question,ground_truth,retrieved_contexts,answer,hypothesis,faithfulness,answer_relevancy,context_precision,context_recall
Apa hal-hal yang dapat menyebabkan penyakit hipertensi?,"Hipertensi sekunder bisa disebabkan oleh sejumlah kondisi, yaitu:\n\nPenyakit ginjal\nPenyakit kelenjar tiroid\nTumor kelenjar adrenal\nKelainan bawaan pada pembuluh darah\nKecanduan alkohol\nPenyalahgunaan NAPZA\nGangguan pernapasan yang terjadi saat tidur (sleep apnea)\nKonsumsi obat-obatan tertentu, seperti obat antiinflamasi nonsteroid (NSAID), obat batuk pilek, atau pil KB","['Topik: Hipertensi, Subtopik: Penyebab Hipertensi \n Hipertensi dibagi menjadi hipertensi primer dan sekunder. Hipertensi primer berkembang selama bertahun-tahun dan tidak diketahui penyebabnya secara pasti. Hipertensi primer merupakan jenis hipertensi yang paling sering terjadi.\nBerbeda dengan hipertensi primer, hipertensi sekunder bisa disebabkan oleh sejumlah kondisi, yaitu:\n- Penyakit ginjal\n- Penyakit kelenjar tiroid\n- Tumor kelenjar adrenal\n- Kelainan bawaan pada pembuluh darah\n- Kecanduan alkohol\n- Penyalahgunaan NAPZA\n- Gangguan pernapasan yang terjadi saat tidur (sleep apnea)\n- Konsumsi obat-obatan tertentu, seperti obat antiinflamasi nonsteroid (NSAID), obat batuk pilek, atau pil KB\n', 'Topik: Hipertensi, Subtopik: Penyebab Hipertensi: Faktor Risiko Hipertensi \n Ada beberapa faktor yang bisa meningkatkan risiko seseorang terserang hipertensi, yaitu:\n- Berusia di atas 65 tahun\n- Sedang hamil\n- Jarang berolahraga dan jarang melakukan aktivitas fisik\n- Kurang mengonsumsi makanan yang mengandung kalium\n- Memiliki keluarga dengan riwayat tekanan darah tinggi\n- Menderita obesitas, sleep apnea, diabetes, atau penyakit ginjal\n- Mengonsumsi terlalu banyak makanan tinggi garam\n- Mengonsumsi terlalu banyak kafein\n- Memiliki kebiasaan merokok dan mengonsumsi minuman beralkohol\n', 'Topik: Hipertensi, Subtopik: Pengertian Hipertensi \n Hipertensi atau darah tinggi adalah kondisi ketika tekanan darah berada pada angka 130/80 mmHg atau lebih. Jika tidak segera ditangani, hipertensi bisa menyebabkan komplikasi serius, seperti gagal jantung, penyakit ginjal, hingga stroke.\nTekanan darah dinyatakan dalam dua nilai angka yang dipisahkan dengan garis miring atau yang biasanya disebut  per  . Angka di awal, yaitu di sebelah kiri garis miring menandakan tekanan sistolik. Ini adalah tekanan di dalam pembuluh darah ketika jantung berkontraksi untuk memompa darah keluar dari jantung.\n\nAngka di akhir yang berada setelah garis miring menandakan tekanan diastolik, yaitu tekanan darah saat jantung berelaksasi dan menyedot atau menerima darah masuk kembali ke dalam jantung.\nPada kondisi normal, tekanan darah orang dewasa adalah 120/80 mmHg. Artinya, tekanan sistoliknya adalah 120 mmHg dan diastoliknya 80 mmHG.\nTekanan darah tinggi yang terjadi terus-menerus dapat membuat jantung bekerja lebih keras untuk memompa darah ke seluruh tubuh. Kondisi ini lama-kelamaan bisa membuat jantung membesar, merusak pembuluh darah, dan membuat ginjal tidak bisa bekerja dengan baik.\nOleh karena itu, hipertensi perlu segera ditangani. Setelah tekanan darah kembali normal pun, perlu terus dilakukan pemantauan dan bahkan penggunaan obat rutin agar tekanan darah selalu terkontrol.\n']","Hipertensi atau darah tinggi bisa disebabkan oleh beberapa faktor risiko, di antaranya:\n\n1. Usia di atas 65 tahun: Kecuali ada penyebab khusus lainnya, risiko hipertensi meningkat dengan bertambahnya usia.\n2. Mengonsumsi obat anti-inflamasi nonsteroid (NSAID) atau batuk pilek yang mengandung kafein: Beberapa obat ini bisa mempengaruhi tekanan darah dan tingginya risiko terjadinya hipertensi.\n3. Berusia di bawah 40 tahun dan memiliki riwayat hipertensi pada keluarganya: Kemungkinan besar mengonsumsi makanan yang mengandung garam tinggi atau kurangnya aktivitas fisik juga dapat meningkatkan risiko terjadinya hipertensi.\n4. Mengonsumsi terlalu banyak makanan berlemak dan kaya gizi: Makanan ini bisa meningkatkan resiko munculnya hipertensi, terutama jika Anda memiliki riwayat tekanan darah tinggi atau obesitas.\n5. Mengonsumsi minuman beralkohol secara rutin: Minuman yang mengandung alkohol dapat meningkatkan risiko munculnya hipertensi, terutama jika Anda meminum lebih banyak daripada rekomendasikan.\n6. Mengonsumsi kafein secara berlebihan: Kafein bisa meningkatkan tekanan darah dan mengancam risiko munculnya hipertensi.\n7. Menderita obesitas, sleep apnea, diabetes atau penyakit ginjal: Keadaan ini membuat Anda lebih rentan untuk terkena hipertensi.\n8. Mengonsumsi makanan yang kaya garam dan kurang mengonsumsi kalium: Garam dan asam amino metil dalam makanan tinggi garam bisa meningkatkan risiko munculnya hipertensi.\n9. Menggunakan ibu-jari atau tonggol di leher untuk mencapai piring makan yang diletakkan di atasnya: Metode ini seringkali memicu terpancing tekanan darah tinggi, sehingga perlu dihindari.\n10. Mengonsumsi obat-obatan tertentu untuk mengurangi ereksi dan menyebarkan nafsu makan: Beberapa obat ini bisa meningkatkan risiko terjadinya hipertensi.","Penyebab utama penyakit hipertensi meliputi beberapa faktor, termasuk:\n\n1. Pola diet tinggi dalam sodium dan rendah dalam kafein.\n2. Obesitas atau obesitas.\n3. Asupan lebih banyak alkohol atau penggunaan obat-obatan stimulan, seperti narkotik.\n4. Kebisingan tinggi dan tekanan yang tinggi di lingkungan.\n5. Kerusakan hati akibat penyakit hepatitis atau metabolisme lemak tidak normal (hiperlipidemia).\n6. Masalah genetik atau nyeri punggung bergulir secara berkala atau angka tekan darah tinggi yang meningkat.",0.6363636363636364,0.5703463967012984,0.9999999999,1.0
Apa saja gejala hipertensi?,Gejala yang dapat muncul pada kondisi tersebut adalah:\n\nMual dan muntah\nSakit kepala\nMimisan\nSesak napas\nNyeri dada\nGangguan penglihatan\nTelinga berdenging\nGangguan irama jantung\nDarah dalam urine,"['Topik: Hipertensi, Subtopik: Gejala Hipertensi \n Hipertensi merupakan penyakit yang berbahaya, karena bisa terjadi tanpa gejala. Bahkan, pada beberapa kasus, gejalanya baru muncul setelah hipertensi makin parah dan sampai mengancam nyawa. Gejala yang dapat muncul pada kondisi tersebut adalah:\n- Mual dan muntah\n- Sakit kepala\n- Mimisan\n- Sesak napas\n- Nyeri dada\n- Gangguan penglihatan\n- Telinga berdenging\n- Gangguan irama jantung\n- Darah dalam urine\n', 'Topik: Hipertensi, Subtopik: Gejala Hipertensi: Kapan Harus ke Dokter \n Pada beberapa kasus, hipertensi dapat menjadi kondisi gawat darurat yang membutuhkan penanganan dengan segera. Hal ini terjadi ketika tekanan darah naik dengan cepat dan terlalu tinggi.\nSegera ke dokter jika tekanan darah Anda telah mencapai angka 180/120 atau lebih. Anda juga perlu segera ke dokter jika mengalami gejala yang dapat menjadi pertanda kerusakan organ, yaitu:\n- Sesak napas\n- Nyeri dada\n- Sulit berbicara\n- Sakit kepala yang parah\n- Mati rasa\n- Lemas\n- Gangguan penglihatan\n', 'Topik: Hipertensi, Subtopik: Pengertian Hipertensi \n Hipertensi atau darah tinggi adalah kondisi ketika tekanan darah berada pada angka 130/80 mmHg atau lebih. Jika tidak segera ditangani, hipertensi bisa menyebabkan komplikasi serius, seperti gagal jantung, penyakit ginjal, hingga stroke.\nTekanan darah dinyatakan dalam dua nilai angka yang dipisahkan dengan garis miring atau yang biasanya disebut  per  . Angka di awal, yaitu di sebelah kiri garis miring menandakan tekanan sistolik. Ini adalah tekanan di dalam pembuluh darah ketika jantung berkontraksi untuk memompa darah keluar dari jantung.\n\nAngka di akhir yang berada setelah garis miring menandakan tekanan diastolik, yaitu tekanan darah saat jantung berelaksasi dan menyedot atau menerima darah masuk kembali ke dalam jantung.\nPada kondisi normal, tekanan darah orang dewasa adalah 120/80 mmHg. Artinya, tekanan sistoliknya adalah 120 mmHg dan diastoliknya 80 mmHG.\nTekanan darah tinggi yang terjadi terus-menerus dapat membuat jantung bekerja lebih keras untuk memompa darah ke seluruh tubuh. Kondisi ini lama-kelamaan bisa membuat jantung membesar, merusak pembuluh darah, dan membuat ginjal tidak bisa bekerja dengan baik.\nOleh karena itu, hipertensi perlu segera ditangani. Setelah tekanan darah kembali normal pun, perlu terus dilakukan pemantauan dan bahkan penggunaan obat rutin agar tekanan darah selalu terkontrol.\n']","Berdasarkan konteks yang diberikan, gejala hipertensi meliputi:\n\n1. Mual dan muntah\n2. Sakit kepala\n3. Mimisan\n4. Sesak napas\n5. Nyeri dada\n6. Gangguan penglihatan (seperti gangguan visus atau penyaringan cahaya di mata)\n7. Telinga berdenging\n8. Gangguan irama jantung\n9. Darah dalam urine","Gejala utama hipertensi termasuk peningkatan tekanan darah tinggi. Beberapa gejala yang umum dari hipertensi antara lain:\n\n1. Ketegangan atau ketakutan (terutama jika tekanan darah tinggi)\n2. Migren\n3. Sesaknya napas\n4. Blurred vision atau penyakit mata sehingga tampak lebih gelap\n5. Ginjal yang bermacil dan gangguan fungsi hati (di abad ke-21)\n6. Kedinginan, kesulitan dalam mengikuti pikiran atau konfusi mental\n7. Pendengaran terdengar di tengah gelisah yang tak terduga\n8. Kerusakan tulang dan penyakit gigi (di masa lalu)",1.0,0.47548722785432856,0.99999999995,1.0
Bagaimana cara mencegah hipertensi?,"Beberapa cara efektif yang dapat dilakukan adalah:\n\nPertahankan berat badan ideal.\nLakukan olahraga secara rutin minimal 30 menit setiap hari.\nCukupi waktu tidur dan istirahat.\nKelola stres dengan baik.\nKonsumsi makanan rendah lemak dan kaya serat, seperti buah dan sayuran.\nBatasi konsumsi garam atau micin dalam makanan, tidak lebih dari satu sendok teh per hari.\nHindari konsumsi minuman beralkohol.\nBatasi konsumsi minuman berkafein.\nHentikan kebiasaan merokok.\nLakukan pemeriksaan kesehatan dan skrining hipertensi secara rutin.","['Topik: Hipertensi, Subtopik: Pencegahan Hipertensi \n Cara mencegah hipertensi adalah dengan menghindari faktor yang dapat meningkatkan risiko terserang penyakit ini. Beberapa cara efektif yang dapat dilakukan adalah:\n- Pertahankan berat badan ideal.\n- Lakukan olahraga secara rutin minimal 30 menit setiap hari.\n- Cukupi waktu tidur dan istirahat.\n- Kelola stres dengan baik.\n- Konsumsi makanan rendah lemak dan kaya serat, seperti buah dan sayuran.\n- Batasi konsumsi garam atau micin dalam makanan, tidak lebih dari satu sendok teh per hari.\n- Hindari konsumsi minuman beralkohol.\n- Batasi konsumsi minuman berkafein.\n- Hentikan kebiasaan merokok.\n- Lakukan pemeriksaan kesehatan dan skrining hipertensi secara rutin.\nDeteksi dini hipertensi dapat dilakukan dengan melakukan pemeriksaan tekanan darah secara mandiri dengan menggunakan tensimeter yang tepat. Selain itu, konsultasikan dengan dokter mengenai pemilihan tensimeter yang tepat untuk di rumah.\n', 'Topik: Hipertensi, Subtopik: Pengertian Hipertensi \n Hipertensi atau darah tinggi adalah kondisi ketika tekanan darah berada pada angka 130/80 mmHg atau lebih. Jika tidak segera ditangani, hipertensi bisa menyebabkan komplikasi serius, seperti gagal jantung, penyakit ginjal, hingga stroke.\nTekanan darah dinyatakan dalam dua nilai angka yang dipisahkan dengan garis miring atau yang biasanya disebut  per  . Angka di awal, yaitu di sebelah kiri garis miring menandakan tekanan sistolik. Ini adalah tekanan di dalam pembuluh darah ketika jantung berkontraksi untuk memompa darah keluar dari jantung.\n\nAngka di akhir yang berada setelah garis miring menandakan tekanan diastolik, yaitu tekanan darah saat jantung berelaksasi dan menyedot atau menerima darah masuk kembali ke dalam jantung.\nPada kondisi normal, tekanan darah orang dewasa adalah 120/80 mmHg. Artinya, tekanan sistoliknya adalah 120 mmHg dan diastoliknya 80 mmHG.\nTekanan darah tinggi yang terjadi terus-menerus dapat membuat jantung bekerja lebih keras untuk memompa darah ke seluruh tubuh. Kondisi ini lama-kelamaan bisa membuat jantung membesar, merusak pembuluh darah, dan membuat ginjal tidak bisa bekerja dengan baik.\nOleh karena itu, hipertensi perlu segera ditangani. Setelah tekanan darah kembali normal pun, perlu terus dilakukan pemantauan dan bahkan penggunaan obat rutin agar tekanan darah selalu terkontrol.\n', 'Topik: Hipertensi, Subtopik: Pengobatan Hipertensi: Perubahan gaya hidup \n Mengubah gaya hidup menjadi lebih sehat bisa menurunkan tekanan darah dalam beberapa minggu. Biasanya, dokter akan menyarankan perubahan gaya hidup tanpa perlu konsumsi obat jika risiko pasien terserang komplikasi rendah.\nGaya hidup sehat yang dijalani adalah:\n- Mengonsumsi lebih banyak buah-buahan dan sayur-sayuran\n- Mengurangi konsumsi garam, yaitu maksimal sebanyak satu sendok teh per hari\n- Memperbanyak aktivitas fisik dan rutin berolahraga\n- Menurunkan berat badan berlebih dan menjaga berat badan ideal\n- Menghentikan kebiasaan merokok\n- Menghindari atau mengurangi konsumsi minuman beralkohol\n- Mengurangi konsumsi minuman berkafein, seperti kopi, teh, atau soda\n- Melakukan terapi relaksasi untuk mengelola stres, seperti yoga atau meditasi\n']","Untuk mencegah hipertensi, ada beberapa cara yang efektif dan komprehensif yang bisa dilakukan. Berikut ini langkah-langkah utama untuk mencegah hipertensi:\n\n1. Tetapkan berat badan ideal: Pastikan berat badan Anda sesuai dengan standar target berdasarkan tinggi dan umur, sehingga tekanan darah tetap stabil.\n2. Olahraga rutin minimal 30 menit per hari: Berolahraga secara teratur bisa menurunkan tekanan darah secara signifikan. Pilih aktivitas fisik yang disukai Anda, seperti jogging, bersepeda, atau badminton.\n3. Hindarkan stres: Gunakan cara-cara mengelola stres yang sesuai, seperti melakukan terapi relaksasi, berolahraga, ataupun menghidari stimulan seperti kopi dan teh tinggi kafein.\n4. Periksa tekanan darah mandiri: Usahakan untuk mengukur tekanan darah secara berkala agar dapat memantau keadaannya, terutama jika ada gejolak atau gangguan tidur yang merugikan.\n5. Periksa kesehatan regu: Konsultasikan dengan dokter untuk mengetahui apakah Anda memiliki riwayat penyakit hipertensi, sehingga bisa segera mengambil langkah pencegahan atau pengobatan.\n6. Hindari konsumsi makanan tinggi lemak dan rendah serat: Mengonsumsikan diet yang sehat akan membantu menjaga tekanan darah tetap stabil.\n7. Batasi konsumsi garam atau micin: Konsumsi garam dalam jumlah terbatas bisa mencegah gangguan hipertensi, khususnya pada usia lanjut dan orang dewasa.\n8. Hindari minuman beralkohol dan berkafein: Pengeluaran alkohol dan teh tinggi kafein bisa meningkatkan risiko terkena hipertensi, sehingga perlu dihindari atau diminimalkan.\n9. Berhenti merokok: Konsumsi rokok secara rutin dapat mempercepat perkembangan penyakit jantung dan sirkulasi, termasuk peningkatan tekanan darah.\n10. Periksa dokter untuk skrining hipertensi: Jika ada rasa takut atau ketidakpastian mengenai gejolak tekanan darah, segera konsultasikan kepada dokter untuk pemeriksaan dan penyuluhan lebih lanjut.\n\nDengan melakukan hal-hal ini secara teratur, Anda bisa mencegah hipertensi sebelum timbulnya gejolak gangguan kesehatan lainnya.","Untuk mencegah hipertensi, berikut beberapa langkah yang dapat diambil:\n\n1. Mengurangi jumlah asupan garam dalam makanan dan minuman mengandung natrium.\n2. Menurunkan berat badan secara sadar untuk menghindari obesitas.\n3. Melakukan aktivitas fisik seperti jogging, biking, atau berburu setiap hari untuk mengurangi tekanan darah tinggi.\n4. Menghentikan merokok secara permanen dan menghindari paparan kumuh pada asap rokok.\n5. Menjaga pola tidur yang baik, tetapi jangan lupa untuk menghindari tekanan ke atas dada saat tidur.\n6. Mengurangi jumlah stres dalam kehidupan sehari-hari dengan cara bermain game, berlatih yoga, ataupun belajar newaza.",0.75,0.6056710282364047,0.8333333332916666,1.0
Apa penyebab umum seseorang terkena penyakit jantung?,"Secara umum, penyakit jantung dapat diakibatkan oleh kondisi berikut:\n\nPenumpukan lemak di dalam pembuluh darah koroner (aterosklerosis)\nTekanan darah tinggi (hipertensi)\nDiabetes tidak terkontrol\nInfeksi","['Topik: Penyakit Jantung, Subtopik: Penyebab Penyakit Jantung: Penyakit Jantung Koroner \n Penyakit jantung koroner merupakan jenis penyakit jantung yang paling sering terjadi. Kondisi ini muncul ketika pembuluh darah jantung menyempit atau tersumbat. Akibatnya, jantung kekurangan darah yang kaya oksigen dan nutrisi.\nPenyakit jantung koroner umumnya disebabkan oleh aterosklerosis, yaitu penyempitan pembuluh darah akibat penumpukan lemak (kolesterol) dan kalsium. Kondisi ini juga bisa menyebabkan pembuluh darah menjadi lebih kaku, sehingga membuat aliran darah jantung tidak lancar.\nAda beberapa kondisi atau faktor yang bisa meningkatkan risiko seseorang untuk terkena penyakit jantung koroner, di antaranya:\n- Hipertensi\n- Tingginya kadar kolesterol dalam darah (hiperkolesterolemia)\n- Kebiasaan merokok\n- Diabetes\n- Obesitas\n- Jarang olahraga\n- Kebiasaan sering mengonsumsi minuman beralkohol berlebihan\n', 'Topik: Penyakit Jantung, Subtopik: Penyebab Penyakit Jantung: Faktor Risiko Penyakit Jantung \n Penyakit jantung lebih berisiko terjadi pada orang dengan faktor-faktor berikut:\n- Rokok\nKandungan nikotin dan karbonmonoksida di dalam asap rokok dapat merusak lapisan dalam jantung dan menyempitkan pembuluh darah. Oleh sebab itu, serangan jantung lebih sering terjadi pada perokok.\n- Riwayat keluarga\nRisiko terserang penyakit jantung cukup tinggi jika memiliki memiliki ayah atau saudara laki-laki yang terkena penyakit jantung sebelum usia 55 tahun. Risiko yang sama juga bisa dialami jika memiliki ibu atau saudara perempuan yang menderita penyakit jantung sebelum usia 65 tahun\n- Pola makan buruk\nKonsumsi makanan tinggi lemak, gula, garam, dan kolesterol, bisa meningkatkan risiko penyakit jantung.\n- Hipertensi\nTekanan darah tinggi yang tidak terkendali dapat membuat pembuluh darah menebal sehingga mempersempit aliran darah.\n- Kadar kolesterol tinggi\nKolesterol tinggi dan trigliserida yang berlebihan dapat membentuk timbunan plak di pembuluh darah. Hal ini kemudian dapat meningkatkan risiko terjadinya aterosklerosis.\n- Diabetes\nDiabetes yang tidak terkontrol dapat menimbulkan komplikasi pada pembuluh darah sehingga mengakibatkan penyakit jantung koroner.\n- Kurang menjaga kebersihan diri\nTidak rutin mencuci tangan atau menyikat gigi dapat membuat bakteri dan virus masuk ke dalam tubuh dan memicu infeksi jantung.\n- Usia\nBertambahnya usia dapat meningkatkan risiko otot jantung melemah dan menebal. Pertambahan usia juga menyebabkan pembuluh darah menjadi lebih kaku sehingga tekanan darah lebih tinggi.\n- Jenis kelamin\nPria lebih berisiko terserang penyakit jantung daripada wanita. Namun, risiko penyakit jantung akan meningkat pada wanita setelah masa menopause.\nSelain sejumlah faktor di atas, kurang berolahraga, stres berat, dan mengalami obesitas juga bisa meningkatkan risiko penyakit jantung.\n', 'Topik: Penyakit Jantung, Subtopik: Pengertian Penyakit Jantung \n Penyakit jantung adalah kondisi ketika bagian jantung yang meliputi pembuluh darah jantung, selaput jantung, katup jantung, dan otot jantung mengalami gangguan. Penyakit jantung bisa disebabkan oleh berbagai hal, seperti sumbatan pada pembuluh darah jantung, peradangan, infeksi, atau kelainan bawaan.\nJantung adalah organ vital yang terdiri dari otot dan terbagi menjadi empat ruang. Ruang jantung dibatasi oleh katup jantung yang berfungsi mengatur aliran darah agar bergerak ke satu arah.\n\nPada dinding jantung, terdapat pembuluh darah jantung atau arteri koroner yang mengalirkan darah kaya oksigen ke seluruh bagian jantung. Pembuluh ini memiliki dua cabang, yaitu pembuluh darah koroner kanan dan kiri.\nJantung juga memiliki dua selaput yang disebut perikardium. Fungsinya adalah untuk melindungi jantung, menjaga posisi jantung tetap pada tempatnya, dan mencegah terjadinya luka akibat gesekan ketika berdenyut.\n']","Penyebab umum seseorang terkena penyakit jantung, berdasarkan konteks yang diberikan, adalah sebagai berikut:\n\n1. Aterosklerosis - Kondisi ini merupakan penumpukan lemak (kolesterol), kalsium, dan sel-sel abnormal dalam pembuluh darah, menyebabkan mereka menjadi tersumbat atau menyempit. Hal ini dapat mengganggu aliran darah ke jantung dan mengurangi oksigen yang dibutuhkan untuk fungsi jantung.\n2. Hipertensi - Tekanan darah tinggi yang tidak terkendali dapat menekan pembuluh darah, termasuk pada pembuluh darah jantung, sehingga aliran darah ke jantung menjadi lebih lancar.\n3. Tingginya kadar kolesterol dalam darah (hiperkolesterolemia) - Kolesterol tinggi dapat menyebabkan timbunan plak di pembuluh darah, termasuk yang melewati jantung, sehingga mengurangi aliran darah dan mengurangi oksigen yang mencapai jantung.\n4. Diabetes - Penyakit ini dapat menyebabkan luka-luka pada pembuluh darah jantung akibat pertumbuhan cepat sel-sel di dalam pembuluh darah, termasuk yang melewati jantung.\n5. Obesitas - Mengkonsumsi makanan berlemak dan mengalami obesitas dapat meningkatkan risiko penyakit jantung karena bertambahnya tekanan darah pada hati dan jantung, serangkaian faktor risiko lainnya.\n6. Riwayat keluarga - Jika orang tersebut memiliki ayah atau saudara laki-laki yang menderita penyakit jantung sebelum usia 55 tahun, risiko mereka untuk terkena penyakit jantung juga meningkat.\n7. Kurang olahraga - Mengurangi aktivitas fisik secara berkelanjutan dapat menggangu metabolisme dan membuat pembuluh darah jantung kurang baik, sehingga risiko terkena penyakit jantung meningkat.\n8. Riwayat merokok - Konsumsi rokok atau asap rokok dapat merusak lapisan di dalam jantung dan menyebabkan pembuluh darah menjadi tersumbat, mengurangi aliran darah ke jantung.\n9. Kadar kolesterol tinggi - Kolesterol tinggi dan trigliserida yang berlebih dapat meningkatkan risiko terkena penyakit jantung, termasuk aterosklerosis.\n10. Jenis kelamin - Pria lebih sering terkena penyakit jantung dibanding wanita, namun risiko ini meningkat untuk wanita setelah masa menopause.","Penyebab umum seseorang terkena penyakit jantung meliputi faktor genetik, faktor lingkungan, serta kombinasi keduanya. Faktor genetik yang mempengaruhi risiko penyakit jantung termasuk usia, jenis kelamin, dan rasa bergairah (lihat asidosis metabolis).\n\nFaktor lingkungan juga penting dalam menentukan risiko terkait penyakit jantung. Faktor ini meliputi faktor pembuluh darah tinggi, obesitas, asidosis metabolik, kecanduan narkotika, serta konsumsi alkohol dan tabak.\n\nKombinasi dari faktor genetik dan lingkungan juga mempengaruhi risiko terkait penyakit jantung. Beberapa contoh kombinasi ini termasuk obesitas, asidosis metabolik, kecandangan narkotika, serta konsumsi alkohol dan tabah.\n\nNamun, penting untuk diingat bahwa penyebab terkait penyakit jantung adalah kompleks dan belum tentu semua disebabkan oleh faktor-faktor yang telah disebutkan. Penelitian lebih lanjut diperlukan untuk menggali lebih dalam pada penyebab umum terkait penyakit jantung ini.",0.7096774193548387,0.5760987036021161,0.9999999999666667,0.8
Bagaimana pola hidup yang benar untuk menyembuhkan penyakit jantung?,Menjalani pola hidup sehat dapat mencegah perburukan penyakit jantung. Beberapa cara yang dapat dilakukan adalah:\n\nBerhenti merokok\nBerolahraga ringan 30 menit sehari\nMengonsumsi makanan rendah lemak dan rendah garam\nMembatasi konsumsi minuman beralkohol,"['Topik: Penyakit Jantung, Subtopik: Pengobatan Penyakit Jantung: Perbaikan Gaya Hidup \n Menjalani pola hidup sehat dapat mencegah perburukan penyakit jantung. Beberapa cara yang dapat dilakukan adalah:\n- Berhenti merokok\n- Berolahraga ringan 30 menit sehari\n- Mengonsumsi makanan rendah lemak dan rendah garam\n- Membatasi konsumsi minuman beralkohol\n', 'Topik: Penyakit Jantung, Subtopik: Pengobatan Penyakit Jantung \n Pengobatan penyakit jantung tergantung pada jenis penyakitnya. Sebagai contoh, dokter akan meresepkan antibiotik guna mengatasi penyakit jantung akibat infeksi. Sementara untuk mengatasi penyakit jantung koroner, dokter akan meresepkan obat-obatan dan menyarankan pasien mengubah gaya hidup menjadi lebih sehat.\nPada umumnya, metode pengobatan penyakit jantung meliputi:\n', 'Topik: Penyakit Jantung, Subtopik: Penyebab Penyakit Jantung: Faktor Risiko Penyakit Jantung \n Penyakit jantung lebih berisiko terjadi pada orang dengan faktor-faktor berikut:\n- Rokok\nKandungan nikotin dan karbonmonoksida di dalam asap rokok dapat merusak lapisan dalam jantung dan menyempitkan pembuluh darah. Oleh sebab itu, serangan jantung lebih sering terjadi pada perokok.\n- Riwayat keluarga\nRisiko terserang penyakit jantung cukup tinggi jika memiliki memiliki ayah atau saudara laki-laki yang terkena penyakit jantung sebelum usia 55 tahun. Risiko yang sama juga bisa dialami jika memiliki ibu atau saudara perempuan yang menderita penyakit jantung sebelum usia 65 tahun\n- Pola makan buruk\nKonsumsi makanan tinggi lemak, gula, garam, dan kolesterol, bisa meningkatkan risiko penyakit jantung.\n- Hipertensi\nTekanan darah tinggi yang tidak terkendali dapat membuat pembuluh darah menebal sehingga mempersempit aliran darah.\n- Kadar kolesterol tinggi\nKolesterol tinggi dan trigliserida yang berlebihan dapat membentuk timbunan plak di pembuluh darah. Hal ini kemudian dapat meningkatkan risiko terjadinya aterosklerosis.\n- Diabetes\nDiabetes yang tidak terkontrol dapat menimbulkan komplikasi pada pembuluh darah sehingga mengakibatkan penyakit jantung koroner.\n- Kurang menjaga kebersihan diri\nTidak rutin mencuci tangan atau menyikat gigi dapat membuat bakteri dan virus masuk ke dalam tubuh dan memicu infeksi jantung.\n- Usia\nBertambahnya usia dapat meningkatkan risiko otot jantung melemah dan menebal. Pertambahan usia juga menyebabkan pembuluh darah menjadi lebih kaku sehingga tekanan darah lebih tinggi.\n- Jenis kelamin\nPria lebih berisiko terserang penyakit jantung daripada wanita. Namun, risiko penyakit jantung akan meningkat pada wanita setelah masa menopause.\nSelain sejumlah faktor di atas, kurang berolahraga, stres berat, dan mengalami obesitas juga bisa meningkatkan risiko penyakit jantung.\n']","Pola hidup yang benar untuk menyembuhkan penyakit jantung melibatkan beberapa aspek, termasuk perubahan perilaku dan gaya hidup. Berikut adalah langkah-langkah penting yang dapat membantu mengurangi resiko penyakit jantung serta meningkatkan kualitas hidup:\n\n1. **Mengurangi atau Menghindari Obesitas**: Mengontrol berat badan melalui diet dan olahraga dapat menurunkan risiko terkena penyakit jantung, terutama jika mengalami obesitas ringan.\n\n2. **Berolahraga Secara Teratur**: Olahraga sehari-hari minimal 150 menit perhari dapat membantu menurunkan tekanan darah dan meningkatkan kadar 'good cholesterol' (HDL), yang berfungsi melindungi jantung.\n\n3. **Mengubah Pola Makan**: Mengonsumsi makanan rendah lemak, rendah gula, dan tinggi serat dapat membantu mengurangi berat badan dan menurunkan risiko penyakit jantung.\n\n4. **Menghindari Asupan Alkohol**: Mengurangi penggunaan minuman beralkohol, khususnya yang tinggi asam urat, dapat mencegah hipertensi dan meningkatkan risiko penyakit jantung.\n\n5. **Mengontrol Tekanan Darah**: Mengendalikan tekanan darah dalam batas normal (di bawah 120/80 mmHg untuk pasien dengan riwayat hipertensi) melalui diet dan obat-obatan, jika perlu.\n\n6. **Mengontrol Kadar LDL dan Trigliserida**: Mengurangi asupan makanan tinggi lemak dan kolesterol serta menjaga agar kadar 'bad cholesterol' (LDL) dan trigliserida tetap rendah dapat mencegah timbunan plak pada pembuluh darah.\n\n7. **Mengontrol Diabetes**: Mengendalikan diabetes melalui diet dan obat-obatan, jika perlu, untuk menghindari komplikasi seperti penyakit jantung koroner.\n\n8. **Menjaga Keparahan Tubuh: Menjauhi Roekok dan Obati Stres**: Mengurangi tekanan stres melalui praktis kegiatan rekreasi, olahraga, atau metode stress management lainnya juga penting untuk menjaga fungsi jantung.\n\n9. **Menginfeksi Secara Sembawang**: Mengurangi risiko infeksi jantung melalui penyikapan tangan dan kebersihan makanan serta minum yang baik.\n\n10. **Mengadopsi Pola Hidup Sehat secara Konsisten**: Semua langkah tersebut harus diadopsi secara konsisten agar efektif dalam menurunkan risiko penyakit jantung.\n\nDengan mengikuti pola hidup sehat dan sering mendapatkan pemantauan dokter, seseorang dapat mencegah atau mengurangi resiko terkena penyakit jantung.","Pola hidup yang dianjurkan untuk mencegah dan mengatasi penyakit jantung melibatkan beberapa aspek, termasuk diet, aktivitas fisik, status stres, nafsu makan, serta pengelolaan tekanan darah dan kolesterol. Berikut adalah langkah-langkah yang dapat membantu:\n\n1. Diet Sihat: Mengonsumsi sayuran segar, buah-buahan, protein nabati (seperti tempe, tahu), serta mengurangi asupan lemak dalam makanan dan mengkonsumsi karbohidrat yang kompleks.\n2. Aktivitas Fisik: Melakukan rutinitas aktivitas fisik sehari-hari minimal 150 menit perhari, termasuk berolahraga secara intermiten atau aerob untuk meningkatkan daya saing jantung dan mengurangi risiko serius penyakit jantung.\n3. Pengelolaan Stres: Mengurangi stres dengan metode yang sesuai, seperti meditasi, yoga, atau belajar cara beradaptasi terhadap tekanan.\n4. Nafsu Makan Kontrol: Menjaga nafsu makan agar tetap stabil untuk mengurangi risiko obesitas dan peningkatan resistin, yang dapat memperburuk penyakit jantung.\n5. Pengelolaan Tekanan Darah dan LDL Cholesterol: Mengontrol tekanan darah dan kadar LDL cholesterol melalui diet dan pemberian obat bila perlu.\n6. Konsultasi Ilmiah: Memiliki riset medis untuk mengetahui status tubuh dan mengidentifikasi penyebab masalah jantung, sehingga dapat diarahkan ke dokter spesialis jantung atau ahli kesehatan lainnya.\n7. Konsistensi: Terus melakukan praktik-praktik yang telah ditawarkan dan tetap semangat untuk mengejar pola hidup sehat demi mencegah penyakit jantung serius.",0.8148148148148148,0.4270214699036809,0.9999999999666667,1.0
Bagaimana gejala penyakit gagal jantung?,"Gejala utama yang timbul akibat gagal jantung antara lain:\n\nSesak napas\nMudah lelah\nPembengkakan di kaki dan pergelangan kaki\n\nSelain beberapa gejala utama di atas, ada beberapa keluhan lain yang dapat muncul, yaitu:\n\nBatuk terus-menerus yang memburuk di malam hari\nBerat badan naik atau turun secara drastis\nRasa cemas dan gelisah\nHilang nafsu makan\nPerut kembung\nMual\nLinglung atau penurunan kesadaran","['Topik: Gagal Jantung, Subtopik: Gejala Gagal Jantung \n Gejala gagal jantung dapat bervariasi pada setiap penderitanya. Gejalanya juga bisa muncul secara tiba-tiba atau berkembang secara perlahan selama beberapa minggu atau beberapa bulan.\nGejala utama yang timbul akibat gagal jantung antara lain:\n- Sesak napas\n- Mudah lelah\n- Pembengkakan di kaki dan pergelangan kaki\nSelain beberapa gejala utama di atas, ada beberapa keluhan lain yang dapat muncul, yaitu:\n- Batuk terus-menerus yang memburuk di malam hari\n- Berat badan naik atau turun secara drastis\n- Rasa cemas dan gelisah\n- Hilang nafsu makan\n- Perut kembung\n- Mual\n- Linglung atau penurunan kesadaran\nPada gagal jantung ringan, gejala mungkin tidak muncul meski penderita sedang beraktivitas. Akan tetapi, pada gagal jantung yang parah, gejala bisa muncul saat penderita beraktivitas atau ketika sedang beristirahat.\n', 'Topik: Gagal Jantung, Subtopik: Penyebab Gagal Jantung \n Gagal jantung disebabkan oleh kondisi atau penyakit yang menyebabkan jantung menjadi lemah, kaku, dan bekerja secara berlebihan dalam jangka panjang. Gagal jantung juga dapat disebabkan oleh kerusakan atau kelainan pada jantung, seperti pada otot atau katup jantung.\nBerikut ini adalah sejumlah kondisi atau penyakit yang menyebabkan gagal jantung:\n', 'Topik: Gagal Jantung, Subtopik: Pengobatan Gagal Jantung \n Gagal jantung merupakan kondisi yang terjadi dalam jangka panjang. Oleh sebab itu, pengobatan yang dilakukan bertujuan untuk:\n- Meringankan gejala gagal jantung\n- Meningkatkan kekuatan jantung\n- Mencegah terjadinya komplikasi\nMetode pengobatan gagal jantung akan disesuaikan dengan usia pasien, penyebab dan tingkat keparahannya, serta penyakit lain yang menyertai. Metode pengobatan gagal jantung dapat berupa:\n']","Gejala-gejala penyakit gagal jantung, seperti yang dijelaskan dalam konteks tersebut, bervariasi dan bisa muncul secara tiba-tiba atau berkembang perlahan. Berikut adalah gejala utama dari penyakit gagal jantung:\n\n1. Sesak napas: Penderita sering merasa sulit untuk menyerap udara, terutama saat beraktivitas atau sedang istirahat.\n2. Mudah lelah: Gejala ini bisa muncul secara ringan atau parah dan biasanya disertai dengan mudah keseringan napas.\n3. Pembengkakan di kaki dan pergelangan kaki: Jantung yang gagal membuang air mata dalam hal ini menyebabkan pengaruh vaskular, sehingga terjadi penggigitan atau sensasi busuk pada bagian bawah tubuh.\n4. Batuk terus-menerus di malam hari: Batuk yang tidak hilang meskipun telah batuk banyak saat pagi hari juga merupakan gejala gagal jantung.\n5. Berat badan naik atau turun secara drastis: Gagal jantung bisa menyebabkan berat badan meningkat karena pengaruh vaskular, yang bisa mencapai ribuan gram dalam beberapa minggu.\n6. Rasa cemas dan gelisah: Penderita gagal jantung mungkin merasakan ketakutan atau kecemburuan akibat gejala-gejala tubuhnya yang buruk.\n7. Hilang nafsu makan: Ketidaktelitian pada makanan juga bisa disebabkan oleh gagal jantung, terutama saat kondisi parah.\n8. Perut kembung: Gejala ini biasanya diakibatkan oleh gas atau air di abdomen yang tidak pernah hilang akibat pengaruh vaskular pada gagal jantung.\n9. Mual: Penderita gagal jantung mungkin merasakan rasa mual karena sistem pencernaan juga terpengaruh oleh penyakit ini.\n10. Linglung atau penurunan kesadaran: Akibat kelelahan dan gejala lainnya, penderita gagal jantung bisa merasa seperti akan terserang napas yang sulit untuk menghilangkan.\n\nGejala-gejala ini tentunya harus dianalisis oleh dokter atau spesialis medis untuk memastikan diagnosis dan kelak mengobati gagal jantung secara tepat.","Penyakit gagal jantung (cardiomyopathy) dapat beragam dan disebabkan oleh berbagai faktor, termasuk genetik, medis, alkoholisme, atau infeksi. Gejala umum yang mungkin timbul pada pasien dengan penyakit gagal jantung antara lain:\n\n1. Nyeri dada atau peraba rambut.\n2. Sakit nafas dan gejolak serta terkesan tidak nyaman saat beraktivitas fisik.\n3. Sesaknya hati, yang dapat menyebabkan mual atau ketegangan pada dada.\n4. Penyumbatan lengan atau kepala oleh tekanan darah tinggi, yang dapat meningkatkan risiko serbuk jantung.\n5. Efusi (pembuluh darah yang keluar dari bagian dalam hati), yang menyebabkan wujud cairan di abu-abu yang tampak pada leher dan tangan pasien.\n6. Penyumbatan limbah oleh ginjal atau insufisiensi jantung, yang juga dapat meningkatkan risiko serbuk jantung.\n7. Efusi periferik, yaitu pelepasan cairan di luar tubuh sehingga pasien mengalami penurunan denyut nadi dan tekanan darah rendah.\n\nNamun, gejala ini bervariasi dari satu individu ke individu lain dan tidak semua orang yang menderita gagal jantung akan mengalami kesemuanya secara serempak. Selain itu, beberapa pasien mungkin memiliki gejala yang agak unik atau bahkan tak terduga dibanding gejala umum lainnya.\n\nJika ada aspek kesehatan Anda atau perilaku sosial/psikologis yang berubah secara mendadak dan tidak diharapkan, segera hubungi dokter untuk memeriksa gejala itu dan menentukan penyebabnya.",0.37037037037037035,0.4993690446159506,0.9999999999,1.0
Apa saja obat yang direkomendasikan untuk penderita penyakit gagal jantung?,"Beberapa jenis obat yang dapat diresepkan adalah:\n\nDiuretik, seperti spironolactone, furosemide, indapamide, dan acetazolamide untuk mencegah pengumpulan cairan di dalam tubuh\nPenghambat beta, seperti carvedilol dan bisoprolol, untuk memperlambat jantung dan menurunkan tekanan darah\nACE inhibitor, seperti lisinopril, ramipril, dan perindopril, untuk mengurangi ketegangan pada pembuluh darah, menurunkan tekanan darah, dan melancarkan aliran darah\nAngiotensin II receptor blockers (ARB), seperti candesartan, valsartan, dan telmisartan, untuk mengurangi ketegangan pada pembuluh darah pada pasien yang tidak cocok dengan ACE inhibitor\nDigoxin, untuk meningkatkan kekuatan otot jantung\nIvabradine, untuk memperlambat laju denyut jantung\nTolvaptan, untuk mengembalikan kadar natrium darah yang dapat menurun pada pasien gagal jantung\nEmpagliflozin, untuk menurunkan tekanan darah dan beban kerja jantung pada pasien yang juga memiliki diabetes tipe 2.","['Topik: Gagal Jantung, Subtopik: Diagnosis Gagal Jantung \n Untuk mendiagnosis gagal jantung, dokter akan menanyakan gejala yang dialami pasien, riwayat kesehatan pasien dan keluarga, serta obat-obatan yang dikonsumsi.\nSelanjutnya, dokter akan melakukan pemeriksaan fisik untuk melihat tanda-tanda gagal jantung, seperti pembengkakan di kaki atau pergelangan kaki. Dokter juga akan memeriksa detak jantung menggunakan stetoskop.\nDokter dapat melakukan beberapa pemeriksaan penunjang untuk memastikan diagnosis. Beberapa pemeriksaan tersebut adalah:\n- Tes darah, untuk mendeteksi hormon brain natriuretic peptide (BNP) yang kadarnya akan meningkat bila terjadi gagal jantung, dan mendeteksi penyakit yang dapat menjadi penyebab gagal jantung\n- Foto Rontgen dada, untuk mendeteksi pembesaran jantung atau penumpukan cairan dalam paru-paru yang umum terjadi pada penderita gagal jantung\n- Elektrokardiografi, untuk merekam perubahan aktivitas listrik jantung atau mendeteksi gangguan irama jantung yang bisa menjadi penyebab gagal jantung\n- Ekokardiografi, untuk melihat struktur organ jantung secara lebih jelas dengan bantuan gelombang suara berfrekuensi tinggi\n- CT scan atau MRI jantung, untuk memperoleh gambaran yang lebih detail mengenai kondisi organ jantung\n- Katerisasi jantung, untuk mendeteksi penyumbatan pada pembuluh darah jantung\n', 'Topik: Gagal Jantung, Subtopik: Pencegahan Gagal Jantung \n Untuk mencegah terjadinya gagal jantung, cara terbaik yang dapat dilakukan adalah menjalani pola hidup sehat, seperti:\n- Menjaga berat badan agar tetap ideal, atau mengurangi berat badan jika memiliki berat badan berlebih\n- Mengonsumsi makanan yang tinggi serat atau tinggi protein, seperti sayur, buah, ikan, dan biji-bijian atau serealia\n\n- Mengurangi asupan gula dan garam\n- Mengurangi konsumsi minuman beralkohol\n- Berolahraga secara rutin, setidaknya 30 menit setiap hari\n- Mencukupi waktu tidur dan istirahat\n- Mengelola stres dengan baik\n- Tidak merokok\nSelain dengan menjalani pola hidup sehat, gagal jantung juga dapat dicegah dengan menjalani pemeriksaan kesehatan secara rutin, seperti pemeriksaan tekanan darah, gula darah, dan kolesterol.\nBagi penderita kondisi atau penyakit yang dapat menyebabkan gagal jantung, seperti penyakit jantung atau diabetes, jalani pengobatan yang telah diberikan oleh dokter dan lakukan kontrol secara rutin.\n', 'Topik: Gagal Jantung, Subtopik: Penyebab Gagal Jantung: Faktor Risiko Gagal Jantung \n Meski dapat terjadi pada siapa saja, ada beberapa faktor yang dapat meningkatkan risiko terjadinya gagal jantung pada seseorang, yaitu:\n- Berusia di atas 65 tahun\n- Memiliki keluarga dengan riwayat gagal jantung\n- Memiliki berat badan berlebih atau obesitas\n\n- Merokok\n- Sering mengonsumsi makanan tinggi lemak dan kolesterol\n\n- Jarang berolahraga\n- Mengonsumsi minuman beralkohol secara berlebihan\n- Mengonsumsi obat-obatan tertentu, seperti obat pereda nyeri dan obat antihipertensi\n']","Untuk menggugah kesehatan dan mencegah gejala-gejala gagal jantung, dokter umumnya merekomendasikan beberapa jenis obat. Berikut ini beberapa obat yang sering digunakan untuk pengobatan penyakit jantung:\n\n1. Diuretik atau obat untuk menurunkan tekanan darah dan mengeluarkan cairan di luar sistem peredaran darah (edema):\n   - *Furosemide*: merupakan obat yang umum digunakan sebagai pengeluaran air dalam tubuh.\n   - *Spironolakton*: biasanya digunakan untuk menurunkan tekanan darah dan mengeluarkan cairan di luar sistem peredaran darah, serta membantu mengatasi edema.\n\n2. Agonist/antagonist kolinergik:\n   - *Soduim nitroprussid*: obat ini bekerja dengan cara menyebarkan nitrogen monoksida ke tubuh, yang akan mengecil jantung dan mengurangi tekanan darah.\n\n3. Beta-bloker:\n   - *Metoprolol* dan *Bisoprolol*: obat ini membantu mengontrol ritme jantung dengan cara mereduksi jumlah darah yang dipompa oleh jantung, sehingga tekanan darah menjadi lebih stabil.\n\n4. Angiotensin II receptor antagonis (ARBs):\n   - *Losartan* dan *Valsartan*: obat ini membantu mengurangi beban pada jantung dengan mencegah aktivitas enzim angiotensin II, yang biasanya akan mengebarki otot jantung dan memperkuat tekanan darah.\n\n5. Angkaosterol siklisasi:\n   - *Anakinra*: ini bukan obat untuk manusia tetapi sebagai contoh penggunaan biologic dalam penatalesan gagal jantung, anakinra digunakan untuk mengurangi risiko terjadinya gagal jantung.\n\n6. Angkaosterol siklisasi:\n   - *Anakinra*: ini bukan obat untuk manusia tetapi sebagai contoh penggunaan biologic dalam penatalesan gagal jantung, anakinra digunakan untuk mengurangi risiko terjadinya gagal jantung.\n\n7. *Angiotensin konverting enzyme (ACE) inhibitor*:\n   - *Lisinopril* dan *Ramipril*: obat ini membantu mengurangi tekanan darah, menghambat penyumbatan pembuluh darah jantung, dan mencegah gagal jantung.\n\n8. Agonist kolinergik:\n   - *Irbesartan*: obat ini digunakan untuk mengontrol ritme jantung dan menurunkan tekanan darah serta mengeluarkan cairan di luar sistem peredaran darah pada pasien yang memiliki riwayat penyakit jantung.\n\n9. *Spironolakton*: obat ini digunakan untuk menurunkan tekanan darah dan mengeluarkan cairan di luar sistem peredaran darah pada pasien yang memiliki riwayat penyakit jantung.\n\n10. *Bisoprolol*: obat ini digunakan untuk menurunkan tekanan darah dan mengontrol ritme jantung serta mengeluarkan cairan di luar sistem peredaran darah pada pasien yang memiliki riwayat penyakit jantung.\n\nSemua obat tersebut harus diakui, digunakan atau tidaknya ditentukan oleh dokter khususnya di bidang gigi kardiologis dan ahli kesehatan lain yang mengetahui dosis dan cara pemberian obat dengan benar.\n\nJangan gunakan obat tanpa nasihat dokter terlebih dahulu, karena beberapa obat ini bersifat beracun dalam jumlah kecil dan mengakibatkan gejala-gejala parah.","Obat-obatan yang umum direkomendasikan bagi pasien dengan penyakit jantung atau gangguan pada sistem peredaran darah, seperti gagal jantung, meliputi zat aktif untuk mengekang otot hati (beta blokader), memperkuat denyut jantung, dan mengurangi tekanan. Berikut beberapa jenis obat yang sering diberikan:\n\n1. Beta Blokade: Obat ini mereduksi denyut jantung, menghilangkan rasa ngeri pada bahagian belakang tenggorok, dan mengurangi tekanan darah tinggi. Contoh umum termasuk propranolol, bisoprolol, metoprolol, dan atenolol.\n2. Diuretik: Obat ini membantu mengeluarkan air berlebihan dalam tubuh untuk menurunkan tekanan darah dan mengurangi edema (pemunisan). Contohnya furosemid, torasemid, dan spironolakton.\n3. Antiaggregan: Obat ini memblokir serabut zat penyebab agregasi sel yang berhubungan dengan penggumpalan darah, menghindari terbentuknya trombos ke dalam arteri lain. Salbutamol dan clopidogrel adalah contoh antiaggregan.\n4. Angiotensin II receptor blokir (ARBS): Obat ini mengurangi sistem peredaran darah alami yang berlebihan, mengecilkan otot hati, dan menaikkan tekanan darah. Contohnya losartan, valsartan, irbesartan, dan candesartan.\n5. Kardiotonik: Obat ini memperkuat denyut jantung yang normal atau meningkatkan jumlah serabut nadi untuk mengatasi gangguan ritme jantung. Contohnya digoxin.\n6. Antihipertrofi oblat: Obat ini me遏制 otot hati, mengurangi tekanan darah dan menghilangkan edema dengan cara yang sama seperti ARBS tetapi tanpa memakai enzim konversi angiotensin I ke II. Contohnya carvedilol, metoprolol suksesor, and nebivolol.\n7. Antikoagulan: Obat ini digunakan untuk mencegah terbentuknya trombus dalam arteri atau pembekuan darah, seperti dalam penyakit jantung gangguan jalan atau stroke. Contohnya heparin, warfarin, dan dabigatran.\n\nPenting untuk diingat bahwa obat-obatan ini seringkali diberikan bersamaan dan harus direncanakan oleh dokter khusus atau ahli medis yang memiliki pengetahuan lanjutan mengenai gejala, tindak balas pasien, dan kombinasi efek obat.",0.3,0.8777122148537954,0.0,0.0
Apa saja hal yang membuat seseorang memiliki risiko tinggi mengidap penyakit gagal jantung?,"Ada beberapa faktor yang dapat meningkatkan risiko terjadinya gagal jantung pada seseorang, yaitu:\n\nBerusia di atas 65 tahun\nMemiliki keluarga dengan riwayat gagal jantung\nMemiliki berat badan berlebih atau obesitas\nMerokok\nSering mengonsumsi makanan tinggi lemak dan kolesterol\nJarang berolahraga\nMengonsumsi minuman beralkohol secara berlebihan\nMengonsumsi obat-obatan tertentu, seperti obat pereda nyeri dan obat antihipertensi","['Topik: Gagal Jantung, Subtopik: Penyebab Gagal Jantung: Faktor Risiko Gagal Jantung \n Meski dapat terjadi pada siapa saja, ada beberapa faktor yang dapat meningkatkan risiko terjadinya gagal jantung pada seseorang, yaitu:\n- Berusia di atas 65 tahun\n- Memiliki keluarga dengan riwayat gagal jantung\n- Memiliki berat badan berlebih atau obesitas\n\n- Merokok\n- Sering mengonsumsi makanan tinggi lemak dan kolesterol\n\n- Jarang berolahraga\n- Mengonsumsi minuman beralkohol secara berlebihan\n- Mengonsumsi obat-obatan tertentu, seperti obat pereda nyeri dan obat antihipertensi\n', 'Topik: Gagal Jantung, Subtopik: Penyebab Gagal Jantung: 3. Diabetes \n Penderita diabetes berisiko lebih tinggi untuk terkena penyakit jantung koroner, yaitu penyebab utama gagal jantung. Diabetes juga dapat menyebabkan kerusakan pada pembuluh darah dan saraf di jantung.\n', 'Topik: Gagal Jantung, Subtopik: Penyebab Gagal Jantung: 9. Kadar hormon tiroid yang tinggi (hipertiroidisme) \n Tingginya kadar hormon tiroid dalam darah dapat meningkatkan denyut jantung dan membuat jantung bekerja lebih keras. Akibatnya, jantung bisa menjadi lelah dan tidak berfungsi dengan baik.\n']","Hal-hal yang membuat seseorang memiliki risiko tinggi mengidap penyakat gagal jantung meliputi:\n\n1. Usia di atas 65 tahun, karena umur meningkatkan risiko terkena penyakit jantung.\n2. Memiliki keluarga dengan riwayat gagal jantung, yang mengindikasikan bahwa risiko seseorang mengidap penyakit ini juga tinggi.\n3. Berat badan berlebih atau obesitas, sebab faktor ini bisa meningkatkan resiko terkena penyakit jantung.\n4. Merokok dan sering mengonsumsi minuman beralkohol, karena aktivitas ini dapat memperparah fungsi jantung seseorang.\n5. Mengonsumsi makanan tinggi lemak dan kolesterol, yang bisa meningkatkan risiko penyakit jantung.\n6. Jarang berolahraga, sebab aktivitas fisik dapat mempengaruhi fungsi jantung seseorang.\n7. Mengonsumsi obat-obatan tertentu, termasuk obat pereda nyeri dan obat antihipertensi, yang bisa berdampak pada fungsi jantung.","Hal-hal yang membuat seseorang memiliki risiko tinggi mengidap penyakit gagal jantung termasuk:\n\n1. Penyakit arteri pembuluh kecil (PAK): PAK merupakan salah satu faktor risiko utama yang dapat meningkatkan resiko terkena gagal jantung karena menyebabkan penyumbatan pembuluh darah di hati.\n2. Penyakit hipertensi: Hipertensi seringkali memicu tekanan dalam pembuluh darah yang tinggi, sehingga mengganggu aliran darah ke jantung dan dapat meningkatkan risiko terjadinya gagal jantung.\n3. Obesitas: Keadaan obesitas (kegemukan) seringkali memicu faktor-faktor riwayat medis atau lingkungan, seperti hipertensi dan PAK, yang dapat meningkatkan resiko mengidap gagal jantung.\n4. Asupan lemak dalam jumlah tinggi: Mengkonsumsi makanan berlemak secara berlebihan seringkali menyebabkan penumpukan lemak pada paru-paru, yang dapat menghambat aliran darah dan oksigen ke jantung.\n5. Kecurigaan: Rh negative sebagai faktor sosial dan genetik juga mempunyai hubungan erat dengan risiko mengidap gagal jantung, terutama dalam keluarga yang beralih antara Rh positif dan Rh negatif.\n6. Kebiasaan merokok: Merokok secara fisik maupun perasaan rokok (pencium rokok) dapat meningkatkan resiko mengidap gagal jantung karena menyebabkan penurunan kapasitas jantung dan kerusakan pada sel-sel otot jantung.\n7. Konsumsi alkohol: Mengkonsumsi alkohol dalam jumlah banyak secara rutin dapat meningkatkan risiko mengidap gagal jantung, terutama karena efek toksik yang ditimbulkan oleh metabolit alkohol.\n8. Keadaan depresi: Faktor sosial dan emosi seperti kecemasan, stres, atau depresi juga dapat mempengaruhi fungsi jantung dan meningkatkan resiko mengidap gagal jantung.",1.0,0.49426458884432506,0.99999999995,1.0
Apa saja faktor risiko seseorang terkena serangan jantung?,"Penyakit jantung koroner merupakan penyebab utama terjadinya serangan jantung. Oleh sebab itu, orang dengan faktor risiko penyakit jantung koroner juga berisiko terkena serangan jantung, antara lain;\n\nBerusia lanjut (≥45 tahun pada pria atau ≥55 tahun pada wanita)\nMenderita tekanan darah tinggi atau hipertensi\nMenderita kolesterol tinggi atau trigliserida tinggi\nMengalami diabetes\nMengalami obesitas\nMengalami stres\nMemiliki keluarga yang pernah mengalami serangan jantung\nJarang berolahraga\nMerokok","['Topik: Serangan Jantung, Subtopik: Penyebab Serangan Jantung: Faktor Risiko Serangan Jantung \n Seperti yang telah disebutkan sebelumnya, penyakit jantung koroner merupakan penyebab utama terjadinya serangan jantung. Oleh sebab itu, orang dengan faktor risiko penyakit jantung koroner juga berisiko terkena serangan jantung, antara lain;\n- Berusia lanjut (  45 tahun pada pria atau  55 tahun pada wanita)\n- Menderita tekanan darah tinggi atau hipertensi\n- Menderita kolesterol tinggi atau trigliserida tinggi\n\n- Mengalami diabetes\n- Mengalami obesitas\n- Mengalami stres\n\n- Memiliki keluarga yang pernah mengalami serangan jantung\n- Jarang berolahraga\n- Merokok\nRisiko terjadinya serangan jantung juga lebih tinggi pada penderita penyakit autoimun, seperti lupus, dan wanita yang mengalami preeklamsia saat hamil.\n', 'Topik: Serangan Jantung, Subtopik: Pencegahan Serangan Jantung: Berhenti merokok \n Merokok merupakan faktor risiko utama serangan jantung. Hal ini karena rokok bisa menyebabkan aterosklerosis di pembuluh darah, serta dapat meningkatkan tekanan darah.\n', 'Topik: Serangan Jantung, Subtopik: Penyebab Serangan Jantung \n Sama seperti organ lain di dalam tubuh, jantung membutuhkan pasokan darah yang mengandung oksigen secara terus menerus. Jika tidak mendapatkan pasokan darah yang cukup, otot-otot jantung akan rusak dan jantung tidak bisa mengalirkan darah ke seluruh tubuh.\nSerangan jantung terjadi ketika pasokan darah ke otot jantung terganggu. Beberapa faktor yang dapat menyebabkan terjadinya serangan jantung, yaitu:\n']","Faktor risiko terjadinya serangan jantung meliputi:\n\n1. Usia lanjut (45 tahun untuk pria atau 55 tahun untuk wanita)\n2. Penyakit jantung koroner, yang merupakan penyebab utama serangan jantung\n3. Tekanan darah tinggi atau hipertensi\n4. Kolesterol tinggi atau trigliserida tinggi\n5. Diabetes\n6. Obesitas\n7. Stres\n8. Keluarga yang pernghal mengalami serangan jantung\n9. Jarang berolahraga\n10. Merokok","Faktor risiko seseorang mengidap penyakit jantung termasuk serangan jantung bisa beragam dan mencakup faktor biologis, psikososial, dan ekonomi. Berikut adalah beberapa faktor risiko utama yang terkait dengan serangan jantung:\n\n1. Asupan makanan tinggi lemak atau asam lemak trans: Diet rendah karbohidrat: Fokus pada pakan hewani dan minuman beralkohol.\n2. Obesitas: Pengidap obesitas dengan bobot badan yang tinggi memiliki risiko sering mengalami serangan jantung lebih tinggi daripada mereka yang gemuk atau normal.\n3. Asupan asam urat tinggi: Orang yang memiliki asidosis hiperkloremia akibat asupan makanan dan minuman berasa asam pada umumnya mengalami risiko serangan jantung lebih tinggi.\n4. Tingkat kolesterol dalam darah: Pengidap dengan kolesterol total atau LDL tinggi, dan yang rendah pada HDL, cenderung memiliki risiko serangan jantung lebih tinggi.\n5. Hipertensi: Gangguan arteri torakal (penyumbatan pembuluh darah di tengah-tengah dada) dapat meningkatkan risiko serangan jantung.\n6. Kanker: Penderita penyakit kanker paru atau yang mengalami radiasi paru akibat laringioskopi juga memiliki risiko lebih tinggi terkena serangan jantung.\n7. Faktor genetik dan sosial: Keluarga dengan riwayat penyakit jantung atau kesakitan jinak lainnya cenderung menunjukkan risiko serangan jantung yang lebih tinggi.\n8. Stres emosi: Penyebab stres, depresi, dan angan-angan psikososial dapat mempengaruhi faktor risiko serangan jantung.\n9. Asupan alkohol dan merokok: Konsumsi alkohol berlebihan dan merokok secara luas telah terbukti sebagai faktor risiko tinggi bagi penyakit jantung, termasuk serangan jantung.\n10. Penyerbukan obat: Beberapa obat dapat meningkatkan risiko serangan jantung, seperti beberapa antidepresan dan ergot alkaloid pada penyakit ganas jinak (hipokloridosis).",1.0,0.5705547977797382,0.8333333332916666,1.0
Apa saja hal yang menunjukkan gejala penyakit jantung?,"Serangan jantung bisa muncul secara mendadak dengan beberapa gejala berikut:\n\nNyeri dada sebelah kiri seperti tertekan atau tertindih, yang dapat menjalar ke daerah leher, rahang, lengan, atau punggung\nGangguan pencernaan, seperti mual, muntah, atau sakit perut\nBatuk atau mengi\nSesak napas\nPusing\nKeringat dingin\nGelisah dan cemas\nPenurunan kesadaran","['Topik: Serangan Jantung, Subtopik: Pencegahan Serangan Jantung: Menjalani pemeriksaan kesehatan secara rutin \n Rutin menjalani pemeriksaan kesehatan setidaknya 1 tahun sekali dapat membantu mendeteksi penyakit jantung lebih dini. Meski cara deteksi penyakit jantung lewat jari bisa dilakukan secara mandiri, namun untuk memastikan kondisi kesehatan sebenarnya, Anda sebaiknya melakukan pemeriksaan kesehatan rutin ke fasilitas kesehatan. Selain penyakit jantung, pemeriksaan ini juga dapat mendeteksi gangguan pada tekanan darah, kadar gula darah dan kolesterol, serta berbagai penyakit lainnya.\n', 'Topik: Serangan Jantung, Subtopik: Komplikasi Serangan Jantung: Gagal jantung \n Serangan jantung dapat memicu gagal jantung. Kondisi ini membuat jantung tidak dapat secara efektif memompa darah ke seluruh tubuh. Gejalanya berupa sesak napas, cepat merasa lelah, dan bengkak pada tungkai.\n', 'Topik: Serangan Jantung, Subtopik: Penyebab Serangan Jantung: Faktor Risiko Serangan Jantung \n Seperti yang telah disebutkan sebelumnya, penyakit jantung koroner merupakan penyebab utama terjadinya serangan jantung. Oleh sebab itu, orang dengan faktor risiko penyakit jantung koroner juga berisiko terkena serangan jantung, antara lain;\n- Berusia lanjut (  45 tahun pada pria atau  55 tahun pada wanita)\n- Menderita tekanan darah tinggi atau hipertensi\n- Menderita kolesterol tinggi atau trigliserida tinggi\n\n- Mengalami diabetes\n- Mengalami obesitas\n- Mengalami stres\n\n- Memiliki keluarga yang pernah mengalami serangan jantung\n- Jarang berolahraga\n- Merokok\nRisiko terjadinya serangan jantung juga lebih tinggi pada penderita penyakit autoimun, seperti lupus, dan wanita yang mengalami preeklamsia saat hamil.\n']","Gejala penyakitan jantung yang umum termasuk dalam konteks subtopik ""Komplikasi Serangan Jantung"" dan ""Penyebab Serangan Jantung"" di atas adalah sebagai berikut:\n\n1. Sesak napas (dispair): Gejala ini disebabkan oleh berkurangnya aliran oksigen ke jaringan tubuh karena jantung tidak dapat memompa darahnya efektif.\n2. Cepat merasa lelah: Penderita sering merasa gemetar dan sulit untuk melakukan aktivitas sehari-hari, termasuk pekerjaan yang ringan atau tidur.\n3. Bengkak (edema): Jantung mungkin menumpah cairan lebih banyak ke paru-paru dan mengotor aliran oksigen, menyebabkan bengkak pada tungkai, perut, dan di sekitar mata.\n4. Sesaknya gendang (pleural effusion): Penderita sering merasa sangat nyedapi saat bernapas karena adanya cairan yang menumpuk antara jaringan paru-paru dan dinding dada.\n5. Nyeri di bagian belakang atau ke kanan: Gejala ini disebabkan oleh tekanan pada saraf pada saat jantung mengedarkan darah lebih lambat.\n6. Pusing atau kehilangan kesadaran: Kondisi ini dapat menyertai gejala lain seperti sesak napas dan bengkak, yang menggangu fungsi otak.\n7. Hipertensi (tekanan darah tinggi): Gejalanya juga termasuk dalam faktor risiko penyebab serangan jantung.\n8. Kadar gula darah yang tidak terkendali: Diabetes merupakan faktor risiko utama lainnya untuk serangan jantung.\n9. Mengalami penurunan akses titik (tingkat kebahagiaan rendah): Kondisi ini juga disertai oleh penderita serangan jantung dan menunjukkan bahwa mereka memiliki risiko tinggi untuk terkena penyakit jantung lebih lanjut.\n10. Berat badan yang berlebihan: Obesitas juga termasuk dalam faktor risiko utama serangan jantung.\n\nGejala-gejala ini dapat mempercepat proses penyebab serangan jantung dan meningkatkan resiko kematian, sehingga penting untuk segera mengobati dan mencegahnya.","Hal-hal yang biasanya ditunjukkan oleh gejala penyakit jantung termasuk:\n\n1. Sakit pada hati, seperti berkeringat atau rasa sakit di dalam dada.\n2. Istri-atri terhenti atau tidur sering.\n3. Gejolak pernapasan yang lebih parah dibanding biasanya.\n4. Sesak napas, bahkan saat beraktivitas ringan.\n5. Perobahan suhu badan dan kelelahan yang sulit dijelaskan.\n6. Pusing atau ketegangan secara fisik.",0.2916666666666667,0.44226517896992085,0.49999999995,0.6666666666666666
Bagaimana pertolongan pertama untuk penderita penyakit jantung?,"Lakukan pertolongan pertama berupa cardiopulmonary resuscitation (CPR) atau resusitasi jantung paru (RJP). Namun, jika memungkinkan, bawalah penderita langsung ke instalasi gawat darurat (IGD) rumah sakit terdekat.","['Topik: Serangan Jantung, Subtopik: Gejala Serangan Jantung: Kapan Harus ke Dokter \n Serangan jantung adalah kondisi gawat darurat yang perlu ditangani secepatnya. Segera hubungi layanan ambulans di nomor 119 apabila Anda menemukan seseorang di sekitar Anda yang tidak sadarkan diri dan mengalami henti jantung (tidak ada detak jantung dan denyut nadi).\nSambil menunggu bantuan medis datang, lakukan pertolongan pertama berupa cardiopulmonary resuscitation (CPR) atau resusitasi jantung paru (RJP). Namun, jika memungkinkan, bawalah penderita langsung ke instalasi gawat darurat (IGD) rumah sakit terdekat.\nPada beberapa orang, gejala angina dapat terjadi sebelum gejala serangan jantung muncul. Konsultasikan dengan dokter bila muncul gejala angina, sebelum serangan jantung terjadi.\n', 'Topik: Serangan Jantung, Subtopik: Pengobatan Serangan Jantung: Obat-obatan \n Berikut ini adalah obat-obatan yang dapat diberikan untuk mengatasi serangan jantung:\n- Obat pengencer darah jenis antiplatelet, seperti aspirin, ticagrelor, dan clopidogrel, untuk mencegah terjadinya penggumpalan darah sehingga darah tetap dapat mengalir melalui pembuluh darah yang mengalami penyempitan\n- Obat pelebar pembuluh darah golongan nitrat, seperti nitrogliserin, untuk meningkatkan aliran darah ke jantung\n- Obat pereda nyeri, seperti morfin, untuk meredakan nyeri yang dirasakan pasien\n- Obat penghancur gumpalan darah (fibrinolitik), seperti streptokinase atau tenecteplase, untuk membantu melarutkan gumpalan darah yang menghalangi aliran darah menuju otot jantung\n- Obat antikoagulan, seperti enoxaparin atau heparin, untuk mencegah penggumpalan darah terjadi lagi\n- Obat kolesterol, misalnya atorvastatin, untuk menurunkan kadar kolestrol dan plak pada pembuluh jantung\n- Obat hipertensi jenis ACE inhibitor, misalnya ramipril, untuk melebarkan pembuluh darah dan menurunkan tekanan darah sehingga mengurangi beban jantung\n- Obat hipertensi jenis penghambat beta, misalnya bisoprolol atau atenolol, untuk menurunkan detak jantung dan mengurangi tekanan darah, sehingga meringankan kerja jantung\n', 'Topik: Serangan Jantung, Subtopik: Pengobatan Serangan Jantung: Pemulihan Setelah Mengalami Serangan Jantung \n Tujuan utama dari program rehabilitasi jantung adalah mengembalikan kebugaran fisik pasien agar bisa melanjutkan aktivitas sehari-hari, serta mengurangi risiko terjadinya komplikasi dan serangan jantung kambuh. Program rehabilitasi ini akan dimulai sejak pasien berada di rumah sakit hingga pulang ke rumah.\nProgram rehabilitasi jantung terdiri dari beberapa jenis olahraga aerobik, seperti bersepeda, jogging, dan berenang. Untuk mengetahui program lain pada rehabilitasi jantung, penderita bisa menanyakan langsung ke dokter.\nKetika di rumah, pasien disarankan untuk melakukan olahraga ringan, seperti berjalan kaki jarak dekat dan naik-turun tangga. Selanjutnya, penderita dapat meningkatkan aktivitas fisiknya secara perlahan-lahan.\nSelain menjalani rehabilitasi, berikut ini adalah hal-hal yang perlu diperhatikan pasien ketika menjalani pemulihan dari serangan jantung:\n']","Pertolongan pertama yang harus dilakukan terhadap pasien jantung yang mengalami serangan termasuk langkah-langkah penting untuk memastikan penanganan yang adekuat. Berikut ini adalah langkah-langkah utama dalam menangani penderita jantung saat serangan:\n\n1. **Segera Hubungi Ambulans**: Pastikan pasien segera mendapat bantuan medis dengan menelepon angka 119 untuk mendapatkan dukungan medis profesional dan cepat, terlebih jika ada gejala seperti tidak sadar atau hentian jantung.\n\n2. **Penggunaan Nitrogliserin**: Jika pasien sedang mengalami angina pectoris (penyakit jantung yang sering diikuti oleh serangan), gunakan nitroglycerin untuk mengecilkan pembuluh darah dan mengurangi nyeri.\n\n3. **Penatalaksanaan Medis**: Segera menyuntikkan obat angina seperti sublingual aspirin atau nitrostat untuk mencegah serangan jantung yang kemudian bisa diarahkan ke dokter dan rumah sakit.\n\n4. **Penggunaan Obat Antiplatlet**: Aspirin dapat digunakan secara terus-menerus untuk mencegah penggumpalan darah yang mengganggu aliran darah menuju jantung dan otak.\n\n5. **Periksa Medis Secara Lanjut**: Setelah pasien pulih dari serangan, lakukan evaluasi medis ketat untuk menentukan apakah ada kerusakan pada jantung atau bahaya risiko lebih lanjut.\n\n6. **Penggunaan Obat Pelebar Pembuluh Darah Golongan Nitrat**: Jika serangan terus berlangsung, pasien perlu diberikan obat lain seperti isosorbiddifenoksasin atau nitroglycerin untuk mengecilkan pembuluh darah dan mengurangi tekanan.\n\n7. **Penggunaan Obat Anti-Koagulasi**: Jika ada gejala penyakit jantung ulang, obat anti-koagulasi seperti heparin atau warfarin dapat digunakan untuk mencegah penggumpalan darah yang membahayakan.\n\n8. **Pemulihan dan Rehabilitasi**: Setelah pasien pulih dari serangan, mulailah program rehabilitasi jantung yang direkomendasikan oleh dokter untuk meningkatkan fungsi jantung, mengurangi risiko kedaluwarsa, dan meningkatkan kualitas hidup.\n\nDengan mematuhi langkah-langkah ini, Anda dapat memberikan pertolongan yang cepat dan efektif pada pasien jantung saat serangan, sehingga mengurangi resiko terjadinya komplikasi atau ulang.","Pertolongan awal yang harus diberikan kepada pasien penyakit jantung termasuk langkah-langkah dasar untuk mengurangi risiko kematian akibat serangan jantung. Berikut ini adalah beberapa langkah penting:\n\n1. Memastikan agar pasien tenang dan nyaman, dengan menekan dada atau memberikan obat anti-hipertensi untuk mengurangi tekanan darah tinggi.\n2. Menghentikan aktivitas otot paru-paru yang berlebihan, seperti berenang atau memakai baju pendek, dan menjangkau dada secara perlahan untuk mencegah konstriksi jantung akibat tekanan dalam darah rendah.\n3. Menghentikan penggunaan merokok atau mengurangi konsumsi minuman stimulan seperti kopi dan teh, yang dapat meningkatkan detak nadi dan tekanan darah.\n4. Melakukan semprotan asam salisilat untuk membantu meringankan pleksa serta mengurangi gangguan stres fisik atau emosi yang berkaitan dengan konstriksi jantung.\n5. Menghentikan penggunaan obat-obatan yang tidak disangka aman, seperti narkotika dan alkohol, karena mereka dapat memperburuk penyakit jantung atau meningkatkan risiko serangan jantung.\n6. Menghentikan aktivitas otot paru-paru yang berlebihan secara perlahan dan memberi pasien obat untuk mengurangi konstriksi jantung, seperti morphine atau nitroglycerin.\n7. Segera memanggil dokter atau angkatan medis lainnya untuk mendiagnosis dan terapi serangan jantung yang parah atau resiko kematian tinggi.",0.7142857142857143,0.6118612038518053,0.9999999999,1.0
Apa saja gejala pada seseorang yang mengalami hipotensi?,"Hipotensi tidak selalu menimbulkan gejala. Jika muncul gejala, penderita hipotensi dapat merasakan keluhan berikut:\n\nPusing\nMual dan muntah\nLemas\nPandangan kabur\nLinglung\nSulit berkonsentrasi\nTubuh terasa tidak stabil\nSesak napas\nPingsan","['Topik: Hipotensi, Subtopik: Gejala Hipotensi \n Hipotensi tidak selalu menimbulkan gejala. Jika muncul gejala, penderita hipotensi dapat merasakan keluhan berikut:\n- Pusing\n- Mual dan muntah\n- Lemas\n- Pandangan kabur\n- Linglung\n- Sulit berkonsentrasi\n- Tubuh terasa tidak stabil\n- Sesak napas\n- Pingsan\n', 'Topik: Hipotensi, Subtopik: Gejala Hipotensi \n Lakukan pemeriksaan ke dokter jika Anda mengalami gejala yang telah disebutkan di atas. Bila setelah diperiksa tekanan darah Anda di bawah normal, dokter akan melakukan pemeriksaan lanjutan untuk mencari tahu penyebab hipotensi tersebut.\nSegera ke dokter atau rumah sakit terdekat jika mengalami hipotensi dengan penurunan kesadaran dan gejala syok, seperti jantung berdebar, keringat dingin, atau sesak napas. Tekanan darah yang sangat rendah hingga menimbulkan syok perlu segera ditangani, karena dapat membahayakan nyawa.\n', 'Topik: Hipotensi, Subtopik: Pengertian Hipotensi \n Darah rendah atau hipotensi adalah kondisi ketika tekanan darah kurang dari 90/60 mmHg. Hipotensi umumnya tidak bergejala dan dapat dialami oleh siapa saja. Namun, pada beberapa orang, hipotensi dapat menyebabkan pusing, lemas, hingga pingsan.\nTekanan darah normal berkisar antara 90/60 mmHg dan 120/80 mmHg. Seseorang dapat dikatakan menderita hipotensi jika tekanan darahnya berada di bawah rentang tersebut.\n\nHipotensi dapat menjadi tanda dari suatu penyakit atau kondisi yang sedang diderita. Pada beberapa kasus yang parah, hipotensi dapat mengancam nyawa sehingga butuh ditangani segera.\n']","Gejala penderita hipotensi, seperti yang dijelaskan dalam konteks tersebut, termasuk:\n\n1. Pusing\n2. Mual dan muntah\n3. Lemas\n4. Pandangan kabur\n5. Linglung\n6. Sulit berkonsentrasi\n7. Tubuh terasa tidak stabil\n8. Sesak napas\n9. Pingsan","Gejala umum pada seseorang yang mengalami hipotensi atau penyakit jantung termasuk antara lain tidak nyambung hati, sering demam, nyeri dada, gatalan dekat perut, dan gejala ringan seperti mual-mual. Jika ada asupan makanan yang buruk atau penggunaan obat yang salah, ini juga dapat memicu hipotensi.",1.0,0.5106497521919336,0.9999999999666667,1.0
Berapa tekanan darah yang menandakan seseorang mengalami hipotensi?,Tekanan darah normal berkisar antara 90/60 mmHg dan 120/80 mmHg. Seseorang dapat dikatakan menderita hipotensi jika tekanan darahnya berada di bawah rentang tersebut.,"['Topik: Hipotensi, Subtopik: Pengertian Hipotensi \n Darah rendah atau hipotensi adalah kondisi ketika tekanan darah kurang dari 90/60 mmHg. Hipotensi umumnya tidak bergejala dan dapat dialami oleh siapa saja. Namun, pada beberapa orang, hipotensi dapat menyebabkan pusing, lemas, hingga pingsan.\nTekanan darah normal berkisar antara 90/60 mmHg dan 120/80 mmHg. Seseorang dapat dikatakan menderita hipotensi jika tekanan darahnya berada di bawah rentang tersebut.\n\nHipotensi dapat menjadi tanda dari suatu penyakit atau kondisi yang sedang diderita. Pada beberapa kasus yang parah, hipotensi dapat mengancam nyawa sehingga butuh ditangani segera.\n', 'Topik: Hipotensi, Subtopik: Pengertian Hipotensi \n Tekanan darah normal berkisar antara 90/60 mmHg dan 120/80 mmHg. Seseorang dapat dikatakan menderita hipotensi jika tekanan darahnya berada di bawah rentang tersebut.\n\nHipotensi dapat menjadi tanda dari suatu penyakit atau kondisi yang sedang diderita. Pada beberapa kasus yang parah, hipotensi dapat mengancam nyawa sehingga butuh ditangani segera.\n', 'Topik: Hipotensi, Subtopik: Gejala Hipotensi \n Lakukan pemeriksaan ke dokter jika Anda mengalami gejala yang telah disebutkan di atas. Bila setelah diperiksa tekanan darah Anda di bawah normal, dokter akan melakukan pemeriksaan lanjutan untuk mencari tahu penyebab hipotensi tersebut.\nSegera ke dokter atau rumah sakit terdekat jika mengalami hipotensi dengan penurunan kesadaran dan gejala syok, seperti jantung berdebar, keringat dingin, atau sesak napas. Tekanan darah yang sangat rendah hingga menimbulkan syok perlu segera ditangani, karena dapat membahayakan nyawa.\n']","Tekanan darah normal berkisar antara 90/60 mmHg dan 120/80 mmHg. Seseorang dapat dikatakan menderita hipotensi jika tekanan darahnya berada di bawah rentang tersebut, yaitu kurang dari 90/60 mmHg.","Tekanan darab yang umum dianggap sebagai tolok ukur hipotensi (tegangan darah rendah) adalah tekanan darah 90/60 mmHg atau lebih rendah. Namun, ini bergantung pada individu dan kondisi mereka.",1.0,0.5644453557808217,0.9999999999666667,1.0
Bagaimana metode utama dalam pengobatan penyakit hipotensi?,"Metode utama untuk menangani hipotensi adalah perubahan pola makan dan gaya hidup, seperti:\n\nMemperbanyak konsumsi cairan, karena cairan dapat meningkatkan volume darah dan membantu mencegah dehidrasi\nBerolahraga secara teratur untuk meningkatkan tekanan darah\nMengonsumsi suplemen atau obat darah rendah yang bisa didapatkan di apotek\nMenggunakan stoking khusus (stoking kompresi) pada tungkai untuk memperlancar aliran darah","['Topik: Hipotensi, Subtopik: Pengobatan Hipotensi \n Pengobatan hipotensi tergantung pada penyebab yang mendasarinya. Tujuan pengobatan adalah untuk meningkatkan tekanan darah, meredakan gejala yang muncul, dan mengobati kondisi yang menyebabkan hipotensi.\nJika hipotensi menimbulkan gejala, maka tindakan pertama yang perlu dilakukan adalah duduk atau berbaring. Setelah itu, posisikan kaki lebih tinggi dari jantung dan pertahankan posisi tersebut selama beberapa saat. Bila gejala tidak juga mereda, penanganan oleh dokter perlu dilakukan.\nMetode utama untuk menangani hipotensi adalah perubahan pola makan dan gaya hidup, seperti:\n- Memperbanyak konsumsi cairan, karena cairan dapat meningkatkan volume darah dan membantu mencegah dehidrasi\n- Berolahraga secara teratur untuk meningkatkan tekanan darah\n- Mengonsumsi suplemen atau obat darah rendah yang bisa didapatkan di apotek\n- Menggunakan stoking khusus (stoking kompresi) pada tungkai untuk memperlancar aliran darah\nJika hipotensi disebabkan oleh konsumsi obat-obatan, dokter akan mengurangi dosis atau mengganti jenis obatnya bila perlu. Selain itu, dokter juga dapat memberikan obat-obatan untuk menurunkan tekanan darah, yang disesuaikan dengan penyebab dan kondisi pasien.\nHipotensi yang disertai gejala syok membutuhkan penanganan darurat. Dokter akan memberikan cairan infus dan obat peningkat tekanan darah, seperti epinephrine atau norepinephrine untuk mencegah kerusakan fungsi organ. Transfusi darah juga dapat diberikan jika hipotensi disebabkan oleh kehilangan darah yang banyak.\nSetelah tekanan darah, detak jantung, suhu tubuh, dan pernapasan pasien stabil, dokter akan memberikan pengobatan untuk mengatasi penyebabnya. Misalnya, memberikan obat antibiotik untuk mengatasi infeksi yang sudah masuk ke dalam darah.\n', 'Topik: Hipotensi, Subtopik: Diagnosis Hipotensi \n Untuk mendiagnosis hipotensi, dokter akan melakukan tanya jawab mengenai gejala dan riwayat kesehatan pasien. Setelah itu, dokter akan melakukan pemeriksaan fisik, termasuk memeriksa tekanan darah dengan menggunakan sfigmomanometer.\nJika hasil pemeriksaan menunjukkan angka yang cukup rendah dan disertai gejala tertentu, dokter akan melakukan pemeriksaan lanjutan untuk mendeteksi kondisi atau penyakit yang menyebabkan hipotensi.\nPemeriksaan yang akan dilakukan dokter meliputi:\n- Tes darah, untuk memeriksa kadar gula dan kadar hormon dalam darah\n- Elektrokardiografi (EKG), untuk mendeteksi struktur jantung yang tidak normal dan detak jantung yang tidak beraturan\n- Ekokardiogram, untuk memeriksa fungsi jantung dan mendeteksi kelainan pada jantung\n- Uji latih jantung (stress test), untuk menilai fungsi jantung saat melakukan aktivitas, seperti berjalan atau berlari\n- Tilt table test, untuk melihat perbedaan tekanan darah saat berbaring dan berdiri pada pasien hipotensi ortostatik\n\n', 'Topik: Hipotensi, Subtopik: Pencegahan Hipotensi \n Cara terbaik untuk mencegah terjadinya hipotensi adalah dengan menghindari faktor pemicunya. Beberapa hal yang dapat dilakukan adalah:\n- Membatasi konsumsi minuman berkafein dan beralkohol\n- Mengonsumsi makanan dalam porsi kecil tetapi sering, dan tidak langsung berdiri setelah makan\n- Memosisikan kepala lebih tinggi ketika tidur\n- Berdiri secara perlahan dari posisi duduk atau berbaring\n- Tidak berdiri atau duduk terlalu lama\n- Tidak membungkuk atau mengubah posisi tubuh secara tiba-tiba\n- Tidak mengangkat beban yang terlalu berat\n- Mencukupi kebutuhan minum, minimal 8 gelas per hari\n- Berolahraga secara teratur, untuk meningkatkan otot tubuh dan melancarkan aliran darah\n- Menghindari diet rendah garam yang terlalu ketat\n']","Metode utama dalam pengobatan penyakit hipotensi melibatkan beberapa aspek, termasuk perubahan pola makan dan gaya hidup, konsumsi suplemen atau obat darah rendah, serta tindakan medis jika diperlukan. Berikut adalah metode utama yang dapat digunakan:\n\n1. Perubahan Pola Makan dan Gaya Hidup:\n   - Memperbanyak konsumsi cairan untuk meningkatkan volume darah dan mengatasi dehidrasi.\n   - Berolahraga secara teratur, seperti berjalan atau berlari, yang dapat meningkatkan tekanan darah.\n   - Menggunakan suplemen atau obat darah rendah, termasuk zat-zat seperti kodein dan midodrine, yang dapat didapatkan di apotek tanpa resep doktor.\n2. Konsumsi Suplemen atau Obat Darah Rendah:\n   - Zat-zat seperti kodein (detolak) dan midodrine (pressophilin) dapat memperkuat pembuluh darah, meningkatkan tekanan darah.\n   - Dosis ini biasanya diatur oleh dokter atau praktisi kesehatan lainnya, bergantung pada penyebab dan kondisi pasien hipotensi.\n3. Tindakan Medis:\n   - Jika hipotensi disebabkan oleh obat-obatan, dosis obat dikurangi atau diganti dengan jenis lain yang lebih menguntungkan untuk tekanan darah.\n   - Obat-obatan untuk menurunkan tekanan darah juga dapat diberikan sesuai kebutuhan, seperti angiotensin II atau angiotensin receptor blocker (ARB).\n4. Penggunaan Stoking Khusus:\n   - Pemberian stoking kompresi pada tungkai untuk memperlancar aliran darah dan meningkatkan tekanan darah.\n5. Pemeriksaan Lanjutan dan Diagnosis:\n   - Dokter akan melakukan pemeriksaan lanjutan, seperti tes darah dan ekokardiogram, untuk memastikan penyebab hipotensi dan memberikan terapi yang sesuai.\n6. Pencegahan Hipotensi:\n   - Mengurangi konsumsi minuman beralkohol dan berkafein.\n   - Membiasakan diri menghindari posisi duduk atau berbaring dalam jangka panjang, menguras jumlah darah yang teratur.\n   - Mencukupi kebutuhan cairan dengan penciuman dingin dan minum secara teratur.\n7. Penggunaan Metode Khusus untuk Pasien Tertentu:\n   - Untuk pasien hipotensi yang disebabkan oleh struktur jantung atau fungsi jantung tidak normal, dokter akan mengadakan pemeriksaan khusus seperti elektrokardiografi (EKG), ekokardiogram, dan uji latih jantung (stress test).\n8. Pengobatan Secara Kuratif:\n   - Jika hipotensi disertai gejala syok atau gangguan fungsi organ signifikan, dokter akan memberikan cairan infus dan obat peningkat tekanan darah secara kuratif untuk menangani situasi darurat ini.\n9. Pengobatan Berdasarkan Penyebab:\n   - Setelah stabilisasi parameter fisiologis seperti tekanan darah, detak jantung, suhu tubuh, dan pernapasan pasien, dokter akan memberikan pengobatan untuk mengatasi penyebab hipotensi yang diakibatkan oleh infeksi atau gangguan lainnya.\n\nDengan metode ini, diharapkan dapat meningkatkan tekanan darah secara efektif dan memberikan kesehatan yang lebih baik kepada pasien hipotensi.","Metode utama dalam pengobatan penyakit hipotensi, atau tekanan darah rendah, meliputi beberapa aspek kesehatan dan prinsip-prinsip medis. Berikut adalah metode umum yang sering digunakan:\n\n1. **Pemberian Garam (NaCl)**: Salah satu pendekatan paling umum dalam mengatasi hipotensi adalah dengan meningkatkan jumlah garam di dalam tubuh melalui pemberian natrium klorida intravena (IV). Hal ini berguna untuk meningkatkan volume plasma dan, oleh karena itu, meningkatkan tekanan darah.\n\n2. **Pemberian Prickling Drinks**: Beberapa formulir stimulan dalam bentuk cairan, seperti salep dimetilturbinada (TD) atau cuka, juga dapat digunakan untuk meningkatkan tekanan darah pada awalnya rendah.\n\n3. **Penggunaan Vaskuler Pressor**: Jika garam dan stimulan tidak mencapai hasil yang diharapkan, dokter mungkin akan menggunakan zat vaskuler pressor seperti terbutalin atau adrenaline untuk meningkatkan tekanan darah.\n\n4. **Penggunaan Minuman Kental**: Pemberian minuman kental yang tinggi dalam protein dan karbohidrat dapat membantu meningkatkan berat badan secara efektif, yang pada gilirannya bisa meningkatkan tekanan darah.\n\n5. **Penggunaan Minuman Sehat**: Mengurangi asupan kafein dan stimulan lainnya serta memperlakukan penyakit ringan atau pembedahan yang mungkin disebabkan oleh tekanan darah rendah juga penting.\n\n6. **Penggunaan Pemberantas Anemia**: Jika hipotensi disertai anemia, penggunaan suplemen besi dan asam folat sering digunakan untuk meningkatkan jumlah eritrosit dan meningkatkan tekanan darah.\n\n7. **Penghentian Penyebab Hipotensi Secara Fisik**: Beberapa penyebab hipotensi fisik, seperti disfungsi jantung atau limpa yang terhambat, memerlukan penggunaan obat-obatan khusus untuk mengatasinya.\n\nDalam setiap kasus, diagnosa dan program pengobatan harus didasarkan atas penilaian individual pasien dan kombinasi antara metode utama ini. Konsultasi dengan dokter spesialis tersebut adalah kunci untuk mendapatkan pengobatan yang sesuai dan meminimalkan risiko hipotensi.",0.7941176470588235,0.5734012687581788,0.9999999999,1.0
Apa gejala yang menunjukkan seseorang mengalami angin duduk?,Beberapa gejala lain yang dapat menyertai nyeri dada pada angin duduk atau angina adalah:\n\nKeringat dingin\nMual\nPusing\nLemas\nSesak napas,"['Topik: Angin Duduk, Subtopik: Gejala Angin Duduk \n Gejala utama angin duduk adalah nyeri dada yang terasa seperti ditindih atau ditekan benda berat. Nyeri yang timbul akibat angin duduk dapat menyebar ke bagian tubuh lain, seperti leher, lengan, bahu, punggung, rahang, dan gigi. Pada wanita, terkadang nyeri dada dapat terasa seperti ditusuk benda tajam.\nBeberapa gejala lain yang dapat menyertai nyeri dada pada angin duduk atau angina adalah:\n- Keringat dingin\n- Mual\n- Pusing\n- Lemas\n- Sesak napas\nGejala angin duduk lebih sering timbul saat beraktivitas dan mereda atau hilang jika beristirahat atau meminum obat. Angin duduk jenis ini disebut angin duduk stabil.\nPada kasus tertentu, angin duduk tidak hilang meski sudah beristirahat dan minum obat, atau timbul saat sedang beristirahat. Angin duduk jenis ini disebut dengan angin duduk tidak stabil.\n', 'Topik: Angin Duduk, Subtopik: Gejala Angin Duduk: Kapan harus ke dokter \n Segera ke IGD jika mengalami gejala angin duduk untuk pertama kalinya. Bila Anda sudah memiliki obat angin duduk, cepatlah minum obat dan beristirahat jika gejala muncul. \nNamun, jangan menunda untuk mencari pertolongan medis jika gejala angin duduk tidak membaik atau makin berat, terlebih bila gejala tersebut disertai dengan sesak napas, berkeringat berlebihan, atau nyeri yang menjalar ke lengan, rahang, maupun punggung. \nBila ada orang lain, mintalah pertolongannya untuk membawa Anda ke rumah sakit terdekat. Penting diingat bahwa Anda tidak boleh mengemudi seorang diri ke rumah sakit, kecuali bila tidak ada pilihan lain.\n', 'Topik: Angin Duduk, Subtopik: Komplikasi Angin Duduk \n Angin duduk dapat berkembang menjadi serangan jantung, yang ditandai dengan nyeri dada berat yang menjalar ke lengan, leher, atau punggung, disertai gejala seperti keringat berlebihan, mual, dan pusing. Jika Anda atau orang di sekitar mengalami gejala ini, segera ke IGD terdekat.\n']","Gejala utama angin duduk, atau angina, termasuk nyeri dada yang terasa seperti ditindih atau ditekan benda berat. Nyeri ini dapat menyebar ke bagian tubuh lain, seperti leher, lengan, bahu, punggung, rahang, dan gigi. Pada wanita, nyeri dada yang dirasakan cenderung lebih menyakitkan dan seringkali terasa seperti ditusuk benda tajam.\n\nGejala lain yang dapat menyertai nyeri dada pada angin duduk atau angina antara lain keringat dingin, mual, pusing, lemas, dan sesak napas. Angin duduk umumnya lebih sering terjadi saat beraktivitas dan berkurang atau hilang jika seseorang beristirahat atau minum obat untuk mengobati angin duduk. Ada dua jenis angin duduk: yang stabil, dimana gejakala tetap padahal sudah beristirahat, dan tidak stabil, dimana angin duduk tersebut muncul meskipun sedang beristirahat atau bahkan meningkat saat istirahat.\n\nPenting untuk segera mencari bimbingan dokter jika gejala angin duduk membaik atau semakin berat, terutama bila disertai dengan sesak napas, berkeringat berlebihan, nyeri yang menjalar ke bagian tubuh lain, atau komplikasi seperti serangan jantung.","Gejala yang umum ditandai oleh orang yang mengalami angin duduk termasuk rasa lelah pada paha, sensasi gemetar atau peraba panas pada sisi dada, gejolak nafas, dan buruk hati. Beberapa orang juga mungkin merasakan bengkang di seluruh tubuh atau efek sementara dalam kesadaran. Namun, ini seringkali berbeda antara individu dan tidak selalu mudah untuk dideteksi tanpa pemeriksaan medis lebih lanjut.",0.9130434782608695,0.36760435634879557,0.9999999999666667,1.0
Bagaimana pertolongan terhadap seseorang yang mengalami angin duduk?,"Segera ke IGD jika mengalami gejala angin duduk untuk pertama kalinya. Bila Anda sudah memiliki obat angin duduk, cepatlah minum obat dan beristirahat jika gejala muncul. \n\nNamun, jangan menunda untuk mencari pertolongan medis jika gejala angin duduk tidak membaik atau makin berat, terlebih bila gejala tersebut disertai dengan sesak napas, berkeringat berlebihan, atau nyeri yang menjalar ke lengan, rahang, maupun punggung. \n\nBila ada orang lain, mintalah pertolongannya untuk membawa Anda ke rumah sakit terdekat. Penting diingat bahwa Anda tidak boleh mengemudi seorang diri ke rumah sakit, kecuali bila tidak ada pilihan lain.","['Topik: Angin Duduk, Subtopik: Pengertian Angin Duduk \n Angin duduk adalah nyeri dada yang disebabkan oleh berkurangnya aliran darah ke otot jantung. Kondisi ini sering kali disalahartikan dan diremehkan karena gejalanya mirip dengan masalah yang ringan. Padahal, angin duduk berkaitan erat dengan gangguan jantung yang perlu segera ditangani.\nAngina pectoris atau angin duduk ditandai dengan nyeri dada yang seperti tertindih, terbakar, atau tertusuk. Keluhan ini lebih sering muncul saat penderitanya sedang beraktivitas, yaitu ketika jantung memompa darah lebih cepat. \n\nAngin duduk dapat ditangani dengan pengobatan dari dokter dan dengan menjalani gaya hidup sehat. Jika ditangani dengan baik, penderita angin duduk dapat terhindar dari komplikasi yang serius.\n', 'Topik: Angin Duduk, Subtopik: Pengobatan Angin Duduk  \n Pengobatan angina duduk bertujuan untuk mengurangi keluhan dan mencegah terjadinya serangan jantung. Pengobatan ini umumnya melibatkan perubahan gaya hidup yang diimbangi dengan pengobatan dan prosedur medis tertentu. Perubahan gaya hidup untuk menangani angin duduk mencakup:\n- Tidak merokok\n- Memilih makanan rendah garam dan tinggi serat, seperti sayuran dan buah-buahan\n- Menghindari konsumsi makanan tinggi lemak jenuh dan minuman beralkohol\n- Menjaga berat badan ideal atau menurunkan berat badan jika overweight  atau obesitas\n\n- Berolahraga secara teratur\n- Mengelola stres dengan baik\n', 'Topik: Angin Duduk, Subtopik: Pengertian Angin Duduk \n Angina pectoris atau angin duduk ditandai dengan nyeri dada yang seperti tertindih, terbakar, atau tertusuk. Keluhan ini lebih sering muncul saat penderitanya sedang beraktivitas, yaitu ketika jantung memompa darah lebih cepat. \n\nAngin duduk dapat ditangani dengan pengobatan dari dokter dan dengan menjalani gaya hidup sehat. Jika ditangani dengan baik, penderita angin duduk dapat terhindar dari komplikasi yang serius.\n']","Pertolongan terhadap seseorang yang mengalami angin duduk melibatkan beberapa langkah, termasuk pengobatan medis dan perubahan gaya hidup. Berikut adalah pertolongan umum untuk menangani angin duduk:\n\n1. Segera periksa dokter: Angin duduk merupakan gejala dari berbagai penyakit jantung, termasuk angina pectoris, dan perlu segera diteliti oleh dokter untuk memastikan penyebabnya dan memberikan tindakan terapeutik yang sesuai.\n\n2. Fokus pada perubahan gaya hidup sehat: Seperti yang dijelaskan dalam konteks, perubahan gaya hidup penting untuk menangani angin duduk. Ini meliputi tidak merokok, memilih makanan rendah lemak dan garam tinggi serat, menghindari paparan asap rokok atau racun lainnya, dan mengelola berat badan ideal.\n\n3. Berolahraga secara teratur: Olahraga dapat membantu mensejajarkan aliran darah di jantung dan menurunkan risiko serangan angin duduk. Penyusunan waktu untuk berolahraga seperti jogging, biking, atau swimming biasanya disarankan secara teratur.\n\n4. Mengelola stres: Stres dapat memperburuk gejala angin duduk, oleh karena itu penting untuk mengelola stres dengan cara yang efektif, seperti melakukan praktis yoga atau meditasi.\n\n5. Terapis dan obat: Dokter mungkin akan merencanakan obat tradisional atau modern untuk menurunkan tekanan jantung dan mengurangi nyeri dada, seperti nitroglycerin atau aspirin.\n\n6. Penggunaan alat bantu: Beberapa penderita angin duduk mungkin diberikan talisman medis untuk menghindari serangan jantung, seperti sirip obat atau bracelet kontraksor.\n\nDalam kesimpulan, pertolongan terhadap orang yang mengalami angin duduk melibatkan dukungan medis dan perubahan gaya hidup untuk menjaga jantung tetap sehat dan mencegah serangan angin duduk.","Angin duduk, atau sering disebut sebagai hipertensi jantung, merupakan suatu kondisi di mana tekanan darah tinggi dalam pembuluh darah. Ini bisa menjadi ancaman bagi kesehatan yang serius dan memicu penyakit jantung atau stroke. Pengobatan umum untuk mengatasi angin duduk melalui metode medis termasuk dengan pemberian obat-obatan untuk menurunkan tekanan darah, menekan asupan makanan rendah lemak dan tinggi serat, serta mencegah penyakit jantung yang parah.\n\nSelain itu, aktivitas fisik sehari-hari juga sangat penting untuk mengurangi angin duduk. Beberapa langkah sederhana yang dapat diambil oleh individu terkena angin duduk termasuk menurunkan asupan garam dalam makanan, menjaga berat badan ideal, dan melakukan obesitas dan anorexia menyusui.\n\nPenyembuhan alami atau kebijakan kesehatan lain yang tidak medis termasuk dengan memilih diet sehat, mengurangi tekanan kerja berat, menghindari rokok dan minuman alkohol, serta melakukan risiko penggunaan obat-obatan atau stimulan.\n\nPenting untuk selalu berkonsultasi dengan dokter jika mengalami gejala angin duduk karena setiap kasus pasti unik dan memerlukan penilaian medis secara cermat oleh profesional medis.",0.43478260869565216,0.6746884311727209,0.9999999999666667,0.6
Bagaimana cara mencegah penyakit angin duduk?,"Angin duduk dapat dicegah melalui beberapa cara berikut:\n\nBerolahraga secara rutin, misalnya bersepeda santai, berjalan kaki, atau berenang\nMengonsumsi makanan yang sehat untuk jantung, terutama makanan yang mengandung serat dan lemak tak jenuh, seperti sayuran, buah-buahan, ikan tuna, dan minyak zaitun\nMenghindari konsumsi makanan yang tinggi garam dan lemak jenuh, seperti santan, gorengan, keju, dan mentega\nMengonsumsi obat secara rutin sesuai anjuran dokter \nMenjaga berat badan ideal\nMenghindari konsumsi minuman beralkohol\nTidak merokok","['Topik: Angin Duduk, Subtopik: Pencegahan Angin Duduk \n Angin duduk dapat dicegah melalui beberapa cara berikut:\n- Berolahraga secara rutin, misalnya bersepeda santai, berjalan kaki, atau berenang\n- Mengonsumsi makanan yang sehat untuk jantung, terutama makanan yang mengandung serat dan lemak tak jenuh, seperti sayuran, buah-buahan, ikan tuna, dan minyak zaitun\n- Menghindari konsumsi makanan yang tinggi garam dan lemak jenuh, seperti santan, gorengan, keju, dan mentega\n- Mengonsumsi obat secara rutin sesuai anjuran dokter \n- Menjaga berat badan ideal\n\n- Menghindari konsumsi minuman beralkohol\n- Tidak merokok\nUntuk mencegah angin duduk, pastikan untuk menjalani pemeriksaan kesehatan rutin, terutama bagi yang menderita diabetes, hipertensi, atau faktor risiko lain. Pemeriksaan secara berkala dapat mengendalikan faktor risiko yang ada dengan lebih baik dan mendeteksi masalah lebih dini.\n', 'Topik: Angin Duduk, Subtopik: Pengobatan Angin Duduk  \n Pengobatan angina duduk bertujuan untuk mengurangi keluhan dan mencegah terjadinya serangan jantung. Pengobatan ini umumnya melibatkan perubahan gaya hidup yang diimbangi dengan pengobatan dan prosedur medis tertentu. Perubahan gaya hidup untuk menangani angin duduk mencakup:\n- Tidak merokok\n- Memilih makanan rendah garam dan tinggi serat, seperti sayuran dan buah-buahan\n- Menghindari konsumsi makanan tinggi lemak jenuh dan minuman beralkohol\n- Menjaga berat badan ideal atau menurunkan berat badan jika overweight  atau obesitas\n\n- Berolahraga secara teratur\n- Mengelola stres dengan baik\n', 'Topik: Angin Duduk, Subtopik: Pengobatan Angin Duduk : Obat-obatan \n Jika perubahan gaya hidup tidak cukup untuk meningkatkan kesehatan jantung dan mengatasi angin duduk, dokter akan meresepkan obat-obatan. Beberapa jenis obat yang dapat digunakan untuk mengobati angin duduk meliputi: \n- Nitrat\nObat ini berfungsi melemaskan pembuluh darah yang kaku agar darah dapat mengalir dengan lancar menuju otot Salah satu contoh obat jenis ini adalah nitrogliserin.\n\n- Pengencer darah\nObat ini berfungsi untuk mencegah sel darah menggumpal. Beberapa contoh obat dari golongan ini adalah aspirin, clopidogrel, dan ticagrelor.\n\n- Antagonis kalsium\nAntagonis kalsium dapat melancarkan aliran darah jantung dan mencegah angin duduk. Obat ini juga mampu melemaskan sel-sel otot di dalam dinding pembuluh darah. Beberapa contoh obat dari golongan ini adalah amlodipine dan diltiazem.\n- Penghambat beta\nObat penghambat beta berfungsi menurunkan tekanan darah dan denyut jantung. Dengan begitu, beban kerja jantung menjadi berkurang.\n- ACE inhibitor\nACE inhibitor berfungsi untuk melebarkan pembuluh darah dan menurunkan tekanan darah.\n- Statin\nObat ini bertujuan menurunkan kolesterol dalam darah sehingga kerusakan pembuluh darah dapat dicegah.\n']","Mencegah angin duduk melalui beberapa cara, di antaranya:\n\n1. Berolahraga secara rutin, seperti bersepeda santai, berjalan kaki, atau berenang, yang dapat meningkatkan daya tahan tubuh dan mengurangi risiko angin duduk.\n2. Mengonsumsi makanan sehat untuk jantung, terutama yang tinggi serat dan lemak tak jenuh, seperti sayuran, buah-buahan, ikan tuna, dan minyak zaitun.\n3. Menghindari konsumsi makanan yang tinggi garam dan lemak jenuh, seperti santan, gorengan, keju, dan mentega.\n4. Mengonsumsi obat secara rutin sesuai anjuran dokter, termasuk obat-obatan untuk mengobati penyakit lain yang berhubungan dengan angin duduk seperti diabetes atau hipertensi.\n5. Menjaga berat badan ideal dan menghindari keadaan overweight atau obesitas, karena faktor ini juga dapat mempengaruhi risiko terkena angin duduk.\n6. Mengurangi paparan stres melalui cara-cara yang baik, seperti berolahraga secara teratur dan belajar cara mengelola tekanan serta stres.\n7. Menghindari konsumsi minuman beralkohol dan menjauhi aktivitas merokok.\n8. Menyadari bahwa penyakit angin duduk dapat membahayakan, maka penting untuk selalu mengikuti pemeriksaan kesehatan rutin, terutama bagi yang menderita penyakit lain seperti diabetes atau hipertensi. Pemeriksaan berkala ini akan sangat membantu dalam mengendalikan faktor risiko dan mendeteksi masalah lebih dini sebelum serangan angin duduk terjadi.","Untuk mencegah penyakit angin duduk, konsumen dapat mengikuti beberapa langkah berikut:\n\n1. Mengurangi asupan makanan tinggi lemak dan menjaga pola makan sehat.\n2. Menjaga berat badan agar tidak overweight atau underweight secara konsisten.\n3. Melakukan aktivitas fisik setidaknya 150 menit perhari untuk meningkatkan resistensi tubuh dan mengurangi risiko penyakit jantung.\n4. Mengontrol tekanan darah dan menjaga konsentrasi vitamin D yang baik dalam tubuh.\n5. Mengevaluasi familial, terutama jika ada riwayat penyakit jantung atau diabetes mellitus pada keluarga.\n6. Menghentikan merokok dan mencegah paparan pada radiasi sinar ultraviolet (UV) dari kebisingan dan asap rokok.\n7. Mengevaluasi resiko penyakit jantung lainnya, seperti mengkonsumsi obat-obatan tertentu atau memiliki faktor risiko kardiovaskuler lainnya.\n8. Mengadopsi pola hidup yang sehat dan menghindari tekanan dari pekerjaan atau kehidupan personal.",0.7894736842105263,0.7462208672109845,0.99999999995,1.0
Apa saja faktor risiko penyakit emboli?,"Angin duduk dapat dicegah melalui beberapa cara berikut:\n\nBerolahraga secara rutin, misalnya bersepeda santai, berjalan kaki, atau berenang\nMengonsumsi makanan yang sehat untuk jantung, terutama makanan yang mengandung serat dan lemak tak jenuh, seperti sayuran, buah-buahan, ikan tuna, dan minyak zaitun\nMenghindari konsumsi makanan yang tinggi garam dan lemak jenuh, seperti santan, gorengan, keju, dan mentega\nMengonsumsi obat secara rutin sesuai anjuran dokter \nMenjaga berat badan ideal\nMenghindari konsumsi minuman beralkohol\nTidak merokok","['Topik: Emboli, Subtopik: Faktor risiko emboli \n Ada beberapa faktor yang dapat meningkatkan risiko seseorang mengalami emboli, yaitu:\n- Merokok\n- Berusia 60 tahun atau lebih\n- Sedang hamil\n- Mengalami berat badan berlebih atau obesitas\n- Tidak aktif bergerak untuk waktu yang lama, misalnya karena kelumpuhan atau menjalani rawat inap intensif di rumah sakit\n- Menderita penyakit jantung, kelainan katup jantung, fibrilasi atrium\n\n- Memiliki kelainan pada pembuluh darah vena\n- Menderita infeksi atau peradangan yang parah, kanker, kolesterol tinggi, atau diabetes\n- Sedang menjalani terapi hormon\n', 'Topik: Emboli, Subtopik: Pencegahan Emboli \n Emboli tidak selalu dapat dicegah. Meski demikian, ada upaya yang dapat dilakukan untuk mengurangi risiko terjadinya emboli, antara lain:\n- Rutin berolahraga, setidaknya 30 menit sehari\n- Minum air putih yang cukup\n- Menerapkan pola makan sehat dan bergizi seimbang\n- Membatasi asupan garam dengan diet rendah garam\n\n- Mempertahankan berat badan ideal\n- Berhenti merokok dan hindari konsumsi minuman beralkohol\n- Tidak duduk terlalu lama atau kurang aktif bergerak\n- Menjalani pemeriksaan kesehatan secara berkala\n', 'Topik: Emboli, Subtopik: Pengertian Emboli \n Emboli adalah kondisi ketika pembuluh darah tersumbat oleh zat asing, seperti gumpalan darah, gelembung udara, atau gumpalan kolesterol. Kondisi ini berbahaya dan harus segera diatasi, terutama bila terjadi di paru-paru, otak, atau jantung.\nEmboli menyebabkan pembuluh darah tersumbat. Penyumbatan ini dapat terjadi di pembuluh darah mana saja, mulai dari yang terkecil hingga terbesar, arteri maupun vena. Meski begitu, emboli biasanya lebih sering terjadi di arteri.\n\nEmboli yang terjadi pada arteri akan menyebabkan kurangnya asupan oksigen ke jaringan sehingga hal ini akan mengganggu fungsi jaringan atau organ. Jika tidak ditangani dengan tepat, penyumbatan ini dapat menyebabkan kerusakan permanen\nSementara itu, emboli yang terjadi pada vena akan mengganggu aliran darah yang akan kembali ke jantung. Akibatnya, darah akan membendung dan menyebabkan jaringan membengkak. Jika tidak segera ditangani, kondisi ini juga dapat merusak jaringan dan organ.\n']","Berdasarkan konteks yang diberikan, berikut adalah faktor risiko penyakit emboli:\n\n1. Merokok: Pernikahan meroket meningkatkan risiko terkena penyumbatan pembuluh darah dan gejala-gejala lain seperti kanker paru-paru, disentriasi, gangguan kecepatan denyut nadi, serta kerugian ekonomis.\n2. Berusia 60 tahun atau lebih: Usia yang tinggi meningkatkan risiko terkena penyumbatan pembuluh darah karena peningkatan peluang timbulnya penyakit jantung, stroke, dan penyumbatan vena.\n3. Sedang hamil: Mengandalkan asupan gizi yang baik selama kehamilan dan mengurangi risiko infeksi saluran nafas dan diabetes melitus juga penting untuk mencegah terjadinya emboli pada ibu hamil.\n4. Mengalami berat badan berlebih atau obesitas: Obesitas dapat meningkatkan risiko penyumbatan arteri, seperti yang terjadi pada aterosklerosis, serta menyebabkan gangguan dalam sistem peredaran darah.\n5. Tidak aktif bergerak untuk waktu yang lama: Mengurangi risiko penyumbatan vena mayor dengan rutinitas berolahraga dan menjaga pola makan sehat.\n6. Menderita penyakit jantung, kelainan katup jantung, fibrilasi atrium: Penyebab lain yang memperkuat risiko terkena emboli termasuk faktor genetik dan riwayat penyakit jantung di keluarga.\n7. Memiliki kelainan pada pembuluh darah vena: Penyebab lain yang memperkuat risiko terkena emboli termasuk faktor genetik dan riwayat penyakit jantung di keluarga.\n8. Menderita infeksi atau peradangan yang parah, kanker, kolesterol tinggi, atau diabetes: Faktor medis lainnya seperti kolesterol tinggi, diabetes, dan riwayat penyakit jantung dapat meningkatkan risiko terkena emboli.\n9. Sedang menjalani terapi hormon: Penggunaan kontracepsi hormonal atau pengobatan lain yang mengandung estrogen seperti minyak hati, krim anti-aging, dan zat makanan dapat memperkuat risiko terkena emboli.\n\nDari faktor risiko ini, upaya yang dapat diambil untuk mencegah emboli meliputi rutinitas berolahraga seimbang, minum air putih yang cukup, menjaga pola makan sehat dan mengurangi asupan garam, menjaga berat badan ideal, berhenti merokok, menghindari penggunaan kontrasepsi hormonal secara luas, dan menerapkan upaya medis yang tepat.","Faktor risiko penyakit emboli meliputi beberapa aspek kesehatan dan fisik, antara lain:\n\n1. Penyakit jantung dan stroke sebelumnya: Pemakaian obat-obatan yang mengandung estrogen dapat meningkatkan risiko emboli, terutama dalam kalangan pasien yang memiliki riwayat penyakit jantung atau stroke.\n2. Penyakit arteri pembuluh darah lainnya: Kerusakan arteri pembuluh darah lain seperti diabetes mellitus, penyumbatan ginjal, dan asidosis metabolis juga dapat meningkatkan risiko emboli.\n3. Obesitas dan sedentarisme: Obesitas dan aktivitas fisik rendah berkaitan dengan risiko emboli tinggi.\n4. Usia dan jenis kelamin: Semakin tua umur, semakin besar risiko emboli. Selain itu, empik sering terjadi pada laki-laki lebih dari pada wanita.\n5. Rasa纳ngsanggang atau ketakutan: Penyebab ini belum jelas dan jarang terlibat dalam penyebab utama emboli, tetapi faktor ini juga perlu diperhatikan.\n6. Genetika: Beberapa penyakit genetik spesifik seperti hemofilus溶合, antiphospholipid syndrome dan hyperhomocysteinemia dapat meningkatkan risiko emboli.",0.72,0.6068412559768097,0.49999999995,0.875
Apa saja gejala penyakit emboli yang terjadi di daerah tangan?,"Berikut adalah contoh gejala emboli yang terjadi di pembuluh darah arteri tangan atau kaki:\n\nTangan dan kaki terasa dingin dan pucat\nOtot terasa lemah, sulit bergerak\nOtot kram atau kedutan\nNyeri saat berjalan\nMati rasa atau kesemutan","['Topik: Emboli, Subtopik: Pengertian Emboli \n Emboli adalah kondisi ketika pembuluh darah tersumbat oleh zat asing, seperti gumpalan darah, gelembung udara, atau gumpalan kolesterol. Kondisi ini berbahaya dan harus segera diatasi, terutama bila terjadi di paru-paru, otak, atau jantung.\nEmboli menyebabkan pembuluh darah tersumbat. Penyumbatan ini dapat terjadi di pembuluh darah mana saja, mulai dari yang terkecil hingga terbesar, arteri maupun vena. Meski begitu, emboli biasanya lebih sering terjadi di arteri.\n\nEmboli yang terjadi pada arteri akan menyebabkan kurangnya asupan oksigen ke jaringan sehingga hal ini akan mengganggu fungsi jaringan atau organ. Jika tidak ditangani dengan tepat, penyumbatan ini dapat menyebabkan kerusakan permanen\nSementara itu, emboli yang terjadi pada vena akan mengganggu aliran darah yang akan kembali ke jantung. Akibatnya, darah akan membendung dan menyebabkan jaringan membengkak. Jika tidak segera ditangani, kondisi ini juga dapat merusak jaringan dan organ.\n', 'Topik: Emboli, Subtopik: Pengertian Emboli \n Emboli menyebabkan pembuluh darah tersumbat. Penyumbatan ini dapat terjadi di pembuluh darah mana saja, mulai dari yang terkecil hingga terbesar, arteri maupun vena. Meski begitu, emboli biasanya lebih sering terjadi di arteri.\n\nEmboli yang terjadi pada arteri akan menyebabkan kurangnya asupan oksigen ke jaringan sehingga hal ini akan mengganggu fungsi jaringan atau organ. Jika tidak ditangani dengan tepat, penyumbatan ini dapat menyebabkan kerusakan permanen\nSementara itu, emboli yang terjadi pada vena akan mengganggu aliran darah yang akan kembali ke jantung. Akibatnya, darah akan membendung dan menyebabkan jaringan membengkak. Jika tidak segera ditangani, kondisi ini juga dapat merusak jaringan dan organ.\n', 'Topik: Emboli, Subtopik: Penyebab Emboli: Gas \n Gelembung gas atau udara yang menyebabkan penyumbatan di pembuluh darah terjadi pada penyakit dekompresi. Kondisi ini biasanya dialami oleh penyelam yang terlalu cepat naik ke permukaan.\n']","Berdasarkan konteks yang diberikan, beberapa gejala penyakit emboli yang mungkin terjadi pada bagian tangan termasuk:\n\n1. Mengalami nyeri atau rasa sakit di sekitar daerah yang tersumbat darah, seperti berkeringat dan menggigil (Raynaud's phenomenon).\n2. Pernapasan menjadi lebih sulit karena kurangnya oksigen yang masuk ke paru-paru.\n3. Daun tangan atau bagian lain dari tangan tampak merah, sebelum menguning dan terputus.\n4. Perasaan gemas atau sakit saat menekan tulang pada daun tangan.\n5. Penyempitan aliran darah yang menyebabkan bagian tangan terasa dingin dan tampak kehilangan ciri-ciri normalnya, seperti mengalir cairan atau memutar jari.","Gejala penyakit emboli pada umumnya tidang disebabkan oleh benda asing seperti lecet, darah tipes atau jaringan tipis lainnya yang menghentikan aliran darah ke organ-organ tubuh. Dalam kasus emboli di daerah tangan, gejala umum termasuk pembesaran dan ketegatan pada bagian tangan yang terserang oleh arteri.\n\n1. Pembesaran dan Ketegasan Penyakit Emboli: Gejala paling sering terjadi dalam penyakit emboli, dimana arsitektur atau kesehatan arteri tangan mengalami perubahan yang menyebabkan bagian yang terserang menjadi lebih besar dan lebih tebal.\n2. Nyeri di Bagian Tangan: Penyakit emboli dapat menyebabkan nyeri atau rasa sakit pada bagian tangan yang terpengaruh, seperti pergelangan tangan atau jari-jari.\n3. Gangguan Pembuluh Darah: Dalam penyakit emboli, gangguan aliran darah dapat menyebabkan gumpalan darah menempel pada arteri yang terpengaruh, sehingga mengurangi aliran oksigen ke tubuh dan membuat bagian tangan kesulitan mendapat oksigen.\n4. Pembesaran Dan Ketegasan Penyumbatan Arteri: Dalam hal ini, arsitektur arteri tangan yang terserang oleh emboli akan menjadi lebih besar dan tebal akibat penghentian aliran darah.\n5. Gejala Lain seperti Nyeri Akibat Ketegasan: Penyebab lain dari ketegasan penyakit emboli adalah nyeri yang disertai oleh rasa tekanan atau ketegangan pada bagian tangan yang terserang.\n6. Perubahan Far: Perubahan fare, yaitu perubahan warna kulit di sekitar arteri yang terpengaruh oleh emboli, juga bisa menjadi gejala dari penyakit ini.\n7. Pembesaran Dan Ketegasan Penyumbatan Arteri: Dalam hal ini, arsitektur arteri tangan yang terserang oleh emboli akan menjadi lebih besar dan tebal akibat penghentian aliran darah.\n8. Gejala Lain seperti Nyeri Akibat Ketegasan: Penyebab lain dari ketegasan penyakit emboli adalah nyeri yang disertai oleh rasa tekanan atau ketegangan pada bagian tangan yang terserang.\n9. Perubahan Far: Perubahan fare, yaitu perubahan warna kulit di sekitar arteri yang terpengaruh oleh emboli, juga bisa menjadi gejala dari penyakit ini.",0.16666666666666666,0.7438487432599975,0.99999999995,0.0
Bagaimana cara mencegah penyakit emboli?,"Emboli tidak selalu dapat dicegah. Meski demikian, ada upaya yang dapat dilakukan untuk mengurangi risiko terjadinya emboli, antara lain:\n\nRutin berolahraga, setidaknya 30 menit sehari\nMinum air putih yang cukup\nMenerapkan pola makan sehat dan bergizi seimbang\nMembatasi asupan garam dengan diet rendah garam\nMempertahankan berat badan ideal\nBerhenti merokok dan hindari konsumsi minuman beralkohol\nTidak duduk terlalu lama atau kurang aktif bergerak\nMenjalani pemeriksaan kesehatan secara berkala","['Topik: Emboli, Subtopik: Pencegahan Emboli \n Emboli tidak selalu dapat dicegah. Meski demikian, ada upaya yang dapat dilakukan untuk mengurangi risiko terjadinya emboli, antara lain:\n- Rutin berolahraga, setidaknya 30 menit sehari\n- Minum air putih yang cukup\n- Menerapkan pola makan sehat dan bergizi seimbang\n- Membatasi asupan garam dengan diet rendah garam\n\n- Mempertahankan berat badan ideal\n- Berhenti merokok dan hindari konsumsi minuman beralkohol\n- Tidak duduk terlalu lama atau kurang aktif bergerak\n- Menjalani pemeriksaan kesehatan secara berkala\n', 'Topik: Emboli, Subtopik: Pengobatan Emboli: Obat-obatan \n Obat-obatan yang digunakan dalam pengobatan emboli berfungsi untuk mengontrol pembentukan gumpalan darah dan menormalkan aliran darah ke organ tubuh yang tersumbat. Jenis obat yang dapat digunakan antara lain:\n- Antikoagulan, seperti apixaban, warfarin dan heparin, untuk mencegah penggumpalan darah\n- Antiplatelet, seperti aspirin dan clopidogrel, untuk mencegah pembentukan gumpalan baru\n- Obat pemecah gumpalan darah, seperti alteplase, untuk meleburkan darah yang menggumpal\n- Obat antinyeri dan obat penenang, untuk meredakan nyeri\n', 'Topik: Emboli, Subtopik: Pengobatan Emboli: Operasi \n Dokter akan menyarankan operasi jika emboli sudah parah atau tidak bisa diobati dengan obat-obatan. Metode operasi yang dapat dilakukan adalah:\n- Embolektomi\nEmbolektomi bertujuan untuk mengangkat gumpalan di pembuluh darah. Prosedur ini dilakukan dengan menggunakan kateter atau melalui operasi terbuka\n- Filter inferior vena cava (IVC)\nPada prosedur ini, dokter akan menanam alat khusus berbentuk jaring di pembuluh darah. Tujuannya adalah untuk menyaring gumpalan darah dan mencegahnya menyebar ke organ lain.\n- Angioplasti\nAngioplasti dilakukan dengan memasukkan balon kecil ke pembuluh darah kemudian menggembungkannya. Tujuannya adalah untuk melebarkan pembuluh darah yang tersumbat.\n- Arterial bypass\nArterial bypass bertujuan untuk mencangkok pembuluh darah tambahan di pembuluh arteri yang tersumbat. Caranya bisa dengan mengambil vena dari bagian tubuh lain atau dengan menggunakan pipa buatan.\n']","Untuk mencegah penyakit emboli, ada beberapa upaya yang dapat dilakukan, termasuk rutinitas berolahraga setidaknya 30 menit sehari, minum air putih yang cukup, mengikuti pola makan sehat dan bergizi seimbang, membatasi asupan garam dalam diet rendah garam, menjaga berat badan ideal, tidak merokok, dan menghindari pemakanan tingkat obesitas. Selain itu, upaya lain yang dapat dilakukan adalah menjaga tubuh tetap aktif dan sering melakukan pemeriksaan kesehatan secara berkala untuk mendeteksi masalah awal sebelum timbulnya penyakit emboli.","Untuk mencegah penyakit emboli, berikut beberapa langkah yang dapat dilakukan:\n\n1. Mengurangi faktor-faktor risiko seperti merokok, obesitas, diabetes, dan tingkat asam urat darah tinggi.\n2. Melakukan pengobatan serius untuk penyakit jantung atau stroke yang sudah terjadi.\n3. Mengurangi tekanan darah dan mengendalikan ritme nafas secara efektif.\n4. Meredakan stres dan menghindari aktivitas fisik berat, seperti berolahraga yang mendadak atau menyelam.\n5. Mengurangi paparan ke basah (meminimalkan asupan air pagi hari) dan menggunakan obat-obatan kontraindications untuk penyakit jantung atau stroke.",0.9,0.6984988166699986,0.9999999999,1.0
Apa itu penyakit aritmia?,"Aritmia adalah gangguan yang terjadi pada irama jantung. Penderita aritmia bisa merasakan irama jantungnya terlalu cepat, terlalu lambat, atau tidak teratur.","['Topik: Aritmia, Subtopik: Pengertian Aritmia \n Aritmia adalah gangguan yang terjadi pada irama jantung. Penderita aritmia bisa merasakan irama jantungnya terlalu cepat, terlalu lambat, atau tidak teratur.\nSebenarnya, aritmia normal terjadi pada kondisi jantung yang sehat. Namun, bila terjadi terus menerus atau berulang, aritmia bisa menandakan adanya masalah pada organ jantung.\n\n', 'Topik: Aritmia, Subtopik: Pengertian Aritmia \n Sebenarnya, aritmia normal terjadi pada kondisi jantung yang sehat. Namun, bila terjadi terus menerus atau berulang, aritmia bisa menandakan adanya masalah pada organ jantung.\n\n', 'Topik: Aritmia, Subtopik: Komplikasi Aritmia \n Pada beberapa kasus, aritmia dapat memburuk dan menyebabkan komplikasi serius, seperti:\n- Demensia\n- Penyakit Alzheimer\n- Stroke\n- Gagal jantung\n- Henti jantung mendadak\n- Kematian mendadak pada bayi (SIDS)\n']","Penyakit aritmia adalah gangguan dalam ritme jantung, dimana frekuensi atau pola kerja jantung tidak normal. Penderita aritmia mungkin merasakan bahwa irama jantung mereka terlalu cepat (takdirnya tahapkan), terlalu lambat, atau tidak teratur. Dalam konteks yang diberikan, aritmia bisa menunjukkan masalah pada organ jantung dan berpotensi menyebabkan komplikasi seperti demensia, penyakit Alzheimer, stroke, gagal jantung, henti jantung mendadak, atau bahkan kematian.","Penyakit aritmia merupakan suatu kondisi di mana frekuensi dan ritme jantung bergegas atau tidak stabil. Fenomena ini dapat menyebabkan pasien mengalami sensasi nyawanya, gejolak penglihatan, rasa gatal, atau bahkan pilek yang serius sehingga membahayakan hidup mereka. Ada berbagai jenis aritmia jantung, termasuk aritmia sinus, fibrilasi, dan tahap-tahap lainnya. Penyebabnya bisa beragam, dari penyakit pada organ tubuh hingga obesitas atau merokok.",1.0,0.5551640243635092,0.99999999995,1.0
Apa saja penyebab penyakit aritmia?,"Aritmia terjadi ketika impuls listrik yang berfungsi mengatur detak jantung tidak bekerja dengan baik. Kondisi tersebut dapat disebabkan oleh sejumlah kondisi di bawah ini:\nKonsumsi obat pilek atau obat alergi\nSleep apnea\nHipertensi\nDiabetes\nGangguan elektrolit, seperti kelebihan atau kekurangan kalium, hiperkalemia, dan hipomagnesemia\nGangguan tiroid, misalnya hipertiroidisme\nKelainan katup jantung\nPenyakit jantung bawaan, seperti tetralogy of Fallot\nPenyakit jantung koroner\nSerangan jantung\nKardiomiopati\nTorsade de pointes\n\nSelain kondisi medis, aritmia juga dapat dipicu oleh gaya hidup yang tidak sehat, seperti:\nTidak dapat mengelola stres dengan baik\nKurang tidur\nMerokok\nMengonsumsi minuman beralkohol atau berkafein secara berlebihan\nMenyalahgunakan NAPZA","['Topik: Aritmia, Subtopik: Penyebab Aritmia \n Aritmia terjadi ketika impuls listrik yang berfungsi mengatur detak jantung tidak bekerja dengan baik. Kondisi tersebut dapat disebabkan oleh sejumlah kondisi di bawah ini:\n- Konsumsi obat pilek atau obat alergi\n- Sleep apnea\n- Hipertensi\n- Diabetes\n- Gangguan elektrolit, seperti kelebihan atau kekurangan kalium, hiperkalemia, dan hipomagnesemia\n\n- Gangguan tiroid, misalnya hipertiroidisme\n\n- Kelainan katup jantung\n- Penyakit jantung bawaan, seperti tetralogy of Fallot\n\n- Penyakit jantung koroner\n- Serangan jantung\n- Kardiomiopati\n- Torsade de pointes\nSelain kondisi medis, aritmia juga dapat dipicu oleh gaya hidup yang tidak sehat, seperti:\n- Tidak dapat mengelola stres dengan baik\n- Kurang tidur\n- Merokok\n- Mengonsumsi minuman beralkohol atau berkafein secara berlebihan\n- Menyalahgunakan NAPZA\n', 'Topik: Aritmia, Subtopik: Komplikasi Aritmia \n Pada beberapa kasus, aritmia dapat memburuk dan menyebabkan komplikasi serius, seperti:\n- Demensia\n- Penyakit Alzheimer\n- Stroke\n- Gagal jantung\n- Henti jantung mendadak\n- Kematian mendadak pada bayi (SIDS)\n', 'Topik: Aritmia, Subtopik: Diagnosis Aritmia \n Untuk menentukan apakah pasien menderita aritmia, dokter akan menanyakan gejala yang muncul dan mendengarkan detak jantung pasien. Setelah itu, dokter akan melakukan beberapa pemeriksaan berikut:\n- Elektrokardiogram (EKG), untuk merekam aktivitas listrik jantung dalam kondisi berbaring\n- Holter monitoring, untuk merekam aktivitas listrik jantung ketika pasien beraktivitas selama seharian\n- Uji latih jantung, untuk mengukur aktivitas jantung saat pasien melakukan latihan fisik, seperti mengayuh sepeda statis atau berjalan di atas treadmill\n\n- Echo jantung, untuk melihat struktur dan fungsi jantung dengan bantuan gelombang suara\nDokter juga dapat menjalankan pemeriksaan lain guna melihat kemungkinan adanya penyakit yang mendasari aritmia, yaitu:\n- Pengukuran kadar elektrolit\n- Pengukuran kadar gula darah\n- Pemindaian\n- Katerisasi jantung\n- Biopsi\n']","Penyebab aritmia di antaranya meliputi:\n1. Konsumsi obat pilek atau obat alergi, yang dapat memengaruhi fungsi jantung dan impuls listrik.\n2. Sleep apnea, yaitu penyebab tidur teratur yang buruk yang menyebabkan asupan oksigen menjadi kurang sehingga aritmia bisa timbul.\n3. Hipertensi atau tekanan darah tinggi, yang dapat mempengaruhi fungsi jantung dan kesadaran pasien.\n4. Diabetes, merupakan penyebab gangguan impuls listrik di dalam jantung, seperti aritmia.\n5. Gangguan elektrolit, kelebihan atau kekurangan kalium, hiperkalemia dan hipomagnesemia yang dapat mempengaruhi fungsi jantung dan impuls listrik.\n6. Gangguan tiroid, seperti hipertiroidisme yang dapat menyebabkan aritmia.\n7. Kelainan katup jantung, misalnya stenosis valve atau insufisiensi valve katup jantung.\n8. Penyakit jantung bawaan, contohnya tetralogy of Fallot dan asma kronis.\n9. Penyakit jantung koroner yang dapat menyebabkan aritmia pada beberapa pasien.\n10. Serangan jantung atau infark mukun, yaitu penyakit yang melibatkan pembekuan lemak di dalam jantung dan mempengaruhi fungsi jantung secara signifikan.\n11. Kardiomiopati, termasuk hipertiroidisme atau hipoksiemia miokardium, yaitu penyebab gangguan impuls listrik di dalam jantung yang bisa meningkatkan risiko terjadinya aritmia.","Penyebab penyakit aritmik bervariasi dan tidak semua penyebab ini telah dijelaskan secara komplit. Berikut beberapa penyebab utama dari penyakit aritmogenik:\n\n1. Hipoksia (Keadaan dimana tubuh kekurangan oksigen)\n2. Atletitis (Penggunaan berlebih dan pemaparan terhadap tekanan tinggi di bagian dada yang mengurangi jumlah aliran darah)\n3. Kebiasaan merokok\n4. Obesitas\n5. Asupan stimulan, seperti kafein atau theobromin dari minuman dan makanan beralkohol\n6. Hipertiroidisme (Keadaan dimana tubuh memiliki tingkat racun lebih tinggi daripada yang diinginkan)\n7. Hipotiroidisme (Kurangnya aktivitas thyroid, menyebabkan kurang oksigen dalam sirkulasi darah)\n8. Penyakit jantung khususnya congestive heart failure\n9. TDS (Tumor pencernaan yang membahayakan arteri sistemik)\n10. Obstruksi saluran pernapasan akibat tumor atau infeksi\n11. Penyebab lain termasuk penyakit jaringan, inflamasi, dan genetik seperti Long-QT syndrom atau Brugada syndrome\n\nNamun, ini hanyalah beberapa dari penyebab yang mungkin menyebabkan aritmogenik. Setiap kasus memerlukan pemeriksaan medis dan diagnosa terkini untuk menentukan penyebab tertentu dan cara terbaik untuk mengobahinnya.",0.55,0.6530723247576141,0.9999999999,1.0
Apa alat bantu untuk menangani pasien yang mengalami syok kardiogenik?,"Beberapa alat bantu yang dapat dipasang adalah:\n\nExtracorporeal membrane oxygenation (ECMO), untuk meningkatkan aliran darah dan suplai oksigen ke seluruh tubuh\nPemasangan alat pacu jantung, untuk mengembalikan irama jantung ke dalam kondisi normal","['Topik: Syok Kardiogenik, Subtopik: Pengobatan Syok Kardiogenik: Pengobatan gawat darurat \n Saat penderita syok kardiogenik tiba di IGD, dokter akan melakukan penanganan untuk menstabilkan kondisi penderita, antara lain dengan:\n- Memastikan jalan napas pasien aman dan tidak ada sumbatan\n- Memberikan oksigen tambahan dengan bantuan nasal kanul, masker pernapasan, atau ventilator\n\n- Memberikan cairan dan obat melalui infus\n', 'Topik: Syok Kardiogenik, Subtopik: Pengertian Syok Kardiogenik \n Syok kardiogenik adalah syok yang disebabkan oleh ketidakmampuan jantung untuk memompa darah ke seluruh tubuh. Syok kardiogenik merupakan kondisi yang berbahaya dan perlu mendapatkan penanganan secepatnya.\nBeberapa gejala yang terjadi saat seseorang mengalami syok kardiogenik adalah penurunan tekanan darah, denyut nadi cepat tetapi lemah, sesak napas, ujung kaki dan tangan terasa dingin, hingga penurunan kesadaran.\n\n', 'Topik: Syok Kardiogenik, Subtopik: Pengobatan Syok Kardiogenik: Obat-obatan \n Ada beberapa jenis obat yang dapat diberikan kepada pasien, di antaranya:\n- Agen inotropik, seperti norepinephrine, dopamine, atau dobutamin, untuk meningkatkan fungsi jantung\n- Obat antiplatelet, seperti clopidogrel atau aspirin, untuk mencegah pembentukan gumpalan darah baru\n- Obat antikoagulan, seperti heparin, untuk menurunkan risiko terbentuknya gumpalan darah setelah serangan jantung\n- Obat antiaritmia, untuk mengembalikan irama jantung menjadi lebih teratur\n']","Alat bantu utama yang umum digunakan untuk menangani pasien yang mengalami syok kardiogenik adalah alat vital dan obat-obatan. \n\nDalam hal ini, dokter akan melakukan beberapa tindakan sebagai berikut:\n1. Mengamati dan memastikan bahwa jalan napas pasien aman dan tidak ada sumbatan. (Dari konteks yang diberikan)\n2. Memberikan oksigen tambahan melalui nasal kanul, masker pernapasan, atau ventilator untuk meningkatkan kadar oksigen dalam sirkulasi darah pasien dan mengatasi penyumbatan asidosis. (Dari konteks yang diberikan)\n3. Memberikan cairan dan obat melalui infus, seperti agen inotropik untuk meningkatkan kontraksi jantung atau antiarrhythmia untuk mengembalikan ritme jantung ke normal. (Berdasarkan konteks yang diberikan)\n4. Menggunakan elektrokaustik untuk mencegah fibrilasi ventrikular dan mengembalikan ritme jantung ke stabil. (Berdasarkan konteks yang diberikan)","Alat bantu utama dalam menangani pasien yang mengalami syok kardiogenik termasuk alat pengganti ginjal, pengobatan intravenous (IV), dan perawatan medis ekstensif. Penting untuk segera memberikan obat antihipertensi seperti adrenalin atau noradrenalin, mengatur denyut jantung dengan defibrilator atau zokin, serta memastikan pasien tetap teratur nafas dan mendapatkan oksigen yang cukup. Selain itu, penanganan medis lebih lanjut seperti reanimasi dada juga harus siap untuk menghindari kerugian jasmanat pada saat ini yang sangat serius.",0.6,0.5654970436945965,0.0,0.0
Apa saja hal yang dapat meningkatkan risiko seseorang mengalami syok kardiogenik?,"Selain penyakit dan kondisi yang disebutkan di atas, sejumlah faktor berikut juga bisa meningkatkan risiko seseorang mengalami syok kardiogenik:\n\nBerusia lebih dari 75 tahun\nMenderita gagal jantung\nMenderita diabetes, sepsis, atau pneumothorax\nMenderita berat badan berlebih atau obesitas\nPernah terkena serangan jantung\nPernah menjalani operasi bypass jantung","['Topik: Syok Kardiogenik, Subtopik: Faktor risiko syok kardiogenik \n Selain penyakit dan kondisi yang disebutkan di atas, sejumlah faktor berikut juga bisa meningkatkan risiko seseorang mengalami syok kardiogenik:\nBerusia lebih dari 75 tahun\n- Menderita gagal jantung\n\n- Menderita diabetes, sepsis, atau pneumothorax\n\n- Menderita berat badan berlebih atau obesitas\n\n- Pernah terkena serangan jantung\n- Pernah menjalani operasi bypass jantung\n\n', 'Topik: Syok Kardiogenik, Subtopik: Gejala Syok Kardiogenik: Kapan harus ke dokter \n Segera bawa ke IGD rumah sakit terdekat jika ada seseorang di sekitar Anda yang mengalami gejala seperti di atas, terlebih bila disertai dengan penurunan kesadaran. Syok kardiogenik bisa memburuk dalam waktu yang cepat dan mengancam nyawa sehingga pasien perlu mendapatkan penanganan secepatnya.\nJika Anda memiliki penyakit atau kondisi medis yang dapat meningkatkan risiko terjadinya syok kardiogenik, lakukan pemeriksaan berkala sesuai anjuran dokter.\n', 'Topik: Syok Kardiogenik, Subtopik: Pengertian Syok Kardiogenik \n Syok kardiogenik adalah syok yang disebabkan oleh ketidakmampuan jantung untuk memompa darah ke seluruh tubuh. Syok kardiogenik merupakan kondisi yang berbahaya dan perlu mendapatkan penanganan secepatnya.\nBeberapa gejala yang terjadi saat seseorang mengalami syok kardiogenik adalah penurunan tekanan darah, denyut nadi cepat tetapi lemah, sesak napas, ujung kaki dan tangan terasa dingin, hingga penurunan kesadaran.\n\n']","Hal-hal yang dapat meningkatkan risiko seseorang mengalami syok kardiogenik, selain penyakit dan kondisi yang disebutkan dalam konteks tersebut, termasuk:\n\n1. Berusia lebih dari 75 tahun, yang menunjukkan ketidakmampuan jantung untuk berfungsi secara efektif.\n2. Penyakit gagal jantung, dimana jantung kurang mampu mengeluarkan aliran darah dengan cukup sehingga menyebabkan penurunan sistemik kesadaran dan gejala syok.\n3. Diabetes, yang mempengaruhi fungsi hati dan bisa meningkatkan risiko terjadinya komplikasi seperti syok kardiogenik.\n4. Sepsis, yaitu infeksi di dalam tubuh yang melekat pada darah dan menyebabkan sistem sirkulasi mengalami gangguan.\n5. Pneumothorax, yaitu kekurangan tekanan udara di dalam paru-paru yang bisa menurunkan tekanan darah dan menyebabkan syok kardiogenik.\n6. Berat badan berlebih atau obesitas, yang dapat mengganggu fungsi jantung dan sistem sirkulasi.\n7. Pernyakitan terdahulu, seperti serangan jantung, yang menunjukkan bahwa seseorang mungkin lebih rentan terhadap gangguan kardiovaskuler.\n8. Pemakaian obat-obatan atau tindakan medis lainnya, seperti pembedahan bypass jantung, yang bisa mempengaruhi sistem sirkulasi dan meningkatkan risiko syok kardiogenik.","Hal-hal yang dapat meningkatkan risiko seseorang mengalami syok kardiogenik termasuk faktor riwayat penyakit jantung pada keluarga, hipertensi, asidosis metabolis, dan poliuria. Faktor lain yang mempengaruhi risiko ini antara lain usia, kebiasaan merokok, serta faktor genetik.",0.1111111111111111,0.5893753267387088,0.99999999995,1.0
Apa gejala dari penyakit kardiomiopati?,"Kardiomiopati atau lemah jantung pada awalnya jarang menimbulkan gejala. Gejalanya akan muncul dan berkembang seiring dengan menurunnya kerja jantung dalam memompa darah.\n\nBeberapa gejala yang bisa muncul adalah:\n\nNapas pendek, terutama setelah melakukan aktivitas fisik yang berat\nTungkai membengkak (edema tungkai)\nBatuk terutama saat tidur telentang\nTubuh mudah lelah\nPerut kembung\nNyeri dada\nPenglihatan berkunang-kunang\nJantung berdebar-debar (palpitasi)\nDenyut jantung tidak teratur (aritmia)\nPusing dan pingsan","['Topik: Kardiomiopati, Subtopik: Gejala Kardiomiopati \n Kardiomiopati atau lemah jantung pada awalnya jarang menimbulkan gejala. Gejalanya akan muncul dan berkembang seiring dengan menurunnya kerja jantung dalam memompa darah.\nBeberapa gejala yang bisa muncul adalah:\n- Napas pendek, terutama setelah melakukan aktivitas fisik yang berat\n- Tungkai membengkak (edema tungkai)\n- Batuk terutama saat tidur telentang\n- Tubuh mudah lelah\n- Perut kembung\n- Nyeri dada\n- Penglihatan berkunang-kunang\n- Jantung berdebar-debar (palpitasi)\n- Denyut jantung tidak teratur (aritmia)\n- Pusing dan pingsan\n\n', 'Topik: Kardiomiopati, Subtopik: Pengertian Kardiomiopati \n Kardiomiopati adalah penyakit akibat kelainan di otot jantung. Penyakit ini ditandai dengan melemahnya kemampuan jantung untuk memompa darah. Gejala kardiomiopati bisa bervariasi, mulai dari tubuh mudah lelah, napas pendek, pusing, hingga nyeri dada.\nPenyebab kardiomiopati sering kali tidak diketahui dengan pasti. Namun, kondisi ini bisa terkait dengan kelainan genetik atau penyakit tertentu. Penyakit yang sering memicu terjadinya kardiomiopati pada orang dewasa adalah hipertensi kronis, yaitu tekanan darah tinggi yang sudah berlangsung lama.\n\n', 'Topik: Kardiomiopati, Subtopik: Gejala Kardiomiopati: Kapan harus ke dokter \n Lakukan pemeriksaan ke dokter jika Anda mengalami gejala seperti yang telah disebutkan di atas. Jika Anda merasakan keluhan sulit bernapas, nyeri dada, sakit kepala, atau seperti akan pingsan, segera pergi ke IGD rumah sakit terdekat untuk mendapatkan pertolongan gawat darurat.\nJika Anda memiliki faktor yang bisa meningkatkan risiko terkena kardiomiopati, seperti hipertensi, lakukan pemeriksaan berkala ke dokter untuk mencegah terjadinya kardiomiopati.\n']","Gejala dari penyakat kardiomiopati yang umum termasuk dalam konteks yang diberikan adalah sebagai berikut:\n\n1. Napas pendek, terutama setelah melakukan aktivitas fisik yang berat.\n2. Tungkai membengkak (edema tungkai).\n3. Batuk terutama saat tidur telentang.\n4. Tubuh mudah lelah.\n5. Perut kembung.\n6. Nyeri dada, termasuk sering merasa nyeri di belakang lubang nafas atau di bagian pinggul jantung.\n7. Penglihatan berkunang-kunang.\n8. Jantung berdebar-debar (palpitasi).\n9. Denyut jantung tidak teratur (aritmia).\n10. Pusing dan pingsan.\n\nGejala ini biasanya muncul sebagai akibat penurunan kapasitas jantung untuk memompa darah, yang bisa meningkat secara bertahap atau dengan cepat terutama ketika jantung telah mengalami beban lebih dalam jumlah waktu.\n\nUntuk mengidentifikasi dan segera menangani gejala kardiomiopati, sangat penting untuk memiliki pola nalar yang cepat terhadap perubahan tubuh serta melakukan pemeriksaan medis dengan cepat jika mengalami gejala yang disukai seperti napas pendek atau nyeri dada.","Gejala dari penyakit kardiomiopati bermacam-macam tergantung pada jenis kardiomiopati yang dimiliki. Namun, beberapa gejala umum termasuk dalam penyakit ini antara lain:\n\n1. Sakit di dada atau perut\n2. Pusingan dan kehilangan daya dukung\n3. Bermiring badan\n4. Sesak nafas, bahaya alis bernafas, atau nyeri ketiak\n5. Gejala yang bergegas seperti angin menetes saat sedang tidur (nyeri malam)\n6. Kurang aman dan kehilangan perasaan dingin pada kaki atau tangan\n7. Sesak nafas, bahaya alis bernafas, atau efek sosok yang aneh di belakang tulang belakang\n8. Efek fisis lain seperti cedera jantung dan penurunan tekanan darah rendah.\n\nNamun, ini bukan daftar lengkap gejala kardiomiopati. Setiap orang mungkin mengalami gejala yang berbeda-beda, serta beberapa gejala bisa mirip dengan gejala penyakit lainnya. Jadi, jika Anda atau seseorang Anda mengalami gejala ini, segera hubungi dokter untuk mendapatkan diagnosis dan pengobatan yang tepat.",0.9333333333333333,0.6291189468884985,0.9999999999666667,1.0
Apa saja komplikasi yang dapat ditimbulkan dari penyakit kardiomiopati?,Kardiomiopati dapat menyebabkan komplikasi serius jika tidak segera terdiagnosis dan ditangani dengan baik. Beberapa komplikasi yang dapat timbul adalah:\n\nGagal jantung\nPenggumpalan darah\nGangguan katup jantung\nHenti jantung dan kematian mendadak,"['Topik: Kardiomiopati, Subtopik: Komplikasi Kardiomiopati \n Kardiomiopati dapat menyebabkan komplikasi serius jika tidak segera terdiagnosis dan ditangani dengan baik. Beberapa komplikasi yang dapat timbul adalah:\n- Gagal jantung\n- Penggumpalan darah\n- Gangguan katup jantung\n- Henti jantung dan kematian mendadak\n', 'Topik: Kardiomiopati, Subtopik: Pengertian Kardiomiopati \n Kardiomiopati adalah penyakit akibat kelainan di otot jantung. Penyakit ini ditandai dengan melemahnya kemampuan jantung untuk memompa darah. Gejala kardiomiopati bisa bervariasi, mulai dari tubuh mudah lelah, napas pendek, pusing, hingga nyeri dada.\nPenyebab kardiomiopati sering kali tidak diketahui dengan pasti. Namun, kondisi ini bisa terkait dengan kelainan genetik atau penyakit tertentu. Penyakit yang sering memicu terjadinya kardiomiopati pada orang dewasa adalah hipertensi kronis, yaitu tekanan darah tinggi yang sudah berlangsung lama.\n\n', 'Topik: Kardiomiopati, Subtopik: Faktor risiko kardiomiopati \n Ada beberapa hal yang dapat meningkatkan risiko kardiomiopati, yaitu:\n- Memiliki keluarga dengan riwayat kardiomiopati\n- Menderita berat badan berlebih atau obesitas\n- Menderita hipertensi kronis\n- Memiliki riwayat serangan jantung, penyakit jantung koroner, atau infeksi jantung\n- Menderita penyakit tiroid atau diabetes\n\n- Mengalami kekurangan vitamin dan mineral\n- Memiliki riwayat kemoterapi atau radioterapi\n- Memiliki riwayat penyakit hemokromatosis, amiloidosis, atau sarkoidosis\n\n- Memiliki kebiasaan mengonsumsi minuman beralkohol secara berlebihan\n- Menyalahgunakan obat-obatan tertentu, seperti kokain, amfetamin, dan steroid\n\n']","Komplikasi yang dapat timbul dari penyakit kardiomiopati, seperti yang dijelaskan dalam konteks tersebut, termasuk:\n\n1. Gagal jantung: Kardiomiopati bisa menyebabkan kerusakan pada jantung hingga akhirikah jantung tidak dapat bekerja efisien untuk memompa darah sebagaimana mestinya, yang disebut gagal jantung.\n\n2. Penggumpalan darah: Karena penyebab kardiomiopati bervariasi dan bisa meningkat risiko terjadinya penggumpalan darah, termasuk hipertensi atau gangguan lain di jantung.\n\n3. Gangguan katup jantung: Kardiomiopati yang berat bisa menyebabkan kerusakan katup jantung, yang dapat memicu penyakit lain seperti infeksi jantung atau penyumbatan darah ke jantung.\n\n4. Henti jantung dan kematian mendadak: Kardiomiopati yang tidak terdiagnosis atau tidak diatasi dengan baik bisa meningkatkan risiko henti jantung dan bahkan kematian, terutama dalam skala waktu singkat.\n\nHal ini memberikan gambaran tentang komplikasi serius yang berkaitan dengan penyakit kardiomiopati dan pentingnya mendapat pemahaman awal dan penatalaksanaan serius untuk mencegahnya.","Komplikasi dari penyakit kardiomiopati berkaitan dengan tiga jenis jantung, yaitu jantung yang membuld霸k atrioventrikuler (KARDIOFI), jantung normal, dan jantung hipertrofi ventrikel. Berikut ini beberapa komplikasi umumnya:\n\n1. Penyempitan pembuluh darah: Penyempitan pada pembuluh darah yang mengalir keluar dari jantung atau ke jantung bisa menyebabkan masalah seperti stroke, angina inangina pectoris, dan gangguan aliran darah pada pasien dekompen.\n2. Hipertensi: Peningkatan tekanan darah tinggi yang disebabkan oleh penyempitan arteri dapat menyebabkan organ lain dalam tubuh mengalami beban, seperti hati, ginjal, dan jantung itu sendiri.\n3. Hiperkapsie: Peningkatan kapasitas ventrikel di mana ventrikel mengecil karena tekanan yang terlalu tinggi dalam ventrikel.\n4. Gangguan aritmik: Masalah ritme jantung seperti tahanan fibrilasi atau disartrofia auricular posterior dapat menyebabkan gangguan fungsi jantung dan penurunan kualitas hidup pasien.\n5. Penyusutan fungsi jantung: Kondisi dimana jantung tidak bekerja secara efisien, yang dapat menyebabkan gejala seperti langkah perlahan, dehidrasi, dan kesulitan beraktivitas.\n6. Hipovolemia: Ketika pasien kehilangan banyak cairan atau darah, ini bisa memperburuk fungsi jantung dan menyebabkan penurunan tekanan darah serta gejala yang lebih parah seperti ketacatan, dehidrasi, dan kerusakan organ.\n7. Penyakit pada ginjal: Gangguan aritmik, hipovolemia, dan gangguan aliran darah bisa menyebabkan penyakit pada ginjal karena fluktuasi tekanan darah yang tidak stabil atau cairan.\n8. Penyakit paru-paru: Kondisi ini dapat disebabkan oleh beban jantung tinggi dan mengganggu fungsi paru, menyebabkan gatalan napas, demam, serta gejala lain yang berkaitan dengan napas.\n\nKomplikasi lainnya termasuk stroke, angina inangina pectoris, gangguan aliran darah di jantung (seperti disekusi), hipertensi, dan penurunan kapasitas fungsional ventrikel kiri atau kanan.\n\nSemua komplikasi ini bisa memperburuk kualitas hidup pasien dengan penyebab yang berbeda-beda termasuk genetik, infeksi, dan penyakit lain seperti diabetes dan asam urat.",0.7222222222222222,0.798723958763227,0.9999999999,1.0
Apa saja gejala umum yang dialami oleh seseorang dengan penyakit katup jantung?,"Umumnya, penyakit katup jantung memunculkan gejala-gejala di bawah ini:\n\nNyeri dada saat beraktivitas\nJantung berdebar atau berdetak tidak beraturan (aritmia)\nSesak napas\nTubuh lebih mudah lelah\nPusing\nPingsan\nPembengkakan (edema) di bagian kaki, pergelangan kaki,  perut, atau pembuluh darah di leher\nBatuk darah\nGejala penyakit katup jantung bisa berbeda-beda pada setiap penderita, tergantung pada jenis gangguan katup jantung yang dialami dan tingkat keparahannya. Gejala bisa muncul secara perlahan atau bisa juga secara tiba-tiba dan berkembang sangat cepat.","['Topik: Penyakit Katup Jantung, Subtopik: Gejala Penyakit Katup Jantung \n Katup jantung berperan untuk menjaga kelancaran aliran darah yang ada di dalam jantung dan keluar dari jantung. Katup jantung bekerja tiap kali jantung berdetak. Bunyi  lup-dup  jantung berasal dari suara katup yang sedang menutup setelah menyalurkan darah.\nKetika terjadi gangguan pada katup jantung, biasanya dokter akan menemukan tanda khas berikut: \n- Murmur jantung atau bunyi bising pada jantung  \n\n- Tekanan darah rendah atau tekanan darah tinggi\nPenderita penyakit katup jantung umumnya tidak merasakan gejala khas. Akan tetapi, ia dapat mengalami beberapa gejala akibat aliran darah terhambat sehingga jantung perlu bekerja lebih keras.\nUmumnya, penyakit katup jantung memunculkan gejala-gejala di bawah ini:\n- Nyeri dada saat beraktivitas\n- Jantung berdebar atau berdetak tidak beraturan (aritmia)\n- Sesak napas\n- Tubuh lebih mudah lelah\n- Pusing\n- Pingsan\n- Pembengkakan (edema) di bagian kaki, pergelangan kaki,  perut, atau pembuluh darah di leher\n- Batuk darah\nGejala penyakit katup jantung bisa berbeda-beda pada setiap penderita, tergantung pada jenis gangguan katup jantung yang dialami dan tingkat keparahannya. Gejala bisa muncul secara perlahan atau bisa juga secara tiba-tiba dan berkembang sangat cepat.\n', 'Topik: Penyakit Katup Jantung, Subtopik: Pengertian Penyakit Katup Jantung \n Penyakit katup jantung adalah kondisi ketika katup jantung tidak dapat membuka dan menutup dengan sempurna. Kondisi ini menyebabkan aliran darah di dalam jantung dan yang keluar dari jantung tidak lancar. Penyakit katup jantung dapat ditandai dengan suara jantung yang tidak normal, nyeri dada, pusing, dan sesak napas.\nKatup jantung atau klep jantung merupakan bagian jantung yang berfungsi seperti pintu satu arah. Tugasnya adalah sebagai pintu yang mengalirkan darah dari satu ruang jantung ke ruang lain. Katup jantung juga mengalirkan darah dari jantung ke pembuluh darah yang akan menuju seluruh tubuh.\n\nGangguan pada satu atau beberapa katup jantung dapat berpengaruh dalam fungsi jantung dalam mengalirkan darah dan oksigen ke seluruh tubuh. Berkurangnya distribusi oksigen ke jaringan tubuh (hipoksemia) dapat menyebabkan kerusakan pada berbagai organ tubuh dan mengakibatkan komplikasi yang fatal.\n', 'Topik: Penyakit Katup Jantung, Subtopik: Gejala Penyakit Katup Jantung: Kapan harus ke dokter \n Segera periksakan diri ke dokter jika Anda mengalami gejala-gejala di atas agar mendapatkan pemeriksaan dan penanganan yang tepat. Makin cepat penyakit katup jantung ditangani, peluang kondisi ini membaik akan lebih besar.\n']","Gejala umum yang dialami oleh seseorang dengan penyakit katup jantung, berdasarkan informasi yang diberikan, termasuk:\n\n1. Murmur jantung atau bunyi bising pada jantung - suara katup yang sedang menutup setelah menyalurkan darah.\n2. Nyeri dada saat beraktivitas - kadang-kadang disertai dengan murmur jantung, terutama jika aliran darah ke otak terhambat.\n3. Jantung berdebar atau aritmia - detak jantung yang tidak stabil dan tak teratur.\n4. Sesak napas - karena pengaruh tekanan darah rendah, tubuh kurang merawat paru-paru dengan cukup oksigen.\n5. Tubuh lebih mudah lelah - akibat beban yang ditimbulkan oleh jantung yang bekerja lebih keras untuk mengalirkan darah.\n6. Pusing dan pingsan - disebabkan oleh gangguan oksigenasi tubuh.\n7. Penderita mungkin terkena pembengkakan (edema) di bagian kaki, pergelangan kaki, perut, atau pembulus darah di leher - aliran darah yang tidak lancar dapat menyebabkan penumpukan cairan.\n8. Batuk darah - disertai oleh edema paru-paru jika batas tekanan darah rendah dan aritmia terus berlanggan.\n\nGejala ini bisa muncul secara perlahan atau secara tiba-tiba, bergantung pada jenis gangguan katup jantung dan tingkat keparahan penyakitnya.","Gejala umum yang mungkin timbul akibat penyakit atau disfungsi katup jantung termasuk perdarahan pada tempat operasi, rasa gatal di area luka, gejala lainnya seperti pilek dan pergelangan tangan, serta kesulitan untuk menyerap makanan. Selain itu, beberapa orang dapat mengalami sesak nafas atau edem pada kedua lengan. Juga penting untuk mencatat bahwa gejala ini bervariasi dan tidak semua pasien akan mengalami semua gejala tersebut secara signifikan.",0.6,0.819349319270693,0.9999999999666667,1.0
Bagaimana cara mencegah penyakit katup jantung?,"Penyakit katup jantung dapat dicegah dengan menangani penyakit atau infeksi yang berisiko menyebabkan masalah pada katup jantung, di antaranya:\n\nMengobati infeksi streptokokus sedini mungkin agar tidak berkembang menjadi demam reumatik, yang dapat meningkatkan risiko terjadinya penyakit katup jantung\nMengobati endokarditis sedini mungkin\nMenerapkan kebersihan gigi dan mulut, untuk mencegah infeksi pemicu penyakit katup jantung \nMengonsumsi obat dan kontrol secara rutin jika memiliki penyakit kronis yang dapat meningkatkan risiko terjadinya kerusakan katup jantung, seperti hipertensi, penyakit jantung koroner, penyakit autoimun, atau diabetes\nBagi orang yang pernah mengalami penyakit katup jantung, terapkan gaya hidup sehat berikut untuk mencegah kondisi ini memburuk:\n\nMengonsumsi makanan bergizi yang rendah akan kolesterol dan lemak tak jenuh, misalnya sayur, buah, ikan, gandum utuh, dan minyak zaitun\nBerolahraga rutin, setidaknya 30 menit setiap hari\nBerhenti merokok\nTidur cukup setiap hari atau melakukan konsultasi online dengan dokter jika sulit tidur\nMelakukan pemeriksaan tekanan darah, fungsi jantung, kadar kolesterol darah, serta kadar gula darah secara rutin dengan dokter","['Topik: Penyakit Katup Jantung, Subtopik: Pencegahan Penyakit Katup Jantung \n Penyakit katup jantung dapat dicegah dengan menangani penyakit atau infeksi yang berisiko menyebabkan masalah pada katup jantung, di antaranya:\n- Mengobati infeksi streptokokus sedini mungkin agar tidak berkembang menjadi demam reumatik, yang dapat meningkatkan risiko terjadinya penyakit katup jantung\n\n- Mengobati endokarditis sedini mungkin\n\n- Menerapkan kebersihan gigi dan mulut, untuk mencegah infeksi pemicu penyakit katup jantung \n- Mengonsumsi obat dan kontrol secara rutin jika memiliki penyakit kronis yang dapat meningkatkan risiko terjadinya kerusakan katup jantung, seperti hipertensi, penyakit jantung koroner, penyakit autoimun, atau diabetes\nBagi orang yang pernah mengalami penyakit katup jantung, terapkan gaya hidup sehat berikut untuk mencegah kondisi ini memburuk:\n- Mengonsumsi makanan bergizi yang rendah akan kolesterol dan lemak tak jenuh, misalnya sayur, buah, ikan, gandum utuh, dan minyak zaitun\n- Berolahraga rutin, setidaknya 30 menit setiap hari\n- Berhenti merokok\n- Tidur cukup setiap hari atau melakukan konsultasi online dengan dokter jika sulit tidur\n\n- Melakukan pemeriksaan tekanan darah, fungsi jantung, kadar kolesterol darah, serta kadar gula darah secara rutin dengan dokter\n', 'Topik: Penyakit Katup Jantung, Subtopik: Pengobatan Penyakit Katup Jantung: Obat-obatan \n Obat-obatan yang diberikan dokter bertujuan untuk untuk meredakan keluhan akibat penyakit katup jantung. Obat tersebut antara lain:\n- Diuretik, yang berfungsi untuk mengeluarkan cairan dari dalam aliran darah dan jaringan tubuh sehingga beban jantung dapat berkurang\n- Beta blockers, seperti bisoprolol (Bisovell atau Hapsen), yang berfungsi untuk menurunkan tekanan darah dan meringankan kerja jantung dengan cara membuat jantung berdetak lebih lambat\n\n- Antiaritmia, seperti amiodarone (Cordarone atau Kendaron), yang berfungsi untuk mengontrol gangguan irama jantung\n\n- ACE inhibitors, seperti ramipril, yang berfungsi untuk mengurangi beban kerja jantung dan menjaga bentuk otot jantung\n\n- Vasodilators, seperti nitrogliserin, (Nitrokaf Retard atau Nitral), yang berfungsi untuk meringankan kerja jantung dan menjaga supaya aliran darah tidak berbalik kembali\n\nJika kadar kolesterol pasien sangat tinggi, dokter mungkin juga akan memberikan obat penurun kolesterol dan menyarankan pasien untuk menerapkan pola makan yang sehat. Hal ini penting untuk mencegah terjadinya penyakit jantung lain, seperti penyakit jantung koroner, yang dapat memperburuk gejala penyakit katup jantung.\n', 'Topik: Penyakit Katup Jantung, Subtopik: Pengobatan Penyakit Katup Jantung \n Penanganan penyakit katup jantung disesuaikan dengan tingkat keparahannya. Umumnya, dokter akan menyarankan pasien untuk menerapkan gaya hidup sehat, seperti tidak merokok, mengonsumsi makanan yang baik untuk jantung, mengelola stres dengan baik, dan beristirahat yang cukup.\nSetelah itu, dokter juga dapat memberikan tindakan medis, seperti:\n']","Untuk mencegah penyakat katup jantung, sangatlah penting untuk menangani infeksi atau penyakit lain yang berisiko memicu masalah pada katup jantung. Berikut cara-cara umum untuk mengurangi risiko terjadinya penyakit katup jantung:\n\n1. Mengobati infeksi streptokokus secepat mungkin, khususnya pada anggota keluarga dengan demam reumatik yang memiliki risiko tinggi terkena penyakit katup jantung.\n2. Mengobati endokarditis (infeksi hati) secepat mungkin untuk mengurangi resiko timbulnya masalah katup jantung akibat infeksi ini.\n3. Menerapkan kebersihan gigi dan mulut dengan baik, yang dapat membantu mencegah penyakit infeksi yang bisa merugikan katup jantung.\n4. Mengonsumsi obat dan kontrol secara rutin oleh mereka yang memiliki penyakit lain seperti hipertensi, penyakit jantung koroner, penyakit autoimun, atau diabetes untuk mencegah kerusakan katup jantung.\n5. Mengadopsi gaya hidup sehat dan tetap merokok yang dapat menurunkan risiko timbulnya penyakit katup jantung.","Salah satu cara untuk mencegah penyakit katup jantung adalah dengan mengendalikan faktor-faktor risiko seperti diabetes, hipertensi, dan kolesterol dalam darah. Mengurangi asupan makanan yang tinggi lemak, menjaga berat badan ideal, serta menghindari merokok dan minum alkohol juga dapat membantu mencegah penyakit jantung. Selain itu, rutinitas kesihatan umum termasuk pemeriksaan jantung secara berkala juga penting untuk menangani masalah yang sebelumnya tidak terlihat.",1.0,0.5120877690046751,0.9999999999666667,1.0
Apa saja hal yang dapat menyebabkan jantung berdebar?,"Jantung berdebar tidak selalu akibat penyakit pada jantung. Berikut adalah beberapa kondisi dan penyakit yang dapat menimbulkan keluhan jantung berdebar kencang:\n\n1. Gaya hidup, seperti:\nKebiasaan merokok\nTidur yang tidak cukup\nLatihan fisik yang berat\nEfek konsumsi minuman beralkohol\nKonsumsi minuman berkafein seperti kopi, teh, dan minuman berenergi\nPenyalahgunaan NAPZA, seperti amfetamin, ekstasi, kokain, atau ganja\nPola makan tinggi gula dan lemak\n\n2. Faktor psikologis, misalnya:\nStres atau gelisah\nSerangan panik\nCemas atau takut luar biasa\n\n3. Obat-obatan, antara lain:\nObat asma\nObat tekanan darah tinggi (antihipertensi)\nAntihistamin\nAntidepresan\nObat flu, contohnya obat yang mengandung phenylephrine\n\n4. Perubahan hormon, misalnya pada masa:\nMenstruasi\nKehamilan\nMenopause\n\n5. Gangguan irama jantung atau aritmia, meliputi:\nFibrilasi atrium\nAtrial flutter\nTakikardia ventrikular\nTakikardia supraventrikular\n\n6. Penyakit jantung, antara lain:\nGagal jantung\nPenyakit jantung bawaan\nKardiomiopati\nPenyakit katup jantung\n\n7. Penyakit atau kondisi tertentu, seperti:\nDehidrasi\nDemam di atas 38 derajat Celcius\nHipertiroidisme\nAnemia\nPheochromocytoma\nHipotensi ortostatik\nKadar gula darah rendah (hipoglikemia)","['Topik: Jantung Berdebar, Subtopik: Penyebab Jantung Berdebar \n Jantung berdebar tidak selalu akibat penyakit pada jantung. Berikut adalah beberapa kondisi dan penyakit yang dapat menimbulkan keluhan jantung berdebar kencang:\n1. Gaya hidup, seperti:\n- Kebiasaan merokok\n\n- Tidur yang tidak cukup\n- Latihan fisik yang berat\n- Efek konsumsi minuman beralkohol\n- Konsumsi minuman berkafein seperti kopi, teh, dan minuman berenergi\n- Penyalahgunaan NAPZA, seperti amfetamin, ekstasi, kokain, atau ganja\n- Pola makan tinggi gula dan lemak\n2. Faktor psikologis, misalnya:\n- Stres atau gelisah\n- Serangan panik\n- Cemas atau takut luar biasa\n3. Obat-obatan, antara lain:\n- Obat asma\n- Obat tekanan darah tinggi (antihipertensi)\n- Antihistamin\n- Antidepresan\n- Obat flu, contohnya obat yang mengandung phenylephrine\n\n4. Perubahan hormon, misalnya pada masa:\n- Menstruasi\n- Kehamilan\n- Menopause\n5. Gangguan irama jantung atau aritmia, meliputi:\n- Fibrilasi atrium\n- Atrial flutter \n- Takikardia ventrikular\n- Takikardia supraventrikular\n6. Penyakit jantung, antara lain:\n- Gagal jantung\n- Penyakit jantung bawaan\n- Kardiomiopati\n- Penyakit katup jantung\n7. Penyakit atau kondisi tertentu, seperti:\n- Dehidrasi\n- Demam di atas 38 derajat Celcius\n- Hipertiroidisme\n- Anemia\n- Pheochromocytoma\n- Hipotensi ortostatik\n- Kadar gula darah rendah (hipoglikemia)\n', 'Topik: Jantung Berdebar, Subtopik: Diagnosis Jantung Berdebar \n Untuk memulai diagnosis, dokter akan melakukan tanya jawab terkait gejala pada pasien yang dapat menandakan gangguan pada jantung. Meski tidak semua kasus jantung berdebar disebabkan oleh gangguan jantung, pemeriksaan perlu dilakukan untuk mencegah komplikasi yang mungkin terjadi akibat gangguan jantung.\nDokter juga akan menanyakan gejala lain yang mungkin menyertai jantung berdebar. Tujuannya adalah untuk mendeteksi kondisi lain yang dapat menyebabkan jantung berdebar, seperti gangguan kelenjar tiroid. Dokter juga akan bertanya tentang aktivitas fisik, tingkat stres, obat yang sedang digunakan, dan riwayat kesehatan pasien.\nSetelah itu, dokter akan melakukan pemeriksaan fisik menyeluruh, termasuk mengukur tekanan darah, suhu tubuh, dan nadi pasien. Dokter juga akan melakukan pemeriksaan yang spesifik, seperti mendengarkan suara jantung pasien menggunakan stetoskop, dan merasakan bagian depan leher untuk memeriksa kelenjar tiroid.\nSelanjutnya, dokter akan melakukan pemeriksaan penunjang untuk memastikan diagnosis. Umumnya, pemeriksaan awal yang dilakukan adalah elektrokardiografi (EKG). Namun, karena jantung berdebar umumnya hilang timbul, EKG mungkin tidak selalu dapat menangkap kelainan pada jantung.\nJika palpitasi dicurigai berasal dari gangguan jantung, pasien akan dirujuk ke dokter jantung untuk menjalani pemeriksaan berikut:\n- Monitor aktivitas listrik jantung selama 24  48 jam dengan alat khusus (Holter monitor)\n- USG jantung atau ekokardiografi\n- Elektrofisiologi jantung\n- MRI jantung\n- Angiografi koroner\nJika hasil pemeriksaan jantung tidak menunjukkan adanya kelainan, pemeriksaan lain dapat dilakukan untuk mendeteksi penyebab jantung berdebar. Beberapa pemeriksaan tersebut adalah:\n- Pemeriksaan darah lengkap, untuk mendeteksi anemia\n- Pemeriksaan hormon, untuk mendeteksi hipertiroidisme atau pheochromocytoma\n\n- Tes urine, untuk mendeteksi penggunaan obat terlarang\n- Tes kehamilan\n', 'Topik: Jantung Berdebar, Subtopik: Pengobatan Jantung Berdebar \n Pengobatan jantung berdebar tergantung pada penyebabnya. Bagi pasien yang menderita penyakit tertentu, misalnya aritmia, gagal jantung, atau hipertiroidisme, dokter akan merujuk pasien ke dokter spesialis terkait untuk menjalani terapi yang spesifik.\nJika diperlukan, dokter akan meresepkan obat jantung berdebar berupa penghambat beta (beta blocker) atau antagonis kalsium (calcium channel blocker) untuk meredakan jantung berdebar. Pada jantung berdebar yang disebabkan oleh gangguan induksi listrik jantung, dokter akan mempertimbangkan operasi ablasi jantung untuk meredakan jantung berdebar.\nSedangkan pada jantung berdebar yang disebabkan oleh gaya hidup tidak sehat, seperti merokok atau mengonsumsi terlalu banyak minuman berkafein, pasien akan disarankan untuk memperbaiki gaya hidupnya menjadi lebih sehat, misalnya dengan berolahraga.\nPada pasien yang mengalami jantung berdebar akibat penggunaan obat-obatan, dianjurkan untuk berkonsultasi dengan dokter yang memberikan obat tersebut. Tidak disarankan berhenti mengonsumsi obat tanpa persetujuan dokter.\nSementara itu, untuk jantung berdebar yang dipicu oleh faktor psikologis dan disertai gejala gelisah dan jantung berdebar, dokter bisa menyarankan pasien mencoba teknik relaksasi sederhana untuk meredakan serangan panik dan rasa cemas. Bila perlu, pasien akan dirujuk ke psikolog atau psikiater agar kondisi mental yang dialami pasien dapat ditangani.\n']","Hal-hal yang dapat menyebabkan jantung berdebar meliputi:\n\n1. Gaya hidup, seperti:\n   - Kebiasaan meroket\n   - Tidur yang tidak cukup\n   - Latihan fisik yang berat\n   - Efek konsumsi minuman beralkohol\n   - Konsumsi minuman berkafein seperti kopi, teh, dan minuman berenergi\n   - Penyalahgunaan NAPZA (narkoba raksasa)\n   - Pola makan tinggi gula dan lemak\n2. Faktor psikologis, misalnya:\n   - Stres atau gelisah\n   - Serangan panik\n   - Cemas atau takut luar biasa\n3. Obat-obatan, antara lain:\n   - Obat asma\n   - Obat tekanan darah tinggi (antihipertensi)\n   - Antihistamin\n   - Antidepresan\n   - Obat flu, contohnya obat yang mengandung phenylephrine\n4. Perubahan hormon, misalnya pada masa:\n   - Menstruasi\n   - Kehamilan\n   - Menopause\n5. Gangguan irama jantung atau aritmia, meliputi:\n   - Fibrilasi atrium\n   - Atrial flutter\n   - Takikardia ventrikular\n   - Takikardia supraventrikular\n6. Penyakit jantung, antara lain:\n   - Gagal jantung\n   - Penyakit jantung bawaan\n   - Kardiomiopati\n   - Penyakit katup jantung\n7. Penyakit atau kondisi tertentu, seperti:\n   - Dehidrasi\n   - Demam di atas 38 derajat Celcius\n   - Hipertiroidisme\n   - Anemia\n   - Pheochromocytoma\n   - Hipotensi ortostatik\n   - Kadar gula darah rendah (hipoglikemia)","Terdapat beberapa faktor yang dapat menyebabkan jantung berdebar, termasuk:\n\n1. Hipertensi (tekanan darah tinggi) - Kenaikan tekanan dalam pembuluh darah meningkatkan tekanan pada jantung untuk mengalirkan darah ke seluruh tubuh.\n2. Berbagai penyakit leluhur, seperti endokardioskopi (penyumbatan pada leher dada) atau peradangan di bagian tengkorak yang menyebabkan aliran darah menjadi terhambat.\n3. Penyakit jantung lainnya, seperti insufisiensi mitral, asistolik, atau fibrosis surya (pengubinan hati).\n4. Obesitas dan gangguan metabolisme, khususnya pada pasien dengan obesitas primar.\n5. Asupan stimulan, seperti teh, kopi, rosolia atau alkohol yang berlebihan, terutama ketika dikonsumsi secara berkala dan dalam jumlah banyak.\n6. Obstruksi pada salah satu pembuluh darah jantung, seperti stenosis subklavikular atau tapak aorta.\n7. Meningitis akut yang terkait dengan infark miokardium (keruntuhan jaringan hati akibat denyut tidak nyawanya pembuluh darah).\n8. Kanker rahim, khususnya metastaik, dan beberapa jenis penyakit lain yang berkaitan dengan metastase ke jantung.",1.0,0.5117839544067371,0.9999999999666667,1.0
Kapan seseorang harus dibawa ke dokter ketika mengalami jantung berdebar?,"Sensasi jantung berdebar umumnya tidak disebabkan oleh kondisi yang berbahaya dan dapat hilang dengan beristirahat dan tanpa pengobatan khusus. Meski demikian, pemeriksaan oleh dokter perlu segera dilakukan jika jantung berdebar sering kambuh, memburuk, atau terjadi lama hingga hitungan jam.\n\nPemeriksaan juga diperlukan bila orang yang mengalami jantung berdebar memiliki riwayat penyakit maupun operasi jantung, atau terdapat riwayat penyakit jantung pada keluarga.\n\nSegera ke IGD rumah sakit jika jantung berdebar tidak membaik dengan beristirahat, atau disertai dengan keluhan berikut:\n\nNyeri dada seperti tertekan, yang bisa menjalar ke bahu, dagu, punggung, atau lengan\nTubuh terasa lemah\nSesak napas\nKeringat dingin\nPusing hebat\nLinglung\nPingsan","['Topik: Jantung Berdebar, Subtopik: Gejala Jantung Berdebar: Kapan harus ke dokter \n Sensasi jantung berdebar umumnya tidak disebabkan oleh kondisi yang berbahaya dan dapat hilang dengan beristirahat dan tanpa pengobatan khusus. Meski demikian, pemeriksaan oleh dokter perlu segera dilakukan jika jantung berdebar sering kambuh, memburuk, atau terjadi lama hingga hitungan jam.\nPemeriksaan juga diperlukan bila orang yang mengalami jantung berdebar memiliki riwayat penyakit maupun operasi jantung, atau terdapat riwayat penyakit jantung pada keluarga.\nSegera ke IGD rumah sakit jika jantung berdebar tidak membaik dengan beristirahat, atau disertai dengan keluhan berikut:\n- Nyeri dada seperti tertekan, yang bisa menjalar ke bahu, dagu, punggung, atau lengan\n- Tubuh terasa lemah\n- Sesak napas\n- Keringat dingin\n- Pusing hebat\n- Linglung\n- Pingsan\n', 'Topik: Jantung Berdebar, Subtopik: Pengobatan Jantung Berdebar \n Pengobatan jantung berdebar tergantung pada penyebabnya. Bagi pasien yang menderita penyakit tertentu, misalnya aritmia, gagal jantung, atau hipertiroidisme, dokter akan merujuk pasien ke dokter spesialis terkait untuk menjalani terapi yang spesifik.\nJika diperlukan, dokter akan meresepkan obat jantung berdebar berupa penghambat beta (beta blocker) atau antagonis kalsium (calcium channel blocker) untuk meredakan jantung berdebar. Pada jantung berdebar yang disebabkan oleh gangguan induksi listrik jantung, dokter akan mempertimbangkan operasi ablasi jantung untuk meredakan jantung berdebar.\nSedangkan pada jantung berdebar yang disebabkan oleh gaya hidup tidak sehat, seperti merokok atau mengonsumsi terlalu banyak minuman berkafein, pasien akan disarankan untuk memperbaiki gaya hidupnya menjadi lebih sehat, misalnya dengan berolahraga.\nPada pasien yang mengalami jantung berdebar akibat penggunaan obat-obatan, dianjurkan untuk berkonsultasi dengan dokter yang memberikan obat tersebut. Tidak disarankan berhenti mengonsumsi obat tanpa persetujuan dokter.\nSementara itu, untuk jantung berdebar yang dipicu oleh faktor psikologis dan disertai gejala gelisah dan jantung berdebar, dokter bisa menyarankan pasien mencoba teknik relaksasi sederhana untuk meredakan serangan panik dan rasa cemas. Bila perlu, pasien akan dirujuk ke psikolog atau psikiater agar kondisi mental yang dialami pasien dapat ditangani.\n', 'Topik: Jantung Berdebar, Subtopik: Diagnosis Jantung Berdebar \n Untuk memulai diagnosis, dokter akan melakukan tanya jawab terkait gejala pada pasien yang dapat menandakan gangguan pada jantung. Meski tidak semua kasus jantung berdebar disebabkan oleh gangguan jantung, pemeriksaan perlu dilakukan untuk mencegah komplikasi yang mungkin terjadi akibat gangguan jantung.\nDokter juga akan menanyakan gejala lain yang mungkin menyertai jantung berdebar. Tujuannya adalah untuk mendeteksi kondisi lain yang dapat menyebabkan jantung berdebar, seperti gangguan kelenjar tiroid. Dokter juga akan bertanya tentang aktivitas fisik, tingkat stres, obat yang sedang digunakan, dan riwayat kesehatan pasien.\nSetelah itu, dokter akan melakukan pemeriksaan fisik menyeluruh, termasuk mengukur tekanan darah, suhu tubuh, dan nadi pasien. Dokter juga akan melakukan pemeriksaan yang spesifik, seperti mendengarkan suara jantung pasien menggunakan stetoskop, dan merasakan bagian depan leher untuk memeriksa kelenjar tiroid.\nSelanjutnya, dokter akan melakukan pemeriksaan penunjang untuk memastikan diagnosis. Umumnya, pemeriksaan awal yang dilakukan adalah elektrokardiografi (EKG). Namun, karena jantung berdebar umumnya hilang timbul, EKG mungkin tidak selalu dapat menangkap kelainan pada jantung.\nJika palpitasi dicurigai berasal dari gangguan jantung, pasien akan dirujuk ke dokter jantung untuk menjalani pemeriksaan berikut:\n- Monitor aktivitas listrik jantung selama 24  48 jam dengan alat khusus (Holter monitor)\n- USG jantung atau ekokardiografi\n- Elektrofisiologi jantung\n- MRI jantung\n- Angiografi koroner\nJika hasil pemeriksaan jantung tidak menunjukkan adanya kelainan, pemeriksaan lain dapat dilakukan untuk mendeteksi penyebab jantung berdebar. Beberapa pemeriksaan tersebut adalah:\n- Pemeriksaan darah lengkap, untuk mendeteksi anemia\n- Pemeriksaan hormon, untuk mendeteksi hipertiroidisme atau pheochromocytoma\n\n- Tes urine, untuk mendeteksi penggunaan obat terlarang\n- Tes kehamilan\n']","Jika seseorang mengalami gejala jantung berdebar, seperti nyeri dada atau perubahan ritme jantung yang tidak normal, dan hal itu tampak sering kambuh, memburuk, atau terjadi lama hingga hitungan jam, mereka harus segera berkonsultasi dengan dokter. Hal ini penting untuk memastikan bahwa gejala yang dialami tidak disebabkan oleh kondisi jantung yang lebih serius dan perlu perawatan medis cepat.\n\nSelain itu, ada beberapa tanda lain yang menunjukkan kebutuhan segera ke dokter:\n1. Jika gejala jantung berdebar disertai riwayat penyakit maupun operasi jantung, atau pada keluarga memiliki penyakit jantung.\n2. Jika gejala jantung berdebar tampak dengan cepat menurun atau terjadi bersamasama riwayat stres tinggi dan aktivitas fisik yang berlebihan.\n3. Jika ada keluhan seperti nyeri dada, sesak napas, pusing hebat, linglung, ouput vokal atau gangguan fungsi sistemik lainnya yang tampak berkaitan dengan gejala jantung berdebar.\n4. Jika ada keluhan mental seperti gelisah dan cemas yang disertai oleh jantung berdebar, yang mungkin memerlukan dukungan psikologis atau medis.\n5. Jika gejala jantung berdebar tampak buruk pada akhir hari dan tidak menurunkan setelah istirahat.\n6. Jika ada kesaktian yang menyokong perluasan gangguan ritme jantung atau riwayat gangguan lainnya, termasuk penyakit hipertiroidisme atau aritmia sebelumnya.\n7. Jika ada tanda-tanda fisik lain yang tampak berkaitan dengan gejala jantung berdebar, seperti gangguan fungsi kelenjar tiroid atau penyakit hipertiroidisme.\n8. Jika pasien menggunakan obat-obatan tertentu dan ada kecurigaan akan efek samping yang dapat mempengaruhi ritme jantung, seperti penggunaan stimulan atau antidepresan.\n\nPada kasus dimana gejala jantung berdebar tampak serius dan bahaya, pasien perlu segera berkunjung ke dokter untuk memperoleh penanganan medis yang tepat sebelum gangguan ini menjadi lebih parah.","Ketika seseorang mengalami jantung berdebar, yang perlu diingat adalah bahwa segala sesuatu harus dievaluasi secara cermat dan dengan cepat. Berikut adalah beberapa gejala atau tanda yang menunjukkan masalah jantung yang serius dan memerlukan perawatan medis segera:\n\n1. **Pingsan berlebihan**: Jika seseorang mengalami pingsan yang cenderung terus menerus atau bahkan meningkat, ini bisa merupakan indikasi adanya gangguan jantung.\n\n2. **Gejala Keracunan**: Jika orang tersebut mengeluh tentang sesuatu yang diakibatkan oleh gas lainnya atau dekomposisi bahan organik, seperti perasaan gatal dan pusing di lokasi yang sama.\n\n3. **Pergeseran Wajah**: Jika ada penurunan darah akibat gangguan jantung, orang tersebut mungkin mengalami pergeseran wajah atau bahkan hilangnya penglihatan untuk beberapa saat.\n\n4. **Gejala Pusing dan Keradul**: Jika seseorang mengeluh tentang gejala pusing, keradul, atau kehilangan kesadaran yang lama-lingkar, ini juga bisa mencolok sebagai tanda adanya masalah jantung.\n\n5. **Gejala Sebelum Migrasi**: Jika seseorang mengalami gangguan jantung berdebar dan kemudian migrasi ke tempat-tempat yang lebih tinggi, hal ini bisa mempercepat aliran darah yang meningkatkan gejala.\n\n6. **Gejala Iritabilitas Paha**: Jika seseorang mengeluh tentang nyeri pada paha akibat aktivitas fisik atau lainnya, ini juga bisa merujuk kepada gangguan jantung yang mendadak.\n\n7. **Penglihatan Menipis**: Jika ada penurunan visus (penglihatan menjadi buruk) secara tiba-tiba dan tak terduga, ini juga bisa merujuk kepada gangguan jantung yang mendadak.\n\n8. **Kesulitan Berbicara atau Mengeluh Tentang Nafas**: Jika orang tersebut mengalami kesukaran dalam mengecapi, mengeluh tentang nafia atau merasa sepi-sepi untuk berbicara akibat gangguan jantung.\n\n9. **Gejala Sebelum Migrasi**: Jika seseorang sudah terkena radiasi sinar dan kemudian mengalami gangguan jantung, hal ini bisa meningkatkan risiko dari gejala mendadak yang disebabkan oleh perubahan tekanan darah.\n\n10. **Gejala Sebelum Migrasi**: Jika seseorang sudah terkena radiasi sinar dan kemudian mengalami gangguan jantung, hal ini bisa meningkatkan risiko dari gejala mendadak yang disebabkan oleh perubahan tekanan darah.\n\nSemua gejala yang disebutkan di atas harus diperhatikan dengan baik dan segera meminta bantuan dokter untuk didiagnosis dan menangani masalah jantung yang mungkin ada.",0.7894736842105263,0.6157319362409281,0.9999999999666667,1.0
Apa saja komplikasi akibat jantung berdebar?,"Jantung berdebar jarang menyebabkan komplikasi. Namun, pada jantung berdebar yang disebabkan oleh penyakit jantung, beberapa komplikasi yang dapat terjadi meliputi:\n\nStroke\nHenti jantung\nGagal jantung","['Topik: Jantung Berdebar, Subtopik: Komplikasi Jantung Berdebar \n Jantung berdebar jarang menyebabkan komplikasi. Namun, pada jantung berdebar yang disebabkan oleh penyakit jantung, beberapa komplikasi yang dapat terjadi meliputi:\n- Stroke\n- Henti jantung\n- Gagal jantung\n', 'Topik: Jantung Berdebar, Subtopik: Diagnosis Jantung Berdebar \n Untuk memulai diagnosis, dokter akan melakukan tanya jawab terkait gejala pada pasien yang dapat menandakan gangguan pada jantung. Meski tidak semua kasus jantung berdebar disebabkan oleh gangguan jantung, pemeriksaan perlu dilakukan untuk mencegah komplikasi yang mungkin terjadi akibat gangguan jantung.\nDokter juga akan menanyakan gejala lain yang mungkin menyertai jantung berdebar. Tujuannya adalah untuk mendeteksi kondisi lain yang dapat menyebabkan jantung berdebar, seperti gangguan kelenjar tiroid. Dokter juga akan bertanya tentang aktivitas fisik, tingkat stres, obat yang sedang digunakan, dan riwayat kesehatan pasien.\nSetelah itu, dokter akan melakukan pemeriksaan fisik menyeluruh, termasuk mengukur tekanan darah, suhu tubuh, dan nadi pasien. Dokter juga akan melakukan pemeriksaan yang spesifik, seperti mendengarkan suara jantung pasien menggunakan stetoskop, dan merasakan bagian depan leher untuk memeriksa kelenjar tiroid.\nSelanjutnya, dokter akan melakukan pemeriksaan penunjang untuk memastikan diagnosis. Umumnya, pemeriksaan awal yang dilakukan adalah elektrokardiografi (EKG). Namun, karena jantung berdebar umumnya hilang timbul, EKG mungkin tidak selalu dapat menangkap kelainan pada jantung.\nJika palpitasi dicurigai berasal dari gangguan jantung, pasien akan dirujuk ke dokter jantung untuk menjalani pemeriksaan berikut:\n- Monitor aktivitas listrik jantung selama 24  48 jam dengan alat khusus (Holter monitor)\n- USG jantung atau ekokardiografi\n- Elektrofisiologi jantung\n- MRI jantung\n- Angiografi koroner\nJika hasil pemeriksaan jantung tidak menunjukkan adanya kelainan, pemeriksaan lain dapat dilakukan untuk mendeteksi penyebab jantung berdebar. Beberapa pemeriksaan tersebut adalah:\n- Pemeriksaan darah lengkap, untuk mendeteksi anemia\n- Pemeriksaan hormon, untuk mendeteksi hipertiroidisme atau pheochromocytoma\n\n- Tes urine, untuk mendeteksi penggunaan obat terlarang\n- Tes kehamilan\n', 'Topik: Jantung Berdebar, Subtopik: Penyebab Jantung Berdebar \n Jantung berdebar tidak selalu akibat penyakit pada jantung. Berikut adalah beberapa kondisi dan penyakit yang dapat menimbulkan keluhan jantung berdebar kencang:\n1. Gaya hidup, seperti:\n- Kebiasaan merokok\n\n- Tidur yang tidak cukup\n- Latihan fisik yang berat\n- Efek konsumsi minuman beralkohol\n- Konsumsi minuman berkafein seperti kopi, teh, dan minuman berenergi\n- Penyalahgunaan NAPZA, seperti amfetamin, ekstasi, kokain, atau ganja\n- Pola makan tinggi gula dan lemak\n2. Faktor psikologis, misalnya:\n- Stres atau gelisah\n- Serangan panik\n- Cemas atau takut luar biasa\n3. Obat-obatan, antara lain:\n- Obat asma\n- Obat tekanan darah tinggi (antihipertensi)\n- Antihistamin\n- Antidepresan\n- Obat flu, contohnya obat yang mengandung phenylephrine\n\n4. Perubahan hormon, misalnya pada masa:\n- Menstruasi\n- Kehamilan\n- Menopause\n5. Gangguan irama jantung atau aritmia, meliputi:\n- Fibrilasi atrium\n- Atrial flutter \n- Takikardia ventrikular\n- Takikardia supraventrikular\n6. Penyakit jantung, antara lain:\n- Gagal jantung\n- Penyakit jantung bawaan\n- Kardiomiopati\n- Penyakit katup jantung\n7. Penyakit atau kondisi tertentu, seperti:\n- Dehidrasi\n- Demam di atas 38 derajat Celcius\n- Hipertiroidisme\n- Anemia\n- Pheochromocytoma\n- Hipotensi ortostatik\n- Kadar gula darah rendah (hipoglikemia)\n']","Komplikasi yang umum terjadi pada jantung berdebar, termasuk yang disebabkan oleh penyakit jantung, antara lain:\n\n1. Stroke (kerompok)\n2. Henti jantung (cardiac death)\n3. Gagal jantung (heart failure)\n4. Penyempitan pembuluh darah (arterial stenosis)\n5. Arterioseksepel (coronary embolism)\n6. Penyakit katup jantung (valvular heart disease)\n7. Hipertensi (high blood pressure)\n8. Angina (chest pain due to reduced blood flow to the heart muscle)\n9. Aritmia (arrhythmias)\n10. Demam tinggi (fever above 38 degrees Celcius)","Komplikasi yang umum di antaranya meliputi infark miokardia, hiperkinesia koronari, aritmia ventrikuler, disfungsi jantung akibat pembekuan sel-sel matriks (myokarditis), gangguan aliran darah, serta penurunan daya tahan tubuh.",0.2727272727272727,0.47101099217133696,0.99999999995,1.0
Apa itu penyakit kardiomegali?,"Kardiomegali adalah membesarnya ukuran jantung akibat penyakit tertentu, seperti tekanan darah tinggi atau penyakit jantung koroner. Tergantung pada penyebabnya, kondisi ini bisa terjadi secara permanen atau hanya sementara.\n\nKardiomegali biasanya terjadi karena penyakit atau kondisi yang menyebabkan jantung harus bekerja lebih keras untuk memompa darah. Akibatnya, otot jantung menebal sehingga ukuran jantung membesar.\n\nKardiomegali dapat terlihat melalui pemindaian, seperti foto Rontgen. Kondisi ini umumnya bukan merupakan suatu keadaan darurat. Namun, penting untuk mencari tahu penyebab kardiomegali sehingga penanganan yang tepat bisa diberikan dan komplikasinya dapat dicegah.","['Topik: Kardiomegali, Subtopik: Pengertian Kardiomegali \n Kardiomegali adalah membesarnya ukuran jantung akibat penyakit tertentu, seperti tekanan darah tinggi atau penyakit jantung koroner. Tergantung pada penyebabnya, kondisi ini bisa terjadi secara permanen atau hanya sementara.\nKardiomegali biasanya terjadi karena penyakit atau kondisi yang menyebabkan jantung harus bekerja lebih keras untuk memompa darah. Akibatnya, otot jantung menebal sehingga ukuran jantung membesar.\n\nKardiomegali dapat terlihat melalui pemindaian, seperti foto Rontgen. Kondisi ini umumnya bukan merupakan suatu keadaan darurat. Namun, penting untuk mencari tahu penyebab kardiomegali sehingga penanganan yang tepat bisa diberikan dan komplikasinya dapat dicegah.\n', 'Topik: Kardiomegali, Subtopik: Pengertian Kardiomegali \n Kardiomegali biasanya terjadi karena penyakit atau kondisi yang menyebabkan jantung harus bekerja lebih keras untuk memompa darah. Akibatnya, otot jantung menebal sehingga ukuran jantung membesar.\n\nKardiomegali dapat terlihat melalui pemindaian, seperti foto Rontgen. Kondisi ini umumnya bukan merupakan suatu keadaan darurat. Namun, penting untuk mencari tahu penyebab kardiomegali sehingga penanganan yang tepat bisa diberikan dan komplikasinya dapat dicegah.\n', 'Topik: Kardiomegali, Subtopik: Penyebab dan Faktor Risiko Kardiomegali \n Kardiomegali terjadi ketika otot jantung memompa darah lebih keras daripada yang seharusnya. Beban kerja yang berlebihan ini lama-lama menyebabkan otot jantung menebal sehingga ukuran jantung menjadi lebih besar.\nBeberapa kondisi yang dapat menyebabkan jantung bengkak atau kardiomegali adalah:\n- Hipertensi\n- Penyakit jantung koroner\n- Penyakit katup jantung\n- Kardiomiopati\n- Gangguan irama jantung (aritmia)\n- Penumpukan cairan di selaput pelindung jantung (efusi perikardium)\n- Gangguan hormon tiroid\n- Anemia\n- Kelebihan zat besi dalam tubuh (hemokromatosis)\n- Infeksi virus pada jantung\n- Infeksi HIV\n- Gagal ginjal\n- Penyakit paru, seperti penyakit paru obstruktif kronik (PPOK)\n- Penyakit amiloidosis\n\n- Penyakit jantung bawaan, seperti kelainan katup jantung atau koarktasio aorta\n\n- Kehamilan\nSelain kondisi-kondisi di atas, risiko kardiomegali juga lebih tinggi pada seseorang dengan beberapa faktor di bawah ini:\n- Memiliki berat badan berlebih atau obesitas\n- Kurang beraktivitas fisik dan berolahraga\n- Menderita kecanduan alkohol\n- Menyalahgunakan NAPZA\n- Pernah terkena serangan jantung\n\n- Memiliki keluarga dengan riwayat pembengkakan jantung\n']","Kardiomegali adalah suatu keadaan dimana ukuran jantung menjadi lebih besar akibat penyebab tertentu, seperti tekanan darah tinggi atau penyakit jantung koroner. Hal ini disebabkan oleh beban kerja yang berlebihan pada jantung, yang lama-lama menyebabkan otot jantung menjadi lebih tebal dan ukuran jantung mengecil. Kardiomegali bisa terlihat melalui pemindaian medis seperti foto Rontgen, dan umumnya bukan merupakan suatu keadaan darurat. Namun, penting untuk mencari tahu penyebab kardiomegali agar penanganan yang tepat bisa diberikan dan komplikasinya dapat dicegah. Beberapa faktor risiko yang memperparah kondisi ini termasuk hipertensi, penumpukan cairan di selaput pelindung jantung (efusi perikardium), gangguan hormon tiroid, dan kehamilan.","Penyakit kardiomegali adalah suatu keadaan dimana ventrikel jantung (bagian yang memompa darah) mengecil dan tidak bekerja dengan baik. Hal ini menyebabkan jantung tidak mampu mengeluarkan cairan dalam jumlah yang cukup untuk memberikan nutrisi ke tubuh, sehingga dapat menyebabkan gejala seperti pusing, sesak nafas, dan edema.",0.9230769230769231,0.766231983754457,0.9999999999666667,1.0
Apa saja obat yang dapat mengatasi penyakit kardiomegali?,"Untuk mengatasi kardiomegali yang disebabkan oleh tekanan darah tinggi atau gagal jantung, dokter dapat memberikan beberapa obat-obatan berikut:\n\nObat penurun tekanan darah golongan ACE inhibitors, seperti captopril; atau obat ARB, seperti candesartan\nObat penghambat beta (beta blockers), seperti bisoprolol, untuk mengontrol tekanan darah dan meningkatkan fungsi pompa jantung\nObat diuretik, untuk mengurangi penumpukan cairan di dalam tubuh agar tekanan darah menurun dan pembengkakan berkurang\n\nUntuk mengatasi penyebab kardiomegali yang terkait dengan irama jantung, dokter dapat meresepkan obat pengontrol denyut jantung, seperti digoxin. Apabila pasien berisiko menderita stroke atau serangan jantung, dokter juga dapat memberikan obat pengencer darah.","['Topik: Kardiomegali, Subtopik: Pengobatan Kardiomegali \n Pengobatan kardiomegali berfokus untuk mengatasi penyebab pembesaran jantung. Metode pengobatannya mencakup pemberian obat atau operasi, tergantung pada penyebab dan tingkat keparahannya.\nUntuk mengatasi kardiomegali yang disebabkan oleh tekanan darah tinggi atau gagal jantung, dokter dapat memberikan beberapa obat-obatan berikut:\n- Obat penurun tekanan darah golongan ACE inhibitors, seperti captopril; atau obat ARB, seperti candesartan\n- Obat penghambat beta (beta blockers), seperti bisoprolol, untuk mengontrol tekanan darah dan meningkatkan fungsi pompa jantung\n- Obat diuretik, untuk mengurangi penumpukan cairan di dalam tubuh agar tekanan darah menurun dan pembengkakan berkurang\nUntuk mengatasi penyebab kardiomegali yang terkait dengan irama jantung, dokter dapat meresepkan obat pengontrol denyut jantung, seperti digoxin. Apabila pasien berisiko menderita stroke atau serangan jantung, dokter juga dapat memberikan obat pengencer darah.\nJika obat-obatan tidak cukup ampuh dalam mengatasi penyebab kardiomegali, dokter dapat melakukan operasi. Beberapa jenis operasi yang bisa dilakukan untuk menangani kardiomegali adalah:\n- Pemasangan alat pacu jantung atau implantable cardioverter-defibrillator (ICD), untuk memantau dan mengendalikan irama jantung\n- Operasi bypass jantung, untuk mengatasi penyumbatan pembuluh darah jantung pada kardiomegali yang disebabkan oleh penyakit jantung koroner\n\n- Operasi katup jantung, untuk mengganti katup yang bermasalah\n- Transplantasi atau pencangkokan jantung, sebagai pilihan terakhir jika berbagai prosedur medis lain tidak dapat menangani kardiomegali\nPeluang keberhasilan pengobatan kardiomegali akan lebih besar jika didukung dengan perubahan gaya hidup menjadi lebih sehat, seperti:\n- Berolahraga secara rutin\n- Mengelola stres dengan baik\n- Menjaga berat badan ideal\n\n- Membatasi asupan garam dalam makanan\n- Tidur yang cukup, sekitar 7  9 jam sehari\n- Berhenti merokok\n- Membatasi konsumsi minuman beralkohol atau berkafein\n\n- Menjaga kadar gula darah dan tekanan darah\nKardiomegali yang terjadi sementara, misalnya akibat kehamilan atau infeksi, biasanya dapat sembuh total dan jantung akan kembali ke ukuran normal. Sementara itu, kardiomegali yang disebabkan oleh penyakit lain biasanya bersifat permanen sehingga perlu terus diobati.\n', 'Topik: Kardiomegali, Subtopik: Pencegahan Kardiomegali \n Kardiomegali dapat dihindari dengan mencegah terjadinya penyakit penyebab dan faktor risikonya. Upaya yang dapat dilakukan adalah dengan menjalani gaya hidup sehat guna menjaga kesehatan jantung, seperti:\n- Mengonsumsi makanan yang baik untuk penderita jantung bengkak, seperti buah, sayur, ikan, susu rendah lemak, dan biji-bijian\n- Membatasi asupan garam dan lemak jenuh dalam makanan\n- Menghindari konsumsi minuman beralkohol\n- Berhenti merokok\n- Berolahraga rutin\n- Menjaga kadar kolesterol dan tekanan darah\n- Mencuci tangan dengan sabun dan air mengalir secara rutin\n', 'Topik: Kardiomegali, Subtopik: Penyebab dan Faktor Risiko Kardiomegali \n Kardiomegali terjadi ketika otot jantung memompa darah lebih keras daripada yang seharusnya. Beban kerja yang berlebihan ini lama-lama menyebabkan otot jantung menebal sehingga ukuran jantung menjadi lebih besar.\nBeberapa kondisi yang dapat menyebabkan jantung bengkak atau kardiomegali adalah:\n- Hipertensi\n- Penyakit jantung koroner\n- Penyakit katup jantung\n- Kardiomiopati\n- Gangguan irama jantung (aritmia)\n- Penumpukan cairan di selaput pelindung jantung (efusi perikardium)\n- Gangguan hormon tiroid\n- Anemia\n- Kelebihan zat besi dalam tubuh (hemokromatosis)\n- Infeksi virus pada jantung\n- Infeksi HIV\n- Gagal ginjal\n- Penyakit paru, seperti penyakit paru obstruktif kronik (PPOK)\n- Penyakit amiloidosis\n\n- Penyakit jantung bawaan, seperti kelainan katup jantung atau koarktasio aorta\n\n- Kehamilan\nSelain kondisi-kondisi di atas, risiko kardiomegali juga lebih tinggi pada seseorang dengan beberapa faktor di bawah ini:\n- Memiliki berat badan berlebih atau obesitas\n- Kurang beraktivitas fisik dan berolahraga\n- Menderita kecanduan alkohol\n- Menyalahgunakan NAPZA\n- Pernah terkena serangan jantung\n\n- Memiliki keluarga dengan riwayat pembengkakan jantung\n']","Obat-obatan yang bisa digunakan untuk mengatasi penyebab kardiomegali meliputi beberapa jenis, antara lain:\n1. Obat penurun tekanan darah golongan ACE inhibitors atau ARB, contohnya captopril dan candesartan, yang dapat digunakan untuk mengatasi kardiomegali disebabkan oleh tekanan darah tinggi atau gagal jantung.\n2. Obat penghambat beta (beta blockers), seperti bisoprolol, yang bisa membantu mengontrol tekanan darah dan meningkatkan fungsi pompa jantung.\n3. Obat diuretik, contohnya lasix atau torasemide, yang digunakan untuk mengurangi penumpukan cairan dalam tubuh dan menurunkan tekanan darah serta pembengkakan.\n4. Obat pengontrol denyut jantung, seperti digoxin, yang dapat digunakan untuk mengendalikan irama jantung apabila kardiomegali disebabkan oleh gangguan ritme jantung.\n5. Obat pengencer darah, misalnya aspirin atau clopidogrel, dalam menghindari risiko stroke dan serangan jantung pada pasien dengan kardiomegali akut.","Dalam upaya untuk mengatasi penyakit kardiomegali, beberapa obat yang umum digunakan termasuk:\n\n1. Diuretik seperti furosemide atau torsemide, yang dapat membantu mengurangi pembengkakan air di jaringan tubuh dan menekan tekanan darah.\n2. ACE inhibisi (angiotensin-converting enzyme inhibitors) seperti enalapril atau lisinopril, yang berguna untuk menurunkan tekanan darah dan mengatasi disfungsi jantung posterior.\n3. Beta blokader seperti metoprolol, propranolol, atau bisoprolol, yang dapat membantu mengurangi jumlah peredaran darah dan menekan tekanan nadi pada penyakit kardiomegali iskemi.\n4. Antikoagulan (zat yang menghentikan pengeluaran trombus) seperti warfarin atau heparin, yang dapat digunakan untuk mencegah kebakaran janin akibat penyumbatan arteri utuh.\n5. Digoxin, obat khusus yang umumnya digunakan untuk meningkatkan fungsi jantung dan mengurangi gangguan ritme jantung pada beberapa pasien dengan penyakit kardiomegali.\n\nNamun, perawatan medis harus selalu dilakukan di bawah direktur dokter atau sarana yang ahli dalam bidang ini untuk memastikan rencana terapi yang tepat dan aman bagi pasien.",0.75,0.6190678541137714,0.8333333332916666,1.0
Bagaimana kelainan jantung yang dialami oleh seseorang dengan penyakit tetralogy of fallot?,"Berikut ini adalah empat kelainan jantung yang terjadi pada ToF:\n\nVentricular septal defect (VSD), yaitu lubang di dinding yang memisahkan ventrikel kanan dan kiri\nPulmonary valve stenosis, yaitu penyempitan pada katup pembuluh darah yang ke paru-paru (katup pulmonal) sehingga darah dari jantung yang ke paru-paru berkurang\nPosisi aorta tidak normal, yakni bergeser ke kanan mengikuti VSD yang terbentuk\nRight ventricular hypertrophy atau penebalan pada otot ventrikel kanan jantung akibat jantung bekerja terlalu keras untuk memompa darah","['Topik: Tetralogy of Fallot, Subtopik: Pengertian Tetralogy of Fallot \n Tetralogy of Fallot adalah salah satu penyakit jantung bawaan pada bayi baru lahir. Penyakit jantung ini terdiri dari empat jenis kelainan struktur pada jantung bayi. Tetralogy of Fallot menyebabkan darah yang dialirkan ke seluruh tubuh bayi tidak mengandung cukup oksigen.\nTetralogy of Fallot (ToF) terjadi ketika bayi masih di dalam kandungan, tepatnya ketika jantungnya sedang berkembang. Di antara penyakit jantung bawaan yang ada, tetralogy of Fallot merupakan salah satu jenis yang umum ditemui. Namun, kondisi ini diperkirakan hanya terjadi pada 5 dari 10.000 kelahiran.\n\nKelainan struktur jantung pada ToF menyebabkan darah yang kaya oksigen bercampur dengan darah yang kekurangan oksigen. Akibatnya, darah yang mengalir ke seluruh tubuh tidak mengandung oksigen yang cukup dan bayi pun kekurangan oksigen.\nBerikut ini adalah empat kelainan jantung yang terjadi pada ToF:\n- Ventricular septal defect (VSD), yaitu lubang di dinding yang memisahkan ventrikel kanan dan kiri\n- Pulmonary valve stenosis, yaitu penyempitan pada katup pembuluh darah yang ke paru-paru (katup pulmonal) sehingga darah dari jantung yang ke paru-paru berkurang\n- Posisi aorta tidak normal, yakni bergeser ke kanan mengikuti VSD yang terbentuk\n- Right ventricular hypertrophy atau penebalan pada otot ventrikel kanan jantung akibat jantung bekerja terlalu keras untuk memompa darah\n', 'Topik: Tetralogy of Fallot, Subtopik: Pengertian Tetralogy of Fallot \n Tetralogy of Fallot (ToF) terjadi ketika bayi masih di dalam kandungan, tepatnya ketika jantungnya sedang berkembang. Di antara penyakit jantung bawaan yang ada, tetralogy of Fallot merupakan salah satu jenis yang umum ditemui. Namun, kondisi ini diperkirakan hanya terjadi pada 5 dari 10.000 kelahiran.\n\nKelainan struktur jantung pada ToF menyebabkan darah yang kaya oksigen bercampur dengan darah yang kekurangan oksigen. Akibatnya, darah yang mengalir ke seluruh tubuh tidak mengandung oksigen yang cukup dan bayi pun kekurangan oksigen.\nBerikut ini adalah empat kelainan jantung yang terjadi pada ToF:\n- Ventricular septal defect (VSD), yaitu lubang di dinding yang memisahkan ventrikel kanan dan kiri\n- Pulmonary valve stenosis, yaitu penyempitan pada katup pembuluh darah yang ke paru-paru (katup pulmonal) sehingga darah dari jantung yang ke paru-paru berkurang\n- Posisi aorta tidak normal, yakni bergeser ke kanan mengikuti VSD yang terbentuk\n- Right ventricular hypertrophy atau penebalan pada otot ventrikel kanan jantung akibat jantung bekerja terlalu keras untuk memompa darah\n', 'Topik: Tetralogy of Fallot, Subtopik: Komplikasi Tetralogy of Fallot \n Tetralogy of Fallot yang tidak tertangani atau tidak terkontrol dengan baik dapat menimbulkan komplikasi serius, seperti:\n- Gangguan tumbuh kembang anak\n- Gangguan irama jantung\n- Kejang\n- Peradangan di lapisan dalam jantung (endokarditis)\n- Kematian\nPenting untuk diingat, risiko terkena komplikasi ToF dapat berlanjut sampai masa remaja atau dewasa. Jika ToF tidak tertangani dengan baik, jantung penderita bisa saja mengalami masalah lagi walau sudah pernah menjalani operasi. Oleh sebab itu, penderita tetap harus kontrol secara rutin semasa hidupnya.\n']","Kelainan jantung pada orang yang menderita Tetralogy of Fallot (ToF) terdiri dari empat jenis penyakit jantung, yaitu:\n\n1. Ventricular septal defect (VSD): Hal ini merupakan suatu kecelaran di antara ventrikel kanan dan kiri yang menyebabkan darah oksigen tinggi bercampur dengan darah rendah oksigen dalam pembuluh darah.\n2. Pulmonary valve stenosis: Penyempitan katup pembuluh darah ke paru-paru (katup pulmonal) yang mengakibatkan aliran darah ke paru-paru berkurang.\n3. Posisi aorta tidak normal: Aorta bergeser ke kanan, sebagai akibat dari VSD yang terbentuk.\n4. Right ventricular hypertrophy atau penebalan otot ventrikel kanan jantung karena bekerja terlalu keras untuk memompa darah.\n\nDiantara komplikasi ToF, termasuk gangguan tumbuh-kembang, gangguan irama jantung, kejang, peradangan di lapisan dalam jantung (endokarditis), dan bahkan kematian. Oleh karena itu penting untuk tetap mengontrol diri secara rutin agar risiko komplikasi dapat diminimalkan.","Kelainan jantung yang dikacaui dalam penyakit tetralogy of Fallot (TOF) meliputi beberapa masalah struktural dan koarkrosis pada sistem arteri. Berikut ini beberapa aspek kelainan jantung TOF:\n\n1. Defek Membranar Atrial septum: Aspek utama penyebab TOF adalah defek membranar atrial septum (ASD), yang menyebabkan aritmia dan aliran bolak-balik antara kedua ruang dalam jantung.\n2. Defek Pulmoner Septum: Kelainan ini menggangu proses pertukaran oksigen dan karbon dioksida, menyebabkan pembesaran arteri pulmonalis (pasangan arteri yang membesar karena aliran bolak-balik).\n3. Peretasan Ventrikel: Hal ini menutupi lubang ventrikel, mengganggu aliran darah dan menyebabkan hipoksia (kesadaran rendah atau kelelahan pada pasien TOF).\n4. Pulmonal Stenosis: Pembesaran arteri pulmonalis yang terjadi karena defek membranar atrial septum dan defectus pulmoris secundarius menyebabkan stenosis pulmonalis, aliran bolak-balik menuju sistem arteri.\n5. Keputihan VSD (Ventricular Septal Defect): Kelainan ini adalah defek membranar atrial septum yang membuka lubang kecil di antara kedua ventrikel jantung, menyebabkan aliran bolak-balik menuju sistem arteri.\n6. Komplikasi: Penyakit tetralogy of Fallot juga dapat disertai komplikasi lainnya seperti endokardialisasi dan aneurisma arteri pulmonalis.\n\nPasien TOF mungkin akan mengalami kesulitan dalam bernapas saat beraktivitas, yang disebut ""seizure of breath"" (SOD). Penderita juga cenderung tumbuh kurang normal dan memiliki risiko tinggi untuk infeksi pada sumsum tulang.\n\nDiagnosa umum dilakukan melalui ekg atau tomografi sinar-X (ekoslusi) untuk mengidentifikasi kelainan jantung TOF, serta memeriksa kondisi fungsional dan fisik pasien. Pengobatan umumnya termasuk operasi pemotongan atrial septum, penyembuhan stensosis pulmonalis, dan reparasi defek ventrikular dan membranar atrial septum.\n\nDengan demikian, kelainan jantung yang dialami oleh pasien dengan penyakit tetralogy of Fallot melibatkan beberapa masalah struktural dalam sistem arteri, termasuk defek membranar atrial septum dan defectus pulmoris.",1.0,0.5767620819834379,0.9999999999666667,1.0
Bagaimana cara mencegah bayi agar terhindar dari penyakit tetralogy of fallot?,"Penyakit jantung bawaan umumnya tidak dapat dicegah, termasuk tetralogy of Fallot. Namun, ada beberapa upaya yang dapat dilakukan oleh ibu hamil untuk mengurangi risiko bayi terlahir dengan kondisi ini, yaitu:\n\nKonsultasikan terlebih dahulu dengan dokter sebelum mengonsumsi obat-obatan, termasuk obat herbal atau obat yang bisa dibeli di apotik.\nKonsumsi suplemen asam folat 400 mcg setiap hari pada trimester pertama kehamilan.\nPastikan telah mendapatkan imunisasi rubella dan flu sebelum hamil.\nJalani pengobatan sesuai yang dianjurkan dokter jika menderita diabetes.\nHindari kebiasaan merokok dan paparan asap rokok, terutama selama hamil.\nJangan mengonsumsi minuman beralkohol dan menggunakan NAPZA.\nHindari kontak dengan orang yang sedang sakit atau terinfeksi.","['Topik: Tetralogy of Fallot, Subtopik: Pencegahan Tetralogy of Fallot \n Penyakit jantung bawaan umumnya tidak dapat dicegah, termasuk tetralogy of Fallot. Namun, ada beberapa upaya yang dapat dilakukan oleh ibu hamil untuk mengurangi risiko bayi terlahir dengan kondisi ini, yaitu:\n- Konsultasikan terlebih dahulu dengan dokter sebelum mengonsumsi obat-obatan, termasuk obat herbal atau obat yang bisa dibeli di apotik.\n- Konsumsi suplemen asam folat 400 mcg setiap hari pada trimester pertama kehamilan.\n- Pastikan telah mendapatkan imunisasi rubella dan flu sebelum hamil.\n- Jalani pengobatan sesuai yang dianjurkan dokter jika menderita diabetes.\n- Hindari kebiasaan merokok dan paparan asap rokok, terutama selama hamil.\n- Jangan mengonsumsi minuman beralkohol dan menggunakan NAPZA.\n- Hindari kontak dengan orang yang sedang sakit atau terinfeksi.\n', 'Topik: Tetralogy of Fallot, Subtopik: Pengertian Tetralogy of Fallot \n Tetralogy of Fallot adalah salah satu penyakit jantung bawaan pada bayi baru lahir. Penyakit jantung ini terdiri dari empat jenis kelainan struktur pada jantung bayi. Tetralogy of Fallot menyebabkan darah yang dialirkan ke seluruh tubuh bayi tidak mengandung cukup oksigen.\nTetralogy of Fallot (ToF) terjadi ketika bayi masih di dalam kandungan, tepatnya ketika jantungnya sedang berkembang. Di antara penyakit jantung bawaan yang ada, tetralogy of Fallot merupakan salah satu jenis yang umum ditemui. Namun, kondisi ini diperkirakan hanya terjadi pada 5 dari 10.000 kelahiran.\n\nKelainan struktur jantung pada ToF menyebabkan darah yang kaya oksigen bercampur dengan darah yang kekurangan oksigen. Akibatnya, darah yang mengalir ke seluruh tubuh tidak mengandung oksigen yang cukup dan bayi pun kekurangan oksigen.\nBerikut ini adalah empat kelainan jantung yang terjadi pada ToF:\n- Ventricular septal defect (VSD), yaitu lubang di dinding yang memisahkan ventrikel kanan dan kiri\n- Pulmonary valve stenosis, yaitu penyempitan pada katup pembuluh darah yang ke paru-paru (katup pulmonal) sehingga darah dari jantung yang ke paru-paru berkurang\n- Posisi aorta tidak normal, yakni bergeser ke kanan mengikuti VSD yang terbentuk\n- Right ventricular hypertrophy atau penebalan pada otot ventrikel kanan jantung akibat jantung bekerja terlalu keras untuk memompa darah\n', 'Topik: Tetralogy of Fallot, Subtopik: Gejala Tetralogy of Fallot: Kapan harus ke dokter \n Lakukan pemeriksaan ke dokter jika muncul gejala atau tanda di atas pada anak. Jika anak terlihat sesak dan bibirnya membiru (sianosis), posisikan anak berbaring menyamping dengan lutut menekuk ke dada dan jangan tunda untuk membawanya ke IGD rumah sakit terdekat.\nPenderita tetralogy of Fallot perlu rutin menjalani pemeriksaan ke dokter seumur hidupnya. Tujuannya adalah agar kondisinya selalu terpantau dan dapat menjalani aktivitas dengan baik.\n']","Untuk mencegah Bayi agar terhindar dari Penyakit Tetralogy of Fallot, ibu hamil harus mengikuti beberapa langkah penting. Berikut adalah upaya yang dapat diambil:\n\n1. **Konsultasi Dokter Sebelum Mengonsumsi Obat**: Ibu harian konsultasikan dengan dokter sebelum menggunakan obat, termasuk obat herbal atau yang bisa dibeli di apotik. Ini adalah penting untuk mencegah terjadinya interaksi antara obat dan risiko kesakitan bagi janin.\n\n2. **Konsumsi Suplemen Asam Folat 400 mcg Setiap Hari Pada Trimester Pertama**: Mengkonsumsi suplemen asam folat yang sesuai dengan dosis direkomendasikan oleh dokter selama trimester pertama kehamilan. Asam folat ini penting untuk memperbaiki dan mencegah beberapa penyakit jantung pada janin, termasuk Tetralogy of Fallot.\n\n3. **Imunisasi Rubella dan Flu**: Pastikan telah mengikuti program imunisasi rubella dan flu sebelum hamil untuk melindungi janin dari penyakit-penyakitan yang bersifat sia-sia, termasuk tetralogy of Fallot.\n\n4. **Pengobatan sesuai Direkomendasikan Doar**: Jika ibu hamil mengalami diabetes, pastikan untuk mendapatkan pengobatan dan menjalani diet yang direkomendasikan dokter. Pengendalian gula darah ini penting karena dapat mempengaruhi pertumbuhan janin dan risiko timbulnya penyakit jantung lain seperti tetralogy of Fallot.\n\n5. **Hindari Kegagalan Merokok dan Paparan Asap Roek**: Hindari merokok dan paparan asap rokok, terutama selama kehamilan, karena asap ini dapat meningkatkan risiko penyakit jantung janin.\n\n6. **Jangan Mengonsumsi Minuman Beralkohol**: Ibu hamil diharuskan untuk menghindari penggunaan alkohol dan produk-produk yang mengandung etanol selama kehamilan. Alkohol dapat meningkatkan risiko timbulnya penyakit jantung lain seperti tetralogy of Fallot.\n\n7. **Hindari Kontak Dengan Orang Sakit atau Terinfeksi**: Ibu hamil diharuskan untuk menghindari kontak dengan orang yang sedang sakit atau terinfeksi, sebagai cara untuk mencegah penularan penyakit pada janin.\n\nDengan mengikuti langkah-langkah ini, ibu hamil dapat meningkatkan kesempatan agar anak mereka tidak mengidap tetralogy of Fallot dan memiliki peluang hidup yang lebih baik.","Untuk mencegah penyakit tetralogy of Fallot, termasuk pasien lain dengan kelainan jantung congenital lainnya, beberapa langkah yang bisa diambil oleh ibu hamil dan tim perawat adalah sebagai berikut:\n\n1. Konsultasi lanjutan dan pemeriksaan khusus: Persiapkan diri untuk melakukan pemeriksaan khusus yang dapat menunjukkan penyakit tetralogy of Fallot, seperti echokardiografi (ekg) atau retikuloelelektrokardiografi (RELG).\n2. Kesiapan medis: Pastikan dukungan dokter dan perawat ahli dalam penyakit jantung sudah siap menangani kasus tetralogy of Fallot atau kelainan jantung lainnya, termasuk tindakan koreksi operasi yang diperlukan.\n3. Pencegahan infeksi: Hindari penyakit infeksi pada masa kehamilan seperti flu dan gusi bengkak untuk mencegah terjadinya difteri, kongenital atau tetanus.\n4. Konsumsi suplementasi zat besi: Zat besi dibutuhkan dalam proses pembentukan sel darurat dan hemoglobin, oleh sebab itu, makanlah lebih banyak sayuran berwarna merah dan hewani yang kaya akan zat besi.\n5. Penggunaan asupan makanan obat: Periksalah bahwa semua suplementasi atau obat yang dikonsumsi selama masa kehamilan tidak boleh merugikan janin, termasuk kelainan jantung congenital.\n6. Kesiapan medis dan fiziologi: Jika ada risiko tinggi atau penyakit tetralogy of Fallot di dalam keluarga, periksa ulang pada janin dengan cara scan kebidahan yang lebih awal sebelum janin tumbuh besar.\n7. Kesiapan medis dan adaptabilitas: Jika ada penyakit tetralogy of Fallot atau kelainan jantung congenital lainnya di dalam keluarga, pastikan dukungan dan keahlian dokter dan perawat ahli yang tersedia untuk membantu ibu hamil menghadapi situasi ini.\n8. Kesiapan medis dan komunikasi: Pastikan hubungan antara pasien, keluarga, dan tim medis adalah transparan agar mereka semua dapat bekerja sama dalam pencegahan dan penyakit tetralogy of Fallot.\n9. Penyuluhan dan pendidikan: Konsultasikan dengan dokter kesehatan masyarakat tentang penyakit tetralogy of Fallot dan cara mencegahnya, agar ibu hamil dan pasien lain yang terlibat dapat mengetahui gejala awal dan langkah-langkah penting untuk diambil.\n10. Penyembuhan dan dukungan: Pastikan ada dukungan keluarga, teman, dan profesional serta fasilitas yang tersedia bagi pasien tetralogy of Fallot atau pasien lain dengan kelainan jantung congenital.\n\nDengan mengikuti langkah-langkah ini, ibu hamil dan tim perawat bisa mencegah penyakit tetralogy of Fallot pada janin dan memberikan dukungan yang baik kepada pasien serta keluarganya.",0.5555555555555556,0.7064595421041991,0.99999999995,1.0
Apa kelainan kondisi pada jantung seseorang yang mengalami takikardia?,"Takikardia adalah kondisi jantung yang berdetak melebihi 100 kali per menit. Normalnya, jantung berdetak 60–100 kali per menit. Jika detak jantung lebih dari 100 kali per menit, kondisi ini disebut takikardia.\n\nDetak jantung yang terlalu cepat dapat menyebabkan aliran darah yang masuk ke jantung berkurang. Kondisi ini membuat jantung tidak memiliki cukup darah untuk dialirkan ke seluruh tubuh. Akibatnya, organ dan jaringan yang tidak dialiri darah menjadi kekurangan oksigen.","['Topik: Takikardia, Subtopik: Pengertian Takikardia \n Takikardia adalah kondisi jantung yang berdetak melebihi 100 kali per menit. Takikardia dapat terjadi sebagai respons dari kondisi normal, penyakit, atau gangguan irama jantung (aritmia).\nNormalnya, jantung berdetak 60  100 kali per menit. Jika detak jantung lebih dari 100 kali per menit, kondisi ini disebut takikardia.\n\nTakikardia terbagi dua, yaitu takikardia sinus dan aritmia. Takikardia sinus bisa terjadi ketika seseorang sedang berolahraga. Kondisi ini juga dapat terjadi sebagai respons tubuh terhadap stres, trauma, atau penyakit. Sementara aritmia terjadi akibat gangguan pada serambi atau bilik jantung sehingga detak jantung menjadi lebih cepat.\nTakikardia umumnya tidak menimbulkan gejala atau komplikasi. Namun, kondisi ini dapat mengganggu fungsi jantung jika dibiarkan tidak tertangani. Akibatnya, penderita bisa mengalami gagal jantung, stroke, serangan jantung mendadak, bahkan kematian.\n', 'Topik: Takikardia, Subtopik: Pengertian Takikardia \n Normalnya, jantung berdetak 60  100 kali per menit. Jika detak jantung lebih dari 100 kali per menit, kondisi ini disebut takikardia.\n\nTakikardia terbagi dua, yaitu takikardia sinus dan aritmia. Takikardia sinus bisa terjadi ketika seseorang sedang berolahraga. Kondisi ini juga dapat terjadi sebagai respons tubuh terhadap stres, trauma, atau penyakit. Sementara aritmia terjadi akibat gangguan pada serambi atau bilik jantung sehingga detak jantung menjadi lebih cepat.\nTakikardia umumnya tidak menimbulkan gejala atau komplikasi. Namun, kondisi ini dapat mengganggu fungsi jantung jika dibiarkan tidak tertangani. Akibatnya, penderita bisa mengalami gagal jantung, stroke, serangan jantung mendadak, bahkan kematian.\n', 'Topik: Takikardia, Subtopik: Gejala Takikardia \n Detak jantung yang terlalu cepat dapat menyebabkan aliran darah yang masuk ke jantung berkurang. Kondisi ini membuat jantung tidak memiliki cukup darah untuk dialirkan ke seluruh tubuh. Akibatnya, organ dan jaringan yang tidak dialiri darah menjadi kekurangan oksigen.\nBeberapa gejala takikardia yang dapat muncul pada penderita adalah:\n- Jantung berdebar\n- Nyeri dada (angina)\n- Lelah atau lemah\n- Cemas\n- Keringat dingin\n- Sesak napas\n- Pusing\n- Pingsan\nPada beberapa kasus, takikardia juga dapat terjadi tanpa disertai gejala.\n']","Kelainan kondisi pada jantung seseorang yang mengalami takikardia terdiri dari beberapa gejala, yaitu:\n1. Jantung berdebar (palpitasi) – Gejala ini merujuk pada sensasi bahwa jantung meledak atau berdenyut secara lebih drastis daripada biasanya.\n2. Nyeri dada (angina) – Penderita mungkin mengeluh tentang nyeri di bagian belakang, tengah, atau kiri dalam lipatan hati, yang sering terkait dengan penyakit pada jantung atau arteri.\n3. Lelah atau lemah – Penderita mungkin merasakan sensasi lelah atau kelelahan yang cukup kuat dan berkeringat, sehingga mengurangi aktivitas rutinnya.\n4. Cemas – Keadaan gugup atau cemas juga dapat terjadi akibat takikardia, yang mungkin membuat penderita merasa gelisah dan tidak tenang.\n5. Keringat dingin – Penderita mungkin mengeluh tentang adanya keringat dingin atau nyeri di sekitar area jantung ketika takikardia terjadi, yang dapat merujuk pada gangguan lain yang disebabkan oleh aritmia.\n6. Sesak napas – Penderita mungkin merasa sulit menghirup udara dan bahkan mengeluh tentang sesak napas, terutama saat aktivitas fisik ringan atau sedang.\n7. Pusing – Gejala pusing juga seringkali muncul sebagai akibat dari gangguan ritme jantung yang cepat dan tidak terduga.\n8. Pingsan – Sebelum mengeluh tentang lelah, gelisah, atau sesak napas, penderita mungkin merasa gugup hingga mencapai fase lebih lanjut dari keadaan takikardia yang melibatkan pingsan.\nPada beberapa kasus, takikardia bisa terjadi tanpa disertai gejala atau komplikasi lainnya, tetapi hal ini juga penting untuk diperhatikan dan diuji oleh dokter medis agar tidak ada penyakit atau kelainan jantung yang belum terdeteksi.","Kelainan condisi pada jantung yang mengalami taki-kardi (takotsukusu) umumnya disebabkan oleh gangguan ritme jantung, dimana frekuensi nadi lebih cepat dari biasanya. Fenomena ini bisa disebabkan oleh beberapa faktor, seperti hipoksia (keracunan oksigen), infark miokardium, atau struktur anormal pada jantung itu sendiri.\n\nDalam hal taki-kardi, jantung mengalami gangguan ritme dan proporsi aliran darah yang signifikan. Hal ini bisa menyebabkan gejala seperti sensasi tidak nyaman di dalam panggul, lelah, ketidaknyamanan, atau bahkan kerusakan jaringan otot jantung itu sendiri.\n\nPenyebab taki-kardi yang umum termasuk:\n1. Hipoksia (keracunan oksigen)\n2. Pembalasan asam laktat intramuskuler atau hiperkapnia (peningkatan kadar karbondioksida dalam darah)\n3. Infark miokardium dan penyumbatan pembuluh darah\n4. Hipertiroidisme atau tiroiditis\n5. Anjakan jantung, seperti valvular heart disease atau aritmia\n6. Stimulasi obat-obatan, seperti stimulan narkotik atau cannabinoide\n7. Faktor psikologis dan emosi, seperti stres dan anehrasia (kesadaran rendah)\n8. Anjakan jantung induksi oleh obat-obatan, seperti beta blokader atau calcium channel blocker\n\nPeriksa medis dibutuhkan untuk menentukan penyebab taki-kardi dan mengatur terapi yang sesuai. Beberapa pasien mungkin memerlukan obat khusus untuk mengendalikan ritme jantung atau pengobatan lain, sedangkan beberapa orang mungkin akan mendapatkan solusi medis seperti implantable cardioverter-defibrillator (ICD) untuk mempertahankan sirkulasi normal dan mengurangi resiko serius dari aritmia.",0.5416666666666666,0.4206340984186608,0.9999999999666667,1.0
Siapa saja orang yang berisiko mengalami takikardia?,"Takikardia atau aritmia lebih sering terjadi pada orang dengan faktor berikut:\n\nBerusia lanjut\nMemiliki penyakit endokrin, seperti diabetes atau penyakit tiroid, yang tidak terkontrol\nMemiliki hipertensi yang tidak terkontrol\nMengalami infeksi bakteri atau virus yang berat\nMenderita atau pernah mengalami hipertensi pulmonal\nMengonsumsi minuman beralkohol secara berlebihan\nMenggunakan NAPZA\nTidak cukup mengonsumsi kalsium, magnesium, atau kalium\n\nTakikardia supraventrikuler lebih sering dialami oleh wanita dan anak-anak, orang yang memiliki kebiasaan merokok, serta orang yang mengonsumsi minuman beralkohol atau berkafein secara berlebihan.","['Topik: Takikardia, Subtopik: Faktor risiko takikardia \n Meski dapat dialami oleh siapa saja, takikardia lebih berisiko terjadi pada orang yang anggota keluarganya menderita aritmia. Selain itu, takikardia atau aritmia lebih sering terjadi pada orang dengan faktor berikut:\n- Berusia lanjut\n- Memiliki penyakit endokrin, seperti diabetes atau penyakit tiroid, yang tidak terkontrol\n- Memiliki hipertensi yang tidak terkontrol\n- Mengalami infeksi bakteri atau virus yang berat\n- Menderita atau pernah mengalami hipertensi pulmonal\n\n- Mengonsumsi minuman beralkohol secara berlebihan\n- Menggunakan NAPZA\n- Tidak cukup mengonsumsi kalsium, magnesium, atau kalium\n\nTakikardia supraventrikuler lebih sering dialami oleh wanita dan anak-anak, orang yang memiliki kebiasaan merokok, serta orang yang mengonsumsi minuman beralkohol atau berkafein secara berlebihan.\n', 'Topik: Takikardia, Subtopik: Pengertian Takikardia \n Takikardia adalah kondisi jantung yang berdetak melebihi 100 kali per menit. Takikardia dapat terjadi sebagai respons dari kondisi normal, penyakit, atau gangguan irama jantung (aritmia).\nNormalnya, jantung berdetak 60  100 kali per menit. Jika detak jantung lebih dari 100 kali per menit, kondisi ini disebut takikardia.\n\nTakikardia terbagi dua, yaitu takikardia sinus dan aritmia. Takikardia sinus bisa terjadi ketika seseorang sedang berolahraga. Kondisi ini juga dapat terjadi sebagai respons tubuh terhadap stres, trauma, atau penyakit. Sementara aritmia terjadi akibat gangguan pada serambi atau bilik jantung sehingga detak jantung menjadi lebih cepat.\nTakikardia umumnya tidak menimbulkan gejala atau komplikasi. Namun, kondisi ini dapat mengganggu fungsi jantung jika dibiarkan tidak tertangani. Akibatnya, penderita bisa mengalami gagal jantung, stroke, serangan jantung mendadak, bahkan kematian.\n', 'Topik: Takikardia, Subtopik: Pengertian Takikardia \n Normalnya, jantung berdetak 60  100 kali per menit. Jika detak jantung lebih dari 100 kali per menit, kondisi ini disebut takikardia.\n\nTakikardia terbagi dua, yaitu takikardia sinus dan aritmia. Takikardia sinus bisa terjadi ketika seseorang sedang berolahraga. Kondisi ini juga dapat terjadi sebagai respons tubuh terhadap stres, trauma, atau penyakit. Sementara aritmia terjadi akibat gangguan pada serambi atau bilik jantung sehingga detak jantung menjadi lebih cepat.\nTakikardia umumnya tidak menimbulkan gejala atau komplikasi. Namun, kondisi ini dapat mengganggu fungsi jantung jika dibiarkan tidak tertangani. Akibatnya, penderita bisa mengalami gagal jantung, stroke, serangan jantung mendadak, bahkan kematian.\n']","Orang yang berisiko mengalami takikardia termasuk mereka yang memiliki faktor risiko seperti:\n1. Anggota keluarga (sempit) yang menderita aritmia.\n2. Wanita dan anak-anak lebih lanjut usia, terutama jika mengonsumsi minuman beralkohol secara berlebihan atau merokok.\n3. Orang yang memiliki hipertensi yang tidak terkontrol.\n4. Penderita infeksi bakteri atau virus yang berat, termasuk penyakit jaringan tulang lemas (sarcoidosis).\n5. Terkena trauma fisik atau mengalami stres tinggi.\n6. Menggunakan obat-obatan seperti NAPZA dan tidak cukup mengonsumsi kalsium, magnesium, atau kalium.","Orang yang berisiko mengalami tikus adalah seseorang dengan riwayat penyakit jantung, penggunaan obat-obatan khusus, atau familiariitas dengan penyakit jantung. Faktanya, beberapa faktor risiko lain yang mempengaruhi kejadian tikus antara lain umur tinggi, penyakit hipertensi, obesitas, dan riwayat asidosis anaerobik (rangsangan otot secara berlebihan seperti yang ditemukan pada lompat jantung).\n\nNamun, perlu dicatat bahwa penyebab tikus umumnya tidak diketahui secara pasti dan sering kali merupakan kompleksitas multifactorial.",0.8571428571428571,0.9863192223632066,0.9999999999666667,1.0
Apa penyebab seseorang mengalami iskemia?,"Iskemia umumnya disebabkan oleh aterosklerosis, yaitu penumpukan plak lemak di pembuluh darah. Akibatnya, aliran darah pun menjadi terhambat. Penumpukan ini terjadi secara perlahan sehingga jarang disadari.\n\nSelain itu, plak di pembuluh darah bisa pecah dan membentuk gumpalan darah, yang dapat menyumbat pembuluh darah dan menghentikan aliran darah secara tiba-tiba. Gumpalan darah tersebut juga dapat terlepas dan menyumbat pembuluh darah di area lain. Kondisi ini disebut sebagai emboli.","['Topik: Iskemia, Subtopik: Penyebab Iskemia \n Iskemia umumnya disebabkan oleh aterosklerosis, yaitu penumpukan plak lemak di pembuluh darah. Akibatnya, aliran darah pun menjadi terhambat. Penumpukan ini terjadi secara perlahan sehingga jarang disadari.\nSelain itu, plak di pembuluh darah bisa pecah dan membentuk gumpalan darah, yang dapat menyumbat pembuluh darah dan menghentikan aliran darah secara tiba-tiba. Gumpalan darah tersebut juga dapat terlepas dan menyumbat pembuluh darah di area lain. Kondisi ini disebut sebagai emboli.\n', 'Topik: Iskemia, Subtopik: Faktor risiko iskemia  \n Sejumlah faktor berikut ini dapat meningkatkan risiko seseorang untuk mengalami iskemia:\n- Kondisi medis tertentu, seperti diabetes, hipertensi, hipotensi, kolesterol tinggi, trigliserida tinggi, obesitas, anemia sel sabit, gangguan irama jantung, tumor, kelainan darah, gagal ginjal, atau vaskulitis\n\n- Kebiasaan merokok\n\n- Konsumsi minuman beralkohol secara berlebihan\n- Penyalahgunaan NAPZA\n- Cedera \n- Jarang berolahraga \n- Ukuran lingkar pinggang yang lebih dari 80 cm pada wanita dan 90 cm pada pria\n', 'Topik: Iskemia, Subtopik: Pengertian Iskemia \n Iskemia adalah terganggunya aliran darah ke jaringan atau organ tubuh akibat adanya gangguan di pembuluh darah. Kondisi ini dapat terjadi di seluruh tubuh, mulai dari jaringan pada tungkai, saluran pencernaan, jantung, hingga otak. \nKetika terjadi iskemia, jaringan atau organ tidak mendapat cukup oksigen. Jika terjadi cukup lama, jaringan atau organ tersebut tidak dapat berfungsi dengan baik, bahkan bisa mengalami kerusakan. Oleh karena itu, iskemia bisa menyebabkan kondisi yang fatal jika terjadi pada organ yang vital, seperti jantung atau otak.\n\n']","Penyebab umum yang menyebabkan seseorang mengalami iskemia adalah arterioklerosis, yaitu penumpukan plak lemak di dalam arteri. Akibatnya, aliran darah menjadi terhambat sehingga oksigen tidak dapat diterima oleh jaringan atau organ tubuh secara merata. Hal ini bisa memicu kerusakan pada jaringan yang mengalami iskemia dan bisa berdampak fatal, terutama jika mengganggu organ vital seperti hati, jantung, atau otak.","Penyebab utama seseorang mengalami iskemia, yaitu ketidakpuluhan pembekuan atau disfungsi arteri yang menyebarkan darah ke jaringan tubuh. Ini dapat disebabkan oleh berbagai faktor, seperti:\n\n1. Arteriosklerosis (puskeselatan pembuluh darah): Keadaan di mana aterosklerosis membuang atau menyumbat arteri yang mengalirkan darah ke jaringan tubuh secara normal.\n2. Atelektasis: Pembekuan cepat pada saluran pernafasan, sehingga arus darah terganggu.\n3. Dislokasi arteri: Arteri yang terletak di luar posisinya dan tidak dapat menyebarkan darah secara efektif ke jaringan tubuh.\n4. Tumor (kanker): Penyumbatan arteri akibat pertumbuhan tumor atau inflamasi pada area tertentu.\n5. Inflamasi: Keadaan di mana pembuluh darah terpapar virus, bakteri, atau zat lain yang menyebabkan penyumbatan aliran darah.\n6. Trauma fisik: Penyebab pertama kali iskemia akibat luka atau kerusakan jaringan yang mengganggu aliran darah ke area tersebut.\n7. Obstruksi pengeluaran darah: Masalah dengan valve arteri atau sistem pengeluaran darah dalam hati, sehingga darah tidak bisa keluar dari hati dengan normal.",0.7142857142857143,0.5580766848197427,0.8333333332916666,1.0
Apa gejala iskemia yang terjadi di bagian jantung?,"Iskemia di jantung terjadi pada pembuluh darah koroner yang tersumbat sebagian atau seluruhnya. Kondisi ini bisa menyebabakn serangan jantung. \n\nGejala yang dapat muncul akibat iskema jantung antara lain:\n\nNyeri dada seperti tertekan\nNyeri di leher, rahang, bahu, atau lengan\nDetak jantung menjadi lebih cepat\nSesak napas, terutama saat melakukan aktivitas fisik\nMual dan muntah\nBerkeringat dingin\nLemas\nPusing atau sakit kepala ","['Topik: Iskemia, Subtopik: Gejala Iskemia: Iskemia di jantung  \n Iskemia di jantung terjadi pada pembuluh darah koroner yang tersumbat sebagian atau seluruhnya. Kondisi ini bisa menyebabakn serangan jantung. \nGejala yang dapat muncul akibat iskema jantung antara lain:\n- Nyeri dada seperti tertekan\n- Nyeri di leher, rahang, bahu, atau lengan\n- Detak jantung menjadi lebih cepat\n- Sesak napas, terutama saat melakukan aktivitas fisik\n- Mual dan muntah\n- Berkeringat dingin\n- Lemas\n- Pusing atau sakit kepala \n', 'Topik: Iskemia, Subtopik: Pengertian Iskemia \n Iskemia adalah terganggunya aliran darah ke jaringan atau organ tubuh akibat adanya gangguan di pembuluh darah. Kondisi ini dapat terjadi di seluruh tubuh, mulai dari jaringan pada tungkai, saluran pencernaan, jantung, hingga otak. \nKetika terjadi iskemia, jaringan atau organ tidak mendapat cukup oksigen. Jika terjadi cukup lama, jaringan atau organ tersebut tidak dapat berfungsi dengan baik, bahkan bisa mengalami kerusakan. Oleh karena itu, iskemia bisa menyebabkan kondisi yang fatal jika terjadi pada organ yang vital, seperti jantung atau otak.\n\n', 'Topik: Iskemia, Subtopik: Diagnosis Iskemia: 1. Pemeriksaan iskemia di jantung  \n - Elektrokardiografi (EKG), untuk merekam aktivitas listrik jantung\n- Tes tekanan (stress test), untuk memantau irama jantung, tekanan darah, dan laju pernapasan saat pasien melakukan aktivitas fisik\n\n- Ekokardiografi, untuk melihat struktur bentuk dan gerakan jantung\n- CT scan jantung, untuk mendeteksi aterosklerosis pada pembuluh darah koroner\n- Angiografi jantung, untuk memeriksa pembuluh darah koroner secara lebih detil\n\n']","Gejala iskemia yang bisa terjadi pada bagian jantung termasuk nyeri dada seperti tertekur, nyeri di leher, rahang, bahu, atau lengan, detak jantung menjadi lebih cepat, sesak napas, mual dan muntah, berkeringat dingin, lesu, pusing atau sakit kepala.","Gejala iskemia pada jantung dapat beragam, bergantung pada jenis dan sebab timbulnya gejala itu. Berikut beberapa gejala yang mungkin timbul akibat iskemia di bagian jantung:\n\n1. **Sakit nyeri atau sakit gesa** : Pemukiman lebih lanjut dapat disertai oleh rasa sakit pada bagian dada, puncak hati, atau perut yang bervariasi dari ringan hingga parah.\n\n2. **Sakit nafas berat** : Pemukiman lebih sering terjadi saat melakukan aktivitas fisik, menyebabkan seseorang merasa gatal atau bosan pada nafas.\n\n3. **Pusing dan kehilangan daya dukung** : Isteak hati yang timbul akibat iskemia dapat menimbulkan pusing dan kehilangan daya dukung, menyulitkan aktivitas sehari-hari.\n\n4. **Sakit pada pernapasan** : Pemukiman lebih sering terjadi saat berbaring atau saat tidur, yang dapat menimbulkan nyeri dada dan keguguran pada napas.\n\n5. **Mual dan muntah** : Gejala ini bisa disertai oleh rasa kesakitan di perut, seperti rasa lemas atau sakit.\n\n6. **Kurang tenang mental** : Pemukiman lebih sering terjadi pada seseorang yang memiliki tekanan atau ancaman iskemia jantung dalam hidupnya, seperti orang tua, pekerja di bidang medis, dan pasien jahanam.\n\n7. **Perubahan mental** : Imbangan kognitif dapat terpengaruh yang melibatkan kehilangan daya记忆 atau pemahaman dalam menghadapi situasi.\n\n8. **Pergerakan lemah dan dehidrasi** : Pemukiman lebih sering terjadi saat beraktivitas fisik, menyebabkan seseorang merasa gemetar atau lemah secara fisik.\n\n9. **Gesa ringan pada kaki dan tangan** : Isteak hati yang timbul akibat iskemia dapat menyebar ke bagian lain tubuh, termasuk jari-jari dan kaki.\n\n10. **Perubahan suhu badan** : Pemukiman lebih sering terjadi pada seseorang yang memiliki tekanan atau ancaman iskemia jantung dalam hidupnya, sehingga perubahan suhu badan dapat menunjukkan adanya gejala ini.\n\nGejala ini bisa timbul karena penyempitan arteri (stenosis) atau busur pembuluh darah di jantung yang mengganggu aliran darah dan oksigen ke jaringan hati. Pemukiman lebih dapat menandakan adanya iskemia, tetapi tidak semua gejala ini selalu terjadi bersamaan atau secara konsisten pada setiap pasien.\n\nKriteria medis tentang penyakit jantung dan iskemia telah didefinisikan oleh Amerika Serikat untuk membantu dalam diagnostikasi, tetapi gejala ini bisa berbeda-beda antara individu. Jika ada kesaksian tentang gejala iskemia jantung yang terlibat, sangatlah baik untuk segera menghubungi dokter atau penyakit jantung profesional untuk mendapatkan pemeriksaan dan perawatan medis yang tepat.",1.0,0.5896836317980648,0.99999999995,1.0
Bagaimana cara mengobati penyakit bradikardia?,"Pengobatan bradikardia akan disesuaikan dengan tingkat keparahannya dan penyebabnya. Sebagai contoh, jika penyebabnya adalah hipotiroidisme, dokter akan memberikan terapi yang sesuai untuk mengobati kondisi tersebut.\n\nSementara pada bradikardia yang disebabkan oleh penggunaan obat-obatan, dokter akan menurunkan dosis obat, mengganti jenis obat, atau menghentikan pengobatan.\n\nJika metode di atas tidak menunjukkan perbaikan atau kondisi pasien memburuk, dokter mungkin akan menyarankan penggunaan alat pacu jantung. Alat ini ditanam di dalam dada sebagai pengirim sinyal listrik ke jantung. Dengan begitu, detak jantung dapat kembali normal.","['Topik: Bradikardia, Subtopik: Pengobatan Bradikardia \n Pengobatan bradikardia akan disesuaikan dengan tingkat keparahannya dan penyebabnya. Sebagai contoh, jika penyebabnya adalah hipotiroidisme, dokter akan memberikan terapi yang sesuai untuk mengobati kondisi tersebut.\nSementara pada bradikardia yang disebabkan oleh penggunaan obat-obatan, dokter akan menurunkan dosis obat, mengganti jenis obat, atau menghentikan pengobatan.\nJika metode di atas tidak menunjukkan perbaikan atau kondisi pasien memburuk, dokter mungkin akan menyarankan penggunaan alat pacu jantung. Alat ini ditanam di dalam dada sebagai pengirim sinyal listrik ke jantung. Dengan begitu, detak jantung dapat kembali normal.\n', 'Topik: Bradikardia, Subtopik: Pencegahan Bradikardia \n Bradikardia tidak selalu bisa dicegah. Namun, ada beberapa upaya yang dapat dilakukan untuk menurunkan risiko terkena bradikardia, yaitu:\n- Mengonsumsi makanan bergizi seimbang, serta rendah garam dan gula\n- Tidak merokok atau menghentikan kebiasaan merokok\n- Menghindari penggunaan NAPZA\n- Tidak mengonsumsi minuman beralkohol\n- Menjaga berat badan ideal\n\n- Berolahraga secara rutin\n- Mengelola stres dengan baik\nSelain cara-cara di atas, lakukan pemeriksaan tekanan darah, kolesterol, dan kadar gula darah secara berkala ke dokter.\n', 'Topik: Bradikardia, Subtopik: Diagnosis Bradikardia \n Untuk mendiagnosis bradikardia, dokter akan bertanya seputar gejala yang muncul, riwayat penyakit dan obat-obatan yang dikonsumsi pasien. Setelah itu, dokter akan melakukan pemeriksaan fisik, termasuk mengukur tekanan darah dan denyut nadi serta mendengarkan detak jantung pasien menggunakan stetoskop.\nUntuk memastikan diagnosis, dokter akan melakukan pemeriksaan penunjang berikut:\n- Elektrokardiografi (EKG), untuk mengetahui aliran listrik pada jantung. Namun, EKG bisa menunjukkan hasil yang normal jika pada saat pemeriksaan pasien tidak mengalami bradikardia.\n- Holter monitoring, untuk mendeteksi bradikardia yang mungkin terjadi di lain waktu. Alat ini dapat merekam aktivitas listrik pada jantung secara terus-menerus selama 1  2 hari.\n- Event recorder, untuk melihat aliran listrik pada jantung melalui monitor di alat tersebut. Event recorder akan merekam aktivitas listrik jantung ketika muncul gejala. Alat ini umumnya digunakan selama beberapa minggu hingga 1 bulan.\n']","Mengobati bradikardia melalui beberapa metode tergantung pada penyebab dan tingkat keparahan kondisi tersebut. Berikut adalah cara mengobati bradikardia, sesuai dengan konteks yang diberikan:\n\n1. Hipotiroidisme: Jika penyebabnya hipotiroidisme, obat levothyroxine biasanya digunakan untuk meningkatkan kadar hormon tiroid dalam tubuh dan mengembalikan ritme jantung ke normal.\n2. Penggunaan obat-obatan: Jika penyebabnya penggunaan obat, dosis atau jenis obat dikurangi, diganti, atau penggunaan dilarang berdasarkan situasi khusus.\n3. Alat pacu jantung: Metode ini dilakukan apabila metode terdahulu tidak memberikan hasil yang memuaskan dan gejala pasien semakin buruk atau meningkat, di mana alat ditanam dalam dada untuk mengembalikan ritme jantung ke normal.\n4. Pembersihan sumsum tulang: Jika ada nodul hipertiroid yang menyumbat saluran pengeluaran darah, penyakit ini bisa disembuhkan dengan operasi.","Untuk mengobati bradycardia, metode medis yang umum digunakan termasuk penggunaan obat untuk mempercepat ritme jantung atau implantasi defibrilator (ICD) untuk mengembalikan ritme jantung ke normal. Pada kasus severe, bisa juga melalui penyuntikkan simpatomimetic seperti isoproterenol untuk meningkatkan frekuensi jantung dalam batas yang aman.\n\nNamun, selalu penting untuk meminta nasihat dari dokter atau saraf khususnya tentang penggunaan obat dan cara mengobati penyakit ini, karena setiap penyakit mungkin memerlukan pendekatan medis yang berbeda.",0.5833333333333334,0.0,0.9999999999,1.0
Bagaimana metode pemberian diagnosis pada pasien yang mengalami bradikardia?,"Untuk mendiagnosis bradikardia, dokter akan bertanya seputar gejala yang muncul, riwayat penyakit dan obat-obatan yang dikonsumsi pasien. Setelah itu, dokter akan melakukan pemeriksaan fisik, termasuk mengukur tekanan darah dan denyut nadi serta mendengarkan detak jantung pasien menggunakan stetoskop.\n\nUntuk memastikan diagnosis, dokter akan melakukan pemeriksaan penunjang berikut:\n\nElektrokardiografi (EKG), untuk mengetahui aliran listrik pada jantung. Namun, EKG bisa menunjukkan hasil yang normal jika pada saat pemeriksaan pasien tidak mengalami bradikardia.\nHolter monitoring, untuk mendeteksi bradikardia yang mungkin terjadi di lain waktu. Alat ini dapat merekam aktivitas listrik pada jantung secara terus-menerus selama 1–2 hari.\nEvent recorder, untuk melihat aliran listrik pada jantung melalui monitor di alat tersebut. Event recorder akan merekam aktivitas listrik jantung ketika muncul gejala. Alat ini umumnya digunakan selama beberapa minggu hingga 1 bulan.","['Topik: Bradikardia, Subtopik: Diagnosis Bradikardia \n Untuk mendiagnosis bradikardia, dokter akan bertanya seputar gejala yang muncul, riwayat penyakit dan obat-obatan yang dikonsumsi pasien. Setelah itu, dokter akan melakukan pemeriksaan fisik, termasuk mengukur tekanan darah dan denyut nadi serta mendengarkan detak jantung pasien menggunakan stetoskop.\nUntuk memastikan diagnosis, dokter akan melakukan pemeriksaan penunjang berikut:\n- Elektrokardiografi (EKG), untuk mengetahui aliran listrik pada jantung. Namun, EKG bisa menunjukkan hasil yang normal jika pada saat pemeriksaan pasien tidak mengalami bradikardia.\n- Holter monitoring, untuk mendeteksi bradikardia yang mungkin terjadi di lain waktu. Alat ini dapat merekam aktivitas listrik pada jantung secara terus-menerus selama 1  2 hari.\n- Event recorder, untuk melihat aliran listrik pada jantung melalui monitor di alat tersebut. Event recorder akan merekam aktivitas listrik jantung ketika muncul gejala. Alat ini umumnya digunakan selama beberapa minggu hingga 1 bulan.\n', 'Topik: Bradikardia, Subtopik: Pengobatan Bradikardia \n Pengobatan bradikardia akan disesuaikan dengan tingkat keparahannya dan penyebabnya. Sebagai contoh, jika penyebabnya adalah hipotiroidisme, dokter akan memberikan terapi yang sesuai untuk mengobati kondisi tersebut.\nSementara pada bradikardia yang disebabkan oleh penggunaan obat-obatan, dokter akan menurunkan dosis obat, mengganti jenis obat, atau menghentikan pengobatan.\nJika metode di atas tidak menunjukkan perbaikan atau kondisi pasien memburuk, dokter mungkin akan menyarankan penggunaan alat pacu jantung. Alat ini ditanam di dalam dada sebagai pengirim sinyal listrik ke jantung. Dengan begitu, detak jantung dapat kembali normal.\n', 'Topik: Bradikardia, Subtopik: Pengertian Bradikardia \n Bradikardia adalah kondisi jantung yang berdetak lebih lambat dari normal. Bradikardia yang parah merupakan kondisi serius yang dapat menyebabkan gejala berupa pusing berat, lemas, sesak napas, hingga pingsan.\nNormalnya, jantung berdetak sekitar 60  100 detak per menit. Namun, pada penderita bradikardia, detak jantungnya kurang dari 60 detak per menit. Kondisi ini normal terjadi pada atlet, lansia, atau saat sedang tidur.\n\nNamun, jika disertai keluhan lain, seperti nyeri dada atau sesak napas, bradikardia bisa menjadi salah satu gejala adanya gangguan aktivitas listrik pada jantung. Kondisi ini membuat jantung tidak dapat memompa cukup darah sesuai yang dibutuhkan tubuh. Akibatnya, akan terjadi gangguan pada organ, seperti otak dan jantung.\n']","Untuk mendiagnosis bradikardia, dokter akan bertanya tentang gejala yang dialami oleh pasien, riwayat penyakit dan obat-obatan yang dikonsumsi. Selanjutnya, dokter akan melakukan pemeriksaan fisik, seperti mengukur tekanan darah dan denyut nadi serta mendengarkan detak jantung menggunakan stetoskop. Untuk memastikan diagnosis, dokter juga dapat melakukan beberapa pemeriksaan penunjang seperti elektrokardiografi (EKG), holter monitoring, atau event recorder untuk mendeteksi bradikardia yang mungkin terjadi di lain waktu.","Saat diagnostikasi pada pasien dengan bradikardia, ahli penyakit jantung biasanya akan melakukan beberapa langkah utama. Pertama, mereka akan mengambil riwayat medis pasien untuk mengetahui apakah ada faktor resiko lain yang mungkin berhubungan dengan bradikardia atau gangguan jantung lainnya.\n\nKedua, mereka akan melakukan pemeriksaan fisik untuk mengidentifikasi adanya perubahan ritme dan frekuensi nadi yang tidak normal. Hal ini bisa dideteksi dengan mendengarkan suara jantung pasien menggunakan stetoskop, serta mengukur posisi elektrokardiogram (ECG) untuk mengetahui bentuk gelombang EKG dan periode interval PR.\n\nKetiga, untuk memastikan diagnosa bradikardia, ahli penyakit jantung mungkin akan menggunakan pengukuran khusus seperti holter eksternal atau implantable cardiac monitor (ICM). Holter eksternal adalah alat yang dapat merekam elektrokardiogram pasien dalam waktu yang lebih lama, mencakup aktivitas harian mereka. ICM adalah alat yang dapat disisipkan ke dalam tubuh untuk merekam ritme jantung selama minggu atau bahkan bulan, dan seringkali membantu mengidentifikasi bradikardia pada saat-saat tertentu ketika alami tidak ada gejolak nadi.\n\nTerakhir, jika perlu, mereka mungkin juga akan melakukan beberapa uji laboratorium seperti tes troponin untuk mengevaluasi risiko terapi infark miokardium atau penyebab lainnya dari bradikardia.\n\nDalam keseluruhan prosedur ini, tujuan ahli penyakit jantung adalah untuk mengidentifikasi dan memastikan bahwa pasien benar-benar mengalami bradikardia serta menentukan apakah ada faktor resiko atau gangguan lain yang perlu ditindaklanjuti.",1.0,0.8623473272136143,0.9999999999,1.0
Apa gejala yang muncul pada anak yang mengalami miokarditis?,Tanda dan gejala yang umumnya muncul pada anak-anak dan bayi dengan miokarditis adalah: \n\nLemas\nHilang nafsu makan\nBatuk\nSulit bernapas\nDemam\nKulit pucat\nLebih rewel daripada biasanya\nNyeri dada\nTangan atau kaki yang dingin,"['Topik: Miokarditis, Subtopik: Gejala Miokarditis \n Kebanyakan miokarditis tidak disadari oleh penderitanya karena kondisi ini bisa tidak bergejala atau hanya menimbulkan keluhan ringan. Jika terjadi keluhan, penderita mungkin mengalami gejala-gejala berikut:\n- Nyeri dada\n- Sesak napas, baik saat beraktivitas maupun ketika beristirahat\n- Jantung berdebar atau berdetak tidak beraturan\n\n- Pembengkakan di tungkai atau kaki\n- Lemas\n- Mudah lelah\n- Sakit kepala ringan atau malah berat seperti akan pingsan\nAda kemungkinan juga muncul gejala lain, yang jenisnya tergantung pada penyebab miokarditis itu sendiri. Sebagai contoh, jika miokarditis disebabkan oleh infeksi virus, penderita dapat mengalami demam, nyeri sendi, badan pegal-pegal, atau sakit tenggorokan.\nSementara itu, miokarditis pada anak dan bayi tidak memiliki gejala yang spesifik sehingga diperlukan pemeriksaan langsung oleh dokter. Tanda dan gejala yang umumnya muncul pada anak-anak dan bayi dengan miokarditis adalah: \n- Lemas\n- Hilang nafsu makan\n- Batuk\n- Sulit bernapas\n- Demam\n- Kulit pucat\n- Lebih rewel daripada biasanya\n- Nyeri dada\n- Tangan atau kaki yang dingin \n', 'Topik: Miokarditis, Subtopik: Diagnosis Miokarditis \n Diagnosis miokarditis dimulai dengan tanya jawab mengenai kondisi pasien. Dokter akan menanyakan kepada pasien tentang:\n- Gejala yang dirasakan dan lama berlangsungnya\n- Penyakit yang pernah atau sedang diderita\nSelanjutnya, dokter akan melakukan pemeriksaan fisik. Pada pemeriksaan ini, dokter akan mendengarkan bunyi jantung dan pernapasan dengan menggunakan stetoskop, serta melihat apakah ada pembengkakan di tungkai dan kaki pasien.\nDokter juga mungkin akan melakukan beberapa pemeriksaan penunjang berikut untuk memastikan diagnosis dan menentukan penyebab miokarditis:\n- Tes darah, untuk mendeteksi  tanda-tanda infeksi atau penyakit autoimun\n- Elektrokardiogram (EKG), untuk memeriksa aktivitas listrik jantung\n\n- Foto Rontgen dada, untuk melihat ukuran dan bentuk jantung, serta untuk memeriksa kemungkinan adanya gagal jantung\n- Ekokardiografi atau USG jantung, untuk memeriksa fungsi pompa jantung, serta mendeteksi gumpalan darah di dalam jantung, penumpukan cairan di selaput jantung (efusi perikardium), gangguan pada katup jantung, dan pembesaran jantung\n\n- MRI jantung, untuk melihat ada tidaknya peradangan pada otot jantung\n- Kateterisasi jantung yang disertai biopsi otot jantung (pemeriksaan dari sampel otot jantung), untuk melihat kondisi jantung\n', 'Topik: Miokarditis, Subtopik: Pengertian Miokarditis \n Miokarditis adalah peradangan yang terjadi pada miokardium atau otot jantung. Peradangan ini umumnya disebabkan oleh infeksi bakteri atau virus. Namun, pada beberapa kasus, miokarditis juga dapat terjadi akibat paparan zat berbahaya atau penggunaan obat-obatan tertentu.\nMiokardium adalah otot jantung yang berperan memompa darah dari jantung ke seluruh tubuh. Peradangan pada otot jantung dapat menyebabkan gangguan irama jantung dan menurunkan kemampuan jantung dalam memompa darah. \n\nMiokarditis ditandai dengan nyeri dada, sesak napas, dan jantung berdebar. Pada kasus yang ringan, miokarditis bisa sembuh dengan perawatan sederhana, serta tidak menyebabkan komplikasi. Namun, jika tidak tertangani dengan benar, miokarditis bisa menyebabkan komplikasi serius, seperti gangguan irama jantung, gagal jantung, dan serangan jantung.\n']","Gejala yang umumnya muncul pada anak-anak dan bayi dengan miokarditis, seperti yang dijelaskan dalam konteks tersebut, termasuk:\n\n1. Lemas\n2. Hilang nafsu makan\n3. Batuk\n4. Sulit bernapas\n5. Demam\n6. Kulit pucat\n7. Lebih rewel daripada biasanya\n8. Nyeri dada","Gejala yang sering timbul pada anak yang mengalami miokarditis berkaitan dengan gangguan fungsi jantung, termasuk:\n\n1. Sakit dada atau peraba rasa nyeri di belakang dada.\n2. Tersedaknya hati dan nyeri pada bagian leher, kerungkain, atau sisipan tengah antara lengan.\n3. Denaturan (perubahan suhu tubuh) yang berkaitan dengan kelelahan atau sakit badan.\n4. Kesulitan dalam bernapas pada aksi berat, seperti saat berjalan atau berenang.\n5. Nyeri di bagian dada ketika berhubungan dewasa.\n6. Pertumbuhan anak yang lambat dan perubahan gaya hidup lainnya.\n7. Pusingan, kehilangan kesadaran, atau gangguan fungsi otak yang bisa menggangu perilaku normal.",1.0,0.6305304479750177,0.8333333332916666,1.0
Bagaimana upaya pencegahan penyakit miokarditis?,"Sampai saat ini, belum diketahui secara pasti bagaimana cara untuk mencegah miokarditis. Namun, risiko terkena kondisi ini bisa dikurangi dengan melakukan upaya-upaya berikut:\n\nSelalu menjaga kebersihan diri, makanan, dan tempat tinggal \nMelakukan vaksinasi sesuai anjuran dokter\nMenghindari kontak dengan orang yang sedang sakit\nBerhubungan seks secara sehat, yaitu dengan memakai kondom dan tidak bergonta-ganti pasangan\nMengonsumsi obat sesuai aturan pakai dan dosis yang tertera, atau sesuai anjuran dokter\nMenghindari penggunaan obat-obatan terlarang","['Topik: Miokarditis, Subtopik: Pencegahan Miokarditis \n Sampai saat ini, belum diketahui secara pasti bagaimana cara untuk mencegah miokarditis. Namun, risiko terkena kondisi ini bisa dikurangi dengan melakukan upaya-upaya berikut:\n- Selalu menjaga kebersihan diri, makanan, dan tempat tinggal \n- Melakukan vaksinasi sesuai anjuran dokter\n- Menghindari kontak dengan orang yang sedang sakit\n- Berhubungan seks secara sehat, yaitu dengan memakai kondom dan tidak bergonta-ganti pasangan\n- Mengonsumsi obat sesuai aturan pakai dan dosis yang tertera, atau sesuai anjuran dokter\n- Menghindari penggunaan obat-obatan terlarang\n', 'Topik: Miokarditis, Subtopik: Pengertian Miokarditis \n Miokarditis adalah peradangan yang terjadi pada miokardium atau otot jantung. Peradangan ini umumnya disebabkan oleh infeksi bakteri atau virus. Namun, pada beberapa kasus, miokarditis juga dapat terjadi akibat paparan zat berbahaya atau penggunaan obat-obatan tertentu.\nMiokardium adalah otot jantung yang berperan memompa darah dari jantung ke seluruh tubuh. Peradangan pada otot jantung dapat menyebabkan gangguan irama jantung dan menurunkan kemampuan jantung dalam memompa darah. \n\nMiokarditis ditandai dengan nyeri dada, sesak napas, dan jantung berdebar. Pada kasus yang ringan, miokarditis bisa sembuh dengan perawatan sederhana, serta tidak menyebabkan komplikasi. Namun, jika tidak tertangani dengan benar, miokarditis bisa menyebabkan komplikasi serius, seperti gangguan irama jantung, gagal jantung, dan serangan jantung.\n', 'Topik: Miokarditis, Subtopik: Pengertian Miokarditis \n Miokardium adalah otot jantung yang berperan memompa darah dari jantung ke seluruh tubuh. Peradangan pada otot jantung dapat menyebabkan gangguan irama jantung dan menurunkan kemampuan jantung dalam memompa darah. \n\nMiokarditis ditandai dengan nyeri dada, sesak napas, dan jantung berdebar. Pada kasus yang ringan, miokarditis bisa sembuh dengan perawatan sederhana, serta tidak menyebabkan komplikasi. Namun, jika tidak tertangani dengan benar, miokarditis bisa menyebabkan komplikasi serius, seperti gangguan irama jantung, gagal jantung, dan serangan jantung.\n']","Upaya pencegahan miokarditis meliputi beberapa langkah sosial dan perilaku, seperti:\n\n1. Menjaga kebersihan diri, makanan, dan tempat tinggal: Mengevaluasi dan merawat lingkungan keluarga secara cermat adalah cara yang baik untuk menghindari penyebaran infeksi atau pengotoran.\n2. Melakukan vaksinasi sesuai anjuran dokter: Mengikuti rekomendasi dari dokter dalam memastikan keluarga teratur mengadopsi program vaksinasi yang lengkap dan efektif.\n3. Menghindari kontak dengan orang yang sedang sakit: Membiasakan diri untuk menjauh atau berhubungan jarak jauh saat seseorang mengalami infeksi, terutama infeksi pernapasan dan digestif, yang bisa berpengaruh pada miokardium.\n4. Berhubungan seks secara sehat: Menyadari pentingnya hubungan seks dengan cara aman dan menggunakan kondom untuk mencegah penyaluran infeksi atau kehamilan tidak sengaja, terlebih bagi mereka yang rentan terhadap miokarditis.\n5. Mengonsumsi obat sesuai aturan pakai dan dosis yang tertera, atau sesuai anjuran dokter: Mengevaluasi penggunaan obat-obatan oleh keluarga dan menghindari pemakaian obat-obatan tidak sehat atau berlebihan.\n6. Menghindari penggunaan obat-obatan terlarang: Mengevaluasi kebiasaan merokok, minum alkohol, dan pemakaian obat-obatan lain yang dilarang secara ketat oleh dokter atau lembaga kesehatan.\n\nDengan mengikuti langkah-langkah ini, risiko terkena miokarditis bisa dikurangi secara signifikan bagi individu dan keluarga mereka.","Upaya pencegahan penyakit miokarditis melibatkan beberapa aspek kesehatan, termasuk faktorial riwayat, diet dan aktivitas fisik. Berikut ini beberapa upaya yang dapat dilakukan:\n\n1. Mengurangi risiko infeksi primer: Terdapat hubungan antara infeksi primitif seperti flu atau sariawan dengan riwayat penyakit miokarditis. Mencegah infeksi ini melalui imunitas dan makanannya yang baik.\n2. Mengurangi risiko infeksi sekunder: Penyebab utama lainnya adalah infeksi primitif yang terpantau dalam jaringan miokardium, biasanya akibat sternotomi atau hipervaskulitis. Mencegah infeksi ini melalui pengobatan dan penyembuhan lancar dari infeksi primer lainnya.\n3. Mengurangi risiko fisik: Pemulihan miokardium yang tidak sempurna dapat memicu terjadinya miokarditis setelah trauma fisik atau operasi jantung, sehingga penggunaan obat-obatan dan konseling medis perlu diminimalkan.\n4. Mengurangi risiko farmakologis: Beberapa obat yang digunakan untuk penyakit jantung lain (seperti beta bloker atau calcium channel blokir) bisa meningkatkan risiko miokarditis, khususnya pada pasien dengan riwayat infeksi primitif. Perlu dilakukan balas清胆 dan penilaian dosis yang tepat untuk mencegah hal ini.\n5. Mengurangi stress: Stress berlebihan bisa mempengaruhi fungsi jantung, sehingga pengelolaan stres secara efektif menjadi penting dalam upaya penyakit miokarditis prevention.",0.6,0.6666229883645022,0.9999999999,1.0
Apa gejala yang muncul pada penderita hipertensi pulmonal?,Beberapa gejala awal hipertensi pulmonal yang mungkin muncul adalah:\n\nNapas yang pendek atau terputus-putus\nNyeri atau rasa tertekan di dada\nNyeri di perut bagian kanan atas\nJantung berdebar\nLemas\nSuara serak\nHilang nafsu makan\n\nSedangkan gejala yang muncul saat kondisi telah bertambah parah meliputi:\n\nPembengkakan di area tungkai dan perut\nPusing saat sedang berolahraga\nWarna bibir atau kulit yang kebiruan\nBatuk kering atau batuk berdarah\nPingsan,"['Topik: Hipertensi Pulmonal, Subtopik: Pengertian Hipertensi Pulmonal \n Hipertensi pulmonal adalah tekanan darah tinggi yang secara spesifik terjadi pada pembuluh darah arteri di paru-paru dan sisi kanan jantung. Kondisi ini awalnya bisa tidak disadari, kemudian lama-kelamaan makin serius dan dapat berakibat fatal.\nHipertensi pulmonal dapat terjadi pada semua orang, tetapi penyakit ini sering kali menyerang orang yang menderita gangguan di jantung atau paru-paru. Kondisi ini dapat terjadi dengan sendirinya atau disebabkan oleh penyakit lain.\n\nHipertensi pulmonal berkembang dengan perlahan sehingga gejalanya pun timbul secara bertahap. Penderita dapat tidak mengalami gejala apa pun pada tahap awal, tetapi gejala kemudian akan muncul dan bertambah parah seiring dengan berkembangnya kondisi.\nHipertensi pulmonal umumnya dapat ditandai oleh gejala berikut ini:\n- Napas pendek selama beraktivitas\n- Kelelahan\n- Nyeri dada\n- Jantung berdebar\n- Nyeri pada bagian kanan atas perut\n- Hilang nafsu makan\nHipertensi pulmonal terjadi ketika arteri kecil di paru-paru dan pembuluh kapilernya menyempit, tersumbat, atau rusak. Kondisi ini mengakibatkan darah dari sisi kanan jantung sulit mengalir ke paru-paru. Akibatnya, tekanan pada arteri paru-paru juga meningkat.\nSeiring peningkatan tekanan tersebut, bilik kanan jantung harus bekerja lebih keras untuk memompa darah menuju paru-paru. Kondisi ini seiring waktu membuat otot jantung melemah dan dapat memicu beragam komplikasi, yang meliputi:\n- Gagal jantung\n- Pembesaran jantung\n- Aritmia\n- Penggumpalan darah\n- Perdarahan pada paru-paru\n- Komplikasi kehamilan\nHipertensi pulmonal jarang terdiagnosis pada tahap awal dan biasanya baru disadari setelah penyakit tersebut berkembang selama beberapa waktu atau setelah mencapai tahap lanjut. Diagnosa biasanya ditetapkan melalui pemindaian jantung dan paru-paru, serta elektrokardiogram.\nHipertensi pulmonal merupakan penyakit yang belum dapat disembuhkan, sehingga pengobatan akan lebih difokuskan untuk meredakan gejala atau memperlambat perkembangan penyakit.\nPenanganan sedini mungkin penting untuk dilakukan agar tidak terjadi komplikasi. Selain itu, penderita juga disarankan untuk mengubah gaya hidup untuk memperbaiki kondisinya.\n', 'Topik: Hipertensi Pulmonal, Subtopik: Gejala Hipertensi Pulmonal: Kapan harus ke dokter \n Periksakan diri Anda ke dokter jika mengalami gejala seperti yang telah disebutkan di atas. Gejala hipertensi pulmonal dapat menyerupai gejala dari kondisi lain. Oleh sebab itu, diperlukan pemeriksaan untuk memastikan kondisi yang dialami.\nDiagnosis hipertensi pulmonal sebaiknya diketahui sedini mungkin, bahkan sebelum gejala muncul. Dengan begitu, potensi kesembuhan meningkat dan risiko terjadinya komplikasi dapat dicegah. Oleh karena itu, jika Anda memiliki faktor risiko hipertensi pulmonal, disarankan untuk melakukan pemeriksaan ke dokter secara rutin.\nSegera cari pertolongan medis jika Anda mengalami gejala yang serius, seperti:\n- Nyeri atau rasa tidak nyaman di dada yang disertai dengan sesak napas, berkeringat, mual, dan kelelahan\n- Denyut jantung yang sangat cepat hingga lebih dari 120  150 per menit, terutama jika disertai dengan sesak napas\n- Sesak napas yang tidak dapat diredakan dengan beristirahat\n- Lemah atau lumpuh di lengan dan tungkai yang terjadi tanpa sebab yang jelas\n- Sakit kepala berat yang muncul secara tiba-tiba\n', 'Topik: Hipertensi Pulmonal, Subtopik: Pengobatan Hipertensi Pulmonal: Operasi \n Sebagian penderita hipertensi pulmonal juga dapat menjalani prosedur operasi untuk mengatasi gejala yang dialami. Operasi yang dapat dilakukan antara lain:\n- Endarterektomi paru\nTindakan ini dilakukan untuk menghilangkan darah yang telah lama menggumpal di arteri pulmonal. Prosedur ini dilakukan pada penderita hipertensi pulmonal dan emboli paru.\n- Balloon pulmonary angioplasty\nProsedur ini dilakukan untuk melancarkan aliran darah ke paru-paru. Pada prosedur ini, balon kecil dimasukkan ke dalam arteri yang aliran darahnya terhambat. Setelah itu, balon dikembangkan beberapa saat untuk membuka hambatan.\n- Septostomi atrium\nSeptostomi atrium dilakukan untuk mengatasi gejala yang tidak dapat diredakan dengan obat-obatan. Pada prosedur ini, dokter melakukan bedah terbuka untuk membuat celah di antara atrium kiri dan kanan jantung, guna melonggarkan tekanan pada sisi kanan jantung. Dengan begitu, jantung dapat memompa darah secara lebih efisien.\n- Transplantasi paru-paru atau jantung-paru\nTransplantasi dilakukan pada hipertensi pulmonal yang sudah sangat parah. Prosedur ini biasanya dilakukan pada pasien yang masih berusia muda dan menderita hipertensi arteri pulmonal idiopatik.\nTransplantasi paru-paru atau jantung-paru dilakukan jika pengobatan lain tidak menunjukkan perbaikan. Hanya saja, prosedur ini belum bisa dilaksanakan di Indonesia.\nUntuk mengoptimalkan upaya pengobatan, pasien juga perlu melakukan perubahan gaya hidup. Berikut ini adalah beberapa langkah yang dapat dilakukan:\n- Beristirahat yang cukup, untuk membantu mengurangi gejala lemas akibat hipertensi pulmonal\n- Tetap aktif berolahraga dengan terlebih dahulu berkonsultasi dengan dokter mengenai jenis olahraga yang tepat\n- Menghindari aktivitas yang dapat menurunkan tekanan darah, seperti sauna atau mandi dengan air panas terlalu lama, dan aktivitas yang menyebabkan tegang otot dalam waktu lama, seperti mengangkat benda berat\n- Berhenti merokok dan menghindari paparan asap rokok dari orang lain\n- Menghindari tinggal atau terlalu lama berada di dataran tinggi, karena dapat memperburuk gejala hipertensi pulmonal\n- Menggunakan alat kontrasepsi untuk mencegah kehamilan, karena kehamilan dapat berbahaya bagi penderita hipertensi pulmonal\n- Mendapatkan vaksin pneumonia dan influenza secara rutin, karena dua penyakit tersebut dapat memperburuk hipertensi pulmonal\n- Mengonsumsi obat yang diresepkan secara teratur sesuai dengan anjuran dokter dan berkonsultasi dengan dokter sebelum mengonsumsi obat lainnya\n- Menjalani pemeriksaan secara berkala, sesuai dengan anjuran dari dokter\nDengan menjalani pengobatan dan mengubah gaya hidup, perkembangan penyakit dapat diperlambat dan kondisi pasien akan membaik. Selain itu, dukungan dari teman dan keluarga sangat penting, agar penderita hipertensi pulmonal tidak merasa cemas dan tertekan.\n']","Gejala yang seringkali muncul pada penderita hipertensi pulmonal termasuk napas pendek selama beraktivitas, kelelahan, nyeri dada, jantung berdebar, nyeri pada bagian kanan atau atas perut, hilang nafsu makan. Kondisi ini umumnya terjadi secara bertahap dan dapat membuat pasien merasa lemas atau kelelahan tanpa sebab yang jelas. Gejala-gejala ini biasanya muncul karena penyumbatan pada arteri paru-paru, menyebabkan darah untuk mengalir kurang dengan optimal dan menimbulkan tekanan dalam sistem peredaran darah.\n\nDokter seringkali merencanakan pemeriksaan khusus atau mengadopsi perubahan gaya hidup yang lebih sehat untuk memperbaiki penyakit dan mencegah komplikasi, seperti gangguan jantung, sisa darah, atau cedera lainnya.","Gejala yang umumnya timbul pada pasien dengan penyakit jantung hipertensi pulmonal (PHTL) termasuk gejala fisik dan fungsional. Berikut beberapa gejala yang sering diobservasi dalam kasus PHTL:\n\n1. Sesaknya napas atau mualcau saat beraktivitas, yang biasanya disebabkan oleh penyumbatan pada arteri pulmonal atau hipertensi jantung.\n2. Tingginya tekanan darah dan volumenya (hipertrofi nadi dan volume darah tetap tinggi), serta perubahan struktur ventrikel kanan seperti dilatasi.\n3. Efusi alveolar, yaitu kelebihan cairan di paru-paru yang dapat menyebabkan edema pernapasan atau berkeringat saat beraktivitas.\n4. Telinga terdapat suara 'whooshing' akibat gerusan aliran darah melalui arteri pulmonal.\n5. Sesaknya napas dan penurunan kualitas hidup yang lebih lanjut, yang dapat meningkatkan risiko disentrialisasi atau depresi pada pasien PHTL.\n6. Gejala sindrom jantung restriktif, seperti ketegatan dan rasa nyerah, serta gejala umum lainnya yang disebabkan oleh tekanan darah tinggi atau penyakit jantung lainnya.\n7. Penyempitan pembuluh darah di otak akibat hipoksina (kurangnya oksigen) yang dapat menyebabkan konvulsi dan gangguan kognitif.\n\nNamun, kebanyakan gejala ini hanya muncul ketika pasien PHTL mengalami penurunan fungsi jantung atau gejala hipertensi pulmonal yang lebih lanjut seperti efusi alveolar atau disfungsi arteri pulmonal.\n\nItu adalah beberapa gejala paling umum dari pasien PHTL, tetapi setiap kasus boleh jadi berbeda dan memerlukan pemeriksaan medis yang akurat untuk menentukan diagnosis dan mengatasi masalah tersebut.",0.875,0.7120167141972713,0.99999999995,0.4166666666666667
Apa obat yang dapat diberikan pada penderita hipertensi pulmonal?,"Jenis obat yang bisa diberikan antara lain:\n\nSildenafil atau tadalafil\nSildenafil dan tadalafil berfungsi membuka pembuluh darah paru-paru agar darah dapat mengalir dengan lebih mudah.\n\nAntagonis kalsium\nObat ini berfungsi melemaskan otot pembuluh darah, tetapi hanya ampuh pada sebagian penderita hipertensi pulmonal. Beberapa obat yang termasuk ke dalam golongan ini adalah nifedipine, diltiazem, dan amlodipine.\n\nAntikoagulan\nAntikoagulan, seperti warfarin, merupakan obat pengencer darah yang berfungsi menghambat terbentuknya gumpalan darah di arteri paru-paru. Meski obat ini sering digunakan, penggunaannya perlu dievaluasi secara rutin karena dapat meningkatkan risiko terjadinya perdarahan.\n\nDiuretik\nDiuretik adalah obat yang berfungsi mengurangi cairan di dalam tubuh sehingga kerja jantung menjadi lebih ringan. Obat ini juga dapat mengurangi penumpukan cairan di paru-paru, tungkai, dan perut pada pasien yang sudah mengalami komplikasi gagal jantung.\n\nDigoxin\nDigoxin adalah obat yang berfungsi membantu jantung berdenyut lebih kuat agar dapat memompa lebih banyak darah. Obat ini juga dapat mengendalikan denyut jantung menjadi lebih teratur.\n\nVasodilator\nVasodilator digunakan untuk melemaskan dan membuka pembuluh darah yang menyempit di paru-paru. Dengan begitu, darah dapat mengalir lebih baik. Contoh obat dari golongan ini antara lain epoprostenol, beraprost, dan iloprost.","['Topik: Hipertensi Pulmonal, Subtopik: Pengobatan Hipertensi Pulmonal \n Hipertensi pulmonal merupakan penyakit yang belum dapat disembuhkan. Pengobatan hanya bertujuan untuk meredakan gejala dan menghambat perkembangan penyakit. Jika didiagnosis dan ditangani sejak dini, kerusakan arteri pulmonal secara permanen dapat dicegah.\nPengobatan hipertensi pulmonal dapat dilakukan dengan menangani kondisi itu sendiri, atau mengatasi penyebab yang mendasarinya. Beberapa metode pengobatan yang dapat dilakukan meliputi:\n', 'Topik: Hipertensi Pulmonal, Subtopik: Penyebab Hipertensi Pulmonal: Faktor Risiko Hipertensi Pulmonal \n Risiko terkena hipertensi pulmonal lebih dapat meningkat pada orang dengan kondisi berikut:\n- Berjenis kelamin wanita\n- Berusia 30 tahun ke atas\n- Menderita berat badan berlebih\n- Memiliki keluarga dengan riwayat hipertensi pulmonal\n- Menderita kelainan lahir, seperti penyakit jantung bawaan atau sindrom Down\n\n- Memiliki kondisi medis lain, seperti penyakit hati, penyakit penggumpalan darah, penyakit ginjal kronis, atau penyakit tiroid\n- Mengonsumsi obat-obatan penurun berat badan\n- Mengonsumsi obat selective serotonin reuptake inhibitors (SSRIs) untuk mengatasi depresi dan gangguan kecemasan\n- Memiliki kebiasaan merokok\n- Menyalahgunakan NAPZA, seperti kokain\n- Terpapar asbes\n', 'Topik: Hipertensi Pulmonal, Subtopik: Diagnosis Hipertensi Pulmonal \n Dokter akan bertanya mengenai gejala yang dialami, riwayat kesehatan pasien dan keluarga, serta obat-obatan yang sedang dikonsumsi. Dokter juga akan melakukan pemeriksaan fisik secara menyeluruh, termasuk mendengarkan suara jantung dan paru-paru melalui stetoskop, serta memeriksa pembengkakan di tungkai dan pergelangan kaki.\nGuna memastikan diagnosis, beberapa pemeriksaan penunjang juga perlu dilakukan. Karena gejala hipertensi pulmonal mirip dengan beberapa penyakit jantung, dokter akan mengawali dengan pemeriksaan jantung, di antaranya:\n']","Obat-obatan yang umumnya digunakan untuk mengatasi hipertensi pulmonal termasuk obat blokade kanal kalium (IKK), endotelin receptor antagonist, dan prostacyclin analog. Namun, disarankan agar penggunaan obat ini dilakukan di bawah direktur dokter atau ahli medis yang ahli dalam bidang tersebut untuk memastikan keamanan dan efek samping yang tidak timbul.","Obat-obatan yang umum diberikan untuk penderita hipertensi pulmonal (pembesaran tulang keriting atau bulbiata pulmonalis) meliputi:\n\n1. Epoprostenol (Cloxateplase): Inokulum utama yang sering digunakan dalam praktik klinik untuk mengurangi tekanan darah dan mengecili pembesaran tulang keriting.\n2. Bosentan: Obat oral dengan mekanisme dual, yang bekerja sebagai antagonist endotelial angiotensin II dan prostacyclin, sering digunakan untuk kontrol hipertensi pulmonal.\n3. Sildenafil (Viagra), tadalafil (Cialis), atau riociguat: Obat-obatan yang bekerja dengan cara mengecili pembesaran tulang keriting dan mengurangi tekanan darah, seringkali digunakan sebagai terapi alternatif.\n4. Diuretik: Seperti furosemide atau milrinone, yang biasanya digunakan untuk menangani sindrom jantung kan yang umumnya disertai dengan hipertensi pulmonal.\n5. Antikoagulan: Obat-obatan lain seperti warfarin dan heparin seringkali digunakan untuk mencegah penggenangan darah akut (emboli) yang umumnya terjadi dalam hipertensi pulmonal.\n6. Angiotensin II receptor antagonist, contohnya losartan atau valsartan, juga sering digunakan secara eksperimen untuk penderita hipertensi pulmonal.\n\nSemua obat-obatan ini harus diberikan di bawah perawatan dokter spesialisasi dan dosis yang tepat akan menyesuaikan sesuai dengan kondisi pasien.",0.0,0.0,0.99999999995,0.0
Apa saja hal yang dapat meningkatkan risiko terkena penyakit hipertensi pulmonal?,"Risiko terkena hipertensi pulmonal lebih dapat meningkat pada orang dengan kondisi berikut:\n\nBerjenis kelamin wanita\nBerusia 30 tahun ke atas\nMenderita berat badan berlebih\nMemiliki keluarga dengan riwayat hipertensi pulmonal\nMenderita kelainan lahir, seperti penyakit jantung bawaan atau sindrom Down\nMemiliki kondisi medis lain, seperti penyakit hati, penyakit penggumpalan darah, penyakit ginjal kronis, atau penyakit tiroid\nMengonsumsi obat-obatan penurun berat badan\nMengonsumsi obat selective serotonin reuptake inhibitors (SSRIs) untuk mengatasi depresi dan gangguan kecemasan\nMemiliki kebiasaan merokok\nMenyalahgunakan NAPZA, seperti kokain\nTerpapar asbes","['Topik: Hipertensi Pulmonal, Subtopik: Penyebab Hipertensi Pulmonal: Faktor Risiko Hipertensi Pulmonal \n Risiko terkena hipertensi pulmonal lebih dapat meningkat pada orang dengan kondisi berikut:\n- Berjenis kelamin wanita\n- Berusia 30 tahun ke atas\n- Menderita berat badan berlebih\n- Memiliki keluarga dengan riwayat hipertensi pulmonal\n- Menderita kelainan lahir, seperti penyakit jantung bawaan atau sindrom Down\n\n- Memiliki kondisi medis lain, seperti penyakit hati, penyakit penggumpalan darah, penyakit ginjal kronis, atau penyakit tiroid\n- Mengonsumsi obat-obatan penurun berat badan\n- Mengonsumsi obat selective serotonin reuptake inhibitors (SSRIs) untuk mengatasi depresi dan gangguan kecemasan\n- Memiliki kebiasaan merokok\n- Menyalahgunakan NAPZA, seperti kokain\n- Terpapar asbes\n', 'Topik: Hipertensi Pulmonal, Subtopik: Pencegahan Hipertensi Pulmonal \n Meski tidak semua jenis hipertensi pulmonal dapat dicegah, risiko terjadinya kondisi ini dapat dihindari dengan mengubah gaya hidup, misalnya dengan menurunkan berat badan yang berlebih, menerapkan pola makan yang sehat, dan menghindari kebiasaan merokok.\nPencegahan juga dapat dilakukan dengan menangani kondisi lain yang dapat memicu terjadinya hipertensi pulmonal, seperti hipertensi, penyakit jantung koroner, penyakit hati kronis, penyakit paru-paru konis, dan sleep apnea.\n', 'Topik: Hipertensi Pulmonal, Subtopik: Penyebab Hipertensi Pulmonal: Hipertensi pulmonal akibat kondisi lain \n Beberapa kondisi lain yang dapat menyebabkan hipertensi pulmonal adalah:\n- Sarkoidosis\n- Tumor yang menekan pembuluh arteri paru-paru\n- Penyakit ginjal\n- Sindrom Eisenmenger\nMeski jarang terjadi, hipertensi pulmonal juga dapat dialami oleh bayi baru lahir. Kondisi ini membuat jantung tidak bisa mengalirkan darah sarat oksigen ke seluruh tubuh. Penyakit ini dikenal dengan hipertensi pulmonal persisten pada bayi baru lahir.\n']","Hal-hal yang dapat meningkatkan risiko terkena penyakit hipertensi pulmonal (HPP) antara lain:\n\n1. Berjenis kelamin wanita, terutama pada usia 30 tahun ke atas.\n2. Menderita berat badan berlebih.\n3. Memiliki keluarga dengan riwayat hipertensi pulmonal.\n4. Mengalami penyakit lahir, seperti sindrom Down atau penyakit jantung bawaan.\n5. Menderita kondisi medis lain, seperti penyakit hati, penyakit penggumpalan darah, penyakit ginjal kronis, atau penyakit tiroid.\n6. Mengonsumsi obat-obatan penurun berat badan.\n7. Mengonsumsi obat selective serotonin reuptake inhibitors (SSRI) untuk mengatasi depresi dan gangguan kecepatan aksi.\n8. Memiliki kebiasaan merokok.\n9. Mengonsumsi NAPZA secara menyeluruh atau merokok.\n10. Terpapar asbes, yang dapat meningkatkan risiko penyakit jantung dan kanker.","Hal-hal yang dapat meningkatkan risiko terkena penyakit hipertensi pulmonal (PH) termasuk:\n\n1. Penyebab lain seperti asma, bronkiolitis atresia, dan fibrosis kronis.\n2. Faktor genetik, seperti pola familial dari penyakit jantung atau hipertensi pulmonal.\n3. Obesitas tinggi berat badan, terutama orang yang memiliki proporsi tubuh ekstrem.\n4. Asupan obat-obatan tidak sah dan merokok.\n5. Kontak lingkungan dengan bahan toksinya seperti radon atau asap rokok.\n6. Pemakaian alkohol dan stimulan yang berlebihan.",1.0,0.5701823094045629,0.9999999999666667,1.0
Apa penyebab penyakit endokarditis?,"Endokarditis terjadi ketika kuman masuk ke aliran darah dan bergerak menuju jantung. Kuman tersebut lalu menempel di katup jantung yang mengalami gangguan atau di jaringan jantung yang rusak. Selanjutnya, kuman tersebut akan berkembang biak di lapisan dalam jantung (endokardium).\n\nKuman penyebab endokarditis dapat masuk ke aliran darah melalui:\n\nGigi yang berlubang atau infeksi pada rongga mulut, sehingga kuman dapat masuk dengan mudah ke aliran darah\nBagian tubuh lain yang terinfeksi, misalnya infeksi di kulit, infeksi menular seksual, atau infeksi di saluran pencernaan\nKateter urine atau jarum infus, terutama yang telah dipasang dalam jangka waktu lama, misalnya pada pasien stroke atau cuci darah\nJarum suntik yang terkontaminasi kuman, baik pada penggunaan NAPZA suntik, pembuatan tato, maupun pemasangan tindik","['Topik: Endokarditis, Subtopik: Penyebab Endokarditis \n Endokarditis terjadi ketika kuman masuk ke aliran darah dan bergerak menuju jantung. Kuman tersebut lalu menempel di katup jantung yang mengalami gangguan atau di jaringan jantung yang rusak. Selanjutnya, kuman tersebut akan berkembang biak di lapisan dalam jantung (endokardium).\nKuman penyebab endokarditis dapat masuk ke aliran darah melalui:\n- Gigi yang berlubang atau infeksi pada rongga mulut, sehingga kuman dapat masuk dengan mudah ke aliran darah\n- Bagian tubuh lain yang terinfeksi, misalnya infeksi di kulit, infeksi menular seksual, atau infeksi di saluran pencernaan\n\n- Kateter urine atau jarum infus, terutama yang telah dipasang dalam jangka waktu lama, misalnya pada pasien stroke atau cuci darah\n\n- Jarum suntik yang terkontaminasi kuman, baik pada penggunaan NAPZA suntik, pembuatan tato, maupun pemasangan tindik\n', 'Topik: Endokarditis, Subtopik: Pengertian Endokarditis \n Endokarditis adalah peradangan di endokardium, yaitu lapisan bagian dalam jantung. Peradangan ini umumnya disebabkan oleh bakteri, tetapi bisa juga disebabkan oleh virus atau jamur.\nEndokarditis merupakan penyakit peradangan yang jarang terjadi. Penyakit ini hanya dialami oleh 3  10 orang dari setiap 100.000 orang, dan jarang menyerang orang yang jantungnya sehat.\n\n \nEndokarditis paling berisiko terjadi pada pasien yang menderita kerusakan katup jantung, telah menjalani operasi cangkok katup jantung, atau menderita kelainan jantung. \nMeski banyak penderitanya yang sembuh, endokarditis dapat memicu komplikasi serius jika tidak segera ditangani. Oleh karenanya, pemeriksaan dan pengobatan sedini mungkin perlu dilakukan.\n', 'Topik: Endokarditis, Subtopik: Pengertian Endokarditis \n Endokarditis merupakan penyakit peradangan yang jarang terjadi. Penyakit ini hanya dialami oleh 3  10 orang dari setiap 100.000 orang, dan jarang menyerang orang yang jantungnya sehat.\n\n \nEndokarditis paling berisiko terjadi pada pasien yang menderita kerusakan katup jantung, telah menjalani operasi cangkok katup jantung, atau menderita kelainan jantung. \nMeski banyak penderitanya yang sembuh, endokarditis dapat memicu komplikasi serius jika tidak segera ditangani. Oleh karenanya, pemeriksaan dan pengobatan sedini mungkin perlu dilakukan.\n']","Penyebab endokarditis adalah kuman yang masuk ke aliran darah dan bergerak menuju jantung. Kuman tersebut lalu menempel di katup jantung yang mengalami gangguan atau di jaringan jantung yang rusak, sehingga berkembang biak di lapisan dalam jantung (endokardium).\n\nKuman penyebab endokarditis dapat masuk ke aliran darah melalui beberapa cara:\n1. Gigi yang berlubang atau infeksi pada rongga mulut, sehingga kuman dapat masuk dengan mudah ke aliran darah.\n2. Bagian tubuh lain yang terinfeksi, misalnya infeksi di kulit, infeksi menular seksual, atau infeksi di saluran pencernaan.\n3. Kateter urine atau jarum infus, terutama yang telah dipasang dalam jangka waktu lama, misalnya pada pasien stroke atau cuci darah.\n4. Jarum suntik yang terkontaminasi kuman, baik pada penggunaan NAPZA suntik, pembuatan tato, maupun pemasangan tindik.",Penyebab penyakat endokarditis termasuk penyakit infeksi yang diare sesuai dengan benda keras atau lembek dalam hati (emboli) yang mengganggu fungsi jantung dan pembuluh darah.,1.0,0.6834348778336814,0.9999999999666667,1.0
Apa saja faktor yang meningkatkan risiko penyakit endokarditis?,"Endokarditis dapat dialami oleh siapa saja. Namun, ada beberapa faktor yang dapat meningkatkan risiko seseorang menderita kondisi ini, yaitu:\n\nBerusia lebih dari 60 tahun\nMenggunakan katup jantung buatan\nMenderita kerusakan di katup jantung\nMemiliki penyakit jantung bawaan\nMenggunakan alat bantu di jantung, seperti alat pacu jantung\nPernah menderita endokarditis sebelumnya\nPernah menggunakan NAPZA bentuk suntik\nMemiliki daya tahan tubuh lemah\nMemakai kateter dalam jangka panjang\nMemiliki kesehatan gigi dan mulut yang buruk","['Topik: Endokarditis, Subtopik: Faktor risiko endokarditis \n Endokarditis dapat dialami oleh siapa saja. Namun, ada beberapa faktor yang dapat meningkatkan risiko seseorang menderita kondisi ini, yaitu:\n- Berusia lebih dari 60 tahun\n- Menggunakan katup jantung buatan\n- Menderita kerusakan di katup jantung\n- Memiliki penyakit jantung bawaan\n\n- Menggunakan alat bantu di jantung, seperti alat pacu jantung\n- Pernah menderita endokarditis sebelumnya\n- Pernah menggunakan NAPZA bentuk suntik\n- Memiliki daya tahan tubuh lemah\n- Memakai kateter dalam jangka panjang\n- Memiliki kesehatan gigi dan mulut yang buruk\n', 'Topik: Endokarditis, Subtopik: Pengertian Endokarditis \n Endokarditis adalah peradangan di endokardium, yaitu lapisan bagian dalam jantung. Peradangan ini umumnya disebabkan oleh bakteri, tetapi bisa juga disebabkan oleh virus atau jamur.\nEndokarditis merupakan penyakit peradangan yang jarang terjadi. Penyakit ini hanya dialami oleh 3  10 orang dari setiap 100.000 orang, dan jarang menyerang orang yang jantungnya sehat.\n\n \nEndokarditis paling berisiko terjadi pada pasien yang menderita kerusakan katup jantung, telah menjalani operasi cangkok katup jantung, atau menderita kelainan jantung. \nMeski banyak penderitanya yang sembuh, endokarditis dapat memicu komplikasi serius jika tidak segera ditangani. Oleh karenanya, pemeriksaan dan pengobatan sedini mungkin perlu dilakukan.\n', 'Topik: Endokarditis, Subtopik: Pengertian Endokarditis \n Endokarditis merupakan penyakit peradangan yang jarang terjadi. Penyakit ini hanya dialami oleh 3  10 orang dari setiap 100.000 orang, dan jarang menyerang orang yang jantungnya sehat.\n\n \nEndokarditis paling berisiko terjadi pada pasien yang menderita kerusakan katup jantung, telah menjalani operasi cangkok katup jantung, atau menderita kelainan jantung. \nMeski banyak penderitanya yang sembuh, endokarditis dapat memicu komplikasi serius jika tidak segera ditangani. Oleh karenanya, pemeriksaan dan pengobatan sedini mungkin perlu dilakukan.\n']","Berikut adalah beberapa faktor yang meningkatkan risiko terkena endokarditis, sesuai dengan konteks yang diberikan:\n\n1. Usia lebih dari 60 tahun\n2. Menggunakan katup jantung buatan\n3. Menderita kerusakan di katup jantung\n4. Memiliki penyakit jantung bawaan\n5. Menggunakan alat bantu di jantung, seperti alat pacu jantung\n6. Pernah menderita endokarditis sebelumnya","Faktor-faktor yang dapat meningkatkan risiko penyakit endokarditis termasuk:\n\n1. Penyakit infeksi kronis, seperti diabetes mellitus dan HIV/AIDS, yang mengganggu fungsi jantung.\n2. Pemakaian obat-obatan beracun atau penggunaan bahan alami toksik yang dapat merusak hati dan ginjal, sehingga meningkatkan resiko penyakit endokarditis.\n3. Penyakit infeksi primitif akut atau jangkitan sistemik lainnya, terutama pada pasien yang kehati-hatian dengan alergi obat dan anggota keluarga sering menggunakan antibiotik.",1.0,0.8259017437213402,0.9999999999666667,1.0
Apa kelainan yang dialami oleh seseorang dengan penyakit Patent Foramen Ovale?,Patent foramen ovale adalah penyakit jantung bawaan ketika lubang yang terletak di antara serambi kanan dan serambi kiri jantung tidak menutup secara sempurna setelah bayi lahir. Pada patent foramen ovale (PFO) darah kaya oksigen bercampur dengan darah minim oksigen.,"['Topik: Patent Foramen Ovale, Subtopik: Komplikasi Patent Foramen Ovale \n Patent foramen ovale umumnya tidak menimbulkan komplikasi, kecuali jika disertai dengan kondisi lain atau kelainan lain pada struktur jantung. Komplikasi yang dapat terjadi pada penderita PFO adalah:\n- Kekurangan oksigen dalam darah (hipoksemia)\n- Stroke iskemik\n- Serangan jantung\n- Gangguan ginjal\n- Migrain\n- Emboli lemak\n- Emboli udara (pada penyelam)\n- Gangguan katup jantung\n', 'Topik: Patent Foramen Ovale, Subtopik: Pengertian Patent Foramen Ovale \n Patent foramen ovale adalah penyakit jantung bawaan ketika lubang yang terletak di antara serambi kanan dan serambi kiri jantung tidak menutup secara sempurna setelah bayi lahir. Meski jarang bergejala, kondisi ini dapat menyebabkan migrain dan stroke ketika penderita dewasa.\nForamen ovale adalah lubang yang dibutuhkan oleh janin ketika masih di dalam kandungan. Normalnya, lubang ini akan menutup secara alami setelah bayi lahir, karena sudah tidak diperlukan. Patent foramen ovale (PFO) adalah istilah untuk foramen ovale yang tidak menutup setelah bayi lahir.\n\n', 'Topik: Patent Foramen Ovale, Subtopik: Gejala Patent Foramen Ovale \n Patent foramen ovale cukup sering terjadi, yaitu pada 1 dari 4 bayi. Kondisi ini sering kali tidak menimbulkan gejala sehingga tidak disadari oleh penderitanya. Sebagian besar pasien baru menyadari dirinya menderita PFO ketika melakukan pemeriksaan untuk penyakit lain.\nKeluhan yang dapat timbul pada penderita PFO antara lain:\n- Lemah atau mati rasa di lengan atau kaki\n- Migrain atau sakit kepala\n- Nyeri dada\n- Penggumpalan darah\n- Linglung\n- Hilang keseimbangan\n']","Kelainan yang diakibatkan oleh PFO atau Patent Foramen Ovale pada orang dewasa berkisar dari gangguan kognitif hingga fisik. Berikut adalah beberapa contoh komplikasi yang mungkin timbul akibat penyakit ini:\n\n1. Stroke Iskemik: Penyebab utama stroke iskemik pada pasien dengan PFO adalah emboli yang menuju ke jantung dan kemudian ke otak. Karena PFO membuka jalur untuk darah iskemik, emboli ini dapat terdesorpsi melalui lubang foramen ovale dan menghentikan aliran darah pada otak.\n\n2. Migrain: Beberapa penelitian menunjukkan hubungan antara PFO dan migrain, yang mungkin disebabkan oleh perubahan tekanan darah atau ketidakseimbangan oksigen-karbon dioksida pada otak.\n\n3. Sakit Dada: Beberapa pasien dengan PFO menunjukkan gejala sakit dada, yang mungkin disebabkan oleh gangguan aliran darah akibat penyempitan arteri atau vena yang terkait dengan PFO.\n\n4. Linglung: Kondisi ini merujuk pada adanya suara geming (paling sering di belakang) saat pasien sedang berjalan, berenang, atau melakukan aktivitas fisik yang menuntut ketrampilan dan koordinasi.\n\n5. Hilang Keseimbangan: Beberapa penderita PFO mungkin mengalami gangguan kesadaran atau hilang keseimbangan, yang di sebabkan oleh penyebab lain seperti stroke iskemik, migrain, atau emboli.\n\n6. Lemah atau Mati Rasa di Lengan atau Kaki: Gejala ini sering disebut sebagai ""sleeper effect"", dimana pasien tidak sadar mengalami gangguan otot yang dapat menyebabkan kelelahan, lemah, atau bahkan hilangnya kesadaran dalam aktivitas rutin.\n\n7. Gangguan Katup Jantung: PFO bisa meningkatkan resiko terjadinya gangguan katup jantung lain, seperti stenosis valvular atau prolaps bulbi atrialis.\n\nNamun, penting untuk diingat bahwa kondisi ini umumnya tidak menyebabkan gejaya dan seringkali hanya ditemui dalam pemeriksaan medis yang mendalam atau saat pasien sedang mengalami penyakit lain. Keadaan PFO juga bisa berdampak pada pasien yang tinggal di luar negeri, seperti penyelam, dimana perubahan tekanan dapat menyebabkan terjadinya gas dalam tubuh dan komplikasi medis lainnya.","Kelainan yang dikenal sebagai Patent Foramen Ovale (PFO) biasanya tidak menyebabkan gejala atau masalah besar bagi umumnya. PFO adalah suatu keadaan dimana simfisis atrial (pembuluh hubung antara dua ruang dalam hati kanan atas manusia) tetap terbuka sejak lahir, namun tidak memiliki bukti yang kuat bahwa ini menjadi sumber penyakit jantung atau stroke.\n\nNamun, beberapa orang dengan PFO mungkin mengalami trombosis (pengumpulan zat tulang dalam arteri) akibat alis yang berdekatan dengan simfisis ini. Jika terjadi pembekuan di alis dan bolus tersebut merembes ke darah yang mengalir melalui PFO, hal itu bisa menyalahi sistempencecahan (penyumbatan arteri) dalam otak dan mungkin menyebabkan stroke.\n\nPenelitian telah menunjukan bahwa ada hubungan antara beberapa kasus stroke iskemi (ketidaksejahteraan darah pucat yang disebabkan oleh penyumbatan arteri) dan kehadiran PFO, tetapi hal ini tidak selalu berlaku untuk semua orang.\n\nDalam banyak kasus, penelitian menunjukan bahwa faktor lain (seperti asfiksi atau tekanan darah tinggi) mungkin lebih dominan dalam menyebabkan stroke iskemi dibanding PFO.",0.5,0.6890044770007245,0.5833333333041666,0.5
Apa gejala pada seseorang yang menderita penyakit Patent Foramen Ovale?,"Patent foramen ovale cukup sering terjadi, yaitu pada 1 dari 4 bayi. Kondisi ini sering kali tidak menimbulkan gejala sehingga tidak disadari oleh penderitanya. Sebagian besar pasien baru menyadari dirinya menderita PFO ketika melakukan pemeriksaan untuk penyakit lain.\n\nKeluhan yang dapat timbul pada penderita PFO antara lain:\n\nLemah atau mati rasa di lengan atau kaki\nMigrain atau sakit kepala\nNyeri dada\nPenggumpalan darah\nLinglung\nHilang keseimbangan","['Topik: Patent Foramen Ovale, Subtopik: Gejala Patent Foramen Ovale \n Patent foramen ovale cukup sering terjadi, yaitu pada 1 dari 4 bayi. Kondisi ini sering kali tidak menimbulkan gejala sehingga tidak disadari oleh penderitanya. Sebagian besar pasien baru menyadari dirinya menderita PFO ketika melakukan pemeriksaan untuk penyakit lain.\nKeluhan yang dapat timbul pada penderita PFO antara lain:\n- Lemah atau mati rasa di lengan atau kaki\n- Migrain atau sakit kepala\n- Nyeri dada\n- Penggumpalan darah\n- Linglung\n- Hilang keseimbangan\n', 'Topik: Patent Foramen Ovale, Subtopik: Gejala Patent Foramen Ovale: Kapan harus ke dokter \n Seperti yang telah disebutkan sebelumnya, penderita sering kali tidak menyadari bila ia menderita PFO. Oleh karena itu, segera periksakan ke dokter apabila mengalami gejala berikut ini:\n- Sakit kepala atau migrain yang sering terjadi\n- Lemah pada salah satu sisi wajah, lengan, atau kaki\n- Gangguan penglihatan\n- Tidak dapat berbicara atau bicara pelo secara tiba-tiba\n- Gangguan keseimbangan dan berjalan\n- Nyeri dada berulang\n- Pingsan\n', 'Topik: Patent Foramen Ovale, Subtopik: Pengertian Patent Foramen Ovale \n Patent foramen ovale adalah penyakit jantung bawaan ketika lubang yang terletak di antara serambi kanan dan serambi kiri jantung tidak menutup secara sempurna setelah bayi lahir. Meski jarang bergejala, kondisi ini dapat menyebabkan migrain dan stroke ketika penderita dewasa.\nForamen ovale adalah lubang yang dibutuhkan oleh janin ketika masih di dalam kandungan. Normalnya, lubang ini akan menutup secara alami setelah bayi lahir, karena sudah tidak diperlukan. Patent foramen ovale (PFO) adalah istilah untuk foramen ovale yang tidak menutup setelah bayi lahir.\n\n']","Penyakit Patent Foramen Ovale (PFO) seringkali tidak menyebabkan gejala dan biasanya tidak disadari oleh penderita. Namun, ada beberapa gejala yang berkaitan dengan PFO, seperti:\n\n1. Lemah atau mati rasa di lengan atau kaki\n2. Migrain atau sakit kepala\n3. Nyeri dada\n4. Penggumpalan darah\n5. Linglung\n6. Hilang keseimbangan\n7. Sakit kepala atau migrain yang sering terjadi (seperti yang dijelaskan dalam konteks)\n8. Lemah pada salah satu sisi wajah, lengan, atau kaki (seperti yang dijelaskan dalam konteks)\n9. Gangguan penglihatan (mungkin disebabkan oleh iskemi yang terdorong melalui PFO dan menghambat darah ke otak)\n10. Tidak dapat berbicara atau bicara pelom antara-antar gejala lainnya, seperti:\na. Gangguan keseimbangan dan berjalan (mungkin disebabkan oleh iskemi yang terdorong melalui PFO)\nb. Nyeri dada berulang (seperti yang dijelaskan dalam konteks)\nc. Pingsan (mungkin disebabkan oleh linglung atau gangguan penglihatan, seperti dijelaskan sebelumnya)","Penyempitan arteri (stenosis) atau retensi aliran darah (obstruction) pada sumsum tulang punggung, seringkali disertai gejala lain seperti gatalan di dada dan lengket dalam pernapasan.",0.8421052631578947,0.6833101931523093,0.9999999999666667,1.0
Apa penyebab dari penyakit sindrom eisenmenger?,"Pada penderita sindrom Eisenmenger, terdapat lubang di jantung, tepatnya di antara ruang jantung. Kondisi ini menyebabkan darah dari ruang kiri jantung mengalir ke ruang kanan jantung dan tekanan darah paru-paru meningkat (hipertensi pulmonal).\n\nSindrom Eisenmenger atau Eisenmenger syndrome terjadi akibat kelainan jantung bawaan, seperti:\n\nAtrioventricular canal defect, yaitu lubang besar di tengah yang menyebabkan semua ruang jantung menyatu\nVentricular septal defect, yaitu lubang di septum ventrikel\nAtrial septal defect, yaitu lubang pada septum atrium\nPatent ductus arteriosus","['Topik: Sindrom Eisenmenger, Subtopik: Penyebab Sindrom Eisenmenger \n Jantung manusia terdiri dari empat ruang, yaitu dua serambi (atrium) dan dua bilik (ventrikel) yang dipisahkan oleh sekat jantung, serta empat katup jantung.\nRuang kiri jantung berisi darah yang kaya oksigen (darah bersih) untuk dipompa ke seluruh tubuh. Sementara ruang kanan jantung berisi darah yang minim oksigen (darah kotor), untuk dibawa ke paru-paru dan diperkaya dengan oksigen.\nPada penderita sindrom Eisenmenger, terdapat lubang di jantung, tepatnya di antara ruang jantung. Kondisi ini menyebabkan darah dari ruang kiri jantung mengalir ke ruang kanan jantung dan tekanan darah paru-paru meningkat (hipertensi pulmonal).\nSindrom Eisenmenger atau Eisenmenger syndrome terjadi akibat kelainan jantung bawaan, seperti:\n- Atrioventricular canal defect, yaitu lubang besar di tengah yang menyebabkan semua ruang jantung menyatu\n- Ventricular septal defect, yaitu lubang di septum ventrikel\n- Atrial septal defect, yaitu lubang pada septum atrium\n- Patent ductus arteriosus\n', 'Topik: Sindrom Eisenmenger, Subtopik: Pengertian Sindrom Eisenmenger \n Sindrom Eisenmenger adalah kelainan jantung bawaan yang mengakibatkan bercampurnya darah kaya oksigen dengan darah minim oksigen. Kondisi ini menyebabkan penderitanya mudah lelah dan kulitnya membiru.\nBercampurnya darah kaya oksigen dengan darah minim oksigen paling sering terjadi akibat adanya lubang di sekat jantung. Akibatnya, darah yang seharusnya dipompa ke seluruh tubuh malah kembali ke paru-paru.\n\nKondisi tersebut menyebabkan tekanan di pembuluh darah paru-paru meningkat dan meningkatkan risiko terjadinya gagal jantung.\n', 'Topik: Sindrom Eisenmenger, Subtopik: Pengertian Sindrom Eisenmenger \n Bercampurnya darah kaya oksigen dengan darah minim oksigen paling sering terjadi akibat adanya lubang di sekat jantung. Akibatnya, darah yang seharusnya dipompa ke seluruh tubuh malah kembali ke paru-paru.\n\nKondisi tersebut menyebabkan tekanan di pembuluh darah paru-paru meningkat dan meningkatkan risiko terjadinya gagal jantung.\n']","Penyebab sindrom Eisenmenger terjadi akibat kelainan jantung bawaan, seperti atrioventricular canal defect (AVCD), ventricular septal defect (VSD), atrial septal defect (ASD), dan patent ductus arteriosus. Kelainan ini mengakibatkan adanya lubang di dalam sistem jantung, yang menyebabkan terjadinya aliran darah tidak seret (leak) antar ruang jantung.\n\nSalah satu akibat dari kelainan jantung ini adalah bercampurnya darah kaya oksigen dan darah minim oksigen, yang mengganggu fungsi paru-paru dalam memperkuat tekanan di pembuluh darah paru-paru. Hal ini dapat meningkatkan risiko terjadinya hipertensi pulmonal (tekanan darah paru-paru yang tinggi) dan gagal jantung, karena oksigen yang seharusnya digunakan oleh tubuh tidak cukup untuk memenuhi kebutuhan.","Penyebab dari sindrom Eisenmenger adalah terjadinya disfungsi ginjal akibat pembalut darah (stenosis) setelah operasi penyingkiran arteri pengganti atau bypass pembuluh darah jantung. Infeksi atau inflamasi di dalam tuberkulin, yang sering disebabkan oleh infeksi vaskuler lainnya, juga bisa menyebabkan sindrom Eisenmenger.",0.8181818181818182,0.7106763779432574,0.9999999999666667,1.0
Apa gejala yang muncul pada bayi yang mengalami sindrom eisenmenger?,"Pada bayi baru lahir, tanda yang dapat terlihat adalah napas yang cepat, mudah lelah saat menyusu, kulit membiru ketika menangis, dan berat badan sulit naik.","['Topik: Sindrom Eisenmenger, Subtopik: Pencegahan Sindrom Eisenmenger \n Sindrom Eisenmenger pada bayi dapat dicegah melalui operasi perbaikan kelainan jantung sedini mungkin. Sedangkan pada anak yang menderita penyakit jantung bawaan, pemeriksaan rutin bisa mencegah terjadinya komplikasi.\nOrang tua juga perlu waspada ketika berat badan anak tidak naik dengan optimal. Sementara itu, wanita yang menderita sindrom Eisenmenger dan aktif secara seksual disarankan untuk tidak hamil, karena dapat membahayakan kondisi ibu dan janin.\n', 'Topik: Sindrom Eisenmenger, Subtopik: Gejala Sindrom Eisenmenger: Kapan harus ke dokter \n Segera periksakan diri atau anak Anda ke dokter jika mengalami keluhan di atas. Jika Anda atau anak Anda telah didiagnosis menderita sindrom Eisenmenger, pemeriksaan rutin ke dokter perlu dilakukan untuk mencegah terjadinya komplikasi yang fatal.\n', 'Topik: Sindrom Eisenmenger, Subtopik: Diagnosis Sindrom Eisenmenger \n Untuk mendiagnosis sindrom Eisenmenger, dokter akan melakukan tanya jawab seputar gejala dan riwayat penyakit pasien, kemudian menjalankan pemeriksaan fisik. Selanjutnya, dokter akan menganjurkan pasien melakukan pemeriksaan lanjutan, yaitu:\n- Rontgen dada, untuk memeriksa kondisi jantung dan paru-paru\n- Elektrokardiografi (EKG), untuk merekam aktivitas listrik jantung\n- Ekokardiografi, untuk melihat struktur jantung dan sirkulasi darah\n- Tes darah, untuk mengukur jumlah sel darah, kadar zat besi, mendeteksi fungsi ginjal, dan fungsi hati\n- CT scan dan MRI, untuk memeriksa kondisi jantung dan paru-paru lebih detail\n- Kateterisasi jantung, untuk mendeteksi kondisi lubang di bilik jantung dan tekanan aliran darah yang melewatinya\n']","Gejala yang mungkin timbul pada bayi yang mengalami sindrom Eisenmenger meliputi keluhan seperti sesak napas, kerusakan jantung (congenital heart disease), dan gejala pernapasan berat. Selain itu, bayi dengan sindrom Eisenmenger juga mungkin menunjukkan sinyal-sinyal lain seperti pertumbuhannya lambat, gangguan fungsi hati atau ginjal, dan gejala yang menggembirakan. Karena hal ini bisa membahayakan kehidupan bayi, segera menyampaikan diri untuk diteliti oleh dokter jika ada tanda-tanda sosial istimewa tersebut.","Gejala yang sering muncul pada bayi dengan sindrom Eisenmenger termasuk:\n\n1. Pingsan atau pernapasan lebih cepat dan sulit.\n2. Kaki ouput syndrome, yaitu arus darah ke jantung menjadi tidak normal dan mengakibatkan cabang-分支 vena lainnya terdesak.\n3. Penyempitan pembuluh darah (stenosis) di sekitar jantung atau penyempitan arteri lainnya, yang dapat menyebabkan gangguan aliran darah dan gejala klinis lainnya.",0.125,0.8008178566179773,0.49999999995,0.25
Apa yang membedakan henti jantung mendadak dengan serangan jantung?,"Henti jantung mendadak berbeda dengan serangan jantung. Serangan jantung terjadi karena penyumbatan pembuluh darah. Sementara henti jantung mendadak disebabkan oleh ventrikel fibrilasi. Namun, ventrikel fibrilasi juga dapat disebabkan oleh serangan jantung.\n\nVentrikel fibrilasi merupakan salah satu jenis gangguan irama jantung (aritmia). Kondisi ini ditandai dengan ventrikel (bilik) jantung yang hanya bergetar, bukan berdenyut untuk memompa darah. Akibatnya, pasokan darah yang membawa oksigen dan nutrisi ke organ-organ tubuh akan terhenti.","['Topik: Henti Jantung Mendadak, Subtopik: Pengertian Henti Jantung Mendadak \n Henti jantung mendadak atau sudden cardiac arrest adalah kondisi ketika jantung berhenti berdetak secara tiba-tiba. Kondisi ini menyebabkan penderitanya hilang kesadaran dan bahkan berhenti bernapas. \nHenti jantung mendadak terjadi akibat gangguan pada listrik jantung sehingga jantung berhenti memompa darah ke seluruh tubuh. Kondisi ini dapat menyebabkan kerusakan otak permanen sampai kematian. Penderita perlu diberikan pertolongan pertama berupa CPR dan kejut jantung, agar tidak terserang komplikasi.\n\n', 'Topik: Henti Jantung Mendadak, Subtopik: Pengertian Henti Jantung Mendadak \n Henti jantung mendadak terjadi akibat gangguan pada listrik jantung sehingga jantung berhenti memompa darah ke seluruh tubuh. Kondisi ini dapat menyebabkan kerusakan otak permanen sampai kematian. Penderita perlu diberikan pertolongan pertama berupa CPR dan kejut jantung, agar tidak terserang komplikasi.\n\n', 'Topik: Henti Jantung Mendadak, Subtopik: Diagnosis Henti Jantung Mendadak \n Pada saat tiba di rumah sakit, dokter akan memeriksa denyut jantung pasien. Dokter juga akan memasang monitor untuk memeriksa irama jantung. Selanjutnya, dokter akan melakukan penanganan sampai kondisi pasien stabil atau jantungnya kembali berdetak.\nJika kondisi pasien sudah stabil, dokter akan melakukan pemeriksaan lanjutan untuk mendiagnosis penyebab atau faktor pemicu terjadinya henti jantung mendadak. Pemeriksaan tersebut dapat meliputi:\n- Tes darah\nTes darah dilakukan untuk memeriksa kadar kalium, magnesium, atau hormon tertentu yang memengaruhi fungsi jantung. Tes darah juga dapat dilakukan untuk mendeteksi cedera atau riwayat serangan jantung pada penderita henti jantung mendadak.\n- Foto Rontgen dada\nFoto Rontgen dada dilakukan untuk memeriksa ukuran dan struktur jantung serta pembuluh darah jantung. Melalui pemeriksaan ini, dokter juga dapat mendeteksi apakah pasien mengalami gagal jantung.\n- Ekokardiografi\nEkokardiografi atau USG jantung bertujuan untuk mengidentifikasi kerusakan pada jantung.\n- Kateterisasi jantung\nDalam kateterisasi jantung, dokter akan menyuntikkan zat pewarna khusus pada pembuluh darah yang menuju jantung. Pemeriksaan ini bertujuan untuk mendeteksi sumbatan pada pembuluh darah. Kateterisasi jantung juga dapat dilakukan untuk studi elektrofisiologi jantung. Prosedur ini dapat mendeteksi gangguan irama jantung yang mungkin menyebabkan henti jantung mendadak.\n']","Henti jantung mendadak (sudden cardiac arrest) dan serangan jantung (heart attack) adalah dua kondisi medis berbeda, meskipun terkait satu sama lain dalam beberapa aspek. Berikut penjelasan yang membedakan henti jantung mendadak dengan serangan jantung:\n\n1. Penatalaksanaan dan pengobatan: Serangan jantung umumnya disebabkan oleh obstruksi pembuluh darah akibat lemak atau trombos yang menghentikan aliran darah ke bagian jantung yang terluar (muskulus). Penderita serangan jantung biasanya menerima obat antiangina dan dilakukan tindakan medis lainnya untuk membersihkan obstruksi atau mengecilkan lemak.\n\n2. Kondisi fisiologis: Serangan jantung umumnya menyebabkan berkurangnya denyut jantung, tetapi penderita masih memiliki kontrol atas sistem sirkulasi tubuh. Henti jantung mendadak merujuk pada situasi ketika jantung berhenti secara tiba-tiba dan tak terduga tanpa proses penurunan denyut yang signifikan sebelumnya.\n\n3. Masa rawat inap: Penderita serangan jantung biasanya akan menerima pengobatan di rumah sakit, khususnya setelah mendapat diagnosa dan penilaian medis awal. Henti jantung mendadak umumnya menggunkan prosedur resuscitation pertama (CPR) dan kejut jantung untuk memulihkan denyut jantung, serta menghindari komplikasi berat seperti kerusakan otak permanen.\n\n4. Penyebab: Serangan jantung umumnya diakibatkan oleh penyempitan pembuluh darah akibat lemak atau trombos, yang mengganggu aliran darah ke jantung. Henti jantung mendadak berkutat pada gangguan listrik di jantung, seperti defleksi ritme atau impulsasi elektrokanannel, yang menyebabkan jantung berhenti bekerja normal.\n\n5. Prognosis: Serangan jantung biasanya disebabkan oleh penyakit arteri pada pasien tertentu, seperti penyumbatan pembuluh darah akibat penyakit aterosklerotik. Henti jantung mendadak berkutat pada gangguan internal jantung yang tidak selalu terkait dengan penyebab umum lainnya, sehingga prognosis dan resiko kerusakan otak permanen lebih tinggi.\n\nDari beberapa poin di atas, kita dapat melihat bahwa henti jantung mendadak dan serangan jantung berbeda dalam penatalaksanaan dan pengobatan, kondisi fisiologis, masa rawat inap, penyebab, dan prognosis. Namun, obat antiangina yang diberikan pada pasien serangan jantung bisa membantu mencegah henti jantung mendadak, sekaligus menjadi tindakan medis awal dalam upaya mengurangi resiko kerusakan otak permanen.","Perbedaan utama antara henti jantung mendadak (sudden cardiac arrest) dan serangan jantung (heart attack) adalah mekanisme penyebabnya, respon medis yang dihasilkan, dan dampak pada tubuh.\n\n1. Mekanisme Penyebab:\n- Henti Jantung Mendadak: Kehabisan oksigen di hati atau gerakan anjakan listrik (arrhythmia) spontan dalam sistem pengatur elektrolit tubuh yang mengubah ritme jantung secara fatal tanpa pembalasan.\n- Serangan Jantung: Penyebab utama serangan jantung adalah penyumbatan darah ke jantung akibat dari lilitan lemak atau aterosklerosis di saluran arteri jantung, yang mengakibatkan cedera pada jaringan jantung dan gangguan fungsi jantung.\n\n2. Respon Medis:\n- Henti Jantung Mendadak: Metode resusitasi jantung (CPR) dan defribrilasi seringkali digunakan secara mendadak untuk membersihkan saluran pernapasan, membiarkan jantung bekerja sama sendiri atau menggunakan defibrillator portabel.\n- Serangan Jantung: Obat-obatan dan teknik lain yang berurusan dengan penghambatan darah dan penggunaan nifedipin untuk mengekang serangan jantung, kemudian pasien akan diarahkan ke rumah sakit.\n\n3. Dampak pada Tubuh:\n- Henti Jantung Mendadak: Penyebab kematian dalam waktu beberapa menit atau jam terakhir, dan hampir selalu memerlukan resusitasi jantung secara mendadul.\n- Serangan Jantung: Bisa menyebabkan penyakit jantung lanjutan atau cedera pada organ lain dalam waktu minggu hingga bulan setelah serangan, tetapi umumnya tidak langsung menjangkitkan kematian.\n\nDalam prakteknya, henti jantung mendadak dan serangan jantung bisa saling berhubungan satu sama lain atau terjadi pada orang yang sama. Namun, resiko risiko menurunnya jantung dan kesempatan menderita serangan jantung biasanya lebih tinggi dalam masa hidup setelah henti jantung mendadak.",0.2903225806451613,0.5152326683926872,0.9999999999666667,0.14285714285714285
Bagaimana penanganan darurat terhadap seseorang yang mengalami henti jantung mendadak?,"Segera periksa denyut jantungnya dan hubungi ambulans atau rumah sakit terdekat.\n\nSambil menunggu datangnya pertolongan medis, lakukan juga penanganan darurat berupa CPR. Gunakan juga alat automated external defibrillator (AED) bila tersedia.","['Topik: Henti Jantung Mendadak, Subtopik: Pengobatan Henti Jantung Mendadak: Penanganan darurat \n Penanganan darurat bertujuan untuk mengembalikan kesadaran pasien henti jantung mendadak. Hal ini dilakukan oleh petugas medis darurat, yang dimulai dengan memeriksa pernapasan dan denyut nadi pasien.\nJika jantung pasien tidak berdetak, tim medis akan melakukan CPR dan memberikan kejut listrik selama perjalanan ke rumah sakit. Setelah jantung kembali berdetak, pasien akan dirawat di ruang rawat intensif (ICU) dan diberikan alat bantu napas.\n', 'Topik: Henti Jantung Mendadak, Subtopik: Gejala Henti Jantung Mendadak: Kapan harus ke dokter \n Henti jantung mendadak merupakan kondisi darurat yang harus segera ditangani. Jika Anda melihat seseorang yang tidak sadarkan diri dan tidak bernapas dengan normal, segera periksa denyut jantungnya dan hubungi ambulans atau rumah sakit terdekat.\nSambil menunggu datangnya pertolongan medis, lakukan juga penanganan darurat berupa CPR. Gunakan juga alat automated external defibrillator (AED) bila tersedia.\nGejala henti jantung mendadak terjadi secara cepat dan tanpa disadari. Meskipun demikian, gejala-gejala awal biasanya dapat dirasakan penderita beberapa hari sebelumnya. Oleh sebab itu, segera lakukan pemeriksaan ke dokter bila mengalami gejala seperti di atas, terutama bila memiliki riwayat penyakit jantung.\n', 'Topik: Henti Jantung Mendadak, Subtopik: Pengobatan Henti Jantung Mendadak \n Pengobatan henti jantung mendadak terdiri dari penanganan darurat dan pengobatan jangka panjang. Berikut adalah penjelasannya:\n']","Penanganan darurat terhadap seseorang yang mengalami henti jantung mendadak melibatkan beberapa langkah utama. Pertama, petugas medis harus segera memeriksa denyut nadi dan pernapasan pasien untuk menentukan statusnya. Jika pasien tidak sadar atau tidak bernapas dengan normal, tim medis akan mulai prosedur penanganan darurat yang meliputi:\n\n1. Penggunaan alat bantu diagnostik untuk memastikan bahwa jantung pasien benar-benar henti, seperti EKG (elektrokardiografi) atau tomografi sinar komputasi (CT).\n2. Pemakaian defibrillator implantable (bila tersedia dan bila diperlukan untuk mengatur ritme jantung secara normal), yang biasanya disesuaikan dengan kondisi pasien.\n3. Penanganan medis lainnya, seperti pemberian obat atau zat lain yang diperlukan untuk menjaga fungsi vital dan mengembalikan kesadaran pasien.\n4. Penyusunan pasien ke ruang rawat intensif (ICU) untuk perawatan lanjutan dan pemantauan ketat, termasuk dukungan paru-paru dan sistemik yang diperlukan sesaat setelah jantung mulai berdetak kembali.\n5. Pemberian alis napas atau perawatan lainnya untuk membantu pasien menghindari gangguan fungsi paru-paru selama proses penanganan darurat.\n6. Pemeriksaan dan pengobatan medik yang diperlukan berdasarkan hasil diagnostik, termasuk terapi kardiologis atau intervensionis.\n7. Penyusunan laporan rinci tentang prosedur penanganan darurat dan gejala pasien serta pemantauannya untuk evaluasi ulang dan perawatan lanjutan.","Dalam hal kecelaran jantung (cardiac arrest) akibat penyakit jantung, penanganan darurat yang direncanakan dan dilakukan dengan cepat dan terencana sangat penting untuk menghindari kerusakan lebih lanjut pada otak dan hati. Berikut adalah langkah-langkah umum dalam penanganan darurat terhadap henti jantung mendadak:\n\n1. **Segera Menyelidiki Kebenaran Pasien**: Pertama, pastikan pasien benar-benar mengalami henti jantung. Mulailah dengan mengesampingkan penyebab lain yang bisa menyebabkan gangguan kesadaran atau fungsi fisik, seperti stroke, perdagan hipoksia (kesadahan asam lambung), serta penggunaan obat.\n\n2. **Pemberian Pulsa Listrik**: Jika pasien tidak bernafas dan/atau memiliki denyut nadi yang hilang, segera memberikan pulsa listrik dengan defibrillator secara manual. Defibrillator adalah alat khusus untuk menghentikan gangguan ritme jantung seperti tajam (torsades de pointes) atau fibrilasi ventrikuler.\n\n3. **Langkah-langkah Umum dalam Penanganan Darurat**:\n   - Tetap tenang dan berjalan cepat untuk mendapatkan bantuan dokter spesialis penyakit jantung dan perawat yang memadai.\n   - Pastikan pasien tetap dewasa dengan menggosok-geser tenggorokan dan menghadapnya ke arah pengguna defibrillator untuk mencegah perdagan lebih lanjut.\n   - Bersama dokter, memastikan alat-alat medis yang diperlukan (seperti oksigen) siap digunakan.\n\n4. **Pengelolaan Respirasi dan Kolaborasi dengan Tenaga Medis Spesialis**: Setelah henti jantung diatasi, pasien perlu dilakukan pengawasan ketat untuk memastikan bahwa denyut nadi tetap stabil. Pasien juga harus diperiksa oleh dokter spesialis penyakit jantung untuk menentukan apakah mereka memerlukan perawatan lanjutan atau tindakan khusus lainnya, seperti penggunaan obat-obatan.\n\n5. **Penyelesaian dan Pengaduan**: Setelah pasien stabil dan terkunci dalam proses rehabilitasi medis, mungkin lebih lanjut diadakan sesuai kebutuhan pasien. Pasien juga perlu diberikan dukungan emosional dan pengetahuan tentang tindakan yang telah dilakukan serta langkah-langkah untuk mengurangi risiko henti jantung mendadak berikutnya terjadi.\n\nPenanganan darurat ini harus selalu didasarkan atas penilaian diagnostik dan pemahaman tentang pasien, yang bisa diberikan oleh dokter spesialis gigi jantung atau praktisi medis lainnya berdasarkan kondisi pasien di lapangan.",0.6,0.5773743745469425,0.9999999999666667,1.0
Apa saja komplikasi yang dapat dialami oleh orang yang mengalami henti jantung mendadak?,"Komplikasi henti jantung mendadak adalah kerusakan otak permanen, hipoksia, hingga kematian. Pada beberapa kasus, penderita henti jantung mendadak masih bisa ditangani dan akhirnya sembuh.\n\nMeski demikian, penderita henti jantung mendadak yang sembuh umumnya juga mengalami sejumlah komplikasi berupa:\n\nKerusakan saraf\nGangguan gerakan\nKesulitan berbicara\nSulit konsentrasi\nPost-traumatic stress disorder (PTSD)","['Topik: Henti Jantung Mendadak, Subtopik: Komplikasi Henti Jantung Mendadak \n Komplikasi henti jantung mendadak adalah kerusakan otak permanen, hipoksia, hingga kematian. Pada beberapa kasus, penderita henti jantung mendadak masih bisa ditangani dan akhirnya sembuh.\nMeski demikian, penderita henti jantung mendadak yang sembuh umumnya juga mengalami sejumlah komplikasi berupa:\n- Kerusakan saraf\n- Gangguan gerakan\n- Kesulitan berbicara\n- Sulit konsentrasi\n- Post-traumatic stress disorder (PTSD)\n', 'Topik: Henti Jantung Mendadak, Subtopik: Pengertian Henti Jantung Mendadak \n Henti jantung mendadak atau sudden cardiac arrest adalah kondisi ketika jantung berhenti berdetak secara tiba-tiba. Kondisi ini menyebabkan penderitanya hilang kesadaran dan bahkan berhenti bernapas. \nHenti jantung mendadak terjadi akibat gangguan pada listrik jantung sehingga jantung berhenti memompa darah ke seluruh tubuh. Kondisi ini dapat menyebabkan kerusakan otak permanen sampai kematian. Penderita perlu diberikan pertolongan pertama berupa CPR dan kejut jantung, agar tidak terserang komplikasi.\n\n', 'Topik: Henti Jantung Mendadak, Subtopik: Gejala Henti Jantung Mendadak \n Henti jantung mendadak merupakan kondisi yang terjadi secara tiba-tiba. Pada umumnya, gejala utama henti jantung mendadak adalah pingsan. Namun, sebagian penderita henti jantung mendadak dapat mengalami gejala awal berupa:\n- Pusing\n- Lemas\n- Nyeri dada\n- Sesak napas\n- Jantung berdebar\n']","Komplikasi yang dapat dialami oleh orang yang mengalami henti jantung mendadak meliputi:\n\n1. Kerusakan Otak Permanen: Kecurangan oksigen pada otak akibat terhentinya jantung dapat menyebabkan kerusakan permanen pada sistem saraf.\n2. Hipoksia: Ketidakmampuan jantung untuk memberikan oksigen dan nutrisi ke seluruh tubuh, yang dapat membahayakan organ-organ penting seperti hati, ginjal, dan gigi.\n3. Kematian: Dalam kasus yang sangat parah, komplikasi henti jantung mendadak dapat mencapai titik dimana tidak ada pemulihan yang mungkin.\n4. Kerusakan Saraf: Penderita henti jantung mendadak seringkali mengalami kerusakan saraf, termasuk gangguan syaraf ekor dan syaraf kaki sebagai akibat dari kekurangan oksigen yang lama.\n5. Gangguan Gerakan: Kerusakan otak permanen juga dapat menyebabkan gangguan gerakan, seperti kelumpuhan atau kesulitan bergerak secara normal.\n6. Kesulitan Berbicarah: Komplikasi ini bisa disebabkan oleh kerusakan pada area otak yang terlibat dalam proses berbicara, seperti gangguan syaraf atau tekanan intrakranial yang tinggi akibat kehilangan keseimbangan.\n7. Sulit Konsentrasi: Penderita henti jantung mendadak juga mungkin mengalami sulit untuk fokus dan berkonsentrasi, terutama dalam tugas yang kompleks atau menghadapannya mempelajari kasus medis.\n8. Post-Traumatic Stress Disorder (PTSD): Kesulitan emotional dan psikologis seperti PTSD juga dapat merujuk pada gejala henti jantung mendadak, terutama bagi mereka yang melihat kecelakaan atau menghadapi situasi medis serius.\n9. Efek Samping Medik: Penderita henti jantung mendadak juga dapat mengalami efek samping medik seperti hiperkinesia dan anorexia, yang bisa mempersulit proses pemulihan mereka.","Komplikasi yang umumnya dihadapi oleh individu yang mengalami henti jantung mendadak meliputi:\n\n1. Hiperkapnia (tekanan udara dalam paru-paru meningkat) dan asidosis hipoksemik (kadar ion hidrogen dalam darah meningkat karena oksigen dalam sirkulasi darah menurun).\n2. Arritmia jantung, seperti fibrilasi ventrikel atau aritmia lainnya yang dapat menyebabkan penurunan sistemik tekanan darah dan kerusakan hati.\n3. Hipoperfusi (penyempitan pembuluh darah) akibat terbentuknya trombus, yang dapat mengakibatkan organ lainnya kekurangan oksigen.\n4. Koma atau gangguan kesadaran sebagai akibat penurunan sistemik tekanan darah dan kerusakan otak.\n5. Gagal jantung (cardial failure) yang dapat memperburuk gejala asas lainnya, termasuk hiperkapnia atau gangguan fungsi ginjal.\n6. Penyempitan pembuluh darah akut (acut arterial embolism), yang dapat menyebabkan organ lain kekurangan oksigen.\n7. Hipervolesa (pengeluaran darah dalam jumlah berlebih) dan hemothorax, yaitu pengisian bibir udara oleh darah akibat luka di dinding dada.\n8. Penyempitan pembuluh darah akut pada arteri radialis atau femoralis yang dapat menyebabkan gangguan sirkulasi tangan dan keluarannya ke dewasa.\n9. Komplikasi lainnya termasuk infeksi, kerusakan organ seksual, serta trauma fisik akibat proses pemulihan atau tindak lanjut dari penyebab henti jantung mendadak.\n\nSemua komplikasi ini memerlukan perawatan medis yang cermat dan teratur untuk mencegah kerusakan lebih lanjut pada organ-organ penting.",0.631578947368421,0.5029968117220401,0.99999999995,1.0
Apa penyebab seseorang menderita penyakit perikarditis?,"Sebagian besar kasus perikarditis tidak diketahui penyebabnya, tetapi ada beberapa hal yang diduga dapat menjadi penyebab perikarditis, yaitu:\n\nInfeksi bakteri\nInfeksi virus, seperti COVID-19, rubella, dan influenza\nKanker dari organ lain yang menyebar ke perikardium\nSerangan jantung\nCedera pada dada\nKomplikasi akibat operasi jantung\nPenyakit peradangan, seperti lupus dan rheumatoid arthritis\nPaparan radiasi dalam radioterapi, khususnya pada terapi kanker payudara dan kanker paru","['Topik: Perikarditis, Subtopik: Penyebab Perikarditis \n Sebagian besar kasus perikarditis tidak diketahui penyebabnya, tetapi ada beberapa hal yang diduga dapat menjadi penyebab perikarditis, yaitu:\n- Infeksi bakteri\n- Infeksi virus, seperti COVID-19, rubella, dan influenza\n- Kanker dari organ lain yang menyebar ke perikardium\n- Serangan jantung\n- Cedera pada dada\n- Komplikasi akibat operasi jantung\n- Penyakit peradangan, seperti lupus dan rheumatoid arthritis\n\n- Paparan radiasi dalam radioterapi, khususnya pada terapi kanker payudara dan kanker paru\n', 'Topik: Perikarditis, Subtopik: Diagnosis Perikarditis \n Diagnosis perikarditis ditetapkan berdasarkan hasil tanya jawab terkait gejala, serta hasil pemeriksaan fisik dan pemeriksaan penunjang. Beberapa tes penunjang yang dilakukan untuk memastikan perikarditis dan penyebabnya yaitu:\n- Tes darah\nTes darah dilakukan untuk mengetahui adanya infeksi atau peradangan.\n- Rontgen dada\nFoto Rontgen dada bertujuan untuk melihat kondisi jantung, paru-paru, dan pembuluh Jika terdapat efusi perikardium yang terjadi pada perikarditis, maka jantung akan tampak membesar.\n- Echo jantung\nEcho jantung dilakukan untuk melihat gambaran jantung dan mendeteksi cairan yang terkumpul dalam ruang\n- EKG (elektrokardiogram) \nEKG bertujuan untuk mendeteksi dan merekam aktivitas listrik jantung yang dapat berubah saat terjadi perikarditits.\n- CT scan\nPemindaian dengan sinar-X ini dilakukan untuk mendapatkan gambaran jantung lebih detail.\n- MRI\nProsedur menggunakan gelombang magnet ini dilakukan untuk mendapatkan gambaran jantung secara detail. Dari hasil pemeriksaan, dapat terlihat apabila ada penebalan, peradangan, atau perubahan lain pada perikardium.\n', 'Topik: Perikarditis, Subtopik: Pengertian Perikarditis \n Perikarditis adalah peradangan pada lapisan tipis berbentuk kantong yang melapisi jantung (perikardium). Perikardium berfungsi untuk menjaga agar jantung tidak berpindah posisi, serta melindungi jantung dari gesekan atau penyebaran infeksi dari jaringan lain.\nPenyakit yang menimbulkan gejala nyeri dada ini dapat terjadi di segala usia. Meski begitu, perikarditis paling banyak terjadi di usia 20 sampai 50 tahun, terutama pada pria.\n']","Penyebab umum terjadinya perikarditis meliputi beberapa faktor, di antaranya:\n\n1. Infeksi bakteri: Bacteria yang menyebar ke perikardium seperti Staphylococcus aureus dan Streptococcus pneumoniae dapat menyebabkan infeksi ini.\n2. Infeksi virus: Virus, termasuk COVID-19, rubella, influenza, herpes simplex, dan Epstein-Barr, juga dapat menimbulkan perikarditis setelah menginfeksi mulut atau hidung dan kemudian menular ke jantung.\n3. Kanker: Kanker yang berasal dari organ lain seperti limpa, paru-paru, atau ginjal yang menyebar ke perikardium juga dapat menyebabkan infeksi ini.\n4. Serangan jantung: Gejala serangan jantung akut, terutama pada asupan trombunya, juga bisa merusak perikardium dan memicu peradangan.\n5. Cedera dada: Penyebab fisik seperti cedera dada yang bergejolanya dapat menyebabkan infeksi ini karena luka bakar pada bagian dada.\n6. Komplikasi operasi jantung: Setelah operasi, terkadang bisa timbul peradangan atau infeksi lain di sekitar jantung yang dapat menimbulkan perikarditis.\n7. Penyakit peradangan: Beberapa penyakit autoimune, seperti lupus atau rheumatoid arthritis, bisa menyebabkan pembentukan cairan di area perikardium yang kemudian dapat menjalar ke seluruh jantung.\n8. Paparan radiasi: Radiasi dalam radioterapi juga bisa merusak perikardium dan memicu infeksi ini, terutama pada bagian dada di mana telah dilakukan pengobatan kanker.","Penyebab utama penyakit perikarditis termasuk infeksi, inflamasi spontan atau akibat lain seperti trauma medis atau penggunaan obat.",0.5,0.6418376240589824,0.9999999999,1.0
Bagaimana pengobatan terhadap seseorang yang mengalami perikarditis yang tergolong parah?,"Penderita perikarditis yang tergolong parah dan mengalami komplikasi perlu dirawat di rumah sakit. Beberapa tindakan yang dapat dilakukan dokter untuk mengatasi kondisi ini adalah:\n\nPericardiocentesis\nPericardiocentesis dilakukan untuk mengeluarkan timbunan cairan dari ruang perikardium. Pada prosedur ini, dokter akan menyedot cairan menggunakan jarum dan selang kecil.\nPericardiectomy\nOperasi ini perlu dilakukan bila perikardium mengalami Pericardiectomy bertujuan untuk mengambil bagian yang kaku tersebut sehingga pompa jantung dapat kembali normal.","['Topik: Perikarditis, Subtopik: Pengobatan Perikarditis \n Penderita perikarditis ringan bisa sembuh dengan beristirahat dan mengonsumsi obat-obat pereda nyeri. Namun, selama masa penyembuhan, penderita perlu menghindari aktivitas fisik yang berlebihan karena dapat memicu kekambuhan.\nDi samping obat pereda nyeri, dokter juga mungkin akan memberikan:\n- Obat antiinflamasi nonsteroid (OAINS) \nObat antiinflamasi nonsteroid berfungsi untuk mengurangi peradangan di perikardium dan meredakan nyeri dada. Obat yang dapat diberikan adalah ibuprofen dan aspirin.\n- Colchicine\nColchicine berfungsi untuk mengurangi peradangan dengan cara membunuh sel radang Obat ini dapat dikombinasikan dengan OAINS atau diberikan sebagai alternatif dari OAINS.\n- Kortikosteroid\nObat kortikosteroid hanya diberikan apabila perikarditis tidak membaik dengan OAINS dan colchicine. Salah satu contohnya adalah prednisone.\n- Antibiotik\nObat antibiotik hanya diberikan jika perikarditis disebabkan oleh infeksi bakteri.\nPenderita perikarditis yang tergolong parah dan mengalami komplikasi perlu dirawat di rumah sakit. Beberapa tindakan yang dapat dilakukan dokter untuk mengatasi kondisi ini adalah:\n- Pericardiocentesis\nPericardiocentesis dilakukan untuk mengeluarkan timbunan cairan dari ruang perikardium. Pada prosedur ini, dokter akan menyedot cairan menggunakan jarum dan selang kecil.\n- Pericardiectomy\nOperasi ini perlu dilakukan bila perikardium mengalami Pericardiectomy bertujuan untuk mengambil bagian yang kaku tersebut sehingga pompa jantung dapat kembali normal.\n', 'Topik: Perikarditis, Subtopik: Gejala Perikarditis: Kapan harus ke dokter \n Gejala perikarditis mirip dengan penyakit paru-paru dan penyakit jantung lain. Oleh karena itu, jika Anda mengalami gejala-gejala di atas, segera pergi ke dokter agar diperiksa dan ditangani dengan tepat.\nSegera ke dokter jika dada terasa nyeri seperti ditusuk-tusuk dan gejalanya makin parah ketika menarik napas atau berbaring, terutama bila gejala muncul setelah terserang infeksi virus, seperti flu atau sakit tenggorokan.\n', 'Topik: Perikarditis, Subtopik: Pencegahan Perikarditis \n Sebenarnya, tidak ada cara pasti untuk mencegah perikarditis. Akan tetapi, cara-cara berikut dapat mengurangi risiko penyakit tersebut, yaitu:\n- Rutin mencuci tangan dengan air mengalir dan sabun\n- Selalu menjaga kebersihan diri, rumah, dan lingkungan sekitar\n- Menghindari kontak dengan orang-orang yang sedang sakit\n- Menjalani vaksinasi COVID-19, rubella, dan influenza, sesuai saran dokter\n']","Pengobatan untuk seseorang yang mengalami perikarditis yang tergolong parah meliputi beberapa tindakan medis, di antaranya:\n\n1. Obat antiinflamasi nonsteroid (OAINS): Seperti ibuprofen dan aspirin, OAINS dapat memberikan alih-mengi pada nyeri dada akibat perikarditis dan mengurangi peradangan di perikardium.\n2. Colchicine: Obat ini berfungsi untuk menekan peradangan yang terjadi akibat perikarditis, serta dapat digunakan sebagai alternatif atau kombinasi dengan OAINS.\n3. Kortikosteroid: Pemberian obat kortikosteroid biasanya hanya dilakukan pada kasus yang tidak membaik meskipun sudah mengonsumsi OAINS dan colchicine, seperti prednisone. Obat ini dapat meningkatkan fungsi jantung dan mengurangi kerusakan perikardium akibat infeksi atau reaksi autowar yang parah.\n4. Penggunaan antibiotik: Jika infeksi bakteri di balik penyebabnya, dokter akan merekomendasikan pemberian antibiotik untuk mencegah penyakit jaringan lain dan menghambat pertumbuhan bakteri.\n5. Tindakan khusus medis: Seperti pericardiocentesis atau pericardiectomy, yang digunakan untuk mengeluarkan cairan di ruang perikardium serta mengurangi ukuran perikardium agar jantung dapat bekerja secara efektif.\n\nSegera ke dokter dan berkonsultasi tentang gejala-gejala yang dirasakan, khususnya apabila terdapat nyeri dada yang parah atau muncul setelah sering terserang infeksi, sehingga tindakan medis dapat diakses dan sesuai secara cepat.","Pengobatan untuk orang yang mengalami perikarditis yang tergolong parah melibatkan beberapa aspek kesehatan, termasuk penggunaan obat-obatan dan pengaturan keadaan umum pasien. Berikut adalah beberapa langkah utama dalam pengobatan ini:\n\n1. Obat antiinflamasi nonsteroidil (NNSI) – Pemberian obat ini biasanya pertama kali digunakan untuk mengurangi rasa sakit dan menekan denyut jantung yang disebabkan oleh perikarditis.\n2. Antibiotik – Jika penyebab perikarditis akut merupakan infeksi bakteri, maka pemberian antibiotik akan diperlukan untuk menghilangkan bakteri yang menyumbang pada penyakit jantung ini.\n3. Terapi medis khusus – Dalam beberapa kasus, pasien dengan perikarditis parah mungkin memerlukan terapi medis lainnya seperti obat untuk menekan tekanan darah tinggi atau pengobatan untuk mengurangi kebutaan jantung.\n4. Penggunaan kateter perikardial – Dalam kasus yang sangat parah, penyembuhan dengan cara ini mungkin diperlukan untuk mereduksi tekanan cairan di perikardium dan mengurangi paparan jantung terhadap inflamasi.\n5. Penggunaan sirkulasi internal – Dalam kasus yang sangat parah, pasien mungkin memerlukan prosedur medis lainnya untuk mengeluarkan cairan perikardial dan menstabilkan fungsi jantung mereka.\n6. Penggunaan obat-obatan ekstern – Selain pemberian oral, pasien mungkin memerlukan terapi medis ekstern seperti infus antibiotik atau cairan intravena untuk membersihkan tubuh dari bakteri dan mengurangi inflamasi.\n7. Penggunaan obat-obatan internasional – Dalam kasus yang sangat parah, pasien mungkin memerlukan pemberian obat internasional seperti kolestrol ester transfer protein (CETP) untuk menstabilkan fungsi jantung mereka.\n8. Pemantauan medis – Penggunaan semua metode tersebut harus dibarengi dengan penelitian medis yang sering dan ketat untuk memonitor apakah pasien sedang mengalami pemulihan atau tidak.\n9. Konsultasi dokter spesialis lain – Pada kasus parah, terdapat kemungkinan bahwa pasien akan mendapatkan dukungan dari berbagai tenaga medis termasuk ahli jantung, endokrinologi, gigi, dan fisioterapi.\n10. Kepemilikan diri – Pasien yang mengalami perikarditis parah juga memerlukan dukungan keluarga dan teman untuk menjaga komitmen mereka dalam pengobatan dan kehidupannya.",0.7727272727272727,0.639126180150002,0.9999999999,1.0
Apa gejala penyakit ventrikel takikardi?,"Ada beberapa gejala yang menandakan ventrikel takikardi, antara lain:\n\nJantung berdebar yang membuat penderitanya merasa tidak nyaman\nSesak napas\nNyeri atau rasa tertekan di dada\nPening atau terasa melayang\nPenurunan kesadaran\n\nVentrikel takikardi perlu diwaspadai karena dapat berkembang menjadi ventrikel fibrilasi, yaitu suatu kondisi yang berbahaya dan bisa menyebabkan kematian.","['Topik: Ventrikel Takikardi, Subtopik: Gejala Ventrikel Takikardi \n Ada beberapa gejala yang menandakan ventrikel takikardi, antara lain:\n- Jantung berdebar yang membuat penderitanya merasa tidak nyaman\n- Sesak napas\n- Nyeri atau rasa tertekan di dada\n- Pening atau terasa melayang\n- Penurunan kesadaran\nVentrikel takikardi perlu diwaspadai karena dapat berkembang menjadi ventrikel fibrilasi, yaitu suatu kondisi yang berbahaya dan bisa menyebabkan kematian.\n', 'Topik: Ventrikel Takikardi, Subtopik: Gejala Ventrikel Takikardi: Kapan harus ke dokter \n Ventrikel takikardi harus segera ditangani. Oleh sebab itu, jika Anda merasakan gejala-gejala di atas, hubungi dokter secepatnya.\nJika Anda melihat orang yang kehilangan kesadaran, tidak memililiki denyut nadi dan tidak bernapas, segera cari pertolongan medis atau minta bantuan orang sekitar, serta lakukan CPR kepada orang tersebut jika Anda mampu.\nBila tersedia alat kejut jantung otomatis atau Automatic External Defibrillator (AED), gunakan alat tersebut untuk mengetahui irama jantung penderita. Setelah itu, ikuti petunjuk dari alat AED. Lakukan hal tersebut hingga bantuan medis datang.\n', 'Topik: Ventrikel Takikardi, Subtopik: Pengertian Ventrikel Takikardi \n Ventricular tachycardia atau ventrikel takikardi adalah kondisi ketika ventrikel (bilik) jantung berdetak terlalu cepat. Hal ini terjadi akibat gangguan pada aliran listrik jantung yang penyebabnya bervariasi.\nVentrikel takikardi terjadi saat bilik atau ruangan bawah jantung berdetak terlalu cepat dan tidak sinkron dengan gerakan serambi (atrium) jantung. Akibatnya, jantung tidak dapat memompa darah secara efektif. Kondisi ini menyebabkan tubuh kekurangan oksigen.\n\n']","Gejala Ventrikel Takikardi (V-Tak) antara lain:\n\n1. Jantung berdebar, yang membuat pasien merasa tidak nyaman dan bahkan bisa menyebabkan keguguran.\n2. Sesak napas, karena jantung terlalu cepat mengeluarkan darah sehingga paru-paru tidak dapat menyerap oksigen yang cukup.\n3. Nyeri atau rasa tertekar di dada, disebabkan oleh peningkatan tekanan dalam sistem peredaran darah.\n4. Pening atau terasa melayang, karena jantung tidak dapat memompa darah seefektif dan menyebabkan tubuh kekurangan oksigen.\n5. Penurunan kesadaran, akibat penyakit ini yang mengganggu fungsi otak akibat kurangnya pemenuhan oksigen.","Gejala penyakit ventrikel takikardi (VT) termasuk gejala yang seringkali mendahului atau menyertainya, dan dapat beragam antara individu ke individu. Berikut beberapa gejala umum yang terkait dengan penyakit ventrikel takikardi:\n\n1. Tindakan jantung (Cardiac action): Gejala ini meliputi tahapan awal VT, dimana ritme nadi meningkat secara signifikan dan pemicu hipertrofi ventrikel yang dapat menyebabkan tekanan darah meningkat.\n2. Penyakit jantung (Heart failure): Gejala ini terkait dengan VT karena berarti ventrikel tidak bekerja secara efektif untuk membersihkan darah ke seluruh tubuh, menyebabkan gejala seperti pusing, bising di telinga, dan nyeri dada.\n3. Hipertensi: Peningkatan tekanan darah yang tinggi seringkali terjadi akibat dari hipertrofi ventrikel takikardi atau aliran bolak-balik (regurgitant flow) pembuka jantung, yang menyebabkan tekanan dalam ventrikel meningkat.\n4. Hiperkapnie: Gejala ini terkait dengan VT karena menggambarkan penurunan tekanan darah akibat gangguan pengeluaran jantung, yang juga bisa disebabkan oleh ventrikel takikardi.\n5. Pembesaran ventrikel: Pada akhirnya, gejala VT dapat menyebabkan pembesaran ventrikel sebelah kiri atau kanan jantung, yang merupakan penyebab dominan lainnya untuk penyakit jantung.\n6. Emfisema: Gejala ini terkait dengan VT karena seringkali disertai oleh adanya pembekuan darah di dalam paru-paru, yang menggangu aliran oksigen dan karbondioksida.\n7. Koma: Dalam hal terlarang, ventrikel takikardi bisa menyebabkan koma atau gangguan pola tidur akibat pengaruh hipoksia (kurangnya oksigen) dan hiperkapnie.\n8. Hipervolesitas: Gejala ini mengacu pada penyembuhan yang berlebihan di jantung, menyebabkan tekanan darah meningkat secara signifikan.\n\nNamun, perlu dicatat bahwa gejala VT tidak selalu nyata atau mencerminkan pasien mengalami penyakit ventrikel takikardi dan kadang-kadang hanya memiliki beberapa gejala yang sederhana seperti nyeri dada, bising di telinga, atau tidur dingin. Selain itu, beberapa pasien dapat hidup tanpa sadar bahkan dalam kasus yang lebih parah dan mengalami efek fatal akibat VT.\n\nKesimpulannya, gejala penyakit ventrikel takikardi bervariasi antara individu keindividu, tetapi sebagian besar dapat mencerminkan pembedaan jantung atau gangguan ritme nadi yang memicu VT. Namun, khususnya untuk gejala tertentu dan penyebabnya, perlu dilakukan diagnostik medis lebih lanjut untuk mengetahui sebenarnya apa yang terjadi dengan pasien dan mengenai dukungan keamanan jantung mereka.",0.5714285714285714,0.5319578562725273,0.8333333332916666,1.0
Bagaimana penanganan terhadap seseorang yang mengalami penyakit ventrikel takikardi?,"Segera cari pertolongan medis atau minta bantuan orang sekitar, serta lakukan CPR kepada orang tersebut jika Anda mampu.\n\nBila tersedia alat kejut jantung otomatis atau Automatic External Defibrillator (AED), gunakan alat tersebut untuk mengetahui irama jantung penderita. Setelah itu, ikuti petunjuk dari alat AED. Lakukan hal tersebut hingga bantuan medis datang.","['Topik: Ventrikel Takikardi, Subtopik: Pengobatan Ventrikel Takikardi \n Penanganan ventrikel tarkikadi tergantung pada kondisi dan tingkat keparahan pasien. Tindakan yang dapat dilakukan oleh dokter jantung untuk menangani ventrikel takikardi antara lain:\n- Pemberian obat antiaritmia\nObat antiaritmia, seperti verapamil atau amiodarone, diberikan agar gangguan serupa tidak terjadi lagi.\n- Ablasi jantung\nProsedur ini dilakukan jika terdapat jalur listrik yang menyebabkan detak jantung pasien\n- Pemasangan alat implantable cardioverter defibrillator (ICD)\nAlat ini dimasukkan ke dalam dada atau area perut pasien, untuk membantu mengembalikan irama jantung ke kondisi normal.\n', 'Topik: Ventrikel Takikardi, Subtopik: Diagnosis Ventrikel Takikardi \n Pada tahap awal penanganan, dokter akan menstabilkan kondisi pasien terlebih dulu. Setelah kondisi pasien stabil, dokter akan melakukan pemeriksaan untuk mencari tahu penyebab dari keluhan pasien. Pemeriksaan itu meliputi:\n- Elektrokardiografi (EKG)\nEKG jantung bertujuan untuk mengukur aktivitas listrik\n- EKG treadmill\nTindakan ini bertujuan untuk melihat rekaman listrik jantung selama pasien beraktivitas di atas alat treadmill.\n- Holter monitor\nProsedur ini dilakukan dengan memasang EKG portabel selama 24 jam untuk merekam aliran listrik jantung.\n- Echo jantung\nMetode ini menggunakan gelombang suara berfrekuensi tinggi, untuk melihat gambaran struktur dan katup jantung secara lebih detail.\n- MRI jantung\nPemindaian ini dilakukan untuk mendapatkan gambaran detail jantung, dengan menggunakan gelombang magnet.\n- Kateterisasi jantung\nKateterisasi jantung berfungsi untuk mengetahui aliran darah ke otot jantung.\n', 'Topik: Ventrikel Takikardi, Subtopik: Gejala Ventrikel Takikardi: Kapan harus ke dokter \n Ventrikel takikardi harus segera ditangani. Oleh sebab itu, jika Anda merasakan gejala-gejala di atas, hubungi dokter secepatnya.\nJika Anda melihat orang yang kehilangan kesadaran, tidak memililiki denyut nadi dan tidak bernapas, segera cari pertolongan medis atau minta bantuan orang sekitar, serta lakukan CPR kepada orang tersebut jika Anda mampu.\nBila tersedia alat kejut jantung otomatis atau Automatic External Defibrillator (AED), gunakan alat tersebut untuk mengetahui irama jantung penderita. Setelah itu, ikuti petunjuk dari alat AED. Lakukan hal tersebut hingga bantuan medis datang.\n']","Penanganan terhadap seseorang yang mengalami penyakit ventrikel takikardi melibatkan beberapa prosedur medis, di antaranya adalah pemberian obat antiaritmia seperti verapamil atau amiodarone untuk mencegah terjadinya gangguan serupa lagi. Selain itu, tindakan lain yang dapat dilakukan oleh dokter jantung termasuk ablasi jantung dan pemasangan alat implantable cardioverter defibrillator (ICD) untuk mengembalikan irama jantung ke kondisi normal.\n\nPada tahap awal penanganan, dokter akan menstabilkan kondisi pasien terlebih dulu sebelum melakukan pemeriksaan diagnostik untuk mencari tahu penyebab dari keluhan pasien. Pemeriksaan yang umum dilakukan antara lain adalah elektrokardiografi (EKG), EKG treadmill, Holter monitor, echo jantung, MRI jantung, dan kateterisasi jantung untuk mengetahui aliran darah ke otot jantung.\n\nJika Anda melihat orang yang kehilangan kesadaran, tidak memiliki denyut nadi dan tidak bernapas, segera cari pertolongan medis atau minta bantuan orang sekitar, serta lakukan CPR kepada orang tersebut jika Anda mampu. Bila tersedia alat kejut jantung otomatis atau Automatic External Defibrillator (AED), gunakan alat tersebut untuk mengetahui irama jantung penderita dan ikuti petunjuk dari alat AED.","Penanganan pasien dengan penyakit ventrikel takikardi (VT) melibatkan beberapa aspek kesehatan, termasuk intervensi medis dan penggunaan obat. Berikut adalah beberapa aspek penting dalam penanganan VT:\n\n1. Pemberian Obat Konvulsiv: Salah satu obat yang umum diberikan kepada pasien VT adalah antiarytmia, seperti amiodarone atau encainide. Inhibitori IC50 (seperti flecainide) juga sering digunakan untuk menstabilkan saraf pasca-gangguan jantung.\n2. Implant Defibrillator: Jika pasien memiliki riwayat penyakit jantung yang tidak stabil atau telah mengalami rilem, implantasi defibrillator dapat digunakan untuk menjaga agar denyut jantung tetap normal.\n3. Kardioklok: Metode ini digunakan untuk mencegah pengulangan serangkaian gangguan jantung yang mengganggu dan membahayakan pasien, terutama saat tidur atau dalam keadaan pernapasan alami.\n4. Pemulihan Fisik: Perawat dapat merekomendasasi program kondisi tubuh yang kompleks untuk meningkatkan fungsi jantung dan mengurangi risiko serangan jantung atau stroke.\n5. Terapi Konsultasi: Konsultan psikiater, ners, dan ekonom harus terlibat dalam pengobatan pasien VT karena penyakit ini dapat mempengaruhi performa mental dan jiwa pasien.\n6. Pencegahan Komplikasi: Pasien perlu ditindaklanjuti secara mendetail untuk menghindari riwayat serangan jantung atau stroke, termasuk penghentian asupan makanan, penyembuhan luka infeksi, dan pengendalian tekanan darah tinggi.\n7. Dialog dengan Pasien: Konsultasi yang baik tentang penyakit VT dan cara kerjanya harus dilakukan untuk memastikan bahwa pasien mengerti tindakan medis mereka, serta mendapat dukungan emosional dalam menghadapi masalah ini.\n8. Rekomendasi Diet: Pasien dengan VT perlu disarankan oleh dokter untuk memilih makanan sehat dan mengontrol asupan gula serta konsumsi lemak, yang akan menjadi penting dalam mengurangi risiko penyakit jantung.\n9. Penggunaan Alat-alat Rumah: Pasien dengan VT perlu mempelajari cara penggunaan alat-alat kesehatan rumah, seperti oksimeter atau meter denyut nadi, untuk mengontrol kondisinya sendiri.\n10. Konsultasi Ilmiah: Terdapat riset dan inovasi yang terus berkembang dalam penyakit VT dan pengobatan, sehingga dokter sering meminta pasien menjadi subjek riset atau mengikuti seminar tentang perkembangan teknologi medis.\n\nDalam keseluruhan itu, penanganan pasien dengan penyakit ventrikel takikardi adalah sebuah proses yang kompleks dan perlu dukungan interprofessional untuk memastikan bahwa semua aspek kesehatan pasien terpenuhi.",1.0,0.5908468672911162,0.5833333333041666,1.0
Apa faktor yang dapat meningkatkan risiko terkena penyakit Ventricular Septal Defect?,"Ada beberapa faktor yang dapat meningkatkan risiko seseorang terkena VSD, antara lain:\n\nMemiliki keluarga dengan riwayat penyakit jantung bawaan\nMenderita kelainan genetik, seperti Down Syndrome","['Topik: Ventricular Septal Defect, Subtopik: Penyebab Ventricular Septal Defect (VSD) \n Defek septum ventrikel (VSD) disebabkan oleh gangguan dalam proses pembentukan jantung di dalam kandungan. Gangguan ini menyebabkan dinding pemisah antara bilik kanan dan bilik kiri jantung tidak menutup dengan sempurna.\nBelum diketahui secara pasti pemicu terjadinya gangguan tersebut. Namun, faktor kelainan genetik dan lingkungan diduga menjadi faktor utama yang menyebabkan seseorang menderita kondisi ini.\nMeski jarang, defek septum ventrikel juga berisiko dialami oleh orang dewasa. Kondisi ini dapat terjadi pada penderita serangan jantung atau orang yang mengalami cedera hebat di bagian dada, misalnya akibat kecelakaan.\nAda beberapa faktor yang dapat meningkatkan risiko seseorang terkena VSD, antara lain:\n- Memiliki keluarga dengan riwayat penyakit jantung bawaan \n- Menderita kelainan genetik, seperti Down Syndrome \n', 'Topik: Ventricular Septal Defect, Subtopik: Pencegahan Ventricular Septal Defect (VSD) \n Defek septum ventrikel (VSD) sulit dicegah, karena umumnya terjadi karena faktor bawaan lahir. Namun, risiko VSD dapat diturunkan dengan menjalani gaya hidup sehat selama hamil, agar kesehatan dan perkembangan janin tetap terjaga.\nUpaya yang dapat dilakukan antara lain:\n- Melakukan pemeriksaan kehamilan secara rutin\n- Menjalani diet seimbang dengan mengonsumsi makanan bergizi dan bernutrisi\n- Berolahraga secara teratur\n- Tidak merokok\n- Membatasi konsumsi minuman beralkohol\n- Tidak menggunakan narkoba\n- Mencegah infeksi dengan melakukan vaksinasi sebelum merencanakan kehamilan\n', 'Topik: Ventricular Septal Defect, Subtopik: Pengertian Ventricular Septal Defect \n Ventricular septal defect (VSD) adalah kelainan jantung yang ditandai dengan adanya celah atau lubang di antara kedua bilik jantung. Pada kondisi normal, seharusnya lubang atau celah tersebut tidak ada.\nVentricular septal defect atau defek septum ventrikel merupakan salah satu jenis penyakit jantung bawaan. Kondisi ini dapat terjadi sejak usia kehamilan 8 minggu, yaitu pada saat proses pembentukan jantung janin berlangsung.\n\nPada awal pembentukan jantung, bilik kiri dan kanan jantung masih menyatu, tetapi seiring pertumbuhan janin, dinding pemisah (septum) antara kedua bilik tersebut akan terbentuk. Namun, pada beberapa kondisi, septum tidak terbentuk sempurna sehingga meninggalkan sebuah lubang.\nDefek septum ventrikel menyebabkan bilik kiri jantung bekerja lebih keras sehingga menimbulkan gangguan katup dan gagal jantung.\n']","Faktor-faktor yang dapat meningkatkan risiko terkena penyakit ventricular septal defect (VSD) antara lain:\n\n1. Keluarga dengan riwayat penyakit jantung bawaan, sehingga risiko genetik tinggi.\n2. Menderita kelainan genetik, seperti Down syndrome atau sindrom其他其他别的genetic disorders, yang juga memiliki resiko tinggi terkena VSD.\n3. Mengalami infeksi pada masa kehamilan akibat penyakit lain, misalnya rubella atau toxoplasmosis, yang dapat meningkatkan risiko timbulnya VSD.\n4. Kondisi ibu hamil yang merokok atau mengkonsumsi alkohol dan minuman stimulan, karena faktor lingkungan ini juga berpengaruh pada perkembangan janin.\n5. Mengalami penyakit infeksi seperti difteri atau glikemias akut di masa kehamilan, yang dapat memicu terjadinya VSD.\n6. Gangguan metabolisme dalam keluarga atau riwayat asupan racun, seperti berbagai toksin atau zat racun lainnya.\n7. Keadaan ibu hamil yang mengalami penurunan berat badan secara drastis dan gangguan pemenuhan makanannya di masa pertama kehamilan, karena ketersediaan nutrisi janin kurang mendukung perkembangan normal.\n8. Konsepsi dengan usia tengah atau lanjut relatif dini, yang memungkinkan faktor lingkungan dan biologi pada masa pertumbuhan janin belum seimbang.","Faktor-faktor yang dapat meningkatkan risiko terkena penyakit ventrikel septum defek (VSD) termasuk faktor genetik, lingkungan, dan kondisi kehamilan. Beberapa faktor genetik yang berhubungan dengan VSD meliputi asfiksia neonatal, penyempitan arteri umbilikus, hipoksia intramuskular, serta genetik lainnya. Lingkungan dan risiko kesempatan seperti infeksi di masa kehamilan, penggunaan obat, radiasi, hingga tingkat asupan makanan juga dapat mempengaruhi terjadinya VSD. Kondisi mati natal, yang merujuk pada gangguan dalam pertumbuhan dan perkembangan janin sebelum dan sesudah dilahirkan, juga diperkirakan berhubungan dengan risiko penyakit jantung.\n\nPerlu dicatat bahwa beberapa faktor yang mempengaruhi terjadinya VSD tidak selalu dapat dikendalikan atau dicegah, seperti faktor genetik dan lingkungan, tetapi mengetahui hal-hal ini penting untuk mengenal pasti pasien yang mungkin memiliki risiko tinggi dan memberikan perlindungan medis yang lebih baik.",0.3333333333333333,0.734096095738944,0.99999999995,1.0
Apa gejala yang umum terjadi pada anak atau bayi penderita Ventricular Septal Defect?,"Secara umum, gejala VSD pada bayi dan anak-anak meliputi:\n\nMudah lelah ketika sedang makan atau bermain\nBanyak mengeluarkan keringat, terutama ketika makan\nTidak nafsu makan\nBerat badan sulit naik\nNapas cepat dan terdengat berat\nKulit terlihat pucat","['Topik: Ventricular Septal Defect, Subtopik: Gejala Ventricular Septal Defect (VSD) \n Gejala VSD bervariasi, tergantung ukuran dan lokasi celah pada jantung, serta ada tidaknya kondisi cacat jantung lain yang mendasarinya. Gejala ini sering kali sulit terdeteksi saat bayi lahir, terutama jika lubangnya berukuran kecil.\nPada beberapa kasus, kelainan ini terkadang tidak menunjukkan gejala sama sekali dan baru muncul setelah bayi mulai memasuki usia anak-anak.\nSecara umum, gejala VSD pada bayi dan anak-anak meliputi:\n- Mudah lelah ketika sedang makan atau bermain\n- Banyak mengeluarkan keringat, terutama ketika makan\n- Tidak nafsu makan\n- Berat badan sulit naik\n- Napas cepat dan terdengat berat\n- Kulit terlihat pucat\n', 'Topik: Ventricular Septal Defect, Subtopik: Gejala Ventricular Septal Defect (VSD): Kapan harus ke dokter \n Segera periksakan anak Anda ke dokter anak jika muncul gejala VSD seperti di atas, terutama bila sampai menimbulkan gejala yang berbahaya sebagai berikut:\n- Sering mengalami infeksi saluran pernapasan \n- Sesak napas\n- Kulit terlihat membiru di sekitar bibir dan kuku\nJika Anda merasakan gejala seperti napas pendek dan berat saat beraktivitas atau berbaring, detak jantung cepat dan tidak beraturan, serta sering merasa kelelahan dan tubuh terasa lemas, segara periksakan diri ke dokter.\n', 'Topik: Ventricular Septal Defect, Subtopik: Pengobatan Ventricular Septal Defect (VSD) \n Pada sebagian besar kasus, bayi yang terlahir dengan VSD berukuran kecil tidak memerlukan operasi untuk menutup lubang. Dokter hanya akan memantau kondisi bayi dan kemungkinan munculnya gejala melalui pemeriksaan secara rutin, serta menunggu apakah lubang dapat menutup dengan sendirinya.\nJika defek septum ventrikel berukuran sedang hingga besar dan menimbulkan gejala, maka operasi menjadi jalan terbaik untuk menangani kondisi ini. Operasi dilakukan beberapa minggu atau beberapa bulan pertama setelah bayi lahir.\nBerikut ini adalah beberapa metode operasi yang dapat dilakukan untuk mengatasi VSD:\n']","Gejala umum yang mungkin timbul pada anak atau bayi penderita Ventricular Septal Defect (VSD) antara lain:\n\n1. Mudah lelah saat makan atau bermain, serta cepat merasa lupa dan tubuh terasa gemetar.\n2. Mengeluarkan keringat secara banyak, terutama ketika sedang menjarah atau beraktivitas fisik.\n3. Tidak memiliki nafsu makan yang tinggi, sehingga berat badan sulit naik.\n4. Kerap mengalami napas cepat dan sering terdengar lembam saat sedang minum atau bernapas normal lainnya.\n5. Kulit tampak pucat dan kurang merah-merah, yang dapat menandakan adanya defisiensi oksigen dalam tubuh.","Gejala umum pada anak atau bayi penderita Lemoh Ventrikular Septum Defek (LVSD) termasuk ketidaknormalan denyut jantung, seperti pola nafas yang cepat dan teratur serta kesulitan bernapas. Selain itu, anak atau bayi ini juga mungkin mengalami penurunan berat badan tidak normal, kehilangan daya ngaku, dan bahkan gejala ekstrim seperti edema (penggiguran air).\n\nPenyebab dari Lemoh Ventrikular Septum Defek adalah suatu masalah struktural pada jantung dimana penyekat antara kedua ventrikel tidak memiliki fungsi sempurna. Hal ini menyebabkan aliran darah yang tidak merata ke tubuh dan dapat meningkatkan tekanan dalam tubuh, risiko serangan jantung atau penyumbatan pembuluh darah.\n\nSegera setelah muncul gejala-gejala tersebut, berkas informasi ini harus segera didaftarkan kepada dokter untuk mendapatkan perawatan dan dukungan medis yang tepat.",0.5454545454545454,0.7536716380721464,0.99999999995,1.0
Apa penyebab penyakit sindrom brugada?,"Sindrom Brugada terjadi akibat perubahan atau mutasi pada satu atau beberapa gen yang berperan menjaga irama jantung agar tetap normal. Gen yang bermutasi tersebut diturunkan dari salah satu orang tua.\n\nSindrom Brugada lebih sering dialami oleh laki-laki dibandingkan perempuan. Sementara kemunculan gejalanya diduga dapat dipicu dan diperburuk oleh kondisi berikut:\n\nGangguan elektrolit\nEfek samping obat, seperti obat antiaritmia, obat hipertensi, dan obat antidepresan\nPenyalahgunaan kokain\nDemam","['Topik: Sindrom Brugada, Subtopik: Penyebab dan Faktor Risiko Sindrom Brugada \n Sindrom Brugada terjadi akibat perubahan atau mutasi pada satu atau beberapa gen yang berperan menjaga irama jantung agar tetap normal. Gen yang bermutasi tersebut diturunkan dari salah satu orang tua.\nSindrom Brugada lebih sering dialami oleh laki-laki dibandingkan perempuan. Sementara kemunculan gejalanya diduga dapat dipicu dan diperburuk oleh kondisi berikut:\n- Gangguan elektrolit\n- Efek samping obat, seperti obat antiaritmia, obat hipertensi, dan obat antidepresan\n\n- Penyalahgunaan kokain\n\n- Demam\n', 'Topik: Sindrom Brugada, Subtopik: Pengertian Sindrom Brugada \n Sindrom Brugada adalah gangguan irama jantung akibat kelainan genetik. Sindrom Brugada sering kali tidak memunculkan gejala, tetapi dapat membuat penderitanya mengalami henti jantung mendadak.\nIrama jantung yang tidak teratur akan membuat jantung tidak bisa memompa darah ke seluruh tubuh secara optimal. Walaupun sering kali tidak menimbulkan keluhan, sebagian penderita sindrom Brugada dapat merasakan keluhan jantung berdebar dan sesak napas.\n\nSindrom Brugada jarang terjadi, namun merupakan salah satu penyebab utama kematian mendadak pada bayi hingga orang dewasa.\n', 'Topik: Sindrom Brugada, Subtopik: Pengertian Sindrom Brugada \n Irama jantung yang tidak teratur akan membuat jantung tidak bisa memompa darah ke seluruh tubuh secara optimal. Walaupun sering kali tidak menimbulkan keluhan, sebagian penderita sindrom Brugada dapat merasakan keluhan jantung berdebar dan sesak napas.\n\nSindrom Brugada jarang terjadi, namun merupakan salah satu penyebab utama kematian mendadak pada bayi hingga orang dewasa.\n']","Penyebab penyakit sindrom Brugada adalah karena perubahan atau mutasi pada satu atau beberapa gen yang berperan dalam mengatur ritme jantung. Gen tersebut diturunkan dari salah satu induknya, dan ini menimbulkan gangguan irama jantung yang bisa memicu henti jantung mendadak pada beberapa pasien.","Penyebab penyakit sindrom Brugada belum jelas dan kompleks. Beberapa faktornya yang diketahui termasuk genetik, seperti variasi pada locus 1p36 telah teridentifikasi sebagai faktor risiko utama untuk sindrom Brugada. Faktor-faktor lain yang mempengaruhi seperti hiperkapnia, farmaka toksisitas, dan penyakit jantung lainnya juga dapat meningkatkan risiko munculnya sindrom Brugada.",1.0,0.7859264800831417,0.99999999995,1.0
Bagaimana metode utama dalam pengobatan sindrom brugada,"Metode utama pengobatan sindrom Brugada adalah implan alat kejut jantung otomatis (ICD) di bawah tulang selangka. Perangkat ini dihubungkan ke jantung melalui pembuluh darah untuk memonitor detak jantung. Jika detak jantung tidak normal, ICD akan mengirim sinyal kejut agar detak jantung kembali normal.","['Topik: Sindrom Brugada, Subtopik: Pengobatan Sindrom Brugada \n Metode utama pengobatan sindrom Brugada adalah implan alat kejut jantung otomatis (ICD) di bawah tulang selangka. Perangkat ini dihubungkan ke jantung melalui pembuluh darah untuk memonitor detak jantung. Jika detak jantung tidak normal, ICD akan mengirim sinyal kejut agar detak jantung kembali normal.\nPerlu diketahui, ICD dapat mengirimkan sinyal kejut meski detak jantung pasien sedang dalam kondisi normal. Untuk mengurangi risiko kondisi tersebut terjadi, pasien yang menggunakan ICD perlu rutin memeriksakan diri ke dokter. Jika ICD tidak efektif dalam mengatasi sindrom Brugada, dokter akan menyarankan terapi ablasi jantung.\nSelain prosedur di atas, dokter juga dapat meresepkan obat antiaritmia untuk menjaga detak jantung pasien tetap normal.\n', 'Topik: Sindrom Brugada, Subtopik: Pencegahan Sindrom Brugada \n Sindrom Brugada tidak dapat dicegah, karena kelainan genetik yang menyebabkan kondisi ini sudah terjadi sejak lahir. Meski begitu, komplikasi sindrom Brugada bisa dicegah dengan pemeriksaan dini ketika ada gejala gangguan irama jantung.\nBila Anda tidak mengalami gejala sindrom Brugada tetapi memiliki anggota keluarga yang menderita sindrom Brugada atau meninggal karena henti jantung mendadak, sebaiknya periksakan diri ke dokter jantung. Tujuannya adalah agar penyakit ini dapat dideteksi dan ditangani sedini mungkin bila ada.\nSelain itu, penderita sindrom Brugada juga disarankan untuk:\n- Segera mengonsumsi obat penurun demam jika mulai merasa demam dan tidak membiarkan demam naik\n- Menghindari konsumsi minuman beralkohol\n- Berkonsultasi dengan dokter sebelum mengonsumsi obat apapun\n- Menghindari olahraga yang berat atau kompetitif, seperti sepak bola\n', 'Topik: Sindrom Brugada, Subtopik: Pengertian Sindrom Brugada \n Sindrom Brugada adalah gangguan irama jantung akibat kelainan genetik. Sindrom Brugada sering kali tidak memunculkan gejala, tetapi dapat membuat penderitanya mengalami henti jantung mendadak.\nIrama jantung yang tidak teratur akan membuat jantung tidak bisa memompa darah ke seluruh tubuh secara optimal. Walaupun sering kali tidak menimbulkan keluhan, sebagian penderita sindrom Brugada dapat merasakan keluhan jantung berdebar dan sesak napas.\n\nSindrom Brugada jarang terjadi, namun merupakan salah satu penyebab utama kematian mendadak pada bayi hingga orang dewasa.\n']","Metode utama pengobatan Sindrom Brugada adalah implanting alat kejut jantung otomatis (ICD). Perangkat ini dihubungkan ke jantung melalui pembuluh darah untuk memonitor detak jantung. Jika detak jantung tidak normal, ICD akan mengirim sinyal kejut agar detak jantung kembali normal.\n\nSelain prosedur di atas, dokter juga dapat meresepkan obat antiaritmia untuk menjaga detak jantung pasien tetap normal. ICD dapat mengirim sinyal kejut meski detak jantung pasien sedang dalam kondisi normal. Untuk mengurangi risiko kondisi tersebut, pasien yang menggunakan ICD perlu rutin memeriksa diri ke dokter. Jika ICD tidak efektif dalam mengatasi sindrom Brugada, dokter akan menyarankan prosedur lain seperti terapi ablasi jantung.","Syndrome Brugada merupakan suatu kondisi yang menggambarkan gejala munculnya aritmia jantung, termasuk riwayat serius seperti stroke atau pilek. Metode utama dalam pengobatan Syndrome Brugada meliputi:\n\n1. Pemberian obat-obatan khusus untuk mengurangi risiko terjadinya aritmia jantung, seperti amiodarone, flecainide, atau ICD (implantable cardioverter-defibrillator).\n2. Mengubah pola hidup dan faktor-faktor resikonya, seperti penuruan penggunaan alkohol dan merokok, serta menjaga berat badan yang normal untuk mengurangi risiko terkena stress atau stimulan alami.\n3. Melakukan screening rutin terhadap pasien dengan Syndrome Brugada secara berkala untuk memantau kondisinya dan mencegah terjadinya riwayat jangkitan aritmia jantung yang serius.",1.0,0.7222483873563627,0.9999999999,1.0
Apa komplikasi yang dapat ditimbulkan dari Hipertrofi Ventrikel Kiri?,"Hipertrofi ventrikel kiri dapat mengubah struktur dan kerja jantung. Kondisi ini juga dapat menyebabkan jantung melemah, mengeras, dan menurunkan fungsi jantung dalam memompa darah. Kondisi ini dinamakan gagal jantung.\n\nDi samping menyebabkan gagal jantung, hipertrofi ventrikel kiri dapat menyebabkan beberapa komplikasi lain di bawah ini:\n\nPenyakit jantung koroner\nGangguan irama jantung (aritmia), misalnya atrial fibrilasi\nStroke\nHenti jantung mendadak","['Topik: Hipertrofi Ventrikel Kiri, Subtopik: Komplikasi Hipertrofi Ventrikel Kiri \n Hipertrofi ventrikel kiri dapat mengubah struktur dan kerja jantung. Kondisi ini juga dapat menyebabkan jantung melemah, mengeras, dan menurunkan fungsi jantung dalam memompa darah. Kondisi ini dinamakan gagal jantung.\nDi samping menyebabkan gagal jantung, hipertrofi ventrikel kiri dapat menyebabkan beberapa komplikasi lain di bawah ini:\n- Penyakit jantung koroner\n- Gangguan irama jantung (aritmia), misalnya atrial fibrilasi \n- Stroke\n- Henti jantung mendadak\n', 'Topik: Hipertrofi Ventrikel Kiri, Subtopik: Gejala Hipertrofi Ventrikel Kiri: Kapan harus ke dokter \n Hipertrofi ventrikel kiri merupakan komplikasi yang sering terjadi akibat hipertensi. Baik hipertensi maupun hipertrofi ventrikel kiri pada awalnya tidak menimbulkan gejala sehingga sering kali baru terdeteksi ketika ukuran ventrikel kiri sudah sangat besar.\nOleh karena itu, penting untuk melakukan pemeriksaan tekanan darah secara rutin, terutama pada orang-orang yang merokok atau obesitas. Penderita hipertensi juga perlu melakukan pemeriksaan berkala ke dokter agar tekanan darah tetap terkontrol dengan baik.\nKondisi ini dapat berkembang menjadi penyakit jantung. Gejala penyakit jantung yang perlu segera ditangani di IGD (instalasi gawat darurat) adalah:\n- Nyeri dada selama lebih dari beberapa menit\n- Sesak napas yang tidak membaik dengan istirahat\n- Sangat pusing hingga hilang kesadaran \n', 'Topik: Hipertrofi Ventrikel Kiri, Subtopik: Penyebab Hipertrofi Ventrikel Kiri \n Hipertrofi ventrikel kiri terjadi ketika jantung bekerja lebih keras dalam memompa darah ke seluruh tubuh. Beberapa kondisi yang dapat menyebabkan hal tersebut meliputi:\n- Hipertensi Hipertrofi ventrikel kiri sering kali disebabkan oleh hipertensi. Lebih dari sepertiga orang yang didiagnosis menderita hipertrofi ventrikel kiri juga menderita tekanan darah tinggi.\n- Hipertrofi kardiomiopati Hipertrofi kardiomiopati adalah kelainan genetik yang terjadi saat otot jantung menebal secara abnormal tetapi tekanan darah tetap normal. Akibatnya, jantung kesulitan memompa darah.\n- Stenosis katup aorta Penyakit ini menyebabkan penyempitan pada katup aorta, yaitu katup jantung yang terletak setelah ventrikel kiri. Katup aorta yang menyempit membuat ventrikel atau bilik kiri jantung perlu bekerja lebih keras untuk memompa darah.\n- Latihan fisik Latihan fisik yang dilakukan secara intensif dan berkelanjutan dapat membuat jantung bekerja lebih keras sehingga menyebabkan hipertrofi ventrikel kiri. Kondisi ini sering terjadi pada atlet atau tentara.\nSelain itu, ada sejumlah faktor yang membuat seseorang makin berisiko terkena hipertrofi ventrikel kiri, yaitu:\n- Berusia 50 tahun ke atas\n- Memiliki berat badan berlebih\n- Menderita diabetes \n- Berjenis kelamin wanita\n']","Komplikasi yang dapat timbul dari hipertrofi ventrikel kiri, selain gagal jantung, termasuk penyakit jantung koroner, gangguan irama jantung seperti atrial fibrilasi, stroke, dan henti jantung mendadak.","Komplikasi dari hipertrofi ventrikel kiri, atau penyakit jantung yang disebut iskemia miokardia, berkaitan dengan peningkatan tekanan darah dan volume peredaran darah dalam sistem arteri. Berikut beberapa komplikasi umum yang mungkin timbul akibat hipertrofi ventrikel kiri:\n\n1. Hipertrofi Atrial (Pengembangan atrium)\n   - Pembesaran atrium dapat menyebabkan aritmia, termasuk penyebab terjadinya pembesaran atrial ekstravaskuler (AVM).\n\n2. Penyakit Koroner\n   - Perkembangan tebal dan lebih sulitnya pembuluh darah dalam jaringan miokardium dapat mempercepat penyumbatan arteri yang mengalir ke jantung, menyebabkan timbulnya stroke miokardia.\n\n3. Hipertrofi Ventrikel Kanan\n   - Jika hanya ventrikel kiri saja yang mengalami hipertrofia, maka ventrikel kanan akan menjadi lebih effisiensi dan berkontraksi untuk memenuhi kebutuhan tubuh. Namun, ini juga dapat menyebabkan peningkatan tekanan darah dalam sistem vena.\n\n4. Arritmia\n   - Pembesaran atrium dan ventrikel seringkali terkait dengan arritmia, termasuk fibrilasi atrial dan disartria yang bisa meningkatkan risiko stroke jantung.\n\n5. Penyakit Ginjal\n   - Tekanan darah tinggi akibat hipertrofi ventrikel kiri dapat mempengaruhi fungsi ginjal, terutama dalam hal filtrasi ginjal yang menurun dan peningkatan tekanan osmotik tubuh.\n\n6. Penyakit Strokes Miokardia\n   - Terdapat risiko lebih tinggi akan stroke miokardia karena adanya arritmia atau penyumbatan arteri yang mengalir ke jantung, terutama bila hipertrofi ventrikel kiri menyebabkan pembesaran atrium.\n\n7. Penyakit Strokes Miokardia Secara Tak Langsung\n   - Pembesaran atrium dan tekanan darah tinggi juga dapat memicu terjadinya emboli yang mengganggu aliran darah ke otak, menyebabkan stroke tak langsung.\n\n8. Gangguan Fungsi Ginjal\n   - Tekanan darah tinggi akibat hipertrofi ventrikel kiri dapat mempengaruhi fungsi ginjal dan menggangu filtrasi tubuh, yang bisa meningkatkan risiko terjadinya penyakit ginjal.\n\n9. Penyumbatan Arteri Mengalir Ke Jantung (Stroke Miokardia)\n   - Pembesaran atrium dan ventrikel dapat menyebabkan timbulnya aritmia, yang bisa mengganggu aliran darah ke miokardium dan meningkatkan risiko terjadinya penyumbatan arteri mengalir ke jantung (stroke miokardia).\n\n10. Penyakit Strokes Miokardia Secara Tak Langsung\n    - Pembesaran atrium dan tekanan darah tinggi juga dapat memicu terjadinya emboli yang mengganggu aliran darah ke otak, menyebabkan stroke tak langsung.",1.0,0.7342723616778913,0.9999999999666667,1.0
Bagaimana pencegahan penyakit hipertrofi ventrikel kiri?,"Salah satu cara yang bisa dilakukan untuk mencegah hipertrofi ventrikel kiri adalah menjaga agar tekanan darah selalu berada pada batas normal. Berikut ini adalah beberapa upaya yang dapat dilakukan untuk mengontrol tekanan darah, sekaligus mencegah terjadinya hipertensi:\n\nMelakukan pemeriksaan berkala terhadap tekanan darah\nSelalu menjaga berat badan ideal\nBerolahraga secara rutin, idealnya 30 menit setiap hari\nMenerapkan pola makan sehat, seperti banyak makan buah dan sayur, serta menghindari makanan tinggi lemak dan garam\nMenghindari konsumsi minuman beralkohol secara berlebihan, karena dapat meningkatkan tekanan darah dan asupan kalori\nBerhenti merokok, karena merokok dapat menaikkan tekanan darah dan meningkatkan risiko hipertensi\nMengelola stres dengan baik","['Topik: Hipertrofi Ventrikel Kiri, Subtopik: Pencegahan Hipertrofi Ventrikel Kiri \n Salah satu cara yang bisa dilakukan untuk mencegah hipertrofi ventrikel kiri adalah menjaga agar tekanan darah selalu berada pada batas normal. Berikut ini adalah beberapa upaya yang dapat dilakukan untuk mengontrol tekanan darah, sekaligus mencegah terjadinya hipertensi:\n- Melakukan pemeriksaan berkala terhadap tekanan darah\n- Selalu menjaga berat badan ideal \n- Berolahraga secara rutin, idealnya 30 menit setiap hari\n- Menerapkan pola makan sehat, seperti banyak makan buah dan sayur, serta menghindari makanan tinggi lemak dan garam\n- Menghindari konsumsi minuman beralkohol secara berlebihan, karena dapat meningkatkan tekanan darah dan asupan kalori\n- Berhenti merokok, karena merokok dapat menaikkan tekanan darah dan meningkatkan risiko hipertensi\n- Mengelola stres dengan baik\n', 'Topik: Hipertrofi Ventrikel Kiri, Subtopik: Pengobatan Hipertrofi Ventrikel Kiri \n Pengobatan hipertrofi ventrikel kiri adalah dengan mengatasi penyebabnya, agar otot ventrikel kiri jantung tidak makin membesar sehingga mengakibatkan gagal jantung.\nHipertrofi ventrikel kiri yang disebabkan oleh hipertensi bisa diatasi dengan mengubah gaya hidup, seperti menjalani diet rendah lemak dan garam, memperbanyak konsumsi buah dan sayur, berolahraga secara teratur, dan berhenti merokok.\nSelain perubahan gaya hidup, hipertensi perlu diobati dengan obat-obatan untuk mengatasi tekanan darah tinggi, contohnya:\n- Obat ACE inhibitor, seperti captopril dan ramipril\n- Obat ARB, seperti losartan \n- Obat antagonis kalsium, seperti amlodipine \n- Obat diuretik, seperti hydrochlorothiazide \n- Obat penghambat beta, seperti atenolol\nSelain hipertensi, berikut ini adalah metode pengobatan hipertrofi ventrikel kiri sesuai dengan penyebab yang mendasarinya:\n- Penanganan hipertrofi ventrikel kiri akibat stenosis katup aorta Pada pasien dengan kondisi ini, dokter akan menjalankan operasi untuk memperbaiki katup aorta atau menggantinya dengan katup buatan.\n- Penanganan hipertrofi ventrikel kiri akibat aktivitas fisik berlebihan Pada kondisi ini, dokter akan menyarankan pasien untuk menghentikan latihan fisik selama 3 hingga 6 bulan. Setelah itu, dokter akan melakukan pemeriksaan echo jantung untuk memantau pembesaran ventrikel kiri.\n- Penanganan hipertrofi kardiomiopati Kondisi ini dapat ditangani dengan obat-obatan, perubahan gaya hidup, prosedur bedah, dan penanaman alat khusus di dalam jantung.\n', 'Topik: Hipertrofi Ventrikel Kiri, Subtopik: Penyebab Hipertrofi Ventrikel Kiri \n Hipertrofi ventrikel kiri terjadi ketika jantung bekerja lebih keras dalam memompa darah ke seluruh tubuh. Beberapa kondisi yang dapat menyebabkan hal tersebut meliputi:\n- Hipertensi Hipertrofi ventrikel kiri sering kali disebabkan oleh hipertensi. Lebih dari sepertiga orang yang didiagnosis menderita hipertrofi ventrikel kiri juga menderita tekanan darah tinggi.\n- Hipertrofi kardiomiopati Hipertrofi kardiomiopati adalah kelainan genetik yang terjadi saat otot jantung menebal secara abnormal tetapi tekanan darah tetap normal. Akibatnya, jantung kesulitan memompa darah.\n- Stenosis katup aorta Penyakit ini menyebabkan penyempitan pada katup aorta, yaitu katup jantung yang terletak setelah ventrikel kiri. Katup aorta yang menyempit membuat ventrikel atau bilik kiri jantung perlu bekerja lebih keras untuk memompa darah.\n- Latihan fisik Latihan fisik yang dilakukan secara intensif dan berkelanjutan dapat membuat jantung bekerja lebih keras sehingga menyebabkan hipertrofi ventrikel kiri. Kondisi ini sering terjadi pada atlet atau tentara.\nSelain itu, ada sejumlah faktor yang membuat seseorang makin berisiko terkena hipertrofi ventrikel kiri, yaitu:\n- Berusia 50 tahun ke atas\n- Memiliki berat badan berlebih\n- Menderita diabetes \n- Berjenis kelamin wanita\n']","Pencegahan hipertrofi ventrikel kiri terdiri atas beberapa langkah sederhana yang bisa dilakukan oleh siapapun, termasuk mereka yang tidak menderita penyebab utama hipertrofi ventrikel kiri seperti hipertensi. Berikut adalah upaya pencegahan:\n\n1. Mengontrol tekanan darah: Pastikan tekanan darah tetap dalam batas normal dengan cara melakukan pemeriksaan berkala terhadap tekanan darah, menjaga berat badan ideal, mengonsumsi diet sehat, dan menghindari konsumsi minuman beralkohol.\n2. Berolahraga secara rutin: Cukup melakukan latihan fisik sekitar 30 menit setiap hari dapat membantu mengurangi risiko terjadinya hipertrofi ventrikel kiri, termasuk dalam hal ini hubungannya erat dengan tekanan darah dan berat badan.\n3. Mengontrol berat badan: Jaga agar tidak gemetar atau mengecilkan alis secara berlebihan, karena itu juga bisa menyebabkan hipertrofi ventrikel kiri.\n4. Menyusui makan sehat dan mengurangi asupan garam: Mengonsumsi banyak buah-buahan dan sayuran yang bergizi serta menghindari makanan dengan tingkat lemak dan garam yang tinggi akan membantu mencegah hipertrofi ventrikel kiri.\n5. Menjauhi stres: Mengatasi atau mengurangi risiko stres juga penting, sebab stres bisa meningkatkan tekanan darah dan mengancam jantung.\n6. Berhenti merokok: Konsumsi rokok dapat meningkatkan tekanan darah serta mempercepat penuaan jantung dan peningkatan risiko hipertrofi ventrikel kiri.\n7. Mengikuti dokter atau ahli gizi dalam meracik makanan: Mereka yang mengandalkan buku resep medis untuk menentukan pola makan sehat dapat meminta bantuan dari dokter atau pakar gizi untuk merencanakan diet dan program pengolahan makanan yang tepat.\n8. Mengikuti risiko penyakit hipertrofi ventrikel kiri lainnya: Seperti halnya dijelaskan dalam konteks, menderita diabetes atau memiliki pola hidup tidak sehat lainnya juga bisa meningkatkan risiko terkena penyakit ini.\n\nDengan melakukan langkah-langkah pencegahan yang disarankan di atas, seseorang dapat mencegah hipertrofi ventrikel kiri dan mengurangi resiko munculnya penyakit jantung lainnya.","Penyebab utama penyakit hipertrofi ventrikel kiri, yang juga disebut sebagai istilah medis ""hipertrofi ventrikel kiri congestif"", umumnya berkaitan dengan proses penutupan arteri atrioventrikular (AV) dan obstruksi pembuluh darah. Namun, tidak ada metode resmi untuk mencegahnya secara efektif melalui tindakan medis khusus.\n\nNamun, beberapa langkah sosial yang dapat dilakukan oleh individu dan pihak terkait dalam mengurangi risiko penyakit ini adalah:\n1. Mengontrol tekanan darah tinggi, yaitu menjaga tekanan darah rendah atau normal. Penurunan tekanan darah yang berlebihan dapat memicu hipertrofia ventrikel kiri.\n2. Mengevaluasi dan mengobati penyakit jantung lainnya, seperti valvular heart disease, untuk mencegah pembekuan atau infeksi yang bisa menyebabkan kerusakan lebih lanjut di ventrikel kiri.\n3. Mengontrol berat badan dan menghindari obesitas, sebab tingginya BMI dapat mengganggu fungsi jantung.\n4. Mengevaluasi risiko penyakit jantung lainnya, termasuk asidosis metabolis yang bisa menyebabkan hipertrofia ventrikel kiri.\n5. Mengurangi paparan ke basah berlebihan, seperti menghindari minuman beralkohol dan menghentikan merokok, karena ini juga dapat mempengaruhi fungsi jantung.\n6. Melakukan tes gizi secara berkala untuk mencegah defisiensi atau kelebihan zat makanan dalam mempengaruhi fungsi ventrikel kiri.\n7. Menjaga pola hidup sehat, seperti menghindari asupan makanan tinggi lemak dan garam yang berlebihan.\n8. Mengevaluasi risiko penyakit jantung lainnya, termasuk diabetes dan hiperkolesterolemia.",0.59375,0.4976027495846109,0.9999999999666667,1.0
Apa kelainan yang dialami penderita atrial fibrilasi?,"Fibrilasi atrium atau atrial fibrilasi (AF) adalah gangguan irama jantung yang ditandai dengan denyut jantung tidak beraturan dan cepat. Penderita atrial fibrilasi dapat merasakan gejala lemas, jantung berdebar, dan sesak napas.\n\nDenyut jantung yang normal berkisar antara 60–100 kali per menit dengan irama yang teratur. Pada penderita atrial fibrilasi, irama jantung menjadi tidak teratur dan bisa lebih dari 100 kali per menit.","['Topik: Atrial Fibrilasi, Subtopik: Pengertian Atrial Fibrilasi \n Fibrilasi atrium atau atrial fibrilasi (AF) adalah gangguan irama jantung yang ditandai dengan denyut jantung tidak beraturan dan cepat. Penderita atrial fibrilasi dapat merasakan gejala lemas, jantung berdebar, dan sesak napas.\nDenyut jantung yang normal berkisar antara 60  100 kali per menit dengan irama yang teratur. Pada penderita atrial fibrilasi, irama jantung menjadi tidak teratur dan bisa lebih dari 100 kali per menit.\n\nAtrial fibrilasi adalah salah satu jenis aritmia atau gangguan irama jantung. Gejalanya bisa hilang timbul, berlangsung lama, atau bahkan permanen. Apabila dibiarkan, atrial fibrilasi bisa mengakibatkan gagal jantung dan stroke.\n', 'Topik: Atrial Fibrilasi, Subtopik: Penyebab Atrial Fibrilasi (AF) \n Fibrilasi atrium (AF) terjadi akibat adanya gangguan hantaran sinyal listrik di otot jantung. Akibatnya, denyut jantung menjadi tidak normal sehingga tidak memompa darah dengan optimal ke seluruh tubuh.\nGangguan hantran listrik ini diduga disebabkan oleh beberapa faktor berikut:\n- Konsumsi minuman berkafein atau beralkohol\n- Konsumsi obat-obatan batuk pilek\n\n- Kebiasaan merokok\n- Tekanan darah tinggi\n- Penyakit jantung koroner\n- Penyakit jantung bawaan\n- Kelainan katup jantung\n- Serangan jantung\n- Hipertiroidisme\n- Infeksi virus\n- Sleep apnea\n- Gangguan metabolik\n- Penyakit paru-paru\nSelain beberapa faktor di atas, terdapat kondisi lain yang dapat meningkatkan risiko seseorang terserang AF, yaitu:\n- Berusia lanjut\n- Menderita obesitas atau berat badan berlebih\n- Memiliki keluarga yang juga mengalami atrial fibrilasi\n', 'Topik: Atrial Fibrilasi, Subtopik: Pengobatan Atrial Fibrilasi (AF): Mencegah penggumpalan darah \n Penderita atrial fibrilasi (AF) sangat berisiko mengalami penggumpalan darah dan penyumbatan pembuluh darah, terutama di otak (stroke). Untuk mencegahnya, dokter akan meresepkan obat antikoagulan, seperti warfarin, edoxaban,  apixaban, atau rivaroxaban.\nPada banyak kasus, pasien perlu menggunakan obat tersebut untuk seumur hidupnya meski denyut jantungnya sudah kembali normal.\n']","Kelainan yang dialami oleh penderita atrial fibrilasi (AF) termasuk gangguan ritme jantung, dimana irama jantung menjadi tidak teratur dan cepat. Gejalanya meliputi gejala fisik seperti lemas, jantung berdebar, dan sesak napas. Selain itu, penderita AF juga berisiko mengalami komplikasi seperti gumpalan darah yang dapat menyebabkan stroke atau gagal jantung.","Kelainan yang umumnya dialami pasien dengan ateriovenous fibrosis (AVF) termasuk antara lain:\n\n1. Kekurangan atau tidaknya pembuluh darah asli di sekitar arteri dan venen, menyebabkan aliran darah yang tak normal.\n2. Terjadinya penggumpalan darah (thrombosis) karena kurangnya gerakan darah normal di area AVF.",0.8888888888888888,0.5836598200478403,0.99999999995,1.0
Apa penyebab seseorang menderita atrial fibrilasi?,"Fibrilasi atrium (AF) terjadi akibat adanya gangguan hantaran sinyal listrik di otot jantung. Akibatnya, denyut jantung menjadi tidak normal sehingga tidak memompa darah dengan optimal ke seluruh tubuh.\n\nGangguan hantran listrik ini diduga disebabkan oleh beberapa faktor berikut:\n\nKonsumsi minuman berkafein atau beralkohol\nKonsumsi obat-obatan batuk pilek\nKebiasaan merokok\nTekanan darah tinggi\nPenyakit jantung koroner\nPenyakit jantung bawaan\nKelainan katup jantung\nSerangan jantung\nHipertiroidisme\nInfeksi virus\nSleep apnea\nGangguan metabolik\nPenyakit paru-paru\n\nSelain beberapa faktor di atas, terdapat kondisi lain yang dapat meningkatkan risiko seseorang terserang AF, yaitu:\n\nBerusia lanjut\nMenderita obesitas atau berat badan berlebih\nMemiliki keluarga yang juga mengalami atrial fibrilasi","['Topik: Atrial Fibrilasi, Subtopik: Penyebab Atrial Fibrilasi (AF) \n Fibrilasi atrium (AF) terjadi akibat adanya gangguan hantaran sinyal listrik di otot jantung. Akibatnya, denyut jantung menjadi tidak normal sehingga tidak memompa darah dengan optimal ke seluruh tubuh.\nGangguan hantran listrik ini diduga disebabkan oleh beberapa faktor berikut:\n- Konsumsi minuman berkafein atau beralkohol\n- Konsumsi obat-obatan batuk pilek\n\n- Kebiasaan merokok\n- Tekanan darah tinggi\n- Penyakit jantung koroner\n- Penyakit jantung bawaan\n- Kelainan katup jantung\n- Serangan jantung\n- Hipertiroidisme\n- Infeksi virus\n- Sleep apnea\n- Gangguan metabolik\n- Penyakit paru-paru\nSelain beberapa faktor di atas, terdapat kondisi lain yang dapat meningkatkan risiko seseorang terserang AF, yaitu:\n- Berusia lanjut\n- Menderita obesitas atau berat badan berlebih\n- Memiliki keluarga yang juga mengalami atrial fibrilasi\n', 'Topik: Atrial Fibrilasi, Subtopik: Pengertian Atrial Fibrilasi \n Fibrilasi atrium atau atrial fibrilasi (AF) adalah gangguan irama jantung yang ditandai dengan denyut jantung tidak beraturan dan cepat. Penderita atrial fibrilasi dapat merasakan gejala lemas, jantung berdebar, dan sesak napas.\nDenyut jantung yang normal berkisar antara 60  100 kali per menit dengan irama yang teratur. Pada penderita atrial fibrilasi, irama jantung menjadi tidak teratur dan bisa lebih dari 100 kali per menit.\n\nAtrial fibrilasi adalah salah satu jenis aritmia atau gangguan irama jantung. Gejalanya bisa hilang timbul, berlangsung lama, atau bahkan permanen. Apabila dibiarkan, atrial fibrilasi bisa mengakibatkan gagal jantung dan stroke.\n', 'Topik: Atrial Fibrilasi, Subtopik: Pengertian Atrial Fibrilasi \n Denyut jantung yang normal berkisar antara 60  100 kali per menit dengan irama yang teratur. Pada penderita atrial fibrilasi, irama jantung menjadi tidak teratur dan bisa lebih dari 100 kali per menit.\n\nAtrial fibrilasi adalah salah satu jenis aritmia atau gangguan irama jantung. Gejalanya bisa hilang timbul, berlangsung lama, atau bahkan permanen. Apabila dibiarkan, atrial fibrilasi bisa mengakibatkan gagal jantung dan stroke.\n']","Atrial fibrillation (AF), seperti yang dijelaskan dalam konteks, terjadi akibat gangguan hantaran sinyal listrik di otot jantung. Faktor-faktor yang mempengaruhi timbulnya AF termasuk:\n\n1. Konsumsi minuman beralkohol atau kafein, seperti teh dan kopi, yang dapat merusak fungsi saraf dan jantung.\n2. Konsumsi obat-obatan batuk pilek, terutama aquellsonium atau antiasmatik, yang mempengaruhi sistem simpatis dan bisa meningkatkan risiko AF.\n3. Kebiasaan merokok, yang dapat menyebabkan penyakit jantung dan meningkatkan risiko AF.\n4. Tekanan darah tinggi, seperti hipertensi, yang mempengaruhi fungsi jantung dan bisa meningkatkan risiko AF.\n5. Penyakit jantung koroner atau jantung bawaan, yang dapat merusak jantung secara signifikan.\n6. Kelainan katup jantung, seperti stenosis katup mitral atau insufisiensi katup aortic, yang dapat menyebabkan aliran darah menjadi tidak normal dan memicu AF.\n7. Serangan jantung atau infark miokardium, yang bisa merusak jantung secara mendadak.\n8. Hipertiroidisme (penyakit dengan over aktivitas tiroide), yang juga dapat meningkatkan risiko AF.\n9. Infeksi virus atau infeksi bakteri, seperti pneumonia, yang bisa merusak jantung dan sistem saraf.\n10. Kondisi sleep apnea (kesendirian napas saat tidur), yang mempengaruhi fungsi jantung dan bisa meningkatkan risiko AF.\n11. Gangguan metabolik, seperti diabetes mellitus, yang dapat merusak jantung dan berperan dalam timbulnya AF.\n12. Penyakit paru-paru atau penyumbatan pembuluh darah di paru-paru, yang bisa meningkatkan tekanan di jantung dan memicu AF.\n\nSelain faktor-faktor tersebut, ada beberapa kondisi lain yang dapat meningkatkan risiko seseorang mengalami atrial fibrilasi, seperti usia lanjut, obesitas berat badan tinggi, dan keadaan familial dimana anggota keluarga juga menderita AF.","Atrial fibrillation (AF) is a common type of irregular heartbeat, also known as an arrhythmia. The exact cause of AF can vary from person to person, but several factors increase the risk of developing this condition:\n\n1. Aging: As people get older, the risk of developing AF increases.\n2. Heart disease: Conditions like heart valve problems or heart failure can raise the risk of atrial fibrillation.\n3. High blood pressure: Long-term hypertension may damage the heart and increase the likelihood of arrhythmias, including AF.\n4. Other health issues: Diabetes, sleep apnea, and obesity can also contribute to developing AF.\n5. Lifestyle factors: Excessive alcohol consumption, caffeine intake, smoking, and stress have been associated with an increased risk of atrial fibrillation.\n6. Family history: Having a close relative with AF may increase your risk.\n7. Previous heart procedures: Certain surgeries or medical procedures can sometimes lead to the development of AF.\n8. Thyroid problems: Hyperthyroidism and hypothyroidism have been linked to an increased risk of developing atrial fibrillation.",0.8,0.6154867047721289,0.9999999999666667,1.0
Apa gejala yang dialami penderita angina pectoris?,"Angina pectoris ditandai dengan nyeri dada sebelah kiri yang terasa seperti tertindih, terbakar, tertusuk atau terasa sesak. Rasa sakit ini dapat menjalar ke lengan, bahu, punggung, leher, dan rahang.\n\nGejala lain yang dapat menyertai nyeri dada tersebut antara lain:\n\nKeringat berlebihan meski cuaca tidak panas\nMual\nLelah\nPusing\nSesak napas","['Topik: Angina Pectoris, Subtopik: Gejala Angina Pectoris \n Angina pectoris ditandai dengan nyeri dada sebelah kiri yang terasa seperti tertindih, terbakar, tertusuk atau terasa sesak. Rasa sakit ini dapat menjalar ke lengan, bahu, punggung, leher, dan rahang.\nGejala lain yang dapat menyertai nyeri dada tersebut antara lain:\n- Keringat berlebihan meski cuaca tidak panas\n- Mual\n- Lelah\n- Pusing\n- Sesak napas\nBerdasarkan karakteristik gejalanya, angina pectoris dapat dibedakan menjadi:\n', 'Topik: Angina Pectoris, Subtopik: Gejala Angina Pectoris: Kapan harus ke dokter \n Jika Anda baru pertama kali mengalami nyeri dan rasa tidak nyaman di dada, segera konsultasikan dengan dokter. Keluhan nyeri dada tersebut bisa mengarah ke kondisi angina pectoris yang disebabkan oleh penyakit jantung.\nAnda juga perlu memeriksakan diri ke dokter jika angina pektoris yang dialami berlangsung cukup lama dan tidak membaik setelah beristirahat.\nKarena angina pectoris sering disebabkan oleh penyakit jantung koroner, disarankan untuk melakukan pemeriksaan ke dokter jika memiliki riwayat hipertensi, kolesterol tinggi, dan menjalani pola hidup yang tidak sehat, seperti:\n- Sering mengonsumsi makanan berlemak\n- Mengonsumsi minuman beralkohol secara berlebihan\n- Merokok\nMakin cepat Anda diperiksa dan ditangani oleh dokter, risiko komplikasi yang lebih parah bisa dicegah.\n', 'Topik: Angina Pectoris, Subtopik: Pengertian Angina Pectoris \n Angina pectoris adalah nyeri dada akibat penyakit jantung koroner. Angin duduk atau angina pectoris terjadi ketika otot jantung tidak mendapatkan suplai darah yang cukup, akibat penyempitan atau penyumbatan pada pembuluh darah arteri di jantung.\nAngina pectoris bisa terjadi kapan saja dan pada siapa saja. Nyeri akibat angina pectoris ini sering disalahartikan sebagai gejala dari kondisi lain, seperti naiknya asam lambung dan peradangan pada paru-paru.\n']","Gejala yang dialami oleh pasien ketika mengalami angina pectoris termasuk nyeri dada yang terasa seperti tertindih, terbakar, tersusuk atau sesak. Rasa sakit ini bisa merambah ke lengan, bahu, punggung, leher, dan rahang. Selain itu, pasien juga dapat mengalami keringat berlebihan meski cuaca tidak panas, mual, lelah, pusing, dan sesak napas.","Gejala utama penderita angina pectoris termasuk peraba sering kali atau nyaris berat yang mengenai area dada, biasanya membahayakan aktivitas sehari-hari. Hal ini dapat menyebabkan rasa sakit dan ketidaknyamanan besar, bahkan jika waktu parahnya hampir lama keluar atau terpencar. Gejala lain yang mungkin timbul termasuk gejala menurunnya tekanan darah (hipotensi), nyeri punggung atau gatal, dan seringkali bersamasuka hati pada pasien.\n\nPerlu dicatat bahwa angina pectoris dapat memiliki gejala yang sangat berbeda-beda tergantung pada penyebabnya dan individu yang terpapar, sehingga hal ini tidak selalu menjamin peraba sering kali atau nyaris berat. Sebagai risiko tambahan, angina pectoris juga bisa menyebabkan gangguan sistolik ventrikel kanan (GVK), baik akibatnya adalah penurunan tekanan darah yang parah dan hal ini dapat menjangkiti pasien secara mendadak.",1.0,0.7695814584914075,0.9999999999666667,1.0
Jenis obat apa yang digunakan untuk meredakan gejala angina pectoris?,"Beberapa jenis obat yang dapat diberikan oleh dokter untuk meredakan gejala angina adalah:\n\nObat pengencer darah, seperti aspirin, clopidogrel, atau ticagrelor\nObat pelebar pembuluh darah golongan nitrat, seperti nitrogliserin dan isosorbide dinitrate, untuk melebarkan dan merelaksasi pembuluh darah, sehingga aliran darah ke jantung lebih baik\nObat penghambat beta, seperti atenolol,bisoprolol, atau carvedilol, untuk memperlambat denyut jantung dan membuat pembuluh darah lebih rileks sehingga mengurangi beban kerja jantung\nObat untuk mengontrol penyakit diabetes, kolesterol, dan hipertensi yang merupakan faktor risiko dari penyakit jantung koroner\nObat antiangina, seperti trimetazidine atau ranolazine, untuk mengurangi dan mencegah kejadian nyeri dada","['Topik: Angina Pectoris, Subtopik: Pengobatan Angina Pectoris: Obat-obatan \n Beberapa jenis obat yang dapat diberikan oleh dokter untuk meredakan gejala angina adalah:\n- Obat pengencer darah, seperti aspirin, clopidogrel, atau ticagrelor\n\n- Obat pelebar pembuluh darah golongan nitrat, seperti nitrogliserin dan isosorbide dinitrate, untuk melebarkan dan merelaksasi pembuluh darah, sehingga aliran darah ke jantung lebih baik\n- Obat penghambat beta, seperti atenolol,bisoprolol, atau carvedilol, untuk memperlambat denyut jantung dan membuat pembuluh darah lebih rileks sehingga mengurangi beban kerja jantung\n- Obat untuk mengontrol penyakit diabetes, kolesterol, dan hipertensi yang merupakan faktor risiko dari penyakit jantung koroner\n- Obat antiangina, seperti trimetazidine atau ranolazine, untuk mengurangi dan mencegah kejadian nyeri dada\n', 'Topik: Angina Pectoris, Subtopik: Gejala Angina Pectoris: Unstable angina \n Berbeda dengan dua jenis angina yang dijelaskan sebelumnya, Prinzmetal  s angina disebabkan oleh kekakuan di arteri jantung. Kondisi ini menyebabkan jumlah aliran darah menurun untuk sementara waktu.\nPrinzmetal  s angina merupakan jenis angina yang cukup jarang terjadi. Angina jenis ini biasanya muncul saat istirahat, di malam hari atau di pagi hari. Intensitas nyerinya cukup berat, tetapi biasanya mereda dengan pemberian obat-obatan.\n', 'Topik: Angina Pectoris, Subtopik: Pencegahan Angina Pectoris \n Angina pectoris dapat dicegah dengan menerapkan gaya hidup sehat. Upaya yang bisa diterapkan antara lain:\n- Berhenti merokok dan membatasi konsumsi minuman beralkohol\n- Berolahraga secara teratur dan menjaga berat badan ideal\n- Memperbaiki pola makan dengan mengonsumsi makanan rendah lemak dan garam, buah-buahan, sayur-sayuran, dan gandum utuh.\n- Menghindari konsumsi makanan tinggi lemak jenuh, seperti sosis dan daging berlemak, mentega, keju, dan makanan cepat saji\n- Mengelola stres dengan cara yang positif, bisa dengan yoga, meditasi, atau melakukan hobi yang menyenangkan\n- Memeriksakan diri ke dokter secara berkala jika menderita hipertensi, hiperkolesterolemia, atau diabetes\n- Mengonsumsi obat-obatan untuk menurunkan kejadian angina dalam jangka panjang, seperti amlodipine\n\n']","Untuk meredakan gejala angina pectoris, beberapa jenis obat yang biasanya diberikan oleh dokter termasuk:\n\n1. Obat pengencer darah, seperti aspirin, clopidogrel, atau ticagrelor – untuk mencegah agregasi trombosit dan meningkatkan aliran darah ke jantung.\n2. Obat pelebar pembuluh darah golongan nitrat, seperti nitrogliserin dan isosorbide dinitrate – untuk melebarkan dan merelaksasi pembuluh darah, meningkatkan aliran darah ke jantung.\n3. Obat penghambat beta, seperti atenolol, bisoprolol, atau carvedilol – untuk memperlambat denyut jantung dan mengurangi beban kerja jantung.\n4. Obat antiangina, seperti trimetazidine atau ranolazine – untuk mengurangi dan mencegah kejadian nyeri dada.","Untuk meredakan gejala angina pectoris, umumnya digunakan obat-obatan berupa nitrat seperti nifedipin atau isosorbiddinformasi.",0.8,0.7163992644267921,0.9999999999666667,1.0
Apa penyebab penyakit aterosklerosis?,"Penyebab pasti aterosklerosis belum diketahui, tetapi penyakit ini dimulai ketika terjadi kerusakan atau cedera di lapisan dalam arteri. Kerusakan tersebut dapat disebabkan oleh:\n\nKolesterol tinggi\nTekanan darah tinggi\nDiabetes\nPeradangan akibat penyakit tertentu, seperti lupus\nObesitas\nKebiasaan merokok","['Topik: Aterosklerosis, Subtopik: Penyebab Aterosklerosis \n Penyebab pasti aterosklerosis belum diketahui, tetapi penyakit ini dimulai ketika terjadi kerusakan atau cedera di lapisan dalam arteri. Kerusakan tersebut dapat disebabkan oleh:\n- Kolesterol tinggi\n- Tekanan darah tinggi\n- Diabetes\n- Peradangan akibat penyakit tertentu, seperti lupus\n\n- Obesitas\n- Kebiasaan merokok\nSaat lapisan dalam arteri rusak, lemak serta zat lain menjadi mudah menempel dan menggumpal di sana. Seiring berjalannya waktu, gumpalan atau plak ini terus menumpuk dan mengeras sehingga pembuluh darah arteri menyempit dan kaku.\nPenyempitan pembuluh darah akan menghambat suplai oksigen serta nutrisi ke organ-organ tubuh. Hal ini membuat fungsi organ tersebut menurun, bahkan terhenti, tergantung seberapa parah penyempitan yang terjadi.\nPerkembangan aterosklerosis hingga menimbulkan gejala sangat lambat, bahkan bisa sampai puluhan tahun. Namun, kondisi di bawah ini dapat membuat seseorang lebih berisiko atau lebih cepat mengalami aterosklerosis:\n- Usia di atas 40 atau 50 tahun\n- Pola hidup yang tidak sehat, seperti malas bergerak atau jarang berolahraga\n- Pola makan tidak sehat dan sering mengonsumsi minuman beralkohol\n- Stres berkepanjangan\n- Riwayat aterosklerosis pada keluarga\n', 'Topik: Aterosklerosis, Subtopik: Pengertian Aterosklerosis \n Atherosclerosis atau aterosklerosis adalah penyempitan dan pengerasan pembuluh darah arteri akibat penumpukan plak di dinding pembuluh darah. Kondisi ini merupakan penyebab umum penyakit jantung koroner (atherosclerosis heart disease).\nArteri adalah pembuluh darah pembawa oksigen serta nutrisi dari dan ke jantung, juga ke seluruh organ lain. Tersumbatnya arteri akibat penumpukan plak kolesterol akan menghambat aliran darah ke organ-organ tubuh.\n\nPada awalnya, aterosklerosis tidak menimbulkan gejala apa pun. Gejala baru muncul ketika aliran darah ke organ atau jaringan tubuh terhambat. Proses penumpukan plak sampai gejala aterosklerosis timbul bisa memakan waktu hingga bertahun-tahun.\n', 'Topik: Aterosklerosis, Subtopik: Gejala dan Komplikasi Aterosklerosis \n terosklerosis awalnya tidak menimbulkan gejala, sampai pembuluh darah arteri sudah sangat menyempit bahkan tertutup Akibatnya, pembuluh arteri tidak lagi dapat menyalurkan darah dalam jumlah cukup ke organ-organ tubuh.\nKarena gejalanya baru muncul setelah bertahun-tahun, banyak orang yang tidak menyadari bahwa dirinya menderita aterosklerosis sampai muncul komplikasi. Komplikasi yang muncul bisa beragam, tergantung lokasi terjadinya aterosklerosis, antara lain:\nAterosklerosis di jantung bisa menyebabkan penyakit jantung koroner dan serangan jantung. Kedua gangguan tersebut memiliki sejumlah gejala yang serupa, yaitu:\n- Nyeri dada seperti ditekan atau diremas (angina)\n- Nyeri atau tekanan pada pundak, lengan, rahang, atau punggung\n- Gangguan irama jantung (aritmia)\n- Sesak napas, berkeringat, dan gelisah\nAterosklerosis di kaki atau lengan bisa menyebabkan penyakit arteri perifer. Gangguan ini ditandai dengan gejala berikut:\n- Nyeri, kram, hingga mati rasa di area lengan atau tungkai\n- Nyeri saat berjalan dan mereda setelah beristirahat (klaudikasio intermiten)\n- Tungkai bagian bawah terasa dingin\n- Luka di jempol, telapak, atau kaki yang tidak kunjung sembuh\nBila terjadi pada pembuluh darah di otak, aterosklerosis bisa menyebabkan stroke, yang ditandai dengan gejala berupa:\n- Mati rasa hingga lumpuh pada salah satu sisi wajah, lengan, atau tungkai\n- Kebingungan dan sulit untuk dapat berbicara dengan jelas\n- Kehilangan penglihatan pada salah satu mata atau kedua mata\n- Kehilangan koordinasi dan keseimbangan\n- Pusing dan sakit kepala berat\n- Sulit bernapas dan kehilangan kesadaran\n\nPenumpukan plak pada pembuluh arteri di ginjal dapat menyebabkan gagal ginjal. Gangguan ini bisa dikenali dari sejumlah gejala, seperti:\n- Jarang buang air kecil\n- Mual yang terasa terus menerus\n- Tubuh terasa sangat lelah dan sering mengantuk\n- Tungkai membengkak\n- Bingung dan sulit berkonsentrasi\n- Sesak napas dan dada terasa nyeri\nSegera periksakan diri ke dokter jika mengalami gejala yang telah disebutkan di atas. Anda juga perlu segera ke IGD bila mengalami gejala serangan jantung atau stroke. Kedua kondisi tersebut harus segera ditangani, karena bisa berakibat fatal bila menunggu lama.\nJika Anda menderita diabetes atau hipertensi, lakukan kontrol rutin ke dokter untuk memantau kondisi penyakitnya dan mencegah kemungkinan komplikasi aterosklerosis.\nBila Anda perokok, berusahalah untuk menghentikan kebiasaan tersebut. Merokok tidak hanya bisa menyebabkan aterosklerosis, tetapi juga penyakit lain. Jika berhenti merokok dirasa sangat sulit, pergilah ke dokter untuk mengikuti program berhenti merokok.\n']","Penyebab atau faktor utama terjadinya aterosklerosis belum pasti, tetapi penyakit ini dimulai ketika terjadi kerusakan atau cedera di lapisan dalam arteri. Kerusakan tersebut dapat disebabkan oleh beberapa faktor, antara lain:\n\n1. Kolesterol tinggi: Kolesterol dalam darah yang tinggi bisa mengganggu fungsi sel-sel pertahanan tubuh dan menyebabkan lemak serta zat lain menempel di dinding arteri.\n2. Tekanan Darah Tinggi: Rendahnya kontrol tekanan darah juga memicu terjadinya aterosklerosis, sebab tekanan darah yang tinggi bisa merusak sel-sel di lapisan intima arteri dan mengakibatkan penumpukan plak.\n3. Diabetes: Keadaan diabetes meningkatkan risiko terjadinya aterosklerosis karena menyebabkan lendir pembuluh darah menyerupai lupus juga bisa menempel di dinding arteri, yang akhirnya menggangu aliran darah.\n4. Penyakit lain: Seperti penyakit reumatoid dan hiperkortosis misalnya, juga bisa mempercepat terjadinya aterosklerosis karena menyebabkan inflamasi pada arteri.","Penyebab penyakit aterosklerosis meliputi faktor genetik, faktor perilaku, dan faktor lingkungan. Faktor genetik yang penting termasuk pola kebiasaan genetik dalam famili, seperti asimetris transplasi mitokondria atau penyakit Huntington, yang memicu risiko terkena penyakit arteriosklerosis.\n\nFaktor perilaku yang penting termasuk faktor pemakanan dan aktivitas fisik. Faktor makanan seperti asid lambung atau transpirasi berlebihan dapat meningkatkan risiko terkena penyakit arteriosklerosis, sementara aktivitas fisik rendah juga mempengaruhi resiko ini.\n\nFaktor lingkungan yang penting termasuk konsumsi asam lemak trans dan polusi udara. Asid lambung atau paparan radiasi ionizing dapat meningkatkan risiko terkena penyakit arteriosklerosis, sementara faktor lingkungan lainnya seperti paparan radiasi sinar matahari juga mempengaruhi resiko ini.\n\nDalam kesimpulannya, penyebab penyakit aterosklerosis melibatkan kombinasi dari faktor genetik, perilaku, dan lingkungan yang meningkatkan risiko terjadinya penyakit arteriosklerosis.",0.6923076923076923,0.574504433304143,0.9999999999,1.0
Bagaimana pencegahan penyakit aterosklerosis?,"Aterosklerosis dapat dicegah dengan menerapkan pola hidup sehat. Cara yang bisa dilakukan antara lain:\n\nMelakukan pola makan sehat dengan gizi seimbang yang kaya serat dan karbohidrat kompleks, serta rendah kolesterol\nMenghindari atau membatasi konsumsi minuman beralkohol\nBerolahraga selama 30 menit per hari, setidaknya 5 hari dalam seminggu\nBerhenti merokok\nMenjaga berat badan dalam rentang ideal\nMengelola stress dengan baik, misalnya dengan relaksasi (mengendurkan otot-otot yang tegang) atau meditasi\nBeristirahat dan tidur yang cukup","['Topik: Aterosklerosis, Subtopik: Pencegahan Aterosklerosis \n Aterosklerosis dapat dicegah dengan menerapkan pola hidup sehat. Cara yang bisa dilakukan antara lain:\n- Melakukan pola makan sehat dengan gizi seimbang yang kaya serat dan karbohidrat kompleks, serta rendah kolesterol\n- Menghindari atau membatasi konsumsi minuman beralkohol\n- Berolahraga selama 30 menit per hari, setidaknya 5 hari dalam seminggu\n- Berhenti merokok\n- Menjaga berat badan dalam rentang ideal\n\n- Mengelola stress dengan baik, misalnya dengan relaksasi (mengendurkan otot-otot yang tegang) atau meditasi\n- Beristirahat dan tidur yang cukup\n', 'Topik: Aterosklerosis, Subtopik: Pengobatan Aterosklerosis \n Penangan aterosklerosis dapat dilakukan dengan tiga metode, yaitu perubahan gaya hidup, obat-obatan, serta prosedur medis.\nPerubahan gaya hidup sehari-hari merupakan hal utama yang perlu dilakukan. Pasien dianjurkan untuk lebih sering berolahraga guna meningkatkan kesehatan jantung dan pembuluh darah, serta mengurangi konsumsi makanan yang banyak mengandung kolesterol.\nSelain menyarankan perubahan gaya hidup, dokter juga dapat memberi obat-obatan untuk mencegah arterosklerosis bertambah buruk. Obat-obatan ini dapat berupa:\n- Obat untuk mencegah penggumpalan darah, seperti aspirin\n\n- Obat untuk menurunkan tekanan darah, seperti penghambat beta (beta blockers), antagonis kalsium (calcium channel blockers), serta diuretik\n- Obat penurun kadar kolesterol, seperti statin dan fibrat\n- Obat untuk mencegah penyempitan arteri, seperti ACE inhibitor\n\n- Obat untuk mengendalikan penyakit yang bisa menyebabkan aterosklerosis, seperti obat diabetes untuk menjaga kadar gula darah.\nPada kasus aterosklerosis yang parah, dokter mungkin akan menyarankan penanganan dengan:\n- Pemasangan ring (stent) dan angioplasty\nProsedur ini digunakan untuk membuka penyumbatan atau penyempitan arteri, kemudian memasang tabung kecil di sana agar aliran darah kembali lancar.\n- Terapi fibrinolitik\nTerapi ini dilakukan untuk mengatasi penyumbatan arteri akibat pembekuan darah, dengan memberikan obat pelarut atau pemecah gumpalan darah (fibrinolitik).\n- Operasi bypass\nProsedur ini dilakukan dengan cara memintas pembuluh darah yang tersumbat menggunakan pembuluh darah dari bagian tubuh lain atau selang berbahan sintetis.\n- Endarterektomi\nProsedur ini dilakukan untuk membuang tumpukan lemak pada dinding arteri yang menyempit. Biasanya, prosedur ini dilakukan pada arteri di leher.\n- Arterektomi\nProsedur ini dilakukan untuk membuang plak di arteri dengan menggunakan kateter berpisau tajam di salah satu ujungnya.\n', 'Topik: Aterosklerosis, Subtopik: Gejala dan Komplikasi Aterosklerosis \n terosklerosis awalnya tidak menimbulkan gejala, sampai pembuluh darah arteri sudah sangat menyempit bahkan tertutup Akibatnya, pembuluh arteri tidak lagi dapat menyalurkan darah dalam jumlah cukup ke organ-organ tubuh.\nKarena gejalanya baru muncul setelah bertahun-tahun, banyak orang yang tidak menyadari bahwa dirinya menderita aterosklerosis sampai muncul komplikasi. Komplikasi yang muncul bisa beragam, tergantung lokasi terjadinya aterosklerosis, antara lain:\nAterosklerosis di jantung bisa menyebabkan penyakit jantung koroner dan serangan jantung. Kedua gangguan tersebut memiliki sejumlah gejala yang serupa, yaitu:\n- Nyeri dada seperti ditekan atau diremas (angina)\n- Nyeri atau tekanan pada pundak, lengan, rahang, atau punggung\n- Gangguan irama jantung (aritmia)\n- Sesak napas, berkeringat, dan gelisah\nAterosklerosis di kaki atau lengan bisa menyebabkan penyakit arteri perifer. Gangguan ini ditandai dengan gejala berikut:\n- Nyeri, kram, hingga mati rasa di area lengan atau tungkai\n- Nyeri saat berjalan dan mereda setelah beristirahat (klaudikasio intermiten)\n- Tungkai bagian bawah terasa dingin\n- Luka di jempol, telapak, atau kaki yang tidak kunjung sembuh\nBila terjadi pada pembuluh darah di otak, aterosklerosis bisa menyebabkan stroke, yang ditandai dengan gejala berupa:\n- Mati rasa hingga lumpuh pada salah satu sisi wajah, lengan, atau tungkai\n- Kebingungan dan sulit untuk dapat berbicara dengan jelas\n- Kehilangan penglihatan pada salah satu mata atau kedua mata\n- Kehilangan koordinasi dan keseimbangan\n- Pusing dan sakit kepala berat\n- Sulit bernapas dan kehilangan kesadaran\n\nPenumpukan plak pada pembuluh arteri di ginjal dapat menyebabkan gagal ginjal. Gangguan ini bisa dikenali dari sejumlah gejala, seperti:\n- Jarang buang air kecil\n- Mual yang terasa terus menerus\n- Tubuh terasa sangat lelah dan sering mengantuk\n- Tungkai membengkak\n- Bingung dan sulit berkonsentrasi\n- Sesak napas dan dada terasa nyeri\nSegera periksakan diri ke dokter jika mengalami gejala yang telah disebutkan di atas. Anda juga perlu segera ke IGD bila mengalami gejala serangan jantung atau stroke. Kedua kondisi tersebut harus segera ditangani, karena bisa berakibat fatal bila menunggu lama.\nJika Anda menderita diabetes atau hipertensi, lakukan kontrol rutin ke dokter untuk memantau kondisi penyakitnya dan mencegah kemungkinan komplikasi aterosklerosis.\nBila Anda perokok, berusahalah untuk menghentikan kebiasaan tersebut. Merokok tidak hanya bisa menyebabkan aterosklerosis, tetapi juga penyakit lain. Jika berhenti merokok dirasa sangat sulit, pergilah ke dokter untuk mengikuti program berhenti merokok.\n']","Pencegahan atau preventif aterosklerosis bisa dilakukan melalui berbagai cara, termasuk perubahan gaya hidup dan penggunaan obat-obatan. Berikut adalah beberapa langkah yang dapat diambil untuk mencegah atau mengurangi risiko terkena penyakit aterosklerosis:\n\n1. Mengadopsi pola makan sehat dan gizi seimbang, yaitu meliputi penggunaan karbohidrat kompleks, serat kasar, dan rendah lemak atau tidak mengandung kolesterol tinggi.\n2. Menghindari atau membatasi konsumsi minuman beralkohol sehingga jumlahnya sesuai dengan batas makan yang diijinkan.\n3. Berolahraga secara teratur, minimal 150 menit per minggu, termasuk penggunaan otot tubuh dan aktivitas fisik sehari-hari.\n4. Mengurangi tekanan stres dengan cara yang bervariasi, mulai dari bereksperimen dengan berolahraga hingga menggunakan metode relaksasi atau meditasi.\n5. Berhenti merokok dan menjauhi paparan rokok serta zat-zat beracun yang ada dalam ibu seperti tabir surya, parfum, dan sabun.\n6. Mengelola berat badan agar tetap dalam rentang ideal atau tidak terlalu tinggi dan tidak terlalu rendah.\n7. Memantau kadar gula darah untuk mengendalikan diabetes dan hipertensi, yang bisa meningkat risiko terkena penyakit arteri seperti aterosklerosis.\n8. Menjaga asupan makanan dalam batas-batas tertentu untuk mencegah pembekuan darah dan menurunkan tekanan darah tinggi atau gangguan lainnya yang berkaitan dengan arteri.\n9. Mengadopsi konsumsi obat-obatan yang diperluas, seperti aspirin untuk mengurangi resiko terkena stroke dan penggumpalan darah.\n10. Mematuhi dosis dan cara minum obat dengan benar sesuai perintah dokter atau pakar kesehatan agar efektif dalam mencegah penyakit arteri, seperti statin untuk menurunkan kadar LDL (low-density lipoprotein) atau lemak tinggi dan menaikkan HDL (high-density lipoprotein) atau lemak tinggi yang berarti.\n11. Mengadopsi metode relaksasi, meditasi, atau kegiatan lainnya untuk mengurangi stres dan menjaga kondisi jantung tetap sehat.","Penyebab utama penyakit arteriosklerosis termasuk faktor genetik, tetapi faktor perilaku seperti asupan lemak tinggi dan aktivitas fisik yang kurang juga memainkan peranan penting. Berikut beberapa cara untuk mencegah atau mengurangi risiko penyakit arteriosklerosis:\n\n1. Mengontrol Asupan Lemak Tinggi: Sesuai dengan namanya, lemak tinggi (termasuk asetilkolinol) bisa meningkatkan resiko terjadinya penyakit jantung dan stroke karena mengurangi kapasitas pembuluh darah.\n2. Mengontrol Asupan Protein: Beberapa jenis protein tinggi seperti lemak berencana dan asin bisa meningkatkan risiko serangan jantung atau stroke.\n3. Menjaga Berat Badan Ideal: Obesitas yang berlebih dapat meningkatkan risiko penyakit jantung, kardiomyopati, dan stroke.\n4. Mencukupi Asupan Serat: Serat dalam makanan bisa membantu mengurangi asupan lemak dan menaikkan nafsu makan sehingga menjaga berat badan dibawah kontrol.\n5. Beraktivitas Fisik Setidaknya 30 Menit Sehari: Aktivitas fisik yang sehat bisa meningkatkan kapasitas jantung dan mengurangi risiko penyakit jantung.\n6. Mengontrol Tekanan Darah dan Lemak Darah: Pengendalian tekanan darah tinggi dan kadar lemak dalam darah yang tidak normal bisa mencegah atau mengurangi risiko penyakit jantung.\n7. Menekan Kolesterol Dalam Darah: Mengontrol jumlah LDL (lemak bebas) dalam darah, menjaga konsentrasi HDL (lemak kompleks) dan mengecualikan penderita hiperkolesterolemia atau faktor risiko lainnya.\n8. Menghindari Pernapasan Krik: Asupsi rokok secara langsung bisa memperparah kondisi jantung, termasuk resiko serangan jantung dan stroke.\n9. Mengurangi Stres dan Jenuh: Stres dan penyembuhan yang tidak merata dalam tubuh juga dapat meningkatkan risiko terjadinya penyakit jantung atau stroke.\n10. Mengevaluasi Keluarga: Penyakit jantung atau stroke pada keluarga mungkin mempengaruhi resiko Anda untuk mengalami penyakit ini.\n\nDengan melakukan hal-hal tersebut, risiko akan menurun secara signifikan terjadinya penyakit arteriosklerosis dan koroner.",0.7777777777777778,0.6396209074806231,0.9999999999666667,1.0
Apa saja hal yang dapat meningkatkan risiko penyakit Arteriosklerosis?,"Selain itu, ada beberapa kondisi yang dapat meningkatkan risiko terjadinya kerusakan pembuluh darah arteri, yaitu:\n\nKolesterol tinggi\nTrigliserida tinggi\nTekanan darah tinggi\nBerat badan berlebih\nDiabetes\nPeradangan akibat arthritis, lupus, atau infeksi\nKebiasaan merokok\nKurang olahraga\nPola makan yang tidak sehat\nRiwayat penyakit jantung di keluarga","['Topik: Arteriosklerosis, Subtopik: Penyebab Arteriosklerosis \n Arteriosklerosis terjadi ketika dinding bagian dalam pembuluh darah arteri mengalami kerusakan. Akibatnya, sel darah dan plak yang terbentuk dari kolesterol, lemak, atau kalsium menumpuk di dinding arteri dan menyumbat pembuluh darah.\nPenyumbatan pembuluh darah membuat aliran darah ke organ-organ tubuh menjadi tidak lancar. Hal ini mengakibatkan organ tersebut tidak berfungsi dengan baik.\nBelum diketahui secara pasti penyebab kerusakan pada pembuluh darah arteri. Akan tetapi, kondisi ini diyakini bisa terjadi sejak usia muda dan dapat berkembang seiring pertambahan usia.\nSelain itu, ada beberapa kondisi yang dapat meningkatkan risiko terjadinya kerusakan pembuluh darah arteri, yaitu:\n- Kolesterol tinggi\n- Trigliserida tinggi\n- Tekanan darah tinggi\n- Berat badan berlebih\n- Diabetes\n- Peradangan akibat arthritis, lupus, atau infeksi\n- Kebiasaan merokok\n- Kurang olahraga\n- Pola makan yang tidak sehat\n- Riwayat penyakit jantung di keluarga\n', 'Topik: Arteriosklerosis, Subtopik: Pengertian Arteriosklerosis \n Arteriosklerosis adalah pengerasan pembuluh darah arteri akibat penumpukan plak di dinding arteri. Arteri yang mengeras dapat membuat aliran darah ke organ tubuh menjadi tidak lancar sehingga mengganggu fungsi organ tersebut. Kondisi ini dapat terjadi akibat berbagai hal, seperti penumpukan lemak atau penuaan.\nArteri adalah pembuluh darah yang berfungsi mengalirkan darah kaya oksigen dari jantung ke seluruh tubuh. Seiring berjalannya waktu, arteri dapat mengeras sehingga kehilangan elastisitasnya.\n\nArteriosklerosis dapat terjadi di arteri yang mengalirkan darah ke jantung, otak, kaki, dan ginjal. Bila berlangsung dalam waktu lama, aliran darah ke organ-organ tersebut akan terganggu, bahkan tersumbat. Akibatnya, penderita arteriosklerosis berisiko terserang penyakit serius, seperti stroke dan penyakit jantung koroner.\nMeski sering kali dianggap sama, arteriosklerosis berbeda dengan aterosklerosis. Arteriosklerosis mencakup semua kondisi pengerasan arteri. Sedangkan aterosklerosis merupakan pengerasan arteri yang secara spesifik terjadi akibat penumpukan lemak di dinding arteri. Dengan kata lain, aterosklerosis termasuk ke dalam jenis arteriosklerosis.\n', 'Topik: Arteriosklerosis, Subtopik: Pencegahan Arteriosklerosis \n Arteriosklerosis bisa dicegah dengan meminimalkan faktor risiko yang telah disebutkan di atas. Caranya adalah dengan menjalani pola hidup sehat, seperti:\n- Tidak merokok\n- Berolahraga secara rutin\n- Mengonsumsi makanan sehat dan bergizi seimbang, serta memperbanyak asupan sayur-sayuran dan buah-buahan\n- Mempertahankan berat badan ideal\n\n- Beristirahat dan tidur yang cukup\n- Mengelola stres dengan baik\nSelain itu, penderita penyakit diabetes, lupus, dan arthritis dianjurkan untuk melakukan kontrol ke dokter secara rutin, guna memantau kondisi kesehatan dan efektivitas pengobatan yang telah dilakukan.\n']","Hal-hal yang dapat meningkatkan risiko penyakit arteriosklerosis termasuk:\n\n1. Kolesterol tinggi: Menggangu sistem pengangkutan lemak tubuh dan memicu terjadinya proses pengerasan dinding arteri.\n2. Trigliserida tinggi: Faktor risiko lain yang berhubungan erat dengan kolesterol, sering muncul bersamaan dengan kolesterol total dalam darah.\n3. Tekanan darah tinggi: Mengganggu aliran darah dan mengurangi pemenuhan oksigen ke organ tubuh.\n4. Berat badan berlebih: Keadaan dimana jumlah lemak di bagian dada, pinggang, dan perut menjadi berlebih, yang dapat menyebabkan terjadinya penumpukan lemak pada arteri.\n5. Diabetes: Mengakibatkan penyumbatan pembuluh darah akibat kerusakan sel-sel di sekitar arteri.\n6. Peradangan akibat arthritis, lupus, atau infeksi: Gejala ini juga dapat menyebabkan terjadinya proses pengerasan arteri.\n7. Kebiasaan merokok: Merokok dapat menurunkan kapasitas arteri dalam mengangkut oksigen ke tubuh, sekaligus meningkatkan risiko penyakit jantung koroner.\n8. Kurang olahraga: Mengurangi aliran darah dan menyebabkan terjadinya pengerasan arteri.\n9. Pola makan yang tidak sehat: Konsumsi makanan berlemak dan tinggi gula dapat meningkatkan risiko terjadinya arteriosklerosis.\n10. Riwayat penyakit jantung di keluarga: Kemungkinan besar untuk mengalami penyakit jantung atau tekanan darah tinggi juga dapat diturunkan.","Hal-hal yang dapat meningkatkan risiko arteriosklerosis antara lain:\n\n1. Faktor genetik atau familiari\n2. Tingginya tekanan darah (hipertensi)\n3. Kolesterol tinggi dalam darah\n4. Penyakit jantung atau stroke sebelumnya\n5. RhinitIS, radang tenggorokan lama dan ibu hamil yang mengalami penyakit jantung anak-nya 6. Faktor gizi buruk dan obesitas\n7. Kecenderungan untuk merokok atau kebiasaan menghirup rokok\n8. Kehilangan penglihatan akibat penyakit arteriosklerosis\n9. Gangguan fungsi hati sebagai hasil trauma fisik, infeksi, atau obesitas\n10. Penyerbuabahan tubuh terhadap radiasi sinar-X dan paparan zat beracun",0.37037037037037035,0.6843368546063632,0.99999999995,1.0
Apa saja gejala penyakit arteriosklerosis?,"Sebagian besar kasus arteriosklerosis tidak menimbulkan gejala sampai terjadi penyumbatan di pembuluh darah arteri. Gejala yang muncul tergantung pada lokasi pembuluh arteri yang tersumbat.\n\nBerdasarkan lokasi pembuluh darah arteri yang mengalami penyumbatan, gejala-gejala yang dapat muncul adalah:\n\nPenyumbatan di arteri yang menuju otak, yang dapat menimbulkan gejala berupa mati rasa di tungkai dan lengan, sulit berbicara, gangguan penglihatan, dan wajah terkulai\nPenyumbatan di arteri yang menuju jantung, yang bisa menimbulkan keluhan berupa nyeri dada, sesak napas, dan gangguan irama jantung\nPenyumbatan di arteri yang menuju tungkai, yang dapat menimbulkan gejala berupa nyeri di kaki ketika berjalan dan penurunan tekanan darah di lengan yang terkena\nPenyumbatan di arteri yang menuju ginjal, yang dapat menimbulkan keluhan berupa tekanan darah tinggi hingga gagal ginjal","['Topik: Arteriosklerosis, Subtopik: Gejala Arteriosklerosis \n Sebagian besar kasus arteriosklerosis tidak menimbulkan gejala sampai terjadi penyumbatan di pembuluh darah arteri. Gejala yang muncul tergantung pada lokasi pembuluh arteri yang tersumbat.\nBerdasarkan lokasi pembuluh darah arteri yang mengalami penyumbatan, gejala-gejala yang dapat muncul adalah:\n- Penyumbatan di arteri yang menuju otak, yang dapat menimbulkan gejala berupa mati rasa di tungkai dan lengan, sulit berbicara, gangguan penglihatan, dan wajah terkulai\n- Penyumbatan di arteri yang menuju jantung, yang bisa menimbulkan keluhan berupa nyeri dada, sesak napas, dan gangguan irama jantung\n- Penyumbatan di arteri yang menuju tungkai, yang dapat menimbulkan gejala berupa nyeri di kaki ketika berjalan dan penurunan tekanan darah di lengan yang terkena\n- Penyumbatan di arteri yang menuju ginjal, yang dapat menimbulkan keluhan berupa tekanan darah tinggi hingga gagal ginjal\n\n', 'Topik: Arteriosklerosis, Subtopik: Gejala Arteriosklerosis: Kapan harus ke dokter \n Segera ke dokter bila mengalami gejala arteriosklerosis seperti yang disebutkan di atas, terutama nyeri dada dan mati rasa atau nyeri di kaki. Pemeriksaan dan pengobatan yang dilakukan lebih awal dapat mencegah arteriosklerosis memburuk dan berkembang menjadi penyakit jantung dan stroke.\n', 'Topik: Arteriosklerosis, Subtopik: Pengertian Arteriosklerosis \n Arteriosklerosis adalah pengerasan pembuluh darah arteri akibat penumpukan plak di dinding arteri. Arteri yang mengeras dapat membuat aliran darah ke organ tubuh menjadi tidak lancar sehingga mengganggu fungsi organ tersebut. Kondisi ini dapat terjadi akibat berbagai hal, seperti penumpukan lemak atau penuaan.\nArteri adalah pembuluh darah yang berfungsi mengalirkan darah kaya oksigen dari jantung ke seluruh tubuh. Seiring berjalannya waktu, arteri dapat mengeras sehingga kehilangan elastisitasnya.\n\nArteriosklerosis dapat terjadi di arteri yang mengalirkan darah ke jantung, otak, kaki, dan ginjal. Bila berlangsung dalam waktu lama, aliran darah ke organ-organ tersebut akan terganggu, bahkan tersumbat. Akibatnya, penderita arteriosklerosis berisiko terserang penyakit serius, seperti stroke dan penyakit jantung koroner.\nMeski sering kali dianggap sama, arteriosklerosis berbeda dengan aterosklerosis. Arteriosklerosis mencakup semua kondisi pengerasan arteri. Sedangkan aterosklerosis merupakan pengerasan arteri yang secara spesifik terjadi akibat penumpukan lemak di dinding arteri. Dengan kata lain, aterosklerosis termasuk ke dalam jenis arteriosklerosis.\n']","Gejala-gejala penyakat arteriosklerosis meliputi:\n\n1. Nyeri di kaki atau tungkai saat berjalan, yang disebut sebagai ""nyeri-nyeri"" atau mual ketika menggembirakan aktivitas fisik.\n2. Kemungkinan terdapatnya gangguan penglihatan akibat penyumbatan arteri retina olecranon yang menyebabkan kurangnya aliran darah ke mata.\n3. Gangguan ritme jantung, seperti nyeri dada atau gatalan saat beraktivitas fisik.\n4. Sulit berbicara atau kesulitan menggali ide-ide dalam pikiran.\n5. Wajah terkulai, yang merujuk pada penurunan tekanan darah akibat penyumbatan arteri carotid dan mengecilnya sumsum tulang.\n6. Sesak napas atau perasaan sulit bernapas saat beraktivitas fisik, yang juga dapat merujuk pada gejala jantung serius seperti penyumbatan arteri aorta atau penyumbatan arteri pulmonal.\n7. Tekanan darah tinggi, yang juga bisa meningkatkan risiko terkena stroke dan gagal ginjal akibat pembuluh darah yang tersumbat.","Gejala penyakit arteriosklerosis berkaitan dengan karotid dan arteri lain yang mengalir ke otak. Ini termasuk gejala seperti stroke akibat disekresinya trombus dari luka pembuluh darah, serta gangguan fungsi syaraf di dalam kepala atau fasies meniskus yang menyebabkan masalah kesadaran dan mobilitas.\n\nGejala umum arteriosklerosis mencakup:\n1. Keracunan pada satu sisi (monokondropli) atau dua sisi di bawah pengaruh gravitasi, yang menandakan adanya penyumbatan pembuluh darah kepala.\n2. Perubahan suara keras dan lembut seperti ""bunyi guntur"" atau ""bunyi berdar"".\n3. Kehilangan pendengaran di satu sisi, yang bisa disebabkan oleh penyumbatan pembuluh darah akibat dari arteriosklerosis.\n4. Kedadakaran otak dan fungsi syaraf, seperti gangguan mobilitas atau kesadaran.\n5. Masalah pada gigi atau lidah yang disebabkan oleh penyumbatan darah kepala.\n6. Pendarahan di tengah nafas (hemoptysis) akibat terjadinya luka pembuluh darah saat pernapasan.",0.38461538461538464,0.6612322527489631,0.9999999999666667,1.0
Apa gejala umum penyakit jantung bawaan pada bayi?,"Sedangkan pada bayi, gejala penyakit jantung bawaan yang umum terjadi adalah:\n\nWarna kebiruan atau kehitaman di bibir, kulit, atau jari-jari kuku (sianosis)\nKelelahan dan kesulitan bernapas, terutama ketika disusui\nBerat badan rendah\nPertumbuhan terhambat\nPembengkakan di tungkai, perut, atau area sekitar mata\nInfeksi paru-paru yang berulang\nSering mengeluarkan keringat dingin","['Topik: Penyakit Jantung Bawaan, Subtopik: Gejala Penyakit Jantung Bawaan \n Penyakit jantung bawaan bisa terdeteksi saat USG kehamilan rutin atau sesaat setelah bayi dilahirkan. Salah satu gejala penyakit jantung bawaan pada janin adalah bunyi detak jantung yang tidak beraturan (aritmia).\nSedangkan pada bayi, gejala penyakit jantung bawaan yang umum terjadi adalah:\n- Warna kebiruan atau kehitaman di bibir, kulit, atau jari-jari kuku (sianosis)\n- Kelelahan dan kesulitan bernapas, terutama ketika disusui\n- Berat badan rendah\n- Pertumbuhan terhambat\n- Pembengkakan di tungkai, perut, atau area sekitar mata\n- Infeksi paru-paru yang berulang\n- Sering mengeluarkan keringat dingin\n\nPada kasus tertentu, gejala penyakit jantung bawaan baru muncul beberapa tahun setelah bayi dilahirkan, bisa ketika masa kanak-kanak atau remaja. Gejalanya bisa berupa:\n- Detak jantung tidak beraturan (aritmia)\n- Pusing dan mudah lelah, terutama saat berolahraga\n- Sulit bernapas atau napas terengah-engah\n- Pembengkakan (edema) di kaki, pergelangan kaki, atau tangan\n- Kulit berwarna kebiruan (sianosis)\n- Mudah pingsan\nPada beberapa kasus, penyakit jantung bawaan tidak menyebabkan nyeri dada atau keluhan lain, bahkan dapat terjadi tanpa gejala tertentu.\nSegera periksakan diri ke dokter jika Anda atau anak Anda mengalami gejala-gejala penyakit jantung bawaan seperti yang telah disebutkan sebelumnya. Penanganan sejak dini perlu segera dilakukan untuk mencegah kondisi yang lebih serius.\nJika pernah divonis mengalami penyakit jantung bawaan, lakukan kontrol secara berkala ke dokter untuk memantau perkembangan penyakit.\nRisiko bayi menderita penyakit jantung bawaan akan lebih tinggi pada ibu hamil yang menderita diabetes atau memiliki riwayat penyakit genetik dalam keluarga. Jika Anda sedang atau pernah menderita kondisi tersebut, konsultasikan dengan dokter terkait kemungkinan menurunkan penyakit jantung bawaan kepada bayi Anda.\nSegera ke IGD rumah sakit terdekat bila Anda atau anak Anda sulit bernapas, kulit dan bibir tampak kebiruan, atau mengalami pembengkakan di tungkai atau bagian tubuh lainnya.\n', 'Topik: Penyakit Jantung Bawaan, Subtopik: Jenis Penyakit Jantung Bawaan \n Penyakit jantung bawaan dapat dibagi berdasarkan bagian organ jantung yang mengalami gangguan. Berikut adalah penjelasannya:\nPenyakit jantung bawaan jenis ini terjadi akibat katup jantung yang melemah atau tertutup sejak bayi dilahirkan. Beberapa jenis penyakit jantung bawaan dengan kelainan di katup jantung adalah:\n- Tricuspid atresia, terjadi ketika katup di antara serambi kanan dan bilik kanan tidak terbentuk dengan sempurna\n- Pulmonary atresia, terjadi ketika ada gangguan di katup antara bilik kanan dan paru-paru sehingga darah tidak dapat mengalir ke paru-paru\n- Stenosis katup aorta, terjadi ketika katup antara bilik kiri dan aorta tidak terbentuk sempurna dan menyempit sehingga jantung sulit memompa darah\nKelainan di dinding pembatas atrium dan ventrikel bisa mengganggu fungsi jantung dalam memompa darah dan darah berkumpul di bagian yang tidak seharusnya.\nPenyakit jantung bawaan jenis ini, di antaranya:\n- Defek septum ventrikel dan defek septum atrium, yang terjadi ketika ada celah atau lubang di antara kedua bilik atau atrium jantung\n- Tetralogy of Fallot, yang terjadi ketika ada kombinasi empat penyakit jantung bawaan saat lahir, seperti defek septum dan penyempitan (stenosis) katup pembuluh darah dari jantung ke paru-paru (arteri pulmonalis)\nPenyakit jantung bawaan ini terjadi di arteri dan vena dari dan ke jantung. Kondisi ini menyebabkan aliran darah dari dan menuju jantung terhambat.\nBeberapa penyakit jantung bawaan jenis ini adalah:\n- Patent ductus arteriosus (PDA), yang terjadi ketika ada celah atau lubang di pembuluh darah aorta yang membawa darah dari jantung ke seluruh tubuh\n- Transposisi arteri besar (TAB), yang terjadi ketika posisi arteri pulmonalis dan aorta terbalik\n- Truncus arteriosus, yang terjadi ketika proses pemisahan aorta dan arteri paru-paru tidak terjadi secara sempurna\n- Koarktasio aorta, yang terjadi ketika aorta menyempit\nSelain tiga jenis di atas, penyakit jantung bawaan juga dapat dibagi menjadi dua kategori, yaitu sianotik dan asianotik. Sianotik menyebabkan rendahnya kadar oksigen dalam darah, yang ditandai dengan semburat biru di kulit dan kesulitan bernapas. Sementara asianotik umumnya tidak menimbulkan gejala tersebut.\n', 'Topik: Penyakit Jantung Bawaan, Subtopik: Diagnosis Penyakit Jantung Bawaan \n Penyakit jantung bawaan umumnya bisa terdeteksi lebih awal saat pemeriksaan USG kehamilan. Jika gejala penyakit ini muncul pada remaja atau orang dewasa, dokter akan melakukan tanya jawab seputar gejala, riwayat penyakit pasien dan keluarga, dilanjutkan dengan pemeriksaan fisik.\nBila pasien diduga mengalami penyakit jantung bawaan, dokter akan melakukan beberapa pemeriksaan lanjutan meliputi:\n- Echo jantung, untuk melihat kemampuan aliran darah yang melalui jantung dan katup jantung\n- Elektrokardiogram, untuk mendeteksi kelainan pada aktivitas listrik jantung\n- Kateterisasi jantung, untuk mengetahui kondisi aliran dan tekanan darah di jantung\n- Foto Rontgen, CT scan, atau MRI, untuk melihat gambaran jantung dan pembuluh darah jantung\n- Pulse oximetry, untuk mengukur kadar oksigen dalam darah\n- Stress test, untuk menilai kerja jantung ketika pasien sedang beraktivitas atau berolahraga\n- Tes DNA, untuk mendeteksi gen atau sindrom genetik tertentu yang bisa menyebabkan kelainan jantung bawaan\n']","Gejala umum penyakit jantung bawaan pada bayi antara lain:\n1. Warna kebiruan atau kehitaman di bibir, kulit, atau jari-jari kuku (sianosis).\n2. Kelelahan dan kesulitan bernapas, terutama ketika disusui.\n3. Berat badan rendah.\n4. Pertumbuhan terhambat.\n5. Pembengkakan di tungkai, perut, atau area sekitar mata.\n6. Infeksi paru-paru yang berulang.\n7. Sering mengeluarkan keringat dingin.","Gejala umum penyakit jantung bawaan pada bayi meliputi perubahan dalam denyut nadi, bentuk dan posisi jantung, serta aliran darah yang tidak normal. Ini dapat mencakup gangguan dalam jumlah arus darah ke organ atau fungsi jantung lainnya, seperti gangguan pada pembuluh darah maupun diaphragm (pemisah antar paru-paru dan dada).\n\nPenyebab penyakit ini bisa berbeda-beda termasuk faktor genetik atau lingkungan, seperti infeksi pada masa kehamilan. Beberapa gejala yang mungkin terlihat di antaranya adalah sesak nafas (difficulty breathing), kerdil berdarah (blue baby syndrome), dan kesulitan makan atau pertumbuhannya lambat.\n\nNamun, itu hanyalah beberapa gejala yang umumnya terkait dengan penyakit jantung bawaan. Perlu diingat bahwa setiap kasus pasti memiliki cirri spesifik dan dampaknya pada bayi tersebut, sehingga diperlukan diagnosa medis yang akurat untuk mengidentifikasi penyebab ini dan menghadapi tindakan atau perawatan mana yang sesuai.",1.0,0.5640324439399917,0.9999999999666667,1.0
Apa saja kondisi yang dapat meningkatkan faktor risiko penyakit jantung bawaan pada bayi?,"Sejumlah kondisi pada ibu hamil bisa meningkatkan risiko terjadinya penyakit jantung bawaan pada bayi, yaitu:\n\nMemiliki keluarga dengan riwayat penyakit jantung bawaan atau kelainan genetik, seperti sindrom Down atau sindrom Edward\nMenderita diabetes tipe 1 atau 2 yang tidak terkontrol\nMenderita penyakit autoimun, seperti sindrom Sjögren\nMengonsumsi alkohol secara berlebihan atau merokok saat hamil\nMenderita infeksi virus, seperti rubella, pada trimester pertama kehamilan\nMengonsumsi obat-obatan tertentu selama hamil, seperti obat antikejang, obat antijerawat golongan retinoid, dan obat golongan statin, tanpa resep dokter\nTerpapar pelarut organik yang umumnya ditemukan dalam produk cat tembok, cat kuku, atau lem\nMenderita penyakit tertentu yang dapat diturunkan dari orang tua ke anaknya, misalnya fenilketonuria","['Topik: Penyakit Jantung Bawaan, Subtopik: Gejala Penyakit Jantung Bawaan \n Penyakit jantung bawaan bisa terdeteksi saat USG kehamilan rutin atau sesaat setelah bayi dilahirkan. Salah satu gejala penyakit jantung bawaan pada janin adalah bunyi detak jantung yang tidak beraturan (aritmia).\nSedangkan pada bayi, gejala penyakit jantung bawaan yang umum terjadi adalah:\n- Warna kebiruan atau kehitaman di bibir, kulit, atau jari-jari kuku (sianosis)\n- Kelelahan dan kesulitan bernapas, terutama ketika disusui\n- Berat badan rendah\n- Pertumbuhan terhambat\n- Pembengkakan di tungkai, perut, atau area sekitar mata\n- Infeksi paru-paru yang berulang\n- Sering mengeluarkan keringat dingin\n\nPada kasus tertentu, gejala penyakit jantung bawaan baru muncul beberapa tahun setelah bayi dilahirkan, bisa ketika masa kanak-kanak atau remaja. Gejalanya bisa berupa:\n- Detak jantung tidak beraturan (aritmia)\n- Pusing dan mudah lelah, terutama saat berolahraga\n- Sulit bernapas atau napas terengah-engah\n- Pembengkakan (edema) di kaki, pergelangan kaki, atau tangan\n- Kulit berwarna kebiruan (sianosis)\n- Mudah pingsan\nPada beberapa kasus, penyakit jantung bawaan tidak menyebabkan nyeri dada atau keluhan lain, bahkan dapat terjadi tanpa gejala tertentu.\nSegera periksakan diri ke dokter jika Anda atau anak Anda mengalami gejala-gejala penyakit jantung bawaan seperti yang telah disebutkan sebelumnya. Penanganan sejak dini perlu segera dilakukan untuk mencegah kondisi yang lebih serius.\nJika pernah divonis mengalami penyakit jantung bawaan, lakukan kontrol secara berkala ke dokter untuk memantau perkembangan penyakit.\nRisiko bayi menderita penyakit jantung bawaan akan lebih tinggi pada ibu hamil yang menderita diabetes atau memiliki riwayat penyakit genetik dalam keluarga. Jika Anda sedang atau pernah menderita kondisi tersebut, konsultasikan dengan dokter terkait kemungkinan menurunkan penyakit jantung bawaan kepada bayi Anda.\nSegera ke IGD rumah sakit terdekat bila Anda atau anak Anda sulit bernapas, kulit dan bibir tampak kebiruan, atau mengalami pembengkakan di tungkai atau bagian tubuh lainnya.\n', 'Topik: Penyakit Jantung Bawaan, Subtopik: Jenis Penyakit Jantung Bawaan \n Penyakit jantung bawaan dapat dibagi berdasarkan bagian organ jantung yang mengalami gangguan. Berikut adalah penjelasannya:\nPenyakit jantung bawaan jenis ini terjadi akibat katup jantung yang melemah atau tertutup sejak bayi dilahirkan. Beberapa jenis penyakit jantung bawaan dengan kelainan di katup jantung adalah:\n- Tricuspid atresia, terjadi ketika katup di antara serambi kanan dan bilik kanan tidak terbentuk dengan sempurna\n- Pulmonary atresia, terjadi ketika ada gangguan di katup antara bilik kanan dan paru-paru sehingga darah tidak dapat mengalir ke paru-paru\n- Stenosis katup aorta, terjadi ketika katup antara bilik kiri dan aorta tidak terbentuk sempurna dan menyempit sehingga jantung sulit memompa darah\nKelainan di dinding pembatas atrium dan ventrikel bisa mengganggu fungsi jantung dalam memompa darah dan darah berkumpul di bagian yang tidak seharusnya.\nPenyakit jantung bawaan jenis ini, di antaranya:\n- Defek septum ventrikel dan defek septum atrium, yang terjadi ketika ada celah atau lubang di antara kedua bilik atau atrium jantung\n- Tetralogy of Fallot, yang terjadi ketika ada kombinasi empat penyakit jantung bawaan saat lahir, seperti defek septum dan penyempitan (stenosis) katup pembuluh darah dari jantung ke paru-paru (arteri pulmonalis)\nPenyakit jantung bawaan ini terjadi di arteri dan vena dari dan ke jantung. Kondisi ini menyebabkan aliran darah dari dan menuju jantung terhambat.\nBeberapa penyakit jantung bawaan jenis ini adalah:\n- Patent ductus arteriosus (PDA), yang terjadi ketika ada celah atau lubang di pembuluh darah aorta yang membawa darah dari jantung ke seluruh tubuh\n- Transposisi arteri besar (TAB), yang terjadi ketika posisi arteri pulmonalis dan aorta terbalik\n- Truncus arteriosus, yang terjadi ketika proses pemisahan aorta dan arteri paru-paru tidak terjadi secara sempurna\n- Koarktasio aorta, yang terjadi ketika aorta menyempit\nSelain tiga jenis di atas, penyakit jantung bawaan juga dapat dibagi menjadi dua kategori, yaitu sianotik dan asianotik. Sianotik menyebabkan rendahnya kadar oksigen dalam darah, yang ditandai dengan semburat biru di kulit dan kesulitan bernapas. Sementara asianotik umumnya tidak menimbulkan gejala tersebut.\n', 'Topik: Penyakit Jantung Bawaan, Subtopik: Pengertian Penyakit Jantung Bawaan \n Penyakit jantung bawaan (PJB) atau congenital heart disease adalah kelainan pada struktur dan fungsi jantung yang sudah ada sejak lahir. Kondisi ini dapat mengganggu aliran darah dari dan menuju jantung sehingga bisa mengancam jiwa.\nPenyakit jantung bawaan merupakan penyebab cacat lahir yang paling sering terjadi dengan jenis dan tingkat keparahan yang beragam. Sebagian penderita penyakit jantung bawaan hanya memerlukan pemeriksaan secara rutin, tetapi ada pula yang perlu menjalani operasi hingga transplantasi jantung.\n\n']","Kondisi atau faktor risiko yang dapat meningkatkan kesulitan dalam mengidentifikasi penyakit jantung bawaan pada bayi meliputi:\n\n1. **Penyakit Diabetes Mellitus (DM) pada ibu hamil**: Ibu hamil yang menderita diabetes mellitus memiliki risiko lebih tinggi untuk melahirkan bayi dengan penyakat jantung bawaan karena faktor ini juga berhubungan dengan terjadinya kegagalan fungsi hati ibu.\n\n2. **Riwayat Penyakit Genetik di Keluarga**: Jika ada riwayat penyakit genetik yang menunjukkan penyakit jantung bawaan di keluarga, maka risiko bayi mengalami penyakit jantung bawaan juga cenderung lebih tinggi.\n\n3. **Kondisi Prematur**: Bayi yang lahir prematur (sebelum waktunya) juga memiliki risiko lebih tinggi untuk terkena penyakit jantung bawaan karena faktor ini dapat menyebabkan pertumbuhan janin menjadi lebih rentan.\n\n4. **Kelainan Genetik yang Berhubungan**: Beberapa jenis kelainan genetik atau sindrom lainnya bisa berhubungan erat dengan penyakit jantung bawaan, seperti sindroma Down dan Turner.\n\n5. **Lingkungan dan Kondisi Kesehatan Umum**: Faktor ling环境和一般健康状况也可以影响婴儿患先天性心脏病的风险，例如接触有害化学物质或感染某些病毒。\n\nDengan mempertimbangkan faktor-faktor risiko ini, perawat dan pasien harus tetap hati-hati dan sering menjadi observasi kesehatan bayi untuk mengidentifikasi masalah jantung yang mungkin timbul.","Kondisi yang dapat meningkatkan faktor risiko penyakit jantung bawaan pada bayi meliputi:\n\n1. Kebiasaan merokok di sekitar atau dalam ruangan tidur, karena asap rokok membahayakan dan mengganggu fungsi jantung.\n2. Pemberian ASI (Eksklusif ataupun Lanjutan) pada bayi yang ada dalam keluarga yang merokok secara luas atau dewasa yang juga merokok, sebab asetil salisilat yang terdapat dalam rokok dapat meningkatkan risiko penyakit jantung.\n3. Kebiasaan menggunakan obat-obatan dan minuman stimulan (seperti teh atau kopi) pasca keguguran, sebab beberapa obat dan zat kimia dalam bahan baku dapat meningkatkan risiko penyakit jantung.\n4. Keadaan anemia pada ibu hamil yang tidak terkendali, karena asupan oksigen yang kurang pada fetus juga akan mempengaruhi pertumbuhan dan perkembangan jantung bayi.",0.6,0.5116644564279285,0.9999999999,1.0
Apa saja komplikasi yang diakibatkan oleh penyakit jantung bawaan?,"Penyakit jantung bawaan dapat menyebabkan sejumlah komplikasi, seperti:\n\nEndokarditis\nGangguan irama jantung atau aritmia\nGagal jantung\nHipertensi pulmonal\nInfeksi saluran pernapasan, seperti pneumonia\nPenggumpalan darah dan stroke\nGangguan pertumbuhan (stunting)\nGangguan belajar","['Topik: Penyakit Jantung Bawaan, Subtopik: Komplikasi Penyakit Jantung Bawaan \n Penyakit jantung bawaan dapat menyebabkan sejumlah komplikasi, seperti:\n- Endokarditis\n- Gangguan irama jantung atau aritmia\n- Gagal jantung\n- Hipertensi pulmonal\n- Infeksi saluran pernapasan, seperti pneumonia\n- Penggumpalan darah dan stroke\n\n- Gangguan pertumbuhan (stunting)\n- Gangguan belajar\n', 'Topik: Penyakit Jantung Bawaan, Subtopik: Pengobatan Penyakit Jantung Bawaan: Implan alat pacu jantung dan kejut jantung (ICD) \n Pemasangan alat pacu jantung dan ICD (implantable cardioverter-defibrillator) dapat dilakukan untuk membantu jantung berdetak lebih teratur. Metode ini bisa mencegah komplikasi akibat kelainan jantung bawaan.\nKateterisasi dilakukan untuk memperbaiki kelainan jantung tanpa perlu melakukan operasi. Pada prosedur ini, selang tipis dan lentur (kateter) akan dimasukkan melalui pembuluh darah di tungkai pasien menuju jantung dengan bantuan pemindaian gambar, yaitu foto Rontgen dan CT scan.\nSetelah kateter berada di posisi yang tepat, sebuah alat kecil akan dimasukkan melalui kateter untuk mengatasi kelainan atau cacat jantung. Kateterisasi jantung bisa dilakukan dengan prosedur angioplasti dan perbaikan katup jantung (valvuloplasti).\nJenis-jenis penyakit jantung bawaan yang dapat ditangani dengan kateterisasi jantung adalah stenosis katup aorta, defek septum, dan transposisi arteri besar.\nOperasi jantung bisa dilakukan bila kateterisasi jantung tidak efektif mengatasi penyakit jantung bawaan. Operasi bertujuan untuk menambal atau menjahit lubang di jantung, memperbaiki atau mengganti katup jantung, dan melebarkan pembuluh darah.\nCABG (coronary artery bypass grafting) adalah salah satu contoh prosedur bedah jantung. Beberapa jenis penyakit jantung bawaan yang dapat ditangani dengan operasi jantung adalah koarktasio aorta dan Tetralogy of Fallot.\nJika kelainan jantung tidak bisa diperbaiki dengan obat-obatan atau metode pengobatan lain, transplantasi jantung dapat menjadi pilihan penanganan terakhir.\nTransplantasi jantung merupakan prosedur pengangkatan jantung yang sudah tidak bekerja secara optimal, untuk kemudian digantikan dengan jantung yang sehat dari pendonor.\nSetelah pasien penyakit jantung bawaan menjalani pengobatan, pemeriksaan rutin ke dokter tetap perlu dilakukan. Hal ini karena penyakit ini berpotensi terjadi kembali di kemudian hari. Selain itu, fungsi jantung juga dapat menurun seiring pertambahan usia.\nUntuk menjaga kondisi jantung agar tetap sehat, pasien disarankan untuk rutin berolahraga. Jenis olahraga yang disarankan adalah yang berintensitas ringan, seperti berjalan atau berenang.\n', 'Topik: Penyakit Jantung Bawaan, Subtopik: Pengobatan Penyakit Jantung Bawaan \n Penanganan penyakit jantung bawaan bertujuan untuk memperbaiki kelainan jantung atau mengatasi komplikasi yang mungkin terjadi akibat kondisi ini. Metode yang diberikan akan disesuaikan dengan jenis kelainan dan tingkat keparahannya.\nBeberapa kelainan atau cacat jantung ringan biasanya tidak membutuhkan penanganan khusus. Walau demikian, pasien perlu memeriksakan diri ke dokter secara rutin untuk memantau kondisinya.\nPada penyakit jantung bawaan yang tergolong sedang hingga berat, dokter dapat melakukan beberapa metode berikut:\n']","Komplikasi yang diakibatkan oleh penyakit jantung bawaan meliputi:\n\n1. Endokarditis: Penyakit pada endotel hati, seringkali akut dan disebabkan infeksi.\n2. Gangguan irama jantung atau aritmia: Kecurian tidak teratur dalam ritme jantung yang dapat menyebabkan rasa takut, sesaknya napas, dan kerusakan hati akibat peredaran darah yang berlebihan.\n3. Gagal jantung: Jantung menjadi lemah untuk membersihkan darah dan memenuhi tubuh dengan oksigen, menyebabkan pasien merasa pusing, dehidrasi, dan bahkan keguguran.\n4. Hipertensi pulmonal: Tekanan darah tinggi di dalam pembuluh nafas yang mengakibatkan jantung makin sibuk untuk membersihkan darah.\n5. Infeksi saluran pernapasan, seperti pneumonia: Gejala umum termasuk demam, sesak napas, serta rasa pusing atau keguguran.\n6. Penggumpalan darah dan stroke: Zat pengikat darah yang mengganggu aliran darah dapat menyebabkan stroke atau serangan dadah.\n7. Gangguan pertumbuhan (stunting): Pertambahan ukuran tubuh kurang dibandingkan orang lain, yang bisa disebabkan oleh gangguan jantung dan sistem peredaran darah yang tidak efektif.\n8. Gangguan belajar: Kemampuan belajar atau fokus menjadi buruk akibat ketidakmaksudan oksigen di dalam tubuh.\n\nKomplikasi lain, seperti endokarditis dan aritmia, bisa menyebabkan penyakit jantung bawaan semakin parah, sementara gangguan pertumbuhan dapat mempengaruhi pertumbuhan fisik. Pasien perlu mengadapi komplikasi ini secara cermat dan mendapat pengobatan yang tepat untuk menjaga kondisi jantung tetap sehat.","Komplikasi dari penyakit jantung bawaan termasuk dalam beberapa kategori, seperti infeksi, disfungsi pembuluh darah, serta gangguan aritmogenik. Beberapa di antaranya meliputi:\n\n1. Penyakit infeksi (seperti endokarditis dan peradangan jantung) yang bisa meningkatkan risiko infeksi pada tempat operasi atau memerlukan antibiotic lebih lama.\n2. Disfungsi pembuluh darah, sehingga aliran darah ke hati dan ginjal bisa terhambat, menyebabkan penyakit hati, cedera jaringan akibat gangguan arus darah, atau kerugian fungsi organ.\n3. Gangguan aritmogenik, seperti tahanan sinus luar biasa (torsades de pointes), yang dapat memicu ketegangan pada sistem sirkulasi dan menyebabkan gejala seperti lelah atau kehilangan daya ngape.\n4. Penyempitan arteri mayor, yang bisa meningkatkan risiko stroke akibat pelepasan trombus di dalam pembuluh darah.\n5. Kerusakan jantung secara fisik, seperti penyumbatan arcoideal atau lacerasi pada seluruh permukaan hati, yang dapat memerlukan operasi tambahan untuk membersihkannya dan menghentikan perdarahan.\n6. Efek samping obat-obatan, seperti hiperkinesia, disfagia atau ketergantungan pada zat alami dalam hati yang mempengaruhi metabolisme dan fungsi jantung.",0.6,0.5992063908087563,nan,1.0
Apa saja faktor yang dapat meningkatkan risiko terkena penyakit koarktasio aorta?,"Beberapa faktor yang dapat meningkatkan risiko bayi menderita koarktasio aorta adalah:\n\nMemilliki penyakit jantung bawaan lain, seperti patent ductus arteriosus, arterial septal defect, defek septum ventrikel, atau penyakit katup jantung\nMenderita kelainan genetik, seperti sindrom Turner \nSelain itu, risiko bayi mengalami penyakit jantung bawaan juga meningkat jika ibu hamil merokok, mengonsumsi obat, seperti obat antikejang, menderita lupus, atau menderita diabetes yang tidak terkontrol.","['Topik: Koarktasio Aorta, Subtopik: Faktor risiko koarktasio aorta \n Beberapa faktor yang dapat meningkatkan risiko bayi menderita koarktasio aorta adalah:\n- Memilliki penyakit jantung bawaan lain, seperti patent ductus arteriosus, arterial septal defect, defek septum ventrikel, atau penyakit katup jantung\n\n- Menderita kelainan genetik, seperti sindrom Turner \n\nSelain itu, risiko bayi mengalami penyakit jantung bawaan juga meningkat jika ibu hamil merokok, mengonsumsi obat, seperti obat antikejang, menderita lupus, atau menderita diabetes yang tidak terkontrol.\n', 'Topik: Koarktasio Aorta, Subtopik: Penyebab Koarktasio Aorta \n Koartasio aorta adalah salah satu jenis penyakit jantung bawaan. Pada sebagian besar kasus, penyebab terjadinya koarktasio aorta belum dapat dipastikan. Kondisi ini diduga berkaitan dengan kombinasi faktor genetik dan lingkungan,  termasuk paparan bahan kimia atau obat-obatan selama kehamilan. Koarktasio aorta bisa terjadi bersamaan dengan penyakit jantung bawaan lainnya.\nKondisi ini paling sering ditemukan pada bayi. Namun, koarktasio aorta juga dapat terjadi pada usia dewasa. Koartasio aorta pada orang dewasa biasanya disebabkan arteritis Takayasu dan aterosklerosis.\nKoarktasio aorta sering terjadi pada cabang aorta yang akan mengalirkan darah ke kepala, leher, atau bagian atas tubuh, dan dekat ductus arteriosus (bagian pembuluh darah janin yang menghubungkan aorta dengan arteri pulmonal).\nPenyempitan aorta di bagian ini akan menyebabkan tekanan darah di lengan cenderung lebih tinggi dibandingkan tekanan darah di tungkai dan pergelangan kaki.\n', 'Topik: Koarktasio Aorta, Subtopik: Komplikasi Koarktasio Aorta \n Komplikasi yang dapat terjadi pada penderita koarktasio aorta adalah:\n- Hipertensi\n- Hipertrofi ventrikel kiri\n- Stroke \n- Aneurisma aorta\n- Diseksi atau robeknya aorta \n- Aneurisma otak\n- Gagal jantung \n- Penyakit jantung koroner pada usia muda\n\n- Penyakit ginjal\n- Endokartitis\n']","Berikut adalah beberapa faktor yang dapat meningkatkan risiko terkena penyakit koarktasio aorta, selain yang telah disebut dalam konteks yang diberikan:\n\n1. Penyakit jantung bawaan lain, seperti patent ductus arteriosus, arterial septal defect, defek septum ventrikel, atau penyakit katup jantung.\n2. Menderita kelainan genetik, seperti sindrom Turner.\n3. Ibu hamil yang merokok.\n4. Mengonsumsi obat, termasuk antikejang, selama kehamilan.\n5. Menderita penyakit autoimun lain, seperti lupus atau diabetes yang tidak terkontrol.\n6. Paparan lingkungan pada masa kehamilan, termasuk paparan obat-obatan atau kontak dengan bahan kimia tertentu.","Faktor-faktor yang dapat meningkatkan risiko terkena penyakit koarktasio aorta termasuk antara lain:\n\n1. Genetik (Tumor familial): Penyakit ini umumnya merupakan penyebab keturunan, sehingga jika ada yang dalam keluarga mengidap penyakit ini maka orang-orang yang memilikinya juga cenderung lebih rentan.\n2. Tingkat kolesterol tinggi: Peningkatan jumlah LDL (low-density lipoprotein) atau ""kesemutan dalam lemak"" dapat menyebabkan terjadinya pengumpulan lemak di luar sel darah merah, yang bisa meningkatkan risiko penyakit koarktasio aorta.\n3. Penyakit jantung atau tukundan arteri lainnya: Jika seseorang memiliki riwayat penyakit jantung atau gangguan pada tukundan arteri lain, risiko terkena penyakit koarktasio aorta juga cenderung meningkat.\n4. Penyebab lain seperti radiasi ionizing, obesitas, ginjal yang rusak dan asupan alkohol dan kopi berlebihan dapat mempengaruhi risiko terkena penyakit koarktasio aorta.",1.0,0.6542960490228186,0.99999999995,1.0
Apa saja gejala yang menandakan penyakit koarktasio aorta?,"Gejala koarktasio aorta bervariasi, sesuai dengan tingkat keparahan penyempitan aorta yang terjadi. Pada koarktasio aorta yang ringan, gejala bisa baru muncul setelah anak menjadi remaja atau dewasa. Beberapa gejala yang bisa muncul adalah: \n\nHipertensi \nSakit kepala\nOtot lemah\nNyeri dada\nSesak napas\nKram tungkai\nKaki terasa dingin\n\nSedangkan pada kasus koarktasio aorta yang parah, gejala dapat muncul sesaat setelah bayi lahir atau beberapa bulan setelah kelahiran. Gejala koarktasio aorta pada bayi berupa: \n\nKesulitan bernapas\nKesulitan untuk menyusu\nKulit terlihat pucat \nSangat berkeringat\nBayi tampak gelisah","['Topik: Koarktasio Aorta, Subtopik: Gejala Koarktasio Aorta \n Gejala koarktasio aorta bervariasi, sesuai dengan tingkat keparahan penyempitan aorta yang terjadi. Pada koarktasio aorta yang ringan, gejala bisa baru muncul setelah anak menjadi remaja atau dewasa. Beberapa gejala yang bisa muncul adalah: \n- Hipertensi \n\n- Sakit kepala\n- Otot lemah\n- Nyeri dada\n- Sesak napas\n- Kram tungkai\n- Kaki terasa dingin\nSedangkan pada kasus koarktasio aorta yang parah, gejala dapat muncul sesaat setelah bayi lahir atau beberapa bulan setelah kelahiran. Gejala koarktasio aorta pada bayi berupa: \n- Kesulitan bernapas\n- Kesulitan untuk menyusu\n- Kulit terlihat pucat \n- Sangat berkeringat\n- Bayi tampak gelisah\n', 'Topik: Koarktasio Aorta, Subtopik: Diagnosis Koarktasio Aorta \n Dokter akan melakukan tanya jawab seputar keluhan dan riwayat kesehatan pasien, baik kepada keluarga maupun langsung kepada pasien. Setelah itu, dokter akan melakukan pemeriksaan dada dan jantung. \nSaat pemeriksaan, dokter mungkin akan menemukan adanya suara bising jantung dan perbedaan tekanan darah pada lengan dengan tungkai. Hal-hal tersebut bisa menjadi penanda terjadinya koarktasio aorta. \nUntuk memastikan diagnosis, dokter akan melakukan pemeriksaan penunjang di bawah ini: \n- Elektrokardiogram (EKG), untuk melihat aktivitas kelistrikan jantung sekaligus mendeteksi adanya hipertrofi ventrikel kiri\n\n- Ekokardiogram atau USG jantung, untuk mengetahui lokasi dan keparahan dari koarktasio aorta, sekaligus untuk melihat adanya gangguan jantung lain\n\n- Pemindaian dengan Rontgen dada, CT scan, dan MRI, untuk melihat lokasi, tingkat keparahan, dan efek dari koarktasio aorta terhadap jantung \n\n- Katerisasi jantung, untuk mengetahui penyempitan aorta yang terjadi \n\n', 'Topik: Koarktasio Aorta, Subtopik: Komplikasi Koarktasio Aorta \n Komplikasi yang dapat terjadi pada penderita koarktasio aorta adalah:\n- Hipertensi\n- Hipertrofi ventrikel kiri\n- Stroke \n- Aneurisma aorta\n- Diseksi atau robeknya aorta \n- Aneurisma otak\n- Gagal jantung \n- Penyakit jantung koroner pada usia muda\n\n- Penyakit ginjal\n- Endokartitis\n']","Gejala koarktasio aorta bervariasi, sesuai dengan tingkat keparahan penyempitan aorta yang terjadi. Pada koarktasio aorta yang ringan, gejala bisa baru muncul setelah anak menjadi remaja atau dewasa. Beberapa gejala yang bisa muncul adalah:\n- Hipertensi\n- Sakit kepala\n- Otot lemah\n- Nyeri dada\n- Sesak napas\n- Kram tungkai\n- Kaki terasa dingin","Gejala-gejala yang umumnya dikaitkan dengan penyakit koarktasio aorta (ADA - aortic coarctation) termasuk gejala pembesaran hati dan selaput perut, gemuhan lemah, serangan jantung gangguan, kehilangan berat badan tanpa alasan, dan efusi pleura. Penyakit koarktasio aorta juga dapat menyebabkan tekanan darah tinggi pada bagian luar yang terdekat dengan operasi, seperti pergelangan tangan dan pergelangan tangan.\n\nPenyebab kesulitan dalam mengalirkan darah melalui aorta atas adalah penyakit ini umumnya diakibatkan oleh pertumbuhan otot di sepanjang lipatan-liputan dinding aorta yang berlebihan. Ini membuat bagian bawah aorta mengecil dan mengganggu aliran darah normal menuju ke jantung dan ke organ lain.\n\nGejala ini juga dapat menyebabkan beban pada hati, sehingga terjadi penyempitan lebih lanjut akibat adanya pasangan darah yang keluar dari aorta utuh tetapi tidak mengalir ke jantung. Sebagian besar anak-anak dan bayi dengan ADA menunjukkan gejala pembesaran hati, sedangkan efeknya lain seperti gangguan fungsi ginjal atau penyempitan aorta yang lebih kecil bisa tersembunyi selama periksaan.\n\nPenyebab klinis ADA umumnya diketahui setelah anak-anak dan bayi mendapatkan pemeriksaan jantung atau melakukan eksamen medis lainnya, yang mengguncangkan bahwa mereka memiliki penyakit dengan gejala yang sulit diamati secara fisik.\n\nDari segi risiko pencegahan, perokok ringan dan pasien dewasa yang mengkonsumsi alkohol tidak pernah menunjukkan kebiasaan merokok atau minum alkohol sebelumnya juga dapat terkena penyakit ini.\n\nPenyakit koarktasio aorta adalah salah satu penyebab koroneritas pada dewasa harinya dan biasanya memerlukan tindakan medis atau operasi untuk menghilangkan celah lipatan otot yang mengganggu aliran darah.\n\nGejala-gejala lain seperti ketegangan tinggi, kehilangan tubuh berat badan tanpa alasan, sianosis (penyakit jantung), atau penurunan tekanan arteri pada pergelangan tangan dan kaki juga dapat merujuk pada ADA.\n\nKecuali terlihat secara mendadak saat anak-anak lahir, gejala ini bisa muncul setelah beberapa bulan atau tahun pertama hidupnya. Karena itu, kesadaran tentang penyebab dan gejala yang mungkin menandakan ADA sangat penting untuk mengidentifikasi anak-anak dan bayi dengan resiko tinggi terkait ini.",1.0,0.5827204118295618,0.9999999999666667,1.0
Bagaimana prosedur yang dilakukan oleh dokter untuk pengobatan tamponade jantung?,"Untuk mengurangi tekanan di jantung, ada beberapa prosedur yang dapat dilakukan dokter, yaitu:\n\nPericardiocentesis (punksi perikardium)\nPericardiocentesis adalah prosedur yang dilakukan untuk mengeluarkan cairan dari ruang perikardium dengan menggunakan jarum.\nPericardiectomy\nPericardiectomy dilakukan dengan memotong dan menghilangkan sebagian perikardium yang melapisi jantung. Dengan begitu, tekanan di jantung akan berkurang.\nPericardiodesis\nPericardiodesis adalah pemberian obat-obatan langsung ke dalam rongga perikardium untuk menempelkan perikardium dengan otot jantung. Prosedur ini biasa dilakukan bila penumpukan cairan di ruang perikardium terjadi secara berulang.\nTorakotomi\nTorakotomi adalah prosedur bedah terbuka yang dilakukan dokter untuk mengeluarkan gumpalan darah pada tamponade jantung yang terjadi akibat cedera.","['Topik: Tamponade Jantung, Subtopik: Pengobatan Tamponade Jantung \n Tamponade jantung penting untuk segera didiagnosis dan ditangani agar risiko kematian akibat penyakit ini dapat berkurang. Pada dasarnya, tujuan pengobatan tamponade jantung adalah untuk meredakan tekanan di jantung dan menangani penyebab yang mendasarinya.\nSebagai langkah awal, dokter akan memberikan oksigen dan obat-obatan untuk meringankan beban kerja jantung dan meningkatkan tekanan darah. Pasien juga akan diminta untuk berbaring di ranjang dengan kaki disangga ke atas guna meningkatkan aliran balik darah ke jantung.\nUntuk mengurangi tekanan di jantung, ada beberapa prosedur yang dapat dilakukan dokter, yaitu:\n- Pericardiocentesis (punksi perikardium)\nPericardiocentesis adalah prosedur yang dilakukan untuk mengeluarkan cairan dari ruang perikardium dengan menggunakan jarum.\n- Pericardiectomy\nPericardiectomy dilakukan dengan memotong dan menghilangkan sebagian perikardium yang melapisi jantung. Dengan begitu, tekanan di jantung akan berkurang.\n- Pericardiodesis\nPericardiodesis adalah pemberian obat-obatan langsung ke dalam rongga perikardium untuk menempelkan perikardium dengan otot jantung. Prosedur ini biasa dilakukan bila penumpukan cairan di ruang perikardium terjadi secara berulang.\n- Torakotomi\nTorakotomi adalah prosedur bedah terbuka yang dilakukan dokter untuk mengeluarkan gumpalan darah pada tamponade jantung yang terjadi akibat cedera.\nSetelah tekanan di jantung dikurangi, dokter akan mencari tahu penyebab timbulnya tamponade jantung dan memberikan pengobatan terhadap penyebab tersebut.\n', 'Topik: Tamponade Jantung, Subtopik: Diagnosis Tamponade Jantung \n Dokter akan mengawali diagnosis tamponade jantung dengan menanyakan gejala yang dialami pasien dan riwayat kesehatannya. Setelah itu, dokter akan melakukan pemeriksaan fisik secara menyeluruh.\nTamponade jantung biasanya memiliki tiga tanda yang dapat dikenali oleh dokter. Tanda-tanda ini dikenal dengan istilah Beck  s triad. Tanda tersebut meliputi:\n- Tekanan darah rendah dan denyut nadi lemah karena volume darah yang dipompa jantung berkurang\n- Detak jantung cepat disertai suara jantung yang melemah akibat adanya timbunan cairan di dalam ruang perikardium\n- Pembuluh darah vena di leher menonjol karena kesulitan mengembalikan darah ke jantung\nDokter juga akan melakukan pemeriksaan lanjutan berikut ini untuk menunjang diagnosis:\n- Tes darah, untuk mendeteksi infeksi yang bisa menyebabkan perikarditis\n- Rontgen dada, untuk mendeteksi pembesaran di jantung\n- Elektrokardiografi, untuk memeriksa irama jantung pasien\n- Ekokardiografi, untuk mencari tahu apakah pembesaran perikardium dan pengempisan jantung diakibatkan oleh volume darah yang rendah\n- CT scan jantung, untuk memeriksa penimbunan cairan di ruang perikardium dan perubahan lain yang terjadi di jantung\n', 'Topik: Tamponade Jantung, Subtopik: Pencegahan Tamponade Jantung \n Tamponade jantung bisa disebabkan oleh beragam kondisi dan dapat kambuh. Oleh sebab itu, jika Anda memiliki riwayat tamponade jantung atau menderita penyakit yang dapat menyebabkan kondisi ini, lakukanlah pemeriksaan kesehatan ke dokter secara rutin.\nSelain itu, terdapat beberapa upaya yang dapat dilakukan untuk mengurangi risiko terkena penyakit yang dapat menyebabkan tamponade jantung, yaitu:\n- Mengonsumsi makanan yang menyehatkan jantung\n\n- Berolahraga secara rutin\n- Menjaga berat badan ideal\n- Menghindari konsumsi minuman beralkohol\n- Berhati-hati dalam berkendara untuk menghindari cedera dada\n- Berhenti merokok\n']","Prosedur penatalaksanaan tamponade jantung melibatkan beberapa langkah utama, di antaranya adalah mengurangi tekanan di jantung dan memperbaiki penyebab aslinya. Berikut prosedur yang umum dilakukan oleh dokter untuk pengobatan tamponade jantung:\n\n1. **Pemberian Oksigen dan Obat-obatan**: Pertama, dokter akan memberikan oksigen pasien dan obat-obatan untuk menurunkan beban kerja jantung dan mengangkat tekanan darah.\n\n2. **Berbaring di Ranjang dengan Kaki Dijembatkan**: Pasien diminta untuk duduk atau berbaring dalam ranjang, dengan kaki disangga ke atas untuk meningkatkan aliran balik darah ke jantung dan mengurangi tekanan perikardium.\n\n3. **Prosedur Medis**: Berikutnya, dokter akan melakukan prosedur medis seperti:\n   - Pericardiocentesis: Pada metode ini, jarum digunakan untuk mengeluarkan cairan yang menumpuk di ruang perikardium.\n   - Pericardiectomy: Prosedur ini melibatkan memotong dan menghilangkan sebagian dari perikardium agar tekanan jantung berkurang.\n   - Pericardiodesis: Obat-obatan diberikan langsung ke dalam ruang perikardium untuk menempelkan perikardium pada otot jantung, yang umumnya dilakukan ketika cairan sering mengembalikan.\n   - Torakotomi: Metode ini digunakan untuk membersihkan gumpalan darah akibat cedera yang menjadi penyebab tamponade jantung.\n\n4. **Pencarian Penjelasan dan Pengobatan**: Setelah tekanan di jantung terkurangi, dokter akan mencari tahu penyebab timbulnya tamponade jantung dan memberikan pengobatan sesuai dengan penyebab yang ditangani.\n\n5. **Pencegahan**: Untuk mengurangi risiko terkena penyakit atau cedera yang memicu tamponade jantung, dokter mungkin akan menyarankan beberapa langkah seperti:\n   - Mengonsumsi makanan yang bergizi dan olahraga secara rutin.\n   - Menjaga berat badan ideal.\n   - Mengurangi konsumsi alkohol dan merokok.\n   - Berhati-hati dalam melakukan aktivitas fisik atau berkendara untuk menghindari cedera dada.","Prosedur penyembuhan atau pengobatan tamponade jantung melibatkan beberapa langkah, di antaranya adalah:\n\n1. Diagnosa dan penilaian kondisi pasien: Pertama, dokter akan mengidentifikasi gejala-gejala yang mungkin disebabkan oleh tamponade, seperti perubahan denyut nadi, rasa tidak nyaman atau pusing, serta gejala yang menunjukan cedera jantung.\n2. Penggunaan obat-obatan khusus: Sebelum memulai prosedur medis lainnya, dokter mungkin akan menggunakan obat untuk membersihkan air laut dalam paru-paru dan menekan jumlah air ini agar tidak terlalu banyak mencapai hati.\n3. Pemakaian alat bantu: Jika dosis obat tidak dapat memperbaiki tamponade, dokter mungkin akan merencanakan penggunaan alat bantu seperti ventricular assist device (VAD) atau transplantasi jantung.\n4. Pemakaian alat stim untuk mengatur denyut nadi: Jika pasien memiliki denyut nadi tidak normal, dokter mungkin akan merencanakan penggunaan stimulator nadi (ICD) atau pacemaker untuk mengatur denyut nadi dan menghindari dampak negatif dari tamponade.\n5. Pemulihan fungsi jantung: Dokter mungkin akan merencanakan pemulihan fungsi jantung melalui program kesehatan mental, diet dan olahraga.\n6. Penggunaan obat-obatan untuk mengurangi tekanan darah tinggi: Untuk menghindari penyumbatan aliran darah yang lebih lanjut, dokter mungkin akan merencanakan penggunaan obat-obatan untuk mengurangi tekanan darah tinggi.\n7. Pembedahan khusus: Jika pasien memiliki tamponade akut atau tertular paru, dokter mungkin akan merencanakan pembedahan khusus untuk menghapus zat yang mengganggu fungsi jantung.\n8. Penggunaan obat-obatan untuk mencegah penyakit jantung: Untuk mencegah terulangnya gangguan fungsi jantung, dokter akan merencanakan penggunaan obat-obatan khusus selama masa pertumbuhan pasien.\n9. Konsultasi dengan tim ahli: Untuk memastikan bahwa semua aspek penyakit jantung telah diatasi, dokter akan melakukan koordinasi dan konsultasi dengan tim ahli yang terdiri atas dokter gigi, perawat, fisioterapis, dan ahli medis lainnya.\n10. Penggantian obat-obatan: Jika pasien memiliki tamponade jantung akut, dokter akan merencanakan pengganti obat untuk mengurangi resiko terjadinya gangguan fungsi jantung berikutnya.\n\nDalam kesimpulan, prosedur penyembuhan tamponade jantung melibatkan beberapa langkah medis dan dukungan dari tim ahli yang komprehensif untuk menjamin bahwa pasien akan pulih sehat dan tidak lagi mengalami gangguan fungsi jantung.",0.8275862068965517,0.6166449907298287,0.99999999995,1.0
Apa saja komplikasi yang mungkin terjadi pada penyakit tamponade jantung?,Komplikasi yang mungkin terjadi akibat tamponade jantung antara lain:\n\nSyok\nPerdarahan\nEdema paru\nGagal jantung\nKematian,"['Topik: Tamponade Jantung, Subtopik: Komplikasi Tamponade Jantung \n Komplikasi yang mungkin terjadi akibat tamponade jantung antara lain:\n- Syok\n- Perdarahan\n- Edema paru\n- Gagal jantung\n- Kematian\n', 'Topik: Tamponade Jantung, Subtopik: Pengertian Tamponade Jantung \n Tamponade jantung sering terjadi akibat tekanan yang berasal dari penumpukan cairan di dalam rongga perikardium, yaitu ruang antara otot dan selaput pelindung jantung. Cairan tersebut bisa darah atau nanah, yang jika menumpuk terlalu banyak dapat menghambat jantung untuk mengembang secara normal.\n\nTamponade jantung dapat menimbulkan gejala seperti kulit pucat, badan lemas, nyeri dada, dan jantung berdebar. Jika orang di sekitar Anda mengalami gejala tersebut, segera cari pertolongan medis agar tamponade jantung tidak menimbulkan komplikasi serius, seperti kerusakan organ, syok, atau kematian.\n', 'Topik: Tamponade Jantung, Subtopik: Pengertian Tamponade Jantung \n Tamponade jantung adalah kondisi terganggunya fungsi jantung dalam memompa darah akibat adanya tekanan yang kuat di jantung. Tamponade jantung merupakan kondisi gawat darurat yang membutuhkan penanganan medis secepatnya.\nTamponade jantung sering terjadi akibat tekanan yang berasal dari penumpukan cairan di dalam rongga perikardium, yaitu ruang antara otot dan selaput pelindung jantung. Cairan tersebut bisa darah atau nanah, yang jika menumpuk terlalu banyak dapat menghambat jantung untuk mengembang secara normal.\n\nTamponade jantung dapat menimbulkan gejala seperti kulit pucat, badan lemas, nyeri dada, dan jantung berdebar. Jika orang di sekitar Anda mengalami gejala tersebut, segera cari pertolongan medis agar tamponade jantung tidak menimbulkan komplikasi serius, seperti kerusakan organ, syok, atau kematian.\n']","Komplikasi yang mungkin terjadi akibat tamponade jantung, selengkapnya adalah sebagai berikut:\n\n1. Syok: Kondisi dimana tekanan darah meningkat secara drastis karena pemompaan jantung yang tidak normal, menyebabkan rasa lelah, nyeri dada, dan bisa berujung pada ketidaknyamanan atau bahkan syok.\n2. Perdaraban: Fenomena dimana darah mengalir ke alis-alis di luar yang biasanya ditempati oleh jaringan lain, seperti perut atau kelenjar.\n3. Edema paru: Keadaan dimana jaringan cairan menumpuk di dalam paru-paru, menyebabkan gejala seperti batuk ringan hingga parah, nyeri dada, dan bisa berujung pada denyut nafas yang tidak normal.\n4. Gagal jantung: Jika fungsi jantung terhambat secara signifikan akibat tekanan cairan, maka kesadaran dapat menurun dan bisa berujung pada kematian.\n5. Kematian: Sebagai akhirnya, penumpukan cairan di sekitar jantung yang terus memperburuk tanpa adanya intervensi medis, menyebabkan fungsi organ vital lain pun berkurang hingga akhir.","Komplikasi dari penyakit tamponade jantung meliputi:\n\n1. Penyempitan pembuluh darah (stenosis atrium) yang mengurangi aliran darah ke hati dan otak, menyebabkan ketidaknyamanan, nyeri dada, serangan jantung, dan penyakit hipertensi.\n2. Penyumbatan pembuluh nadi (atrioventricular block) yang dapat meningkatkan risiko serangan jantung dan mengurangi kapasitas jantung untuk memompa darah.\n3. Efusi pericardial, yaitu kelebihan cairan di tabir jantung (pericardium), yang bisa menyebabkan pendarahan eksternal atau efusi serius yang dapat meningkatkan tekanan dalam hati dan mengurangi fungsi hati.\n4. Penyumbatan vena cava superior, yaitu penyumbatan salah satu arteri mayor yang mengelilingi jantung, menyebabkan edema perifer (penggembunan di bagian luar) dan hipoksia (kesadahan pendengar).\n5. Efusi pleural, yaitu kelebihan cairan di dalam serupa yang dapat meningkatkan tekanan pada paru-paru dan menyebabkan pasien merasa nyedut.\n6. Penyumbatan vena cava inferior atau bejana pengeluaran jantung (vena cava thrombosis), yang bisa menyebabkan edema perifer, hipoksia, dan efusi pleural.\n7. Efusi intravaskular mayor, yaitu kelebihan cairan dalam tubuh lainnya seperti hati, ginjal, atau otot-otot, yang bisa menyebabkan penurunan tekanan darah dan insufisiensi jantung.\n8. Efusi pleuroperikardial, yaitu kelebihan cairan di antara serupa paru (pleura) dan tabir jantung (pleural effusion), yang bisa menyebabkan masalah nafas pada pasien dengan penyakit paru.\n9. Efusi pleurostomik, yaitu kelebihan cairan di dalam rongga dada atau trakea, yang bisa meningkatkan risiko infeksi tenggorokan dan mengurangi kapasitas jantung untuk memompa darah.\n10. Efusi retikular, yaitu kelebihan cairan di dalam hati, yang dapat menyebabkan penyumbatan pembuluh darah liver, hipertensi liver, dan efusi pleural.",0.45454545454545453,0.7217025238036049,0.9999999999666667,1.0
Bagaimana pencegahan diseksi aorta?,"Diseksi aorta tidak dapat dicegah sepenuhnya, tetapi Anda dapat menurunkan risiko terserang penyakit ini dengan cara:\n\nMengontrol tekanan darah secara rutin\nMempertahankan berat badan ideal\nTidak merokok\nMenjaga pola makan dan menghindari makanan tinggi kolesterol\nMemakai sabuk pengaman ketika mengendarai mobil, untuk menghindari benturan ke dada\nBerkonsultasi dengan dokter mengenai kondisi kesehatan Anda dan keluarga, terutama bila ada riwayat penyakit atau kelainan pembuluh darah aorta","['Topik: Diseksi Aorta, Subtopik: Pencegahan Diseksi Aorta \n Diseksi aorta tidak dapat dicegah sepenuhnya, tetapi Anda dapat menurunkan risiko terserang penyakit ini dengan cara:\n- Mengontrol tekanan darah secara rutin\n- Mempertahankan berat badan ideal\n\n- Tidak merokok\n- Menjaga pola makan dan menghindari makanan tinggi kolesterol\n\n- Memakai sabuk pengaman ketika mengendarai mobil, untuk menghindari benturan ke dada\n- Berkonsultasi dengan dokter mengenai kondisi kesehatan Anda dan keluarga, terutama bila ada riwayat penyakit atau kelainan pembuluh darah aorta\n', 'Topik: Diseksi Aorta, Subtopik: Pengertian Diseksi Aorta \n Diseksi aorta adalah kondisi ketika lapisan dalam pembuluh darah aorta robek dan terpisah dari lapisan tengah dinding aorta. Terkadang, gejala diseksi aorta mirip dengan gejala penyakit lain, seperti penyakit jantung dan stroke. Jika tidak segera ditangani, kondisi ini dapat berakibat fatal.\nPembuluh aorta adalah pembuluh darah arteri terbesar di dalam tubuh yang berfungsi menerima darah kaya oksigen dari jantung. Darah kaya oksigen ini akan dialirkan ke seluruh tubuh melalui cabang-cabang arteri.\n\nJika aorta robek, darah akan bocor dan mengalir melalui sela-sela robekan tersebut sehingga membentuk saluran darah palsu di dinding aorta yang membuat lapisan dalam dan tengah aorta terpisah.\nDiseksi aorta terbagi menjadi tipe A dan tipe B. Pada tipe A, robekan terjadi di aorta bagian atas (ascending aorta). Sedangkan pada tipe B, robekan terjadi di aorta bagian bawah (descending aorta). Dua jenis diseksi aorta ini dapat meluas hingga ke perut, tetapi diseksi aorta tipe A umumnya lebih berbahaya daripada diseksi aorta tipe B.\n', 'Topik: Diseksi Aorta, Subtopik: Pengobatan Diseksi Aorta: Operasi \n Operasi dilakukan untuk mengangkat bagian aorta yang rusak dan menggantinya dengan bahan sintetis. Jika terjadi kebocoran di katup jantung, dokter juga akan melakukan operasi penggantian katup jantung.\nSetelah kondisi kembali normal, semua penderita diseksi aorta harus mengonsumsi obat-obatan seumur hidupnya untuk menurunkan tekanan di aorta dan menjaga kestabilan tekanan darah.\nObat-obatan yang dimaksud antara lain obat anthipertensi seperti obat penghambat beta atau antagonis kalsium, obat angiotensin-converting enzyme (ACE) inhibitor, dan obat penurun kolesterol.\n']","Pencegahan diseksi aorta tidak dapat memastikan bahwa kondisi ini jelas akan terjadi, tetapi Anda dapat mengurangi risiko munculnya penyakit diseksi aorta melalui beberapa cara berikut:\n\n1. Mengontrol tekanan darah secara rutin: Memantau dan menjaga tekanan darah agar tetap dalam batas normal dapat membantu mengurangi risiko munculnya penyakat diseksi aorta, terutama jika ada riwayat keluarga atau gangguan pada diri Anda yang berhubungan dengan tekanan darah.\n2. Mempertahankan berat badan ideal: Mengurangi risiko obesitas merupakan cara penting untuk mencegah penyakit jantung dan ginjal, termasuk diseksi aorta.\n3. Tidak meroket: Karena rokok dapat menyebabkan penuaan lebih cepat pada pembuluh darah, sehingga mengurangi aliran darah ke organ tubuh.\n4. Menjaga pola makan dan menghindari makanan tinggi kolesterol: Mengkonsumsi makanan yang sehat dan mengurangi asupan lemak dalam jumlah besar dapat mencegah penyumbatan pembuluh darah, termasuk diseksi aorta.\n5. Memakai sabuk pengaman saat mengendarai mobil: Benturan ke dada dapat meningkatkan tekanan di dalam pembuluh darah dan merusak jaringan yang membatasi aliran darah, seperti yang terjadi pada diseksi aorta.\n6. Berkonsultasi dengan dokter: Mengadakan kunjungan pasien ke dokter secara rutin untuk mengetahui dan merawat penyakit jantung atau gangguan lain yang terkait dengan diseksi aorta.\n\nDengan melakukan cara-cara ini, Anda dapat mengurangi risiko munculnya penyakat diseksi aorta dan menjaga kesehatan tubuh Anda sendiri.","Pencegahan diseksi aorta melibatkan beberapa langkah, termasuk faktor risiko dan tindakan yang bisa diambil untuk mencegahnya. Berikut ini beberapa tips penting:\n\n1. Konsultasi dokter dan pemantauan medis: Mengadopsi rutinitas konsultasi dokter secara teratur, terutama jika ada risiko家族史 kelainan syaraf atau gangguan dalam asupan makanan.\n2. Meredakan faktor risiko penyakit obesitas: Mengurangi berat badan sesuai dengan standar BMI (Body Mass Index) dan menghindari asupan gula yang tinggi.\n3. Olahraga aktif: Melakukan olahraga sehat secara rutin, minimal 150 menit seminggu, untuk mengurangi risiko penyakit jantung.\n4. Konsumsi makanan sehat: Mengkonsumsi lemak trans ganda yang sedikit atau tidak ada dan memilih protein hewani rendah lemak serta sumber karbohidrat kompleks.\n5. Pemakaian tekanan darah dan obat-obatan dalam batas normal: Mengadopsi rutinitas mengukur tekanan darah dan frekuensi jantung secara berkala, mematuhi dosis yang diberikan dokter untuk pengguna obat.\n6. Meredakan faktor risiko asbe: Menghindari lingkungan berbahaya seperti asbes, merupakan faktor risiko penyebab penyakit jantung dan lainnya.\n7. Penyelidikan lanjut: Jika ada gejala atau tanda yang mungkin mencerminkan masalah dalam aspek kardiovaskular, segera berkonsultasi dengan dokter spesialis penyakit jantung untuk pemeriksaan lanjutan dan pengobatan.\n8. Pencegahan diabetes melitus: Mengadopsi pola makan sehat dan olahraga secara teratur, serta mengkonsumsi gula dalam jumlah yang sesuai standar untuk mencegah atau meredakan risiko penyakit jantung.\n9. Penghentian merokok: Mengadopsi pola hidup dan hedonik menjadi lebih sehat, termasuk tidak merokok atau menurunkan jumlah rokok yang dikonsumsi.",0.5,0.6071759807493026,0.9999999999,1.0
Apa itu penyakit diseksi aorta?,"Diseksi aorta adalah kondisi ketika lapisan dalam pembuluh darah aorta robek dan terpisah dari lapisan tengah dinding aorta. Terkadang, gejala diseksi aorta mirip dengan gejala penyakit lain, seperti penyakit jantung dan stroke. Jika tidak segera ditangani, kondisi ini dapat berakibat fatal.","['Topik: Diseksi Aorta, Subtopik: Pengertian Diseksi Aorta \n Diseksi aorta adalah kondisi ketika lapisan dalam pembuluh darah aorta robek dan terpisah dari lapisan tengah dinding aorta. Terkadang, gejala diseksi aorta mirip dengan gejala penyakit lain, seperti penyakit jantung dan stroke. Jika tidak segera ditangani, kondisi ini dapat berakibat fatal.\nPembuluh aorta adalah pembuluh darah arteri terbesar di dalam tubuh yang berfungsi menerima darah kaya oksigen dari jantung. Darah kaya oksigen ini akan dialirkan ke seluruh tubuh melalui cabang-cabang arteri.\n\nJika aorta robek, darah akan bocor dan mengalir melalui sela-sela robekan tersebut sehingga membentuk saluran darah palsu di dinding aorta yang membuat lapisan dalam dan tengah aorta terpisah.\nDiseksi aorta terbagi menjadi tipe A dan tipe B. Pada tipe A, robekan terjadi di aorta bagian atas (ascending aorta). Sedangkan pada tipe B, robekan terjadi di aorta bagian bawah (descending aorta). Dua jenis diseksi aorta ini dapat meluas hingga ke perut, tetapi diseksi aorta tipe A umumnya lebih berbahaya daripada diseksi aorta tipe B.\n', 'Topik: Diseksi Aorta, Subtopik: Pengertian Diseksi Aorta \n Pembuluh aorta adalah pembuluh darah arteri terbesar di dalam tubuh yang berfungsi menerima darah kaya oksigen dari jantung. Darah kaya oksigen ini akan dialirkan ke seluruh tubuh melalui cabang-cabang arteri.\n\nJika aorta robek, darah akan bocor dan mengalir melalui sela-sela robekan tersebut sehingga membentuk saluran darah palsu di dinding aorta yang membuat lapisan dalam dan tengah aorta terpisah.\nDiseksi aorta terbagi menjadi tipe A dan tipe B. Pada tipe A, robekan terjadi di aorta bagian atas (ascending aorta). Sedangkan pada tipe B, robekan terjadi di aorta bagian bawah (descending aorta). Dua jenis diseksi aorta ini dapat meluas hingga ke perut, tetapi diseksi aorta tipe A umumnya lebih berbahaya daripada diseksi aorta tipe B.\n', 'Topik: Diseksi Aorta, Subtopik: Gejala Diseksi Aorta \n Gejala diseksi aorta mirip dengan gejala penyakit lain, terutama penyakit jantung. Umumnya, gejala diseksi aorta terjadi secara tiba-tiba dan bisa terjadi kapan pun. Beberapa gejalanya adalah:\n- Nyeri di dada dan punggung atas yang muncul secara mendadak dan tidak tertahankan, seperti rasa ditusuk-tusuk yang merambat ke leher dan punggung bawah\n- Nyeri perut yang parah secara tiba-tiba akibat penyumbatan di pembuluh yang mengalirkan darah ke usus (arteri mesentrika)\n- Gejala yang mirip stroke, seperti sulit berbicara, gangguan penglihatan, dan kelumpuhan di satu sisi tubuh\n- Denyut nadi lemah di satu sisi lengan atau paha dibandingkan sisi lainnya\n- Nyeri di tungkai yang dapat disertai kesulitan berjalan atau kelumpuhan\n\n- Kesemutan atau mati rasa di jari tangan atau jari kaki\n- Keringat berlebih\n- Linglung\n- Sesak napas\n- Pusing\n- Mual\n- Pingsan\n']","Penyakit diseksi aorta (aortic dissection) adalah kondisi medis di mana lapisan dalam pembuluh darah aorta robek dan terpisah dari lapisan tengah dinding aorta. Akibatnya, darah mengalir melalui sela-sela robekan tersebut, menyebabkan bagian dalam dan tengah aorta terpisah satu sama lain.\n\nPenyebab utama diseksi aorta termasuk penyakit aneurisma pada aorta atau gangguan genetik yang mempengaruhi struktur dinding aorta. Faktor risiko lainnya, seperti rasa stres pada leher aorta, merokok, dan hipertensi, juga bisa meningkatkan risiko terjadinya diseksi aorta.\n\nGejala yang umum dari penyakit ini termasuk nyeri di dada atau punggung yang muncul secara mendadak dan tidak tertahankan, serta gejala yang mirip stroke seperti sulit berbicarapingsan. Gejala lainnya yang terkait dengan diseksi aorta termasuk denyut nadi lemah di satu sisi tubuh, kesulitan berjalan atau kelumpuhan, serta sesak napas dan pusing.\n\nKarena gejala-gejala ini bisa mirip dengan gejala penyakit lain, diagnosis awal umumnya didasarkan pada tes medis seperti tomografi komputer (CT) atau MRI yang dapat menunjukkan robekan aorta. Pengobatan diseksi aorta meliputi penggunaan obat-obatan untuk mengendalikan tekanan darah dan, dalam kasus serius, operasi medis atau intervensi medis yang dibutuhkan untuk mencegah cedera lainnya ke sistem syaraf atau organ.","Penyakit diseksi aorta, atau disebut juga aneurisma aorta diseksi, merupakan suatu keadaan dimana bagian dari pipa aorta yang melebar secara perlahan-lahan. Aneurisma ini biasanya diawali oleh luka pada selaput lendir di dalam aorta dan kemudian mengalami penyumbatan darah yang lebih lanjut.\n\nPenyebab utama dari aneurisma aorta diseksi adalah faktor genetik, seperti gangguan pada kolagen atau selapet darah (tunjukan kerusakan genetik), serta faktor lingkungan dan perilaku. Beberapa penyebab lainnya yang terkait dengan risiko meningkat adalah merokok, tekanan darah tinggi, asam urat tinggi, obesitas, serangga berapi, demam bengkuk, dan pembedahan lama sebelumnya.\n\nAneurisma aorta diseksi dapat menyebabkan cedera besar pada organ-organ yang terdekat dengan bagian melintang pipa darah ini, termasuk hati, ginjal, dan lambung. Keadaan serius ini memerlukan perawatan medis segera untuk mencegah kerusakan lebih lanjut pada organ-organ tersebut atau gangguan lainnya yang disebabkannya.\n\nPasien dengan riwayat aneurisma aorta diseksi harus selalu memantau keadaan tubuhnya secara cermat untuk menemukan perubahan pertama dan mengurangi risiko terkena serangan atau cedera yang parah.",0.7058823529411765,0.5232686541301282,0.9999999999666667,1.0
Apa saja penyebab efusi perikardium?,"Penyebab efusi perikardium sangat bervariasi, antara lain:\n\nPeradangan pada perikardium (perikarditis), baik akibat penyakit maupun cedera\nKanker perikardium, kanker jantung, atau kanker yang menyebar dari paru-paru, kelenjar getah bening, atau payudara\nInfeksi yang disebabkan oleh bakteri, virus, jamur, atau parasit\nPenyakit autoimun, seperti rheumatoid arthritis, lupus, atau sindrom Sjögren\nHipotiroidisme\nGagal ginjal\nSerangan jantung\nEfek samping prosedur medis, seperti radioterapi, kemoterapi, atau operasi jantung\nEfek samping obat-obatan tertentu, seperti obat tekanan darah tinggi, obat tuberkulosis, dan obat antikejang","['Topik: Efusi Perikardium, Subtopik: Penyebab Efusi Perikardium \n Penyebab efusi perikardium sangat bervariasi, antara lain:\n- Peradangan pada perikardium (perikarditis), baik akibat penyakit maupun cedera\n\n- Kanker perikardium, kanker jantung, atau kanker yang menyebar dari paru-paru, kelenjar getah bening, atau payudara\n\n- Infeksi yang disebabkan oleh bakteri, virus, jamur, atau parasit\n- Penyakit autoimun, seperti rheumatoid arthritis, lupus, atau sindrom Sj gren\n\n- Hipotiroidisme\n- Gagal ginjal\n- Serangan jantung\n- Efek samping prosedur medis, seperti radioterapi, kemoterapi, atau operasi jantung\n\n- Efek samping obat-obatan tertentu, seperti obat tekanan darah tinggi, obat tuberkulosis, dan obat antikejang\n\nMeski ada banyak kondisi atau penyakit yang dapat menyebabkan efusi perikardium, tidak sedikit pula kejadian efusi perikardium yang tidak diketahui penyebabnya. Hal ini disebut dengan idiopathic pericardial effusion. \n', 'Topik: Efusi Perikardium, Subtopik: Pengertian Efusi Perikardium \n Efusi perikardium adalah penumpukan cairan di antara selaput jantung (perikardium) dan jantung. Penumpukan cairan tersebut dapat menyebabkan tekanan berlebih pada jantung. Akibatnya, fungsi jantung bisa terganggu.\nPerikardium terdiri dari dua lapisan tipis yang menyelubungi jantung. Satu lapis menempel pada jantung dan satu lapis yang lain membatasi jantung dari organ sekitarnya. Di antara kedua lapisan ini terdapat celah kecil berisi cairan yang berfungsi untuk melumasi jantung agar dapat berdenyut atau memompa darah dengan mudah.\n\nEfusi perikardium terjadi ketika kadar cairan di antara ruang perikardium melebihi jumlah normalnya. Pada efusi perikardium, kadar cairan bisa sebanyak 100 mililiter hingga lebih dari 2 liter, padahal normalnya, cairan tersebut hanya sebanyak 2  3 sendok makan.\n', 'Topik: Efusi Perikardium, Subtopik: Pencegahan Efusi Perikardium \n Pada sebagian besar kasus, efusi perikardium tidak dapat dicegah. Namun, Anda bisa mengurangi risiko terkena penyakit yang dapat menyebabkan efusi perikardium, seperti infeksi, gagal ginjal, dan serangan jantung. Caranya adalah sebagai berikut:\n- Menjalani pola hidup sehat, seperti mengonsumsi makanan bergizi seimbang, menjaga berat badan ideal, dan berolahraga secara rutin\n- Mengonsumsi obat sesuai aturan pakai atau terlebih dahulu berkonsultasi online dengan dokter\n\n- Melakukan pemeriksaan kesehatan ke dokter secara berkala jika menderita penyakit kronis, seperti penyakit autoimun, diabetes, atau hipertensi\n']","Penyebab efusi perikardium sangat bervariasi, antara lain:\n- Peradangan pada perikardium (perikarditis), baik akibat penyakit maupun cedera\n- Kanker perikardium, koroner jantung, atau metastasis dari kanker paru-paru, kelenjar getah bening, atau payudara\n- Infeksi yang disebabkan oleh bakteri, virus, jamur, atau parasit\n- Penyakit autoimun, seperti rheumatoid arthritis, lupus, atau sindrom Sjögren\n- Hipotiroidisme\n- Gagal ginjal\n- Serangan jantung\n- Efek samping prosedur medis, seperti radioterapi, kemoterapi, atau operasi jantung\n- Efek samping obat-obatan tertentu, seperti obat tekanan darah tinggi, obat tuberkulosis, dan obat antikejang","Penyebab efusi perikardium meliputi beberapa faktor, yang termasuk dalam kategori ini antara lain infeksi, inflamasi, trauma medis atau operasi, dan penyakit jantung. Efusi perikardium biasanya merupakan respon fisiologis terhadap jumlah cairan yang tidak ekstrim, tetapi bisa menjadi signifikan apabila jumlahnya tinggi sehingga dapat mempengaruhi fungsi jantung.",1.0,0.6671386964913188,0.8333333332916666,1.0
Apa saja obat untuk menyembuhkan efusi perikardium?,"Obat-obatan yang diberikan dapat berupa:\n\nAspirin\nObat antiinflamasi nonsteroid (OAINS), misalnya ibuprofen\nKortikosteroid, seperti prednisone\nColchicine","['Topik: Efusi Perikardium, Subtopik: Pengobatan Efusi Perikardium: Pemberian obat-obatan \n Dokter akan meresepkan obat untuk mengurangi peradangan pada perikardium jika pasien tidak berisiko mengalami tamponade jantung. Obat-obatan yang diberikan dapat berupa:\n- Aspirin\n- Obat antiinflamasi nonsteroid (OAINS), misalnya ibuprofen\n- Kortikosteroid, seperti prednisone\n\n- Colchicine\n', 'Topik: Efusi Perikardium, Subtopik: Pengobatan Efusi Perikardium: Tindakan medis \n Dokter akan melakukan prosedur medis jika obat-obatan tidak efektif dan bila pasien menderita atau berisiko terserang tamponade jantung. Beberapa prosedur tersebut adalah:\n- Perikardiosentesis, dengan memasang kateter selama beberapa hari, untuk mengeluarkan cairan yang menumpuk di perikardium\n- Operasi jantung terbuka (open-heart surgery), untuk mengeluarkan darah atau cairan dari perikardium, memperbaiki kerusakan di perikardium, dan terkadang memasang selang dari rongga perikardium ke rongga perut supaya cairan bisa mengalir ke area tersebut kemudian terserap\n\n- Perikardiotomi balon perkutan, untuk membuat lubang drainase pada perikardium yang kemudian dibesarkan dengan balon, menggunakan metode kateterisasi\n\n- Perikardiektomi, untuk mengangkat sebagian atau keseluruhan perikardium, bagi pasien yang sudah mengalami efusi perikardium berkali-kali meski sudah ditangani dengan metode lain\n', 'Topik: Efusi Perikardium, Subtopik: Pencegahan Efusi Perikardium \n Pada sebagian besar kasus, efusi perikardium tidak dapat dicegah. Namun, Anda bisa mengurangi risiko terkena penyakit yang dapat menyebabkan efusi perikardium, seperti infeksi, gagal ginjal, dan serangan jantung. Caranya adalah sebagai berikut:\n- Menjalani pola hidup sehat, seperti mengonsumsi makanan bergizi seimbang, menjaga berat badan ideal, dan berolahraga secara rutin\n- Mengonsumsi obat sesuai aturan pakai atau terlebih dahulu berkonsultasi online dengan dokter\n\n- Melakukan pemeriksaan kesehatan ke dokter secara berkala jika menderita penyakit kronis, seperti penyakit autoimun, diabetes, atau hipertensi\n']","Di bawah ini adalah beberapa jenis obat yang biasanya digunakan untuk mengurangi efusi perikardium, termasuk penggunaannya dalam upaya menyembuhkan penyakit atau mencegah efusi perikardium:\n\n1. Aspirin: Umumnya digunakan sebagai obat antiinflamasi dan untuk mengurangi peradangan di seluruh tubuh, termasuk pada perikardium. Obat ini dapat meningkatkan alis darah dan mencegah penyumbatan pembuluh darah yang dapat memperburuk efusi perikardium.\n2. Obat antiinflamasi nonsteroid (OAINS) seperti ibuprofen: Jenis obat ini juga biasa digunakan untuk mengurangi peradangan dan mencegah penyumbatan pembuluh darah, yang dapat memperburuk efusi perikardium.\n3. Kortikosteroid seperti prednisone: Obat ini umumnya digunakan untuk mengurangi peradangan dan inflamasi di seluruh tubuh, termasuk pada perikardium. Obat ini juga dapat meningkatkan alis darah dan mencegah penyumbatan pembuluh darah yang memperburuk efusi perikardium.\n4. Colchicine: Jenis obat ini biasanya digunakan untuk mengurangi kontraksi jantung, yang dapat meningkatkan tekanan di dalam perut dan menyebabkan efusi perikardium. Obat ini juga memiliki sifat antiinflamasi yang dapat membantu mengurangi peradangan pada perikardium.\n\nNamun, tidak semua pasien efusi perikardium akan memerlukan obat atau tindakan medis untuk merawat penyakit ini. Beberapa orang dapat pulih secara alami tanpa menggunakan pengobatan khusus, sementara yang lainnya mungkin memerlukan intervensi medis seperti prosedur perikardiosentesis atau operasi jantung terbuka untuk menghapus cairan di perikardium.\n\nPenggunaan obat dan pilihan tindakan medis tergantung pada faktor-faktor klinis individu pasien, seperti tingkat efusi perikardium, penyebabnya, serta status kesehatan lainnya dari pasien.","Obat untuk menyembuhkan efusi perikardium, yaitu penyakit yang mengakibatkan perikardium menjadi lengket dan mengandung cairan. Berikut beberapa obat atau terapi yang umum digunakan:\n\n1. Diuretika: Obat ini bisa memperkecil jumlah cairan di perut, sehingga cairan efusi dikurangi. Contohnya furosemid dan torasemide.\n2. Betablocker: Umumnya digunakan untuk mengurangi tekanan darah tinggi atau mencegah serangan jantung koroner, tetapi juga dapat menghambat fungsi saraf yang menyebabkan efusi perikardium. Contohnya propranolol.\n3. Plasmafrisenn: Inokulasi darah pada pasien untuk mengganti cairan dan elemen kesehatan lainnya yang hilang akibat efusi perikardium.\n4. Kortikosteroid: Umumnya digunakan dalam skala kecil untuk mencegah penyumbatan pembuluh darah akut, tetapi juga dapat menghambat inflamasi di perikardium. Contohnya prednisolon.\n5. Angiotensin II receptor antagonists: Obat ini bisa mengurangi jumlah cairan dalam tubuh dan tekanan darah tinggi, yang secara tidak langsung dapat memperkecil efusi perikardium. Contohnya losartan atau valsartan.\n6. Pemindahan air: Penggunaan obat khusus untuk mengurangi pengeluaran air tubuh, seperti torasemide yang telah disebutkan sebelumnya.",0.56,0.6092403032124983,0.9999999999,1.0
Apa saja komplikasi yang dapat ditimbulkan penyakit jantung koroner?,"Penyakit jantung koroner jika tidak ditangani dengan baik dapat berujung ke serangan jantung hingga kematian. Selain itu, berkurangnya suplai darah menuju jantung dapat menyebabkan komplikasi lain, seperti:\n\nHipertensi pulmonal, yaitu kondisi ketika tekanan darah di paru-paru meningkat dan menyebabkan pertukaran oksigen tidak optimal\nKardiomiopati, yaitu kondisi ketika otot jantung mengalami kerusakan sehingga terlalu lemah untuk memompa darah\nGagal jantung, akibat kondisi jantung yang tidak cukup kuat untuk memompa darah sehingga suplai oksigen ke tubuh tidak optimal\nGangguan irama jantung (aritmia), ketika suplai darah ke jantung berkurang atau ada kerusakan di jaringan jantung yang memengaruhi impuls listrik jantung","['Topik: Penyakit Jantung Koroner, Subtopik: Komplikasi Penyakit Jantung Koroner \n Penyakit jantung koroner jika tidak ditangani dengan baik dapat berujung ke serangan jantung hingga kematian. Selain itu, berkurangnya suplai darah menuju jantung dapat menyebabkan komplikasi lain, seperti:\n- Hipertensi pulmonal, yaitu kondisi ketika tekanan darah di paru-paru meningkat dan menyebabkan pertukaran oksigen tidak optimal\n- Kardiomiopati, yaitu kondisi ketika otot jantung mengalami kerusakan sehingga terlalu lemah untuk memompa darah\n- Gagal jantung, akibat kondisi jantung yang tidak cukup kuat untuk memompa darah sehingga suplai oksigen ke tubuh tidak optimal\n- Gangguan irama jantung (aritmia), ketika suplai darah ke jantung berkurang atau ada kerusakan di jaringan jantung yang memengaruhi impuls listrik jantung\n', 'Topik: Penyakit Jantung Koroner, Subtopik: Pengertian Penyakit Jantung Koroner \n Penyakit jantung koroner adalah kondisi ketika pembuluh darah jantung (arteri koroner) tersumbat oleh timbunan lemak. Pada awalnya, kondisi ini mungkin tidak menyebabkan gejala. Namun, sumbatan total pada arteri koroner dapat menyebabkan serangan jantung.\nArteri koroner adalah pembuluh darah yang mengalirkan darah kaya oksigen ke otot jantung. Penumpukan lemak di arteri koroner membuat pembuluh darah ini menyempit dan mengeras. Akibatnya, aliran darah dan asupan oksigen ke otot jantung berkurang.\n\nKetika asupan oksigen berkurang, otot jantung bisa rusak sehingga kemampuannya untuk bekerja juga menjadi terbatas. Hal inilah yang menyebabkan gejala serangan jantung, seperti nyeri dada kiri dan sesak napas.\nBerdasarkan data WHO pada tahun 2019, ada 17,9 juta penduduk di dunia yang meninggal karena penyakit jantung dan pembuluh darah (kardiovaskular), di antaranya akibat penyakit jantung koroner (PJK). Sementara di Indonesia, tercatat lebih dari 2 juta orang menderita penyakit kardiovaskular pada tahun 2018.\n', 'Topik: Penyakit Jantung Koroner, Subtopik: Penyebab Penyakit Jantung Koroner \n Penyakit jantung koroner paling sering disebabkan oleh penumpukan plak lemak (aterosklerosis) di dalam arteri koroner. Jika plak makin tebal, arteri koroner akan menyempit dan menjadi kaku. Akibatnya, pasokan darah ke jantung tidak optimal sehingga seseorang mengalami gejala penyakit jantung koroner.\nPada beberapa kasus, penyakit jantung koroner bisa terjadi karena gumpalan darah yang terbentuk untuk memperbaiki dinding pembuluh darah yang rusak. Kerusakan dinding pembuluh darah ini umumnya juga berkaitan dengan aterosklerosis.\nAda kondisi atau penyakit yang dapat meningkatkan risiko terjadinya aterosklerosis atau penggumpalan darah, antara lain:\n']","Komplikasi yang bisa timbul akibat penyakit jantung koroner meliputi:\n\n1. Hipertensi Pulmonal - Kondisi dimana tekanan darah di paru-paru meningkat, menyebabkan pertukaran oksigen tidak optimal dan dapat menyebabkan gatalan pada jantung dan sumsum tulang lempeng.\n2. Kardiomiopati - Jantung yang mengalami kerusakan karena tekanan darah tinggi atau penumpukan lemak di arteri koroner, menyebabkan otot jantung menjadi lebih lemah dan kapasitas jantung berkurang.\n3. Gagal Jantung - Kondisi dimana jantung tidak cukup kuat untuk memompk darah sehingga suplai oksigen ke tubuh menjadi kurang optimal.\n4. Gangguan Irara Jantung (Aritmia) - Ketika impuls listrik di jaringan jantung terpengaruh, menyebabkan ritme jantung tidak normal dan dapat membahayakan.\n5. Penyumbatan Arteri Koroner Secundery - Akibat luka pada arteri koroner utama yang mengganggu aliran darah ke jantung, seringkali menyebabkan penumpukan lemak atau infeksi di bagian lain tubuh.\n6. Penyumbatan Arteri Koroner Tertutup - Kondisi ini bisa meningkatkan risiko terjadinya serangan jantung karena pembuluh darah yang tersumbat secara total, menyebabkan aliran darah ke jantung sepenuhnya terhambat.\n7. Penyumbatan Arteri Koroner Metarterial - Kondisi dimana arteri koroner yang telah sumbat menjadi cabang-cabang kecil dan tidak lengkap, menyebabkan aliran darah tetap rendah dan mengurangi suplai oksigen ke jantung.\n8. Penyumbatan Arteri Koroner Dekanery - Kondisi dimana arteri koroner yang terputus sepenuhnya atau dekat dengan seluruh percabangannya, menyebabkan aliran darah hampir habis dan mengurangi suplai oksigen ke jantung.","Komplikasi yang dapat timbul akibat penyakit jantung koroner meliputi:\n\n1. Penyakit pembuluh darah (arteri hipertrofi) - Ketidaksempurnaan struktur dan fungsi pembuluh darah yang membatasi aliran darah ke jantung.\n2. Tidak terkendali serangan jantung - Gejala nyawanya lama, gejala lelah, nyeri dada, sesak nafas dan iritabilitas pembuluh darah koroner.\n3. Penyumbatan pembuluh darah (emboli) - Ketidakteraturan dalam aliran darah yang mengganggu fungsi jantung.\n4. Hipertensi - Tingginya tekanan darah, yang dapat memperburuk gejala penyakit jantung koroner dan meningkatkan risiko serangan jantung.\n5. Berbagai jenis gangguan aritmia - Ketidaknormalan ritme jantung yang bisa menyebabkan rasa takut, sesak nafas, lelah atau kehilangan kesadaran.\n6. Kerusakan jaringan hati (hepatopancreatik dysfunction) - Gejala yang timbul akibat gangguan fungsi hati dan pankreas sebagai komplikasi dari penyakit jantung koroner.\n7. Penyakit ginjal lanjutan (kidney failure) - Gangguan fungsi ginjal yang disebabkan oleh beban tekanan darah tinggi dan paparan racun toksik seperti obat-obatan.",0.4583333333333333,0.620637735784272,0.99999999995,1.0
Makanan apa yang tepat untuk mencegah penyakit jantung koroner?,"Makanan tinggi serat, seperti sayur dan buah. Selain itu, tingkatkan kadar kolesterol baik atau HDL dengan memperbanyak konsumsi makanan tinggi lemak tak jenuh. Jenis makanan ini antara lain minyak ikan, minyak zaitun, minyak biji bunga matahari, minyak sayur, serta alpukat dan kacang-kacangan.","['Topik: Penyakit Jantung Koroner, Subtopik: Pencegahan Penyakit Jantung Koroner: Mengonsumsi makanan sehat dan bergizi seimbang \n Perbanyaklah mengonsumsi makanan tinggi serat, seperti sayur dan buah. Selain itu, pastikan kadar garam pada makanan tidak lebih dari satu sendok teh sehari.\nHindari jenis makanan tinggi kolesterol. Makanan berkadar gula tinggi juga harus dihindari karena dapat meningkatkan risiko diabetes, yang merupakan salah satu faktor risiko penyakit jantung koroner.\nSebaliknya, tingkatkan kadar kolesterol baik atau HDL dengan memperbanyak konsumsi makanan tinggi lemak tak jenuh. Jenis makanan ini antara lain minyak ikan, minyak zaitun, minyak biji bunga matahari, minyak sayur, serta alpukat dan kacang-kacangan.\n', 'Topik: Penyakit Jantung Koroner, Subtopik: Pencegahan Penyakit Jantung Koroner: Berolahraga rutin \n Pola makan sehat yang dikombinasikan dengan olahraga rutin dapat menjaga berat badan ideal. Di samping itu, olahraga rutin dapat menurunkan kadar kolesterol dan menjaga tekanan darah tetap normal.\nLuangkan waktu untuk berolahraga setidaknya 150 menit dalam seminggu, misalnya dengan jogging, senam, atau renang. Namun, bagi orang yang berisiko terserang penyakit jantung koroner, diskusikan terlebih dahulu dengan dokter mengenai jenis dan durasi olahraga yang tepat.\n', 'Topik: Penyakit Jantung Koroner, Subtopik: Penyebab Penyakit Jantung Koroner: Pola makan tidak sehat \n Risiko penyakit jantung koroner bisa meningkat akibat pola makan yang tidak sehat, seperti mengonsumsi makanan tinggi gula dan tinggi garam, maupun mengandung lemak jenuh atau lemak trans.\nMengonsumsi makanan tinggi gula dapat meningkatkan risiko atau memperburuk diabetes pada penderitanya. Selain itu, konsumsi makanan tinggi garam bisa mengakibatkan hipertensi. Makanan dengan kandungan lemak jenuh dan lemak trans juga meningkatkan penumpukan plak lemak di dalam arteri koroner.\n']","Untuk mencegah penyakit jantung koroner, sebaiknya mengonsumsi makanan sehat dan bergizi seimbang. Berikut beberapa jenis makanan yang sesuai untuk menurunkan risiko penyakit jantung koroner:\n\n1. Makanan tinggi serat: Sayaur dan buah-buahan merupakan sumber serat yang baik, sekaligus membantu mengontrol berat badan agar tetap ideal.\n2. Minyak tak jenuh: Makin banyak minyak ikan (yang tinggi kaya akan omega-3), minyak zaitun, dan minyak biji bunga matahari yang dikonsumsi, semakin baik pula kadar HDL atau kolesterol baik dalam tubuh.\n3. Jenis lemak rendah: Mengurangi penggunaan margarine dan mentega yang berlebih serta mengurangi asupan makanan dengan jenis lemak jenuh dan trans, seperti yang dijumpai pada beberapa jenis minuman secara gratis atau minuman botolan.\n4. Pangan berkadar garam rendah: Menghemat konsumsi pangan berdaring tinggi untuk mencegah hipertensi, yang juga dapat meningkatkan risiko penyakit jantung koroner.\n5. Jenis gula rendah: Mengurangi pengkonsumian makanan berkadar gula tinggi dan menggunakan gula lain seperti stevia atau ekstrak teh, yang memiliki efek lebih lanjut dalam menurunkan risiko penyakit jantung koroner.\n6. Mengonsumsi alpukat: Alpukat adalah jenis buah alami dan sehat yang mengandung kolesterol rendah, tetapi tingkat HDL atau kolesterol baik dalam tubuh sangat dipengaruhi oleh asupan makanan ini.\n7. Mengonsumsi minyak sayur: Jenis minyak ini sendiri memiliki kadar lemak yang rendah dan tidak mengandung trans-fat, sehingga bisa dijadikan alternatif pengganti jenis minyak lain yang berlebih.\n8. Mengonsumsi kacang-kacangan: Jenis makanan ini sendiri memiliki kadar lemak dan protein tinggi, serta mengandung zat besi yang baik untuk jaringan tubuh, sekaligus bisa menurunkan risiko terjadinya penyakit jantung koroner.\n9. Mengonsumsi jenis buah-buahan: Jenis buah alami ini sendiri memiliki kadar gula dan kalori yang rendah, tetapi mengandung serat dan vitamin C yang cukup tinggi dalam tubuh.","Untuk mencegah penyakit jantung koroner, perlu diingat bahwa diet yang sehat dan mengandung banyak sayuran serta buah-buahan, lemak tak jenuh, protein alami, serta reduksi pengkonsumian gula dan garam adalah penting. Berikut beberapa makanan atau bahan pangan yang dianjurkan:\n\n1. Kulit buah-buahan (seperti pir, jambu merah, dll): kulit buah-buahan mengandung fiber yang berguna untuk menurunkan kadar LDL (low-density lipoprotein) atau badan jahat dalam darah.\n2. Beras: sebagai sumber karbohidrat alami dan mengandung polifenol, yaitu zat berantai panjang yang bermanfaat untuk mengurangi risiko penyakit jantung koroner.\n3. Ikan: ikan laut atau ikan hias yang tinggi dalam asam lemak omega-3 seperti salmon, tongkol dan gandum, dikenal memiliki banyak manfaat untuk pengurangan risiko penyakit jantung koroner.\n4. Berbagai sayuran: seperti brokoli, kale, wortel, dll, yang tinggi dalam vitamin, mineral dan antioksidan.\n5. Kulit jeruk: mengandung fitokrom yang dapat membantu mencegah penyakitan jantung koroner serta menurunkan tekanan darah dan lemak serum.\n6. Lemak nabati seperti margarin cair atau mayones, yang bisa diganti dengan minyak masakan lurus atau mentega berlemak rendah.\n7. Berbagai jenis buah: seperti pir, jambu merah, rambutan dll, yang mengandung antioksidan dan polifenol untuk menjadi bahan makanan penyembuh terhadap penyakit jantung koroner.\n8. Tepung serbaguna atau tepung buatan: seperti tepung gandum, tepung beras dll, yang memiliki komposisi karbohidrat dan lemak tinggi, tetapi rendah dalam protein alami.\n9. Gula manis berlebihan: mengkonsumsi gula secara berlebihan dapat meningkatkan risiko penyakit jantung koroner serta obesitas, diabetes melitus dan stroke.\n10. Garam berlebih: penggunaan garam berlebihan juga memiliki hubungan erat dengan risiko penyakit jantung koroner, sehingga perlu dihindari atau dikurangi pada diet yang sehat.\n\nDemikian beberapa makanan dan bahan pangan yang berguna untuk mencegah penyakit jantung koroner. Namun, penting juga mengonsumsi makanan tersebut dalam jumlah dan keadaan yang seimbang agar lebih efektif.",0.6190476190476191,0.5230224465865759,0.9999999999666667,1.0
Bagaimana cara pencegahan penyakit takikardia supraventrikular?,"Takikardia supraventrikular dapat dicegah dengan menerapkan pola hidup sehat, seperti:\n\nMenghindari konsumsi minuman beralkohol dan berkafein secara berlebihan\nBerhenti merokok\nMenghindari penggunaan NAPZA, terutama kokain dan amphetamine\nBeristirahat dan tidur yang cukup\nMengelola stres dengan baik\nSelalu mematuhi dosis dan aturan pakai saat mengonsumsi obat apa pun\nMengonsumsi makanan sehat bergizi lengkap dan seimbang\nMembatasi asupan garam dan lemak jenuh\nBerolahraga rutin, minimal 30 menit setiap hari","['Topik: Takikardia Supraventrikular, Subtopik: Pencegahan Takikardia Supraventrikular \n Takikardia supraventrikular dapat dicegah dengan menerapkan pola hidup sehat, seperti:\n- Menghindari konsumsi minuman beralkohol dan berkafein secara berlebihan\n- Berhenti merokok\n- Menghindari penggunaan NAPZA, terutama kokain dan amphetamine \n- Beristirahat dan tidur yang cukup\n- Mengelola stres dengan baik\n- Selalu mematuhi dosis dan aturan pakai saat mengonsumsi obat apa pun\n- Mengonsumsi makanan sehat bergizi lengkap dan seimbang\n- Membatasi asupan garam dan lemak jenuh\n- Berolahraga rutin, minimal 30 menit setiap hari\n', 'Topik: Takikardia Supraventrikular, Subtopik: Pengobatan Takikardia Supraventrikular \n Pengobatan takikardia supraventrikular bertujuan untuk memperlambat denyut jantung dan mencegah kondisi yang lebih serius.\nPenderita takikardia supraventrikular umumnya tidak memerlukan pengobatan apa pun. Namun, dokter akan menyarankan beberapa tindakan berikut jika kondisi ini terjadi secara terus-menerus dalam jangka panjang:\n', 'Topik: Takikardia Supraventrikular, Subtopik: Pengertian Takikardia Supraventrikular \n Takikardia supraventrikular adalah kondisi ketika jantung berdetak lebih cepat dari biasanya. Pada kasus yang parah, takikardia supraventrikular dapat menyebabkan henti jantung mendadak. Oleh karena itu, kondisi ini penting untuk diobati secara rutin.\nNormalnya, jantung berdetak sekitar 60 100 detak/menit. Namun, pada penderita takikardia supraventrikular, detak jantung bisa mencapai 150 220 detak/menit secara tiba-tiba. Kondisi ini dapat terjadi ketika penderitanya sedang berolahraga atau bahkan saat tidak melakukan aktivitas apa pun.\n\n']","Untuk mencegah takikardia supraventrikular, seseorang dapat mengikuti pola hidup sehat dan melakukan beberapa langkah berikut:\n\n1. Hindari konsumsi minuman beralkohol dan berkafein secara berlebihan, yang bisa meningkatkan risiko terjadinya takikardia supraventrikular.\n2. Berhenti meroket, karena rokok juga dapat mempengaruhi fungsi jantung.\n3. Jangan menggunakan NAPZA, terutama khususnya obat stimulan seperti kokain dan amphetamine, yang bisa meningkatkan risiko timbulnya takikardia supraventrikular.\n4. Pastikan mendapatkan tidur dan istirahat yang cukup, karena kelembabatan dapat mempengaruhi fungsi jantung.\n5. Mengelola stres dengan baik, karena stres juga bisa meningkatkan risiko timbulnya takikardia supraventrikular.\n6. Selalu mengikuti dosis dan aturan penggunaan obat yang benar, apapun jenis obat itu.\n7. Konsumsi makanan sehat dengan komposisi gizi lengkap dan seimbang.\n8. Hindari asupan garam dan lemak jenuh dalam makanan.\n9. Berolahraga rutin, minimal 30 menit setiap hari, untuk menjaga kondisi jantung tetap stabil.","Penyebab utama penyakit takikardi supraventrikuler (SVN) belum sepenuhnya diketahui, tetapi beberapa faktor risiko yang umumnya diakui termasuk hipoksia otot jantung, gangguan elektrolit, dan genetik. Berikut adalah cara penegasan pencegahan penyakit takikardi supraventrikuler:\n\n1. Mengurangi faktor risiko penyebab hipoksia otot jantung:\n	* Meredakan tekanan darah tinggi dengan menggunakan obat-obatan atau diet rendah lemak.\n	* Mencegah konstriksi miometrial (pengelupasan pembuluh darah yang menyebabkan penyempitan jaringan) dengan menggunakan metformin dalam pasien diabetes melitus.\n2. Mengurangi gangguan elektrolit:\n	* Mengekstrak ion kalsium dan magnesium sering dijumpai pada pasien yang memiliki riwayat penyakit takikardi supraventrikuler. Pasien perlu ditangani secara mendetail untuk menghindari gangguan elektrolit seperti defisiensi kalsium dan magnesium, terutama di awal kehamilan atau menggunakan obat-obatan yang mempengaruhi fungsi jantung.\n3. Mengevaluasi genetik:\n	* Menggali riwayat penyakit jantung pada keluarga, terutama orang tua dan saudara kandung untuk mengetahui apakah mereka juga mengalami masalah genetik yang dapat mempengaruhi risiko penyakit takikardi supraventrikuler.\n4. Mengawasi gejala:\n	* Periksa secara berkala dan teratur untuk mengevaluasi fungsi jantung dan mengurangi resiko serangan jantung atau gangguan aritmik yang dapat menyebabkan takikardi supraventrikuler.\n5. Mengadopsi pola hidup sehat:\n	* Mencari obat-obatan kontraindikasi pada pasien jantung, mengurangi stres mental dan fisik, menjaga berat badan ideal, serta menghindari paparan radiasi yang tinggi.\n\nNamun, perlu diingat bahwa penyebab takikardi supraventrikuler bervariasi dan tidak semua cara penegasan tersebut akan berlaku untuk setiap individu. Oleh karena itu, penting bagi pasien untuk membahas dengan dokter mereka tentang risiko dan cara mencegahnya secara personal dan individual.",0.625,0.6285921399313974,0.99999999995,1.0
Apa gejala penyakit takikardia supraventrikular pada bayi?,Bayi dengan takikardia supraventrikular dapat menunjukkan tanda-tanda berikut:\n\nTidak bisa atau sulit menyusu\nNapas cepat\nKulit pucat\nRewel\nMudah berkeringat,"['Topik: Takikardia Supraventrikular, Subtopik: Gejala Takikardia Supraventrikular \n Gejala utama takikardia supraventrikular adalah detak jantung yang cepat. Kondisi ini dapat terjadi secara mendadak dan berlangsung dalam hitungan menit atau bahkan hari.\nSelain detak jantung yang sangat cepat, penderita takikardia supraventrikular juga mengalami gejala berupa:\n- Pusing \n- Nyeri dada\n- Sesak napas\n- Sakit kepala ringan\n- Keringat dingin\n- Mudah lelah\n- Pingsan\n- Gelisah \nSementara itu, gejala takikardia supraventrikular pada bayi umumnya sulit dikenali. Namun, bayi dengan takikardia supraventrikular dapat menunjukkan tanda-tanda berikut:\n- Tidak bisa atau sulit menyusu\n- Napas cepat\n- Kulit pucat\n- Rewel\n- Mudah berkeringat \n', 'Topik: Takikardia Supraventrikular, Subtopik: Gejala Takikardia Supraventrikular: Kapan harus ke dokter \n Segera lakukan pemeriksaan ke dokter jika Anda atau anak Anda merasakan jantung yang berdebar cepat dan disertai dengan gejala di atas, atau jika detak jantung cepat ini berlangsung lebih dari beberapa menit.\n', 'Topik: Takikardia Supraventrikular, Subtopik: Penyebab Takikardia Supraventrikular \n Takikardia supraventrikular terjadi karena adanya gangguan pada sistem pacu listrik jantung. Hal ini membuat jantung berdetak dengan sangat cepat. Akibatnya, waktu yang dibutuhkan oleh jantung agar terisi darah sangat berkurang. Jika jantung tidak cukup terisi darah, aliran darah ke seluruh tubuh pun menjadi berkurang\nTakikardia supraventrikular dapat disebabkan oleh:\n- Penyakit paru-paru\n- Penyakit tiroid, terutama hipertiroidisme \n- Penyakit jantung\n- Penyakit jantung bawaan\n- Sindrom Wolf-Parkinson-White \nSelain itu, ada beberapa kondisi yang diduga dapat meningkatkan risiko seseorang mengalami takikardia supraventrikular, yaitu:\n- Usia 25 40 tahun\n- Kehamilan\n- Penyalahgunaan NAPZA, seperti kokain atau amphetamine \n- Penggunaan obat-obatan, seperti obat asma, alergi, atau flu\n- Konsumsi minuman berkafein dan beralkohol secara berlebihan\n- Kebiasaan merokok\n- Diabetes\n- Sleep apnea \n- Stres\n- Pernah menjalani operasi jantung\n']","Gejala takikardia supraventrikular pada bayi umumnya sulit dikenali dan seringkali tidak jelas, khususnya terutama bila hanya ada sedikit gejala atau ringan. Namun, dapat dikenali melalui beberapa tanda berikut:\n\n1. Tidak bisa atau sulit menyusu, sehingga sering menimbulkan kebuntuan dan terkadang gemetar saat disusui.\n2. Napas cepat dan lemah, yang dapat menggangu kesadaran bayi dalam beberapa kasus.\n3. Kulit pucat atau mual sebelum gejala takikardia muncul.\n4. Rewel, yaitu perubahan suhu tubuh secara mendadak dan signifikan yang seringkali diikuti dengan gemetaran.\n5. Mudah berkeringat atau kedinginan meskipun situasi lingkungan panas.\n6. Kemungkinan adanya gangguan lain seperti infeksi, penyakit paru-paru, atau sindrom inflamatoris sistemik yang dapat menyebabkan gejala takikardia supraventrikular pada bayi.\n\nKarena beberapa gejala ini juga bisa terjadi karena hal-hal lain selain takikardia supraventrikular, perlu untuk segera menghubungi dokter atau tenaga medis apabila ada kecurigaan akan gejala jantung yang cepat detak ini. Dokter akan menggali lebih lanjut tentang riwayat penyakit dan faktor-faktor lainnya, serta melakukan pemeriksaan medis untuk memastikan diagnosa dan segera memberikan pengobatan yang sesuai.","Penyakit takikardia supraventrikular (SAEC) adalah suatu kelainan syaraf otak yang mengganggu fungsi jantung pada bayi. Gejala umum dari SAEC termasuk rasa gelisah, kehilangan berat badan, dan penurunan performa makanan atau tidak tertib dalam aktivitas sehari-hari.\n\nSaat ini, gejala klinis SAEC belum sempurna diketahui dan seringkali sulit untuk dideteksi pada awal keadaan karena biasanya disertai oleh penyakit lain yang mempengaruhi bayi tersebut. Namun, ada beberapa gejala yang umum ditemukan dalam menganalisis risiko untuk SAEC, termasuk:\n\n1. Kelumpuhan atau kesulitan bernapas pada saat tidur (tidak selalu terjadi).\n2. Gangguan sirkadian makanan dan tiduran yang tak tertib alamiah.\n3. Perubahan ekspresi wajah, seperti rasa gemet atau kehilangan kesadaran pada beberapa saat.\n4. Efek samping obat lain untuk penyakit lain (misalnya efedrina dan metilprednisolon) yang digunakan dalam proses diagnostik umum.\n\nPenyebab takikardia supraventrikular pada bayi belum jelas, tetapi faktor-faktor risiko termasuk prematuritas (kecanduan), gangguan pertumbuhan dan perkembangan, serta penyakit lain yang memerlukan infus obat intravena.\n\nKarena gejala SAEC bervariasi secara individual dan dapat disertai oleh penyakit lain, sangat penting untuk melakukan pemeriksaan medis serius dan mendeteksi risiko-risiko yang mungkin terkait sebelum membuat diagnosis.",0.5238095238095238,0.0,0.9999999999666667,1.0
Bagaimana cara mencegah penyakit jantung rematik?,"Beberapa upaya yang dapat dilakukan untuk mencegah penyakit jantung rematik adalah:\n\nMencuci tangan dengan sabun dan air mengalir, terutama sebelum mengolah makanan atau sebelum makan\nMenghindari penyebaran bakteri dengan tidak berbagi peralatan makan, handuk, dan sarung bantal\nMenutup mulut dan hidung saat bersin atau batuk\nMengonsumsi makanan bergizi lengkap seimbang\nMencukupi waktu tidur malam dan istirahat\nMenjalani pemeriksaan jantung dan mengonsumsi antibiotik bila memiliki riwayat demam rematik","['Topik: Penyakit Jantung Rematik, Subtopik: Pencegahan Penyakit Jantung Rematik \n Penyakit jantung reumatik dapat dicegah dengan menghindari berbagai faktor yang menyebabkan infeksi bakteri Streptococcus. Beberapa upaya yang dapat dilakukan untuk mencegah penyakit jantung rematik adalah:\n- Mencuci tangan dengan sabun dan air mengalir, terutama sebelum mengolah makanan atau sebelum makan\n- Menghindari penyebaran bakteri dengan tidak berbagi peralatan makan, handuk, dan sarung bantal\n- Menutup mulut dan hidung saat bersin atau batuk\n- Mengonsumsi makanan bergizi lengkap seimbang\n- Mencukupi waktu tidur malam dan istirahat\n- Menjalani pemeriksaan jantung dan mengonsumsi antibiotik bila memiliki riwayat demam rematik\n', 'Topik: Penyakit Jantung Rematik, Subtopik: Pengobatan Penyakit Jantung Rematik: Obat-obatan \n Dokter dapat meresepkan beberapa obat-obatan untuk menangani gejala penyakit jantung rematik dan mencegah perburukan kondisi pasien. Jenis obat-obatan yang dapat diberikan oleh dokter antara lain:\n- Antibiotik\nPemberian antibiotik harian dalam jangka panjang dilakukan untuk mengobati demam rematik pada anak-anak dan dewasa muda. Hal ini untuk mencegah kekambuhan atau komplikasi demam rematik.\n- Steroid\nSteroid diresepkan oleh dokter untuk meredakan peradangan pada jantung dan bagian tubuh lainnya.\n', 'Topik: Penyakit Jantung Rematik, Subtopik: Penyebab Penyakit Jantung Rematik \n Penyakit jantung rematik disebabkan oleh demam rematik yang tidak tertangani. Demam rematik sendiri dapat disebabkan oleh infeksi bakteri Streptococcus grup A, atau Streptococcus pyogenes (demam scarlet). Infeksi tersebut menyebabkan tubuh menghasilkan respons sistem kekebalan yang menyerang jantung.\nAda beberapa faktor yang diduga dapat meningkatkan risiko seseorang menderita penyakit jantung rematik, yaitu:\n- Tidak mendapatkan pengobatan infeksi Streptococcus secara tuntas, atau mengalami infeksi berulang\n- Tinggal di lingkungan yang padat dan kumuh\n- Sulit mendapatkan antibiotik\n- Jarang mencuci tangan, terutama setelah bersin, batuk, atau sebelum makan\n']","Untuk mencegah penyakit jantung rematik, beberapa upaya yang dapat dilakukan termasuk:\n\n1. Mencuci tangan dengan sabun dan air mengalir, terutama sebelum mengolah makanan atau sebelum makan, untuk mencegah penyebaran bakteri melalui mulut dan hidung.\n2. Menghindari penyebaran bakteri dengan tidak berbagi peralatan makan, handuk, dan sarung bantal yang mungkin terkena infeksi.\n3. Menutup mulut dan hidung saat bersin atau batuk, sehingga menyebabkan bakteri tidak dapat menembus tubuh melalui mulut dan hidung.\n4. Mengonsumsi makanan bergizi lengkap seimbang untuk membersihkan jaringan tubuh dan mencegah penyakit infeksi lainnya yang bisa terjadi karena defisiensi gizi.\n5. Mencukupi waktu tidur malam dan istirahat, yang dapat membantu tubuh untuk beradaptasi dan menangani tekanan serta stres.\n6. Menjalani pemeriksaan jantung dan mengonsumsi antibiotik bila memiliki riwayat demam rematik, sehingga mencegah terjadinya infeksi yang dapat merusak hati.","Untuk mencegah penyakit jantung rematik, salah satu triade utama yang berkaitan dengan risiko penyakit jantung dan stroke yang diusulkan oleh American Heart Association (AHA) adalah mengurangi asupan lemak tingkat lebih lanjut, mengejar kesehatan berat badan ideal, serta aktivitas fisik secara teratur. Berikut ini beberapa langkah tambahan yang bisa diambil untuk mencegah penyakit jantung rematik:\n\n1. Mengurangi asupan lemak tingkat lebih lanjut, termasuk margarin transhidrogen, minyak nabati boleh saja, dan makanan yang mengandung kolesterol tinggi.\n2. Mengejar berat badan ideal secara sehat dengan menurunkan jumlah kalori dan fokus pada diet bergizi, seperti penyajian olahan makanan rendah lemak dan hijau-kuning serta mengonsumsi buah-buahan dan sayuran yang banyak.\n3. Melakukan aktivitas fisik secara teratur, seperti jogging, bersepeda, atau berenang untuk mengejar target 150 menit a锻炼 per minggu (yang diacu oleh AHA dan American College of Cardiology) atau sesuai kapasitas aktivitas fisik masing-masing.\n4. Mengurangi asupan gula dalam makanan, karena tingginya asupan gula dapat meningkatkan risiko penyakit jantung dan stroke.\n5. Menekankan pada pola tidur yang sehat serta mengurangi tekanan akibat stres atau emosi melalui metode komunikasi interpersonal, bermain musik, berolahraga, ataupun belajar teknik deep breathing dan meditasi.\n6. Mengontrol kadar gula darah dan tekanan darah secara sehat, dengan cara mengurangi asupan lemak tingkat lanjut, mengejar bobot badan ideal, serta melakukan aktivitas fisik teratur.\n7. Mengevaluasi risiko penyakit jantung dan stroke sering kali, agar dapat segera mengambil langkah-langkah yang diperlukan untuk mencegah atau menghindari masalah kesehatan ini.\n8. Mengonsumsi obat-obatan seperti aspirin atau antihipertensiva, jika disarankan dokter Anda, dalam rangka pengelolaan risiko penyakit jantung dan stroke.",0.5882352941176471,0.5666503257212844,0.8333333332916666,1.0
Apa saja faktor yang dapat meningkatkan risiko seseorang menderita penyakit jantung rematik?,"Ada beberapa faktor yang diduga dapat meningkatkan risiko seseorang menderita penyakit jantung rematik, yaitu:\n\nTidak mendapatkan pengobatan infeksi Streptococcus secara tuntas, atau mengalami infeksi berulang\nTinggal di lingkungan yang padat dan kumuh\nSulit mendapatkan antibiotik\nJarang mencuci tangan, terutama setelah bersin, batuk, atau sebelum makan","['Topik: Penyakit Jantung Rematik, Subtopik: Penyebab Penyakit Jantung Rematik \n Penyakit jantung rematik disebabkan oleh demam rematik yang tidak tertangani. Demam rematik sendiri dapat disebabkan oleh infeksi bakteri Streptococcus grup A, atau Streptococcus pyogenes (demam scarlet). Infeksi tersebut menyebabkan tubuh menghasilkan respons sistem kekebalan yang menyerang jantung.\nAda beberapa faktor yang diduga dapat meningkatkan risiko seseorang menderita penyakit jantung rematik, yaitu:\n- Tidak mendapatkan pengobatan infeksi Streptococcus secara tuntas, atau mengalami infeksi berulang\n- Tinggal di lingkungan yang padat dan kumuh\n- Sulit mendapatkan antibiotik\n- Jarang mencuci tangan, terutama setelah bersin, batuk, atau sebelum makan\n', 'Topik: Penyakit Jantung Rematik, Subtopik: Pencegahan Penyakit Jantung Rematik \n Penyakit jantung reumatik dapat dicegah dengan menghindari berbagai faktor yang menyebabkan infeksi bakteri Streptococcus. Beberapa upaya yang dapat dilakukan untuk mencegah penyakit jantung rematik adalah:\n- Mencuci tangan dengan sabun dan air mengalir, terutama sebelum mengolah makanan atau sebelum makan\n- Menghindari penyebaran bakteri dengan tidak berbagi peralatan makan, handuk, dan sarung bantal\n- Menutup mulut dan hidung saat bersin atau batuk\n- Mengonsumsi makanan bergizi lengkap seimbang\n- Mencukupi waktu tidur malam dan istirahat\n- Menjalani pemeriksaan jantung dan mengonsumsi antibiotik bila memiliki riwayat demam rematik\n', 'Topik: Penyakit Jantung Rematik, Subtopik: Pengertian Penyakit Jantung Rematik \n Penyakit jantung rematik adalah kerusakan katup jantung akibat komplikasi dari demam rematik. Jika tidak segera mendapatkan penanganan, penyakit jantung rematik berisiko menyebabkan gagal jantung.\nDemam rematik adalah peradangan yang terjadi di berbagai organ tubuh, termasuk jantung. Jika tidak segera ditangani, demam rematik dapat menyebabkan penyempitan atau kebocoran pada katup jantung. Akibatnya, penderita bisa terkena penyakit jantung rematik.\n\nPenyakit jantung rematik bisa dialami oleh siapa saja. Namun, penyakit ini lebih sering menyerang anak-anak usia 5  15 tahun.\n']","Berdasarkan konteks yang diberikan, faktor-faktor yang dapat meningkatkan risiko seseorang menderita penyakit jantung rematik adalah:\n\n1. Tidak mendapatkan pengobatan infeksi Streptococcus secara tuntas atau mengalami infeksi berulang, karena infeksi ini dapat meningkatkan risiko terkena penyakit jantung rematik.\n2. Menderita dalam lingkungan yang padat dan kumuh, yang membuka peluang lebih tinggi bagi penularan infeksi dan oleh karena itu meningkatkan risiko terkena penyakit jantung rematik.\n3. Sulit mendapatkan antibiotik, sehingga masa pengobatan yang cukup untuk membersihkan tubuh dari bakteri Streptococcus tidak tercapai, meningkatkan risiko terkena penyakit jantung rematik.\n4. Jarang mencuci tangan, khususnya setelah bersin atau sebelum makan, yang secara rutin dapat mencegah penyebaran infeksi dan menurunkan risiko terkena penyakit jantung rematik.\n5. Mengonsumsi makanan bergizi kurang (kurang lengkap) yang tidak seimbang, yang dapat memacu pertumbuhan bakteri Streptococcus dan meningkatkan risiko terkena penyakit jantung rematik.","Faktor-faktor yang dapat meningkatkan risiko seseorang menderita penyakit jantung rematik termasuk usia, gender, riwayat keluarga dengan penyakit jantung, faktor genetik, tekanan darah tinggi, asidosis hiperkapnia (penurunan pH darah), obesitas, dan merokok.",0.8,0.5432461661502472,0.9999999999666667,1.0
Apa kelainan jantung yang diderita seseorang dengan torsade de pointes?,"Pada torsade de pointes, bilik jantung berdetak lebih cepat dan tidak selaras dengan denyut pada atrium. Perlu diketahui, denyut jantung manusia pada kondisi normal adalah 60−100 per menit. Sementara pada torsade de pointes, bilik jantung dapat berdenyut hingga 150–300 per menit.","['Topik: Torsade de Pointes, Subtopik: Pengertian Torsade de Pointes \n Torsade de pointes adalah kelainan jantung berupa kecepatan denyut pada bilik jantung (ventrikel) yang melebihi batas normal. Kondisi ini dapat disebabkan oleh kelainan bawaan atau efek samping obat-obatan. Jika tidak segera ditangani, torsade de pointes dapat menyebabkan henti jantung mendadak.\nJantung memiliki empat ruang utama yang dibagi menjadi dua, yaitu dua ruang bagian bawah (bilik jantung) dan dua ruang bagian atas (atrium). Kedua ruangan ini berfungsi untuk menerima dan memompa darah di jantung.\n\nPada torsade de pointes, bilik jantung berdetak lebih cepat dan tidak selaras dengan denyut pada atrium. Perlu diketahui, denyut jantung manusia pada kondisi normal adalah 60  100 per menit. Sementara pada torsade de pointes, bilik jantung dapat berdenyut hingga 150  300 per menit.\n', 'Topik: Torsade de Pointes, Subtopik: Pencegahan Torsade de Pointes \n Cara mencegah torsade de pointes adalah dengan menurunkan risiko terjadinya kondisi tersebut. Beberapa upaya yang dapat dilakukan adalah:\n- Hindari minum obat tanpa saran dari dokter.\n- Terapkan pola hidup yang sehat untuk menghindari serangan jantung.\n- Jaga kesehatan ginjal dengan minum air putih yang cukup, serta selalu jaga kadar gula darah.\n- Hentikan kebiasaan merokok.\n- Terapkan perilaku hidup bersih dan sehat (PHBS) untuk menghindari diare parah yang bisa mengakibatkan hipokalemia.\nSelain itu, ada beberapa langkah untuk menurunkan risiko terjadinya torsade de pointes yang disebabkan oleh kelainan jantung bawaan, yaitu:\n- Lakukan pemeriksaan jantung secara berkala jika menderita long QT syndrome atau memiliki keluarga dengan kondisi tersebut.\n- Konsultasikan dengan dokter sebelum melakukan aktivitas berat, seperti lari maraton.\n', 'Topik: Torsade de Pointes, Subtopik: Penyebab Torsade de Pointes: Congenital long QT syndrome \n Congenital long QT syndrome adalah kelainan bawaan yang menyebabkan gangguan aktivitas listrik pada bilik jantung. Sindrom ini dinamai demikian karena terjadi pemanjangan interval gelombang QRS ke T pada pemeriksaan rekam jantung (EKG).\nMakin sering seseorang mengalami pemanjangan interval QT, maka risiko terkena torsade de pointes makin tinggi.\n']","Kelainan jantung yang umumnya dikaitkan dengan torsade de pointes adalah sindrom long QT syndrom (Congenital Long QT Syndrome). Sementara itu, tidak ada informasi khusus tentang torsade de pointes didalam konteks yang diberikan.\n\nSindrom long QT syndrome adalah salah satu jenis kelainan bawaan jantung yang memiliki dampak besar pada aktivitas listrik di dalam tubuh, yang menyebabkan risiko tinggi terkena torsade de pointes. Kelainan ini mengubah pola denyut jantung dan dapat meningkatkan resiko serangan jantung atau parada jantung secara mendadak.\n\nKelainan ini disebabkan oleh gen yang tidak normal, yang menyebabkan tubuh membuat protein QT lengkap atau tidak sempurna dengan kurang baik. Hal ini mengganggu pola denyut jantung dan dapat meningkatkan risiko terkena torsade de pointes.\n\nPenyebab torsade de pointes, seperti yang disebut dalam konteks yang diberikan, tidak hanya berkaitan dengan sindrom long QT syndrome, tetapi juga dapat disebabkan oleh penggunaan obat-obatan tertentu atau efek samping lainnya.","Kelainan jantung yang sering terkait dengan torsade de pointes, atau disebut juga sebagai Torsades de Pointes (TDP), adalah suatu tanda klinis dari aritmia ventrikuler. Arritmia ini dikenali dengan ritme jantung yang cepat dan tak terkendali, seringkali menyebabkan pengurangan aliran darah ke organ-organ lain dalam tubuh.\n\nTDP adalah suatu aritmia klinik yang mendadak dan serius, dengan periode refraktori pendek (kurang dari 2,0 detik) dan intermittensi rendah. Faktor risiko utama untuk torsade de pointes termasuk hipokalemia, hiperkalemia, konsumsi berlebih atau overdosis zat kimia antiokitropik (seperti digunakan dalam pengobatan stroke venotakik), dan terapi elektrokanan yang tidak sesuai.\n\nPenyebab torsade de pointes berkaitan dengan perubahan potensial gerak lebih cepat (IKr) di sel-sel ventrikuler, sehingga mengganggu fungsi saraf simpatis dan kontraksi normal jantung. Hal ini terjadi akibat genetik atau mutasi pada ion channel IKor IKr, yang mempengaruhi aliran kalsium dalam sel jantung.\n\nPengobatan torasade de pointes melibatkan penurunan faktor-faktor resiko dan penggunaan obat kardiostimulan untuk menstabilkan ritme jantung, seperti antiarrhythmik amiodarone atau lidokain. Dalam kasus paling serius, terapi ini mungkin tidak cepat berdampak dan memerlukan imodium (penurunan obat elektrolit) atau karboksilat asid fenolik untuk menghentikan arritmia secara mendadak.\n\nDemikianlah informasi tentang kelainan jantung yang terkait dengan torsade de pointes, dan perlu diingat bahwa penyebab genetik atau mutasi pada ion channel IKor IKr merupakan faktor penting dalam menjelaskan gejalanya.",0.6923076923076923,0.6132415652650766,0.8333333332916666,1.0
