question,ground_truth,retrieved_contexts,answer,faithfulness,answer_relevancy,context_precision,context_recall
Apa hal-hal yang dapat menyebabkan penyakit hipertensi?,"Hipertensi sekunder bisa disebabkan oleh sejumlah kondisi, yaitu:\n\nPenyakit ginjal\nPenyakit kelenjar tiroid\nTumor kelenjar adrenal\nKelainan bawaan pada pembuluh darah\nKecanduan alkohol\nPenyalahgunaan NAPZA\nGangguan pernapasan yang terjadi saat tidur (sleep apnea)\nKonsumsi obat-obatan tertentu, seperti obat antiinflamasi nonsteroid (NSAID), obat batuk pilek, atau pil KB","['Topik: Hipertensi, Subtopik: Penyebab Hipertensi \n Hipertensi dibagi menjadi hipertensi primer dan sekunder. Hipertensi primer berkembang selama bertahun-tahun dan tidak diketahui penyebabnya secara pasti. Hipertensi primer merupakan jenis hipertensi yang paling sering terjadi.\nBerbeda dengan hipertensi primer, hipertensi sekunder bisa disebabkan oleh sejumlah kondisi, yaitu:\n- Penyakit ginjal\n- Penyakit kelenjar tiroid\n- Tumor kelenjar adrenal\n- Kelainan bawaan pada pembuluh darah\n- Kecanduan alkohol\n- Penyalahgunaan NAPZA\n- Gangguan pernapasan yang terjadi saat tidur (sleep apnea)\n- Konsumsi obat-obatan tertentu, seperti obat antiinflamasi nonsteroid (NSAID), obat batuk pilek, atau pil KB\n', 'Topik: Hipertensi, Subtopik: Penyebab Hipertensi: Faktor Risiko Hipertensi \n Ada beberapa faktor yang bisa meningkatkan risiko seseorang terserang hipertensi, yaitu:\n- Berusia di atas 65 tahun\n- Sedang hamil\n- Jarang berolahraga dan jarang melakukan aktivitas fisik\n- Kurang mengonsumsi makanan yang mengandung kalium\n- Memiliki keluarga dengan riwayat tekanan darah tinggi\n- Menderita obesitas, sleep apnea, diabetes, atau penyakit ginjal\n- Mengonsumsi terlalu banyak makanan tinggi garam\n- Mengonsumsi terlalu banyak kafein\n- Memiliki kebiasaan merokok dan mengonsumsi minuman beralkohol\n', 'Topik: Hipertensi, Subtopik: Pengertian Hipertensi \n Hipertensi atau darah tinggi adalah kondisi ketika tekanan darah berada pada angka 130/80 mmHg atau lebih. Jika tidak segera ditangani, hipertensi bisa menyebabkan komplikasi serius, seperti gagal jantung, penyakit ginjal, hingga stroke.\nTekanan darah dinyatakan dalam dua nilai angka yang dipisahkan dengan garis miring atau yang biasanya disebut  per  . Angka di awal, yaitu di sebelah kiri garis miring menandakan tekanan sistolik. Ini adalah tekanan di dalam pembuluh darah ketika jantung berkontraksi untuk memompa darah keluar dari jantung.\n\nAngka di akhir yang berada setelah garis miring menandakan tekanan diastolik, yaitu tekanan darah saat jantung berelaksasi dan menyedot atau menerima darah masuk kembali ke dalam jantung.\nPada kondisi normal, tekanan darah orang dewasa adalah 120/80 mmHg. Artinya, tekanan sistoliknya adalah 120 mmHg dan diastoliknya 80 mmHG.\nTekanan darah tinggi yang terjadi terus-menerus dapat membuat jantung bekerja lebih keras untuk memompa darah ke seluruh tubuh. Kondisi ini lama-kelamaan bisa membuat jantung membesar, merusak pembuluh darah, dan membuat ginjal tidak bisa bekerja dengan baik.\nOleh karena itu, hipertensi perlu segera ditangani. Setelah tekanan darah kembali normal pun, perlu terus dilakukan pemantauan dan bahkan penggunaan obat rutin agar tekanan darah selalu terkontrol.\n']","Hal-hal yang dapat menyebabkan penyakit hipertensi, di antaranya adalah:\n\n1. Hipertensi primer dan sekunder:\n   - Hipertensi primer berkembang tanpa jelas penyebabnya, sedangkan hipertensi sekunder disebabkan oleh faktor-faktor khusus atau penyakit lain.\n\n2. Penyakit ginjal:\n   - Gangguan pada fungsi ginjal bisa meningkatkan tekanan darah, terutama jika salah satu atau keduanya ginjal tidak berfungsi dengan baik.\n\n3. Penyakit kelenjar tiroid:\n   - Gangguan pada fungsi kelenjar tiroid bisa menyebabkan perubahan tekanan darah, terutama jika disertai penyumbatan aliran darah ke otak.\n\n4. Tumor kelenjar adrenal:\n   - Penyimpangan dalam aktivitas kelenjar adrenal seperti tumbuhnya tumor benign atau murni dapat menyebabkan perubahan tekanan darah.\n\n5. Kelainan bawaan pada pembuluh darah:\n   - Gangguan struktur dan fungsi pembuluh darah, seperti stenosis arteri atau aneurisma, bisa meningkatkan tekanan darah.\n\n6. Kecanduan alkohol:\n   - Penggunaan alkohol berlebihan juga dapat mempengaruhi tekanan darah secara signifikan.\n\n7. Penyalahgunaan NAPZA (Neuro- aktivitas piridinagenik ) :\n   - Seperti obat antiinflamasi nonsteroid, yang bisa meningkatkan risiko hipertensi apabila dikonsumsi berlebih atau tanpa rekamannya.\n\n8. Gangguan pernapasan saat tidur (sleep apnea):\n   - Keadaan ini dapat membuang udara dan mengganggu sirkulasi oksigen dalam tubuh, yang termasuk peningkatan tekanan darah.\n\n9. Mengonsumsi obat-obatan tertentu:\n   - Beberapa obat seperti obat antiinflamasi nonsteroid (NSAID) dan pil KB dapat meningkatkan risiko hipertensi jika dikonsumsi berlebih atau tanpa rekamannya.\n\n10. Mengonsumsi makanan tinggi garam:\n    - Pemberian makan yang terlalu banyak garam pada bayi dan anak-anak juga bisa meningkatkan risiko hipertensi nafsu makan kelompok ini.\n\n11. Mengonsumsi makanan rendah kalium:\n    - Faktor diet, seperti penyukaran asupan makanan yang buruk kalium, juga dapat mempengaruhi tekanan darah.\n\n12. Kebiasaan merokok dan mengonsumsi minuman beralkohol:\n    - Konsumsi rokok dan alkohol secara konsumtif bisa meningkatkan risiko hipertensi, terutama jika dilakukan secara berlebihan.\n\n13. Keadaan medis lainnya:\n    - Beberapa penyakit atau keadaan medis lainnya seperti obesitas, diabetes, dan penyakit hati bisa meningkatkan risiko hipertensi.",0.7692307692307693,0.5697078878303464,0.9999999999,1.0
Apa saja gejala hipertensi?,Gejala yang dapat muncul pada kondisi tersebut adalah:\n\nMual dan muntah\nSakit kepala\nMimisan\nSesak napas\nNyeri dada\nGangguan penglihatan\nTelinga berdenging\nGangguan irama jantung\nDarah dalam urine,"['Topik: Hipertensi, Subtopik: Gejala Hipertensi \n Hipertensi merupakan penyakit yang berbahaya, karena bisa terjadi tanpa gejala. Bahkan, pada beberapa kasus, gejalanya baru muncul setelah hipertensi makin parah dan sampai mengancam nyawa. Gejala yang dapat muncul pada kondisi tersebut adalah:\n- Mual dan muntah\n- Sakit kepala\n- Mimisan\n- Sesak napas\n- Nyeri dada\n- Gangguan penglihatan\n- Telinga berdenging\n- Gangguan irama jantung\n- Darah dalam urine\n', 'Topik: Hipertensi, Subtopik: Gejala Hipertensi: Kapan Harus ke Dokter \n Pada beberapa kasus, hipertensi dapat menjadi kondisi gawat darurat yang membutuhkan penanganan dengan segera. Hal ini terjadi ketika tekanan darah naik dengan cepat dan terlalu tinggi.\nSegera ke dokter jika tekanan darah Anda telah mencapai angka 180/120 atau lebih. Anda juga perlu segera ke dokter jika mengalami gejala yang dapat menjadi pertanda kerusakan organ, yaitu:\n- Sesak napas\n- Nyeri dada\n- Sulit berbicara\n- Sakit kepala yang parah\n- Mati rasa\n- Lemas\n- Gangguan penglihatan\n', 'Topik: Hipertensi, Subtopik: Pengertian Hipertensi \n Hipertensi atau darah tinggi adalah kondisi ketika tekanan darah berada pada angka 130/80 mmHg atau lebih. Jika tidak segera ditangani, hipertensi bisa menyebabkan komplikasi serius, seperti gagal jantung, penyakit ginjal, hingga stroke.\nTekanan darah dinyatakan dalam dua nilai angka yang dipisahkan dengan garis miring atau yang biasanya disebut  per  . Angka di awal, yaitu di sebelah kiri garis miring menandakan tekanan sistolik. Ini adalah tekanan di dalam pembuluh darah ketika jantung berkontraksi untuk memompa darah keluar dari jantung.\n\nAngka di akhir yang berada setelah garis miring menandakan tekanan diastolik, yaitu tekanan darah saat jantung berelaksasi dan menyedot atau menerima darah masuk kembali ke dalam jantung.\nPada kondisi normal, tekanan darah orang dewasa adalah 120/80 mmHg. Artinya, tekanan sistoliknya adalah 120 mmHg dan diastoliknya 80 mmHG.\nTekanan darah tinggi yang terjadi terus-menerus dapat membuat jantung bekerja lebih keras untuk memompa darah ke seluruh tubuh. Kondisi ini lama-kelamaan bisa membuat jantung membesar, merusak pembuluh darah, dan membuat ginjal tidak bisa bekerja dengan baik.\nOleh karena itu, hipertensi perlu segera ditangani. Setelah tekanan darah kembali normal pun, perlu terus dilakukan pemantauan dan bahkan penggunaan obat rutin agar tekanan darah selalu terkontrol.\n']","Gejala hipertensi, seperti yang dijelaskan dalam konteks tersebut, mencakup beberapa gejala fisik dan gejala organ yang bisa merusak. Berikut ini daftar lengkap gejala hipertensi:\n\n1. Mual dan muntah - Gejala kedua ini sering dianggap sebagai reaksi pencernaan biasa, tetapi dalam konteks hipertensi, mereka bisa menunjukkan bahwa penyebabnya tidak hanya perlu dilihat dari segi pencernaan.\n2. Sakit kepala - Gejala ini juga umum terjadi dan sering kali dianggap sebagai reaksi stres atau migrain, tetapi dalam konteks hipertensi, bisa menunjukkan bahwa tekanan darah tinggi sudah mencapai tingkat yang berbahaya.\n3. Mimisan - Gejala ini biasanya disebabkan oleh penglihatan tidak sempurna atau gangguan visus, tetapi dalam konteks hipertensi, bisa menunjukkan bahwa penyebabnya sebenarnya adalah tekanan darah tinggi.\n4. Sesak napas - Gejala ini sering terjadi saat beraktivitas dan biasanya disebabkan oleh peningkatan jumlah oksigen yang dibutuhkan tubuh, tetapi dalam konteks hipertensi, bisa menunjukkan bahwa penyebabnya adalah tekanan darah tinggi.\n5. Nyeri dada - Gejala ini umum terjadi saat mengalami stres atau kondisi lain yang berhubungan dengan jantung, tetapi dalam konteks hipertensi, bisa menunjukkan bahwa penyebabnya adalah tekanan darah tinggi.\n6. Gangguan penglihatan - Gejala ini umum terjadi saat menggunakan perangkat kontak mata atau saat berada dalam lingkungan gelap, tetapi dalam konteks hipertensi, bisa menunjukkan bahwa penyebabnya adalah tekanan darah tinggi.\n7. Telinga berdenging - Gejala ini sering terjadi saat menggunakan headset atau headphone yang membosankan, tetapi dalam konteks hipertensi, bisa menunjukkan bahwa penyebabnya adalah tekanan darah tinggi.\n8. Gangguan irama jantung - Gejala ini umum terjadi saat beraktivitas atau saat stres, tetapi dalam konteks hipertensi, bisa menunjukkan bahwa penyebabnya adalah tekanan darah tinggi.\n9. Darah dalam urine - Gejala ini umum terjadi saat mengalami infeksi atau kondisi lain yang berhubungan dengan jantung, tetapi dalam konteks hipertensi, bisa menunjukkan bahwa penyebabnya adalah tekanan darah tinggi.\n\nSemua gejala ini harus diperhatikan dan diatasi segera, terutama jika mengikuti gejala yang lebih parah seperti angka tekanan darah tinggi yang sangat tinggi atau komplikasi organ lainnya.",0.6,0.49180879973656166,0.99999999995,1.0
Bagaimana cara mencegah hipertensi?,"Beberapa cara efektif yang dapat dilakukan adalah:\n\nPertahankan berat badan ideal.\nLakukan olahraga secara rutin minimal 30 menit setiap hari.\nCukupi waktu tidur dan istirahat.\nKelola stres dengan baik.\nKonsumsi makanan rendah lemak dan kaya serat, seperti buah dan sayuran.\nBatasi konsumsi garam atau micin dalam makanan, tidak lebih dari satu sendok teh per hari.\nHindari konsumsi minuman beralkohol.\nBatasi konsumsi minuman berkafein.\nHentikan kebiasaan merokok.\nLakukan pemeriksaan kesehatan dan skrining hipertensi secara rutin.","['Topik: Hipertensi, Subtopik: Pencegahan Hipertensi \n Cara mencegah hipertensi adalah dengan menghindari faktor yang dapat meningkatkan risiko terserang penyakit ini. Beberapa cara efektif yang dapat dilakukan adalah:\n- Pertahankan berat badan ideal.\n- Lakukan olahraga secara rutin minimal 30 menit setiap hari.\n- Cukupi waktu tidur dan istirahat.\n- Kelola stres dengan baik.\n- Konsumsi makanan rendah lemak dan kaya serat, seperti buah dan sayuran.\n- Batasi konsumsi garam atau micin dalam makanan, tidak lebih dari satu sendok teh per hari.\n- Hindari konsumsi minuman beralkohol.\n- Batasi konsumsi minuman berkafein.\n- Hentikan kebiasaan merokok.\n- Lakukan pemeriksaan kesehatan dan skrining hipertensi secara rutin.\nDeteksi dini hipertensi dapat dilakukan dengan melakukan pemeriksaan tekanan darah secara mandiri dengan menggunakan tensimeter yang tepat. Selain itu, konsultasikan dengan dokter mengenai pemilihan tensimeter yang tepat untuk di rumah.\n', 'Topik: Hipertensi, Subtopik: Pengertian Hipertensi \n Hipertensi atau darah tinggi adalah kondisi ketika tekanan darah berada pada angka 130/80 mmHg atau lebih. Jika tidak segera ditangani, hipertensi bisa menyebabkan komplikasi serius, seperti gagal jantung, penyakit ginjal, hingga stroke.\nTekanan darah dinyatakan dalam dua nilai angka yang dipisahkan dengan garis miring atau yang biasanya disebut  per  . Angka di awal, yaitu di sebelah kiri garis miring menandakan tekanan sistolik. Ini adalah tekanan di dalam pembuluh darah ketika jantung berkontraksi untuk memompa darah keluar dari jantung.\n\nAngka di akhir yang berada setelah garis miring menandakan tekanan diastolik, yaitu tekanan darah saat jantung berelaksasi dan menyedot atau menerima darah masuk kembali ke dalam jantung.\nPada kondisi normal, tekanan darah orang dewasa adalah 120/80 mmHg. Artinya, tekanan sistoliknya adalah 120 mmHg dan diastoliknya 80 mmHG.\nTekanan darah tinggi yang terjadi terus-menerus dapat membuat jantung bekerja lebih keras untuk memompa darah ke seluruh tubuh. Kondisi ini lama-kelamaan bisa membuat jantung membesar, merusak pembuluh darah, dan membuat ginjal tidak bisa bekerja dengan baik.\nOleh karena itu, hipertensi perlu segera ditangani. Setelah tekanan darah kembali normal pun, perlu terus dilakukan pemantauan dan bahkan penggunaan obat rutin agar tekanan darah selalu terkontrol.\n', 'Topik: Hipertensi, Subtopik: Pengobatan Hipertensi: Perubahan gaya hidup \n Mengubah gaya hidup menjadi lebih sehat bisa menurunkan tekanan darah dalam beberapa minggu. Biasanya, dokter akan menyarankan perubahan gaya hidup tanpa perlu konsumsi obat jika risiko pasien terserang komplikasi rendah.\nGaya hidup sehat yang dijalani adalah:\n- Mengonsumsi lebih banyak buah-buahan dan sayur-sayuran\n- Mengurangi konsumsi garam, yaitu maksimal sebanyak satu sendok teh per hari\n- Memperbanyak aktivitas fisik dan rutin berolahraga\n- Menurunkan berat badan berlebih dan menjaga berat badan ideal\n- Menghentikan kebiasaan merokok\n- Menghindari atau mengurangi konsumsi minuman beralkohol\n- Mengurangi konsumsi minuman berkafein, seperti kopi, teh, atau soda\n- Melakukan terapi relaksasi untuk mengelola stres, seperti yoga atau meditasi\n']","Untuk mencegah hipertensi, ada beberapa cara yang bisa dilakukan, seperti ini:\n\n1. Tetapkan berat badan idealmu dan jadilah gembira dengan tubuh yang sesuai.\n2. Olahraga rutin minimal 30 menit setiap hari, misalnya bermain bisiklet atau jogging.\n3. Jangankan waktu tidur dan istirahat agar tidur siang juga pas.\n4. Kelaola stres dengan baik, seperti berolahraga yang menyenangkan atau belajar cara mengelola tekanan darah.\n5. Gunakan buah-buahan dan sayuran dalam makanannya, jangan lupa batasi konsumsi garam hingga minimal satu sendok teh per hari.\n6. Hindari minuman beralkohol dan berkafein, seperti teh atau kopi.\n7. Jangan merokok sama sekali.\n8. Latihan mandiri dengan mengukur tekanan darah secara rutin untuk mendeteksi hipertensi dini. Konsultasikan hasilnya dengan dokter atau memilih tensimeter yang tepat di rumah.",0.6875,0.6156986977818776,0.8333333332916666,1.0
Apa penyebab umum seseorang terkena penyakit jantung?,"Secara umum, penyakit jantung dapat diakibatkan oleh kondisi berikut:\n\nPenumpukan lemak di dalam pembuluh darah koroner (aterosklerosis)\nTekanan darah tinggi (hipertensi)\nDiabetes tidak terkontrol\nInfeksi","['Topik: Penyakit Jantung, Subtopik: Penyebab Penyakit Jantung: Penyakit Jantung Koroner \n Penyakit jantung koroner merupakan jenis penyakit jantung yang paling sering terjadi. Kondisi ini muncul ketika pembuluh darah jantung menyempit atau tersumbat. Akibatnya, jantung kekurangan darah yang kaya oksigen dan nutrisi.\nPenyakit jantung koroner umumnya disebabkan oleh aterosklerosis, yaitu penyempitan pembuluh darah akibat penumpukan lemak (kolesterol) dan kalsium. Kondisi ini juga bisa menyebabkan pembuluh darah menjadi lebih kaku, sehingga membuat aliran darah jantung tidak lancar.\nAda beberapa kondisi atau faktor yang bisa meningkatkan risiko seseorang untuk terkena penyakit jantung koroner, di antaranya:\n- Hipertensi\n- Tingginya kadar kolesterol dalam darah (hiperkolesterolemia)\n- Kebiasaan merokok\n- Diabetes\n- Obesitas\n- Jarang olahraga\n- Kebiasaan sering mengonsumsi minuman beralkohol berlebihan\n', 'Topik: Penyakit Jantung, Subtopik: Penyebab Penyakit Jantung \n Penyebab penyakit jantung sangat bervariasi, mulai dari masalah pada pembuluh darah jantung, irama jantung, hingga kelainan lahir. Berikut adalah penyebab penyakit jantung berdasarkan jenisnya:\n', 'Topik: Penyakit Jantung, Subtopik: Pengertian Penyakit Jantung \n Penyakit jantung adalah kondisi ketika bagian jantung yang meliputi pembuluh darah jantung, selaput jantung, katup jantung, dan otot jantung mengalami gangguan. Penyakit jantung bisa disebabkan oleh berbagai hal, seperti sumbatan pada pembuluh darah jantung, peradangan, infeksi, atau kelainan bawaan.\nJantung adalah organ vital yang terdiri dari otot dan terbagi menjadi empat ruang. Ruang jantung dibatasi oleh katup jantung yang berfungsi mengatur aliran darah agar bergerak ke satu arah.\n\nPada dinding jantung, terdapat pembuluh darah jantung atau arteri koroner yang mengalirkan darah kaya oksigen ke seluruh bagian jantung. Pembuluh ini memiliki dua cabang, yaitu pembuluh darah koroner kanan dan kiri.\nJantung juga memiliki dua selaput yang disebut perikardium. Fungsinya adalah untuk melindungi jantung, menjaga posisi jantung tetap pada tempatnya, dan mencegah terjadinya luka akibat gesekan ketika berdenyut.\n']","Penyebab umum seseorang terkena penyakit jantung meliputi faktor-faktor seperti hipertensi, tingginya kadar cholesterol dalam darah (hiperkolesterolemia), kebiasaan merokok, diabetes, obesitas, jarang olahraga, dan kebiasaan sering mengonsumsi minuman beralkohol berlebihan.",1.0,0.5797757128215334,0.9999999999666667,0.6
Bagaimana pola hidup yang benar untuk menyembuhkan penyakit jantung?,Menjalani pola hidup sehat dapat mencegah perburukan penyakit jantung. Beberapa cara yang dapat dilakukan adalah:\n\nBerhenti merokok\nBerolahraga ringan 30 menit sehari\nMengonsumsi makanan rendah lemak dan rendah garam\nMembatasi konsumsi minuman beralkohol,"['Topik: Penyakit Jantung, Subtopik: Pengobatan Penyakit Jantung: Perbaikan Gaya Hidup \n Menjalani pola hidup sehat dapat mencegah perburukan penyakit jantung. Beberapa cara yang dapat dilakukan adalah:\n- Berhenti merokok\n- Berolahraga ringan 30 menit sehari\n- Mengonsumsi makanan rendah lemak dan rendah garam\n- Membatasi konsumsi minuman beralkohol\n', 'Topik: Penyakit Jantung, Subtopik: Pengobatan Penyakit Jantung \n Pengobatan penyakit jantung tergantung pada jenis penyakitnya. Sebagai contoh, dokter akan meresepkan antibiotik guna mengatasi penyakit jantung akibat infeksi. Sementara untuk mengatasi penyakit jantung koroner, dokter akan meresepkan obat-obatan dan menyarankan pasien mengubah gaya hidup menjadi lebih sehat.\nPada umumnya, metode pengobatan penyakit jantung meliputi:\n', 'Topik: Penyakit Jantung, Subtopik: Penyebab Penyakit Jantung: Faktor Risiko Penyakit Jantung \n Penyakit jantung lebih berisiko terjadi pada orang dengan faktor-faktor berikut:\n- Rokok\nKandungan nikotin dan karbonmonoksida di dalam asap rokok dapat merusak lapisan dalam jantung dan menyempitkan pembuluh darah. Oleh sebab itu, serangan jantung lebih sering terjadi pada perokok.\n- Riwayat keluarga\nRisiko terserang penyakit jantung cukup tinggi jika memiliki memiliki ayah atau saudara laki-laki yang terkena penyakit jantung sebelum usia 55 tahun. Risiko yang sama juga bisa dialami jika memiliki ibu atau saudara perempuan yang menderita penyakit jantung sebelum usia 65 tahun\n- Pola makan buruk\nKonsumsi makanan tinggi lemak, gula, garam, dan kolesterol, bisa meningkatkan risiko penyakit jantung.\n- Hipertensi\nTekanan darah tinggi yang tidak terkendali dapat membuat pembuluh darah menebal sehingga mempersempit aliran darah.\n- Kadar kolesterol tinggi\nKolesterol tinggi dan trigliserida yang berlebihan dapat membentuk timbunan plak di pembuluh darah. Hal ini kemudian dapat meningkatkan risiko terjadinya aterosklerosis.\n- Diabetes\nDiabetes yang tidak terkontrol dapat menimbulkan komplikasi pada pembuluh darah sehingga mengakibatkan penyakit jantung koroner.\n- Kurang menjaga kebersihan diri\nTidak rutin mencuci tangan atau menyikat gigi dapat membuat bakteri dan virus masuk ke dalam tubuh dan memicu infeksi jantung.\n- Usia\nBertambahnya usia dapat meningkatkan risiko otot jantung melemah dan menebal. Pertambahan usia juga menyebabkan pembuluh darah menjadi lebih kaku sehingga tekanan darah lebih tinggi.\n- Jenis kelamin\nPria lebih berisiko terserang penyakit jantung daripada wanita. Namun, risiko penyakit jantung akan meningkat pada wanita setelah masa menopause.\nSelain sejumlah faktor di atas, kurang berolahraga, stres berat, dan mengalami obesitas juga bisa meningkatkan risiko penyakit jantung.\n']","Pola hidup yang benar untuk menyembuhkan penyakit jantung meliputi beberapa aspek penting, di antaranya:\n\n1. Konsumsi makanan sehat: Mengonsumsi makanan rendah lemak dan rendah garam, serta tingkat diet tinggi karbohidrat seperti buah-buahan, sayuran, dan kedelai dapat membantu mengurangi berat badan dan menurunkan risiko penyakit jantung.\n2. Kegemaran obesitas: Mengurangi bobot badan melalui diet yang sehat dan olahraga secara teratur dapat mencegah timbulnya obesitas, yang konsumsi makanan tinggi lemak dan gula juga bisa meningkatkan risiko penyakit jantung.\n3. Olahraga aktif: Berolahraga ringan seperti berjalan atau bersepeda 30 menit perhari dapat membantu mengurangi tekanan darah dan meningkatkan fungsi jantung, serta mengurangi risiko penyakit jantung.\n4. Penghentian merokok: Menghentikan merokok secara total untuk mencegah kerusakan pada sel-sel jantung akibat asap rokok dan meningkatkan resikonya atas penyakit jantung.\n5. Penghindaran minuman beralkohol: Mengurangi konsumsi minuman beralkohol dapat mencegah peningkatan tekanan darah dan risiko lain yang berkaitan dengan penyakit jantung.\n6. Penghentian merokok: Menghentikan merokok secara total untuk mencegah kerusakan pada sel-sel jantung akibat asap rokok dan meningkatkan resikonya atas penyakung jantung.",0.7857142857142857,0.578851729564085,0.9999999999666667,1.0
Bagaimana gejala penyakit gagal jantung?,"Gejala utama yang timbul akibat gagal jantung antara lain:\n\nSesak napas\nMudah lelah\nPembengkakan di kaki dan pergelangan kaki\n\nSelain beberapa gejala utama di atas, ada beberapa keluhan lain yang dapat muncul, yaitu:\n\nBatuk terus-menerus yang memburuk di malam hari\nBerat badan naik atau turun secara drastis\nRasa cemas dan gelisah\nHilang nafsu makan\nPerut kembung\nMual\nLinglung atau penurunan kesadaran","['Topik: Gagal Jantung, Subtopik: Gejala Gagal Jantung \n Gejala gagal jantung dapat bervariasi pada setiap penderitanya. Gejalanya juga bisa muncul secara tiba-tiba atau berkembang secara perlahan selama beberapa minggu atau beberapa bulan.\nGejala utama yang timbul akibat gagal jantung antara lain:\n- Sesak napas\n- Mudah lelah\n- Pembengkakan di kaki dan pergelangan kaki\nSelain beberapa gejala utama di atas, ada beberapa keluhan lain yang dapat muncul, yaitu:\n- Batuk terus-menerus yang memburuk di malam hari\n- Berat badan naik atau turun secara drastis\n- Rasa cemas dan gelisah\n- Hilang nafsu makan\n- Perut kembung\n- Mual\n- Linglung atau penurunan kesadaran\nPada gagal jantung ringan, gejala mungkin tidak muncul meski penderita sedang beraktivitas. Akan tetapi, pada gagal jantung yang parah, gejala bisa muncul saat penderita beraktivitas atau ketika sedang beristirahat.\n', 'Topik: Gagal Jantung, Subtopik: Penyebab Gagal Jantung \n Gagal jantung disebabkan oleh kondisi atau penyakit yang menyebabkan jantung menjadi lemah, kaku, dan bekerja secara berlebihan dalam jangka panjang. Gagal jantung juga dapat disebabkan oleh kerusakan atau kelainan pada jantung, seperti pada otot atau katup jantung.\nBerikut ini adalah sejumlah kondisi atau penyakit yang menyebabkan gagal jantung:\n', 'Topik: Gagal Jantung, Subtopik: Pengertian Gagal Jantung \n Gagal jantung adalah kondisi ketika jantung melemah sehingga tidak mampu memompa darah yang cukup ke seluruh tubuh. Kondisi ini dapat terjadi pada siapa saja, tetapi lebih sering terjadi pada orang berusia di atas 65 tahun.\nGagal jantung atau heart failure juga dikenal dengan gagal jantung kongestif. Terlepas dari namanya, kondisi ini bukan berarti jantung benar-benar berhenti berfungsi, melainkan jantung tidak bisa berfungsi dengan baik.\n\n']","Penyakit gagal jantung, atau yang sering disebut heart failure, bisa memiliki berbagai gejala yang bervariasi antara individu dan kadang-kadang muncul tiba-tiba atau berkembang perlahan. Gejala utama termasuk:\n\n1. Sesak napas (dyspnea), biasanya saat beraktivitas atau saat tidur.\n2. Mudah lelah, yang dapat membuat seseorang merasa cemas dan kelelahan secara mendadak.\n3. Pembengkakan di kaki dan pergelangan kaki, yang bisa disebabkan oleh penyakit venous stasis atau oedema.\n4. Batuk terus-menerus yang memburuk di malam hari, seringkali akibat nyeri punggung atau pernapasan basah.\n5. Berat badan naik atau turun secara drastis, yang bisa disebabkan oleh perdarahan atau penyakit inflammatoire.\n6. Rasa cemas dan gelisah, serta hilang nafsu makan.\n7. Perut kembung, mual, dan linggung, yang dapat disebabkan oleh sistem peredaran darah yang tidak normal.\n8. Linglung atau penurunan kesadaran, yang bisa merupakan gejala serius dan menandakan bahwa seseorang mungkin kehilangan cukup oksigen untuk seluruh tubuhnya.\n\nGejala ini bisa muncul pada gagal jantung ringan atau parah, dari yang tidak begitu nyata hingga yang memerlukan perawatan medis intensif. Dalam kasus gagal jantung ringan, beberapa gejala mungkin tersembunyi dan seseorang tetap aktif selama hidupnya; sedangkan pada gagal jantung parah, gejala bisa saja muncul bahkan saat tidur atau beraktivitas.",0.64,0.4993647082875166,0.9999999999,1.0
Apa saja obat yang direkomendasikan untuk penderita penyakit gagal jantung?,"Beberapa jenis obat yang dapat diresepkan adalah:\n\nDiuretik, seperti spironolactone, furosemide, indapamide, dan acetazolamide untuk mencegah pengumpulan cairan di dalam tubuh\nPenghambat beta, seperti carvedilol dan bisoprolol, untuk memperlambat jantung dan menurunkan tekanan darah\nACE inhibitor, seperti lisinopril, ramipril, dan perindopril, untuk mengurangi ketegangan pada pembuluh darah, menurunkan tekanan darah, dan melancarkan aliran darah\nAngiotensin II receptor blockers (ARB), seperti candesartan, valsartan, dan telmisartan, untuk mengurangi ketegangan pada pembuluh darah pada pasien yang tidak cocok dengan ACE inhibitor\nDigoxin, untuk meningkatkan kekuatan otot jantung\nIvabradine, untuk memperlambat laju denyut jantung\nTolvaptan, untuk mengembalikan kadar natrium darah yang dapat menurun pada pasien gagal jantung\nEmpagliflozin, untuk menurunkan tekanan darah dan beban kerja jantung pada pasien yang juga memiliki diabetes tipe 2.","['Topik: Gagal Jantung, Subtopik: Pengobatan Gagal Jantung \n Gagal jantung merupakan kondisi yang terjadi dalam jangka panjang. Oleh sebab itu, pengobatan yang dilakukan bertujuan untuk:\n- Meringankan gejala gagal jantung\n- Meningkatkan kekuatan jantung\n- Mencegah terjadinya komplikasi\nMetode pengobatan gagal jantung akan disesuaikan dengan usia pasien, penyebab dan tingkat keparahannya, serta penyakit lain yang menyertai. Metode pengobatan gagal jantung dapat berupa:\n', 'Topik: Gagal Jantung, Subtopik: Gejala Gagal Jantung \n Gejala gagal jantung dapat bervariasi pada setiap penderitanya. Gejalanya juga bisa muncul secara tiba-tiba atau berkembang secara perlahan selama beberapa minggu atau beberapa bulan.\nGejala utama yang timbul akibat gagal jantung antara lain:\n- Sesak napas\n- Mudah lelah\n- Pembengkakan di kaki dan pergelangan kaki\nSelain beberapa gejala utama di atas, ada beberapa keluhan lain yang dapat muncul, yaitu:\n- Batuk terus-menerus yang memburuk di malam hari\n- Berat badan naik atau turun secara drastis\n- Rasa cemas dan gelisah\n- Hilang nafsu makan\n- Perut kembung\n- Mual\n- Linglung atau penurunan kesadaran\nPada gagal jantung ringan, gejala mungkin tidak muncul meski penderita sedang beraktivitas. Akan tetapi, pada gagal jantung yang parah, gejala bisa muncul saat penderita beraktivitas atau ketika sedang beristirahat.\n', 'Topik: Gagal Jantung, Subtopik: Penyebab Gagal Jantung \n Gagal jantung disebabkan oleh kondisi atau penyakit yang menyebabkan jantung menjadi lemah, kaku, dan bekerja secara berlebihan dalam jangka panjang. Gagal jantung juga dapat disebabkan oleh kerusakan atau kelainan pada jantung, seperti pada otot atau katup jantung.\nBerikut ini adalah sejumlah kondisi atau penyakit yang menyebabkan gagal jantung:\n']","Pada umumnya, obat-obatan terapi gagal jantung meliputi beberapa kelompok zat atau preparat, di antaranya adalah:\n\n1. Angiotensin II receptor antagonist (ARBs): sarbesi dan losartan. ARB merupakan obat yang umum digunakan untuk mengontrol tekanan darah dan menjaga fungsi jantung setelah gagal jantung.\n2. Beta bloker: labetalol, metoprolol, bisoprolol, atau acebutolol. Obat ini dapat memperkecil sistolik tekanan darah, mengurangi denyut nadi dan menekan jumlah hormon yang memicu konstriksi otot jantung.\n3. Diuretik: spironolakton atau furosemid. Obat ini digunakan untuk membersihkan air di dalam tubuh, mengurangi angka berat badan ringan, dan menekan gejala sesak napas penderita gagal jantung.\n4. Angiotensin konvertase inhibitor (AKI): enalapril, lisinopril atau ramipril. Obat ini digunakan untuk mengurangi tekanan darah dan menekan jumlah hormon yang memicu konstriksi otot jantung.\n5. Aliskiren: obat baru yang direkomendasikan untuk penderita gagal jantung dengan penyakit ginjal atau hipertensi.\n6. Antiplatik: aspirin dan clopidogrel. Obat ini digunakan untuk mencegah terjadinya trombosis atau tersumbatnya arteri pada pasien gagal jantung.\n7. Kortikosteroid seperti methylprednisolone: obat yang diberikan kepala penyakit infeksi akut di jaringan otak, yang bisa menyebabkan gagal jantung atau meningkatkan kerusakan jantung lain.\n8. Digoxin: obat ini digunakan untuk mengontrol denyut nadi dan mencegah terjadinya pendarahan di jaringan otak.\n9. Pemberian vitamin D secara ekstensif bagi pasien gagal jantung yang memiliki defisiensi vitamin D, khususnya untuk mereka yang mengalami penurunan fungsi jantung.\n10. Obat-obatan lain seperti antioksidan dan antidepresan juga dapat digunakan dalam beberapa kasus untuk mencegah atau mengontrol gejala gagal jantung.",0.0,0.4319934348843228,0.9999999999,0.0
Apa saja hal yang membuat seseorang memiliki risiko tinggi mengidap penyakit gagal jantung?,"Ada beberapa faktor yang dapat meningkatkan risiko terjadinya gagal jantung pada seseorang, yaitu:\n\nBerusia di atas 65 tahun\nMemiliki keluarga dengan riwayat gagal jantung\nMemiliki berat badan berlebih atau obesitas\nMerokok\nSering mengonsumsi makanan tinggi lemak dan kolesterol\nJarang berolahraga\nMengonsumsi minuman beralkohol secara berlebihan\nMengonsumsi obat-obatan tertentu, seperti obat pereda nyeri dan obat antihipertensi","['Topik: Gagal Jantung, Subtopik: Penyebab Gagal Jantung: Faktor Risiko Gagal Jantung \n Meski dapat terjadi pada siapa saja, ada beberapa faktor yang dapat meningkatkan risiko terjadinya gagal jantung pada seseorang, yaitu:\n- Berusia di atas 65 tahun\n- Memiliki keluarga dengan riwayat gagal jantung\n- Memiliki berat badan berlebih atau obesitas\n\n- Merokok\n- Sering mengonsumsi makanan tinggi lemak dan kolesterol\n\n- Jarang berolahraga\n- Mengonsumsi minuman beralkohol secara berlebihan\n- Mengonsumsi obat-obatan tertentu, seperti obat pereda nyeri dan obat antihipertensi\n', 'Topik: Gagal Jantung, Subtopik: Penyebab Gagal Jantung: 8. Penyakit jantung bawaan \n Pada beberapa kasus, bayi dapat terlahir dengan katup jantung yang tidak sempurna. Kondisi ini menyebabkan bagian jantung yang sehat harus bekerja lebih keras dalam memompa darah sehingga berpotensi mengakibatkan gagal jantung.\n', 'Topik: Gagal Jantung, Subtopik: Penyebab Gagal Jantung \n Gagal jantung disebabkan oleh kondisi atau penyakit yang menyebabkan jantung menjadi lemah, kaku, dan bekerja secara berlebihan dalam jangka panjang. Gagal jantung juga dapat disebabkan oleh kerusakan atau kelainan pada jantung, seperti pada otot atau katup jantung.\nBerikut ini adalah sejumlah kondisi atau penyakit yang menyebabkan gagal jantung:\n']","Hal-hal yang membuat seseorang memiliki risiko tinggi mengidap penyakit gagal jantung termasuk usia di atas 65 tahun, riwayat keluarga dengan penyakit gagal jantung, berat badan berlebih atau obesitas, meroket, sering mengonsumsi makanan tinggi lemak dan kolesterol, jarang berolahraga, paparan radikal, penyalahgunaan obat-obatan tertentu seperti obat pereda nyeri dan obat antihipertensi.",0.875,0.9283663097794088,0.8333333332916666,1.0
Apa saja faktor risiko seseorang terkena serangan jantung?,"Penyakit jantung koroner merupakan penyebab utama terjadinya serangan jantung. Oleh sebab itu, orang dengan faktor risiko penyakit jantung koroner juga berisiko terkena serangan jantung, antara lain;\n\nBerusia lanjut (≥45 tahun pada pria atau ≥55 tahun pada wanita)\nMenderita tekanan darah tinggi atau hipertensi\nMenderita kolesterol tinggi atau trigliserida tinggi\nMengalami diabetes\nMengalami obesitas\nMengalami stres\nMemiliki keluarga yang pernah mengalami serangan jantung\nJarang berolahraga\nMerokok","['Topik: Serangan Jantung, Subtopik: Penyebab Serangan Jantung: Faktor Risiko Serangan Jantung \n Seperti yang telah disebutkan sebelumnya, penyakit jantung koroner merupakan penyebab utama terjadinya serangan jantung. Oleh sebab itu, orang dengan faktor risiko penyakit jantung koroner juga berisiko terkena serangan jantung, antara lain;\n- Berusia lanjut (  45 tahun pada pria atau  55 tahun pada wanita)\n- Menderita tekanan darah tinggi atau hipertensi\n- Menderita kolesterol tinggi atau trigliserida tinggi\n\n- Mengalami diabetes\n- Mengalami obesitas\n- Mengalami stres\n\n- Memiliki keluarga yang pernah mengalami serangan jantung\n- Jarang berolahraga\n- Merokok\nRisiko terjadinya serangan jantung juga lebih tinggi pada penderita penyakit autoimun, seperti lupus, dan wanita yang mengalami preeklamsia saat hamil.\n', 'Topik: Serangan Jantung, Subtopik: Pencegahan Serangan Jantung: Berhenti merokok \n Merokok merupakan faktor risiko utama serangan jantung. Hal ini karena rokok bisa menyebabkan aterosklerosis di pembuluh darah, serta dapat meningkatkan tekanan darah.\n', 'Topik: Serangan Jantung, Subtopik: Penyebab Serangan Jantung \n Sama seperti organ lain di dalam tubuh, jantung membutuhkan pasokan darah yang mengandung oksigen secara terus menerus. Jika tidak mendapatkan pasokan darah yang cukup, otot-otot jantung akan rusak dan jantung tidak bisa mengalirkan darah ke seluruh tubuh.\nSerangan jantung terjadi ketika pasokan darah ke otot jantung terganggu. Beberapa faktor yang dapat menyebabkan terjadinya serangan jantung, yaitu:\n']","Faktor risiko terjadinya serangan jantung mencakup berbagai aspek kesehatan dan kehidupan, seperti usia, penyakit jantung, faktor gizi, stres, obesitas, aktivitas fisik, merokok, tekanan darah tinggi, kolesterol tinggi, diabetes, serta aspek familial dan medis lainnya. Berikut adalah beberapa faktor risiko utama yang mempengaruhi terjadinya serangan jantung:\n\n1. Usia: Semakin tua umur, semakin tinggi resiko terkena serangan jantung.\n2. Penyakit Jantung Koroner: Orang yang menderita penyakit ini memiliki risiko lebih tinggi untuk mengalami serangan jantung.\n3. Tekanan Darah Tinggi: Mengidap hipertensi meningkatkan resiko terkena serangan jantung, khususnya pada orang yang menderita tekanan darah tinggi lama.\n4. Kolesterol dan Trigliserida Tinggi: Penyakit ini dapat menyumbat arteri dan menurunkan aliran darah ke jantung.\n5. Diabetes Mellitus: Mengidap DM atau diabetes memiliki risiko lebih tinggi untuk terkena serangan jantung.\n6. Obesitas: Keadaan obesitas juga dianggap sebagai faktor risiko utama dalam mengancam kesehatan jantung, terutama pada perut yang membosankan (abdomen obesity).\n7. Stres Emosi: Kondisi stress dan emosional dapat meningkatkan risiko serangan jantung, terutama berkaitan dengan faktor gangguan metabolisme.\n8. Keluarga Yang Mengalami Serangan Jantung: Adanya riwayat keluarga yang mengalami penyakit jantung atau serangan jantung juga mempengaruhi resiko terjadinya penyakit ini.\n9. Jarang Berolahraga: Tidak melakukan aktivitas fisik seperti jogging, bersepeda, maupun bergerak-gerak lainnya dapat meningkatkan risiko serangan jantung.\n10. Merokok: Minum alkohol dan merokok juga termasuk dalam kategori faktor risiko utama terkena penyakit jantung, yang berkaitan dengan kerusakan pada arteri dan meningkatnya tekanan darah.\n11. Penyakit Autoimun: Seperti lupus atau gagal ginjal akibat diabetes, juga mempunyai risiko tinggi terkena serangan jantung.\n12. Preeklamsia: Wanita yang mengalami preeklamsia saat hamil cenderung memiliki risiko lebih tinggi untuk mengidap penyakit jantung setelah melahirkan.",0.9285714285714286,0.5705662053056644,0.9999999999666667,1.0
Apa saja hal yang menunjukkan gejala penyakit jantung?,"Serangan jantung bisa muncul secara mendadak dengan beberapa gejala berikut:\n\nNyeri dada sebelah kiri seperti tertekan atau tertindih, yang dapat menjalar ke daerah leher, rahang, lengan, atau punggung\nGangguan pencernaan, seperti mual, muntah, atau sakit perut\nBatuk atau mengi\nSesak napas\nPusing\nKeringat dingin\nGelisah dan cemas\nPenurunan kesadaran","['Topik: Serangan Jantung, Subtopik: Pencegahan Serangan Jantung: Menjalani pemeriksaan kesehatan secara rutin \n Rutin menjalani pemeriksaan kesehatan setidaknya 1 tahun sekali dapat membantu mendeteksi penyakit jantung lebih dini. Meski cara deteksi penyakit jantung lewat jari bisa dilakukan secara mandiri, namun untuk memastikan kondisi kesehatan sebenarnya, Anda sebaiknya melakukan pemeriksaan kesehatan rutin ke fasilitas kesehatan. Selain penyakit jantung, pemeriksaan ini juga dapat mendeteksi gangguan pada tekanan darah, kadar gula darah dan kolesterol, serta berbagai penyakit lainnya.\n', 'Topik: Serangan Jantung, Subtopik: Komplikasi Serangan Jantung: Gagal jantung \n Serangan jantung dapat memicu gagal jantung. Kondisi ini membuat jantung tidak dapat secara efektif memompa darah ke seluruh tubuh. Gejalanya berupa sesak napas, cepat merasa lelah, dan bengkak pada tungkai.\n', 'Topik: Serangan Jantung, Subtopik: Pencegahan Serangan Jantung: Menjaga kadar gula darah dan tekanan darah \n Dengan mengendalikan kadar gula darah dan tekanan darah, risiko terjadinya penyakit jantung koroner yang menjadi penyebab utama serangan jantung juga berkurang.\n']","1. Sesak napas, termasuk saat aktivitas ringan atau tidur normal.\n2. Merasa cepat lelah dan kelelahan yang tak terkendali.\n3. Bengkak pada tungkai (padat dan tampak menyusahkan).",0.0,0.34441607475038877,0.0,0.3333333333333333
Bagaimana pertolongan pertama untuk penderita penyakit jantung?,"Lakukan pertolongan pertama berupa cardiopulmonary resuscitation (CPR) atau resusitasi jantung paru (RJP). Namun, jika memungkinkan, bawalah penderita langsung ke instalasi gawat darurat (IGD) rumah sakit terdekat.","['Topik: Serangan Jantung, Subtopik: Pencegahan Serangan Jantung: Menjalani pemeriksaan kesehatan secara rutin \n Rutin menjalani pemeriksaan kesehatan setidaknya 1 tahun sekali dapat membantu mendeteksi penyakit jantung lebih dini. Meski cara deteksi penyakit jantung lewat jari bisa dilakukan secara mandiri, namun untuk memastikan kondisi kesehatan sebenarnya, Anda sebaiknya melakukan pemeriksaan kesehatan rutin ke fasilitas kesehatan. Selain penyakit jantung, pemeriksaan ini juga dapat mendeteksi gangguan pada tekanan darah, kadar gula darah dan kolesterol, serta berbagai penyakit lainnya.\n', 'Topik: Serangan Jantung, Subtopik: Pengobatan Serangan Jantung \n Setelah seseorang terkena serangan jantung, jaringan otot jantung dapat kehilangan oksigen sehingga akhirnya rusak dan mati. Tindakan yang perlu dilakukan untuk mencegah berlanjutnya kerusakan jantung adalah mengembalikan aliran darah secepatnya, baik dengan obat-obatan maupun operasi.\n', 'Topik: Serangan Jantung, Subtopik: Pengertian Serangan Jantung \n Serangan jantung adalah gangguan jantung serius ketika otot jantung tidak mendapat aliran darah. Kondisi ini akan mengganggu fungsi jantung dalam mengalirkan darah ke seluruh tubuh. Serangan jantung dapat menyebabkan kematian bila tidak segera tertangani.\nSerangan jantung, atau disebut juga infark miokard, terjadi akibat terhambatnya aliran darah ke otot jantung. Penyebab utama kondisi ini adalah penyakit jantung koroner.\n\nPenyakit jantung koroner terjadi ketika pembuluh darah koroner yang memasok darah ke jantung tersumbat. Penyumbatan ini terjadi karena timbunan kolesterol yang membentuk plak di dinding pembuluh darah.\n']","Pertolongan pertama untuk penderita penyakit jantung, atau sering disebut infark miokard, melibatkan beberapa langkah dasar dan cepat untuk menangani situasi darurat ini. Berikut adalah langkah-langkah umum yang dapat diambil:\n\n1. Panggil 911 atau panggil operator bencana jika Anda mengeluhkan gejolak, nyawa tertekan, ataupun menurunnya kesadaran penderita serta penyakit jantung lainnya yang tampak parah.\n2. Beri obat ASA (asprin) atau suplemen asam acetilsalisilat kepada penderita dengan alis-alis untuk mengurangi rasa sakit dan menghalang penyumbatan darah lebih lanjut. Jangan memberikan makanan, minuman keras, obat atau suplemen lain tanpa persetujuan dokter.\n3. Beri posisi yang nyaman untuk penderita, seperti berbaring di belakang dan mengayunkan jari-jarinya secara perlahan. Posisi ini dapat membantu aliran darah tetap terjaga ke otak meskipun jantung tidak bekerja secara normal.\n4. Jika penderita bernafas sulit, beri topik untuk membantunya menghindari nafas yang lemas atau tak teratur (hiperventilasi).\n5. Berikan tawin dan peringatan kepada pasien agar tetap tenang serta segera mencarinya bantuan medis setelah serangan jantung berhenti.\n6. Jika diperlukan, lakukan resusitasi dada (CPR) atau menggunakan defibrillator perlahan-lahan untuk memulai denyut jantung dan menghindari kerusakan lebih lanjut pada otak akibat kekurangan oksigen.\n\nPenting untuk diingat bahwa setiap situasi serius dengan penyakit jantung atau infark miokard memerlukan bantuan medis cepat dan tanggap, khususnya dalam hal ini, menghubungi 911 atau panggilan bencana medis lainnya untuk mendapatkan dukungan yang lebih dahulu.",0.08333333333333333,0.6042653893289486,0.5833333333041666,0.0
Apa saja gejala pada seseorang yang mengalami hipotensi?,"Hipotensi tidak selalu menimbulkan gejala. Jika muncul gejala, penderita hipotensi dapat merasakan keluhan berikut:\n\nPusing\nMual dan muntah\nLemas\nPandangan kabur\nLinglung\nSulit berkonsentrasi\nTubuh terasa tidak stabil\nSesak napas\nPingsan","['Topik: Hipotensi, Subtopik: Gejala Hipotensi \n Hipotensi tidak selalu menimbulkan gejala. Jika muncul gejala, penderita hipotensi dapat merasakan keluhan berikut:\n- Pusing\n- Mual dan muntah\n- Lemas\n- Pandangan kabur\n- Linglung\n- Sulit berkonsentrasi\n- Tubuh terasa tidak stabil\n- Sesak napas\n- Pingsan\n', 'Topik: Hipotensi, Subtopik: Gejala Hipotensi \n Lakukan pemeriksaan ke dokter jika Anda mengalami gejala yang telah disebutkan di atas. Bila setelah diperiksa tekanan darah Anda di bawah normal, dokter akan melakukan pemeriksaan lanjutan untuk mencari tahu penyebab hipotensi tersebut.\nSegera ke dokter atau rumah sakit terdekat jika mengalami hipotensi dengan penurunan kesadaran dan gejala syok, seperti jantung berdebar, keringat dingin, atau sesak napas. Tekanan darah yang sangat rendah hingga menimbulkan syok perlu segera ditangani, karena dapat membahayakan nyawa.\n', 'Topik: Hipotensi, Subtopik: Pengertian Hipotensi \n Darah rendah atau hipotensi adalah kondisi ketika tekanan darah kurang dari 90/60 mmHg. Hipotensi umumnya tidak bergejala dan dapat dialami oleh siapa saja. Namun, pada beberapa orang, hipotensi dapat menyebabkan pusing, lemas, hingga pingsan.\nTekanan darah normal berkisar antara 90/60 mmHg dan 120/80 mmHg. Seseorang dapat dikatakan menderita hipotensi jika tekanan darahnya berada di bawah rentang tersebut.\n\nHipotensi dapat menjadi tanda dari suatu penyakit atau kondisi yang sedang diderita. Pada beberapa kasus yang parah, hipotensi dapat mengancam nyawa sehingga butuh ditangani segera.\n']","Gejala penderita hipotensi, seperti yang telah dijelaskan dalam konteks tersebut, termasuk:\n\n1. Pusing\n2. Mual dan muntah\n3. Lemas\n4. Pandangan kabur\n5. Linglung\n6. Sulit berkonsentrasi\n7. Tubuh terasa tidak stabil\n8. Sesak napas\n9. Pingsan",1.0,0.5577634262360539,0.9999999999666667,1.0
Berapa tekanan darah yang menandakan seseorang mengalami hipotensi?,Tekanan darah normal berkisar antara 90/60 mmHg dan 120/80 mmHg. Seseorang dapat dikatakan menderita hipotensi jika tekanan darahnya berada di bawah rentang tersebut.,"['Topik: Hipotensi, Subtopik: Pengertian Hipotensi \n Darah rendah atau hipotensi adalah kondisi ketika tekanan darah kurang dari 90/60 mmHg. Hipotensi umumnya tidak bergejala dan dapat dialami oleh siapa saja. Namun, pada beberapa orang, hipotensi dapat menyebabkan pusing, lemas, hingga pingsan.\nTekanan darah normal berkisar antara 90/60 mmHg dan 120/80 mmHg. Seseorang dapat dikatakan menderita hipotensi jika tekanan darahnya berada di bawah rentang tersebut.\n\nHipotensi dapat menjadi tanda dari suatu penyakit atau kondisi yang sedang diderita. Pada beberapa kasus yang parah, hipotensi dapat mengancam nyawa sehingga butuh ditangani segera.\n', 'Topik: Hipotensi, Subtopik: Pengertian Hipotensi \n Tekanan darah normal berkisar antara 90/60 mmHg dan 120/80 mmHg. Seseorang dapat dikatakan menderita hipotensi jika tekanan darahnya berada di bawah rentang tersebut.\n\nHipotensi dapat menjadi tanda dari suatu penyakit atau kondisi yang sedang diderita. Pada beberapa kasus yang parah, hipotensi dapat mengancam nyawa sehingga butuh ditangani segera.\n', 'Topik: Hipotensi, Subtopik: Gejala Hipotensi \n Lakukan pemeriksaan ke dokter jika Anda mengalami gejala yang telah disebutkan di atas. Bila setelah diperiksa tekanan darah Anda di bawah normal, dokter akan melakukan pemeriksaan lanjutan untuk mencari tahu penyebab hipotensi tersebut.\nSegera ke dokter atau rumah sakit terdekat jika mengalami hipotensi dengan penurunan kesadaran dan gejala syok, seperti jantung berdebar, keringat dingin, atau sesak napas. Tekanan darah yang sangat rendah hingga menimbulkan syok perlu segera ditangani, karena dapat membahayakan nyawa.\n']","Tekanan darah normal berkisar antara 90/60 mmHg dan 120/80 mmHg. Seseorang dapat dikatakan menderita hipotensi jika tekanan darahnya berada di bawah rentang tersebut, yaitu kurang dari 90/60 mmHg.",1.0,0.5545643871915649,0.9999999999666667,1.0
Bagaimana metode utama dalam pengobatan penyakit hipotensi?,"Metode utama untuk menangani hipotensi adalah perubahan pola makan dan gaya hidup, seperti:\n\nMemperbanyak konsumsi cairan, karena cairan dapat meningkatkan volume darah dan membantu mencegah dehidrasi\nBerolahraga secara teratur untuk meningkatkan tekanan darah\nMengonsumsi suplemen atau obat darah rendah yang bisa didapatkan di apotek\nMenggunakan stoking khusus (stoking kompresi) pada tungkai untuk memperlancar aliran darah","['Topik: Hipotensi, Subtopik: Pengobatan Hipotensi \n Pengobatan hipotensi tergantung pada penyebab yang mendasarinya. Tujuan pengobatan adalah untuk meningkatkan tekanan darah, meredakan gejala yang muncul, dan mengobati kondisi yang menyebabkan hipotensi.\nJika hipotensi menimbulkan gejala, maka tindakan pertama yang perlu dilakukan adalah duduk atau berbaring. Setelah itu, posisikan kaki lebih tinggi dari jantung dan pertahankan posisi tersebut selama beberapa saat. Bila gejala tidak juga mereda, penanganan oleh dokter perlu dilakukan.\nMetode utama untuk menangani hipotensi adalah perubahan pola makan dan gaya hidup, seperti:\n- Memperbanyak konsumsi cairan, karena cairan dapat meningkatkan volume darah dan membantu mencegah dehidrasi\n- Berolahraga secara teratur untuk meningkatkan tekanan darah\n- Mengonsumsi suplemen atau obat darah rendah yang bisa didapatkan di apotek\n- Menggunakan stoking khusus (stoking kompresi) pada tungkai untuk memperlancar aliran darah\nJika hipotensi disebabkan oleh konsumsi obat-obatan, dokter akan mengurangi dosis atau mengganti jenis obatnya bila perlu. Selain itu, dokter juga dapat memberikan obat-obatan untuk menurunkan tekanan darah, yang disesuaikan dengan penyebab dan kondisi pasien.\nHipotensi yang disertai gejala syok membutuhkan penanganan darurat. Dokter akan memberikan cairan infus dan obat peningkat tekanan darah, seperti epinephrine atau norepinephrine untuk mencegah kerusakan fungsi organ. Transfusi darah juga dapat diberikan jika hipotensi disebabkan oleh kehilangan darah yang banyak.\nSetelah tekanan darah, detak jantung, suhu tubuh, dan pernapasan pasien stabil, dokter akan memberikan pengobatan untuk mengatasi penyebabnya. Misalnya, memberikan obat antibiotik untuk mengatasi infeksi yang sudah masuk ke dalam darah.\n', 'Topik: Hipotensi, Subtopik: Diagnosis Hipotensi \n Untuk mendiagnosis hipotensi, dokter akan melakukan tanya jawab mengenai gejala dan riwayat kesehatan pasien. Setelah itu, dokter akan melakukan pemeriksaan fisik, termasuk memeriksa tekanan darah dengan menggunakan sfigmomanometer.\nJika hasil pemeriksaan menunjukkan angka yang cukup rendah dan disertai gejala tertentu, dokter akan melakukan pemeriksaan lanjutan untuk mendeteksi kondisi atau penyakit yang menyebabkan hipotensi.\nPemeriksaan yang akan dilakukan dokter meliputi:\n- Tes darah, untuk memeriksa kadar gula dan kadar hormon dalam darah\n- Elektrokardiografi (EKG), untuk mendeteksi struktur jantung yang tidak normal dan detak jantung yang tidak beraturan\n- Ekokardiogram, untuk memeriksa fungsi jantung dan mendeteksi kelainan pada jantung\n- Uji latih jantung (stress test), untuk menilai fungsi jantung saat melakukan aktivitas, seperti berjalan atau berlari\n- Tilt table test, untuk melihat perbedaan tekanan darah saat berbaring dan berdiri pada pasien hipotensi ortostatik\n\n', 'Topik: Hipotensi, Subtopik: Pencegahan Hipotensi \n Cara terbaik untuk mencegah terjadinya hipotensi adalah dengan menghindari faktor pemicunya. Beberapa hal yang dapat dilakukan adalah:\n- Membatasi konsumsi minuman berkafein dan beralkohol\n- Mengonsumsi makanan dalam porsi kecil tetapi sering, dan tidak langsung berdiri setelah makan\n- Memosisikan kepala lebih tinggi ketika tidur\n- Berdiri secara perlahan dari posisi duduk atau berbaring\n- Tidak berdiri atau duduk terlalu lama\n- Tidak membungkuk atau mengubah posisi tubuh secara tiba-tiba\n- Tidak mengangkat beban yang terlalu berat\n- Mencukupi kebutuhan minum, minimal 8 gelas per hari\n- Berolahraga secara teratur, untuk meningkatkan otot tubuh dan melancarkan aliran darah\n- Menghindari diet rendah garam yang terlalu ketat\n']","Metode utama dalam pengobatan penyakit hipotensi meliputi beberapa langkah dasar, seperti perubahan pola makan dan gaya hidup. Berikut metode utama tersebut:\n\n1. Memperbanyak konsumsi cairan: Karena cairan dapat meningkatkan volume darah dan membantu mencegah dehidrasi, yang seringkali menyebabkan hipotensi.\n2. Berolahraga secara teratur: Aktivitas fisik akan meningkatkan tekanan darah dan mengurangi resiko munculnya hipotensi.\n3. Mengonsumsi suplemen atau obat darah rendah yang dapat didapatkan di apotek, seperti vitamin B-kompleks untuk mendukung fungsi hati yang membantu dalam metabolisme lemak dan hormon.\n4. Menggunakan stoting khusus (stoking kompresi) pada tungkai untuk memperlancar aliran darah, yang dapat meningkatkan tekanan darah secara efektif.\n5. Jika hipotensi disebabkan oleh konsumsi obat-obatan, dokter akan mengurangi dosis atau mengganti jenis obatnya bila perlu, dan memberikan obat-obatan untuk menurunkan tekanan darah yang sesuai dengan penyebab dan kondisi pasien.\n6. Hipotensi disertai gejala syok membutuhkan penanganan darurat, seperti pemberian cairan infus dan obat peningkat tekanan darah, serta transfusi darah jika hipotensi disebabkan oleh kehilangan darah yang banyak.\n7. Setelah tekanan darah, detak jantung, suhu tubuh, dan pernapasan pasien stabil, dokter akan memberikan pengobatan untuk mengatasi penyebabnya, seperti memberikan obat antibiotik untuk mengatasi infeksi yang sudah masuk ke dalam darah.",0.75,0.5733934135339264,0.9999999999,1.0
Apa gejala yang menunjukkan seseorang mengalami angin duduk?,Beberapa gejala lain yang dapat menyertai nyeri dada pada angin duduk atau angina adalah:\n\nKeringat dingin\nMual\nPusing\nLemas\nSesak napas,"['Topik: Angin Duduk, Subtopik: Gejala Angin Duduk \n Gejala utama angin duduk adalah nyeri dada yang terasa seperti ditindih atau ditekan benda berat. Nyeri yang timbul akibat angin duduk dapat menyebar ke bagian tubuh lain, seperti leher, lengan, bahu, punggung, rahang, dan gigi. Pada wanita, terkadang nyeri dada dapat terasa seperti ditusuk benda tajam.\nBeberapa gejala lain yang dapat menyertai nyeri dada pada angin duduk atau angina adalah:\n- Keringat dingin\n- Mual\n- Pusing\n- Lemas\n- Sesak napas\nGejala angin duduk lebih sering timbul saat beraktivitas dan mereda atau hilang jika beristirahat atau meminum obat. Angin duduk jenis ini disebut angin duduk stabil.\nPada kasus tertentu, angin duduk tidak hilang meski sudah beristirahat dan minum obat, atau timbul saat sedang beristirahat. Angin duduk jenis ini disebut dengan angin duduk tidak stabil.\n', 'Topik: Angin Duduk, Subtopik: Gejala Angin Duduk: Kapan harus ke dokter \n Segera ke IGD jika mengalami gejala angin duduk untuk pertama kalinya. Bila Anda sudah memiliki obat angin duduk, cepatlah minum obat dan beristirahat jika gejala muncul. \nNamun, jangan menunda untuk mencari pertolongan medis jika gejala angin duduk tidak membaik atau makin berat, terlebih bila gejala tersebut disertai dengan sesak napas, berkeringat berlebihan, atau nyeri yang menjalar ke lengan, rahang, maupun punggung. \nBila ada orang lain, mintalah pertolongannya untuk membawa Anda ke rumah sakit terdekat. Penting diingat bahwa Anda tidak boleh mengemudi seorang diri ke rumah sakit, kecuali bila tidak ada pilihan lain.\n', 'Topik: Angin Duduk, Subtopik: Komplikasi Angin Duduk \n Angin duduk dapat berkembang menjadi serangan jantung, yang ditandai dengan nyeri dada berat yang menjalar ke lengan, leher, atau punggung, disertai gejala seperti keringat berlebihan, mual, dan pusing. Jika Anda atau orang di sekitar mengalami gejala ini, segera ke IGD terdekat.\n']","Gejala utama angin duduk, atau angina, yang seringkali menunjukkan bahwa seseorang sedang mengalami masalah ini, termasuk nyeri dada yang terasa seperti ditindih atau ditekan benda berat. Nyeri yang timbul akibat angin duduk dapat menyebar ke bagian tubuh lain, seperti leher, lengan, bahu, punggung, rahang, dan gigi. Pada wanita, terkadang nyeri dada dapat terasa seperti ditusuk benda tajam.\n\nSelain itu, gejala lain yang sering disertai angin duduk atau angina adalah:\n- Keringat dingin\n- Mual\n- Pusing\n- Lemas\n- Sesak napas",0.9,0.36760435634879557,0.9999999999666667,1.0
Bagaimana pertolongan terhadap seseorang yang mengalami angin duduk?,"Segera ke IGD jika mengalami gejala angin duduk untuk pertama kalinya. Bila Anda sudah memiliki obat angin duduk, cepatlah minum obat dan beristirahat jika gejala muncul. \n\nNamun, jangan menunda untuk mencari pertolongan medis jika gejala angin duduk tidak membaik atau makin berat, terlebih bila gejala tersebut disertai dengan sesak napas, berkeringat berlebihan, atau nyeri yang menjalar ke lengan, rahang, maupun punggung. \n\nBila ada orang lain, mintalah pertolongannya untuk membawa Anda ke rumah sakit terdekat. Penting diingat bahwa Anda tidak boleh mengemudi seorang diri ke rumah sakit, kecuali bila tidak ada pilihan lain.","['Topik: Angin Duduk, Subtopik: Gejala Angin Duduk: Kapan harus ke dokter \n Segera ke IGD jika mengalami gejala angin duduk untuk pertama kalinya. Bila Anda sudah memiliki obat angin duduk, cepatlah minum obat dan beristirahat jika gejala muncul. \nNamun, jangan menunda untuk mencari pertolongan medis jika gejala angin duduk tidak membaik atau makin berat, terlebih bila gejala tersebut disertai dengan sesak napas, berkeringat berlebihan, atau nyeri yang menjalar ke lengan, rahang, maupun punggung. \nBila ada orang lain, mintalah pertolongannya untuk membawa Anda ke rumah sakit terdekat. Penting diingat bahwa Anda tidak boleh mengemudi seorang diri ke rumah sakit, kecuali bila tidak ada pilihan lain.\n', 'Topik: Angin Duduk, Subtopik: Pengertian Angin Duduk \n Angin duduk adalah nyeri dada yang disebabkan oleh berkurangnya aliran darah ke otot jantung. Kondisi ini sering kali disalahartikan dan diremehkan karena gejalanya mirip dengan masalah yang ringan. Padahal, angin duduk berkaitan erat dengan gangguan jantung yang perlu segera ditangani.\nAngina pectoris atau angin duduk ditandai dengan nyeri dada yang seperti tertindih, terbakar, atau tertusuk. Keluhan ini lebih sering muncul saat penderitanya sedang beraktivitas, yaitu ketika jantung memompa darah lebih cepat. \n\nAngin duduk dapat ditangani dengan pengobatan dari dokter dan dengan menjalani gaya hidup sehat. Jika ditangani dengan baik, penderita angin duduk dapat terhindar dari komplikasi yang serius.\n', 'Topik: Angin Duduk, Subtopik: Pengobatan Angin Duduk  \n Pengobatan angina duduk bertujuan untuk mengurangi keluhan dan mencegah terjadinya serangan jantung. Pengobatan ini umumnya melibatkan perubahan gaya hidup yang diimbangi dengan pengobatan dan prosedur medis tertentu. Perubahan gaya hidup untuk menangani angin duduk mencakup:\n- Tidak merokok\n- Memilih makanan rendah garam dan tinggi serat, seperti sayuran dan buah-buahan\n- Menghindari konsumsi makanan tinggi lemak jenuh dan minuman beralkohol\n- Menjaga berat badan ideal atau menurunkan berat badan jika overweight  atau obesitas\n\n- Berolahraga secara teratur\n- Mengelola stres dengan baik\n']","Pertolongan terhadap seseorang yang mengalami angin duduk harus segera dilakukan, khususnya jika merupakan gejala pertama kali. Berikut langkah-langkah yang perlu dilakukan untuk memberikan pertolongan:\n\n1. Segera ke IGD (Institut Gigi dan Pemipaan) atau rumah sakit terdekat untuk memeriksa diri secara lebih lanjut.\n2. Jika penderita menggunakan obat angin duduk, pastikan mereka segera minum obat sesuai dengan nasihat dokter dan beristirahat sementara menunggu untuk proses pengobatan dimulai.\n3. Bantu mencari teman atau memberi tahu keluarga untuk membawa penderita ke rumah sakit jika gejala angin duduk lebih parah, seperti disertai dengan sesak napas, berkeringat berlebihan, atau nyeri yang menjalar ke lengan, rahang, maupun punggung.\n4. Hindari mengemudi sendiri ke rumah sakit dan jangan lupa untuk meminta pertolongan medis secepat mungkin ketika penderita angin duduk terlihat dalam kondisi yang sulit.",0.8,0.6770909301574388,0.9999999999666667,1.0
Bagaimana cara mencegah penyakit angin duduk?,"Angin duduk dapat dicegah melalui beberapa cara berikut:\n\nBerolahraga secara rutin, misalnya bersepeda santai, berjalan kaki, atau berenang\nMengonsumsi makanan yang sehat untuk jantung, terutama makanan yang mengandung serat dan lemak tak jenuh, seperti sayuran, buah-buahan, ikan tuna, dan minyak zaitun\nMenghindari konsumsi makanan yang tinggi garam dan lemak jenuh, seperti santan, gorengan, keju, dan mentega\nMengonsumsi obat secara rutin sesuai anjuran dokter \nMenjaga berat badan ideal\nMenghindari konsumsi minuman beralkohol\nTidak merokok","['Topik: Angin Duduk, Subtopik: Pencegahan Angin Duduk \n Angin duduk dapat dicegah melalui beberapa cara berikut:\n- Berolahraga secara rutin, misalnya bersepeda santai, berjalan kaki, atau berenang\n- Mengonsumsi makanan yang sehat untuk jantung, terutama makanan yang mengandung serat dan lemak tak jenuh, seperti sayuran, buah-buahan, ikan tuna, dan minyak zaitun\n- Menghindari konsumsi makanan yang tinggi garam dan lemak jenuh, seperti santan, gorengan, keju, dan mentega\n- Mengonsumsi obat secara rutin sesuai anjuran dokter \n- Menjaga berat badan ideal\n\n- Menghindari konsumsi minuman beralkohol\n- Tidak merokok\nUntuk mencegah angin duduk, pastikan untuk menjalani pemeriksaan kesehatan rutin, terutama bagi yang menderita diabetes, hipertensi, atau faktor risiko lain. Pemeriksaan secara berkala dapat mengendalikan faktor risiko yang ada dengan lebih baik dan mendeteksi masalah lebih dini.\n', 'Topik: Angin Duduk, Subtopik: Pengobatan Angin Duduk  \n Pengobatan angina duduk bertujuan untuk mengurangi keluhan dan mencegah terjadinya serangan jantung. Pengobatan ini umumnya melibatkan perubahan gaya hidup yang diimbangi dengan pengobatan dan prosedur medis tertentu. Perubahan gaya hidup untuk menangani angin duduk mencakup:\n- Tidak merokok\n- Memilih makanan rendah garam dan tinggi serat, seperti sayuran dan buah-buahan\n- Menghindari konsumsi makanan tinggi lemak jenuh dan minuman beralkohol\n- Menjaga berat badan ideal atau menurunkan berat badan jika overweight  atau obesitas\n\n- Berolahraga secara teratur\n- Mengelola stres dengan baik\n', 'Topik: Angin Duduk, Subtopik: Pengobatan Angin Duduk : Obat-obatan \n Jika perubahan gaya hidup tidak cukup untuk meningkatkan kesehatan jantung dan mengatasi angin duduk, dokter akan meresepkan obat-obatan. Beberapa jenis obat yang dapat digunakan untuk mengobati angin duduk meliputi: \n- Nitrat\nObat ini berfungsi melemaskan pembuluh darah yang kaku agar darah dapat mengalir dengan lancar menuju otot Salah satu contoh obat jenis ini adalah nitrogliserin.\n\n- Pengencer darah\nObat ini berfungsi untuk mencegah sel darah menggumpal. Beberapa contoh obat dari golongan ini adalah aspirin, clopidogrel, dan ticagrelor.\n\n- Antagonis kalsium\nAntagonis kalsium dapat melancarkan aliran darah jantung dan mencegah angin duduk. Obat ini juga mampu melemaskan sel-sel otot di dalam dinding pembuluh darah. Beberapa contoh obat dari golongan ini adalah amlodipine dan diltiazem.\n- Penghambat beta\nObat penghambat beta berfungsi menurunkan tekanan darah dan denyut jantung. Dengan begitu, beban kerja jantung menjadi berkurang.\n- ACE inhibitor\nACE inhibitor berfungsi untuk melebarkan pembuluh darah dan menurunkan tekanan darah.\n- Statin\nObat ini bertujuan menurunkan kolesterol dalam darah sehingga kerusakan pembuluh darah dapat dicegah.\n']","Mencegah angin duduk sebenarnya melibatkan beberapa aspek, termasuk perubahan gaya hidup dan pengobatan medis. Berikut adalah cara mencegah penyakit angin duduk yang dapat diaplikasikan dalam kehidupan sehari-hari:\n\n1. **Perubahan Gaya Hidup:**\n   - **Berolahraga Secara Teratur**: Melakukan aktivitas fisik setidaknya 150 menit perhari, yang termasuk berjalan kaki, bersepeda, atau berenang. Aktivitas ini dapat memperkuat jantung dan mengurangi risiko angin duduk.\n   - **Mengonsumsi Makanan Sehat**: Menjaga berat badan ideal melalui diet yang seimbang dan mengkonsumsi makanan yang kaya aird fiber, seperti sayuran, buah-buahan, dan legumbres. Mengurangi asupan lemak jenuh dan garam juga penting untuk menjaga tekanan darah normal.\n   - **Mengelola Stres**: Melakukan cara-cara mengatasi stres seperti meditasi, yoga, atau berinteraksi dengan teman dan keluarga yang mendukung.\n\n2. **Pengobatan Medis:**\n   - Jika perubahan gaya hidup tidak cukup untuk mengatasi angin duduk, maka dokter akan meresepkan obat-obatan. Beberapa jenis obat yang dapat digunakan antara lain:\n     - **Nitrat**: Obat ini berfungsi melemaskan pembuluh darah sehingga darah dapat mengalir lebih lancar menuju otot jantung. Contoh obat jenis ini adalah nitrogliserin.\n     - **Pengencer Darah**: Obat ini berfungsi mencegah sel darah menggumpal, seperti aspirin atau clopidogrel.\n     - **Antagonis Kalsium**: Obat ini dapat menurunkan aliran darah jantung dan melemaskan otot di dalam pembuluh darah. Contoh obat jenis ini adalah amlodipine atau diltiazem.\n     - **Penghambat Beta**: Obat ini berfungsi menurunkan tekanan darah dan denyut jantung, mengurangi beban kerja jantung. Contoh obat jenis ini adalah labetalol atau bisoprolol.\n   - **ACE Inhibitor**: Obat ini dapat melebarkan pembuluh darah dan menurunkan tekanan darah, yang berguna untuk mengatasi hipertensi dan penyakit jantung.\n   - **Statin**: Obat ini bisa menurunkan kolesterol dalam darah sehingga kerusakan pembuluh darah dapat dicegah.\n\nDengan menerapkan prinsip-prinsip tersebut, seseorang dapat mencegah angin duduk dan mengoptimalkan kondisi jantung serta menjaga kesegaran tubuh.",0.8387096774193549,0.7449374878467471,0.99999999995,1.0
Apa saja faktor risiko penyakit emboli?,"Angin duduk dapat dicegah melalui beberapa cara berikut:\n\nBerolahraga secara rutin, misalnya bersepeda santai, berjalan kaki, atau berenang\nMengonsumsi makanan yang sehat untuk jantung, terutama makanan yang mengandung serat dan lemak tak jenuh, seperti sayuran, buah-buahan, ikan tuna, dan minyak zaitun\nMenghindari konsumsi makanan yang tinggi garam dan lemak jenuh, seperti santan, gorengan, keju, dan mentega\nMengonsumsi obat secara rutin sesuai anjuran dokter \nMenjaga berat badan ideal\nMenghindari konsumsi minuman beralkohol\nTidak merokok","['Topik: Emboli, Subtopik: Faktor risiko emboli \n Ada beberapa faktor yang dapat meningkatkan risiko seseorang mengalami emboli, yaitu:\n- Merokok\n- Berusia 60 tahun atau lebih\n- Sedang hamil\n- Mengalami berat badan berlebih atau obesitas\n- Tidak aktif bergerak untuk waktu yang lama, misalnya karena kelumpuhan atau menjalani rawat inap intensif di rumah sakit\n- Menderita penyakit jantung, kelainan katup jantung, fibrilasi atrium\n\n- Memiliki kelainan pada pembuluh darah vena\n- Menderita infeksi atau peradangan yang parah, kanker, kolesterol tinggi, atau diabetes\n- Sedang menjalani terapi hormon\n', 'Topik: Emboli, Subtopik: Pencegahan Emboli \n Emboli tidak selalu dapat dicegah. Meski demikian, ada upaya yang dapat dilakukan untuk mengurangi risiko terjadinya emboli, antara lain:\n- Rutin berolahraga, setidaknya 30 menit sehari\n- Minum air putih yang cukup\n- Menerapkan pola makan sehat dan bergizi seimbang\n- Membatasi asupan garam dengan diet rendah garam\n\n- Mempertahankan berat badan ideal\n- Berhenti merokok dan hindari konsumsi minuman beralkohol\n- Tidak duduk terlalu lama atau kurang aktif bergerak\n- Menjalani pemeriksaan kesehatan secara berkala\n', 'Topik: Emboli, Subtopik: Pengertian Emboli \n Emboli adalah kondisi ketika pembuluh darah tersumbat oleh zat asing, seperti gumpalan darah, gelembung udara, atau gumpalan kolesterol. Kondisi ini berbahaya dan harus segera diatasi, terutama bila terjadi di paru-paru, otak, atau jantung.\nEmboli menyebabkan pembuluh darah tersumbat. Penyumbatan ini dapat terjadi di pembuluh darah mana saja, mulai dari yang terkecil hingga terbesar, arteri maupun vena. Meski begitu, emboli biasanya lebih sering terjadi di arteri.\n\nEmboli yang terjadi pada arteri akan menyebabkan kurangnya asupan oksigen ke jaringan sehingga hal ini akan mengganggu fungsi jaringan atau organ. Jika tidak ditangani dengan tepat, penyumbatan ini dapat menyebabkan kerusakan permanen\nSementara itu, emboli yang terjadi pada vena akan mengganggu aliran darah yang akan kembali ke jantung. Akibatnya, darah akan membendung dan menyebabkan jaringan membengkak. Jika tidak segera ditangani, kondisi ini juga dapat merusak jaringan dan organ.\n']","Faktor risiko penyebab emboli meliputi berbagai macam kondisi dan perilaku, seperti:\n\n1. Merokok - Pernikahan rokok secara fisik dan toksin dalam rokok dapat meningkatkan resiko terjadinya penyumbatan pembuluh darah.\n2. Usia 60 tahun atau lebih - Risiko mengalami emboli akan semakin tinggi sebagai usia bertambah, khususnya jika ada faktor riwayat penyakit jantung atau stroke di keluarga.\n3. Hamil - Kehamilan dapat meningkatkan risiko terjadinya emboli akibat peningkatan tekanan darah dan fluktuasi hormon.\n4. Berat badan berlebih atau obesitas - Obesitas memicu riwayat medis kelenjar getah bening (KGB) yang tinggi, sehingga meningkat risiko terjadinya emboli.\n5. Tidak aktif bergerak secara rutin - Kegiatan fisik rendah dapat mengurangi aliran darah dan menyebabkan penggumpalan darah (thrombosis).\n6. Menderita penyakit jantung, kelainan katup jantung, fibrilasi atrium - Penyakit jantung dan kerusakan lain di dalam hati dapat menyebabkan pembengkakan darah yang berpotensi merugikan organ.\n7. Kelainan pada pembuluh darah vena - Gejala seperti varis, thrombophlebitis, dan klippings venus di kaki meningkatkan risiko terjadinya emboli dari sistem vena.\n8. Menderita infeksi atau peradangan yang parah, kanker, kolesterol tinggi, diabetes - Penyakit ini dapat mengubah aliran darah dan memicu penggumpalan darah (thrombosis).\n9. Menggunakan obat-obatan hormonal - Hormon oral seperti pil kontrasepsi dapat meningkatkan risiko terjadinya emboli, khususnya jika mengandung estrogen tinggi.",0.6,0.7034445389161009,0.49999999995,0.875
Apa saja gejala penyakit emboli yang terjadi di daerah tangan?,"Berikut adalah contoh gejala emboli yang terjadi di pembuluh darah arteri tangan atau kaki:\n\nTangan dan kaki terasa dingin dan pucat\nOtot terasa lemah, sulit bergerak\nOtot kram atau kedutan\nNyeri saat berjalan\nMati rasa atau kesemutan","['Topik: Emboli, Subtopik: Pengertian Emboli \n Emboli adalah kondisi ketika pembuluh darah tersumbat oleh zat asing, seperti gumpalan darah, gelembung udara, atau gumpalan kolesterol. Kondisi ini berbahaya dan harus segera diatasi, terutama bila terjadi di paru-paru, otak, atau jantung.\nEmboli menyebabkan pembuluh darah tersumbat. Penyumbatan ini dapat terjadi di pembuluh darah mana saja, mulai dari yang terkecil hingga terbesar, arteri maupun vena. Meski begitu, emboli biasanya lebih sering terjadi di arteri.\n\nEmboli yang terjadi pada arteri akan menyebabkan kurangnya asupan oksigen ke jaringan sehingga hal ini akan mengganggu fungsi jaringan atau organ. Jika tidak ditangani dengan tepat, penyumbatan ini dapat menyebabkan kerusakan permanen\nSementara itu, emboli yang terjadi pada vena akan mengganggu aliran darah yang akan kembali ke jantung. Akibatnya, darah akan membendung dan menyebabkan jaringan membengkak. Jika tidak segera ditangani, kondisi ini juga dapat merusak jaringan dan organ.\n', 'Topik: Emboli, Subtopik: Pengertian Emboli \n Emboli menyebabkan pembuluh darah tersumbat. Penyumbatan ini dapat terjadi di pembuluh darah mana saja, mulai dari yang terkecil hingga terbesar, arteri maupun vena. Meski begitu, emboli biasanya lebih sering terjadi di arteri.\n\nEmboli yang terjadi pada arteri akan menyebabkan kurangnya asupan oksigen ke jaringan sehingga hal ini akan mengganggu fungsi jaringan atau organ. Jika tidak ditangani dengan tepat, penyumbatan ini dapat menyebabkan kerusakan permanen\nSementara itu, emboli yang terjadi pada vena akan mengganggu aliran darah yang akan kembali ke jantung. Akibatnya, darah akan membendung dan menyebabkan jaringan membengkak. Jika tidak segera ditangani, kondisi ini juga dapat merusak jaringan dan organ.\n', 'Topik: Emboli, Subtopik: Penyebab Emboli: Gas \n Gelembung gas atau udara yang menyebabkan penyumbatan di pembuluh darah terjadi pada penyakit dekompresi. Kondisi ini biasanya dialami oleh penyelam yang terlalu cepat naik ke permukaan.\n']","Berdasarkan konteks yang diberikan, ada beberapa gejala penyakat emboli yang mungkin terjadi di daerah tangan. Gejala umum yang diakibatkan oleh emboli pada arteri tangan termasuk:\n\n1. Menguning atau menggangu warna gigi kunyah (isian gigi menjadi gelap)\n2. Nyeri di bagian dada, punggung, atau perut yang mungkin merupakan gejala dari gangguan fungsi jaringan otak akibat penyumbatan arteri tengah (istirahat).\n3. Pergeseran sensorik pada tangan berkurang atau hilang, seperti ketidakmampuan untuk merasakan sensasi dingin atau nyeri pada bagian yang terpengaruh.\n4. Pembesaran dan mual pada jari-jari yang disebabkan oleh penyumbatan arteri dimana darah akan membendung jaringan sekunder (gangguan pembuluh darah arteri).\n5. Peningkatan suhu di bagian tangan terpengaruh, serta kram atau sifar yang berkaitan dengan gejala ini juga dapat ditandai oleh gejala-gejala infeksi pada daerah yang tersumbat.\n6. Jika emboli membahayakan otak, mungkin timbul gejala lain seperti ketidakmampuan untuk berbicara atau menangkap gagasan, lengkungan pandangan mata hilang sesaat, serta gangguan gerak yang cepat dan lambat.\n7. Penyebab dari gejala-gejala ini adalah pembuluh darah tangan tersumbat oleh zat asing seperti gumpalan kolesterol atau batu empedu, yang menyebabkan kurangnya aliran darah dan oksigen ke jaringan.\n8. Jika terjadi penyumbatan pada arteri periferi lain (misalnya arteri radial atau ulnar), gejala-gejala diatas dapat muncul baik secara vertikal maupun horizontal, bergantian tergantung lokasi dan arah aliran darah yang terpengaruh.\n\nKondisi ini menandai bahwa setiap adanya gejala penyakit emboli di daerah tangan harus segera dievaluasi oleh dokter untuk mencegah kerusakan permanen pada jaringan dan organ yang terlibat.",0.375,0.747692625980485,0.99999999995,0.0
Bagaimana cara mencegah penyakit emboli?,"Emboli tidak selalu dapat dicegah. Meski demikian, ada upaya yang dapat dilakukan untuk mengurangi risiko terjadinya emboli, antara lain:\n\nRutin berolahraga, setidaknya 30 menit sehari\nMinum air putih yang cukup\nMenerapkan pola makan sehat dan bergizi seimbang\nMembatasi asupan garam dengan diet rendah garam\nMempertahankan berat badan ideal\nBerhenti merokok dan hindari konsumsi minuman beralkohol\nTidak duduk terlalu lama atau kurang aktif bergerak\nMenjalani pemeriksaan kesehatan secara berkala","['Topik: Emboli, Subtopik: Pencegahan Emboli \n Emboli tidak selalu dapat dicegah. Meski demikian, ada upaya yang dapat dilakukan untuk mengurangi risiko terjadinya emboli, antara lain:\n- Rutin berolahraga, setidaknya 30 menit sehari\n- Minum air putih yang cukup\n- Menerapkan pola makan sehat dan bergizi seimbang\n- Membatasi asupan garam dengan diet rendah garam\n\n- Mempertahankan berat badan ideal\n- Berhenti merokok dan hindari konsumsi minuman beralkohol\n- Tidak duduk terlalu lama atau kurang aktif bergerak\n- Menjalani pemeriksaan kesehatan secara berkala\n', 'Topik: Emboli, Subtopik: Pengertian Emboli \n Emboli adalah kondisi ketika pembuluh darah tersumbat oleh zat asing, seperti gumpalan darah, gelembung udara, atau gumpalan kolesterol. Kondisi ini berbahaya dan harus segera diatasi, terutama bila terjadi di paru-paru, otak, atau jantung.\nEmboli menyebabkan pembuluh darah tersumbat. Penyumbatan ini dapat terjadi di pembuluh darah mana saja, mulai dari yang terkecil hingga terbesar, arteri maupun vena. Meski begitu, emboli biasanya lebih sering terjadi di arteri.\n\nEmboli yang terjadi pada arteri akan menyebabkan kurangnya asupan oksigen ke jaringan sehingga hal ini akan mengganggu fungsi jaringan atau organ. Jika tidak ditangani dengan tepat, penyumbatan ini dapat menyebabkan kerusakan permanen\nSementara itu, emboli yang terjadi pada vena akan mengganggu aliran darah yang akan kembali ke jantung. Akibatnya, darah akan membendung dan menyebabkan jaringan membengkak. Jika tidak segera ditangani, kondisi ini juga dapat merusak jaringan dan organ.\n', 'Topik: Emboli, Subtopik: Pengobatan Emboli \n Pengobatan emboli tergantung pada ukuran emboli, serta lokasi dan penyebab penyumbatan. Metode penanganannya bisa dengan pemberian obat-obatan atau prosedur operasi. Berikut ini adalah penjelasannya:\n']","Untuk mencegah penyakit emboli, ada beberapa upaya yang dapat dilakukan, termasuk:\n\n1. Rutin berolahraga, setidaknya 30 menit sehari: Berolahraga secara teratur memungkinkan Anda mengurangi risiko penyembuhan emboli karena oksigen yang lebih banyak dialirkan ke jaringan tubuh selama aktivitas fisik.\n\n2. Minum air putih yang cukup: Air sehat membantu sistem peredaran darah dalam mengalir dengan lancar, menghindari terjadinya pengumpulan zat-zat sisa dan lemak di saluran darah.\n\n3. Menerapkan pola makan sehat dan bergizi seimbang: Mengonsumsi makanan yang kaya airdarah dan mengandung vitamin, mineral, serta antioksidan dapat meningkatkan fungsi jantung dan pembuluh darah Anda.\n\n4. Membatasi asupan garam diet rendah garam: Penggunaan garam berlebih memicu penyumbatan darah, sehingga mengurangi asupan garam yang tinggi dapat mencegah terjadinya pembuluh darah yang tersumbat.\n\n5. Mempertahankan berat badan ideal: Obesitas meningkatkan risiko emboli karena lebih banyak tekanan pada jantung dan pembuluh darah untuk melawan kekuatan berat tubuh, serta menggembirakan jumlah zat sisa.\n\n6. Berhenti merokok dan hindari konsumsi minuman beralkohol: Keguguran merokok dan paparan alkohol memperparah fungsi jantung dan aliran darah, meningkatkan risiko terjadinya emboli.\n\n7. Tidak duduk terlalu lama atau kurang aktif bergerak: Kebiasaan duduk yang lama dapat mengurangi pembuluh darah di bagian tubuh tertentu, seperti kaki dan lengan, meningkatkan risiko emboli.\n\n8. Menjalani pemeriksaan kesehatan secara berkala: Pencarian penyebab kegagalan sistem peredaran darah dan pengobatan awal dapat mencegah timbulnya emboli yang parah atau permanen.",0.4,0.6985387862431752,0.99999999995,1.0
Apa itu penyakit aritmia?,"Aritmia adalah gangguan yang terjadi pada irama jantung. Penderita aritmia bisa merasakan irama jantungnya terlalu cepat, terlalu lambat, atau tidak teratur.","['Topik: Aritmia, Subtopik: Pengertian Aritmia \n Aritmia adalah gangguan yang terjadi pada irama jantung. Penderita aritmia bisa merasakan irama jantungnya terlalu cepat, terlalu lambat, atau tidak teratur.\nSebenarnya, aritmia normal terjadi pada kondisi jantung yang sehat. Namun, bila terjadi terus menerus atau berulang, aritmia bisa menandakan adanya masalah pada organ jantung.\n\n', 'Topik: Aritmia, Subtopik: Diagnosis Aritmia \n Untuk menentukan apakah pasien menderita aritmia, dokter akan menanyakan gejala yang muncul dan mendengarkan detak jantung pasien. Setelah itu, dokter akan melakukan beberapa pemeriksaan berikut:\n- Elektrokardiogram (EKG), untuk merekam aktivitas listrik jantung dalam kondisi berbaring\n- Holter monitoring, untuk merekam aktivitas listrik jantung ketika pasien beraktivitas selama seharian\n- Uji latih jantung, untuk mengukur aktivitas jantung saat pasien melakukan latihan fisik, seperti mengayuh sepeda statis atau berjalan di atas treadmill\n\n- Echo jantung, untuk melihat struktur dan fungsi jantung dengan bantuan gelombang suara\nDokter juga dapat menjalankan pemeriksaan lain guna melihat kemungkinan adanya penyakit yang mendasari aritmia, yaitu:\n- Pengukuran kadar elektrolit\n- Pengukuran kadar gula darah\n- Pemindaian\n- Katerisasi jantung\n- Biopsi\n', 'Topik: Aritmia, Subtopik: Gejala Aritmia \n Aritmia bisa terjadi tanpa menimbulkan gejala, sehingga kadang tidak disadari oleh penderitanya. Gejala aritmia yang dapat muncul antara lain:\n- Jantung berdetak lebih cepat dari normal (takikardia)\n- Jantung berdetak lebih lambat dari normal (bradikardia)\n- Pusing\n- Pingsan\n- Cepat lelah\n- Sesak napas\n- Nyeri dada\nPerlu diketahui, seseorang yang mengalami gejala di atas belum tentu mengalami aritmia. Oleh karena itu, pemeriksaan oleh dokter diperlukan agar dapat diketahui apa yang memicu gejala tersebut.\n']","Penyakit aritmia adalah gangguan dalam ritme jantung, dimana frekuensi detak jantung tidak teratur atau terlalu cepat atau lambat. Aritmia bisa menyebabkan diri penderita merasakan gatalan, gelisah, ouwe, atau bahkan sesak napas yang berarti perlu segera ditangani oleh dokter untuk mencegah seriusnya masalah jantung dan gejala lain.",0.7272727272727273,0.6966431222030076,0.9999999999666667,1.0
Apa saja penyebab penyakit aritmia?,"Aritmia terjadi ketika impuls listrik yang berfungsi mengatur detak jantung tidak bekerja dengan baik. Kondisi tersebut dapat disebabkan oleh sejumlah kondisi di bawah ini:\nKonsumsi obat pilek atau obat alergi\nSleep apnea\nHipertensi\nDiabetes\nGangguan elektrolit, seperti kelebihan atau kekurangan kalium, hiperkalemia, dan hipomagnesemia\nGangguan tiroid, misalnya hipertiroidisme\nKelainan katup jantung\nPenyakit jantung bawaan, seperti tetralogy of Fallot\nPenyakit jantung koroner\nSerangan jantung\nKardiomiopati\nTorsade de pointes\n\nSelain kondisi medis, aritmia juga dapat dipicu oleh gaya hidup yang tidak sehat, seperti:\nTidak dapat mengelola stres dengan baik\nKurang tidur\nMerokok\nMengonsumsi minuman beralkohol atau berkafein secara berlebihan\nMenyalahgunakan NAPZA","['Topik: Aritmia, Subtopik: Komplikasi Aritmia \n Pada beberapa kasus, aritmia dapat memburuk dan menyebabkan komplikasi serius, seperti:\n- Demensia\n- Penyakit Alzheimer\n- Stroke\n- Gagal jantung\n- Henti jantung mendadak\n- Kematian mendadak pada bayi (SIDS)\n', 'Topik: Aritmia, Subtopik: Pencegahan Aritmia \n Seperti telah dijelaskan di atas, banyak faktor yang bisa menyebabkan aritmia. Oleh karena itu, pencegahannya tergantung pada penyebab aritmia tersebut.\n', 'Topik: Aritmia, Subtopik: Pengertian Aritmia \n Aritmia adalah gangguan yang terjadi pada irama jantung. Penderita aritmia bisa merasakan irama jantungnya terlalu cepat, terlalu lambat, atau tidak teratur.\nSebenarnya, aritmia normal terjadi pada kondisi jantung yang sehat. Namun, bila terjadi terus menerus atau berulang, aritmia bisa menandakan adanya masalah pada organ jantung.\n\n']","Berdasarkan konteks yang diberikan, beberapa penyebab aritmias termasuk faktor riwayat keluarga, stres mental dan emosi, obesitas, merokok, alkohol atau zat lain yang toksik, infeksi jantung atau sistem imun lainnya, anemia, penyakit ginjal atau hati, serta dehidrasi. Selain itu, penggunaan obat-obatan seperti antidepressan, beta blokir, dan ergot alokaina juga bisa menyebabkan aritmia. Faktor genetik dan penyakit jantung lainnya, seperti hipertrofi ventrikel kiri atau valvular heart disease, juga dapat memicu aritmia.",0.0,0.517774832987926,0.49999999995,0.16666666666666666
Apa alat bantu untuk menangani pasien yang mengalami syok kardiogenik?,"Beberapa alat bantu yang dapat dipasang adalah:\n\nExtracorporeal membrane oxygenation (ECMO), untuk meningkatkan aliran darah dan suplai oksigen ke seluruh tubuh\nPemasangan alat pacu jantung, untuk mengembalikan irama jantung ke dalam kondisi normal","['Topik: Syok Kardiogenik, Subtopik: Pengobatan Syok Kardiogenik: Pemasangan alat bantu \n Untuk mencegah kerusakan jaringan tubuh akibat syok kardiogenik, dokter akan memasang beberapa alat bantu guna memperbaiki dan meningkatkan aliran darah. Pemasangan alat bantu juga diperlukan saat pasien sedang menunggu transplantasi jantung. Beberapa alat bantu yang dapat dipasang adalah:\n- Extracorporeal membrane oxygenation (ECMO), untuk meningkatkan aliran darah dan suplai oksigen ke seluruh tubuh\n- Pemasangan alat pacu jantung, untuk mengembalikan irama jantung ke dalam kondisi normal\n', 'Topik: Syok Kardiogenik, Subtopik: Pengobatan Syok Kardiogenik: Pengobatan gawat darurat \n Saat penderita syok kardiogenik tiba di IGD, dokter akan melakukan penanganan untuk menstabilkan kondisi penderita, antara lain dengan:\n- Memastikan jalan napas pasien aman dan tidak ada sumbatan\n- Memberikan oksigen tambahan dengan bantuan nasal kanul, masker pernapasan, atau ventilator\n\n- Memberikan cairan dan obat melalui infus\n', 'Topik: Syok Kardiogenik, Subtopik: Pengertian Syok Kardiogenik \n Syok kardiogenik adalah syok yang disebabkan oleh ketidakmampuan jantung untuk memompa darah ke seluruh tubuh. Syok kardiogenik merupakan kondisi yang berbahaya dan perlu mendapatkan penanganan secepatnya.\nBeberapa gejala yang terjadi saat seseorang mengalami syok kardiogenik adalah penurunan tekanan darah, denyut nadi cepat tetapi lemah, sesak napas, ujung kaki dan tangan terasa dingin, hingga penurunan kesadaran.\n\n']","Untuk menangani pasien yang mengalami syok kardiogenik, dokter sering melakukan pemasangan beberapa alat bantu medis. Beberapa alat bantu umum yang digunakan termasuk:\n\n1. Extracorporeal membrane oxygenation (ECMO) - Alat ini digunakan untuk meningkatkan aliran darah dan suplai oksigen ke seluruh tubuh pasien. ECMO bekerja dengan cara memompa darah luar ventrikel kiri atau kanan, mengoksidasi nitrogen dan karbon dioksida, kemudian memberikan udara yang teroksidasi kembali masuk ke paru-paru untuk disirkulasi.\n2. Pemasangan alat pacu jantung - Alat ini digunakan untuk mengembalikan irama jantung ke dalam kondisi normal, dan memastikan bahwa jantung tetap berfungsi dengan baik selama proses penanganan syok kardiogenik.\n\nDalam hal pengobatan gawat darurat, dokter akan melakukan beberapa langkah untuk menstabilkan kondisi pasien, termasuk:\n1. Memastikan jalan napas pasien aman dan tidak ada sumbatan.\n2. Memberikan oksigen tambahan dengan bantuan nasal kanul, masker pernapasan, atau ventilator untuk memperbaiki asupan oksigen.\n3. Memberikan cairan dan obat melalui infus untuk mengembalikan volume darah dan meningkatkan tekanan darah yang turun akibat syok kardiogenik.",0.6923076923076923,0.8491060946008065,0.9999999999,1.0
Apa saja hal yang dapat meningkatkan risiko seseorang mengalami syok kardiogenik?,"Selain penyakit dan kondisi yang disebutkan di atas, sejumlah faktor berikut juga bisa meningkatkan risiko seseorang mengalami syok kardiogenik:\n\nBerusia lebih dari 75 tahun\nMenderita gagal jantung\nMenderita diabetes, sepsis, atau pneumothorax\nMenderita berat badan berlebih atau obesitas\nPernah terkena serangan jantung\nPernah menjalani operasi bypass jantung","['Topik: Syok Kardiogenik, Subtopik: Faktor risiko syok kardiogenik \n Selain penyakit dan kondisi yang disebutkan di atas, sejumlah faktor berikut juga bisa meningkatkan risiko seseorang mengalami syok kardiogenik:\nBerusia lebih dari 75 tahun\n- Menderita gagal jantung\n\n- Menderita diabetes, sepsis, atau pneumothorax\n\n- Menderita berat badan berlebih atau obesitas\n\n- Pernah terkena serangan jantung\n- Pernah menjalani operasi bypass jantung\n\n', 'Topik: Syok Kardiogenik, Subtopik: Gejala Syok Kardiogenik: Kapan harus ke dokter \n Segera bawa ke IGD rumah sakit terdekat jika ada seseorang di sekitar Anda yang mengalami gejala seperti di atas, terlebih bila disertai dengan penurunan kesadaran. Syok kardiogenik bisa memburuk dalam waktu yang cepat dan mengancam nyawa sehingga pasien perlu mendapatkan penanganan secepatnya.\nJika Anda memiliki penyakit atau kondisi medis yang dapat meningkatkan risiko terjadinya syok kardiogenik, lakukan pemeriksaan berkala sesuai anjuran dokter.\n', 'Topik: Syok Kardiogenik, Subtopik: Pengertian Syok Kardiogenik \n Syok kardiogenik adalah syok yang disebabkan oleh ketidakmampuan jantung untuk memompa darah ke seluruh tubuh. Syok kardiogenik merupakan kondisi yang berbahaya dan perlu mendapatkan penanganan secepatnya.\nBeberapa gejala yang terjadi saat seseorang mengalami syok kardiogenik adalah penurunan tekanan darah, denyut nadi cepat tetapi lemah, sesak napas, ujung kaki dan tangan terasa dingin, hingga penurunan kesadaran.\n\n']","Hal-hal yang dapat meningkatkan risiko seseorang mengalami syok kardiogenik, selain penyakit dan kondisi yang disebutkan dalam konteks tersebut, termasuk:\n\n1. Berusia lebih dari 75 tahun, yang menunjukkan umur rentan sehingga risiko mengalami gejala syok kardiogenik meningkat.\n2. Penyakit gagal jantung, yaitu kondisi dimana jantung tidak bekerja dengan normal dan sulit memompa darah dengan efektif.\n3. Diabetes, sepsis, atau pneumothorax, penyakit atau kondisi medis lainnya yang bisa meningkatkan risiko terjadinya syok kardiogenik.\n4. Berat badan berlebih atau obesitas, yang bisa menimbulkan tekanan tambahan pada jantung dan mengurangi kapasitas jantung untuk memompa darah.\n5. Pernama terkena serangan jantung sebelumnya, yang menunjukkan bahwa seseorang mungkin rentan terhadap gejala syok kardiogenik.\n6. Menjalani operasi bypass jantung, karena proses ini bisa merusak struktur atau fungsi jantung dan mempercepatnya mengalami kegagalan.",0.5714285714285714,0.5893979951715743,0.99999999995,1.0
Apa gejala dari penyakit kardiomiopati?,"Kardiomiopati atau lemah jantung pada awalnya jarang menimbulkan gejala. Gejalanya akan muncul dan berkembang seiring dengan menurunnya kerja jantung dalam memompa darah.\n\nBeberapa gejala yang bisa muncul adalah:\n\nNapas pendek, terutama setelah melakukan aktivitas fisik yang berat\nTungkai membengkak (edema tungkai)\nBatuk terutama saat tidur telentang\nTubuh mudah lelah\nPerut kembung\nNyeri dada\nPenglihatan berkunang-kunang\nJantung berdebar-debar (palpitasi)\nDenyut jantung tidak teratur (aritmia)\nPusing dan pingsan","['Topik: Kardiomiopati, Subtopik: Gejala Kardiomiopati \n Kardiomiopati atau lemah jantung pada awalnya jarang menimbulkan gejala. Gejalanya akan muncul dan berkembang seiring dengan menurunnya kerja jantung dalam memompa darah.\nBeberapa gejala yang bisa muncul adalah:\n- Napas pendek, terutama setelah melakukan aktivitas fisik yang berat\n- Tungkai membengkak (edema tungkai)\n- Batuk terutama saat tidur telentang\n- Tubuh mudah lelah\n- Perut kembung\n- Nyeri dada\n- Penglihatan berkunang-kunang\n- Jantung berdebar-debar (palpitasi)\n- Denyut jantung tidak teratur (aritmia)\n- Pusing dan pingsan\n\n', 'Topik: Kardiomiopati, Subtopik: Pengertian Kardiomiopati \n Kardiomiopati adalah penyakit akibat kelainan di otot jantung. Penyakit ini ditandai dengan melemahnya kemampuan jantung untuk memompa darah. Gejala kardiomiopati bisa bervariasi, mulai dari tubuh mudah lelah, napas pendek, pusing, hingga nyeri dada.\nPenyebab kardiomiopati sering kali tidak diketahui dengan pasti. Namun, kondisi ini bisa terkait dengan kelainan genetik atau penyakit tertentu. Penyakit yang sering memicu terjadinya kardiomiopati pada orang dewasa adalah hipertensi kronis, yaitu tekanan darah tinggi yang sudah berlangsung lama.\n\n', 'Topik: Kardiomiopati, Subtopik: Gejala Kardiomiopati: Kapan harus ke dokter \n Lakukan pemeriksaan ke dokter jika Anda mengalami gejala seperti yang telah disebutkan di atas. Jika Anda merasakan keluhan sulit bernapas, nyeri dada, sakit kepala, atau seperti akan pingsan, segera pergi ke IGD rumah sakit terdekat untuk mendapatkan pertolongan gawat darurat.\nJika Anda memiliki faktor yang bisa meningkatkan risiko terkena kardiomiopati, seperti hipertensi, lakukan pemeriksaan berkala ke dokter untuk mencegah terjadinya kardiomiopati.\n']","Gejala kardiomiopati yang umum termasuk dalam konteks yang diberikan antara lain:\n\n1. Napas pendek, terutama setelah melakukan aktivitas fisik berat.\n2. Tungkai membengkak (edema tungkai).\n3. Batuk terutama saat tidur telentang.\n4. Tubuh mudah lelah.\n5. Perut kembung.\n6. Nyeri dada.\n7. Penglihatan berkunang-kunang.\n8. Jantung berdebar-debar (palpitasi).\n9. Denyut jantung tidak teratur (aritmia).\n10. Pusing dan pingsan.\n\nGejala ini menandai bahwa kerja jantung mulai menurun dalam memompa darah, yang mengindikasikan penyebab atau faktor yang menyebabkan kardiomiopati. Pemeriksaan ke dokter harus dilakukan apabila Anda mengalami gejala seperti itu untuk mengetahui lebih lanjut dan mencegah terjadinya penyelubung secara drastis.",1.0,0.6291643736003194,0.9999999999666667,1.0
Apa saja komplikasi yang dapat ditimbulkan dari penyakit kardiomiopati?,Kardiomiopati dapat menyebabkan komplikasi serius jika tidak segera terdiagnosis dan ditangani dengan baik. Beberapa komplikasi yang dapat timbul adalah:\n\nGagal jantung\nPenggumpalan darah\nGangguan katup jantung\nHenti jantung dan kematian mendadak,"['Topik: Kardiomiopati, Subtopik: Komplikasi Kardiomiopati \n Kardiomiopati dapat menyebabkan komplikasi serius jika tidak segera terdiagnosis dan ditangani dengan baik. Beberapa komplikasi yang dapat timbul adalah:\n- Gagal jantung\n- Penggumpalan darah\n- Gangguan katup jantung\n- Henti jantung dan kematian mendadak\n', 'Topik: Kardiomiopati, Subtopik: Pengertian Kardiomiopati \n Kardiomiopati adalah penyakit akibat kelainan di otot jantung. Penyakit ini ditandai dengan melemahnya kemampuan jantung untuk memompa darah. Gejala kardiomiopati bisa bervariasi, mulai dari tubuh mudah lelah, napas pendek, pusing, hingga nyeri dada.\nPenyebab kardiomiopati sering kali tidak diketahui dengan pasti. Namun, kondisi ini bisa terkait dengan kelainan genetik atau penyakit tertentu. Penyakit yang sering memicu terjadinya kardiomiopati pada orang dewasa adalah hipertensi kronis, yaitu tekanan darah tinggi yang sudah berlangsung lama.\n\n', 'Topik: Kardiomiopati, Subtopik: Faktor risiko kardiomiopati \n Ada beberapa hal yang dapat meningkatkan risiko kardiomiopati, yaitu:\n- Memiliki keluarga dengan riwayat kardiomiopati\n- Menderita berat badan berlebih atau obesitas\n- Menderita hipertensi kronis\n- Memiliki riwayat serangan jantung, penyakit jantung koroner, atau infeksi jantung\n- Menderita penyakit tiroid atau diabetes\n\n- Mengalami kekurangan vitamin dan mineral\n- Memiliki riwayat kemoterapi atau radioterapi\n- Memiliki riwayat penyakit hemokromatosis, amiloidosis, atau sarkoidosis\n\n- Memiliki kebiasaan mengonsumsi minuman beralkohol secara berlebihan\n- Menyalahgunakan obat-obatan tertentu, seperti kokain, amfetamin, dan steroid\n\n']","Berdasarkan konteks yang diberikan, komplikasi yang bisa timbul dari penyakat kardiomiopati antara lain:\n\n1. Gagal jantung, yaitu keadaan dimana jantung tidak lagi mampu bekerja secara efisien untuk membersihkan darah dan membawa oksigen yang diperlukan tubuh.\n2. Penggumpalan darah, yang bisa menjadi komplikasi karena penggumpalan ini dapat menciptakan resiko terhadap stroke atau serangan jantung.\n3. Gangguan katup jantung, dimana salah satu dari tiga katup dalam hati (katup mitral, aorta, dan bumi) tidak bekerja dengan baik, menyebabkan aliran darah menjadi tak normal.\n4. Henti jantung dan kematian mendadak, komplikasi yang paling serius dimana terdapat risiko tinggi akan tetapi bisa berujung pada kematian pasien secara mendadak tanpa adanya tanda-tanda awal sebelumnya.",0.4444444444444444,0.7070728036219615,0.9999999999,1.0
Apa saja gejala umum yang dialami oleh seseorang dengan penyakit katup jantung?,"Umumnya, penyakit katup jantung memunculkan gejala-gejala di bawah ini:\n\nNyeri dada saat beraktivitas\nJantung berdebar atau berdetak tidak beraturan (aritmia)\nSesak napas\nTubuh lebih mudah lelah\nPusing\nPingsan\nPembengkakan (edema) di bagian kaki, pergelangan kaki,  perut, atau pembuluh darah di leher\nBatuk darah\nGejala penyakit katup jantung bisa berbeda-beda pada setiap penderita, tergantung pada jenis gangguan katup jantung yang dialami dan tingkat keparahannya. Gejala bisa muncul secara perlahan atau bisa juga secara tiba-tiba dan berkembang sangat cepat.","['Topik: Penyakit Katup Jantung, Subtopik: Gejala Penyakit Katup Jantung \n Katup jantung berperan untuk menjaga kelancaran aliran darah yang ada di dalam jantung dan keluar dari jantung. Katup jantung bekerja tiap kali jantung berdetak. Bunyi  lup-dup  jantung berasal dari suara katup yang sedang menutup setelah menyalurkan darah.\nKetika terjadi gangguan pada katup jantung, biasanya dokter akan menemukan tanda khas berikut: \n- Murmur jantung atau bunyi bising pada jantung  \n\n- Tekanan darah rendah atau tekanan darah tinggi\nPenderita penyakit katup jantung umumnya tidak merasakan gejala khas. Akan tetapi, ia dapat mengalami beberapa gejala akibat aliran darah terhambat sehingga jantung perlu bekerja lebih keras.\nUmumnya, penyakit katup jantung memunculkan gejala-gejala di bawah ini:\n- Nyeri dada saat beraktivitas\n- Jantung berdebar atau berdetak tidak beraturan (aritmia)\n- Sesak napas\n- Tubuh lebih mudah lelah\n- Pusing\n- Pingsan\n- Pembengkakan (edema) di bagian kaki, pergelangan kaki,  perut, atau pembuluh darah di leher\n- Batuk darah\nGejala penyakit katup jantung bisa berbeda-beda pada setiap penderita, tergantung pada jenis gangguan katup jantung yang dialami dan tingkat keparahannya. Gejala bisa muncul secara perlahan atau bisa juga secara tiba-tiba dan berkembang sangat cepat.\n', 'Topik: Penyakit Katup Jantung, Subtopik: Pengertian Penyakit Katup Jantung \n Penyakit katup jantung adalah kondisi ketika katup jantung tidak dapat membuka dan menutup dengan sempurna. Kondisi ini menyebabkan aliran darah di dalam jantung dan yang keluar dari jantung tidak lancar. Penyakit katup jantung dapat ditandai dengan suara jantung yang tidak normal, nyeri dada, pusing, dan sesak napas.\nKatup jantung atau klep jantung merupakan bagian jantung yang berfungsi seperti pintu satu arah. Tugasnya adalah sebagai pintu yang mengalirkan darah dari satu ruang jantung ke ruang lain. Katup jantung juga mengalirkan darah dari jantung ke pembuluh darah yang akan menuju seluruh tubuh.\n\nGangguan pada satu atau beberapa katup jantung dapat berpengaruh dalam fungsi jantung dalam mengalirkan darah dan oksigen ke seluruh tubuh. Berkurangnya distribusi oksigen ke jaringan tubuh (hipoksemia) dapat menyebabkan kerusakan pada berbagai organ tubuh dan mengakibatkan komplikasi yang fatal.\n', 'Topik: Penyakit Katup Jantung, Subtopik: Gejala Penyakit Katup Jantung: Kapan harus ke dokter \n Segera periksakan diri ke dokter jika Anda mengalami gejala-gejala di atas agar mendapatkan pemeriksaan dan penanganan yang tepat. Makin cepat penyakit katup jantung ditangani, peluang kondisi ini membaik akan lebih besar.\n']","Gejala umum yang dialami oleh seseorang dengan penyakit katup jantung termasuk:\n\n1. Murmur jantung atau bunyi bising pada jantung, yang merupakan cirri khas dari gangguan pada katup jantung.\n2. Tekanan darah rendah atau tekanan darah tinggi, yang juga sering terjadi dalam penyakit katup jantung.\n3. Nyeri dada saat beraktivitas, yang bisa disebabkan oleh peningkatan kebutuhan oksigen tubuh dan mem迫使 jantung bekerja lebih keras untuk menyamakan aliran darah.\n4. Jantung berdebar atau aritmia, yang merupakan perubahan ritme jantung yang tidak teratur.\n5. Sesak napas, sehingga tubuh mendapat oksigen dengan lebih lama dan lebih sulit daripada normal.\n6. Tubuh lebih mudah lelah, karena jantung bekerja lebih keras untuk memenuhi kebutuhan tubuh terhadap oksigen.\n7. Pusing, yang merupakan gejala umum dari penyakit katup jantung dan bisa disebabkan oleh kerusakan sel akibat ketidakmampuan untuk mendapatkan oksigen yang cukup.\n8. Pingsan, sebagai respons terhadap gejala-gejala lainnya yang diakibatkan oleh penyakit katup jantung.\n9. Pembengkakan (edema) di bagian kaki, pergelangan kaki, perut, atau pembuluh darah di leher, seperti akibat dari aliran darah yang terhambat oleh penyakit katup jantung.\n10. Batuk darah, yang bisa disebabkan oleh edema pada saluran pernapasan atau karena kerusakan hati akibat kekurangan oksigen.\n\nGejala-gejala ini dapat muncul secara perlahan atau secara tiba-tiba dan berkembang sangat cepat, bergantung pada jenis gangguan katup jantung yang dialami dan tingkat keparahannya.",0.6666666666666666,0.4580479578120804,0.9999999999666667,1.0
Bagaimana cara mencegah penyakit katup jantung?,"Penyakit katup jantung dapat dicegah dengan menangani penyakit atau infeksi yang berisiko menyebabkan masalah pada katup jantung, di antaranya:\n\nMengobati infeksi streptokokus sedini mungkin agar tidak berkembang menjadi demam reumatik, yang dapat meningkatkan risiko terjadinya penyakit katup jantung\nMengobati endokarditis sedini mungkin\nMenerapkan kebersihan gigi dan mulut, untuk mencegah infeksi pemicu penyakit katup jantung \nMengonsumsi obat dan kontrol secara rutin jika memiliki penyakit kronis yang dapat meningkatkan risiko terjadinya kerusakan katup jantung, seperti hipertensi, penyakit jantung koroner, penyakit autoimun, atau diabetes\nBagi orang yang pernah mengalami penyakit katup jantung, terapkan gaya hidup sehat berikut untuk mencegah kondisi ini memburuk:\n\nMengonsumsi makanan bergizi yang rendah akan kolesterol dan lemak tak jenuh, misalnya sayur, buah, ikan, gandum utuh, dan minyak zaitun\nBerolahraga rutin, setidaknya 30 menit setiap hari\nBerhenti merokok\nTidur cukup setiap hari atau melakukan konsultasi online dengan dokter jika sulit tidur\nMelakukan pemeriksaan tekanan darah, fungsi jantung, kadar kolesterol darah, serta kadar gula darah secara rutin dengan dokter","['Topik: Penyakit Katup Jantung, Subtopik: Pengobatan Penyakit Katup Jantung \n Penanganan penyakit katup jantung disesuaikan dengan tingkat keparahannya. Umumnya, dokter akan menyarankan pasien untuk menerapkan gaya hidup sehat, seperti tidak merokok, mengonsumsi makanan yang baik untuk jantung, mengelola stres dengan baik, dan beristirahat yang cukup.\nSetelah itu, dokter juga dapat memberikan tindakan medis, seperti:\n', 'Topik: Penyakit Katup Jantung, Subtopik: Pengertian Penyakit Katup Jantung \n Penyakit katup jantung adalah kondisi ketika katup jantung tidak dapat membuka dan menutup dengan sempurna. Kondisi ini menyebabkan aliran darah di dalam jantung dan yang keluar dari jantung tidak lancar. Penyakit katup jantung dapat ditandai dengan suara jantung yang tidak normal, nyeri dada, pusing, dan sesak napas.\nKatup jantung atau klep jantung merupakan bagian jantung yang berfungsi seperti pintu satu arah. Tugasnya adalah sebagai pintu yang mengalirkan darah dari satu ruang jantung ke ruang lain. Katup jantung juga mengalirkan darah dari jantung ke pembuluh darah yang akan menuju seluruh tubuh.\n\nGangguan pada satu atau beberapa katup jantung dapat berpengaruh dalam fungsi jantung dalam mengalirkan darah dan oksigen ke seluruh tubuh. Berkurangnya distribusi oksigen ke jaringan tubuh (hipoksemia) dapat menyebabkan kerusakan pada berbagai organ tubuh dan mengakibatkan komplikasi yang fatal.\n', 'Topik: Penyakit Katup Jantung, Subtopik: Gejala Penyakit Katup Jantung \n Katup jantung berperan untuk menjaga kelancaran aliran darah yang ada di dalam jantung dan keluar dari jantung. Katup jantung bekerja tiap kali jantung berdetak. Bunyi  lup-dup  jantung berasal dari suara katup yang sedang menutup setelah menyalurkan darah.\nKetika terjadi gangguan pada katup jantung, biasanya dokter akan menemukan tanda khas berikut: \n- Murmur jantung atau bunyi bising pada jantung  \n\n- Tekanan darah rendah atau tekanan darah tinggi\nPenderita penyakit katup jantung umumnya tidak merasakan gejala khas. Akan tetapi, ia dapat mengalami beberapa gejala akibat aliran darah terhambat sehingga jantung perlu bekerja lebih keras.\nUmumnya, penyakit katup jantung memunculkan gejala-gejala di bawah ini:\n- Nyeri dada saat beraktivitas\n- Jantung berdebar atau berdetak tidak beraturan (aritmia)\n- Sesak napas\n- Tubuh lebih mudah lelah\n- Pusing\n- Pingsan\n- Pembengkakan (edema) di bagian kaki, pergelangan kaki,  perut, atau pembuluh darah di leher\n- Batuk darah\nGejala penyakit katup jantung bisa berbeda-beda pada setiap penderita, tergantung pada jenis gangguan katup jantung yang dialami dan tingkat keparahannya. Gejala bisa muncul secara perlahan atau bisa juga secara tiba-tiba dan berkembang sangat cepat.\n']","Untuk mencegah penyakat katup jantung, penting untuk mematuhi gaya hidup sehat dan mengelola faktor-faktor risiko lainnya. Berikut beberapa langkah yang bisa diambil:\n\n1. Tidur cukup: Mengkonsumsi jumlah makanan yang sesuai dengan kebutuhan tubuh, meminimalkan stres dan menjaga pola tidur yang baik akan sangat membantu mengendalikan berat badan secara normal.\n2. Minum alkohol dengan bijak: Mengonsumsi minuman alkohol dalam jumlah terbatas atau bahkan dihindari sama sekali, karena bisa meningkatkan risiko penyakit jantung dan gangguan jantung.\n3. Konsumsi makanan yang baik untuk jantung: Mengkonsumsi lebih banyak sayuran dan buah-buahan segar, mengurangi konsumsi lemak dalam makanan, serta memilih protein nabati atau hewani sebagai sumber protein alami.\n4. Menjaga tekanan darah dan denyut jantung: Mengikuti dokter untuk menjaga tekanan darah dan denyut jantung dalam batas normal, melakukan aktivitas fisik sehat secara berkala, dan menghentikan merokok.\n5. Manajemen stres: Membuat waktu luang yang santai untuk berekspresi dan menghiburkan diri sendiri atau keluarga dalam cara yang aman dan nyaman.\n6. Obesitas: Mengkonsumsi jumlah kalori yang sesuai dengan kebutuhan tubuh, serta melakukan aktivitas fisik sehat secara berkala untuk menjaga berat badan tetap normal dan mengurangi risiko penyakit jantung.\n7. Konsumsi obat: Mengikuti petunjuk dari dokter atas penggunaan obat-obatan, termasuk obat untuk menurunkan tekanan darah dan mengendalikan denyut jantung secara efektif.\n8. Pemeriksaan kesehatan: Mengikuti program penyuluhan kesehatan rutin atau pemeriksaan medis berkala untuk menjangkau risiko terhadap penyakit jantung dan gangguan jantung secara mendetail.\n9. Konsultasi dengan dokter: Mengajukan pertanyaan atau keluhan kepada dokter, termasuk menggali informasi tentang gejala-gejala yang mungkin terjadi sebelumnya, agar diketahui penyebab dan cara menyembuhnya.\n10. Hubungan sosial: Membangun hubungan baik dengan keluarga, teman atau penggiat masa lalu yang bisa menjadi sumber dukungan moral dan emosi dalam menghadapi tantangan penyakit jantung.\n\nDengan mematuhi gaya hidup sehat dan mengikuti program kesehatan rutin, risiko terkena penyakit katup jantung dapat dikurangi secara signifikan.",0.4583333333333333,0.5120877690046751,0.9999999999666667,0.8181818181818182
Apa saja hal yang dapat menyebabkan jantung berdebar?,"Jantung berdebar tidak selalu akibat penyakit pada jantung. Berikut adalah beberapa kondisi dan penyakit yang dapat menimbulkan keluhan jantung berdebar kencang:\n\n1. Gaya hidup, seperti:\nKebiasaan merokok\nTidur yang tidak cukup\nLatihan fisik yang berat\nEfek konsumsi minuman beralkohol\nKonsumsi minuman berkafein seperti kopi, teh, dan minuman berenergi\nPenyalahgunaan NAPZA, seperti amfetamin, ekstasi, kokain, atau ganja\nPola makan tinggi gula dan lemak\n\n2. Faktor psikologis, misalnya:\nStres atau gelisah\nSerangan panik\nCemas atau takut luar biasa\n\n3. Obat-obatan, antara lain:\nObat asma\nObat tekanan darah tinggi (antihipertensi)\nAntihistamin\nAntidepresan\nObat flu, contohnya obat yang mengandung phenylephrine\n\n4. Perubahan hormon, misalnya pada masa:\nMenstruasi\nKehamilan\nMenopause\n\n5. Gangguan irama jantung atau aritmia, meliputi:\nFibrilasi atrium\nAtrial flutter\nTakikardia ventrikular\nTakikardia supraventrikular\n\n6. Penyakit jantung, antara lain:\nGagal jantung\nPenyakit jantung bawaan\nKardiomiopati\nPenyakit katup jantung\n\n7. Penyakit atau kondisi tertentu, seperti:\nDehidrasi\nDemam di atas 38 derajat Celcius\nHipertiroidisme\nAnemia\nPheochromocytoma\nHipotensi ortostatik\nKadar gula darah rendah (hipoglikemia)","['Topik: Jantung Berdebar, Subtopik: Penyebab Jantung Berdebar \n Jantung berdebar tidak selalu akibat penyakit pada jantung. Berikut adalah beberapa kondisi dan penyakit yang dapat menimbulkan keluhan jantung berdebar kencang:\n1. Gaya hidup, seperti:\n- Kebiasaan merokok\n\n- Tidur yang tidak cukup\n- Latihan fisik yang berat\n- Efek konsumsi minuman beralkohol\n- Konsumsi minuman berkafein seperti kopi, teh, dan minuman berenergi\n- Penyalahgunaan NAPZA, seperti amfetamin, ekstasi, kokain, atau ganja\n- Pola makan tinggi gula dan lemak\n2. Faktor psikologis, misalnya:\n- Stres atau gelisah\n- Serangan panik\n- Cemas atau takut luar biasa\n3. Obat-obatan, antara lain:\n- Obat asma\n- Obat tekanan darah tinggi (antihipertensi)\n- Antihistamin\n- Antidepresan\n- Obat flu, contohnya obat yang mengandung phenylephrine\n\n4. Perubahan hormon, misalnya pada masa:\n- Menstruasi\n- Kehamilan\n- Menopause\n5. Gangguan irama jantung atau aritmia, meliputi:\n- Fibrilasi atrium\n- Atrial flutter \n- Takikardia ventrikular\n- Takikardia supraventrikular\n6. Penyakit jantung, antara lain:\n- Gagal jantung\n- Penyakit jantung bawaan\n- Kardiomiopati\n- Penyakit katup jantung\n7. Penyakit atau kondisi tertentu, seperti:\n- Dehidrasi\n- Demam di atas 38 derajat Celcius\n- Hipertiroidisme\n- Anemia\n- Pheochromocytoma\n- Hipotensi ortostatik\n- Kadar gula darah rendah (hipoglikemia)\n', 'Topik: Jantung Berdebar, Subtopik: Diagnosis Jantung Berdebar \n Untuk memulai diagnosis, dokter akan melakukan tanya jawab terkait gejala pada pasien yang dapat menandakan gangguan pada jantung. Meski tidak semua kasus jantung berdebar disebabkan oleh gangguan jantung, pemeriksaan perlu dilakukan untuk mencegah komplikasi yang mungkin terjadi akibat gangguan jantung.\nDokter juga akan menanyakan gejala lain yang mungkin menyertai jantung berdebar. Tujuannya adalah untuk mendeteksi kondisi lain yang dapat menyebabkan jantung berdebar, seperti gangguan kelenjar tiroid. Dokter juga akan bertanya tentang aktivitas fisik, tingkat stres, obat yang sedang digunakan, dan riwayat kesehatan pasien.\nSetelah itu, dokter akan melakukan pemeriksaan fisik menyeluruh, termasuk mengukur tekanan darah, suhu tubuh, dan nadi pasien. Dokter juga akan melakukan pemeriksaan yang spesifik, seperti mendengarkan suara jantung pasien menggunakan stetoskop, dan merasakan bagian depan leher untuk memeriksa kelenjar tiroid.\nSelanjutnya, dokter akan melakukan pemeriksaan penunjang untuk memastikan diagnosis. Umumnya, pemeriksaan awal yang dilakukan adalah elektrokardiografi (EKG). Namun, karena jantung berdebar umumnya hilang timbul, EKG mungkin tidak selalu dapat menangkap kelainan pada jantung.\nJika palpitasi dicurigai berasal dari gangguan jantung, pasien akan dirujuk ke dokter jantung untuk menjalani pemeriksaan berikut:\n- Monitor aktivitas listrik jantung selama 24  48 jam dengan alat khusus (Holter monitor)\n- USG jantung atau ekokardiografi\n- Elektrofisiologi jantung\n- MRI jantung\n- Angiografi koroner\nJika hasil pemeriksaan jantung tidak menunjukkan adanya kelainan, pemeriksaan lain dapat dilakukan untuk mendeteksi penyebab jantung berdebar. Beberapa pemeriksaan tersebut adalah:\n- Pemeriksaan darah lengkap, untuk mendeteksi anemia\n- Pemeriksaan hormon, untuk mendeteksi hipertiroidisme atau pheochromocytoma\n\n- Tes urine, untuk mendeteksi penggunaan obat terlarang\n- Tes kehamilan\n', 'Topik: Jantung Berdebar, Subtopik: Pengobatan Jantung Berdebar \n Pengobatan jantung berdebar tergantung pada penyebabnya. Bagi pasien yang menderita penyakit tertentu, misalnya aritmia, gagal jantung, atau hipertiroidisme, dokter akan merujuk pasien ke dokter spesialis terkait untuk menjalani terapi yang spesifik.\nJika diperlukan, dokter akan meresepkan obat jantung berdebar berupa penghambat beta (beta blocker) atau antagonis kalsium (calcium channel blocker) untuk meredakan jantung berdebar. Pada jantung berdebar yang disebabkan oleh gangguan induksi listrik jantung, dokter akan mempertimbangkan operasi ablasi jantung untuk meredakan jantung berdebar.\nSedangkan pada jantung berdebar yang disebabkan oleh gaya hidup tidak sehat, seperti merokok atau mengonsumsi terlalu banyak minuman berkafein, pasien akan disarankan untuk memperbaiki gaya hidupnya menjadi lebih sehat, misalnya dengan berolahraga.\nPada pasien yang mengalami jantung berdebar akibat penggunaan obat-obatan, dianjurkan untuk berkonsultasi dengan dokter yang memberikan obat tersebut. Tidak disarankan berhenti mengonsumsi obat tanpa persetujuan dokter.\nSementara itu, untuk jantung berdebar yang dipicu oleh faktor psikologis dan disertai gejala gelisah dan jantung berdebar, dokter bisa menyarankan pasien mencoba teknik relaksasi sederhana untuk meredakan serangan panik dan rasa cemas. Bila perlu, pasien akan dirujuk ke psikolog atau psikiater agar kondisi mental yang dialami pasien dapat ditangani.\n']","Hal-hal yang dapat menyebabkan jantung berdebar meliputi:\n\n1. Gaya hidup, seperti kebiasaan merokok, tidur yang tidak cukup, latihan fisik yang berat, konsumsi minuman beralkohol, konsumsi minuman berkafein, penyalahgunaan NAPZA, pola makan tinggi gula dan lemak.\n2. Faktor psikologis, seperti stres atau gelisah, serangan panik, cemas atau takut luar biasa.\n3. Obat-obatan, antara lain obat asma, obat tekanan darah tinggi (antihipertensi), antihistamin, antidepresan, obat flu, dan obat yang mengandung phenylephrine.\n4. Perubahan hormon, misalnya pada masa menopause atau kehamilan.\n5. Gangguan irama jantung atau aritmia, seperti fibrilasi atrium, atrial flutter, takikardia ventrikular, dan takikardia supraventrikular.\n6. Penyakit jantung, antara lain gagal jantung, penyakit jantung bawaan, kardiomiopati, dan penyakit katup jantung.\n7. Penyakit atau kondisi tertentu, seperti dehidrasi, demam di atas 38 derajat Celcius, hipertiroidisme, anemia, pheochromocytoma, hipotensi ortostatik, dan kadar gula darah rendah (hipoglikemia).",1.0,0.5117941805984262,0.9999999999666667,1.0
Kapan seseorang harus dibawa ke dokter ketika mengalami jantung berdebar?,"Sensasi jantung berdebar umumnya tidak disebabkan oleh kondisi yang berbahaya dan dapat hilang dengan beristirahat dan tanpa pengobatan khusus. Meski demikian, pemeriksaan oleh dokter perlu segera dilakukan jika jantung berdebar sering kambuh, memburuk, atau terjadi lama hingga hitungan jam.\n\nPemeriksaan juga diperlukan bila orang yang mengalami jantung berdebar memiliki riwayat penyakit maupun operasi jantung, atau terdapat riwayat penyakit jantung pada keluarga.\n\nSegera ke IGD rumah sakit jika jantung berdebar tidak membaik dengan beristirahat, atau disertai dengan keluhan berikut:\n\nNyeri dada seperti tertekan, yang bisa menjalar ke bahu, dagu, punggung, atau lengan\nTubuh terasa lemah\nSesak napas\nKeringat dingin\nPusing hebat\nLinglung\nPingsan","['Topik: Jantung Berdebar, Subtopik: Gejala Jantung Berdebar: Kapan harus ke dokter \n Sensasi jantung berdebar umumnya tidak disebabkan oleh kondisi yang berbahaya dan dapat hilang dengan beristirahat dan tanpa pengobatan khusus. Meski demikian, pemeriksaan oleh dokter perlu segera dilakukan jika jantung berdebar sering kambuh, memburuk, atau terjadi lama hingga hitungan jam.\nPemeriksaan juga diperlukan bila orang yang mengalami jantung berdebar memiliki riwayat penyakit maupun operasi jantung, atau terdapat riwayat penyakit jantung pada keluarga.\nSegera ke IGD rumah sakit jika jantung berdebar tidak membaik dengan beristirahat, atau disertai dengan keluhan berikut:\n- Nyeri dada seperti tertekan, yang bisa menjalar ke bahu, dagu, punggung, atau lengan\n- Tubuh terasa lemah\n- Sesak napas\n- Keringat dingin\n- Pusing hebat\n- Linglung\n- Pingsan\n', 'Topik: Jantung Berdebar, Subtopik: Pengobatan Jantung Berdebar \n Pengobatan jantung berdebar tergantung pada penyebabnya. Bagi pasien yang menderita penyakit tertentu, misalnya aritmia, gagal jantung, atau hipertiroidisme, dokter akan merujuk pasien ke dokter spesialis terkait untuk menjalani terapi yang spesifik.\nJika diperlukan, dokter akan meresepkan obat jantung berdebar berupa penghambat beta (beta blocker) atau antagonis kalsium (calcium channel blocker) untuk meredakan jantung berdebar. Pada jantung berdebar yang disebabkan oleh gangguan induksi listrik jantung, dokter akan mempertimbangkan operasi ablasi jantung untuk meredakan jantung berdebar.\nSedangkan pada jantung berdebar yang disebabkan oleh gaya hidup tidak sehat, seperti merokok atau mengonsumsi terlalu banyak minuman berkafein, pasien akan disarankan untuk memperbaiki gaya hidupnya menjadi lebih sehat, misalnya dengan berolahraga.\nPada pasien yang mengalami jantung berdebar akibat penggunaan obat-obatan, dianjurkan untuk berkonsultasi dengan dokter yang memberikan obat tersebut. Tidak disarankan berhenti mengonsumsi obat tanpa persetujuan dokter.\nSementara itu, untuk jantung berdebar yang dipicu oleh faktor psikologis dan disertai gejala gelisah dan jantung berdebar, dokter bisa menyarankan pasien mencoba teknik relaksasi sederhana untuk meredakan serangan panik dan rasa cemas. Bila perlu, pasien akan dirujuk ke psikolog atau psikiater agar kondisi mental yang dialami pasien dapat ditangani.\n', 'Topik: Jantung Berdebar, Subtopik: Diagnosis Jantung Berdebar \n Untuk memulai diagnosis, dokter akan melakukan tanya jawab terkait gejala pada pasien yang dapat menandakan gangguan pada jantung. Meski tidak semua kasus jantung berdebar disebabkan oleh gangguan jantung, pemeriksaan perlu dilakukan untuk mencegah komplikasi yang mungkin terjadi akibat gangguan jantung.\nDokter juga akan menanyakan gejala lain yang mungkin menyertai jantung berdebar. Tujuannya adalah untuk mendeteksi kondisi lain yang dapat menyebabkan jantung berdebar, seperti gangguan kelenjar tiroid. Dokter juga akan bertanya tentang aktivitas fisik, tingkat stres, obat yang sedang digunakan, dan riwayat kesehatan pasien.\nSetelah itu, dokter akan melakukan pemeriksaan fisik menyeluruh, termasuk mengukur tekanan darah, suhu tubuh, dan nadi pasien. Dokter juga akan melakukan pemeriksaan yang spesifik, seperti mendengarkan suara jantung pasien menggunakan stetoskop, dan merasakan bagian depan leher untuk memeriksa kelenjar tiroid.\nSelanjutnya, dokter akan melakukan pemeriksaan penunjang untuk memastikan diagnosis. Umumnya, pemeriksaan awal yang dilakukan adalah elektrokardiografi (EKG). Namun, karena jantung berdebar umumnya hilang timbul, EKG mungkin tidak selalu dapat menangkap kelainan pada jantung.\nJika palpitasi dicurigai berasal dari gangguan jantung, pasien akan dirujuk ke dokter jantung untuk menjalani pemeriksaan berikut:\n- Monitor aktivitas listrik jantung selama 24  48 jam dengan alat khusus (Holter monitor)\n- USG jantung atau ekokardiografi\n- Elektrofisiologi jantung\n- MRI jantung\n- Angiografi koroner\nJika hasil pemeriksaan jantung tidak menunjukkan adanya kelainan, pemeriksaan lain dapat dilakukan untuk mendeteksi penyebab jantung berdebar. Beberapa pemeriksaan tersebut adalah:\n- Pemeriksaan darah lengkap, untuk mendeteksi anemia\n- Pemeriksaan hormon, untuk mendeteksi hipertiroidisme atau pheochromocytoma\n\n- Tes urine, untuk mendeteksi penggunaan obat terlarang\n- Tes kehamilan\n']","Jika seseorang mengalami jantung berdebar, mereka sebaiknya segera ke dokter (IGD atau rumah sakit) apabila gejala yang disertai tidak membahayakan secara langsung dan belum sembuh dengan beristirahat. Gejala yang perlu diperhatikan termasuk nyeri dada, kesemutan tubuh, sesak napas, keringat dingin, pusing, linglung, atau pingsan yang sering terjadi secara berkala dan tidak membaik dengan beristirahat.\n\nSelain itu, seseorang harus segera ke dokter jika mengalami riwayat penyakit maupun operasi jantung, atau jika ada gejala lain yang terkait seperti gangguan kelenjar tiroid. Pemeriksaan diagnostik juga perlu dilakukan untuk memastikan penyebab dari gejala-gejala yang dialami orang tersebut, termasuk pemeriksaan fisik dan pemeriksaan penunjang seperti elektrokardiografi (EKG), USG jantung, atau alat khusus untuk monitoring aktivitas listrik jantung.\n\nDokter akan mempertimbangkan beberapa faktor, termasuk gejala yang dialami pasien dan riwayat medis mereka, sebelum merekomendasikan langkah-langkah pengobatan atau terapi spesifik untuk menangani jantung berdebar.",0.9047619047619048,0.8373859864480693,0.9999999999666667,1.0
Apa saja komplikasi akibat jantung berdebar?,"Jantung berdebar jarang menyebabkan komplikasi. Namun, pada jantung berdebar yang disebabkan oleh penyakit jantung, beberapa komplikasi yang dapat terjadi meliputi:\n\nStroke\nHenti jantung\nGagal jantung","['Topik: Jantung Berdebar, Subtopik: Komplikasi Jantung Berdebar \n Jantung berdebar jarang menyebabkan komplikasi. Namun, pada jantung berdebar yang disebabkan oleh penyakit jantung, beberapa komplikasi yang dapat terjadi meliputi:\n- Stroke\n- Henti jantung\n- Gagal jantung\n', 'Topik: Jantung Berdebar, Subtopik: Diagnosis Jantung Berdebar \n Untuk memulai diagnosis, dokter akan melakukan tanya jawab terkait gejala pada pasien yang dapat menandakan gangguan pada jantung. Meski tidak semua kasus jantung berdebar disebabkan oleh gangguan jantung, pemeriksaan perlu dilakukan untuk mencegah komplikasi yang mungkin terjadi akibat gangguan jantung.\nDokter juga akan menanyakan gejala lain yang mungkin menyertai jantung berdebar. Tujuannya adalah untuk mendeteksi kondisi lain yang dapat menyebabkan jantung berdebar, seperti gangguan kelenjar tiroid. Dokter juga akan bertanya tentang aktivitas fisik, tingkat stres, obat yang sedang digunakan, dan riwayat kesehatan pasien.\nSetelah itu, dokter akan melakukan pemeriksaan fisik menyeluruh, termasuk mengukur tekanan darah, suhu tubuh, dan nadi pasien. Dokter juga akan melakukan pemeriksaan yang spesifik, seperti mendengarkan suara jantung pasien menggunakan stetoskop, dan merasakan bagian depan leher untuk memeriksa kelenjar tiroid.\nSelanjutnya, dokter akan melakukan pemeriksaan penunjang untuk memastikan diagnosis. Umumnya, pemeriksaan awal yang dilakukan adalah elektrokardiografi (EKG). Namun, karena jantung berdebar umumnya hilang timbul, EKG mungkin tidak selalu dapat menangkap kelainan pada jantung.\nJika palpitasi dicurigai berasal dari gangguan jantung, pasien akan dirujuk ke dokter jantung untuk menjalani pemeriksaan berikut:\n- Monitor aktivitas listrik jantung selama 24  48 jam dengan alat khusus (Holter monitor)\n- USG jantung atau ekokardiografi\n- Elektrofisiologi jantung\n- MRI jantung\n- Angiografi koroner\nJika hasil pemeriksaan jantung tidak menunjukkan adanya kelainan, pemeriksaan lain dapat dilakukan untuk mendeteksi penyebab jantung berdebar. Beberapa pemeriksaan tersebut adalah:\n- Pemeriksaan darah lengkap, untuk mendeteksi anemia\n- Pemeriksaan hormon, untuk mendeteksi hipertiroidisme atau pheochromocytoma\n\n- Tes urine, untuk mendeteksi penggunaan obat terlarang\n- Tes kehamilan\n', 'Topik: Jantung Berdebar, Subtopik: Penyebab Jantung Berdebar \n Jantung berdebar tidak selalu akibat penyakit pada jantung. Berikut adalah beberapa kondisi dan penyakit yang dapat menimbulkan keluhan jantung berdebar kencang:\n1. Gaya hidup, seperti:\n- Kebiasaan merokok\n\n- Tidur yang tidak cukup\n- Latihan fisik yang berat\n- Efek konsumsi minuman beralkohol\n- Konsumsi minuman berkafein seperti kopi, teh, dan minuman berenergi\n- Penyalahgunaan NAPZA, seperti amfetamin, ekstasi, kokain, atau ganja\n- Pola makan tinggi gula dan lemak\n2. Faktor psikologis, misalnya:\n- Stres atau gelisah\n- Serangan panik\n- Cemas atau takut luar biasa\n3. Obat-obatan, antara lain:\n- Obat asma\n- Obat tekanan darah tinggi (antihipertensi)\n- Antihistamin\n- Antidepresan\n- Obat flu, contohnya obat yang mengandung phenylephrine\n\n4. Perubahan hormon, misalnya pada masa:\n- Menstruasi\n- Kehamilan\n- Menopause\n5. Gangguan irama jantung atau aritmia, meliputi:\n- Fibrilasi atrium\n- Atrial flutter \n- Takikardia ventrikular\n- Takikardia supraventrikular\n6. Penyakit jantung, antara lain:\n- Gagal jantung\n- Penyakit jantung bawaan\n- Kardiomiopati\n- Penyakit katup jantung\n7. Penyakit atau kondisi tertentu, seperti:\n- Dehidrasi\n- Demam di atas 38 derajat Celcius\n- Hipertiroidisme\n- Anemia\n- Pheochromocytoma\n- Hipotensi ortostatik\n- Kadar gula darah rendah (hipoglikemia)\n']","Komplikasi jantung berdebar, terutama yang disebabkan oleh penyakit jantung, termasuk komplikasi seperti stroke, henti jantung, dan gagal jantung. Selain itu, beberapa komplikasi lainnya yang dapat timbul akibat gangguan jantung berdebar antara lain:\n\n1. Stroke (stroke): Jika arteri di sekitar jantung mengalami penyumbatan atau terjadi pemadaman, ini akan mengurangi aliran oksigen dan nutrien ke otak, yang dapat menyebabkan stroke.\n2. Henti jantung (heart failure): Jika jantung tidak bekerja sebagaimana mestinya karena penyakit atau gangguan lainnya, tubuh akan mengalami tekanan dan komplikasi yang melibatkan penggunaan oksigen rendah.\n3. Gagal jantung (cardiac arrest): Jika jantung berdebar secara signifikan membatu aliran darah ke seluruh tubuh, ini dapat menyebabkan gagal jantung yang mendadak dan bahkan sebagainya.\n4. Penyumbatan arteri (embolism): Jika bagian dari batas tengah atau leher mengeluarkan pasien darah yang tidak benar, ini akan menyebabkan penyumbatan pada arteri-arteri lain dan menurunkan aliran oksigen ke organ.\n5. Penyakit jantung bawaan (congenital heart disease): Jika seseorang lahir dengan masalah dalam struktur jantung, hal ini dapat menggangu fungsi jantung dan meningkatkan risiko terkena komplikasi.\n6. Kardiomiopati: Penyebab lain yang menyebabkan gangguan pada jantung adalah kardiomiopati, yaitu penyakit jantung yang mengubah fungsi jantung dan dapat meningkatkan risiko komplikasi.\n7. Polip hipertensi: Penyebab lainnya termasuk polip hipertensi (penggembungan pada saluran pernafasan) yang dapat menyebabkan gangguan jantung dan mengurangi aliran oksigen ke paru-paru.\n8. Hipertiroidisme: Penyakit ini juga bisa meningkatkan risiko terkena komplikasi karena itu mengubah ritme dan tekanan darah, yang dapat mempengaruhi fungsi jantung.",0.45,0.46588185590654074,0.9999999999666667,1.0
Apa itu penyakit kardiomegali?,"Kardiomegali adalah membesarnya ukuran jantung akibat penyakit tertentu, seperti tekanan darah tinggi atau penyakit jantung koroner. Tergantung pada penyebabnya, kondisi ini bisa terjadi secara permanen atau hanya sementara.\n\nKardiomegali biasanya terjadi karena penyakit atau kondisi yang menyebabkan jantung harus bekerja lebih keras untuk memompa darah. Akibatnya, otot jantung menebal sehingga ukuran jantung membesar.\n\nKardiomegali dapat terlihat melalui pemindaian, seperti foto Rontgen. Kondisi ini umumnya bukan merupakan suatu keadaan darurat. Namun, penting untuk mencari tahu penyebab kardiomegali sehingga penanganan yang tepat bisa diberikan dan komplikasinya dapat dicegah.","['Topik: Kardiomegali, Subtopik: Pengertian Kardiomegali \n Kardiomegali adalah membesarnya ukuran jantung akibat penyakit tertentu, seperti tekanan darah tinggi atau penyakit jantung koroner. Tergantung pada penyebabnya, kondisi ini bisa terjadi secara permanen atau hanya sementara.\nKardiomegali biasanya terjadi karena penyakit atau kondisi yang menyebabkan jantung harus bekerja lebih keras untuk memompa darah. Akibatnya, otot jantung menebal sehingga ukuran jantung membesar.\n\nKardiomegali dapat terlihat melalui pemindaian, seperti foto Rontgen. Kondisi ini umumnya bukan merupakan suatu keadaan darurat. Namun, penting untuk mencari tahu penyebab kardiomegali sehingga penanganan yang tepat bisa diberikan dan komplikasinya dapat dicegah.\n', 'Topik: Kardiomegali, Subtopik: Pengertian Kardiomegali \n Kardiomegali biasanya terjadi karena penyakit atau kondisi yang menyebabkan jantung harus bekerja lebih keras untuk memompa darah. Akibatnya, otot jantung menebal sehingga ukuran jantung membesar.\n\nKardiomegali dapat terlihat melalui pemindaian, seperti foto Rontgen. Kondisi ini umumnya bukan merupakan suatu keadaan darurat. Namun, penting untuk mencari tahu penyebab kardiomegali sehingga penanganan yang tepat bisa diberikan dan komplikasinya dapat dicegah.\n', 'Topik: Kardiomegali, Subtopik: Penyebab dan Faktor Risiko Kardiomegali \n Kardiomegali terjadi ketika otot jantung memompa darah lebih keras daripada yang seharusnya. Beban kerja yang berlebihan ini lama-lama menyebabkan otot jantung menebal sehingga ukuran jantung menjadi lebih besar.\nBeberapa kondisi yang dapat menyebabkan jantung bengkak atau kardiomegali adalah:\n- Hipertensi\n- Penyakit jantung koroner\n- Penyakit katup jantung\n- Kardiomiopati\n- Gangguan irama jantung (aritmia)\n- Penumpukan cairan di selaput pelindung jantung (efusi perikardium)\n- Gangguan hormon tiroid\n- Anemia\n- Kelebihan zat besi dalam tubuh (hemokromatosis)\n- Infeksi virus pada jantung\n- Infeksi HIV\n- Gagal ginjal\n- Penyakit paru, seperti penyakit paru obstruktif kronik (PPOK)\n- Penyakit amiloidosis\n\n- Penyakit jantung bawaan, seperti kelainan katup jantung atau koarktasio aorta\n\n- Kehamilan\nSelain kondisi-kondisi di atas, risiko kardiomegali juga lebih tinggi pada seseorang dengan beberapa faktor di bawah ini:\n- Memiliki berat badan berlebih atau obesitas\n- Kurang beraktivitas fisik dan berolahraga\n- Menderita kecanduan alkohol\n- Menyalahgunakan NAPZA\n- Pernah terkena serangan jantung\n\n- Memiliki keluarga dengan riwayat pembengkakan jantung\n']","Kardiomegali adalah suatu kondisi dimana ukuran jantung menjadi lebih besar akibat penyakit atau kondisi tertentu, seperti tekanan darah tinggi atau penyakit jantung koroner. Tergantung pada penyebabnya, kardiomegali bisa permanen atau hanya sementara. Kardiomegali umumnya terjadi karena otot jantung bekerja lebih keras untuk memompa darah akibat suatu penyakban yang menyebabkan jantung, seperti tekanan darah tinggi atau gangguan katup jantung.\n\nKondisi ini dapat menyebabkan otot jantung menjadi lebih tebal dan ukuran jantung mengecil. Kardiomegali bisa diketahui melalui pemindaian medis seperti foto Rontgen untuk menguji struktur dan fungsi jantung, yang umumnya bukan merupakan keadaan darurat. Namun, penting bagi pasien untuk mengetahui penyebab kardiomegali agar bisa diberikan penanganan yang tepat dan komplikasi dapat dicegah.\n\nPenyebab dan faktor risiko kardiomegali mencakup berbagai kondisi medis seperti hipertensi, penyakit jantung koroner, gangguan katup jantung, kardiomiopati, aritmias, efusi perikardium, penumpukan cairan di selaput pelindung jantung, kehamilan, obesitas, aktivitas fisik rendah, kurangnya narkoba, riwayat terkena serangan jantung, dan adanya penyakit lain yang berkaitan dengan jantung.\n\nDalam kasus di atas, konteks ini menjelaskan bahwa kardiomegali merupakan suatu penyakban pada jantung yang disebabkan oleh beberapa faktor risiko seperti hipertensi dan riwayat terkena serangan jantung. Penting bagi pasien untuk memahami penyebab kardiomegali ini agar bisa mencegahnya dengan cara yang tepat, termasuk menjaga tekanan darah dalam batas normal, tetap aktif dan berolahraga secara teratur, serta mengikuti dokter mereka untuk pemantauan kondisi jantung mereka.",0.88,0.7574593768557926,0.9999999999666667,1.0
Apa saja obat yang dapat mengatasi penyakit kardiomegali?,"Untuk mengatasi kardiomegali yang disebabkan oleh tekanan darah tinggi atau gagal jantung, dokter dapat memberikan beberapa obat-obatan berikut:\n\nObat penurun tekanan darah golongan ACE inhibitors, seperti captopril; atau obat ARB, seperti candesartan\nObat penghambat beta (beta blockers), seperti bisoprolol, untuk mengontrol tekanan darah dan meningkatkan fungsi pompa jantung\nObat diuretik, untuk mengurangi penumpukan cairan di dalam tubuh agar tekanan darah menurun dan pembengkakan berkurang\n\nUntuk mengatasi penyebab kardiomegali yang terkait dengan irama jantung, dokter dapat meresepkan obat pengontrol denyut jantung, seperti digoxin. Apabila pasien berisiko menderita stroke atau serangan jantung, dokter juga dapat memberikan obat pengencer darah.","['Topik: Kardiomegali, Subtopik: Pengobatan Kardiomegali \n Pengobatan kardiomegali berfokus untuk mengatasi penyebab pembesaran jantung. Metode pengobatannya mencakup pemberian obat atau operasi, tergantung pada penyebab dan tingkat keparahannya.\nUntuk mengatasi kardiomegali yang disebabkan oleh tekanan darah tinggi atau gagal jantung, dokter dapat memberikan beberapa obat-obatan berikut:\n- Obat penurun tekanan darah golongan ACE inhibitors, seperti captopril; atau obat ARB, seperti candesartan\n- Obat penghambat beta (beta blockers), seperti bisoprolol, untuk mengontrol tekanan darah dan meningkatkan fungsi pompa jantung\n- Obat diuretik, untuk mengurangi penumpukan cairan di dalam tubuh agar tekanan darah menurun dan pembengkakan berkurang\nUntuk mengatasi penyebab kardiomegali yang terkait dengan irama jantung, dokter dapat meresepkan obat pengontrol denyut jantung, seperti digoxin. Apabila pasien berisiko menderita stroke atau serangan jantung, dokter juga dapat memberikan obat pengencer darah.\nJika obat-obatan tidak cukup ampuh dalam mengatasi penyebab kardiomegali, dokter dapat melakukan operasi. Beberapa jenis operasi yang bisa dilakukan untuk menangani kardiomegali adalah:\n- Pemasangan alat pacu jantung atau implantable cardioverter-defibrillator (ICD), untuk memantau dan mengendalikan irama jantung\n- Operasi bypass jantung, untuk mengatasi penyumbatan pembuluh darah jantung pada kardiomegali yang disebabkan oleh penyakit jantung koroner\n\n- Operasi katup jantung, untuk mengganti katup yang bermasalah\n- Transplantasi atau pencangkokan jantung, sebagai pilihan terakhir jika berbagai prosedur medis lain tidak dapat menangani kardiomegali\nPeluang keberhasilan pengobatan kardiomegali akan lebih besar jika didukung dengan perubahan gaya hidup menjadi lebih sehat, seperti:\n- Berolahraga secara rutin\n- Mengelola stres dengan baik\n- Menjaga berat badan ideal\n\n- Membatasi asupan garam dalam makanan\n- Tidur yang cukup, sekitar 7  9 jam sehari\n- Berhenti merokok\n- Membatasi konsumsi minuman beralkohol atau berkafein\n\n- Menjaga kadar gula darah dan tekanan darah\nKardiomegali yang terjadi sementara, misalnya akibat kehamilan atau infeksi, biasanya dapat sembuh total dan jantung akan kembali ke ukuran normal. Sementara itu, kardiomegali yang disebabkan oleh penyakit lain biasanya bersifat permanen sehingga perlu terus diobati.\n', 'Topik: Kardiomegali, Subtopik: Pencegahan Kardiomegali \n Kardiomegali dapat dihindari dengan mencegah terjadinya penyakit penyebab dan faktor risikonya. Upaya yang dapat dilakukan adalah dengan menjalani gaya hidup sehat guna menjaga kesehatan jantung, seperti:\n- Mengonsumsi makanan yang baik untuk penderita jantung bengkak, seperti buah, sayur, ikan, susu rendah lemak, dan biji-bijian\n- Membatasi asupan garam dan lemak jenuh dalam makanan\n- Menghindari konsumsi minuman beralkohol\n- Berhenti merokok\n- Berolahraga rutin\n- Menjaga kadar kolesterol dan tekanan darah\n- Mencuci tangan dengan sabun dan air mengalir secara rutin\n', 'Topik: Kardiomegali, Subtopik: Penyebab dan Faktor Risiko Kardiomegali \n Kardiomegali terjadi ketika otot jantung memompa darah lebih keras daripada yang seharusnya. Beban kerja yang berlebihan ini lama-lama menyebabkan otot jantung menebal sehingga ukuran jantung menjadi lebih besar.\nBeberapa kondisi yang dapat menyebabkan jantung bengkak atau kardiomegali adalah:\n- Hipertensi\n- Penyakit jantung koroner\n- Penyakit katup jantung\n- Kardiomiopati\n- Gangguan irama jantung (aritmia)\n- Penumpukan cairan di selaput pelindung jantung (efusi perikardium)\n- Gangguan hormon tiroid\n- Anemia\n- Kelebihan zat besi dalam tubuh (hemokromatosis)\n- Infeksi virus pada jantung\n- Infeksi HIV\n- Gagal ginjal\n- Penyakit paru, seperti penyakit paru obstruktif kronik (PPOK)\n- Penyakit amiloidosis\n\n- Penyakit jantung bawaan, seperti kelainan katup jantung atau koarktasio aorta\n\n- Kehamilan\nSelain kondisi-kondisi di atas, risiko kardiomegali juga lebih tinggi pada seseorang dengan beberapa faktor di bawah ini:\n- Memiliki berat badan berlebih atau obesitas\n- Kurang beraktivitas fisik dan berolahraga\n- Menderita kecanduan alkohol\n- Menyalahgunakan NAPZA\n- Pernah terkena serangan jantung\n\n- Memiliki keluarga dengan riwayat pembengkakan jantung\n']","Obat-obatan yang dapat digunakan untuk mengatasi penyebab kardiomegali meliputi beberapa jenis obat berikut:\n\n1. Obat penurun tekanan darah golongan ACE inhibitors, seperti captopril atau ARB (angiotensin receptor blockers) seperti candesartan.\n2. Obat penghambat beta (beta blockers), seperti bisoprolol yang dapat mengontrol tekanan darah dan meningkatkan fungsi pompa jantung.\n3. Obat diuretik, misalnya furosemid atau torasemide, yang digunakan untuk mengurangi penumpukan cairan di dalam tubuh agar tekanan darah menurun dan pembengkakan berkurang.\n4. Obat pengontrol denyut jantung, seperti digoxin, yang dapat membantu mengendalikan ritme jantung.\n5. Dalam kasus tertentu, obat-obatan untuk mengendalikan ritme jantung atau obat pencegah stroke, sebagai preventif terhadap serangan jantung atau stroke.\n\nSemua obat ini dapat disesuaikan oleh dokter tergantung pada penyebab dan tingkat keparahan kardiomegali yang dialami pasien.",0.8888888888888888,0.6190678541137715,0.8333333332916666,1.0
Bagaimana kelainan jantung yang dialami oleh seseorang dengan penyakit tetralogy of fallot?,"Berikut ini adalah empat kelainan jantung yang terjadi pada ToF:\n\nVentricular septal defect (VSD), yaitu lubang di dinding yang memisahkan ventrikel kanan dan kiri\nPulmonary valve stenosis, yaitu penyempitan pada katup pembuluh darah yang ke paru-paru (katup pulmonal) sehingga darah dari jantung yang ke paru-paru berkurang\nPosisi aorta tidak normal, yakni bergeser ke kanan mengikuti VSD yang terbentuk\nRight ventricular hypertrophy atau penebalan pada otot ventrikel kanan jantung akibat jantung bekerja terlalu keras untuk memompa darah","['Topik: Tetralogy of Fallot, Subtopik: Pengertian Tetralogy of Fallot \n Tetralogy of Fallot adalah salah satu penyakit jantung bawaan pada bayi baru lahir. Penyakit jantung ini terdiri dari empat jenis kelainan struktur pada jantung bayi. Tetralogy of Fallot menyebabkan darah yang dialirkan ke seluruh tubuh bayi tidak mengandung cukup oksigen.\nTetralogy of Fallot (ToF) terjadi ketika bayi masih di dalam kandungan, tepatnya ketika jantungnya sedang berkembang. Di antara penyakit jantung bawaan yang ada, tetralogy of Fallot merupakan salah satu jenis yang umum ditemui. Namun, kondisi ini diperkirakan hanya terjadi pada 5 dari 10.000 kelahiran.\n\nKelainan struktur jantung pada ToF menyebabkan darah yang kaya oksigen bercampur dengan darah yang kekurangan oksigen. Akibatnya, darah yang mengalir ke seluruh tubuh tidak mengandung oksigen yang cukup dan bayi pun kekurangan oksigen.\nBerikut ini adalah empat kelainan jantung yang terjadi pada ToF:\n- Ventricular septal defect (VSD), yaitu lubang di dinding yang memisahkan ventrikel kanan dan kiri\n- Pulmonary valve stenosis, yaitu penyempitan pada katup pembuluh darah yang ke paru-paru (katup pulmonal) sehingga darah dari jantung yang ke paru-paru berkurang\n- Posisi aorta tidak normal, yakni bergeser ke kanan mengikuti VSD yang terbentuk\n- Right ventricular hypertrophy atau penebalan pada otot ventrikel kanan jantung akibat jantung bekerja terlalu keras untuk memompa darah\n', 'Topik: Tetralogy of Fallot, Subtopik: Pengertian Tetralogy of Fallot \n Tetralogy of Fallot (ToF) terjadi ketika bayi masih di dalam kandungan, tepatnya ketika jantungnya sedang berkembang. Di antara penyakit jantung bawaan yang ada, tetralogy of Fallot merupakan salah satu jenis yang umum ditemui. Namun, kondisi ini diperkirakan hanya terjadi pada 5 dari 10.000 kelahiran.\n\nKelainan struktur jantung pada ToF menyebabkan darah yang kaya oksigen bercampur dengan darah yang kekurangan oksigen. Akibatnya, darah yang mengalir ke seluruh tubuh tidak mengandung oksigen yang cukup dan bayi pun kekurangan oksigen.\nBerikut ini adalah empat kelainan jantung yang terjadi pada ToF:\n- Ventricular septal defect (VSD), yaitu lubang di dinding yang memisahkan ventrikel kanan dan kiri\n- Pulmonary valve stenosis, yaitu penyempitan pada katup pembuluh darah yang ke paru-paru (katup pulmonal) sehingga darah dari jantung yang ke paru-paru berkurang\n- Posisi aorta tidak normal, yakni bergeser ke kanan mengikuti VSD yang terbentuk\n- Right ventricular hypertrophy atau penebalan pada otot ventrikel kanan jantung akibat jantung bekerja terlalu keras untuk memompa darah\n', 'Topik: Tetralogy of Fallot, Subtopik: Komplikasi Tetralogy of Fallot \n Tetralogy of Fallot yang tidak tertangani atau tidak terkontrol dengan baik dapat menimbulkan komplikasi serius, seperti:\n- Gangguan tumbuh kembang anak\n- Gangguan irama jantung\n- Kejang\n- Peradangan di lapisan dalam jantung (endokarditis)\n- Kematian\nPenting untuk diingat, risiko terkena komplikasi ToF dapat berlanjut sampai masa remaja atau dewasa. Jika ToF tidak tertangani dengan baik, jantung penderita bisa saja mengalami masalah lagi walau sudah pernah menjalani operasi. Oleh sebab itu, penderita tetap harus kontrol secara rutin semasa hidupnya.\n']","Kelainan jantung pada orang yang mengalami Tetralogy of Fallot (ToF) terdiri dari empat penyakit struktur jantung, yaitu:\n\n1. Ventricular septal defect (VSD): ini merupakan lubang di dinding yang memisahkan ventrikel kanan dan kiri, menyebabkan darah yang mengandung oksigen dan kekurangan oksigen bercampur sehingga tidak cukup mengandung oksigen untuk dialirkan ke seluruh tubuh.\n2. Pulmonary valve stenosis: penyempitan pada katup pembuluh darah yang membuat darah dari jantung yang harus pergi ke paru-paru berkurang, menyebabkan kurangnya aliran darah ke paru-paru.\n3. Posisi aorta tidak normal: aorta bergeser ke kanan mengikuti VSD yang terbentuk, sehingga darah oksigen tidak dapat segera dialirkan ke otak dan sistem sirkulasi lainnya.\n4. Right ventricular hypertrophy atau penebalan pada otot ventrikel kanan jantung akibat jantung bekerja terlalu keras untuk memompa darah, menyebabkan tekanan dalam paru-paru meningkat dan mengurangi aliran oksigen ke seluruh tubuh.\n\nKomplikasi yang bisa timbul akibat tetralogy of fallot yang tidak terkontrol atau tidak diobati termasuk gangguan tumbuh kembang anak, gangguan irama jantung, kejang, peradangan di lapisan dalam jantung (endokarditis), dan bahkan kematian. Risiko terkena komplikasi ini bisa berlanjut sampai masa remaja atau dewasa, oleh sebab itu penderita tetap harus dikontrol secara rutin untuk mencegah risiko komplikasi serius.",0.875,0.5663996288072775,0.9999999999666667,1.0
Bagaimana cara mencegah bayi agar terhindar dari penyakit tetralogy of fallot?,"Penyakit jantung bawaan umumnya tidak dapat dicegah, termasuk tetralogy of Fallot. Namun, ada beberapa upaya yang dapat dilakukan oleh ibu hamil untuk mengurangi risiko bayi terlahir dengan kondisi ini, yaitu:\n\nKonsultasikan terlebih dahulu dengan dokter sebelum mengonsumsi obat-obatan, termasuk obat herbal atau obat yang bisa dibeli di apotik.\nKonsumsi suplemen asam folat 400 mcg setiap hari pada trimester pertama kehamilan.\nPastikan telah mendapatkan imunisasi rubella dan flu sebelum hamil.\nJalani pengobatan sesuai yang dianjurkan dokter jika menderita diabetes.\nHindari kebiasaan merokok dan paparan asap rokok, terutama selama hamil.\nJangan mengonsumsi minuman beralkohol dan menggunakan NAPZA.\nHindari kontak dengan orang yang sedang sakit atau terinfeksi.","['Topik: Tetralogy of Fallot, Subtopik: Pencegahan Tetralogy of Fallot \n Penyakit jantung bawaan umumnya tidak dapat dicegah, termasuk tetralogy of Fallot. Namun, ada beberapa upaya yang dapat dilakukan oleh ibu hamil untuk mengurangi risiko bayi terlahir dengan kondisi ini, yaitu:\n- Konsultasikan terlebih dahulu dengan dokter sebelum mengonsumsi obat-obatan, termasuk obat herbal atau obat yang bisa dibeli di apotik.\n- Konsumsi suplemen asam folat 400 mcg setiap hari pada trimester pertama kehamilan.\n- Pastikan telah mendapatkan imunisasi rubella dan flu sebelum hamil.\n- Jalani pengobatan sesuai yang dianjurkan dokter jika menderita diabetes.\n- Hindari kebiasaan merokok dan paparan asap rokok, terutama selama hamil.\n- Jangan mengonsumsi minuman beralkohol dan menggunakan NAPZA.\n- Hindari kontak dengan orang yang sedang sakit atau terinfeksi.\n', 'Topik: Tetralogy of Fallot, Subtopik: Pengertian Tetralogy of Fallot \n Tetralogy of Fallot adalah salah satu penyakit jantung bawaan pada bayi baru lahir. Penyakit jantung ini terdiri dari empat jenis kelainan struktur pada jantung bayi. Tetralogy of Fallot menyebabkan darah yang dialirkan ke seluruh tubuh bayi tidak mengandung cukup oksigen.\nTetralogy of Fallot (ToF) terjadi ketika bayi masih di dalam kandungan, tepatnya ketika jantungnya sedang berkembang. Di antara penyakit jantung bawaan yang ada, tetralogy of Fallot merupakan salah satu jenis yang umum ditemui. Namun, kondisi ini diperkirakan hanya terjadi pada 5 dari 10.000 kelahiran.\n\nKelainan struktur jantung pada ToF menyebabkan darah yang kaya oksigen bercampur dengan darah yang kekurangan oksigen. Akibatnya, darah yang mengalir ke seluruh tubuh tidak mengandung oksigen yang cukup dan bayi pun kekurangan oksigen.\nBerikut ini adalah empat kelainan jantung yang terjadi pada ToF:\n- Ventricular septal defect (VSD), yaitu lubang di dinding yang memisahkan ventrikel kanan dan kiri\n- Pulmonary valve stenosis, yaitu penyempitan pada katup pembuluh darah yang ke paru-paru (katup pulmonal) sehingga darah dari jantung yang ke paru-paru berkurang\n- Posisi aorta tidak normal, yakni bergeser ke kanan mengikuti VSD yang terbentuk\n- Right ventricular hypertrophy atau penebalan pada otot ventrikel kanan jantung akibat jantung bekerja terlalu keras untuk memompa darah\n', 'Topik: Tetralogy of Fallot, Subtopik: Gejala Tetralogy of Fallot: Kapan harus ke dokter \n Lakukan pemeriksaan ke dokter jika muncul gejala atau tanda di atas pada anak. Jika anak terlihat sesak dan bibirnya membiru (sianosis), posisikan anak berbaring menyamping dengan lutut menekuk ke dada dan jangan tunda untuk membawanya ke IGD rumah sakit terdekat.\nPenderita tetralogy of Fallot perlu rutin menjalani pemeriksaan ke dokter seumur hidupnya. Tujuannya adalah agar kondisinya selalu terpantau dan dapat menjalani aktivitas dengan baik.\n']","Untuk mencegah Tetralogy of Fallot, ibu hamil harus mengikuti prosedur kesehatan dan pemeriksaan medis secara rutin. Berikut cara ibu hamil dapat meningkatkan kesempatan untuk memiliki bayi bebas dari penyakit ini:\n\n1. Konsultasi dokter sebelum mengonsumsi obat-obatan, termasuk obat herbal atau yang bisa dibeli di apotik. Dokter akan memberikan nasehat kesehatan dan rekomendasi terkait penggunaan obat selama kehamilan.\n2. Konsumsi suplemen asam folat 400 mcg setiap hari pada trimester pertama kehamilan. Asam folat penting untuk pertumbuhan dan perkembangan janin, yang dapat membantu mengurangi risiko kelainan struktur jantung seperti Tetralogy of Fallot.\n3. Pastikan telah mendapatkan imunisasi rubella dan flu sebelum hamil. Infeksi ini bisa menyebabkan gangguan terhadap janin, termasuk penyakit jantung.\n4. Jalani pengobatan sesuai yang dianjurkan dokter, jika mengalami diabetes selama kehamilan. Pengendalian gula darah ini penting untuk mencegah masuknya bayi dalam keluarga risiko penyakit jantung lainnya.\n5. Hindari kebiasaan merokok dan paparan asap rokok, terutama selama kehamilan. Paparan rokok bisa meningkatkan risiko timbulnya penyakit jantung seperti Tetralogy of Fallot.\n6. Jangan mengonsumsi minuman beralkohol dan menggunakan NAPZA. Asupan alkohol dapat meningkatkan risiko kelainan struktur jantung pada janin.\n7. Hindari kontak dengan orang yang sedang sakit atau terinfeksi, untuk mencegah penularan infeksi kepala hingga bayi lahir.\n8. Bersosialisasikan dan belajar informasi tentang pencegahan tetralogy of Fallot melalui sumber resmi dan ahli seperti dokter spesialis jantung atau instansi kesehatan terdaftar, agar semakin memahami risiko dan upaya pencegahan yang tepat.",0.3888888888888889,0.6878167186498215,0.99999999995,1.0
Apa kelainan kondisi pada jantung seseorang yang mengalami takikardia?,"Takikardia adalah kondisi jantung yang berdetak melebihi 100 kali per menit. Normalnya, jantung berdetak 60–100 kali per menit. Jika detak jantung lebih dari 100 kali per menit, kondisi ini disebut takikardia.\n\nDetak jantung yang terlalu cepat dapat menyebabkan aliran darah yang masuk ke jantung berkurang. Kondisi ini membuat jantung tidak memiliki cukup darah untuk dialirkan ke seluruh tubuh. Akibatnya, organ dan jaringan yang tidak dialiri darah menjadi kekurangan oksigen.","['Topik: Takikardia, Subtopik: Pengertian Takikardia \n Takikardia adalah kondisi jantung yang berdetak melebihi 100 kali per menit. Takikardia dapat terjadi sebagai respons dari kondisi normal, penyakit, atau gangguan irama jantung (aritmia).\nNormalnya, jantung berdetak 60  100 kali per menit. Jika detak jantung lebih dari 100 kali per menit, kondisi ini disebut takikardia.\n\nTakikardia terbagi dua, yaitu takikardia sinus dan aritmia. Takikardia sinus bisa terjadi ketika seseorang sedang berolahraga. Kondisi ini juga dapat terjadi sebagai respons tubuh terhadap stres, trauma, atau penyakit. Sementara aritmia terjadi akibat gangguan pada serambi atau bilik jantung sehingga detak jantung menjadi lebih cepat.\nTakikardia umumnya tidak menimbulkan gejala atau komplikasi. Namun, kondisi ini dapat mengganggu fungsi jantung jika dibiarkan tidak tertangani. Akibatnya, penderita bisa mengalami gagal jantung, stroke, serangan jantung mendadak, bahkan kematian.\n', 'Topik: Takikardia, Subtopik: Pengertian Takikardia \n Normalnya, jantung berdetak 60  100 kali per menit. Jika detak jantung lebih dari 100 kali per menit, kondisi ini disebut takikardia.\n\nTakikardia terbagi dua, yaitu takikardia sinus dan aritmia. Takikardia sinus bisa terjadi ketika seseorang sedang berolahraga. Kondisi ini juga dapat terjadi sebagai respons tubuh terhadap stres, trauma, atau penyakit. Sementara aritmia terjadi akibat gangguan pada serambi atau bilik jantung sehingga detak jantung menjadi lebih cepat.\nTakikardia umumnya tidak menimbulkan gejala atau komplikasi. Namun, kondisi ini dapat mengganggu fungsi jantung jika dibiarkan tidak tertangani. Akibatnya, penderita bisa mengalami gagal jantung, stroke, serangan jantung mendadak, bahkan kematian.\n', 'Topik: Takikardia, Subtopik: Pengobatan Takikardia \n Pengobatan takikardia bertujuan untuk menurunkan detak jantung yang cepat, mencegah kekambuhan dan komplikasi, serta mengatasi penyebab takikardia.\nBagi penderita yang mengalami takikardia sinus, dokter akan menangani penyebabnya. Jika penyebabnya adalah stres, dokter akan meminta pasien untuk memperbaiki gaya hidup sehingga stres bisa mereda. Sementara jika penyebabnya adalah kondisi medis, dokter akan memberikan pengobatan sesuai kondisi pasien.\nPada pasien takikardia supaventrikuler, dokter akan menganjurkan untuk beristirahat yang cukup, mengurangi konsumsi minuman beralkohol atau berkafein, dan berhenti merokok.\nSementara itu, bagi penderita takikardia yang disertai dengan gangguan irama jantung (aritmia), ada beberapa penanganan yang dapat dilakukan, yaitu:\n']","Kelainan kondisi pada jantung seseorang yang mengalami takikardia, seperti yang dijelaskan dalam konteks tersebut, adalah perubahan ritme atau detak jantung (aritmia) melebihi 100 kali per menit. Takikardia dapat disebabkan oleh beberapa faktor, termasuk penyakit jaringan jantung, obesitas, diabetes, asam urat tinggi, dan merokok. Selain itu, penggunaan stimulan psikoaktif atau minuman keras juga dapat menyebabkan takikardia.\n\nKondisi ini umumnya tidak menimbulkan gejala, tetapi bisa mengganggu fungsi jantung dan memicu komplikasi seperti gagal jantung, stroke, serangan jantung mendadak, bahkan kematian. Oleh karena itu, pengobatan takikardia perlu dilakukan dengan cermat untuk mencegah hal tersebut.",0.6470588235294118,0.45248950070085775,0.9999999999666667,0.5
Siapa saja orang yang berisiko mengalami takikardia?,"Takikardia atau aritmia lebih sering terjadi pada orang dengan faktor berikut:\n\nBerusia lanjut\nMemiliki penyakit endokrin, seperti diabetes atau penyakit tiroid, yang tidak terkontrol\nMemiliki hipertensi yang tidak terkontrol\nMengalami infeksi bakteri atau virus yang berat\nMenderita atau pernah mengalami hipertensi pulmonal\nMengonsumsi minuman beralkohol secara berlebihan\nMenggunakan NAPZA\nTidak cukup mengonsumsi kalsium, magnesium, atau kalium\n\nTakikardia supraventrikuler lebih sering dialami oleh wanita dan anak-anak, orang yang memiliki kebiasaan merokok, serta orang yang mengonsumsi minuman beralkohol atau berkafein secara berlebihan.","['Topik: Takikardia, Subtopik: Faktor risiko takikardia \n Meski dapat dialami oleh siapa saja, takikardia lebih berisiko terjadi pada orang yang anggota keluarganya menderita aritmia. Selain itu, takikardia atau aritmia lebih sering terjadi pada orang dengan faktor berikut:\n- Berusia lanjut\n- Memiliki penyakit endokrin, seperti diabetes atau penyakit tiroid, yang tidak terkontrol\n- Memiliki hipertensi yang tidak terkontrol\n- Mengalami infeksi bakteri atau virus yang berat\n- Menderita atau pernah mengalami hipertensi pulmonal\n\n- Mengonsumsi minuman beralkohol secara berlebihan\n- Menggunakan NAPZA\n- Tidak cukup mengonsumsi kalsium, magnesium, atau kalium\n\nTakikardia supraventrikuler lebih sering dialami oleh wanita dan anak-anak, orang yang memiliki kebiasaan merokok, serta orang yang mengonsumsi minuman beralkohol atau berkafein secara berlebihan.\n', 'Topik: Takikardia, Subtopik: Pengertian Takikardia \n Takikardia adalah kondisi jantung yang berdetak melebihi 100 kali per menit. Takikardia dapat terjadi sebagai respons dari kondisi normal, penyakit, atau gangguan irama jantung (aritmia).\nNormalnya, jantung berdetak 60  100 kali per menit. Jika detak jantung lebih dari 100 kali per menit, kondisi ini disebut takikardia.\n\nTakikardia terbagi dua, yaitu takikardia sinus dan aritmia. Takikardia sinus bisa terjadi ketika seseorang sedang berolahraga. Kondisi ini juga dapat terjadi sebagai respons tubuh terhadap stres, trauma, atau penyakit. Sementara aritmia terjadi akibat gangguan pada serambi atau bilik jantung sehingga detak jantung menjadi lebih cepat.\nTakikardia umumnya tidak menimbulkan gejala atau komplikasi. Namun, kondisi ini dapat mengganggu fungsi jantung jika dibiarkan tidak tertangani. Akibatnya, penderita bisa mengalami gagal jantung, stroke, serangan jantung mendadak, bahkan kematian.\n', 'Topik: Takikardia, Subtopik: Pengertian Takikardia \n Normalnya, jantung berdetak 60  100 kali per menit. Jika detak jantung lebih dari 100 kali per menit, kondisi ini disebut takikardia.\n\nTakikardia terbagi dua, yaitu takikardia sinus dan aritmia. Takikardia sinus bisa terjadi ketika seseorang sedang berolahraga. Kondisi ini juga dapat terjadi sebagai respons tubuh terhadap stres, trauma, atau penyakit. Sementara aritmia terjadi akibat gangguan pada serambi atau bilik jantung sehingga detak jantung menjadi lebih cepat.\nTakikardia umumnya tidak menimbulkan gejala atau komplikasi. Namun, kondisi ini dapat mengganggu fungsi jantung jika dibiarkan tidak tertangani. Akibatnya, penderita bisa mengalami gagal jantung, stroke, serangan jantung mendadak, bahkan kematian.\n']","Orang yang berisiko mengalami takikardia termasuk mereka yang memiliki faktor risiko seperti orang yang anggota keluarganya menderita aritmia, pria usia lanjut, orang dengan penyakit endokrin atau hipertensi yang tidak terkontrol, serta mereka yang mengalami infeksi bakteri atau virus berat, dan penderita atau pernah mengalami hipertensi pulmonal. Selain itu, faktanya orang yang memiliki kebiasaan merokok, mengonsumsi minuman beralkohol secara berlebihan, serta menggunakan NAPZA juga cenderung lebih rentan terkena takikardia.",0.8888888888888888,0.9863143209111204,0.9999999999666667,1.0
Apa penyebab seseorang mengalami iskemia?,"Iskemia umumnya disebabkan oleh aterosklerosis, yaitu penumpukan plak lemak di pembuluh darah. Akibatnya, aliran darah pun menjadi terhambat. Penumpukan ini terjadi secara perlahan sehingga jarang disadari.\n\nSelain itu, plak di pembuluh darah bisa pecah dan membentuk gumpalan darah, yang dapat menyumbat pembuluh darah dan menghentikan aliran darah secara tiba-tiba. Gumpalan darah tersebut juga dapat terlepas dan menyumbat pembuluh darah di area lain. Kondisi ini disebut sebagai emboli.","['Topik: Iskemia, Subtopik: Penyebab Iskemia \n Iskemia umumnya disebabkan oleh aterosklerosis, yaitu penumpukan plak lemak di pembuluh darah. Akibatnya, aliran darah pun menjadi terhambat. Penumpukan ini terjadi secara perlahan sehingga jarang disadari.\nSelain itu, plak di pembuluh darah bisa pecah dan membentuk gumpalan darah, yang dapat menyumbat pembuluh darah dan menghentikan aliran darah secara tiba-tiba. Gumpalan darah tersebut juga dapat terlepas dan menyumbat pembuluh darah di area lain. Kondisi ini disebut sebagai emboli.\n', 'Topik: Iskemia, Subtopik: Pengertian Iskemia \n Iskemia adalah terganggunya aliran darah ke jaringan atau organ tubuh akibat adanya gangguan di pembuluh darah. Kondisi ini dapat terjadi di seluruh tubuh, mulai dari jaringan pada tungkai, saluran pencernaan, jantung, hingga otak. \nKetika terjadi iskemia, jaringan atau organ tidak mendapat cukup oksigen. Jika terjadi cukup lama, jaringan atau organ tersebut tidak dapat berfungsi dengan baik, bahkan bisa mengalami kerusakan. Oleh karena itu, iskemia bisa menyebabkan kondisi yang fatal jika terjadi pada organ yang vital, seperti jantung atau otak.\n\n', 'Topik: Iskemia, Subtopik: Diagnosis Iskemia: 3. Pemeriksaan iskemia pada otak \n - CT scan otak, untuk memastikan apakah gejala yang terjadi disebabkan oleh iskemia, perdarahan, atau tumor\n- MRI otak, untuk mengetahui seberapa besar jaringan otak yang terdampak iskemia\n']","Penyebab umum yang menyebabkan seseorang mengalami iskemia adalah arteri sklerosis, yaitu penumpukan lemak di dalam arteri. Hal ini membuat aliran darah menjadi terhambat dan sulit untuk mencapai jaringan atau organ tubuh yang dibutuhkan oksigen. Selain itu, plak lemak dalam arteri bisa pecah dan membentuk gumpalan darah yang mengganggu aliran darah secara signifikan. Gumpalan ini kemudian bisa terlepas dan menyumbat pembuluh darah di area lain, termasuk ke dalam organ atau jaringan tubuh tertentu. Kondisi ini disebut sebagai emboli.\n\nIskemia yang disebabkan oleh arteri sklerosis bisa meningkat secara perlahan dan seringkali tidak terasa sampai menyebabkan gejala-gejala yang lebih parah, seperti stroke atau gangguan fungsi tubuh lainnya. Oleh karena itu, penyebab iskemia secara umum diawali dari penumpukan lemak di dalam arteri dan akibatnya terhambatnya aliran darah ke jaringan atau organ tubuh yang memerlukan oksigen.",1.0,0.558104113399763,0.99999999995,1.0
Apa gejala iskemia yang terjadi di bagian jantung?,"Iskemia di jantung terjadi pada pembuluh darah koroner yang tersumbat sebagian atau seluruhnya. Kondisi ini bisa menyebabakn serangan jantung. \n\nGejala yang dapat muncul akibat iskema jantung antara lain:\n\nNyeri dada seperti tertekan\nNyeri di leher, rahang, bahu, atau lengan\nDetak jantung menjadi lebih cepat\nSesak napas, terutama saat melakukan aktivitas fisik\nMual dan muntah\nBerkeringat dingin\nLemas\nPusing atau sakit kepala ","['Topik: Iskemia, Subtopik: Gejala Iskemia: Iskemia di jantung  \n Iskemia di jantung terjadi pada pembuluh darah koroner yang tersumbat sebagian atau seluruhnya. Kondisi ini bisa menyebabakn serangan jantung. \nGejala yang dapat muncul akibat iskema jantung antara lain:\n- Nyeri dada seperti tertekan\n- Nyeri di leher, rahang, bahu, atau lengan\n- Detak jantung menjadi lebih cepat\n- Sesak napas, terutama saat melakukan aktivitas fisik\n- Mual dan muntah\n- Berkeringat dingin\n- Lemas\n- Pusing atau sakit kepala \n', 'Topik: Iskemia, Subtopik: Gejala Iskemia: Kapan harus ke dokter  \n Iskemia di otak, jantung, perut, atau tungkai bisa berakibat fatal. Namun, iskemia di bagian tubuh lainnya juga dapat menyebabkan kondisi yang serius. Segera cari pertolongan medis jika Anda mengalami gejala berikut: \n- Nyeri berat di dada \n- Nyeri dada yang tidak kunjung reda \n- Kesulitan bernapas \n- Gejala stroke, seperti lemah di tungkai, mati rasa, pusing, sulit bicara, atau hilang penglihatan \n- Nyeri perut yang parah\n- Tungkai, lengan, atau jari terasa dingin, berwarna kebiruan, dan mati rasa\n', 'Topik: Iskemia, Subtopik: Pengertian Iskemia \n Iskemia adalah terganggunya aliran darah ke jaringan atau organ tubuh akibat adanya gangguan di pembuluh darah. Kondisi ini dapat terjadi di seluruh tubuh, mulai dari jaringan pada tungkai, saluran pencernaan, jantung, hingga otak. \nKetika terjadi iskemia, jaringan atau organ tidak mendapat cukup oksigen. Jika terjadi cukup lama, jaringan atau organ tersebut tidak dapat berfungsi dengan baik, bahkan bisa mengalami kerusakan. Oleh karena itu, iskemia bisa menyebabkan kondisi yang fatal jika terjadi pada organ yang vital, seperti jantung atau otak.\n\n']","Gejala iskemia yang terjadi di bagian jantung termasuk nyeri dada seperti tertekan, detak jantung menjadi lebih cepat, sesak napas, mual dan muntah, berkeringat dingin, lemas, serta pusing atau sakit kepala.",1.0,0.5923423692670778,0.8333333332916666,1.0
Bagaimana cara mengobati penyakit bradikardia?,"Pengobatan bradikardia akan disesuaikan dengan tingkat keparahannya dan penyebabnya. Sebagai contoh, jika penyebabnya adalah hipotiroidisme, dokter akan memberikan terapi yang sesuai untuk mengobati kondisi tersebut.\n\nSementara pada bradikardia yang disebabkan oleh penggunaan obat-obatan, dokter akan menurunkan dosis obat, mengganti jenis obat, atau menghentikan pengobatan.\n\nJika metode di atas tidak menunjukkan perbaikan atau kondisi pasien memburuk, dokter mungkin akan menyarankan penggunaan alat pacu jantung. Alat ini ditanam di dalam dada sebagai pengirim sinyal listrik ke jantung. Dengan begitu, detak jantung dapat kembali normal.","['Topik: Bradikardia, Subtopik: Pengobatan Bradikardia \n Pengobatan bradikardia akan disesuaikan dengan tingkat keparahannya dan penyebabnya. Sebagai contoh, jika penyebabnya adalah hipotiroidisme, dokter akan memberikan terapi yang sesuai untuk mengobati kondisi tersebut.\nSementara pada bradikardia yang disebabkan oleh penggunaan obat-obatan, dokter akan menurunkan dosis obat, mengganti jenis obat, atau menghentikan pengobatan.\nJika metode di atas tidak menunjukkan perbaikan atau kondisi pasien memburuk, dokter mungkin akan menyarankan penggunaan alat pacu jantung. Alat ini ditanam di dalam dada sebagai pengirim sinyal listrik ke jantung. Dengan begitu, detak jantung dapat kembali normal.\n', 'Topik: Bradikardia, Subtopik: Pencegahan Bradikardia \n Bradikardia tidak selalu bisa dicegah. Namun, ada beberapa upaya yang dapat dilakukan untuk menurunkan risiko terkena bradikardia, yaitu:\n- Mengonsumsi makanan bergizi seimbang, serta rendah garam dan gula\n- Tidak merokok atau menghentikan kebiasaan merokok\n- Menghindari penggunaan NAPZA\n- Tidak mengonsumsi minuman beralkohol\n- Menjaga berat badan ideal\n\n- Berolahraga secara rutin\n- Mengelola stres dengan baik\nSelain cara-cara di atas, lakukan pemeriksaan tekanan darah, kolesterol, dan kadar gula darah secara berkala ke dokter.\n', 'Topik: Bradikardia, Subtopik: Diagnosis Bradikardia \n Untuk mendiagnosis bradikardia, dokter akan bertanya seputar gejala yang muncul, riwayat penyakit dan obat-obatan yang dikonsumsi pasien. Setelah itu, dokter akan melakukan pemeriksaan fisik, termasuk mengukur tekanan darah dan denyut nadi serta mendengarkan detak jantung pasien menggunakan stetoskop.\nUntuk memastikan diagnosis, dokter akan melakukan pemeriksaan penunjang berikut:\n- Elektrokardiografi (EKG), untuk mengetahui aliran listrik pada jantung. Namun, EKG bisa menunjukkan hasil yang normal jika pada saat pemeriksaan pasien tidak mengalami bradikardia.\n- Holter monitoring, untuk mendeteksi bradikardia yang mungkin terjadi di lain waktu. Alat ini dapat merekam aktivitas listrik pada jantung secara terus-menerus selama 1  2 hari.\n- Event recorder, untuk melihat aliran listrik pada jantung melalui monitor di alat tersebut. Event recorder akan merekam aktivitas listrik jantung ketika muncul gejala. Alat ini umumnya digunakan selama beberapa minggu hingga 1 bulan.\n']","Mengobati bradikardia melalui berbagai metode bergantung pada faktor-faktor seperti penyebab, tingkat keparahan, dan respon terhadap pengobatan. Berikut adalah beberapa cara mengobati bradikardia:\n\n1. Mengubah obat atau menurunkan dosis: Jika bradikardia disebabkan oleh obat-obatan tertentu, dokter mungkin akan merekomendasikan penggantian atau penurunan dosis obat tersebut.\n2. Penggunaan alat pacu jantung: Alat ini ditanam di dalam dada dan mengirim sinyal listrik ke jantung, yang kemudian mempercepat detak jantung untuk menghindari gangguan aritmia jantung.\n3. Pemulihan obat atau dosis: Jika bradikardia disebabkan oleh penyakit seperti hipotiroidisme, dokter akan mengobati penyakit tersebut dengan cara yang sesuai untuk menghilangkan penyebab bradikardia.\n4. Penggunaan obat-obatan lain: Dalam kasus tertentu, dokter mungkin akan merekomendasikan penggunaan obat-obatan lain yang dapat meningkatkan detak jantung atau mengurangi frekuensi denyut jantung.\n5. Pencegahan bradikardia: Upaya pen预防 bradikardia termasuk mengonsumsi makanan bergizi, tidak merokok, tidak menggunakan NAPZA, dan menjaga berat badan ideal melalui olahraga rutin dan pengelolaan stres.\n6. Pemeriksaan tekanan darah, kolesterol, dan kadar gula darah secara berkala: Mengukur parameter ini dapat membantu dokter mengetahui apakah pasien berisiko terkena penyakit jantung atau tidak.\n7. Lakukan pemeriksaan tekanan darah dan denyut nadi secara berkala: Pemeriksaan ini dapat membantu dokter mengetahui apakah pasien mengalami bradikardia atau tidak, serta menentukan metode pengobatan yang tepat.\n8. Pemulihan obat atau dosis: Jika penyebab bradikardia adalah obat-obatan, dokter mungkin akan merekomendasikan penggantian atau penurunan dosis obat tersebut untuk mengembalikan denyut jantung ke kondisi normal.",0.8,0.6108503992806463,0.9999999999,1.0
Bagaimana metode pemberian diagnosis pada pasien yang mengalami bradikardia?,"Untuk mendiagnosis bradikardia, dokter akan bertanya seputar gejala yang muncul, riwayat penyakit dan obat-obatan yang dikonsumsi pasien. Setelah itu, dokter akan melakukan pemeriksaan fisik, termasuk mengukur tekanan darah dan denyut nadi serta mendengarkan detak jantung pasien menggunakan stetoskop.\n\nUntuk memastikan diagnosis, dokter akan melakukan pemeriksaan penunjang berikut:\n\nElektrokardiografi (EKG), untuk mengetahui aliran listrik pada jantung. Namun, EKG bisa menunjukkan hasil yang normal jika pada saat pemeriksaan pasien tidak mengalami bradikardia.\nHolter monitoring, untuk mendeteksi bradikardia yang mungkin terjadi di lain waktu. Alat ini dapat merekam aktivitas listrik pada jantung secara terus-menerus selama 1–2 hari.\nEvent recorder, untuk melihat aliran listrik pada jantung melalui monitor di alat tersebut. Event recorder akan merekam aktivitas listrik jantung ketika muncul gejala. Alat ini umumnya digunakan selama beberapa minggu hingga 1 bulan.","['Topik: Bradikardia, Subtopik: Diagnosis Bradikardia \n Untuk mendiagnosis bradikardia, dokter akan bertanya seputar gejala yang muncul, riwayat penyakit dan obat-obatan yang dikonsumsi pasien. Setelah itu, dokter akan melakukan pemeriksaan fisik, termasuk mengukur tekanan darah dan denyut nadi serta mendengarkan detak jantung pasien menggunakan stetoskop.\nUntuk memastikan diagnosis, dokter akan melakukan pemeriksaan penunjang berikut:\n- Elektrokardiografi (EKG), untuk mengetahui aliran listrik pada jantung. Namun, EKG bisa menunjukkan hasil yang normal jika pada saat pemeriksaan pasien tidak mengalami bradikardia.\n- Holter monitoring, untuk mendeteksi bradikardia yang mungkin terjadi di lain waktu. Alat ini dapat merekam aktivitas listrik pada jantung secara terus-menerus selama 1  2 hari.\n- Event recorder, untuk melihat aliran listrik pada jantung melalui monitor di alat tersebut. Event recorder akan merekam aktivitas listrik jantung ketika muncul gejala. Alat ini umumnya digunakan selama beberapa minggu hingga 1 bulan.\n', 'Topik: Bradikardia, Subtopik: Pengobatan Bradikardia \n Pengobatan bradikardia akan disesuaikan dengan tingkat keparahannya dan penyebabnya. Sebagai contoh, jika penyebabnya adalah hipotiroidisme, dokter akan memberikan terapi yang sesuai untuk mengobati kondisi tersebut.\nSementara pada bradikardia yang disebabkan oleh penggunaan obat-obatan, dokter akan menurunkan dosis obat, mengganti jenis obat, atau menghentikan pengobatan.\nJika metode di atas tidak menunjukkan perbaikan atau kondisi pasien memburuk, dokter mungkin akan menyarankan penggunaan alat pacu jantung. Alat ini ditanam di dalam dada sebagai pengirim sinyal listrik ke jantung. Dengan begitu, detak jantung dapat kembali normal.\n', 'Topik: Bradikardia, Subtopik: Pengertian Bradikardia \n Bradikardia adalah kondisi jantung yang berdetak lebih lambat dari normal. Bradikardia yang parah merupakan kondisi serius yang dapat menyebabkan gejala berupa pusing berat, lemas, sesak napas, hingga pingsan.\nNormalnya, jantung berdetak sekitar 60  100 detak per menit. Namun, pada penderita bradikardia, detak jantungnya kurang dari 60 detak per menit. Kondisi ini normal terjadi pada atlet, lansia, atau saat sedang tidur.\n\nNamun, jika disertai keluhan lain, seperti nyeri dada atau sesak napas, bradikardia bisa menjadi salah satu gejala adanya gangguan aktivitas listrik pada jantung. Kondisi ini membuat jantung tidak dapat memompa cukup darah sesuai yang dibutuhkan tubuh. Akibatnya, akan terjadi gangguan pada organ, seperti otak dan jantung.\n']","Metode pemberian diagnosis pada pasien yang mengalami bradikardia melibatkan beberapa langkah, antara lain:\n\n1. Pertanyaan gejala dan riwayat penyakit: Dokter akan bertanya tentang apa saja gejala yang dialami oleh pasien, termasuk waktu terjadinya, keadaan fisik yang dirasakan, dan penggunaan obat-obatan.\n2. Pemeriksaan fisik: Dokter akan mengukur tekanan darah dan denyut nadi pasien untuk mengetahui tingkat aritmia jantung tersebut. Mereka juga akan mendengarkan detak jantung menggunakan stetoskop, yang biasanya bervariasi antara 60 hingga 100 denyut per menit.\n3. Pemeriksaan penunjang: Untuk memastikan diagnosis, dokter akan melakukan pemeriksaan tambahan berikut:\n   - Elektrokardiografi (EKG): Alat ini digunakan untuk mengetahui aliran listrik jantung dan mengidentifikasi gangguan ritme aritmia. Namun, hasil EKG normal tidak selalu bisa memastikan bahwa pasien tidak mengalami bradikardia karena adanya gangguan ritme tersebut dapat terjadi pada saat pemeriksaan.\n   - Holter monitoring: Alat ini akan merekam aktivitas aritmia jantung secara terus-menerus selama 1 hingga 2 hari, yang membantu dokter mengetahui apakah ada gejala bradikardia yang muncul di lain waktu.\n   - Event recorder: Alat ini digunakan untuk merekam detak jantung saat pasien mengalami gangguan ritme aritmia, sehingga dokter dapat melihat aktivitas aritmia ketika gejala tersebut muncul dan menentukan apakah hal itu dianggap sebagai bradikardia.\n4. Penggunaan alat pacu jantung: Jika metode pemeriksaan penunjang tidak dapat mengidentifikasi gangguan aritmia, dokter mungkin akan menyarankan penggunaan alat pacu jantung untuk menstabilkan ritme jantung.\n\nDengan metode ini, dokter dapat memastikan diagnosis bradikardia dan kemudian melakukan perawatan atau pengobatan yang sesuai untuk mengatasi aritmia tersebut.",0.8387096774193549,0.6987807136574191,0.8333333332916666,1.0
Apa gejala yang muncul pada anak yang mengalami miokarditis?,Tanda dan gejala yang umumnya muncul pada anak-anak dan bayi dengan miokarditis adalah: \n\nLemas\nHilang nafsu makan\nBatuk\nSulit bernapas\nDemam\nKulit pucat\nLebih rewel daripada biasanya\nNyeri dada\nTangan atau kaki yang dingin,"['Topik: Miokarditis, Subtopik: Gejala Miokarditis: Kapan harus ke dokter \n Lakukan pemeriksaan ke dokter jika Anda atau anak Anda mengalami gejala di atas, terutama jika ada keluhan nyeri dada dan sesak napas. Jika gejala memburuk atau tidak membaik dalam beberapa menit, jangan tunda untuk ke IGD rumah sakit terdekat, agar segera mendapat penanganan medis.\n', 'Topik: Miokarditis, Subtopik: Diagnosis Miokarditis \n Diagnosis miokarditis dimulai dengan tanya jawab mengenai kondisi pasien. Dokter akan menanyakan kepada pasien tentang:\n- Gejala yang dirasakan dan lama berlangsungnya\n- Penyakit yang pernah atau sedang diderita\nSelanjutnya, dokter akan melakukan pemeriksaan fisik. Pada pemeriksaan ini, dokter akan mendengarkan bunyi jantung dan pernapasan dengan menggunakan stetoskop, serta melihat apakah ada pembengkakan di tungkai dan kaki pasien.\nDokter juga mungkin akan melakukan beberapa pemeriksaan penunjang berikut untuk memastikan diagnosis dan menentukan penyebab miokarditis:\n- Tes darah, untuk mendeteksi  tanda-tanda infeksi atau penyakit autoimun\n- Elektrokardiogram (EKG), untuk memeriksa aktivitas listrik jantung\n\n- Foto Rontgen dada, untuk melihat ukuran dan bentuk jantung, serta untuk memeriksa kemungkinan adanya gagal jantung\n- Ekokardiografi atau USG jantung, untuk memeriksa fungsi pompa jantung, serta mendeteksi gumpalan darah di dalam jantung, penumpukan cairan di selaput jantung (efusi perikardium), gangguan pada katup jantung, dan pembesaran jantung\n\n- MRI jantung, untuk melihat ada tidaknya peradangan pada otot jantung\n- Kateterisasi jantung yang disertai biopsi otot jantung (pemeriksaan dari sampel otot jantung), untuk melihat kondisi jantung\n', 'Topik: Miokarditis, Subtopik: Pengertian Miokarditis \n Miokarditis adalah peradangan yang terjadi pada miokardium atau otot jantung. Peradangan ini umumnya disebabkan oleh infeksi bakteri atau virus. Namun, pada beberapa kasus, miokarditis juga dapat terjadi akibat paparan zat berbahaya atau penggunaan obat-obatan tertentu.\nMiokardium adalah otot jantung yang berperan memompa darah dari jantung ke seluruh tubuh. Peradangan pada otot jantung dapat menyebabkan gangguan irama jantung dan menurunkan kemampuan jantung dalam memompa darah. \n\nMiokarditis ditandai dengan nyeri dada, sesak napas, dan jantung berdebar. Pada kasus yang ringan, miokarditis bisa sembuh dengan perawatan sederhana, serta tidak menyebabkan komplikasi. Namun, jika tidak tertangani dengan benar, miokarditis bisa menyebabkan komplikasi serius, seperti gangguan irama jantung, gagal jantung, dan serangan jantung.\n']","Gejala yang umum dialami oleh anak-anak atau orang dewasa yang mengalami miokarditis termasuk nyeri dada, sesak napas, dan gangguan irama jantung. Selain itu, beberapa gejala lain yang mungkin terjadi pada pasien dengan miokarditis antara lain:\n\n1. Mengerakkan tangan atau mengayunkan tangan secara spontan (kardiomegm)\n2. Bermiring badan ke satu sisi, khususnya saat tidur atau berbaris\n3. Merasa lemah dan dewasa dalam melakukan aktivitas sehari-hari\n4. Mengalami mual, penglihatan, atau nyeri di bagian belakang tengah (sternum) yang bisa menjalar ke seluruh badan\n5. Muntah dan merasa gatal saat melakukan aktivitas ringan seperti berdiri atau duduk\n6. Mengalami gangguan tidur, misalnya sulit untuk tertidur atau sering bangun karena nyeri dada\n7. Menurunnya tekanan darah dan denyut nadi akibat penyakit lain yang terkait dengan miokarditis.\n\nJika ada gejala di atas, sangat penting untuk segera melakukan pemeriksaan ke dokter atau IGD agar dapat mendapatkan penanganan medis awal dan menghindari komplikasi seperti gangguan irama jantung, gagal jantung, serta serangan jantung.",0.38095238095238093,0.6132000230501958,0.3333333333,0.3
Bagaimana upaya pencegahan penyakit miokarditis?,"Sampai saat ini, belum diketahui secara pasti bagaimana cara untuk mencegah miokarditis. Namun, risiko terkena kondisi ini bisa dikurangi dengan melakukan upaya-upaya berikut:\n\nSelalu menjaga kebersihan diri, makanan, dan tempat tinggal \nMelakukan vaksinasi sesuai anjuran dokter\nMenghindari kontak dengan orang yang sedang sakit\nBerhubungan seks secara sehat, yaitu dengan memakai kondom dan tidak bergonta-ganti pasangan\nMengonsumsi obat sesuai aturan pakai dan dosis yang tertera, atau sesuai anjuran dokter\nMenghindari penggunaan obat-obatan terlarang","['Topik: Miokarditis, Subtopik: Pencegahan Miokarditis \n Sampai saat ini, belum diketahui secara pasti bagaimana cara untuk mencegah miokarditis. Namun, risiko terkena kondisi ini bisa dikurangi dengan melakukan upaya-upaya berikut:\n- Selalu menjaga kebersihan diri, makanan, dan tempat tinggal \n- Melakukan vaksinasi sesuai anjuran dokter\n- Menghindari kontak dengan orang yang sedang sakit\n- Berhubungan seks secara sehat, yaitu dengan memakai kondom dan tidak bergonta-ganti pasangan\n- Mengonsumsi obat sesuai aturan pakai dan dosis yang tertera, atau sesuai anjuran dokter\n- Menghindari penggunaan obat-obatan terlarang\n', 'Topik: Miokarditis, Subtopik: Pengertian Miokarditis \n Miokarditis adalah peradangan yang terjadi pada miokardium atau otot jantung. Peradangan ini umumnya disebabkan oleh infeksi bakteri atau virus. Namun, pada beberapa kasus, miokarditis juga dapat terjadi akibat paparan zat berbahaya atau penggunaan obat-obatan tertentu.\nMiokardium adalah otot jantung yang berperan memompa darah dari jantung ke seluruh tubuh. Peradangan pada otot jantung dapat menyebabkan gangguan irama jantung dan menurunkan kemampuan jantung dalam memompa darah. \n\nMiokarditis ditandai dengan nyeri dada, sesak napas, dan jantung berdebar. Pada kasus yang ringan, miokarditis bisa sembuh dengan perawatan sederhana, serta tidak menyebabkan komplikasi. Namun, jika tidak tertangani dengan benar, miokarditis bisa menyebabkan komplikasi serius, seperti gangguan irama jantung, gagal jantung, dan serangan jantung.\n', 'Topik: Miokarditis, Subtopik: Pengertian Miokarditis \n Miokardium adalah otot jantung yang berperan memompa darah dari jantung ke seluruh tubuh. Peradangan pada otot jantung dapat menyebabkan gangguan irama jantung dan menurunkan kemampuan jantung dalam memompa darah. \n\nMiokarditis ditandai dengan nyeri dada, sesak napas, dan jantung berdebar. Pada kasus yang ringan, miokarditis bisa sembuh dengan perawatan sederhana, serta tidak menyebabkan komplikasi. Namun, jika tidak tertangani dengan benar, miokarditis bisa menyebabkan komplikasi serius, seperti gangguan irama jantung, gagal jantung, dan serangan jantung.\n']","Upaya pencegahan miokarditis meliputi beberapa langkah sosial dan kebijakan kesehatan, seperti:\n\n1. Menjaga kebersihan diri, makanan, dan tempat tinggal: Meningkatkan pengetahuan tentang pentingnya menjaga kebersihan tubuh dan lingkungan akan membantu mencegah infeksi yang dapat menyebabkan miokarditis.\n2. Melakukan vaksinasi sesuai anjuran dokter: Vaksinasi merupakan salah satu metode paling efektif untuk melindungi diri dari penyakit infeksi, termasuk yang berkaitan dengan miokarditis.\n3. Menghindari kontak dengan orang yang sedang sakit: Mengurangi kesempatan terkena virus atau bakteri yang mungkin menyebabkan infeksi jantung.\n4. Berhubungan seks secara sehat, yaitu dengan memakai kondom dan tidak bergonta-ganti pasangan: Mencegah penularan penyakit melalui pemakaian kondom selama hubungan seksual adalah metode yang efektif untuk mencegah infeksi jantung.\n5. Mengonsumsi obat sesuai aturan pakai dan dosis yang tertera, atau sesuai anjuran dokter: Penggunaan obat dengan benar akan membantu mengurangi risiko munculnya infeksi jantung.\n6. Menghindari penggunaan obat-obatan terlarang: Menggunakan obat-obatan yang tidak sehat, termasuk alkohol dan narkotika, juga dapat memperparah kondisi miokarditis atau meningkatkan risiko munculnya penyakit jantung.\n\nDengan mengikuti langkah-langkah ini, risiko terkena miokarditis bisa dikurangi secara signifikan, sekaligus mempertahankan kesehatan dan kehidupan individu.",0.42857142857142855,0.6666200275505232,0.9999999999,1.0
Apa gejala yang muncul pada penderita hipertensi pulmonal?,Beberapa gejala awal hipertensi pulmonal yang mungkin muncul adalah:\n\nNapas yang pendek atau terputus-putus\nNyeri atau rasa tertekan di dada\nNyeri di perut bagian kanan atas\nJantung berdebar\nLemas\nSuara serak\nHilang nafsu makan\n\nSedangkan gejala yang muncul saat kondisi telah bertambah parah meliputi:\n\nPembengkakan di area tungkai dan perut\nPusing saat sedang berolahraga\nWarna bibir atau kulit yang kebiruan\nBatuk kering atau batuk berdarah\nPingsan,"['Topik: Hipertensi Pulmonal, Subtopik: Gejala Hipertensi Pulmonal: Kapan harus ke dokter \n Periksakan diri Anda ke dokter jika mengalami gejala seperti yang telah disebutkan di atas. Gejala hipertensi pulmonal dapat menyerupai gejala dari kondisi lain. Oleh sebab itu, diperlukan pemeriksaan untuk memastikan kondisi yang dialami.\nDiagnosis hipertensi pulmonal sebaiknya diketahui sedini mungkin, bahkan sebelum gejala muncul. Dengan begitu, potensi kesembuhan meningkat dan risiko terjadinya komplikasi dapat dicegah. Oleh karena itu, jika Anda memiliki faktor risiko hipertensi pulmonal, disarankan untuk melakukan pemeriksaan ke dokter secara rutin.\nSegera cari pertolongan medis jika Anda mengalami gejala yang serius, seperti:\n- Nyeri atau rasa tidak nyaman di dada yang disertai dengan sesak napas, berkeringat, mual, dan kelelahan\n- Denyut jantung yang sangat cepat hingga lebih dari 120  150 per menit, terutama jika disertai dengan sesak napas\n- Sesak napas yang tidak dapat diredakan dengan beristirahat\n- Lemah atau lumpuh di lengan dan tungkai yang terjadi tanpa sebab yang jelas\n- Sakit kepala berat yang muncul secara tiba-tiba\n', 'Topik: Hipertensi Pulmonal, Subtopik: Diagnosis Hipertensi Pulmonal \n Dokter akan bertanya mengenai gejala yang dialami, riwayat kesehatan pasien dan keluarga, serta obat-obatan yang sedang dikonsumsi. Dokter juga akan melakukan pemeriksaan fisik secara menyeluruh, termasuk mendengarkan suara jantung dan paru-paru melalui stetoskop, serta memeriksa pembengkakan di tungkai dan pergelangan kaki.\nGuna memastikan diagnosis, beberapa pemeriksaan penunjang juga perlu dilakukan. Karena gejala hipertensi pulmonal mirip dengan beberapa penyakit jantung, dokter akan mengawali dengan pemeriksaan jantung, di antaranya:\n', 'Topik: Hipertensi Pulmonal, Subtopik: Pengobatan Hipertensi Pulmonal \n Hipertensi pulmonal merupakan penyakit yang belum dapat disembuhkan. Pengobatan hanya bertujuan untuk meredakan gejala dan menghambat perkembangan penyakit. Jika didiagnosis dan ditangani sejak dini, kerusakan arteri pulmonal secara permanen dapat dicegah.\nPengobatan hipertensi pulmonal dapat dilakukan dengan menangani kondisi itu sendiri, atau mengatasi penyebab yang mendasarinya. Beberapa metode pengobatan yang dapat dilakukan meliputi:\n']","Gejala hipertensi pulmonal (HPP) bisa beragam dan mencakup beberapa gejala umum, seperti sesak napas, perubahan dalam penggantian nafas, fokus mudah lelah, kenikmatan yang tak terkendali, bising di telinga, penyumbatan jantung, dan perubahan warna darah. Gejala serius termasuk rasa gemetar atau nyaman di dada, sesak napas yang tidak dapat diredakan, denyut jantung cepat, sifat fisik menurun, gangguan visu (seperti berkedip mata), dan penyumbatan aliran darah.\n\nJika Anda atau si Who mengalami gejala yang kian membingungkan, segera hubungi dokter untuk mendapatkan pemeriksaan medis lebih lanjut dan diagnosis yang akurat.",0.4444444444444444,0.5996869718439377,0.99999999995,0.25
Apa obat yang dapat diberikan pada penderita hipertensi pulmonal?,"Jenis obat yang bisa diberikan antara lain:\n\nSildenafil atau tadalafil\nSildenafil dan tadalafil berfungsi membuka pembuluh darah paru-paru agar darah dapat mengalir dengan lebih mudah.\n\nAntagonis kalsium\nObat ini berfungsi melemaskan otot pembuluh darah, tetapi hanya ampuh pada sebagian penderita hipertensi pulmonal. Beberapa obat yang termasuk ke dalam golongan ini adalah nifedipine, diltiazem, dan amlodipine.\n\nAntikoagulan\nAntikoagulan, seperti warfarin, merupakan obat pengencer darah yang berfungsi menghambat terbentuknya gumpalan darah di arteri paru-paru. Meski obat ini sering digunakan, penggunaannya perlu dievaluasi secara rutin karena dapat meningkatkan risiko terjadinya perdarahan.\n\nDiuretik\nDiuretik adalah obat yang berfungsi mengurangi cairan di dalam tubuh sehingga kerja jantung menjadi lebih ringan. Obat ini juga dapat mengurangi penumpukan cairan di paru-paru, tungkai, dan perut pada pasien yang sudah mengalami komplikasi gagal jantung.\n\nDigoxin\nDigoxin adalah obat yang berfungsi membantu jantung berdenyut lebih kuat agar dapat memompa lebih banyak darah. Obat ini juga dapat mengendalikan denyut jantung menjadi lebih teratur.\n\nVasodilator\nVasodilator digunakan untuk melemaskan dan membuka pembuluh darah yang menyempit di paru-paru. Dengan begitu, darah dapat mengalir lebih baik. Contoh obat dari golongan ini antara lain epoprostenol, beraprost, dan iloprost.","['Topik: Hipertensi Pulmonal, Subtopik: Pengobatan Hipertensi Pulmonal \n Hipertensi pulmonal merupakan penyakit yang belum dapat disembuhkan. Pengobatan hanya bertujuan untuk meredakan gejala dan menghambat perkembangan penyakit. Jika didiagnosis dan ditangani sejak dini, kerusakan arteri pulmonal secara permanen dapat dicegah.\nPengobatan hipertensi pulmonal dapat dilakukan dengan menangani kondisi itu sendiri, atau mengatasi penyebab yang mendasarinya. Beberapa metode pengobatan yang dapat dilakukan meliputi:\n', 'Topik: Hipertensi Pulmonal, Subtopik: Pengobatan Hipertensi Pulmonal: Terapi oksigen \n Dokter dapat memberikan suplemen oksigen pada pasien hipertensi pulmonal yang hidup di dataran tinggi atau mengalami sleep apnea.\n', 'Topik: Hipertensi Pulmonal, Subtopik: Penyebab Hipertensi Pulmonal: Faktor Risiko Hipertensi Pulmonal \n Risiko terkena hipertensi pulmonal lebih dapat meningkat pada orang dengan kondisi berikut:\n- Berjenis kelamin wanita\n- Berusia 30 tahun ke atas\n- Menderita berat badan berlebih\n- Memiliki keluarga dengan riwayat hipertensi pulmonal\n- Menderita kelainan lahir, seperti penyakit jantung bawaan atau sindrom Down\n\n- Memiliki kondisi medis lain, seperti penyakit hati, penyakit penggumpalan darah, penyakit ginjal kronis, atau penyakit tiroid\n- Mengonsumsi obat-obatan penurun berat badan\n- Mengonsumsi obat selective serotonin reuptake inhibitors (SSRIs) untuk mengatasi depresi dan gangguan kecemasan\n- Memiliki kebiasaan merokok\n- Menyalahgunakan NAPZA, seperti kokain\n- Terpapar asbes\n']","Dari konteks yang diberikan, tidak ada informasi khusus tentang obat-obatan yang dapat diberikan pada penderita hipertensi pulmonal. Namun, metode pengobatan umumnya meliputi penyembuhan terapi lokal atau menghilangkan faktor risiko yang mendasari penyakit ini. Beberapa obat-obatan dan teknik pengobatan lainnya yang mungkin diterapkan untuk mengatasi hipertensi pulmonal termasuk:\n\n1. Suplemen oksigen, seperti yang dijelaskan dalam subtopik terapi oksigen, dimana obat ini bisa membantu pasien yang hidup di dataran tinggi atau mengalami sleep apnea.\n2. Terapia lokal dan/atau operasi, jika perlu untuk mencegah kerusakan arteri pulmonal secara permanen.\n3. Penghentian faktor risiko, seperti pengurangan berat badan, menghindari merokok, mengontrol tekanan darah dan menjauhi obat-obatan penurun berat badan atau SSRIs yang mempunyai potensi untuk meningkatkan resiko hipertensi pulmonal.\n4. Pemberian terapi kardiologis sesuai dengan kebutuhan pasien lainnya, seperti penghentian asupan minuman beralkohol dan mengontrol tekanan darah untuk mencegah penyumbatan arteri yang bisa merusak paru-paru.\n5. Penggunaan obat-obatan lainnya, seperti antiplatelet atau antikoagulan, jika pasien memiliki riwayat penyakit penggumpalan darah atau kelainan hati yang signifikan.\n\nNamun, perlu dicatat bahwa obat-obatan ini harus diberikan dan direncanakan secara ketat di bawah perawatan dokter gigi serta mempertimbangkan faktor risiko pasien hipertensi pulmonal yang spesifik.",0.3,0.0,0.9999999999666667,0.0
Apa saja hal yang dapat meningkatkan risiko terkena penyakit hipertensi pulmonal?,"Risiko terkena hipertensi pulmonal lebih dapat meningkat pada orang dengan kondisi berikut:\n\nBerjenis kelamin wanita\nBerusia 30 tahun ke atas\nMenderita berat badan berlebih\nMemiliki keluarga dengan riwayat hipertensi pulmonal\nMenderita kelainan lahir, seperti penyakit jantung bawaan atau sindrom Down\nMemiliki kondisi medis lain, seperti penyakit hati, penyakit penggumpalan darah, penyakit ginjal kronis, atau penyakit tiroid\nMengonsumsi obat-obatan penurun berat badan\nMengonsumsi obat selective serotonin reuptake inhibitors (SSRIs) untuk mengatasi depresi dan gangguan kecemasan\nMemiliki kebiasaan merokok\nMenyalahgunakan NAPZA, seperti kokain\nTerpapar asbes","['Topik: Hipertensi Pulmonal, Subtopik: Penyebab Hipertensi Pulmonal: Faktor Risiko Hipertensi Pulmonal \n Risiko terkena hipertensi pulmonal lebih dapat meningkat pada orang dengan kondisi berikut:\n- Berjenis kelamin wanita\n- Berusia 30 tahun ke atas\n- Menderita berat badan berlebih\n- Memiliki keluarga dengan riwayat hipertensi pulmonal\n- Menderita kelainan lahir, seperti penyakit jantung bawaan atau sindrom Down\n\n- Memiliki kondisi medis lain, seperti penyakit hati, penyakit penggumpalan darah, penyakit ginjal kronis, atau penyakit tiroid\n- Mengonsumsi obat-obatan penurun berat badan\n- Mengonsumsi obat selective serotonin reuptake inhibitors (SSRIs) untuk mengatasi depresi dan gangguan kecemasan\n- Memiliki kebiasaan merokok\n- Menyalahgunakan NAPZA, seperti kokain\n- Terpapar asbes\n', 'Topik: Hipertensi Pulmonal, Subtopik: Pencegahan Hipertensi Pulmonal \n Meski tidak semua jenis hipertensi pulmonal dapat dicegah, risiko terjadinya kondisi ini dapat dihindari dengan mengubah gaya hidup, misalnya dengan menurunkan berat badan yang berlebih, menerapkan pola makan yang sehat, dan menghindari kebiasaan merokok.\nPencegahan juga dapat dilakukan dengan menangani kondisi lain yang dapat memicu terjadinya hipertensi pulmonal, seperti hipertensi, penyakit jantung koroner, penyakit hati kronis, penyakit paru-paru konis, dan sleep apnea.\n', 'Topik: Hipertensi Pulmonal, Subtopik: Penyebab Hipertensi Pulmonal: Hipertensi pulmonal akibat kondisi lain \n Beberapa kondisi lain yang dapat menyebabkan hipertensi pulmonal adalah:\n- Sarkoidosis\n- Tumor yang menekan pembuluh arteri paru-paru\n- Penyakit ginjal\n- Sindrom Eisenmenger\nMeski jarang terjadi, hipertensi pulmonal juga dapat dialami oleh bayi baru lahir. Kondisi ini membuat jantung tidak bisa mengalirkan darah sarat oksigen ke seluruh tubuh. Penyakit ini dikenal dengan hipertensi pulmonal persisten pada bayi baru lahir.\n']","Hal-hal yang dapat meningkatkan risiko terkena penyakit hipertensi pulmonal (HPP) termasuk:\n\n1. Jenis kelamin wanita, di mana wanita lebih cenderung mengalami HPP jika dibandingkan dengan pria.\n2. Usia 30 tahun ke atas, dimana risiko meningkat seiring pertumbuhan usia.\n3. Berat badan berlebih, yang memicu tekanan darah tinggi dan bisa merusak arteri paru-paru.\n4. Keluarga dengan riwayat hipertensi pulmonal, mengindikasikan bahwa penyebab genetis atau sosial juga mungkin berperan dalam meningkatkan risiko.\n5. Kondisi medis lain seperti penyakit hati, penggumpalan darah, dan penyakit ginjal kronis yang dapat memicu gangguan aliran darah di paru-paru.\n6. Mengonsumsi obat penurun berat badan atau obat SSRI untuk mengatasi depresi dan kecemasan, yang bisa meningkatkan tekanan darah.\n7. Kebiasaan merokok, yang mempengaruhi kondisi jantung dan paru-paru serta dapat meningkatkan risiko HPP.\n8. Mengonsumsi NAPZA atau merokok kartel (merokok secara teratur), yang bisa menyebabkan penyumbatan arteri paru-paru dan tekanan darah tinggi.\n9. Terpapar asbes, seperti pada industri bouwplafond, yang memiliki hubungan erat dengan hipertensi pulmonal.\n10. Kondisi medis lain, seperti sindrom Eisenmenger dan sarkoidosis, yang bisa meningkatkan risiko terkena HPP.",0.42857142857142855,0.5702494910475869,0.99999999995,1.0
Apa penyebab penyakit endokarditis?,"Endokarditis terjadi ketika kuman masuk ke aliran darah dan bergerak menuju jantung. Kuman tersebut lalu menempel di katup jantung yang mengalami gangguan atau di jaringan jantung yang rusak. Selanjutnya, kuman tersebut akan berkembang biak di lapisan dalam jantung (endokardium).\n\nKuman penyebab endokarditis dapat masuk ke aliran darah melalui:\n\nGigi yang berlubang atau infeksi pada rongga mulut, sehingga kuman dapat masuk dengan mudah ke aliran darah\nBagian tubuh lain yang terinfeksi, misalnya infeksi di kulit, infeksi menular seksual, atau infeksi di saluran pencernaan\nKateter urine atau jarum infus, terutama yang telah dipasang dalam jangka waktu lama, misalnya pada pasien stroke atau cuci darah\nJarum suntik yang terkontaminasi kuman, baik pada penggunaan NAPZA suntik, pembuatan tato, maupun pemasangan tindik","['Topik: Endokarditis, Subtopik: Penyebab Endokarditis \n Endokarditis terjadi ketika kuman masuk ke aliran darah dan bergerak menuju jantung. Kuman tersebut lalu menempel di katup jantung yang mengalami gangguan atau di jaringan jantung yang rusak. Selanjutnya, kuman tersebut akan berkembang biak di lapisan dalam jantung (endokardium).\nKuman penyebab endokarditis dapat masuk ke aliran darah melalui:\n- Gigi yang berlubang atau infeksi pada rongga mulut, sehingga kuman dapat masuk dengan mudah ke aliran darah\n- Bagian tubuh lain yang terinfeksi, misalnya infeksi di kulit, infeksi menular seksual, atau infeksi di saluran pencernaan\n\n- Kateter urine atau jarum infus, terutama yang telah dipasang dalam jangka waktu lama, misalnya pada pasien stroke atau cuci darah\n\n- Jarum suntik yang terkontaminasi kuman, baik pada penggunaan NAPZA suntik, pembuatan tato, maupun pemasangan tindik\n', 'Topik: Endokarditis, Subtopik: Pengertian Endokarditis \n Endokarditis adalah peradangan di endokardium, yaitu lapisan bagian dalam jantung. Peradangan ini umumnya disebabkan oleh bakteri, tetapi bisa juga disebabkan oleh virus atau jamur.\nEndokarditis merupakan penyakit peradangan yang jarang terjadi. Penyakit ini hanya dialami oleh 3  10 orang dari setiap 100.000 orang, dan jarang menyerang orang yang jantungnya sehat.\n\n \nEndokarditis paling berisiko terjadi pada pasien yang menderita kerusakan katup jantung, telah menjalani operasi cangkok katup jantung, atau menderita kelainan jantung. \nMeski banyak penderitanya yang sembuh, endokarditis dapat memicu komplikasi serius jika tidak segera ditangani. Oleh karenanya, pemeriksaan dan pengobatan sedini mungkin perlu dilakukan.\n', 'Topik: Endokarditis, Subtopik: Pengertian Endokarditis \n Endokarditis merupakan penyakit peradangan yang jarang terjadi. Penyakit ini hanya dialami oleh 3  10 orang dari setiap 100.000 orang, dan jarang menyerang orang yang jantungnya sehat.\n\n \nEndokarditis paling berisiko terjadi pada pasien yang menderita kerusakan katup jantung, telah menjalani operasi cangkok katup jantung, atau menderita kelainan jantung. \nMeski banyak penderitanya yang sembuh, endokarditis dapat memicu komplikasi serius jika tidak segera ditangani. Oleh karenanya, pemeriksaan dan pengobatan sedini mungkin perlu dilakukan.\n']","Penyebab endokarditis meliputi beberapa faktor, di antaranya adalah:\n\n1. Masuknya kuman ke aliran darah melalui gigi yang berlubang atau infeksi di rongga mulmouth, saluran pencernaan, atau bagian tubuh lainnya.\n2. Infeksi di katup jantung atau jaringan jantung yang rusak, sehingga kuman dapat menempel dan berkembang biak di lapisan dalam jantung (endokardium).\n3. Penggunaan kateter urine atau jarum infus yang telah terinfeksi, terutama yang digunakan dalam pengobatan jangka panjang seperti pasien stroke atau pasien yang menderita penyakit kronis.\n4. Penggunaan jarum suntik yang terkontaminasi kuman, baik dari pemakaian NAPZA suntik, pembuatan tato, maupun pemasangan tindik.",1.0,0.6833926343728921,0.9999999999666667,1.0
Apa saja faktor yang meningkatkan risiko penyakit endokarditis?,"Endokarditis dapat dialami oleh siapa saja. Namun, ada beberapa faktor yang dapat meningkatkan risiko seseorang menderita kondisi ini, yaitu:\n\nBerusia lebih dari 60 tahun\nMenggunakan katup jantung buatan\nMenderita kerusakan di katup jantung\nMemiliki penyakit jantung bawaan\nMenggunakan alat bantu di jantung, seperti alat pacu jantung\nPernah menderita endokarditis sebelumnya\nPernah menggunakan NAPZA bentuk suntik\nMemiliki daya tahan tubuh lemah\nMemakai kateter dalam jangka panjang\nMemiliki kesehatan gigi dan mulut yang buruk","['Topik: Endokarditis, Subtopik: Faktor risiko endokarditis \n Endokarditis dapat dialami oleh siapa saja. Namun, ada beberapa faktor yang dapat meningkatkan risiko seseorang menderita kondisi ini, yaitu:\n- Berusia lebih dari 60 tahun\n- Menggunakan katup jantung buatan\n- Menderita kerusakan di katup jantung\n- Memiliki penyakit jantung bawaan\n\n- Menggunakan alat bantu di jantung, seperti alat pacu jantung\n- Pernah menderita endokarditis sebelumnya\n- Pernah menggunakan NAPZA bentuk suntik\n- Memiliki daya tahan tubuh lemah\n- Memakai kateter dalam jangka panjang\n- Memiliki kesehatan gigi dan mulut yang buruk\n', 'Topik: Endokarditis, Subtopik: Pengertian Endokarditis \n Endokarditis adalah peradangan di endokardium, yaitu lapisan bagian dalam jantung. Peradangan ini umumnya disebabkan oleh bakteri, tetapi bisa juga disebabkan oleh virus atau jamur.\nEndokarditis merupakan penyakit peradangan yang jarang terjadi. Penyakit ini hanya dialami oleh 3  10 orang dari setiap 100.000 orang, dan jarang menyerang orang yang jantungnya sehat.\n\n \nEndokarditis paling berisiko terjadi pada pasien yang menderita kerusakan katup jantung, telah menjalani operasi cangkok katup jantung, atau menderita kelainan jantung. \nMeski banyak penderitanya yang sembuh, endokarditis dapat memicu komplikasi serius jika tidak segera ditangani. Oleh karenanya, pemeriksaan dan pengobatan sedini mungkin perlu dilakukan.\n', 'Topik: Endokarditis, Subtopik: Pengertian Endokarditis \n Endokarditis merupakan penyakit peradangan yang jarang terjadi. Penyakit ini hanya dialami oleh 3  10 orang dari setiap 100.000 orang, dan jarang menyerang orang yang jantungnya sehat.\n\n \nEndokarditis paling berisiko terjadi pada pasien yang menderita kerusakan katup jantung, telah menjalani operasi cangkok katup jantung, atau menderita kelainan jantung. \nMeski banyak penderitanya yang sembuh, endokarditis dapat memicu komplikasi serius jika tidak segera ditangani. Oleh karenanya, pemeriksaan dan pengobatan sedini mungkin perlu dilakukan.\n']","Faktor-faktor yang meningkatkan risiko penyakit endokarditis termasuk:\n\n1. Usia lebih dari 60 tahun, karena resiko terkena penyakit ini meningkat seiring dengan bertambahnya usia.\n2. Menggunakan katup jantung buatan (prostata), yang memiliki risiko tinggi untuk menginduksi infeksi endokarditis akibat kolonisasi bakteri pada alat tersebut.\n3. Menderita kerusakan di katup jantung, seperti stenosis atau insufisiensi, yang memperburuk kondisi jantung dan meningkatkan resiko infeksi endokarditis.\n4. Memiliki penyakit jantung bawaan, seperti hipertrofi ventrikel kanan (HVC) atau difteri dini, yang memperkuat kondisi jantung dan meningkatkan risiko terkena endokarditis.\n5. Menggunakan alat bantu di jantung, seperti alat pacu jantung, yang memperluas peluang infeksi akibat kolonisasi bakteri atau virus pada alat ini.\n6. Pernah menderita endokarditis sebelumnya, karena seseorang yang pernah mengalaminya memiliki riwayat penyakit dan resiko lebih tinggi untuk terkena kembali.\n7. Memiliki daya tahan tubuh lemah atau keadaan fisik tidak sehat, sehingga tubuh kurang mampu menghadapi infeksi dan mempercepatnya sembuh.",0.5652173913043478,0.7474907034763986,0.9999999999666667,1.0
Apa kelainan yang dialami oleh seseorang dengan penyakit Patent Foramen Ovale?,Patent foramen ovale adalah penyakit jantung bawaan ketika lubang yang terletak di antara serambi kanan dan serambi kiri jantung tidak menutup secara sempurna setelah bayi lahir. Pada patent foramen ovale (PFO) darah kaya oksigen bercampur dengan darah minim oksigen.,"['Topik: Patent Foramen Ovale, Subtopik: Komplikasi Patent Foramen Ovale \n Patent foramen ovale umumnya tidak menimbulkan komplikasi, kecuali jika disertai dengan kondisi lain atau kelainan lain pada struktur jantung. Komplikasi yang dapat terjadi pada penderita PFO adalah:\n- Kekurangan oksigen dalam darah (hipoksemia)\n- Stroke iskemik\n- Serangan jantung\n- Gangguan ginjal\n- Migrain\n- Emboli lemak\n- Emboli udara (pada penyelam)\n- Gangguan katup jantung\n', 'Topik: Patent Foramen Ovale, Subtopik: Pengertian Patent Foramen Ovale \n Patent foramen ovale adalah penyakit jantung bawaan ketika lubang yang terletak di antara serambi kanan dan serambi kiri jantung tidak menutup secara sempurna setelah bayi lahir. Meski jarang bergejala, kondisi ini dapat menyebabkan migrain dan stroke ketika penderita dewasa.\nForamen ovale adalah lubang yang dibutuhkan oleh janin ketika masih di dalam kandungan. Normalnya, lubang ini akan menutup secara alami setelah bayi lahir, karena sudah tidak diperlukan. Patent foramen ovale (PFO) adalah istilah untuk foramen ovale yang tidak menutup setelah bayi lahir.\n\n', 'Topik: Patent Foramen Ovale, Subtopik: Pengobatan Patent Foramen Ovale \n Sebagian besar patent foramen ovale tidak membutuhkan penanganan medis secara khusus. Obat hanya diberikan kepada penderita yang mengalami stroke dan penyakit jantung. Dokter juga akan memberikan obat pengencer darah, seperti clopidogrel atau warfarin, untuk mencegah penggumpalan darah di jantung,.\nJika PFO menimbulkan gejala dan menyebabkan kadar oksigen dalam darah rendah (hipoksemia), dokter akan menyarankan pasien untuk menjalani tindakan penutupan foramen ovale. Ada dua metode yang dapat dilakukan dokter untuk menutup lubang PFO, yaitu:\n']","Kelainan yang mungkin diakomodasi dalam konteks patent foramen ovale (PFO) termasuk kekurangan oksigen dalam darah (hipoksemia), stroke iskemik, serangan jantung, gangguan ginjal, migrain, emboli lemak, emboli udara (pada penyelam), dan gangguan katup jantung.",1.0,0.7979248676499807,0.49999999995,0.5
Apa gejala pada seseorang yang menderita penyakit Patent Foramen Ovale?,"Patent foramen ovale cukup sering terjadi, yaitu pada 1 dari 4 bayi. Kondisi ini sering kali tidak menimbulkan gejala sehingga tidak disadari oleh penderitanya. Sebagian besar pasien baru menyadari dirinya menderita PFO ketika melakukan pemeriksaan untuk penyakit lain.\n\nKeluhan yang dapat timbul pada penderita PFO antara lain:\n\nLemah atau mati rasa di lengan atau kaki\nMigrain atau sakit kepala\nNyeri dada\nPenggumpalan darah\nLinglung\nHilang keseimbangan","['Topik: Patent Foramen Ovale, Subtopik: Gejala Patent Foramen Ovale \n Patent foramen ovale cukup sering terjadi, yaitu pada 1 dari 4 bayi. Kondisi ini sering kali tidak menimbulkan gejala sehingga tidak disadari oleh penderitanya. Sebagian besar pasien baru menyadari dirinya menderita PFO ketika melakukan pemeriksaan untuk penyakit lain.\nKeluhan yang dapat timbul pada penderita PFO antara lain:\n- Lemah atau mati rasa di lengan atau kaki\n- Migrain atau sakit kepala\n- Nyeri dada\n- Penggumpalan darah\n- Linglung\n- Hilang keseimbangan\n', 'Topik: Patent Foramen Ovale, Subtopik: Gejala Patent Foramen Ovale: Kapan harus ke dokter \n Seperti yang telah disebutkan sebelumnya, penderita sering kali tidak menyadari bila ia menderita PFO. Oleh karena itu, segera periksakan ke dokter apabila mengalami gejala berikut ini:\n- Sakit kepala atau migrain yang sering terjadi\n- Lemah pada salah satu sisi wajah, lengan, atau kaki\n- Gangguan penglihatan\n- Tidak dapat berbicara atau bicara pelo secara tiba-tiba\n- Gangguan keseimbangan dan berjalan\n- Nyeri dada berulang\n- Pingsan\n', 'Topik: Patent Foramen Ovale, Subtopik: Pengertian Patent Foramen Ovale \n Patent foramen ovale adalah penyakit jantung bawaan ketika lubang yang terletak di antara serambi kanan dan serambi kiri jantung tidak menutup secara sempurna setelah bayi lahir. Meski jarang bergejala, kondisi ini dapat menyebabkan migrain dan stroke ketika penderita dewasa.\nForamen ovale adalah lubang yang dibutuhkan oleh janin ketika masih di dalam kandungan. Normalnya, lubang ini akan menutup secara alami setelah bayi lahir, karena sudah tidak diperlukan. Patent foramen ovale (PFO) adalah istilah untuk foramen ovale yang tidak menutup setelah bayi lahir.\n\n']","Penyakit Patent Foramen Ovale (PFO) umumnya tidak menyebabkan gejala yang jelas pada banyak orang, khususnya dalam keadaan normal. Namun, ada beberapa gejala yang berkaitan dengan PFO, seperti:\n\n1. Lemah atau mati rasa di lengan atau kaki.\n2. Migrain atau sakit kepala yang sering terjadi.\n3. Nyeri dada.\n4. Penggumpalan darah, yang dapat meningkat risiko stroke.\n5. Linglung, yaitu gejala seperti berkeringat dan nafas berdin pada siang hari.\n6. Hilang keseimbangan dan gangguan bergerak.\n\nGejala ini seringkali muncul saat orang tersebut mendapatkan penyelidikan medis untuk masalah lain, sehingga PFO tidak disadari sampai akhirnya. Jika ada gejala yang tampak pada individu dan klien bersangkutan menghubungi dokter atau spesialis penyakit jantung untuk mendapatkan wawancara medis, penelitian PFO sebaiknya dilakukan.\n\nDemikian informasi yang lengkap tentang gejala pada seseorang yang menderita penyakit Patent Foramen Ovale (PFO).",0.9285714285714286,0.6947270760888088,0.9999999999666667,1.0
Apa penyebab dari penyakit sindrom eisenmenger?,"Pada penderita sindrom Eisenmenger, terdapat lubang di jantung, tepatnya di antara ruang jantung. Kondisi ini menyebabkan darah dari ruang kiri jantung mengalir ke ruang kanan jantung dan tekanan darah paru-paru meningkat (hipertensi pulmonal).\n\nSindrom Eisenmenger atau Eisenmenger syndrome terjadi akibat kelainan jantung bawaan, seperti:\n\nAtrioventricular canal defect, yaitu lubang besar di tengah yang menyebabkan semua ruang jantung menyatu\nVentricular septal defect, yaitu lubang di septum ventrikel\nAtrial septal defect, yaitu lubang pada septum atrium\nPatent ductus arteriosus","['Topik: Sindrom Eisenmenger, Subtopik: Penyebab Sindrom Eisenmenger \n Jantung manusia terdiri dari empat ruang, yaitu dua serambi (atrium) dan dua bilik (ventrikel) yang dipisahkan oleh sekat jantung, serta empat katup jantung.\nRuang kiri jantung berisi darah yang kaya oksigen (darah bersih) untuk dipompa ke seluruh tubuh. Sementara ruang kanan jantung berisi darah yang minim oksigen (darah kotor), untuk dibawa ke paru-paru dan diperkaya dengan oksigen.\nPada penderita sindrom Eisenmenger, terdapat lubang di jantung, tepatnya di antara ruang jantung. Kondisi ini menyebabkan darah dari ruang kiri jantung mengalir ke ruang kanan jantung dan tekanan darah paru-paru meningkat (hipertensi pulmonal).\nSindrom Eisenmenger atau Eisenmenger syndrome terjadi akibat kelainan jantung bawaan, seperti:\n- Atrioventricular canal defect, yaitu lubang besar di tengah yang menyebabkan semua ruang jantung menyatu\n- Ventricular septal defect, yaitu lubang di septum ventrikel\n- Atrial septal defect, yaitu lubang pada septum atrium\n- Patent ductus arteriosus\n', 'Topik: Sindrom Eisenmenger, Subtopik: Pengertian Sindrom Eisenmenger \n Sindrom Eisenmenger adalah kelainan jantung bawaan yang mengakibatkan bercampurnya darah kaya oksigen dengan darah minim oksigen. Kondisi ini menyebabkan penderitanya mudah lelah dan kulitnya membiru.\nBercampurnya darah kaya oksigen dengan darah minim oksigen paling sering terjadi akibat adanya lubang di sekat jantung. Akibatnya, darah yang seharusnya dipompa ke seluruh tubuh malah kembali ke paru-paru.\n\nKondisi tersebut menyebabkan tekanan di pembuluh darah paru-paru meningkat dan meningkatkan risiko terjadinya gagal jantung.\n', 'Topik: Sindrom Eisenmenger, Subtopik: Gejala Sindrom Eisenmenger \n Gejala sindrom Eisenmenger tergantung pada penyebab dan usia penderitanya. Pada bayi baru lahir, tanda yang dapat terlihat adalah napas yang cepat, mudah lelah saat menyusu, kulit membiru ketika menangis, dan berat badan sulit naik.\nSementara pada anak-anak, gejala yang muncul adalah berat badan sulit naik dan sering sesak napas saat beraktivitas. Sedangkan pada penderita usia remaja atau dewasa, sindrom Eisenmenger dapat menimbulkan gejala, seperti:\n- Kulit, bibir, jari-jari tangan dan kaki berwarna kebiruan (sianosis)\n- Jari-jari tangan atau kaki menjadi lebar dan gempal (clubbing finger)\n- Kesemutan atau mati rasa pada jari kaki atau tangan\n- Pusing atau sakit kepala\n- Batuk berdarah\n- Kaki bengkak\n- Mudah lelah\n- Jantung berdebar\n- Nyeri dada\n- Sesak napas makin parah\n- Sering pingsan\n']","Penyebab Sindrom Eisenmenger terjadi akibat kelainan jantung bawaan, seperti atrioventricular canal defect (lubang besar di tengah menyebabkan semua ruang jantung menyatu), ventricular septal defect (lubang di septum ventrikel), atrial septal defect (lubang pada septum atrium), dan patent ductus arteriosus. Kelainan ini membuat darah dari ruang kiri jantung mengalir ke ruang kanan jantung, serta tekanan darah paru-paru meningkat (hipertensi pulmonal).\n\nDalam konteks yang diberikan, penyebab sindrom Eisenmenger tidak ditunjukkan secara eksplisit pada setiap kasus. Namun, umumnya disebabkan oleh adanya lubang di sekat jantung atau kelainan lain dalam sistem jantung yang membuat aliran darah antar ruang jantung terganggu dan menyebabkan darah dari ruang kiri mengalir ke ruang kanan, serta tekanan darah paru-paru meningkat.",0.9230769230769231,0.0,0.99999999995,1.0
Apa gejala yang muncul pada bayi yang mengalami sindrom eisenmenger?,"Pada bayi baru lahir, tanda yang dapat terlihat adalah napas yang cepat, mudah lelah saat menyusu, kulit membiru ketika menangis, dan berat badan sulit naik.","['Topik: Sindrom Eisenmenger, Subtopik: Gejala Sindrom Eisenmenger \n Gejala sindrom Eisenmenger tergantung pada penyebab dan usia penderitanya. Pada bayi baru lahir, tanda yang dapat terlihat adalah napas yang cepat, mudah lelah saat menyusu, kulit membiru ketika menangis, dan berat badan sulit naik.\nSementara pada anak-anak, gejala yang muncul adalah berat badan sulit naik dan sering sesak napas saat beraktivitas. Sedangkan pada penderita usia remaja atau dewasa, sindrom Eisenmenger dapat menimbulkan gejala, seperti:\n- Kulit, bibir, jari-jari tangan dan kaki berwarna kebiruan (sianosis)\n- Jari-jari tangan atau kaki menjadi lebar dan gempal (clubbing finger)\n- Kesemutan atau mati rasa pada jari kaki atau tangan\n- Pusing atau sakit kepala\n- Batuk berdarah\n- Kaki bengkak\n- Mudah lelah\n- Jantung berdebar\n- Nyeri dada\n- Sesak napas makin parah\n- Sering pingsan\n', 'Topik: Sindrom Eisenmenger, Subtopik: Pencegahan Sindrom Eisenmenger \n Sindrom Eisenmenger pada bayi dapat dicegah melalui operasi perbaikan kelainan jantung sedini mungkin. Sedangkan pada anak yang menderita penyakit jantung bawaan, pemeriksaan rutin bisa mencegah terjadinya komplikasi.\nOrang tua juga perlu waspada ketika berat badan anak tidak naik dengan optimal. Sementara itu, wanita yang menderita sindrom Eisenmenger dan aktif secara seksual disarankan untuk tidak hamil, karena dapat membahayakan kondisi ibu dan janin.\n', 'Topik: Sindrom Eisenmenger, Subtopik: Gejala Sindrom Eisenmenger: Kapan harus ke dokter \n Segera periksakan diri atau anak Anda ke dokter jika mengalami keluhan di atas. Jika Anda atau anak Anda telah didiagnosis menderita sindrom Eisenmenger, pemeriksaan rutin ke dokter perlu dilakukan untuk mencegah terjadinya komplikasi yang fatal.\n']","Gejala yang mungkin muncul pada bayi yang mengalami sindrom Eisenmenger bervariasi dan tergantung pada penyebab serta usia penderita. Pada bayi baru lahir, gejala yang dapat diamati termasuk napas yang cepat, mudah lelah saat menyusu, kulit membiru ketika menangis, dan berat badan sulit naik.\n\nPada anak-anak, gejala yang sering terlihat adalah berat badan sulit naik dan sering sesak napas saat beraktivitas. Selain itu, penderita usia remaja atau dewasa dengan sindrom Eisenmenger mungkin mengalami sianosis (kulit, bibir, jari-jari tangan, dan kaki berwarna kebiruan), clubbing finger (jari-jari tangan atau kaki menjadi lebar dan gempal), mati rasa pada jari kaki atau tangan, pusing atau sakit kepala, batuk berdarah, kaki bengkak, mudah lelah, jantung berdebar, nyeri dada, sesak napas yang makin parah, sering pingsan, dan sebagainya.\n\nOrang tua perlu teritoria dan segera menghubungi dokter ketika mengalami keluhan yang di atas, terutama jika ada aspek penyebab sindrom Eisenmenger seperti cacat jantung bawaan. Pemeriksaan rutin ke dokter perlu dilakukan untuk mencegah komplikasi fatal dan mengatur pengobatan yang sesuai dengan kondisi pasien.",1.0,0.6868066239119238,0.8333333332916666,1.0
Apa yang membedakan henti jantung mendadak dengan serangan jantung?,"Henti jantung mendadak berbeda dengan serangan jantung. Serangan jantung terjadi karena penyumbatan pembuluh darah. Sementara henti jantung mendadak disebabkan oleh ventrikel fibrilasi. Namun, ventrikel fibrilasi juga dapat disebabkan oleh serangan jantung.\n\nVentrikel fibrilasi merupakan salah satu jenis gangguan irama jantung (aritmia). Kondisi ini ditandai dengan ventrikel (bilik) jantung yang hanya bergetar, bukan berdenyut untuk memompa darah. Akibatnya, pasokan darah yang membawa oksigen dan nutrisi ke organ-organ tubuh akan terhenti.","['Topik: Henti Jantung Mendadak, Subtopik: Pengertian Henti Jantung Mendadak \n Henti jantung mendadak atau sudden cardiac arrest adalah kondisi ketika jantung berhenti berdetak secara tiba-tiba. Kondisi ini menyebabkan penderitanya hilang kesadaran dan bahkan berhenti bernapas. \nHenti jantung mendadak terjadi akibat gangguan pada listrik jantung sehingga jantung berhenti memompa darah ke seluruh tubuh. Kondisi ini dapat menyebabkan kerusakan otak permanen sampai kematian. Penderita perlu diberikan pertolongan pertama berupa CPR dan kejut jantung, agar tidak terserang komplikasi.\n\n', 'Topik: Henti Jantung Mendadak, Subtopik: Pengertian Henti Jantung Mendadak \n Henti jantung mendadak terjadi akibat gangguan pada listrik jantung sehingga jantung berhenti memompa darah ke seluruh tubuh. Kondisi ini dapat menyebabkan kerusakan otak permanen sampai kematian. Penderita perlu diberikan pertolongan pertama berupa CPR dan kejut jantung, agar tidak terserang komplikasi.\n\n', 'Topik: Henti Jantung Mendadak, Subtopik: Diagnosis Henti Jantung Mendadak \n Pada saat tiba di rumah sakit, dokter akan memeriksa denyut jantung pasien. Dokter juga akan memasang monitor untuk memeriksa irama jantung. Selanjutnya, dokter akan melakukan penanganan sampai kondisi pasien stabil atau jantungnya kembali berdetak.\nJika kondisi pasien sudah stabil, dokter akan melakukan pemeriksaan lanjutan untuk mendiagnosis penyebab atau faktor pemicu terjadinya henti jantung mendadak. Pemeriksaan tersebut dapat meliputi:\n- Tes darah\nTes darah dilakukan untuk memeriksa kadar kalium, magnesium, atau hormon tertentu yang memengaruhi fungsi jantung. Tes darah juga dapat dilakukan untuk mendeteksi cedera atau riwayat serangan jantung pada penderita henti jantung mendadak.\n- Foto Rontgen dada\nFoto Rontgen dada dilakukan untuk memeriksa ukuran dan struktur jantung serta pembuluh darah jantung. Melalui pemeriksaan ini, dokter juga dapat mendeteksi apakah pasien mengalami gagal jantung.\n- Ekokardiografi\nEkokardiografi atau USG jantung bertujuan untuk mengidentifikasi kerusakan pada jantung.\n- Kateterisasi jantung\nDalam kateterisasi jantung, dokter akan menyuntikkan zat pewarna khusus pada pembuluh darah yang menuju jantung. Pemeriksaan ini bertujuan untuk mendeteksi sumbatan pada pembuluh darah. Kateterisasi jantung juga dapat dilakukan untuk studi elektrofisiologi jantung. Prosedur ini dapat mendeteksi gangguan irama jantung yang mungkin menyebabkan henti jantung mendadak.\n']","Henti jantung mendadak (sudden cardiac arrest) dan serangan jantung (myocardial infarction) adalah dua kondisi medis berbeda yang memiliki beberapa penyebab utama dan gejala yang berbeda pula.\n\n1. Penyebab:\n- Henti Jantung Mendadak: Penyebabnya umumnya berkaitan dengan gangguan dalam sistem elektrikal jantung, seperti aritmia atau disentriasi yang mengganggu fungsi jantung untuk memompa darah.\n- Serangan Jantung: Penurunan aliran darah ke jantung akibat pembekuan atau terhamburan jaringan dalam arteri coronaire, biasanya disebabkan oleh penyakit aterosklerosis dan ledakan aritmia.\n\n2. Gejala:\n- Henti Jantung Mendadak: Penderita seringkali hilang kesadaran secara mendadak, berhenti bernapas, dan jantungnya tidak lagi berdetak. Gejala ini terjadi akibat penghentian fungsi jantung secara tiba-tiba.\n- Serangan Jantung: Penderita seringkali mengalami berkedut, nyawanya mengecil, dan rasa lelah atau sesak yang membawa kepala. Gejala ini terjadi akibat penghentian aliran darah tetapi biasanya jantung tetap berdetak.\n\n3. Perawatan:\n- Henti Jantung Mendadak: Kecuali CPR dan kejut jantung, pasien mungkin diberikan obat untuk mengontrol aritmia atau disentriasi yang menyebabkan hentinya jantung. Selain itu, perawatan umumnya fokus pada memulihkannya fungsi jantung dan menghindari komplikasi seperti kerusakan otak permanen atau kematian.\n- Serangan Jantung: Perawatan melibatkan obat untuk mengurangi tekanan darah, mempercepat pembekuan darah, dan memberikan infus darah apabila perlu untuk menopong volume darah yang hilang akibat gagal jantung. Pasien juga mungkin diberikan obat lain untuk mengurangi bahaya serangan berikutnya atau terkait.\n\nDari uraian di atas, kita dapat melihat bahwa henti jantung mendadak dan serangan jantung memiliki penyebab utama yang berbeda, sehingga gejala dan perawatan juga tidak sama. Namun, keduanya merupakan krisis medis serius yang harus segera diatasi untuk menghindari komplikasi atau bahkan kematian pasien.",0.48148148148148145,0.41504671457621517,0.9999999999666667,0.0
Bagaimana penanganan darurat terhadap seseorang yang mengalami henti jantung mendadak?,"Segera periksa denyut jantungnya dan hubungi ambulans atau rumah sakit terdekat.\n\nSambil menunggu datangnya pertolongan medis, lakukan juga penanganan darurat berupa CPR. Gunakan juga alat automated external defibrillator (AED) bila tersedia.","['Topik: Henti Jantung Mendadak, Subtopik: Pengobatan Henti Jantung Mendadak: Penanganan darurat \n Penanganan darurat bertujuan untuk mengembalikan kesadaran pasien henti jantung mendadak. Hal ini dilakukan oleh petugas medis darurat, yang dimulai dengan memeriksa pernapasan dan denyut nadi pasien.\nJika jantung pasien tidak berdetak, tim medis akan melakukan CPR dan memberikan kejut listrik selama perjalanan ke rumah sakit. Setelah jantung kembali berdetak, pasien akan dirawat di ruang rawat intensif (ICU) dan diberikan alat bantu napas.\n', 'Topik: Henti Jantung Mendadak, Subtopik: Gejala Henti Jantung Mendadak: Kapan harus ke dokter \n Henti jantung mendadak merupakan kondisi darurat yang harus segera ditangani. Jika Anda melihat seseorang yang tidak sadarkan diri dan tidak bernapas dengan normal, segera periksa denyut jantungnya dan hubungi ambulans atau rumah sakit terdekat.\nSambil menunggu datangnya pertolongan medis, lakukan juga penanganan darurat berupa CPR. Gunakan juga alat automated external defibrillator (AED) bila tersedia.\nGejala henti jantung mendadak terjadi secara cepat dan tanpa disadari. Meskipun demikian, gejala-gejala awal biasanya dapat dirasakan penderita beberapa hari sebelumnya. Oleh sebab itu, segera lakukan pemeriksaan ke dokter bila mengalami gejala seperti di atas, terutama bila memiliki riwayat penyakit jantung.\n', 'Topik: Henti Jantung Mendadak, Subtopik: Pengobatan Henti Jantung Mendadak \n Pengobatan henti jantung mendadak terdiri dari penanganan darurat dan pengobatan jangka panjang. Berikut adalah penjelasannya:\n']","Penanganan darurat pada pasien yang mengalami henti jantung mendadak meliputi beberapa langkah krusial. Pertama, petugas medis harus segera memeriksa denyut nadi dan pernapasan pasien. Jika jantung pasien tidak berdetak, tim medis akan mulai prosedur CPR (cardiopulmonary resuscitation) untuk membersihkan saluran pernapasan dari benda-benda lembab atau debu dan mengg激励 pulmonek sistemik oksigen.\n\nSelama perjalanan ke rumah sakit, pasien mungkin akan mendapatkan bantuan defibrilasi (kejut listrik) jika medis meyimak bahaya fibrilasi aritmia yang dapat menyebabkan henti jantung. Setelah jantung kembali berdetak, pasien akan dianggap dalam ruang rawat intensif (ICU), dimana mereka akan mendapatkan pengobatan dan dukungan medis lanjutan untuk mengurangi risiko penyusutan fungsional jantung.\n\nPada umumnya, penanganan henti jantung mendadak melibatkan kontinuitas pelayanan medis yang baik dan cepat, dengan fokus pada mempertahankan aliran darah dan oksigen dalam tubuh selama proses resusi.\n\nGejala henti jantung mendadak seringkali terjadi secara tiba-tiba dan tanpa peringatan, tetapi beberapa orang mungkin memiliki gejakala awal yang dapat dirasakan beberapa hari sebelumnya. Oleh karena itu, penting untuk segera menghubungi dokter atau pertolongan medis jika Anda mengidentifikasi orang yang menderita gejala ini, terutama bila ada riwayat penyakit jantung di keluarga.",0.75,0.5615815681670998,0.9999999999666667,1.0
Apa saja komplikasi yang dapat dialami oleh orang yang mengalami henti jantung mendadak?,"Komplikasi henti jantung mendadak adalah kerusakan otak permanen, hipoksia, hingga kematian. Pada beberapa kasus, penderita henti jantung mendadak masih bisa ditangani dan akhirnya sembuh.\n\nMeski demikian, penderita henti jantung mendadak yang sembuh umumnya juga mengalami sejumlah komplikasi berupa:\n\nKerusakan saraf\nGangguan gerakan\nKesulitan berbicara\nSulit konsentrasi\nPost-traumatic stress disorder (PTSD)","['Topik: Henti Jantung Mendadak, Subtopik: Komplikasi Henti Jantung Mendadak \n Komplikasi henti jantung mendadak adalah kerusakan otak permanen, hipoksia, hingga kematian. Pada beberapa kasus, penderita henti jantung mendadak masih bisa ditangani dan akhirnya sembuh.\nMeski demikian, penderita henti jantung mendadak yang sembuh umumnya juga mengalami sejumlah komplikasi berupa:\n- Kerusakan saraf\n- Gangguan gerakan\n- Kesulitan berbicara\n- Sulit konsentrasi\n- Post-traumatic stress disorder (PTSD)\n', 'Topik: Henti Jantung Mendadak, Subtopik: Pengertian Henti Jantung Mendadak \n Henti jantung mendadak atau sudden cardiac arrest adalah kondisi ketika jantung berhenti berdetak secara tiba-tiba. Kondisi ini menyebabkan penderitanya hilang kesadaran dan bahkan berhenti bernapas. \nHenti jantung mendadak terjadi akibat gangguan pada listrik jantung sehingga jantung berhenti memompa darah ke seluruh tubuh. Kondisi ini dapat menyebabkan kerusakan otak permanen sampai kematian. Penderita perlu diberikan pertolongan pertama berupa CPR dan kejut jantung, agar tidak terserang komplikasi.\n\n', 'Topik: Henti Jantung Mendadak, Subtopik: Gejala Henti Jantung Mendadak \n Henti jantung mendadak merupakan kondisi yang terjadi secara tiba-tiba. Pada umumnya, gejala utama henti jantung mendadak adalah pingsan. Namun, sebagian penderita henti jantung mendadak dapat mengalami gejala awal berupa:\n- Pusing\n- Lemas\n- Nyeri dada\n- Sesak napas\n- Jantung berdebar\n']","Komplikasi henti jantung mendadak yang umum terjadi pada pasien adalah kerusakan otak permanen, hipoksia (penyempitan otot hati akibat kekurangan oksigen), hingga kematian. Namun, dalam beberapa kasus, penderita henti jantung mendadak yang sembuh juga sering mengalami komplikasi seperti kerusakan saraf, gangguan gerakan, kesulitan berbicara, sulit konsentrasi, dan post-traumatic stress disorder (PTSD).",0.8888888888888888,0.45849891707610696,0.99999999995,1.0
Apa penyebab seseorang menderita penyakit perikarditis?,"Sebagian besar kasus perikarditis tidak diketahui penyebabnya, tetapi ada beberapa hal yang diduga dapat menjadi penyebab perikarditis, yaitu:\n\nInfeksi bakteri\nInfeksi virus, seperti COVID-19, rubella, dan influenza\nKanker dari organ lain yang menyebar ke perikardium\nSerangan jantung\nCedera pada dada\nKomplikasi akibat operasi jantung\nPenyakit peradangan, seperti lupus dan rheumatoid arthritis\nPaparan radiasi dalam radioterapi, khususnya pada terapi kanker payudara dan kanker paru","['Topik: Perikarditis, Subtopik: Penyebab Perikarditis \n Sebagian besar kasus perikarditis tidak diketahui penyebabnya, tetapi ada beberapa hal yang diduga dapat menjadi penyebab perikarditis, yaitu:\n- Infeksi bakteri\n- Infeksi virus, seperti COVID-19, rubella, dan influenza\n- Kanker dari organ lain yang menyebar ke perikardium\n- Serangan jantung\n- Cedera pada dada\n- Komplikasi akibat operasi jantung\n- Penyakit peradangan, seperti lupus dan rheumatoid arthritis\n\n- Paparan radiasi dalam radioterapi, khususnya pada terapi kanker payudara dan kanker paru\n', 'Topik: Perikarditis, Subtopik: Diagnosis Perikarditis \n Diagnosis perikarditis ditetapkan berdasarkan hasil tanya jawab terkait gejala, serta hasil pemeriksaan fisik dan pemeriksaan penunjang. Beberapa tes penunjang yang dilakukan untuk memastikan perikarditis dan penyebabnya yaitu:\n- Tes darah\nTes darah dilakukan untuk mengetahui adanya infeksi atau peradangan.\n- Rontgen dada\nFoto Rontgen dada bertujuan untuk melihat kondisi jantung, paru-paru, dan pembuluh Jika terdapat efusi perikardium yang terjadi pada perikarditis, maka jantung akan tampak membesar.\n- Echo jantung\nEcho jantung dilakukan untuk melihat gambaran jantung dan mendeteksi cairan yang terkumpul dalam ruang\n- EKG (elektrokardiogram) \nEKG bertujuan untuk mendeteksi dan merekam aktivitas listrik jantung yang dapat berubah saat terjadi perikarditits.\n- CT scan\nPemindaian dengan sinar-X ini dilakukan untuk mendapatkan gambaran jantung lebih detail.\n- MRI\nProsedur menggunakan gelombang magnet ini dilakukan untuk mendapatkan gambaran jantung secara detail. Dari hasil pemeriksaan, dapat terlihat apabila ada penebalan, peradangan, atau perubahan lain pada perikardium.\n', 'Topik: Perikarditis, Subtopik: Pengertian Perikarditis \n Perikarditis adalah peradangan pada lapisan tipis berbentuk kantong yang melapisi jantung (perikardium). Perikardium berfungsi untuk menjaga agar jantung tidak berpindah posisi, serta melindungi jantung dari gesekan atau penyebaran infeksi dari jaringan lain.\nPenyakit yang menimbulkan gejala nyeri dada ini dapat terjadi di segala usia. Meski begitu, perikarditis paling banyak terjadi di usia 20 sampai 50 tahun, terutama pada pria.\n']","Penyebab umum perikarditis mencakup beberapa faktor, antara lain:\n\n1. Infeksi bakteri: Beberapa infeksi bakteri seperti mycoplasma, streptococcus, atau Staphylococcus dapat menyebabkan perikarditis. Misalnya, penyakit jaringan lunak (Lyme disease) yang disebabkan oleh bakteri Borrelia burgdorferi juga bisa menjadi salah satu penyebab perikarditis.\n2. Infeksi virus: Virus seperti COVID-19, rubella, dan influenza dapat menyebabkan infeksi jaringan yang melibatkan perikardium, serta menginduksi radang pada perikardium dan menimbulkan nyeri dada.\n3. Kanker: Kadar kecil kanker lainnya (misalnya dari organ toraks atau limfe) yang menyebar ke perikardium juga bisa menyebabkan infeksi yang melibatkan perikarditis.\n4. Serangan jantung: Gejala penyakit jantung, seperti miokarditis (peradangan pada miokard), dapat meningkatkan risiko terkena perikarditis karena serangan ini bisa menyebabkan infeksi atau radang.\n5. Cedera dada: Penyemutan dan nyeri dada yang disebabkan oleh cedera dada juga bisa merujuk pada gejala perikarditis, terutama jika ada efusi perikardium (pengisaran cairan di antara lapisan perikardium).\n6. Komplikasi operasi: Setelah operasi jantung, kadang-kadang radikul yang hilang dari proses pembedahan bisa meningkatkan risiko terjadinya infeksi atau efusi perikardium.\n7. Penyakit peradangan lainnya: Sistem kekebalan tubuh (immunodefisiensi) seperti yang dialami oleh pasien lupus atau arthritis reumatoid bisa meningkatkan risiko terjadinya infeksi pada perikardium.\n8. Paparan radiasi: Radiasi dalam radioterapi, terutama digunakan untuk terapis kanker payudara dan paru, dapat menyebabkan kerusakan jaringan termasuk perikardium dan mengakibatkan infeksi atau efusi cairan.\n\nDalam menentukan penyebab perikarditis, dokter biasanya akan mempertimbangkan faktor-faktor ini serta menggabungkan gejala pasien dan hasil pemeriksaan medis untuk menetapkan diagnosa yang tepat.",0.7222222222222222,0.6418691699758129,0.99999999995,1.0
Bagaimana pengobatan terhadap seseorang yang mengalami perikarditis yang tergolong parah?,"Penderita perikarditis yang tergolong parah dan mengalami komplikasi perlu dirawat di rumah sakit. Beberapa tindakan yang dapat dilakukan dokter untuk mengatasi kondisi ini adalah:\n\nPericardiocentesis\nPericardiocentesis dilakukan untuk mengeluarkan timbunan cairan dari ruang perikardium. Pada prosedur ini, dokter akan menyedot cairan menggunakan jarum dan selang kecil.\nPericardiectomy\nOperasi ini perlu dilakukan bila perikardium mengalami Pericardiectomy bertujuan untuk mengambil bagian yang kaku tersebut sehingga pompa jantung dapat kembali normal.","['Topik: Perikarditis, Subtopik: Pengobatan Perikarditis \n Penderita perikarditis ringan bisa sembuh dengan beristirahat dan mengonsumsi obat-obat pereda nyeri. Namun, selama masa penyembuhan, penderita perlu menghindari aktivitas fisik yang berlebihan karena dapat memicu kekambuhan.\nDi samping obat pereda nyeri, dokter juga mungkin akan memberikan:\n- Obat antiinflamasi nonsteroid (OAINS) \nObat antiinflamasi nonsteroid berfungsi untuk mengurangi peradangan di perikardium dan meredakan nyeri dada. Obat yang dapat diberikan adalah ibuprofen dan aspirin.\n- Colchicine\nColchicine berfungsi untuk mengurangi peradangan dengan cara membunuh sel radang Obat ini dapat dikombinasikan dengan OAINS atau diberikan sebagai alternatif dari OAINS.\n- Kortikosteroid\nObat kortikosteroid hanya diberikan apabila perikarditis tidak membaik dengan OAINS dan colchicine. Salah satu contohnya adalah prednisone.\n- Antibiotik\nObat antibiotik hanya diberikan jika perikarditis disebabkan oleh infeksi bakteri.\nPenderita perikarditis yang tergolong parah dan mengalami komplikasi perlu dirawat di rumah sakit. Beberapa tindakan yang dapat dilakukan dokter untuk mengatasi kondisi ini adalah:\n- Pericardiocentesis\nPericardiocentesis dilakukan untuk mengeluarkan timbunan cairan dari ruang perikardium. Pada prosedur ini, dokter akan menyedot cairan menggunakan jarum dan selang kecil.\n- Pericardiectomy\nOperasi ini perlu dilakukan bila perikardium mengalami Pericardiectomy bertujuan untuk mengambil bagian yang kaku tersebut sehingga pompa jantung dapat kembali normal.\n', 'Topik: Perikarditis, Subtopik: Gejala Perikarditis: Kapan harus ke dokter \n Gejala perikarditis mirip dengan penyakit paru-paru dan penyakit jantung lain. Oleh karena itu, jika Anda mengalami gejala-gejala di atas, segera pergi ke dokter agar diperiksa dan ditangani dengan tepat.\nSegera ke dokter jika dada terasa nyeri seperti ditusuk-tusuk dan gejalanya makin parah ketika menarik napas atau berbaring, terutama bila gejala muncul setelah terserang infeksi virus, seperti flu atau sakit tenggorokan.\n', 'Topik: Perikarditis, Subtopik: Pencegahan Perikarditis \n Sebenarnya, tidak ada cara pasti untuk mencegah perikarditis. Akan tetapi, cara-cara berikut dapat mengurangi risiko penyakit tersebut, yaitu:\n- Rutin mencuci tangan dengan air mengalir dan sabun\n- Selalu menjaga kebersihan diri, rumah, dan lingkungan sekitar\n- Menghindari kontak dengan orang-orang yang sedang sakit\n- Menjalani vaksinasi COVID-19, rubella, dan influenza, sesuai saran dokter\n']","Pengobatan terhadap seseorang yang mengalami perikarditis yang tergolong parah meliputi beberapa langkah khusus untuk mengatasi penyakit dan mencegah komplikasinya. Berikut adalah beberapa cara pengobatan yang dapat dilakukan:\n\n1. Obat-obatan pereda nyeri, seperti obat antiinflamasi nonsteroid (OAINS) atau ibuprofen, seringkali digunakan untuk mengurangi rasa nyeri dada penderita perikarditis.\n2. Colchicine, yaitu obat yang berfungsi mempercepat proses penyembuhan dan mengurangi peradangan di dalam tubuh, juga seringkali diberikan kepada pasien dengan perikarditis parah untuk menekan respon radang.\n3. Obat kortikosteroid seperti prednisolon atau dexamethasone, yang biasanya digunakan jika obat anti-inflamasi dan colchicine tidak cukup efektif dalam mengurangi gejala perikarditis, seringkali diberikan pada kasus parah.\n4. Dalam beberapa kasus, dokter mungkin melakukan prosedur medis untuk menyingkirkan cairan atau zat yang membahayakan di ruang perikardium, seperti pericardiocentesis atau operasi pericardiectomy.\n5. Penderita parah dengan komplikasi perikarditis mungkin juga akan mendapatkan terapi keseluruhan yang lebih lengkap termasuk penggunaan infeksi antibiotik jika penyebabnya infeksi bakteri.\n6. Penyusunan pola makan sehat dan menghindari obat-obatan secara manual juga sangat penting untuk mencegah terjadinya infeksi atau gangguan lain yang dapat memperparah kondisi perikarditis.\n\nPenting untuk diingat bahwa setiap pasien pasti berbeda, dan tindakan pengobatan harus disesuaikan sesuai dengan gejala, komplikasi, serta penyebab yang dialami oleh masing-masing individu. Oleh karena itu, segera berkonsultasi dengan dokter untuk mendapatkan pengobatan dan narasumberan yang tepat adalah kunci dalam mengatasi perikarditis parah.",0.6923076923076923,0.0,0.9999999999,1.0
Apa gejala penyakit ventrikel takikardi?,"Ada beberapa gejala yang menandakan ventrikel takikardi, antara lain:\n\nJantung berdebar yang membuat penderitanya merasa tidak nyaman\nSesak napas\nNyeri atau rasa tertekan di dada\nPening atau terasa melayang\nPenurunan kesadaran\n\nVentrikel takikardi perlu diwaspadai karena dapat berkembang menjadi ventrikel fibrilasi, yaitu suatu kondisi yang berbahaya dan bisa menyebabkan kematian.","['Topik: Ventrikel Takikardi, Subtopik: Gejala Ventrikel Takikardi \n Ada beberapa gejala yang menandakan ventrikel takikardi, antara lain:\n- Jantung berdebar yang membuat penderitanya merasa tidak nyaman\n- Sesak napas\n- Nyeri atau rasa tertekan di dada\n- Pening atau terasa melayang\n- Penurunan kesadaran\nVentrikel takikardi perlu diwaspadai karena dapat berkembang menjadi ventrikel fibrilasi, yaitu suatu kondisi yang berbahaya dan bisa menyebabkan kematian.\n', 'Topik: Ventrikel Takikardi, Subtopik: Gejala Ventrikel Takikardi: Kapan harus ke dokter \n Ventrikel takikardi harus segera ditangani. Oleh sebab itu, jika Anda merasakan gejala-gejala di atas, hubungi dokter secepatnya.\nJika Anda melihat orang yang kehilangan kesadaran, tidak memililiki denyut nadi dan tidak bernapas, segera cari pertolongan medis atau minta bantuan orang sekitar, serta lakukan CPR kepada orang tersebut jika Anda mampu.\nBila tersedia alat kejut jantung otomatis atau Automatic External Defibrillator (AED), gunakan alat tersebut untuk mengetahui irama jantung penderita. Setelah itu, ikuti petunjuk dari alat AED. Lakukan hal tersebut hingga bantuan medis datang.\n', 'Topik: Ventrikel Takikardi, Subtopik: Pengertian Ventrikel Takikardi \n Ventricular tachycardia atau ventrikel takikardi adalah kondisi ketika ventrikel (bilik) jantung berdetak terlalu cepat. Hal ini terjadi akibat gangguan pada aliran listrik jantung yang penyebabnya bervariasi.\nVentrikel takikardi terjadi saat bilik atau ruangan bawah jantung berdetak terlalu cepat dan tidak sinkron dengan gerakan serambi (atrium) jantung. Akibatnya, jantung tidak dapat memompa darah secara efektif. Kondisi ini menyebabkan tubuh kekurangan oksigen.\n\n']","Gejala Ventrikel Takikardi meliputi jantung berdebar, sesak napas, nyeri atau rasa tertekar di dada, pening atau merasa terlantar, serta penurunan kesadaran.",1.0,0.5594931952707712,0.9999999999666667,1.0
Bagaimana penanganan terhadap seseorang yang mengalami penyakit ventrikel takikardi?,"Segera cari pertolongan medis atau minta bantuan orang sekitar, serta lakukan CPR kepada orang tersebut jika Anda mampu.\n\nBila tersedia alat kejut jantung otomatis atau Automatic External Defibrillator (AED), gunakan alat tersebut untuk mengetahui irama jantung penderita. Setelah itu, ikuti petunjuk dari alat AED. Lakukan hal tersebut hingga bantuan medis datang.","['Topik: Ventrikel Takikardi, Subtopik: Pengobatan Ventrikel Takikardi \n Penanganan ventrikel tarkikadi tergantung pada kondisi dan tingkat keparahan pasien. Tindakan yang dapat dilakukan oleh dokter jantung untuk menangani ventrikel takikardi antara lain:\n- Pemberian obat antiaritmia\nObat antiaritmia, seperti verapamil atau amiodarone, diberikan agar gangguan serupa tidak terjadi lagi.\n- Ablasi jantung\nProsedur ini dilakukan jika terdapat jalur listrik yang menyebabkan detak jantung pasien\n- Pemasangan alat implantable cardioverter defibrillator (ICD)\nAlat ini dimasukkan ke dalam dada atau area perut pasien, untuk membantu mengembalikan irama jantung ke kondisi normal.\n', 'Topik: Ventrikel Takikardi, Subtopik: Diagnosis Ventrikel Takikardi \n Pada tahap awal penanganan, dokter akan menstabilkan kondisi pasien terlebih dulu. Setelah kondisi pasien stabil, dokter akan melakukan pemeriksaan untuk mencari tahu penyebab dari keluhan pasien. Pemeriksaan itu meliputi:\n- Elektrokardiografi (EKG)\nEKG jantung bertujuan untuk mengukur aktivitas listrik\n- EKG treadmill\nTindakan ini bertujuan untuk melihat rekaman listrik jantung selama pasien beraktivitas di atas alat treadmill.\n- Holter monitor\nProsedur ini dilakukan dengan memasang EKG portabel selama 24 jam untuk merekam aliran listrik jantung.\n- Echo jantung\nMetode ini menggunakan gelombang suara berfrekuensi tinggi, untuk melihat gambaran struktur dan katup jantung secara lebih detail.\n- MRI jantung\nPemindaian ini dilakukan untuk mendapatkan gambaran detail jantung, dengan menggunakan gelombang magnet.\n- Kateterisasi jantung\nKateterisasi jantung berfungsi untuk mengetahui aliran darah ke otot jantung.\n', 'Topik: Ventrikel Takikardi, Subtopik: Gejala Ventrikel Takikardi: Kapan harus ke dokter \n Ventrikel takikardi harus segera ditangani. Oleh sebab itu, jika Anda merasakan gejala-gejala di atas, hubungi dokter secepatnya.\nJika Anda melihat orang yang kehilangan kesadaran, tidak memililiki denyut nadi dan tidak bernapas, segera cari pertolongan medis atau minta bantuan orang sekitar, serta lakukan CPR kepada orang tersebut jika Anda mampu.\nBila tersedia alat kejut jantung otomatis atau Automatic External Defibrillator (AED), gunakan alat tersebut untuk mengetahui irama jantung penderita. Setelah itu, ikuti petunjuk dari alat AED. Lakukan hal tersebut hingga bantuan medis datang.\n']","Penanganan terhadap seseorang yang mengalami penyakit ventrikel takikardi melibatkan beberapa prosedur medis, di antaranya adalah pemberian obat antiaritmia, ablasi jantung, dan pemasangan alat implantable cardioverter defibrillator (ICD).\n\n1. Pemberian Obat Antiaritmia: Metode ini digunakan untuk mencegah terjadinya gangguan serupa seperti ventrikel takikardi yang telah pernah dialami pasien. Jenis obat antiaritmia yang umum diberikan termasuk verapamil dan amiodarone.\n2. Ablasi Jantung: Prosedur ini dilakukan jika ada jalur listrik di dalam jantung yang menyebabkan gejala ventrikel takikardi pasien. Metode ablasi jantung bisa melibatkan teknik kirugsi atau metode lainnya untuk menghalangi jalur gangguan tersebut.\n3. Pemasangan Alat Implantable Cardioverter Defibrillator (ICD): Metode ini digunakan jika obat antiaritmia tidak cukup efektif dan pasien memiliki risiko tinggi untuk mengalami penyakit ventrikel takikardi ulang. ICD adalah alat implant yang bekerja dengan cara menghadapati gangguan jantung, sehingga irama jantung kembali ke kondisi normal.\n4. Pemeriksaan Diagnostik: Untuk memastikan penyebab ventrikel takikardi pasien, dokter mungkin melakukan berbagai macam pemeriksaan diagnostik seperti elektrokardiografi (EKG), EKG treadmill, Holter monitor, echo jantung, MRI jantung, dan kateterisasi jantung.\n5. Penggunaan Alat Kejut Jantung Otomatis atau Automatic External Defibrillator (AED): Metode ini digunakan untuk mengetahui irama jantung pasien, sebelum dokter dan perawat datang. AED adalah alat yang dapat membantu mengembalikan irama jantung ke kondisi normal penderita ventrikel takikardi.\n\nDalam hal ini, penanganan terhadap seseorang yang mengalami ventrikel takikardi melibatkan kombinasi metode medis di atas untuk menghindari gangguan jantung dan mencegah resiko serupa nantinya.",0.75,0.6111507174155025,0.5833333333041666,1.0
Apa faktor yang dapat meningkatkan risiko terkena penyakit Ventricular Septal Defect?,"Ada beberapa faktor yang dapat meningkatkan risiko seseorang terkena VSD, antara lain:\n\nMemiliki keluarga dengan riwayat penyakit jantung bawaan\nMenderita kelainan genetik, seperti Down Syndrome","['Topik: Ventricular Septal Defect, Subtopik: Penyebab Ventricular Septal Defect (VSD) \n Defek septum ventrikel (VSD) disebabkan oleh gangguan dalam proses pembentukan jantung di dalam kandungan. Gangguan ini menyebabkan dinding pemisah antara bilik kanan dan bilik kiri jantung tidak menutup dengan sempurna.\nBelum diketahui secara pasti pemicu terjadinya gangguan tersebut. Namun, faktor kelainan genetik dan lingkungan diduga menjadi faktor utama yang menyebabkan seseorang menderita kondisi ini.\nMeski jarang, defek septum ventrikel juga berisiko dialami oleh orang dewasa. Kondisi ini dapat terjadi pada penderita serangan jantung atau orang yang mengalami cedera hebat di bagian dada, misalnya akibat kecelakaan.\nAda beberapa faktor yang dapat meningkatkan risiko seseorang terkena VSD, antara lain:\n- Memiliki keluarga dengan riwayat penyakit jantung bawaan \n- Menderita kelainan genetik, seperti Down Syndrome \n', 'Topik: Ventricular Septal Defect, Subtopik: Pencegahan Ventricular Septal Defect (VSD) \n Defek septum ventrikel (VSD) sulit dicegah, karena umumnya terjadi karena faktor bawaan lahir. Namun, risiko VSD dapat diturunkan dengan menjalani gaya hidup sehat selama hamil, agar kesehatan dan perkembangan janin tetap terjaga.\nUpaya yang dapat dilakukan antara lain:\n- Melakukan pemeriksaan kehamilan secara rutin\n- Menjalani diet seimbang dengan mengonsumsi makanan bergizi dan bernutrisi\n- Berolahraga secara teratur\n- Tidak merokok\n- Membatasi konsumsi minuman beralkohol\n- Tidak menggunakan narkoba\n- Mencegah infeksi dengan melakukan vaksinasi sebelum merencanakan kehamilan\n', 'Topik: Ventricular Septal Defect, Subtopik: Pengertian Ventricular Septal Defect \n Ventricular septal defect atau defek septum ventrikel merupakan salah satu jenis penyakit jantung bawaan. Kondisi ini dapat terjadi sejak usia kehamilan 8 minggu, yaitu pada saat proses pembentukan jantung janin berlangsung.\n\nPada awal pembentukan jantung, bilik kiri dan kanan jantung masih menyatu, tetapi seiring pertumbuhan janin, dinding pemisah (septum) antara kedua bilik tersebut akan terbentuk. Namun, pada beberapa kondisi, septum tidak terbentuk sempurna sehingga meninggalkan sebuah lubang.\nDefek septum ventrikel menyebabkan bilik kiri jantung bekerja lebih keras sehingga menimbulkan gangguan katup dan gagal jantung.\n']","Faktor-faktor yang dapat meningkatkan risiko terkena defek septum ventrikel (VSD) antara lain:\n\n1. Keluarga dengan riwayat penyakit jantung bawaan, yang menunjukkan adanya gen predispoksi kepala keluarga untuk mengalami VSD.\n2. Menderita kelainan genetik lainnya, seperti Down Syndrome, karena faktor gen yang sama juga dapat memicu timbulnya defek septum ventrikel.\n3. Penderita serangan jantung atau orang yang mengalami cedera hebat di bagian dada, misalnya akibat kecelakaan, karena faktor trauma dan beban jantung yang timbul dari cedera tersebut.\n4. Upaya pencegahan lainnya termasuk menjaga tubuh agar tetap sehat dan tidak suntuk datang serta mencegah infeksi saat kehamilan untuk melindungi diri janin dari berbagai penyakit yang bisa merusak pertumbuhan jantung.",0.75,0.7344273179073034,0.99999999995,1.0
Apa gejala yang umum terjadi pada anak atau bayi penderita Ventricular Septal Defect?,"Secara umum, gejala VSD pada bayi dan anak-anak meliputi:\n\nMudah lelah ketika sedang makan atau bermain\nBanyak mengeluarkan keringat, terutama ketika makan\nTidak nafsu makan\nBerat badan sulit naik\nNapas cepat dan terdengat berat\nKulit terlihat pucat","['Topik: Ventricular Septal Defect, Subtopik: Gejala Ventricular Septal Defect (VSD) \n Gejala VSD bervariasi, tergantung ukuran dan lokasi celah pada jantung, serta ada tidaknya kondisi cacat jantung lain yang mendasarinya. Gejala ini sering kali sulit terdeteksi saat bayi lahir, terutama jika lubangnya berukuran kecil.\nPada beberapa kasus, kelainan ini terkadang tidak menunjukkan gejala sama sekali dan baru muncul setelah bayi mulai memasuki usia anak-anak.\nSecara umum, gejala VSD pada bayi dan anak-anak meliputi:\n- Mudah lelah ketika sedang makan atau bermain\n- Banyak mengeluarkan keringat, terutama ketika makan\n- Tidak nafsu makan\n- Berat badan sulit naik\n- Napas cepat dan terdengat berat\n- Kulit terlihat pucat\n', 'Topik: Ventricular Septal Defect, Subtopik: Gejala Ventricular Septal Defect (VSD): Kapan harus ke dokter \n Segera periksakan anak Anda ke dokter anak jika muncul gejala VSD seperti di atas, terutama bila sampai menimbulkan gejala yang berbahaya sebagai berikut:\n- Sering mengalami infeksi saluran pernapasan \n- Sesak napas\n- Kulit terlihat membiru di sekitar bibir dan kuku\nJika Anda merasakan gejala seperti napas pendek dan berat saat beraktivitas atau berbaring, detak jantung cepat dan tidak beraturan, serta sering merasa kelelahan dan tubuh terasa lemas, segara periksakan diri ke dokter.\n', 'Topik: Ventricular Septal Defect, Subtopik: Pengobatan Ventricular Septal Defect (VSD) \n Pada sebagian besar kasus, bayi yang terlahir dengan VSD berukuran kecil tidak memerlukan operasi untuk menutup lubang. Dokter hanya akan memantau kondisi bayi dan kemungkinan munculnya gejala melalui pemeriksaan secara rutin, serta menunggu apakah lubang dapat menutup dengan sendirinya.\nJika defek septum ventrikel berukuran sedang hingga besar dan menimbulkan gejala, maka operasi menjadi jalan terbaik untuk menangani kondisi ini. Operasi dilakukan beberapa minggu atau beberapa bulan pertama setelah bayi lahir.\nBerikut ini adalah beberapa metode operasi yang dapat dilakukan untuk mengatasi VSD:\n']","Gejala yang umum terjadi pada anak atau bayi penderita Ventricular Septal Defect (VSD) bervariasi, tergantung pada ukuran dan lokasi celah pada jantung. Beberapa gejala yang mungkin timbul termasuk:\n- Mudah lelah saat makan atau bermain\n- Banyak mengeluarkan keringat, terutama ketika aktifitas fisik rendah\n- Tidak nafsu makan\n- Berat badan sulit naik atau tetap rendah\n- Napas cepat dan sering lebih berat saat beraktivitas\n- Kulit tampak pucat atau kesegaran kurang\n\nPada beberapa kasus, gejala VSD bisa tidak jelas dan hanya dirasakan oleh bayi setelah mereka mulai bergerak. Dalam kasus defek yang lebih besar dan yang memicu gangguan aliran darah pada saat ini, dapat timbul gejala seperti sesak napas, penyusutan berat badan, atau pertumbuhan kurang pesona.\n\nJika ada kekhawatiran tentang VSD, segera hubungi dokter untuk mendapatkan pemantauan dan tindakan medis yang diperlukan.",0.6875,0.7385510205041391,0.99999999995,1.0
Apa penyebab penyakit sindrom brugada?,"Sindrom Brugada terjadi akibat perubahan atau mutasi pada satu atau beberapa gen yang berperan menjaga irama jantung agar tetap normal. Gen yang bermutasi tersebut diturunkan dari salah satu orang tua.\n\nSindrom Brugada lebih sering dialami oleh laki-laki dibandingkan perempuan. Sementara kemunculan gejalanya diduga dapat dipicu dan diperburuk oleh kondisi berikut:\n\nGangguan elektrolit\nEfek samping obat, seperti obat antiaritmia, obat hipertensi, dan obat antidepresan\nPenyalahgunaan kokain\nDemam","['Topik: Sindrom Brugada, Subtopik: Penyebab dan Faktor Risiko Sindrom Brugada \n Sindrom Brugada terjadi akibat perubahan atau mutasi pada satu atau beberapa gen yang berperan menjaga irama jantung agar tetap normal. Gen yang bermutasi tersebut diturunkan dari salah satu orang tua.\nSindrom Brugada lebih sering dialami oleh laki-laki dibandingkan perempuan. Sementara kemunculan gejalanya diduga dapat dipicu dan diperburuk oleh kondisi berikut:\n- Gangguan elektrolit\n- Efek samping obat, seperti obat antiaritmia, obat hipertensi, dan obat antidepresan\n\n- Penyalahgunaan kokain\n\n- Demam\n', 'Topik: Sindrom Brugada, Subtopik: Pengertian Sindrom Brugada \n Sindrom Brugada adalah gangguan irama jantung akibat kelainan genetik. Sindrom Brugada sering kali tidak memunculkan gejala, tetapi dapat membuat penderitanya mengalami henti jantung mendadak.\nIrama jantung yang tidak teratur akan membuat jantung tidak bisa memompa darah ke seluruh tubuh secara optimal. Walaupun sering kali tidak menimbulkan keluhan, sebagian penderita sindrom Brugada dapat merasakan keluhan jantung berdebar dan sesak napas.\n\nSindrom Brugada jarang terjadi, namun merupakan salah satu penyebab utama kematian mendadak pada bayi hingga orang dewasa.\n', 'Topik: Sindrom Brugada, Subtopik: Pengertian Sindrom Brugada \n Irama jantung yang tidak teratur akan membuat jantung tidak bisa memompa darah ke seluruh tubuh secara optimal. Walaupun sering kali tidak menimbulkan keluhan, sebagian penderita sindrom Brugada dapat merasakan keluhan jantung berdebar dan sesak napas.\n\nSindrom Brugada jarang terjadi, namun merupakan salah satu penyebab utama kematian mendadak pada bayi hingga orang dewasa.\n']","Penyebab penyakit sindrom Brugada adalah karena perubahan atau mutasi pada satu atau beberapa gen yang berperan dalam menjaga irama jantung agar tetap normal. Gen tersebut diturunkan dari salah satu orangtua, dan faktor risiko lainnya termasuk gangguan elektrolit, efek samping obat, penyalahgunaan kokain, serta demam.",1.0,0.7858884873263966,0.99999999995,1.0
Bagaimana metode utama dalam pengobatan sindrom brugada,"Metode utama pengobatan sindrom Brugada adalah implan alat kejut jantung otomatis (ICD) di bawah tulang selangka. Perangkat ini dihubungkan ke jantung melalui pembuluh darah untuk memonitor detak jantung. Jika detak jantung tidak normal, ICD akan mengirim sinyal kejut agar detak jantung kembali normal.","['Topik: Sindrom Brugada, Subtopik: Pengobatan Sindrom Brugada \n Metode utama pengobatan sindrom Brugada adalah implan alat kejut jantung otomatis (ICD) di bawah tulang selangka. Perangkat ini dihubungkan ke jantung melalui pembuluh darah untuk memonitor detak jantung. Jika detak jantung tidak normal, ICD akan mengirim sinyal kejut agar detak jantung kembali normal.\nPerlu diketahui, ICD dapat mengirimkan sinyal kejut meski detak jantung pasien sedang dalam kondisi normal. Untuk mengurangi risiko kondisi tersebut terjadi, pasien yang menggunakan ICD perlu rutin memeriksakan diri ke dokter. Jika ICD tidak efektif dalam mengatasi sindrom Brugada, dokter akan menyarankan terapi ablasi jantung.\nSelain prosedur di atas, dokter juga dapat meresepkan obat antiaritmia untuk menjaga detak jantung pasien tetap normal.\n', 'Topik: Sindrom Brugada, Subtopik: Pencegahan Sindrom Brugada \n Sindrom Brugada tidak dapat dicegah, karena kelainan genetik yang menyebabkan kondisi ini sudah terjadi sejak lahir. Meski begitu, komplikasi sindrom Brugada bisa dicegah dengan pemeriksaan dini ketika ada gejala gangguan irama jantung.\nBila Anda tidak mengalami gejala sindrom Brugada tetapi memiliki anggota keluarga yang menderita sindrom Brugada atau meninggal karena henti jantung mendadak, sebaiknya periksakan diri ke dokter jantung. Tujuannya adalah agar penyakit ini dapat dideteksi dan ditangani sedini mungkin bila ada.\nSelain itu, penderita sindrom Brugada juga disarankan untuk:\n- Segera mengonsumsi obat penurun demam jika mulai merasa demam dan tidak membiarkan demam naik\n- Menghindari konsumsi minuman beralkohol\n- Berkonsultasi dengan dokter sebelum mengonsumsi obat apapun\n- Menghindari olahraga yang berat atau kompetitif, seperti sepak bola\n', 'Topik: Sindrom Brugada, Subtopik: Pengertian Sindrom Brugada \n Sindrom Brugada adalah gangguan irama jantung akibat kelainan genetik. Sindrom Brugada sering kali tidak memunculkan gejala, tetapi dapat membuat penderitanya mengalami henti jantung mendadak.\nIrama jantung yang tidak teratur akan membuat jantung tidak bisa memompa darah ke seluruh tubuh secara optimal. Walaupun sering kali tidak menimbulkan keluhan, sebagian penderita sindrom Brugada dapat merasakan keluhan jantung berdebar dan sesak napas.\n\nSindrom Brugada jarang terjadi, namun merupakan salah satu penyebab utama kematian mendadak pada bayi hingga orang dewasa.\n']","Metode utama pengobatan Sindrom Brugada adalah implantasi alat kejut jantung otomatis (ICD). Perangkat ini dihubungkan ke jantung melalui pembuluh darah dan secara berkala memonitor detak jantung. Jika detak jantung tidak normal, ICD akan mengirim sinyal kejut agar detak jantung kembali normal. Pasien yang menggunakan ICD perlu rutin memeriksa diri ke dokter untuk menghindari risiko kondisi ICD yang tidak efektif, dan bila diperlukan prosedur lain seperti terapi ablasi jantung juga dapat dilakukan. Selain itu, obat antiaritmia pun dapat disarankan dokter untuk menjaga detak jantung tetap normal dalam pencegahan sindrom Brugada.",0.7,0.7283391023449276,0.9999999999,1.0
Apa komplikasi yang dapat ditimbulkan dari Hipertrofi Ventrikel Kiri?,"Hipertrofi ventrikel kiri dapat mengubah struktur dan kerja jantung. Kondisi ini juga dapat menyebabkan jantung melemah, mengeras, dan menurunkan fungsi jantung dalam memompa darah. Kondisi ini dinamakan gagal jantung.\n\nDi samping menyebabkan gagal jantung, hipertrofi ventrikel kiri dapat menyebabkan beberapa komplikasi lain di bawah ini:\n\nPenyakit jantung koroner\nGangguan irama jantung (aritmia), misalnya atrial fibrilasi\nStroke\nHenti jantung mendadak","['Topik: Hipertrofi Ventrikel Kiri, Subtopik: Komplikasi Hipertrofi Ventrikel Kiri \n Hipertrofi ventrikel kiri dapat mengubah struktur dan kerja jantung. Kondisi ini juga dapat menyebabkan jantung melemah, mengeras, dan menurunkan fungsi jantung dalam memompa darah. Kondisi ini dinamakan gagal jantung.\nDi samping menyebabkan gagal jantung, hipertrofi ventrikel kiri dapat menyebabkan beberapa komplikasi lain di bawah ini:\n- Penyakit jantung koroner\n- Gangguan irama jantung (aritmia), misalnya atrial fibrilasi \n- Stroke\n- Henti jantung mendadak\n', 'Topik: Hipertrofi Ventrikel Kiri, Subtopik: Gejala Hipertrofi Ventrikel Kiri: Kapan harus ke dokter \n Hipertrofi ventrikel kiri merupakan komplikasi yang sering terjadi akibat hipertensi. Baik hipertensi maupun hipertrofi ventrikel kiri pada awalnya tidak menimbulkan gejala sehingga sering kali baru terdeteksi ketika ukuran ventrikel kiri sudah sangat besar.\nOleh karena itu, penting untuk melakukan pemeriksaan tekanan darah secara rutin, terutama pada orang-orang yang merokok atau obesitas. Penderita hipertensi juga perlu melakukan pemeriksaan berkala ke dokter agar tekanan darah tetap terkontrol dengan baik.\nKondisi ini dapat berkembang menjadi penyakit jantung. Gejala penyakit jantung yang perlu segera ditangani di IGD (instalasi gawat darurat) adalah:\n- Nyeri dada selama lebih dari beberapa menit\n- Sesak napas yang tidak membaik dengan istirahat\n- Sangat pusing hingga hilang kesadaran \n', 'Topik: Hipertrofi Ventrikel Kiri, Subtopik: Penyebab Hipertrofi Ventrikel Kiri \n Hipertrofi ventrikel kiri terjadi ketika jantung bekerja lebih keras dalam memompa darah ke seluruh tubuh. Beberapa kondisi yang dapat menyebabkan hal tersebut meliputi:\n- Hipertensi Hipertrofi ventrikel kiri sering kali disebabkan oleh hipertensi. Lebih dari sepertiga orang yang didiagnosis menderita hipertrofi ventrikel kiri juga menderita tekanan darah tinggi.\n- Hipertrofi kardiomiopati Hipertrofi kardiomiopati adalah kelainan genetik yang terjadi saat otot jantung menebal secara abnormal tetapi tekanan darah tetap normal. Akibatnya, jantung kesulitan memompa darah.\n- Stenosis katup aorta Penyakit ini menyebabkan penyempitan pada katup aorta, yaitu katup jantung yang terletak setelah ventrikel kiri. Katup aorta yang menyempit membuat ventrikel atau bilik kiri jantung perlu bekerja lebih keras untuk memompa darah.\n- Latihan fisik Latihan fisik yang dilakukan secara intensif dan berkelanjutan dapat membuat jantung bekerja lebih keras sehingga menyebabkan hipertrofi ventrikel kiri. Kondisi ini sering terjadi pada atlet atau tentara.\nSelain itu, ada sejumlah faktor yang membuat seseorang makin berisiko terkena hipertrofi ventrikel kiri, yaitu:\n- Berusia 50 tahun ke atas\n- Memiliki berat badan berlebih\n- Menderita diabetes \n- Berjenis kelamin wanita\n']","Komplikasi yang berkaitan dengan hipertrofi ventrikel kiri meliputi:\n\n1. Gagal Jantung: Hipertrofi ventrikel kiri dapat menyebabkan jantung melemah, mengeras, dan menurunkan fungsi jantung dalam memompa darah. Kondisi ini disebut gagal jantung.\n2. Penyakit Jantung Koroner: Hipertrofi ventrikel kiri dapat menyebabkan peningkatan risiko penyakit jantung koroner, yang merupakan penyakit arteri yang mengakibatkan cacat jaringan jantung.\n3. Gangguan Rhythm Jantung: Hipertrofi ventrikel kiri juga dapat menyebabkan beberapa gangguan irama jantung, seperti aritmia (gangguan ritme jantung yang tidak normal) atau even pada awalnya terdeteksi.\n4. Stroke: Hipertrofi ventrikel kiri juga dapat meningkatkan risiko stroke, yaitu tikus kerdil yang disebabkan oleh aritmia jantung atau gagal jantung.\n5. Henti Jantung Mendadak (Sudden Cardiac Death): Risiko henti jantung mendadak dapat meningkat akibat hipertrofi ventrikel kiri, terutama dalam penderita penyakit jantung lainnya atau yang memiliki faktor-faktor resikonya.\n\nDemikian komplikasi yang disebabkan oleh hipertrofi ventrikel kiri, berdasarkan konteks yang diberikan.",0.6842105263157895,0.6062454505940148,0.9999999999666667,1.0
Bagaimana pencegahan penyakit hipertrofi ventrikel kiri?,"Salah satu cara yang bisa dilakukan untuk mencegah hipertrofi ventrikel kiri adalah menjaga agar tekanan darah selalu berada pada batas normal. Berikut ini adalah beberapa upaya yang dapat dilakukan untuk mengontrol tekanan darah, sekaligus mencegah terjadinya hipertensi:\n\nMelakukan pemeriksaan berkala terhadap tekanan darah\nSelalu menjaga berat badan ideal\nBerolahraga secara rutin, idealnya 30 menit setiap hari\nMenerapkan pola makan sehat, seperti banyak makan buah dan sayur, serta menghindari makanan tinggi lemak dan garam\nMenghindari konsumsi minuman beralkohol secara berlebihan, karena dapat meningkatkan tekanan darah dan asupan kalori\nBerhenti merokok, karena merokok dapat menaikkan tekanan darah dan meningkatkan risiko hipertensi\nMengelola stres dengan baik","['Topik: Hipertrofi Ventrikel Kiri, Subtopik: Pencegahan Hipertrofi Ventrikel Kiri \n Salah satu cara yang bisa dilakukan untuk mencegah hipertrofi ventrikel kiri adalah menjaga agar tekanan darah selalu berada pada batas normal. Berikut ini adalah beberapa upaya yang dapat dilakukan untuk mengontrol tekanan darah, sekaligus mencegah terjadinya hipertensi:\n- Melakukan pemeriksaan berkala terhadap tekanan darah\n- Selalu menjaga berat badan ideal \n- Berolahraga secara rutin, idealnya 30 menit setiap hari\n- Menerapkan pola makan sehat, seperti banyak makan buah dan sayur, serta menghindari makanan tinggi lemak dan garam\n- Menghindari konsumsi minuman beralkohol secara berlebihan, karena dapat meningkatkan tekanan darah dan asupan kalori\n- Berhenti merokok, karena merokok dapat menaikkan tekanan darah dan meningkatkan risiko hipertensi\n- Mengelola stres dengan baik\n', 'Topik: Hipertrofi Ventrikel Kiri, Subtopik: Pengobatan Hipertrofi Ventrikel Kiri \n Pengobatan hipertrofi ventrikel kiri adalah dengan mengatasi penyebabnya, agar otot ventrikel kiri jantung tidak makin membesar sehingga mengakibatkan gagal jantung.\nHipertrofi ventrikel kiri yang disebabkan oleh hipertensi bisa diatasi dengan mengubah gaya hidup, seperti menjalani diet rendah lemak dan garam, memperbanyak konsumsi buah dan sayur, berolahraga secara teratur, dan berhenti merokok.\nSelain perubahan gaya hidup, hipertensi perlu diobati dengan obat-obatan untuk mengatasi tekanan darah tinggi, contohnya:\n- Obat ACE inhibitor, seperti captopril dan ramipril\n- Obat ARB, seperti losartan \n- Obat antagonis kalsium, seperti amlodipine \n- Obat diuretik, seperti hydrochlorothiazide \n- Obat penghambat beta, seperti atenolol\nSelain hipertensi, berikut ini adalah metode pengobatan hipertrofi ventrikel kiri sesuai dengan penyebab yang mendasarinya:\n- Penanganan hipertrofi ventrikel kiri akibat stenosis katup aorta Pada pasien dengan kondisi ini, dokter akan menjalankan operasi untuk memperbaiki katup aorta atau menggantinya dengan katup buatan.\n- Penanganan hipertrofi ventrikel kiri akibat aktivitas fisik berlebihan Pada kondisi ini, dokter akan menyarankan pasien untuk menghentikan latihan fisik selama 3 hingga 6 bulan. Setelah itu, dokter akan melakukan pemeriksaan echo jantung untuk memantau pembesaran ventrikel kiri.\n- Penanganan hipertrofi kardiomiopati Kondisi ini dapat ditangani dengan obat-obatan, perubahan gaya hidup, prosedur bedah, dan penanaman alat khusus di dalam jantung.\n', 'Topik: Hipertrofi Ventrikel Kiri, Subtopik: Penyebab Hipertrofi Ventrikel Kiri \n Hipertrofi ventrikel kiri terjadi ketika jantung bekerja lebih keras dalam memompa darah ke seluruh tubuh. Beberapa kondisi yang dapat menyebabkan hal tersebut meliputi:\n- Hipertensi Hipertrofi ventrikel kiri sering kali disebabkan oleh hipertensi. Lebih dari sepertiga orang yang didiagnosis menderita hipertrofi ventrikel kiri juga menderita tekanan darah tinggi.\n- Hipertrofi kardiomiopati Hipertrofi kardiomiopati adalah kelainan genetik yang terjadi saat otot jantung menebal secara abnormal tetapi tekanan darah tetap normal. Akibatnya, jantung kesulitan memompa darah.\n- Stenosis katup aorta Penyakit ini menyebabkan penyempitan pada katup aorta, yaitu katup jantung yang terletak setelah ventrikel kiri. Katup aorta yang menyempit membuat ventrikel atau bilik kiri jantung perlu bekerja lebih keras untuk memompa darah.\n- Latihan fisik Latihan fisik yang dilakukan secara intensif dan berkelanjutan dapat membuat jantung bekerja lebih keras sehingga menyebabkan hipertrofi ventrikel kiri. Kondisi ini sering terjadi pada atlet atau tentara.\nSelain itu, ada sejumlah faktor yang membuat seseorang makin berisiko terkena hipertrofi ventrikel kiri, yaitu:\n- Berusia 50 tahun ke atas\n- Memiliki berat badan berlebih\n- Menderita diabetes \n- Berjenis kelamin wanita\n']","Pencegahan hipertrofi ventrikel kiri melibatkan beberapa upaya, seperti mengontrol tekanan darah dan memelihara pola hidup sehat. Berikut ini adalah upaya-upaya yang dapat dilakukan:\n\n1. Mengontrol Tekanan Darah:\n   - Melakukan pemeriksaan berkala terhadap tekanan darah untuk mengetahui apakah tekanan darah berada pada batas normal, sekali setiap tahun atau sesuai preferensi dokter.\n   - Menggunakan obat-obatan yang dianjurkan oleh dokter untuk mengendalikan hipertensi, contohnya:\n     a. Obat ACE inhibitor, seperti captopril dan ramipril.\n     b. Obat ARB, seperti losartan.\n     c. Obat antagonis kalsium, seperti amlodipine.\n     d. Obat diuretik, seperti hydrochlorothiazide.\n2. Menjaga Berat Badan Ideal:\n   - Melakukan diet yang sehat dan mengontrol asupan makanan tinggi lemak serta garam untuk menurunkan berat badan ideal.\n3. Berolahraga Secara Rutin:\n   - Mengadakan latihan fisik secara teratur, minimal 30 menit setiap hari, seperti jogging atau bersepeda.\n4. Menerapkan Pola Makan Sehat:\n   - Mengkonsumsi makanan yang mengandung serat dan vitamin tinggi untuk membantu menurunkan berat badan.\n5. Menghindari Konsumsi Minuman Beralkohol Secara Berlebihan:\n   - Mencegah asupan alkohol secara berlebihan, karena dapat meningkatkan tekanan darah dan asupan kalori.\n6. Mengelola Stres:\n   - Menjaga kondisi mental agar tetap tenang dan bebas stres, yang bisa dilakukan melalui berbagai metode seperti meditasi atau kegiatan rekreasi lainnya.\n7. Melakukan Pemeriksaan Bercelana:\n   - Mengontrol tekanan darah dan hipertrofi ventrikel kiri dengan cara yang teratur, seperti melakukan pemeriksaan berkala untuk menjaga agar tidak ada penyakit atau gangguan lain yang mungkin mempengaruhi tekanan darah dan jantung.\n\nDengan mengikuti cara-cara tersebut, Anda dapat mencegah hipertrofi ventrikel kiri dan menjaga kesehatan jantung serta rasa tenang diri yang luar biasa penting untuk hidup sehat.",0.8518518518518519,0.5161190143218989,0.9999999999666667,1.0
Apa kelainan yang dialami penderita atrial fibrilasi?,"Fibrilasi atrium atau atrial fibrilasi (AF) adalah gangguan irama jantung yang ditandai dengan denyut jantung tidak beraturan dan cepat. Penderita atrial fibrilasi dapat merasakan gejala lemas, jantung berdebar, dan sesak napas.\n\nDenyut jantung yang normal berkisar antara 60–100 kali per menit dengan irama yang teratur. Pada penderita atrial fibrilasi, irama jantung menjadi tidak teratur dan bisa lebih dari 100 kali per menit.","['Topik: Atrial Fibrilasi, Subtopik: Pengertian Atrial Fibrilasi \n Fibrilasi atrium atau atrial fibrilasi (AF) adalah gangguan irama jantung yang ditandai dengan denyut jantung tidak beraturan dan cepat. Penderita atrial fibrilasi dapat merasakan gejala lemas, jantung berdebar, dan sesak napas.\nDenyut jantung yang normal berkisar antara 60  100 kali per menit dengan irama yang teratur. Pada penderita atrial fibrilasi, irama jantung menjadi tidak teratur dan bisa lebih dari 100 kali per menit.\n\nAtrial fibrilasi adalah salah satu jenis aritmia atau gangguan irama jantung. Gejalanya bisa hilang timbul, berlangsung lama, atau bahkan permanen. Apabila dibiarkan, atrial fibrilasi bisa mengakibatkan gagal jantung dan stroke.\n', 'Topik: Atrial Fibrilasi, Subtopik: Penyebab Atrial Fibrilasi (AF) \n Fibrilasi atrium (AF) terjadi akibat adanya gangguan hantaran sinyal listrik di otot jantung. Akibatnya, denyut jantung menjadi tidak normal sehingga tidak memompa darah dengan optimal ke seluruh tubuh.\nGangguan hantran listrik ini diduga disebabkan oleh beberapa faktor berikut:\n- Konsumsi minuman berkafein atau beralkohol\n- Konsumsi obat-obatan batuk pilek\n\n- Kebiasaan merokok\n- Tekanan darah tinggi\n- Penyakit jantung koroner\n- Penyakit jantung bawaan\n- Kelainan katup jantung\n- Serangan jantung\n- Hipertiroidisme\n- Infeksi virus\n- Sleep apnea\n- Gangguan metabolik\n- Penyakit paru-paru\nSelain beberapa faktor di atas, terdapat kondisi lain yang dapat meningkatkan risiko seseorang terserang AF, yaitu:\n- Berusia lanjut\n- Menderita obesitas atau berat badan berlebih\n- Memiliki keluarga yang juga mengalami atrial fibrilasi\n', 'Topik: Atrial Fibrilasi, Subtopik: Pengobatan Atrial Fibrilasi (AF): Mencegah penggumpalan darah \n Penderita atrial fibrilasi (AF) sangat berisiko mengalami penggumpalan darah dan penyumbatan pembuluh darah, terutama di otak (stroke). Untuk mencegahnya, dokter akan meresepkan obat antikoagulan, seperti warfarin, edoxaban,  apixaban, atau rivaroxaban.\nPada banyak kasus, pasien perlu menggunakan obat tersebut untuk seumur hidupnya meski denyut jantungnya sudah kembali normal.\n']","Kelainan yang dialami oleh penderita atrial fibrilasi (AF) meliputi gejala fisik dan dampak fungsi jantung. Gejala umumnya mencakup:\n\n1. Rasuk, yaitu perubahan irama denyut jantung menjadi tidak teratur dan cepat.\n2. Jantung berdebar, yang merujuk pada penyimpangan arka atau tendinitas di dada akibat gerakan sporik spontan saat AF tersebut terjadi.\n3. Lemas, seperti kelelahan fisik dan ketidakmaksimalan dalam aktivitas harian.\n4. Sesak napas, yang dapat disertai oleh gelombang tekanan di leher atau gelecek pada pernapasan.\n5. Pusing, mual, dan gemetaran.\n6. Kurang nafsu makan dan kehilangan berat badan.\n7. Sesak nafas saat tidur yang dapat mempersulit waktu tidur atau menimbulkan alis napas pagi hari.\n\nDampak fungsional jantung termasuk:\n\n1. Gangguan pemompaan darah oleh arka lebih cepat dan tak teratur, yang dapat menyebabkan jaringan jantung menjadi lusit dan kurang mengeluarkan cairan, sehingga memperparah penyakit jantung.\n2. Trensi atrioventrikuler (TV), yaitu keadaan di mana tekanan darah di bulbi atrium dan ventrikel menjadi sama setelah arka berlangsung lama, menyebabkan darah terbawa ke seluruh tubuh dengan cepat.\n3. Penurunan kapasitas jantung yang bisa mengakibatkan penyakit jantung lebih lanjut dan gangguan lain seperti cedera hipoksia otak (kesalahan fungsi otak).\n\nKelainan ini dapat membahayakan bagi kesehatan penderita AF, terutama risiko stroke akibat penggumpalan darah dan penurunan kapasitas jantung. Oleh karena itu, perawatan medis yang tepat dan obat antikoagulan sebagai upaya preventif untuk mencegah penggumpalan darah menjadi sangat penting dalam mengelola penyakit AF ini.",0.5263157894736842,0.5618438865895478,0.99999999995,1.0
Apa penyebab seseorang menderita atrial fibrilasi?,"Fibrilasi atrium (AF) terjadi akibat adanya gangguan hantaran sinyal listrik di otot jantung. Akibatnya, denyut jantung menjadi tidak normal sehingga tidak memompa darah dengan optimal ke seluruh tubuh.\n\nGangguan hantran listrik ini diduga disebabkan oleh beberapa faktor berikut:\n\nKonsumsi minuman berkafein atau beralkohol\nKonsumsi obat-obatan batuk pilek\nKebiasaan merokok\nTekanan darah tinggi\nPenyakit jantung koroner\nPenyakit jantung bawaan\nKelainan katup jantung\nSerangan jantung\nHipertiroidisme\nInfeksi virus\nSleep apnea\nGangguan metabolik\nPenyakit paru-paru\n\nSelain beberapa faktor di atas, terdapat kondisi lain yang dapat meningkatkan risiko seseorang terserang AF, yaitu:\n\nBerusia lanjut\nMenderita obesitas atau berat badan berlebih\nMemiliki keluarga yang juga mengalami atrial fibrilasi","['Topik: Atrial Fibrilasi, Subtopik: Penyebab Atrial Fibrilasi (AF) \n Fibrilasi atrium (AF) terjadi akibat adanya gangguan hantaran sinyal listrik di otot jantung. Akibatnya, denyut jantung menjadi tidak normal sehingga tidak memompa darah dengan optimal ke seluruh tubuh.\nGangguan hantran listrik ini diduga disebabkan oleh beberapa faktor berikut:\n- Konsumsi minuman berkafein atau beralkohol\n- Konsumsi obat-obatan batuk pilek\n\n- Kebiasaan merokok\n- Tekanan darah tinggi\n- Penyakit jantung koroner\n- Penyakit jantung bawaan\n- Kelainan katup jantung\n- Serangan jantung\n- Hipertiroidisme\n- Infeksi virus\n- Sleep apnea\n- Gangguan metabolik\n- Penyakit paru-paru\nSelain beberapa faktor di atas, terdapat kondisi lain yang dapat meningkatkan risiko seseorang terserang AF, yaitu:\n- Berusia lanjut\n- Menderita obesitas atau berat badan berlebih\n- Memiliki keluarga yang juga mengalami atrial fibrilasi\n', 'Topik: Atrial Fibrilasi, Subtopik: Pengertian Atrial Fibrilasi \n Fibrilasi atrium atau atrial fibrilasi (AF) adalah gangguan irama jantung yang ditandai dengan denyut jantung tidak beraturan dan cepat. Penderita atrial fibrilasi dapat merasakan gejala lemas, jantung berdebar, dan sesak napas.\nDenyut jantung yang normal berkisar antara 60  100 kali per menit dengan irama yang teratur. Pada penderita atrial fibrilasi, irama jantung menjadi tidak teratur dan bisa lebih dari 100 kali per menit.\n\nAtrial fibrilasi adalah salah satu jenis aritmia atau gangguan irama jantung. Gejalanya bisa hilang timbul, berlangsung lama, atau bahkan permanen. Apabila dibiarkan, atrial fibrilasi bisa mengakibatkan gagal jantung dan stroke.\n', 'Topik: Atrial Fibrilasi, Subtopik: Pengertian Atrial Fibrilasi \n Denyut jantung yang normal berkisar antara 60  100 kali per menit dengan irama yang teratur. Pada penderita atrial fibrilasi, irama jantung menjadi tidak teratur dan bisa lebih dari 100 kali per menit.\n\nAtrial fibrilasi adalah salah satu jenis aritmia atau gangguan irama jantung. Gejalanya bisa hilang timbul, berlangsung lama, atau bahkan permanen. Apabila dibiarkan, atrial fibrilasi bisa mengakibatkan gagal jantung dan stroke.\n']","Atrial fibrillation (AF), seperti yang dijelaskan dalam konteks, terjadi akibat gangguan hantaran sinyal listrik di otot jantung. Faktor-faktor yang mempengaruhi timbulnya AF termasuk:\n\n1. Konsumsi minuman beralkohol atau kafein, seperti teh dan kopi, yang dapat merusak sel-sel jaringan jantung.\n2. Konsumsi obat-obatan batuk pilek, terutama aquellsronium dan antiasetilin, yang bisa menyebabkan perubahan ritme jantung.\n3. Merokok, karena minyak dan zat kimiawi dalam rokok dapat merusak sel-sel jaringan jantung dan mempengaruhi fungsi elektrokimia di sekitar atrioventricular (AV) node.\n4. Tekanan darah tinggi, yang bisa menekan jantung untuk bekerja lebih keras untuk mengalirkan darah.\n5. Penyakit jantung koroner dan jantung bawaan, yang dapat merusak struktur atrioventrikuler (AV) node dan menyebabkan gejala aritmogenik.\n6. Kelainan katup jantung, seperti stenosis valvular atau insufisiensi katup, yang bisa meningkatkan tekanan di dalam atrium dan merusak struktur jantung.\n7. Gangguan metabolik lainnya, seperti hipertiroidisme atau hiperkalemia, yang juga dapat mempengaruhi ritme jantung.\n8. Serangan jantung akibat trombosis pada arteri poliakron, menyebabkan iskemik miokardium dan mengakibatkan aritmia.\n9. Sleep apnea, yang bisa meningkatkan tekanan darah dan mempengaruhi ritme denyut jantung.\n10. Infeksi infeksi viremia pada tikus, seperti mycoplasma, yang dapat menyebabkan aritmia jantung.\n\nSelain faktor-faktor tersebut, ada beberapa kondisi lain yang juga bisa meningkatkan risiko timbulnya AF, termasuk usia lanjut, obesitas atau berat badan berlebih, serta familiari yang mengalami AF.",0.6842105263157895,0.6154592569623577,0.99999999995,1.0
Apa gejala yang dialami penderita angina pectoris?,"Angina pectoris ditandai dengan nyeri dada sebelah kiri yang terasa seperti tertindih, terbakar, tertusuk atau terasa sesak. Rasa sakit ini dapat menjalar ke lengan, bahu, punggung, leher, dan rahang.\n\nGejala lain yang dapat menyertai nyeri dada tersebut antara lain:\n\nKeringat berlebihan meski cuaca tidak panas\nMual\nLelah\nPusing\nSesak napas","['Topik: Angina Pectoris, Subtopik: Gejala Angina Pectoris \n Angina pectoris ditandai dengan nyeri dada sebelah kiri yang terasa seperti tertindih, terbakar, tertusuk atau terasa sesak. Rasa sakit ini dapat menjalar ke lengan, bahu, punggung, leher, dan rahang.\nGejala lain yang dapat menyertai nyeri dada tersebut antara lain:\n- Keringat berlebihan meski cuaca tidak panas\n- Mual\n- Lelah\n- Pusing\n- Sesak napas\nBerdasarkan karakteristik gejalanya, angina pectoris dapat dibedakan menjadi:\n', 'Topik: Angina Pectoris, Subtopik: Gejala Angina Pectoris: Kapan harus ke dokter \n Jika Anda baru pertama kali mengalami nyeri dan rasa tidak nyaman di dada, segera konsultasikan dengan dokter. Keluhan nyeri dada tersebut bisa mengarah ke kondisi angina pectoris yang disebabkan oleh penyakit jantung.\nAnda juga perlu memeriksakan diri ke dokter jika angina pektoris yang dialami berlangsung cukup lama dan tidak membaik setelah beristirahat.\nKarena angina pectoris sering disebabkan oleh penyakit jantung koroner, disarankan untuk melakukan pemeriksaan ke dokter jika memiliki riwayat hipertensi, kolesterol tinggi, dan menjalani pola hidup yang tidak sehat, seperti:\n- Sering mengonsumsi makanan berlemak\n- Mengonsumsi minuman beralkohol secara berlebihan\n- Merokok\nMakin cepat Anda diperiksa dan ditangani oleh dokter, risiko komplikasi yang lebih parah bisa dicegah.\n', 'Topik: Angina Pectoris, Subtopik: Pengertian Angina Pectoris \n Angina pectoris adalah nyeri dada akibat penyakit jantung koroner. Angin duduk atau angina pectoris terjadi ketika otot jantung tidak mendapatkan suplai darah yang cukup, akibat penyempitan atau penyumbatan pada pembuluh darah arteri di jantung.\nAngina pectoris bisa terjadi kapan saja dan pada siapa saja. Nyeri akibat angina pectoris ini sering disalahartikan sebagai gejala dari kondisi lain, seperti naiknya asam lambung dan peradangan pada paru-paru.\n']","Gejala yang dialami oleh pasien yang menderita angina pectoris bervariasi dan mencakup rasa nyeri atau ketegangannya dada. Nyeri ini umumnya terasa seperti tertindih, terbakar, menusuk, atau sesak. Rasa sakit ini sering merambah ke bagian lengan, bahu, punggung, leher, dan rahang. Selain itu, pasien mungkin juga mengalami gejala-gejala lain seperti:\n\n1. Keringat berlebihan meski cuaca tidak panas.\n2. Mual atau merasa gatal pada kulit dada dan leher.\n3. Merasa lapar, sia-sia, atau lelah.\n4. Pusing atau kehilangan daya nafas.\n5. Sesak napas yang terjadi saat tidur atau aktivitas ringan lainnya.\n\nGejala ini bisa muncul kapan saja dan biasanya disertai dengan beban fisik ringan hingga sedang, seperti berdiri lama di tempat atau menempel pada kursi yang tertekuk. Kondisi angina pectoris seringkali memiliki periode gemetar dan berkurangnya gejala selama beberapa waktu, tetapi bisa juga merupakan gejalan dari penyakit jantung koroner yang disebabkan oleh penyempitan atau penyumbatan pada arteri di jantung.",0.72,0.7881336848987339,0.9999999999666667,1.0
Jenis obat apa yang digunakan untuk meredakan gejala angina pectoris?,"Beberapa jenis obat yang dapat diberikan oleh dokter untuk meredakan gejala angina adalah:\n\nObat pengencer darah, seperti aspirin, clopidogrel, atau ticagrelor\nObat pelebar pembuluh darah golongan nitrat, seperti nitrogliserin dan isosorbide dinitrate, untuk melebarkan dan merelaksasi pembuluh darah, sehingga aliran darah ke jantung lebih baik\nObat penghambat beta, seperti atenolol,bisoprolol, atau carvedilol, untuk memperlambat denyut jantung dan membuat pembuluh darah lebih rileks sehingga mengurangi beban kerja jantung\nObat untuk mengontrol penyakit diabetes, kolesterol, dan hipertensi yang merupakan faktor risiko dari penyakit jantung koroner\nObat antiangina, seperti trimetazidine atau ranolazine, untuk mengurangi dan mencegah kejadian nyeri dada","['Topik: Angina Pectoris, Subtopik: Pengobatan Angina Pectoris: Prosedur medis \n Apabila angina pectoris tidak mereda setelah pemberian obat-obatan, dokter akan menganjurkan tindakan medis, seperti:\n- Pemberian suntikan antikoagulan, seperti fondaparinux\n\n- Pemasangan ring jantung, untuk melebarkan arteri yang menyempit dengan meletakkan kawat khusus (ring) yang berbentuk seperti tabung di pembuluh darah arteri jantung\n- Operasi bypass jantung, dengan mengambil pembuluh darah dari bagian tubuh lain, untuk membuat saluran aliran darah baru sebagai pengganti saluran aliran darah yang menyempit\nSelain menjalani pengobatan, pasien perlu menjalani pengobatan untuk berbagai faktor risiko penyakit jantung koroner penyebab angina, seperti hipertensi dan diabetes.\nPasien juga perlu melakukan perubahan gaya hidup untuk mencegah keluhan ini muncul kembali dan meningkatkan harapan hidup. Perubahan gaya hidup yang perlu dilakukan meliputi olahraga secara teratur, menerapkan pola makan yang sehat, berhenti merokok, dan beristirahat yang cukup.\n', 'Topik: Angina Pectoris, Subtopik: Gejala Angina Pectoris: Unstable angina \n Berbeda dengan dua jenis angina yang dijelaskan sebelumnya, Prinzmetal  s angina disebabkan oleh kekakuan di arteri jantung. Kondisi ini menyebabkan jumlah aliran darah menurun untuk sementara waktu.\nPrinzmetal  s angina merupakan jenis angina yang cukup jarang terjadi. Angina jenis ini biasanya muncul saat istirahat, di malam hari atau di pagi hari. Intensitas nyerinya cukup berat, tetapi biasanya mereda dengan pemberian obat-obatan.\n', 'Topik: Angina Pectoris, Subtopik: Pencegahan Angina Pectoris \n Angina pectoris dapat dicegah dengan menerapkan gaya hidup sehat. Upaya yang bisa diterapkan antara lain:\n- Berhenti merokok dan membatasi konsumsi minuman beralkohol\n- Berolahraga secara teratur dan menjaga berat badan ideal\n- Memperbaiki pola makan dengan mengonsumsi makanan rendah lemak dan garam, buah-buahan, sayur-sayuran, dan gandum utuh.\n- Menghindari konsumsi makanan tinggi lemak jenuh, seperti sosis dan daging berlemak, mentega, keju, dan makanan cepat saji\n- Mengelola stres dengan cara yang positif, bisa dengan yoga, meditasi, atau melakukan hobi yang menyenangkan\n- Memeriksakan diri ke dokter secara berkala jika menderita hipertensi, hiperkolesterolemia, atau diabetes\n- Mengonsumsi obat-obatan untuk menurunkan kejadian angina dalam jangka panjang, seperti amlodipine\n\n']","Jenis obat yang umum digunakan untuk meredakan gejala angina pectoris adalah nifedipin (brand name Procardia). Nifedipin termasuk dalam kelas zat bersifat relaxasi musculer, yang bekerja menghilangkan kekakuan pada arteri jantung sehingga aliran darah tidak terganggu. Obat ini sering digunakan untuk mengobati hipertensi dan mencegah angina pectoris akibat penyempitan arteri jantung.",0.0,0.728401357981599,0.5833333333041666,0.0
Apa penyebab penyakit aterosklerosis?,"Penyebab pasti aterosklerosis belum diketahui, tetapi penyakit ini dimulai ketika terjadi kerusakan atau cedera di lapisan dalam arteri. Kerusakan tersebut dapat disebabkan oleh:\n\nKolesterol tinggi\nTekanan darah tinggi\nDiabetes\nPeradangan akibat penyakit tertentu, seperti lupus\nObesitas\nKebiasaan merokok","['Topik: Aterosklerosis, Subtopik: Penyebab Aterosklerosis \n Penyebab pasti aterosklerosis belum diketahui, tetapi penyakit ini dimulai ketika terjadi kerusakan atau cedera di lapisan dalam arteri. Kerusakan tersebut dapat disebabkan oleh:\n- Kolesterol tinggi\n- Tekanan darah tinggi\n- Diabetes\n- Peradangan akibat penyakit tertentu, seperti lupus\n\n- Obesitas\n- Kebiasaan merokok\nSaat lapisan dalam arteri rusak, lemak serta zat lain menjadi mudah menempel dan menggumpal di sana. Seiring berjalannya waktu, gumpalan atau plak ini terus menumpuk dan mengeras sehingga pembuluh darah arteri menyempit dan kaku.\nPenyempitan pembuluh darah akan menghambat suplai oksigen serta nutrisi ke organ-organ tubuh. Hal ini membuat fungsi organ tersebut menurun, bahkan terhenti, tergantung seberapa parah penyempitan yang terjadi.\nPerkembangan aterosklerosis hingga menimbulkan gejala sangat lambat, bahkan bisa sampai puluhan tahun. Namun, kondisi di bawah ini dapat membuat seseorang lebih berisiko atau lebih cepat mengalami aterosklerosis:\n- Usia di atas 40 atau 50 tahun\n- Pola hidup yang tidak sehat, seperti malas bergerak atau jarang berolahraga\n- Pola makan tidak sehat dan sering mengonsumsi minuman beralkohol\n- Stres berkepanjangan\n- Riwayat aterosklerosis pada keluarga\n', 'Topik: Aterosklerosis, Subtopik: Pengertian Aterosklerosis \n Atherosclerosis atau aterosklerosis adalah penyempitan dan pengerasan pembuluh darah arteri akibat penumpukan plak di dinding pembuluh darah. Kondisi ini merupakan penyebab umum penyakit jantung koroner (atherosclerosis heart disease).\nArteri adalah pembuluh darah pembawa oksigen serta nutrisi dari dan ke jantung, juga ke seluruh organ lain. Tersumbatnya arteri akibat penumpukan plak kolesterol akan menghambat aliran darah ke organ-organ tubuh.\n\nPada awalnya, aterosklerosis tidak menimbulkan gejala apa pun. Gejala baru muncul ketika aliran darah ke organ atau jaringan tubuh terhambat. Proses penumpukan plak sampai gejala aterosklerosis timbul bisa memakan waktu hingga bertahun-tahun.\n', 'Topik: Aterosklerosis, Subtopik: Gejala dan Komplikasi Aterosklerosis \n terosklerosis awalnya tidak menimbulkan gejala, sampai pembuluh darah arteri sudah sangat menyempit bahkan tertutup Akibatnya, pembuluh arteri tidak lagi dapat menyalurkan darah dalam jumlah cukup ke organ-organ tubuh.\nKarena gejalanya baru muncul setelah bertahun-tahun, banyak orang yang tidak menyadari bahwa dirinya menderita aterosklerosis sampai muncul komplikasi. Komplikasi yang muncul bisa beragam, tergantung lokasi terjadinya aterosklerosis, antara lain:\nAterosklerosis di jantung bisa menyebabkan penyakit jantung koroner dan serangan jantung. Kedua gangguan tersebut memiliki sejumlah gejala yang serupa, yaitu:\n- Nyeri dada seperti ditekan atau diremas (angina)\n- Nyeri atau tekanan pada pundak, lengan, rahang, atau punggung\n- Gangguan irama jantung (aritmia)\n- Sesak napas, berkeringat, dan gelisah\nAterosklerosis di kaki atau lengan bisa menyebabkan penyakit arteri perifer. Gangguan ini ditandai dengan gejala berikut:\n- Nyeri, kram, hingga mati rasa di area lengan atau tungkai\n- Nyeri saat berjalan dan mereda setelah beristirahat (klaudikasio intermiten)\n- Tungkai bagian bawah terasa dingin\n- Luka di jempol, telapak, atau kaki yang tidak kunjung sembuh\nBila terjadi pada pembuluh darah di otak, aterosklerosis bisa menyebabkan stroke, yang ditandai dengan gejala berupa:\n- Mati rasa hingga lumpuh pada salah satu sisi wajah, lengan, atau tungkai\n- Kebingungan dan sulit untuk dapat berbicara dengan jelas\n- Kehilangan penglihatan pada salah satu mata atau kedua mata\n- Kehilangan koordinasi dan keseimbangan\n- Pusing dan sakit kepala berat\n- Sulit bernapas dan kehilangan kesadaran\n\nPenumpukan plak pada pembuluh arteri di ginjal dapat menyebabkan gagal ginjal. Gangguan ini bisa dikenali dari sejumlah gejala, seperti:\n- Jarang buang air kecil\n- Mual yang terasa terus menerus\n- Tubuh terasa sangat lelah dan sering mengantuk\n- Tungkai membengkak\n- Bingung dan sulit berkonsentrasi\n- Sesak napas dan dada terasa nyeri\nSegera periksakan diri ke dokter jika mengalami gejala yang telah disebutkan di atas. Anda juga perlu segera ke IGD bila mengalami gejala serangan jantung atau stroke. Kedua kondisi tersebut harus segera ditangani, karena bisa berakibat fatal bila menunggu lama.\nJika Anda menderita diabetes atau hipertensi, lakukan kontrol rutin ke dokter untuk memantau kondisi penyakitnya dan mencegah kemungkinan komplikasi aterosklerosis.\nBila Anda perokok, berusahalah untuk menghentikan kebiasaan tersebut. Merokok tidak hanya bisa menyebabkan aterosklerosis, tetapi juga penyakit lain. Jika berhenti merokok dirasa sangat sulit, pergilah ke dokter untuk mengikuti program berhenti merokok.\n']","Penyebab atau faktor utama terjadinya aterosklerosis belum pasti, tetapi penyakit ini dimulai ketika terjadi kerusakan atau cedera di lapisan dalam arteri. Kerusakan tersebut dapat disebabkan oleh beberapa faktor, antara lain:\n\n1. Kolesterol tinggi: Kolesterol dalam darah berlebih bisa menempel dan menggumpal pada dinding arteri, menyebabkan proses penyempitan arteri atau aterosklerosis.\n2. Tekanan Darah Tinggi: Rendahnya kontrol tekanan darah juga bisa memicu terjadinya aterosklerosis, sebab tekanan darah yang tinggi dapat merusak endotel (lapisan seluler di dalam arteri) dan menyebabkan pengerasan dinding arteri.\n3. Diabetes: Penyakit diabetes mengakibatkan rendahnya respons insulin tubuh, yang bisa meningkatkan risiko terjadinya aterosklerosis karena memperlambat proses pelepasan glokusium (zat pengaktif pemotong glikogen) dari darah.\n4. Penyakit infeksi akut atau paru-paru: Gejala penyebab ini bisa meningkatkan risiko terjadinya aterosklerosis karena inflamasi yang diindikasikan oleh penyakit infeksi atau paru-paru dapat merusak endotel dan menyebabkan pengerasan arteri.\n5. Obesitas: Keadaan obesitas bisa meningkatkan risiko terjadinya aterosklerosis, khususnya jika berat badan gemuk melewati batas normal atau mengandung karbondioksida (BBGM).\n6. Kebiasaan merokok: Ibu hamil yang merokok bisa meningkatkan risiko keguguran, pengeluaran prematur, dan kematian janin. Hal ini juga dikaitkan dengan risiko terjadinya aterosklerosis lebih lanjut dalam kehidupan.\n7. Stres Berkepanjangan: Keadaan stres berkepanjangan bisa meningkatkan tekanan darah dan menggembirakan jumlah kolesterol di darah, yang dapat mempercepat terjadinya aterosklerosis.\n8. Riwayat penyakit atau gangguan fungsi jaringan tubuh lainnya: Kebanyakan orang yang menderita aterosklerosis punya riwayat sebelumnya dengan penyakit jantung, stroke, diabetes, atau gangguan kolesterol.\n9. Pola makan dan aktivitas fisik tidak sehat: Konsumsi makanan berlemak tinggi dan kurangnya aktivitas fisik juga bisa meningkatkan risiko terjadinya aterosklerosis, khususnya bagi mereka yang memiliki faktor-faktor genetik atau lingkungan tertentu.\n10. Obat-obatan: Beberapa obat seperti steroid dan anabolik bisa meningkatkan risiko terjadinya aterosklerosis, karena efek toksisitasnya pada endotel arteri.",0.64,0.5691009839830016,0.99999999995,1.0
Bagaimana pencegahan penyakit aterosklerosis?,"Aterosklerosis dapat dicegah dengan menerapkan pola hidup sehat. Cara yang bisa dilakukan antara lain:\n\nMelakukan pola makan sehat dengan gizi seimbang yang kaya serat dan karbohidrat kompleks, serta rendah kolesterol\nMenghindari atau membatasi konsumsi minuman beralkohol\nBerolahraga selama 30 menit per hari, setidaknya 5 hari dalam seminggu\nBerhenti merokok\nMenjaga berat badan dalam rentang ideal\nMengelola stress dengan baik, misalnya dengan relaksasi (mengendurkan otot-otot yang tegang) atau meditasi\nBeristirahat dan tidur yang cukup","['Topik: Aterosklerosis, Subtopik: Pencegahan Aterosklerosis \n Aterosklerosis dapat dicegah dengan menerapkan pola hidup sehat. Cara yang bisa dilakukan antara lain:\n- Melakukan pola makan sehat dengan gizi seimbang yang kaya serat dan karbohidrat kompleks, serta rendah kolesterol\n- Menghindari atau membatasi konsumsi minuman beralkohol\n- Berolahraga selama 30 menit per hari, setidaknya 5 hari dalam seminggu\n- Berhenti merokok\n- Menjaga berat badan dalam rentang ideal\n\n- Mengelola stress dengan baik, misalnya dengan relaksasi (mengendurkan otot-otot yang tegang) atau meditasi\n- Beristirahat dan tidur yang cukup\n', 'Topik: Aterosklerosis, Subtopik: Pengobatan Aterosklerosis \n Penangan aterosklerosis dapat dilakukan dengan tiga metode, yaitu perubahan gaya hidup, obat-obatan, serta prosedur medis.\nPerubahan gaya hidup sehari-hari merupakan hal utama yang perlu dilakukan. Pasien dianjurkan untuk lebih sering berolahraga guna meningkatkan kesehatan jantung dan pembuluh darah, serta mengurangi konsumsi makanan yang banyak mengandung kolesterol.\nSelain menyarankan perubahan gaya hidup, dokter juga dapat memberi obat-obatan untuk mencegah arterosklerosis bertambah buruk. Obat-obatan ini dapat berupa:\n- Obat untuk mencegah penggumpalan darah, seperti aspirin\n\n- Obat untuk menurunkan tekanan darah, seperti penghambat beta (beta blockers), antagonis kalsium (calcium channel blockers), serta diuretik\n- Obat penurun kadar kolesterol, seperti statin dan fibrat\n- Obat untuk mencegah penyempitan arteri, seperti ACE inhibitor\n\n- Obat untuk mengendalikan penyakit yang bisa menyebabkan aterosklerosis, seperti obat diabetes untuk menjaga kadar gula darah.\nPada kasus aterosklerosis yang parah, dokter mungkin akan menyarankan penanganan dengan:\n- Pemasangan ring (stent) dan angioplasty\nProsedur ini digunakan untuk membuka penyumbatan atau penyempitan arteri, kemudian memasang tabung kecil di sana agar aliran darah kembali lancar.\n- Terapi fibrinolitik\nTerapi ini dilakukan untuk mengatasi penyumbatan arteri akibat pembekuan darah, dengan memberikan obat pelarut atau pemecah gumpalan darah (fibrinolitik).\n- Operasi bypass\nProsedur ini dilakukan dengan cara memintas pembuluh darah yang tersumbat menggunakan pembuluh darah dari bagian tubuh lain atau selang berbahan sintetis.\n- Endarterektomi\nProsedur ini dilakukan untuk membuang tumpukan lemak pada dinding arteri yang menyempit. Biasanya, prosedur ini dilakukan pada arteri di leher.\n- Arterektomi\nProsedur ini dilakukan untuk membuang plak di arteri dengan menggunakan kateter berpisau tajam di salah satu ujungnya.\n', 'Topik: Aterosklerosis, Subtopik: Gejala dan Komplikasi Aterosklerosis \n terosklerosis awalnya tidak menimbulkan gejala, sampai pembuluh darah arteri sudah sangat menyempit bahkan tertutup Akibatnya, pembuluh arteri tidak lagi dapat menyalurkan darah dalam jumlah cukup ke organ-organ tubuh.\nKarena gejalanya baru muncul setelah bertahun-tahun, banyak orang yang tidak menyadari bahwa dirinya menderita aterosklerosis sampai muncul komplikasi. Komplikasi yang muncul bisa beragam, tergantung lokasi terjadinya aterosklerosis, antara lain:\nAterosklerosis di jantung bisa menyebabkan penyakit jantung koroner dan serangan jantung. Kedua gangguan tersebut memiliki sejumlah gejala yang serupa, yaitu:\n- Nyeri dada seperti ditekan atau diremas (angina)\n- Nyeri atau tekanan pada pundak, lengan, rahang, atau punggung\n- Gangguan irama jantung (aritmia)\n- Sesak napas, berkeringat, dan gelisah\nAterosklerosis di kaki atau lengan bisa menyebabkan penyakit arteri perifer. Gangguan ini ditandai dengan gejala berikut:\n- Nyeri, kram, hingga mati rasa di area lengan atau tungkai\n- Nyeri saat berjalan dan mereda setelah beristirahat (klaudikasio intermiten)\n- Tungkai bagian bawah terasa dingin\n- Luka di jempol, telapak, atau kaki yang tidak kunjung sembuh\nBila terjadi pada pembuluh darah di otak, aterosklerosis bisa menyebabkan stroke, yang ditandai dengan gejala berupa:\n- Mati rasa hingga lumpuh pada salah satu sisi wajah, lengan, atau tungkai\n- Kebingungan dan sulit untuk dapat berbicara dengan jelas\n- Kehilangan penglihatan pada salah satu mata atau kedua mata\n- Kehilangan koordinasi dan keseimbangan\n- Pusing dan sakit kepala berat\n- Sulit bernapas dan kehilangan kesadaran\n\nPenumpukan plak pada pembuluh arteri di ginjal dapat menyebabkan gagal ginjal. Gangguan ini bisa dikenali dari sejumlah gejala, seperti:\n- Jarang buang air kecil\n- Mual yang terasa terus menerus\n- Tubuh terasa sangat lelah dan sering mengantuk\n- Tungkai membengkak\n- Bingung dan sulit berkonsentrasi\n- Sesak napas dan dada terasa nyeri\nSegera periksakan diri ke dokter jika mengalami gejala yang telah disebutkan di atas. Anda juga perlu segera ke IGD bila mengalami gejala serangan jantung atau stroke. Kedua kondisi tersebut harus segera ditangani, karena bisa berakibat fatal bila menunggu lama.\nJika Anda menderita diabetes atau hipertensi, lakukan kontrol rutin ke dokter untuk memantau kondisi penyakitnya dan mencegah kemungkinan komplikasi aterosklerosis.\nBila Anda perokok, berusahalah untuk menghentikan kebiasaan tersebut. Merokok tidak hanya bisa menyebabkan aterosklerosis, tetapi juga penyakit lain. Jika berhenti merokok dirasa sangat sulit, pergilah ke dokter untuk mengikuti program berhenti merokok.\n']","Pencegahan atau preventif arterosklerosis bisa dimulai sejak usia remaja dan berlanjut hingga dewasa. Berikut cara-cara pencegahannya, yaitu:\n\n1. Melakukan pola makan sehat dengan gizi yang seimbang dan kaya serat, termasuk karbohidrat kompleks dan rendah kolesterol. Ini bisa membantu mengurangi tingkat asid lambung dan menjaga berat badan ideal.\n2. Menghindari atau membatasi penggunaan minuman beralkohol, terutama jenis alkohol berdosis tinggi.\n3. Berolahraga secara konsisten, seperti berjalan, berlari, atau berenang untuk mengurangi risiko penyakit jantung dan stroke. Setidaknya 150 menit per minggu dapat memberikan efek positif terhadap kesehatan tubuh.\n4. Menjaga tekanan darah dan kadar gula darah dalam batas normal, sehingga bisa mengurangi risiko penyakit jantung, stroke, serta gangguan lain yang disebabkan oleh aterosklerosis.\n5. Mengelola stres dengan cara-cara yang sesuai, seperti melakukan olahraga atau beristirahat dan berevolusi.\n6. Berhenti merokok secara permanen karena minyak tanah dalam rokok bisa menempel pada pembuluh darah, menyebabkan penyempitan arteri.\n7. Menjaga berat badan ideal dan tidak mengalami lipidemi atau gangguan metabolik lain yang dapat mempercepat timbulnya aterosklerosis.\n8. Mengontrol risiko penyakit jantung lainnya, seperti menghindari asupan lemak dalam makanan dan mengendalikan diabetes atau hipertensi.\n9. Segera pergi ke dokter bila mengalami gejala serangan jantung atau stroke, karena hal tersebut memerlukan pengobatan yang cepat dan efektif untuk mencegah akibat fatalnya penyakit tersebut.\n10. Mengikuti program kesehatan rutin di Rumah Sakit Gigi agar bisa mendeteksi lebih awal gangguan gigi atau rematoid yang dapat memicu proses aterosklerosis.",0.47058823529411764,0.6435526625279047,0.9999999999666667,1.0
Apa saja hal yang dapat meningkatkan risiko penyakit Arteriosklerosis?,"Selain itu, ada beberapa kondisi yang dapat meningkatkan risiko terjadinya kerusakan pembuluh darah arteri, yaitu:\n\nKolesterol tinggi\nTrigliserida tinggi\nTekanan darah tinggi\nBerat badan berlebih\nDiabetes\nPeradangan akibat arthritis, lupus, atau infeksi\nKebiasaan merokok\nKurang olahraga\nPola makan yang tidak sehat\nRiwayat penyakit jantung di keluarga","['Topik: Arteriosklerosis, Subtopik: Penyebab Arteriosklerosis \n Arteriosklerosis terjadi ketika dinding bagian dalam pembuluh darah arteri mengalami kerusakan. Akibatnya, sel darah dan plak yang terbentuk dari kolesterol, lemak, atau kalsium menumpuk di dinding arteri dan menyumbat pembuluh darah.\nPenyumbatan pembuluh darah membuat aliran darah ke organ-organ tubuh menjadi tidak lancar. Hal ini mengakibatkan organ tersebut tidak berfungsi dengan baik.\nBelum diketahui secara pasti penyebab kerusakan pada pembuluh darah arteri. Akan tetapi, kondisi ini diyakini bisa terjadi sejak usia muda dan dapat berkembang seiring pertambahan usia.\nSelain itu, ada beberapa kondisi yang dapat meningkatkan risiko terjadinya kerusakan pembuluh darah arteri, yaitu:\n- Kolesterol tinggi\n- Trigliserida tinggi\n- Tekanan darah tinggi\n- Berat badan berlebih\n- Diabetes\n- Peradangan akibat arthritis, lupus, atau infeksi\n- Kebiasaan merokok\n- Kurang olahraga\n- Pola makan yang tidak sehat\n- Riwayat penyakit jantung di keluarga\n', 'Topik: Arteriosklerosis, Subtopik: Pengertian Arteriosklerosis \n Arteriosklerosis adalah pengerasan pembuluh darah arteri akibat penumpukan plak di dinding arteri. Arteri yang mengeras dapat membuat aliran darah ke organ tubuh menjadi tidak lancar sehingga mengganggu fungsi organ tersebut. Kondisi ini dapat terjadi akibat berbagai hal, seperti penumpukan lemak atau penuaan.\nArteri adalah pembuluh darah yang berfungsi mengalirkan darah kaya oksigen dari jantung ke seluruh tubuh. Seiring berjalannya waktu, arteri dapat mengeras sehingga kehilangan elastisitasnya.\n\nArteriosklerosis dapat terjadi di arteri yang mengalirkan darah ke jantung, otak, kaki, dan ginjal. Bila berlangsung dalam waktu lama, aliran darah ke organ-organ tersebut akan terganggu, bahkan tersumbat. Akibatnya, penderita arteriosklerosis berisiko terserang penyakit serius, seperti stroke dan penyakit jantung koroner.\nMeski sering kali dianggap sama, arteriosklerosis berbeda dengan aterosklerosis. Arteriosklerosis mencakup semua kondisi pengerasan arteri. Sedangkan aterosklerosis merupakan pengerasan arteri yang secara spesifik terjadi akibat penumpukan lemak di dinding arteri. Dengan kata lain, aterosklerosis termasuk ke dalam jenis arteriosklerosis.\n', 'Topik: Arteriosklerosis, Subtopik: Pencegahan Arteriosklerosis \n Arteriosklerosis bisa dicegah dengan meminimalkan faktor risiko yang telah disebutkan di atas. Caranya adalah dengan menjalani pola hidup sehat, seperti:\n- Tidak merokok\n- Berolahraga secara rutin\n- Mengonsumsi makanan sehat dan bergizi seimbang, serta memperbanyak asupan sayur-sayuran dan buah-buahan\n- Mempertahankan berat badan ideal\n\n- Beristirahat dan tidur yang cukup\n- Mengelola stres dengan baik\nSelain itu, penderita penyakit diabetes, lupus, dan arthritis dianjurkan untuk melakukan kontrol ke dokter secara rutin, guna memantau kondisi kesehatan dan efektivitas pengobatan yang telah dilakukan.\n']","Hal-hal yang dapat meningkatkan risiko terjadinya arteriosklerosis, sesuai dengan konteks yang diberikan, termasuk:\n\n1. Kolesterol tinggi: Peningkatan kadar LDL (low-density lipoprotein) atau lebih dikenal sebagai ""pokeroykot"" dalam darah meningkatkan risiko terjadinya arteriosklerosis.\n2. Trigliserida tinggi: Kadar trigliserida yang tinggi juga dapat memperparah penyakit arteriosklerosis karena menyebabkan pengumpulan lemak di dalam sel darah.\n3. Tekanan Darah Tinggi: Arteri yang sering mendapat tekanan tinggi akibat hipertensi juga cenderung mengalami penyempitan atau mengerut, menyebabkan arus darah menjadi tidak lancar.\n4. Berat Badan Berlebih: Keadaan gizi berlebih dan obesitas dapat meningkatkan risiko terjadinya arteriosklerosis karena mengurangi aliran darah ke organ-organ tubuh.\n5. Diabetes: Penyakit diabetes memiliki hubungan erat dengan peningkatan risiko terjadinya arteriosklerosis, sebab menyebabkan kerusakan sel-sel di dalam pembuluh darah dan mengganggu fungsi hati karena penyumbatan arteri.\n6. Peradangan akibat arthritis, lupus, atau infeksi: Gejala ini dapat menimbulkan peradangan pada pembuluh darah, menyebabkan penyumbatan dan mengganggu aliran darah ke organ-organ tubuh.\n7. Kebiasaan Merokok: Kebiasaan merokok juga memiliki hubungan erat dengan risiko terjadinya arteriosklerosis karena merokok dapat menurunkan kapasitas pembuluh darah untuk mengalirkan oksigen ke jaringan tubuh.\n8. Kurang Olahraga: Tidak sering berolahraga atau kurangnya aktivitas fisik akan memperparah risiko terjadinya arteriosklerosis karena menurunkan kapasitas pembuluh darah untuk mengalirkan oksigen dan nutrisi ke jaringan tubuh.\n9. Pola Makan yang Tidak Sehat: Penyerakan makanan jahat atau makanan berkomposisi tinggi dalam kadar lemak, garam, dan gula dapat meningkatkan risiko terjadinya arteriosklerosis.\n10. Riwayat Penyakit Jantung di Keluarga: Adanya riwayat penyakit jantung atau serius pada keluarga juga memiliki hubungan erat dengan risiko terjadinya arteriosklerosis, sebab meningkatkan resiko munculnya masalah dalam sistem peredaran darah.",0.5454545454545454,0.6840285983805686,0.9999999999666667,1.0
Apa saja gejala penyakit arteriosklerosis?,"Sebagian besar kasus arteriosklerosis tidak menimbulkan gejala sampai terjadi penyumbatan di pembuluh darah arteri. Gejala yang muncul tergantung pada lokasi pembuluh arteri yang tersumbat.\n\nBerdasarkan lokasi pembuluh darah arteri yang mengalami penyumbatan, gejala-gejala yang dapat muncul adalah:\n\nPenyumbatan di arteri yang menuju otak, yang dapat menimbulkan gejala berupa mati rasa di tungkai dan lengan, sulit berbicara, gangguan penglihatan, dan wajah terkulai\nPenyumbatan di arteri yang menuju jantung, yang bisa menimbulkan keluhan berupa nyeri dada, sesak napas, dan gangguan irama jantung\nPenyumbatan di arteri yang menuju tungkai, yang dapat menimbulkan gejala berupa nyeri di kaki ketika berjalan dan penurunan tekanan darah di lengan yang terkena\nPenyumbatan di arteri yang menuju ginjal, yang dapat menimbulkan keluhan berupa tekanan darah tinggi hingga gagal ginjal","['Topik: Arteriosklerosis, Subtopik: Gejala Arteriosklerosis \n Sebagian besar kasus arteriosklerosis tidak menimbulkan gejala sampai terjadi penyumbatan di pembuluh darah arteri. Gejala yang muncul tergantung pada lokasi pembuluh arteri yang tersumbat.\nBerdasarkan lokasi pembuluh darah arteri yang mengalami penyumbatan, gejala-gejala yang dapat muncul adalah:\n- Penyumbatan di arteri yang menuju otak, yang dapat menimbulkan gejala berupa mati rasa di tungkai dan lengan, sulit berbicara, gangguan penglihatan, dan wajah terkulai\n- Penyumbatan di arteri yang menuju jantung, yang bisa menimbulkan keluhan berupa nyeri dada, sesak napas, dan gangguan irama jantung\n- Penyumbatan di arteri yang menuju tungkai, yang dapat menimbulkan gejala berupa nyeri di kaki ketika berjalan dan penurunan tekanan darah di lengan yang terkena\n- Penyumbatan di arteri yang menuju ginjal, yang dapat menimbulkan keluhan berupa tekanan darah tinggi hingga gagal ginjal\n\n', 'Topik: Arteriosklerosis, Subtopik: Gejala Arteriosklerosis: Kapan harus ke dokter \n Segera ke dokter bila mengalami gejala arteriosklerosis seperti yang disebutkan di atas, terutama nyeri dada dan mati rasa atau nyeri di kaki. Pemeriksaan dan pengobatan yang dilakukan lebih awal dapat mencegah arteriosklerosis memburuk dan berkembang menjadi penyakit jantung dan stroke.\n', 'Topik: Arteriosklerosis, Subtopik: Diagnosis Arteriosklerosis \n Dokter akan menanyakan gejala yang dialami pasien, serta riwayat kesehatan pasien dan keluarga. Setelah itu, dokter akan melakukan pemeriksaan fisik menyeluruh, termasuk mengukur perbedaan tekanan darah di lengan dan kaki (ankle-brachial index), serta memeriksa denyut nadi di dekat arteri yang menyempit.\nSelanjutnya, dokter akan melakukan pemeriksaan penunjang yang jenisnya tergantung pada hasil pemeriksaan fisik. Pemeriksaan penunjang tersebut antara lain:\n- Tes darah, untuk mengukur kadar kolesterol dan gula darah\n- USG Doppler, untuk mengukur tekanan darah di kaki atau lengan\n- Tes stres, untuk mengukur seberapa baik kerja jantung saat beraktivitas fisik\n- Elektrokardiografi (EKG), untuk mengukur aktivitas listrik jantung\n- Katerisasi jantung, untuk melihat apakah terjadi penyumbatan di pembuluh darah jantung\n- Pemindaian dengan CT scan atau MRA (magnetic resonance angiography), untuk melihat penyempitan dan pengerasan di dinding arteri\n']","Gejala-gejala penyakat arteriosklerosis mencakup perubahan pada arsitektur pembuluh darah, nyeri dada (angina), sesak napas, gangguan irama jantung, keluhan mata seperti gangguan visiolokomotorik dan kehilangan daya tahan. Gejala lain yang mungkin terjadi termasuk penurunan tekanan darah (hipotensi), bising di telinga, gatalan pada kaki atau tangan akibat gangguan sensory-motor, serta halangan pada aktivitas rutin seperti mengeksplorasi luka.\n\nGejala ini biasanya terjadi ketika arsitektur pembuluh darah yang tersumbat atau dimungkinkan penyumbatan semakin membatasi aliran darah ke organ-organ penting, menyebabkan gangguan fungsi jaringan di sepanjang lintasan pembuluh darah. Gejala ini bervariasi dan bergantung pada lokasi yang tersumbat serta kapan gejalanya timbul atau meningkat.\n\nPenderita harus segera mengajukan gejala-gejala tersebut ke dokter untuk mencegah kematian akibat penyebab medis lainnya seperti serangan jantung dan stroke, yang bisa fatal atau menyebabkan fungsi tubuh menurun secara permanen.",0.3333333333333333,0.6612322527489631,0.9999999999666667,1.0
Apa gejala umum penyakit jantung bawaan pada bayi?,"Sedangkan pada bayi, gejala penyakit jantung bawaan yang umum terjadi adalah:\n\nWarna kebiruan atau kehitaman di bibir, kulit, atau jari-jari kuku (sianosis)\nKelelahan dan kesulitan bernapas, terutama ketika disusui\nBerat badan rendah\nPertumbuhan terhambat\nPembengkakan di tungkai, perut, atau area sekitar mata\nInfeksi paru-paru yang berulang\nSering mengeluarkan keringat dingin","['Topik: Penyakit Jantung Bawaan, Subtopik: Gejala Penyakit Jantung Bawaan \n Penyakit jantung bawaan bisa terdeteksi saat USG kehamilan rutin atau sesaat setelah bayi dilahirkan. Salah satu gejala penyakit jantung bawaan pada janin adalah bunyi detak jantung yang tidak beraturan (aritmia).\nSedangkan pada bayi, gejala penyakit jantung bawaan yang umum terjadi adalah:\n- Warna kebiruan atau kehitaman di bibir, kulit, atau jari-jari kuku (sianosis)\n- Kelelahan dan kesulitan bernapas, terutama ketika disusui\n- Berat badan rendah\n- Pertumbuhan terhambat\n- Pembengkakan di tungkai, perut, atau area sekitar mata\n- Infeksi paru-paru yang berulang\n- Sering mengeluarkan keringat dingin\n\nPada kasus tertentu, gejala penyakit jantung bawaan baru muncul beberapa tahun setelah bayi dilahirkan, bisa ketika masa kanak-kanak atau remaja. Gejalanya bisa berupa:\n- Detak jantung tidak beraturan (aritmia)\n- Pusing dan mudah lelah, terutama saat berolahraga\n- Sulit bernapas atau napas terengah-engah\n- Pembengkakan (edema) di kaki, pergelangan kaki, atau tangan\n- Kulit berwarna kebiruan (sianosis)\n- Mudah pingsan\nPada beberapa kasus, penyakit jantung bawaan tidak menyebabkan nyeri dada atau keluhan lain, bahkan dapat terjadi tanpa gejala tertentu.\nSegera periksakan diri ke dokter jika Anda atau anak Anda mengalami gejala-gejala penyakit jantung bawaan seperti yang telah disebutkan sebelumnya. Penanganan sejak dini perlu segera dilakukan untuk mencegah kondisi yang lebih serius.\nJika pernah divonis mengalami penyakit jantung bawaan, lakukan kontrol secara berkala ke dokter untuk memantau perkembangan penyakit.\nRisiko bayi menderita penyakit jantung bawaan akan lebih tinggi pada ibu hamil yang menderita diabetes atau memiliki riwayat penyakit genetik dalam keluarga. Jika Anda sedang atau pernah menderita kondisi tersebut, konsultasikan dengan dokter terkait kemungkinan menurunkan penyakit jantung bawaan kepada bayi Anda.\nSegera ke IGD rumah sakit terdekat bila Anda atau anak Anda sulit bernapas, kulit dan bibir tampak kebiruan, atau mengalami pembengkakan di tungkai atau bagian tubuh lainnya.\n', 'Topik: Penyakit Jantung Bawaan, Subtopik: Jenis Penyakit Jantung Bawaan \n Penyakit jantung bawaan dapat dibagi berdasarkan bagian organ jantung yang mengalami gangguan. Berikut adalah penjelasannya:\nPenyakit jantung bawaan jenis ini terjadi akibat katup jantung yang melemah atau tertutup sejak bayi dilahirkan. Beberapa jenis penyakit jantung bawaan dengan kelainan di katup jantung adalah:\n- Tricuspid atresia, terjadi ketika katup di antara serambi kanan dan bilik kanan tidak terbentuk dengan sempurna\n- Pulmonary atresia, terjadi ketika ada gangguan di katup antara bilik kanan dan paru-paru sehingga darah tidak dapat mengalir ke paru-paru\n- Stenosis katup aorta, terjadi ketika katup antara bilik kiri dan aorta tidak terbentuk sempurna dan menyempit sehingga jantung sulit memompa darah\nKelainan di dinding pembatas atrium dan ventrikel bisa mengganggu fungsi jantung dalam memompa darah dan darah berkumpul di bagian yang tidak seharusnya.\nPenyakit jantung bawaan jenis ini, di antaranya:\n- Defek septum ventrikel dan defek septum atrium, yang terjadi ketika ada celah atau lubang di antara kedua bilik atau atrium jantung\n- Tetralogy of Fallot, yang terjadi ketika ada kombinasi empat penyakit jantung bawaan saat lahir, seperti defek septum dan penyempitan (stenosis) katup pembuluh darah dari jantung ke paru-paru (arteri pulmonalis)\nPenyakit jantung bawaan ini terjadi di arteri dan vena dari dan ke jantung. Kondisi ini menyebabkan aliran darah dari dan menuju jantung terhambat.\nBeberapa penyakit jantung bawaan jenis ini adalah:\n- Patent ductus arteriosus (PDA), yang terjadi ketika ada celah atau lubang di pembuluh darah aorta yang membawa darah dari jantung ke seluruh tubuh\n- Transposisi arteri besar (TAB), yang terjadi ketika posisi arteri pulmonalis dan aorta terbalik\n- Truncus arteriosus, yang terjadi ketika proses pemisahan aorta dan arteri paru-paru tidak terjadi secara sempurna\n- Koarktasio aorta, yang terjadi ketika aorta menyempit\nSelain tiga jenis di atas, penyakit jantung bawaan juga dapat dibagi menjadi dua kategori, yaitu sianotik dan asianotik. Sianotik menyebabkan rendahnya kadar oksigen dalam darah, yang ditandai dengan semburat biru di kulit dan kesulitan bernapas. Sementara asianotik umumnya tidak menimbulkan gejala tersebut.\n', 'Topik: Penyakit Jantung Bawaan, Subtopik: Diagnosis Penyakit Jantung Bawaan \n Penyakit jantung bawaan umumnya bisa terdeteksi lebih awal saat pemeriksaan USG kehamilan. Jika gejala penyakit ini muncul pada remaja atau orang dewasa, dokter akan melakukan tanya jawab seputar gejala, riwayat penyakit pasien dan keluarga, dilanjutkan dengan pemeriksaan fisik.\nBila pasien diduga mengalami penyakit jantung bawaan, dokter akan melakukan beberapa pemeriksaan lanjutan meliputi:\n- Echo jantung, untuk melihat kemampuan aliran darah yang melalui jantung dan katup jantung\n- Elektrokardiogram, untuk mendeteksi kelainan pada aktivitas listrik jantung\n- Kateterisasi jantung, untuk mengetahui kondisi aliran dan tekanan darah di jantung\n- Foto Rontgen, CT scan, atau MRI, untuk melihat gambaran jantung dan pembuluh darah jantung\n- Pulse oximetry, untuk mengukur kadar oksigen dalam darah\n- Stress test, untuk menilai kerja jantung ketika pasien sedang beraktivitas atau berolahraga\n- Tes DNA, untuk mendeteksi gen atau sindrom genetik tertentu yang bisa menyebabkan kelainan jantung bawaan\n']","Gejala umum penyakit jantung bawaan pada bayi meliputi warna kebiruan atau kehitaman di bibir, kulit, atau jari-jari kuku (sianosis), kelelahan dan kesulitan bernapas, berat badan rendah, pertumbuhan terhambat, pembengkakan di tungkai, perut, atau area sekitar mata, serta infeksi paru-paru yang berulang. Selain itu, bayi juga mungkin mengeluarkan keringat dingin dan bisa memiliki detak jantung tidak beraturan (aritmia). Pada remaja atau orang dewasa, gejala umum yang sering terjadi adalah pusing, mudah lelah, sulit bernapris, kulit berwarna kebiruan, dan gawat darah.",0.9473684210526315,0.5640324439399917,0.99999999995,1.0
Apa saja kondisi yang dapat meningkatkan faktor risiko penyakit jantung bawaan pada bayi?,"Sejumlah kondisi pada ibu hamil bisa meningkatkan risiko terjadinya penyakit jantung bawaan pada bayi, yaitu:\n\nMemiliki keluarga dengan riwayat penyakit jantung bawaan atau kelainan genetik, seperti sindrom Down atau sindrom Edward\nMenderita diabetes tipe 1 atau 2 yang tidak terkontrol\nMenderita penyakit autoimun, seperti sindrom Sjögren\nMengonsumsi alkohol secara berlebihan atau merokok saat hamil\nMenderita infeksi virus, seperti rubella, pada trimester pertama kehamilan\nMengonsumsi obat-obatan tertentu selama hamil, seperti obat antikejang, obat antijerawat golongan retinoid, dan obat golongan statin, tanpa resep dokter\nTerpapar pelarut organik yang umumnya ditemukan dalam produk cat tembok, cat kuku, atau lem\nMenderita penyakit tertentu yang dapat diturunkan dari orang tua ke anaknya, misalnya fenilketonuria","['Topik: Penyakit Jantung Bawaan, Subtopik: Gejala Penyakit Jantung Bawaan \n Penyakit jantung bawaan bisa terdeteksi saat USG kehamilan rutin atau sesaat setelah bayi dilahirkan. Salah satu gejala penyakit jantung bawaan pada janin adalah bunyi detak jantung yang tidak beraturan (aritmia).\nSedangkan pada bayi, gejala penyakit jantung bawaan yang umum terjadi adalah:\n- Warna kebiruan atau kehitaman di bibir, kulit, atau jari-jari kuku (sianosis)\n- Kelelahan dan kesulitan bernapas, terutama ketika disusui\n- Berat badan rendah\n- Pertumbuhan terhambat\n- Pembengkakan di tungkai, perut, atau area sekitar mata\n- Infeksi paru-paru yang berulang\n- Sering mengeluarkan keringat dingin\n\nPada kasus tertentu, gejala penyakit jantung bawaan baru muncul beberapa tahun setelah bayi dilahirkan, bisa ketika masa kanak-kanak atau remaja. Gejalanya bisa berupa:\n- Detak jantung tidak beraturan (aritmia)\n- Pusing dan mudah lelah, terutama saat berolahraga\n- Sulit bernapas atau napas terengah-engah\n- Pembengkakan (edema) di kaki, pergelangan kaki, atau tangan\n- Kulit berwarna kebiruan (sianosis)\n- Mudah pingsan\nPada beberapa kasus, penyakit jantung bawaan tidak menyebabkan nyeri dada atau keluhan lain, bahkan dapat terjadi tanpa gejala tertentu.\nSegera periksakan diri ke dokter jika Anda atau anak Anda mengalami gejala-gejala penyakit jantung bawaan seperti yang telah disebutkan sebelumnya. Penanganan sejak dini perlu segera dilakukan untuk mencegah kondisi yang lebih serius.\nJika pernah divonis mengalami penyakit jantung bawaan, lakukan kontrol secara berkala ke dokter untuk memantau perkembangan penyakit.\nRisiko bayi menderita penyakit jantung bawaan akan lebih tinggi pada ibu hamil yang menderita diabetes atau memiliki riwayat penyakit genetik dalam keluarga. Jika Anda sedang atau pernah menderita kondisi tersebut, konsultasikan dengan dokter terkait kemungkinan menurunkan penyakit jantung bawaan kepada bayi Anda.\nSegera ke IGD rumah sakit terdekat bila Anda atau anak Anda sulit bernapas, kulit dan bibir tampak kebiruan, atau mengalami pembengkakan di tungkai atau bagian tubuh lainnya.\n', 'Topik: Penyakit Jantung Bawaan, Subtopik: Jenis Penyakit Jantung Bawaan \n Penyakit jantung bawaan dapat dibagi berdasarkan bagian organ jantung yang mengalami gangguan. Berikut adalah penjelasannya:\nPenyakit jantung bawaan jenis ini terjadi akibat katup jantung yang melemah atau tertutup sejak bayi dilahirkan. Beberapa jenis penyakit jantung bawaan dengan kelainan di katup jantung adalah:\n- Tricuspid atresia, terjadi ketika katup di antara serambi kanan dan bilik kanan tidak terbentuk dengan sempurna\n- Pulmonary atresia, terjadi ketika ada gangguan di katup antara bilik kanan dan paru-paru sehingga darah tidak dapat mengalir ke paru-paru\n- Stenosis katup aorta, terjadi ketika katup antara bilik kiri dan aorta tidak terbentuk sempurna dan menyempit sehingga jantung sulit memompa darah\nKelainan di dinding pembatas atrium dan ventrikel bisa mengganggu fungsi jantung dalam memompa darah dan darah berkumpul di bagian yang tidak seharusnya.\nPenyakit jantung bawaan jenis ini, di antaranya:\n- Defek septum ventrikel dan defek septum atrium, yang terjadi ketika ada celah atau lubang di antara kedua bilik atau atrium jantung\n- Tetralogy of Fallot, yang terjadi ketika ada kombinasi empat penyakit jantung bawaan saat lahir, seperti defek septum dan penyempitan (stenosis) katup pembuluh darah dari jantung ke paru-paru (arteri pulmonalis)\nPenyakit jantung bawaan ini terjadi di arteri dan vena dari dan ke jantung. Kondisi ini menyebabkan aliran darah dari dan menuju jantung terhambat.\nBeberapa penyakit jantung bawaan jenis ini adalah:\n- Patent ductus arteriosus (PDA), yang terjadi ketika ada celah atau lubang di pembuluh darah aorta yang membawa darah dari jantung ke seluruh tubuh\n- Transposisi arteri besar (TAB), yang terjadi ketika posisi arteri pulmonalis dan aorta terbalik\n- Truncus arteriosus, yang terjadi ketika proses pemisahan aorta dan arteri paru-paru tidak terjadi secara sempurna\n- Koarktasio aorta, yang terjadi ketika aorta menyempit\nSelain tiga jenis di atas, penyakit jantung bawaan juga dapat dibagi menjadi dua kategori, yaitu sianotik dan asianotik. Sianotik menyebabkan rendahnya kadar oksigen dalam darah, yang ditandai dengan semburat biru di kulit dan kesulitan bernapas. Sementara asianotik umumnya tidak menimbulkan gejala tersebut.\n', 'Topik: Penyakit Jantung Bawaan, Subtopik: Pengertian Penyakit Jantung Bawaan \n Penyakit jantung bawaan (PJB) atau congenital heart disease adalah kelainan pada struktur dan fungsi jantung yang sudah ada sejak lahir. Kondisi ini dapat mengganggu aliran darah dari dan menuju jantung sehingga bisa mengancam jiwa.\nPenyakit jantung bawaan merupakan penyebab cacat lahir yang paling sering terjadi dengan jenis dan tingkat keparahan yang beragam. Sebagian penderita penyakit jantung bawaan hanya memerlukan pemeriksaan secara rutin, tetapi ada pula yang perlu menjalani operasi hingga transplantasi jantung.\n\n']","Kondisi yang dapat meningkatkan faktor risiko penyakit jantung bawaan (PJB) pada bayi termasuk:\n\n1. Ibu hamil yang mengalami diabetes, khususnya diabetes gula darah tinggi (diabetes mellitus), karena hal ini dapat menyebabkan pertumbuhan dan perkembangan janin tidak normal dalam diri.\n2. Riwayat penyakit genetik atau gangguan genetik dikeluarga, seperti polidaktilia atau Down syndrom, karena risiko PJB meningkat pada bayi dengan riwayat ini.\n3. Ibu hamil yang mengalami infeksi sosial selama kehamilan, terutama penyakit saluran pernafasan seperti difteri atau bronkitis maternus, yang juga bisa meningkatkan risiko PJB pada janin.\n4. Pemakaian obat-obatan selama masa kehamilan, terutama asetilklamida dan fenobarbital, yang dapat berpengaruh pada pertumbuhan jantung janin.",0.2222222222222222,0.8626831237761049,0.9999999999,1.0
Apa saja komplikasi yang diakibatkan oleh penyakit jantung bawaan?,"Penyakit jantung bawaan dapat menyebabkan sejumlah komplikasi, seperti:\n\nEndokarditis\nGangguan irama jantung atau aritmia\nGagal jantung\nHipertensi pulmonal\nInfeksi saluran pernapasan, seperti pneumonia\nPenggumpalan darah dan stroke\nGangguan pertumbuhan (stunting)\nGangguan belajar","['Topik: Penyakit Jantung Bawaan, Subtopik: Komplikasi Penyakit Jantung Bawaan \n Penyakit jantung bawaan dapat menyebabkan sejumlah komplikasi, seperti:\n- Endokarditis\n- Gangguan irama jantung atau aritmia\n- Gagal jantung\n- Hipertensi pulmonal\n- Infeksi saluran pernapasan, seperti pneumonia\n- Penggumpalan darah dan stroke\n\n- Gangguan pertumbuhan (stunting)\n- Gangguan belajar\n', 'Topik: Penyakit Jantung Bawaan, Subtopik: Pengobatan Penyakit Jantung Bawaan: Implan alat pacu jantung dan kejut jantung (ICD) \n Pemasangan alat pacu jantung dan ICD (implantable cardioverter-defibrillator) dapat dilakukan untuk membantu jantung berdetak lebih teratur. Metode ini bisa mencegah komplikasi akibat kelainan jantung bawaan.\nKateterisasi dilakukan untuk memperbaiki kelainan jantung tanpa perlu melakukan operasi. Pada prosedur ini, selang tipis dan lentur (kateter) akan dimasukkan melalui pembuluh darah di tungkai pasien menuju jantung dengan bantuan pemindaian gambar, yaitu foto Rontgen dan CT scan.\nSetelah kateter berada di posisi yang tepat, sebuah alat kecil akan dimasukkan melalui kateter untuk mengatasi kelainan atau cacat jantung. Kateterisasi jantung bisa dilakukan dengan prosedur angioplasti dan perbaikan katup jantung (valvuloplasti).\nJenis-jenis penyakit jantung bawaan yang dapat ditangani dengan kateterisasi jantung adalah stenosis katup aorta, defek septum, dan transposisi arteri besar.\nOperasi jantung bisa dilakukan bila kateterisasi jantung tidak efektif mengatasi penyakit jantung bawaan. Operasi bertujuan untuk menambal atau menjahit lubang di jantung, memperbaiki atau mengganti katup jantung, dan melebarkan pembuluh darah.\nCABG (coronary artery bypass grafting) adalah salah satu contoh prosedur bedah jantung. Beberapa jenis penyakit jantung bawaan yang dapat ditangani dengan operasi jantung adalah koarktasio aorta dan Tetralogy of Fallot.\nJika kelainan jantung tidak bisa diperbaiki dengan obat-obatan atau metode pengobatan lain, transplantasi jantung dapat menjadi pilihan penanganan terakhir.\nTransplantasi jantung merupakan prosedur pengangkatan jantung yang sudah tidak bekerja secara optimal, untuk kemudian digantikan dengan jantung yang sehat dari pendonor.\nSetelah pasien penyakit jantung bawaan menjalani pengobatan, pemeriksaan rutin ke dokter tetap perlu dilakukan. Hal ini karena penyakit ini berpotensi terjadi kembali di kemudian hari. Selain itu, fungsi jantung juga dapat menurun seiring pertambahan usia.\nUntuk menjaga kondisi jantung agar tetap sehat, pasien disarankan untuk rutin berolahraga. Jenis olahraga yang disarankan adalah yang berintensitas ringan, seperti berjalan atau berenang.\n', 'Topik: Penyakit Jantung Bawaan, Subtopik: Pengobatan Penyakit Jantung Bawaan \n Penanganan penyakit jantung bawaan bertujuan untuk memperbaiki kelainan jantung atau mengatasi komplikasi yang mungkin terjadi akibat kondisi ini. Metode yang diberikan akan disesuaikan dengan jenis kelainan dan tingkat keparahannya.\nBeberapa kelainan atau cacat jantung ringan biasanya tidak membutuhkan penanganan khusus. Walau demikian, pasien perlu memeriksakan diri ke dokter secara rutin untuk memantau kondisinya.\nPada penyakit jantung bawaan yang tergolong sedang hingga berat, dokter dapat melakukan beberapa metode berikut:\n']","Komplikasi yang diakibatkan oleh penyakit jantung bawaan meliputi:\n\n1. Endokarditis: Penyakit pada endotel atau sel-sel lining membran di dalam jantung, yang dapat menyebabkan gangguan fungsi jantung dan bahaya infeksi lebih lanjut.\n2. Gangguan irama jantung atau aritmia: Masalah ritme nadi (jarum nadi) yang bisa meningkatkan risiko untuk komplikasi seperti stroke, penyakit hipertensi pulmonal, gagal jantung, dan infeksi saluran pernapasan.\n3. Gagal jantung: Situasi dimana jantung tidak dapat membersihkan darah bebas lemak dan zat buangan secara efektif, sehingga menyebabkan pasien merasa pusing atau tertekan di bagian dada.\n4. Hipertensi pulmonal: Tekanan tinggi dalam paru-paru yang disebabkan oleh cacat jantung bawaan, dan dapat menyebabkan cedera hati, anemia, dan bahaya infeksi lebih lanjut.\n5. Infeksi saluran pernapasan, seperti pneumonia: Penyakit paru yang disebabkan oleh infeksi, termasuk virus atau bakteri seperti flu dan batuk.\n6. Penggumpalan darah dan stroke: Gejala dimana zat bening dalam tubuh mengalami penyempitan (gejeler) yang dapat menyebabkan kerugian fungsi jantung atau stroke akibat penggumpalan darah.\n7. Gangguan pertumbuhan (stunting): Kondisi dimana anak menampakkan pertumbuhan lebih lambat dibandingkan rata-rata, yang disebabkan oleh gangguan jantung bawaan dan perlu diperhatikan secara mendetail.\n8. Gangguan belajar: Kemungkinan besar karena faktor medis atau penggunaan tenaga medis yang tinggi, sehingga memerlukan dukungan pendidikan tambahan untuk menghindari gangguan belajar lainnya.",0.23076923076923078,0.5992063908087563,0.99999999995,1.0
Apa saja faktor yang dapat meningkatkan risiko terkena penyakit koarktasio aorta?,"Beberapa faktor yang dapat meningkatkan risiko bayi menderita koarktasio aorta adalah:\n\nMemilliki penyakit jantung bawaan lain, seperti patent ductus arteriosus, arterial septal defect, defek septum ventrikel, atau penyakit katup jantung\nMenderita kelainan genetik, seperti sindrom Turner \nSelain itu, risiko bayi mengalami penyakit jantung bawaan juga meningkat jika ibu hamil merokok, mengonsumsi obat, seperti obat antikejang, menderita lupus, atau menderita diabetes yang tidak terkontrol.","['Topik: Koarktasio Aorta, Subtopik: Faktor risiko koarktasio aorta \n Beberapa faktor yang dapat meningkatkan risiko bayi menderita koarktasio aorta adalah:\n- Memilliki penyakit jantung bawaan lain, seperti patent ductus arteriosus, arterial septal defect, defek septum ventrikel, atau penyakit katup jantung\n\n- Menderita kelainan genetik, seperti sindrom Turner \n\nSelain itu, risiko bayi mengalami penyakit jantung bawaan juga meningkat jika ibu hamil merokok, mengonsumsi obat, seperti obat antikejang, menderita lupus, atau menderita diabetes yang tidak terkontrol.\n', 'Topik: Koarktasio Aorta, Subtopik: Penyebab Koarktasio Aorta \n Koartasio aorta adalah salah satu jenis penyakit jantung bawaan. Pada sebagian besar kasus, penyebab terjadinya koarktasio aorta belum dapat dipastikan. Kondisi ini diduga berkaitan dengan kombinasi faktor genetik dan lingkungan,  termasuk paparan bahan kimia atau obat-obatan selama kehamilan. Koarktasio aorta bisa terjadi bersamaan dengan penyakit jantung bawaan lainnya.\nKondisi ini paling sering ditemukan pada bayi. Namun, koarktasio aorta juga dapat terjadi pada usia dewasa. Koartasio aorta pada orang dewasa biasanya disebabkan arteritis Takayasu dan aterosklerosis.\nKoarktasio aorta sering terjadi pada cabang aorta yang akan mengalirkan darah ke kepala, leher, atau bagian atas tubuh, dan dekat ductus arteriosus (bagian pembuluh darah janin yang menghubungkan aorta dengan arteri pulmonal).\nPenyempitan aorta di bagian ini akan menyebabkan tekanan darah di lengan cenderung lebih tinggi dibandingkan tekanan darah di tungkai dan pergelangan kaki.\n', 'Topik: Koarktasio Aorta, Subtopik: Komplikasi Koarktasio Aorta \n Komplikasi yang dapat terjadi pada penderita koarktasio aorta adalah:\n- Hipertensi\n- Hipertrofi ventrikel kiri\n- Stroke \n- Aneurisma aorta\n- Diseksi atau robeknya aorta \n- Aneurisma otak\n- Gagal jantung \n- Penyakit jantung koroner pada usia muda\n\n- Penyakit ginjal\n- Endokartitis\n']","Berdasarkan konteks yang diberikan, beberapa faktor yang dapat meningkatkan risiko terkena penyakit koarktasio aorta antara lain:\n\n1. Penyakit jantung bawaan lain, seperti patent ductus arteriosus (PDA), arterial septal defect (ASD), defek septum ventrikel, atau penyakit katup jantung.\n2. Menderita kelainan genetik, seperti sindrom Turner.\n3. Ibu hamil yang merokok.\n4. Mengonsumsi obat, seperti obat antikejang, selama kehamilan.\n5. Menderita lupus atau diabetes yang tidak terkontrol.",1.0,0.6276775625114073,0.99999999995,1.0
Apa saja gejala yang menandakan penyakit koarktasio aorta?,"Gejala koarktasio aorta bervariasi, sesuai dengan tingkat keparahan penyempitan aorta yang terjadi. Pada koarktasio aorta yang ringan, gejala bisa baru muncul setelah anak menjadi remaja atau dewasa. Beberapa gejala yang bisa muncul adalah: \n\nHipertensi \nSakit kepala\nOtot lemah\nNyeri dada\nSesak napas\nKram tungkai\nKaki terasa dingin\n\nSedangkan pada kasus koarktasio aorta yang parah, gejala dapat muncul sesaat setelah bayi lahir atau beberapa bulan setelah kelahiran. Gejala koarktasio aorta pada bayi berupa: \n\nKesulitan bernapas\nKesulitan untuk menyusu\nKulit terlihat pucat \nSangat berkeringat\nBayi tampak gelisah","['Topik: Koarktasio Aorta, Subtopik: Gejala Koarktasio Aorta \n Gejala koarktasio aorta bervariasi, sesuai dengan tingkat keparahan penyempitan aorta yang terjadi. Pada koarktasio aorta yang ringan, gejala bisa baru muncul setelah anak menjadi remaja atau dewasa. Beberapa gejala yang bisa muncul adalah: \n- Hipertensi \n\n- Sakit kepala\n- Otot lemah\n- Nyeri dada\n- Sesak napas\n- Kram tungkai\n- Kaki terasa dingin\nSedangkan pada kasus koarktasio aorta yang parah, gejala dapat muncul sesaat setelah bayi lahir atau beberapa bulan setelah kelahiran. Gejala koarktasio aorta pada bayi berupa: \n- Kesulitan bernapas\n- Kesulitan untuk menyusu\n- Kulit terlihat pucat \n- Sangat berkeringat\n- Bayi tampak gelisah\n', 'Topik: Koarktasio Aorta, Subtopik: Gejala Koarktasio Aorta: Kapan harus ke dokter \n Segera pergi ke dokter atau IGD (instalasi gawat darurat) rumah sakit jika Anda atau anak Anda mengalami gejala berikut:\n- Nyeri dada berat\n- Lemas dan pingsan\n\n- Sesak napas dan sulit bernapas\n- Pucat \nWanita yang menderita koarktasio aorta dan berencana untuk hamil juga perlu mendiskusikan rencana kehamilannya dengan dokter untuk mencegah terjadinya komplikasi.\n', 'Topik: Koarktasio Aorta, Subtopik: Komplikasi Koarktasio Aorta \n Komplikasi yang dapat terjadi pada penderita koarktasio aorta adalah:\n- Hipertensi\n- Hipertrofi ventrikel kiri\n- Stroke \n- Aneurisma aorta\n- Diseksi atau robeknya aorta \n- Aneurisma otak\n- Gagal jantung \n- Penyakit jantung koroner pada usia muda\n\n- Penyakit ginjal\n- Endokartitis\n']","Gejala koarktasio aorta bervariasi, sesuai dengan tingkat keparahan penyempitan aorta yang terjadi. Pada koarktasio aorta yang ringan, gejala bisa baru muncul setelah anak menjadi remaja atau dewasa. Beberapa gejala yang bisa muncul adalah:\n- Hipertensi\n- Nyeri dada\n- Sakit kepala\n- Otot lemah\n- Sesak napas\n- Kram tungkai\n- Kaki terasa dingin",1.0,0.5827070725855391,0.9999999999666667,1.0
Bagaimana prosedur yang dilakukan oleh dokter untuk pengobatan tamponade jantung?,"Untuk mengurangi tekanan di jantung, ada beberapa prosedur yang dapat dilakukan dokter, yaitu:\n\nPericardiocentesis (punksi perikardium)\nPericardiocentesis adalah prosedur yang dilakukan untuk mengeluarkan cairan dari ruang perikardium dengan menggunakan jarum.\nPericardiectomy\nPericardiectomy dilakukan dengan memotong dan menghilangkan sebagian perikardium yang melapisi jantung. Dengan begitu, tekanan di jantung akan berkurang.\nPericardiodesis\nPericardiodesis adalah pemberian obat-obatan langsung ke dalam rongga perikardium untuk menempelkan perikardium dengan otot jantung. Prosedur ini biasa dilakukan bila penumpukan cairan di ruang perikardium terjadi secara berulang.\nTorakotomi\nTorakotomi adalah prosedur bedah terbuka yang dilakukan dokter untuk mengeluarkan gumpalan darah pada tamponade jantung yang terjadi akibat cedera.","['Topik: Tamponade Jantung, Subtopik: Pengobatan Tamponade Jantung \n Tamponade jantung penting untuk segera didiagnosis dan ditangani agar risiko kematian akibat penyakit ini dapat berkurang. Pada dasarnya, tujuan pengobatan tamponade jantung adalah untuk meredakan tekanan di jantung dan menangani penyebab yang mendasarinya.\nSebagai langkah awal, dokter akan memberikan oksigen dan obat-obatan untuk meringankan beban kerja jantung dan meningkatkan tekanan darah. Pasien juga akan diminta untuk berbaring di ranjang dengan kaki disangga ke atas guna meningkatkan aliran balik darah ke jantung.\nUntuk mengurangi tekanan di jantung, ada beberapa prosedur yang dapat dilakukan dokter, yaitu:\n- Pericardiocentesis (punksi perikardium)\nPericardiocentesis adalah prosedur yang dilakukan untuk mengeluarkan cairan dari ruang perikardium dengan menggunakan jarum.\n- Pericardiectomy\nPericardiectomy dilakukan dengan memotong dan menghilangkan sebagian perikardium yang melapisi jantung. Dengan begitu, tekanan di jantung akan berkurang.\n- Pericardiodesis\nPericardiodesis adalah pemberian obat-obatan langsung ke dalam rongga perikardium untuk menempelkan perikardium dengan otot jantung. Prosedur ini biasa dilakukan bila penumpukan cairan di ruang perikardium terjadi secara berulang.\n- Torakotomi\nTorakotomi adalah prosedur bedah terbuka yang dilakukan dokter untuk mengeluarkan gumpalan darah pada tamponade jantung yang terjadi akibat cedera.\nSetelah tekanan di jantung dikurangi, dokter akan mencari tahu penyebab timbulnya tamponade jantung dan memberikan pengobatan terhadap penyebab tersebut.\n', 'Topik: Tamponade Jantung, Subtopik: Diagnosis Tamponade Jantung \n Dokter akan mengawali diagnosis tamponade jantung dengan menanyakan gejala yang dialami pasien dan riwayat kesehatannya. Setelah itu, dokter akan melakukan pemeriksaan fisik secara menyeluruh.\nTamponade jantung biasanya memiliki tiga tanda yang dapat dikenali oleh dokter. Tanda-tanda ini dikenal dengan istilah Beck  s triad. Tanda tersebut meliputi:\n- Tekanan darah rendah dan denyut nadi lemah karena volume darah yang dipompa jantung berkurang\n- Detak jantung cepat disertai suara jantung yang melemah akibat adanya timbunan cairan di dalam ruang perikardium\n- Pembuluh darah vena di leher menonjol karena kesulitan mengembalikan darah ke jantung\nDokter juga akan melakukan pemeriksaan lanjutan berikut ini untuk menunjang diagnosis:\n- Tes darah, untuk mendeteksi infeksi yang bisa menyebabkan perikarditis\n- Rontgen dada, untuk mendeteksi pembesaran di jantung\n- Elektrokardiografi, untuk memeriksa irama jantung pasien\n- Ekokardiografi, untuk mencari tahu apakah pembesaran perikardium dan pengempisan jantung diakibatkan oleh volume darah yang rendah\n- CT scan jantung, untuk memeriksa penimbunan cairan di ruang perikardium dan perubahan lain yang terjadi di jantung\n', 'Topik: Tamponade Jantung, Subtopik: Pencegahan Tamponade Jantung \n Tamponade jantung bisa disebabkan oleh beragam kondisi dan dapat kambuh. Oleh sebab itu, jika Anda memiliki riwayat tamponade jantung atau menderita penyakit yang dapat menyebabkan kondisi ini, lakukanlah pemeriksaan kesehatan ke dokter secara rutin.\nSelain itu, terdapat beberapa upaya yang dapat dilakukan untuk mengurangi risiko terkena penyakit yang dapat menyebabkan tamponade jantung, yaitu:\n- Mengonsumsi makanan yang menyehatkan jantung\n\n- Berolahraga secara rutin\n- Menjaga berat badan ideal\n- Menghindari konsumsi minuman beralkohol\n- Berhati-hati dalam berkendara untuk menghindari cedera dada\n- Berhenti merokok\n']","Prosedur utama dalam pengobatan tamponade jantung meliputi beberapa metode medis, antara lain:\n\n1. Mengeluarkan cairan di ruang perikardium:\na. Pericardiocentesis: Dokter akan menarik cairan yang menggenangi ruang perikardium dengan cara membersihkan ruang ini dan menggunakan jarum medis untuk menghapus cairan tersebut.\nb. Pericardiectomy: Dalam hal ini, dokter akan melakukan operasi bedah untuk memotong dan menghilangkan sebagian perikardium yang melapisi jantung, mengurangi tekanan di dalamnya.\nc. Pericardiodesis: Dokter akan memberikan obat ke dalam ruang perikardium untuk menempelkannya pada otot-otot jantung dan mencegah penumpukan cairan kembali.\nd. Torakotomi: Dalam hal ini, dokter akan melakukan bedah terbuka untuk mengeluarkan gumpalan darah atau zat lain yang menyebabkan tamponade jantung seperti cedera dada.\n\n2. Mengurangi tekanan di jantung:\na. Memberikan oksigen dan obat-obatan untuk menstabilkan pasien, mengurangi beban kerja jantung, dan meningkatkan tekanan darah.\nb. Pasien diminta untuk berbaring dengan kaki disangga ke atas dalam ranjang untuk mempercepat aliran balik darah ke jantung.\nc. Dokter akan melakukan pemeriksaan lanjutan dan tes lain seperti elektrokardiografi, ekokardiografi, atau CT scan jantung untuk mendeteksi penyebab tamponade jantung.\nd. Setelah tekanan di jantung berkurang, dokter akan mencari tahu penyebab timbulnya tamponade dan memberikan pengobatan terhadap hal itu.",0.8947368421052632,0.657879133303272,0.99999999995,1.0
Apa saja komplikasi yang mungkin terjadi pada penyakit tamponade jantung?,Komplikasi yang mungkin terjadi akibat tamponade jantung antara lain:\n\nSyok\nPerdarahan\nEdema paru\nGagal jantung\nKematian,"['Topik: Tamponade Jantung, Subtopik: Komplikasi Tamponade Jantung \n Komplikasi yang mungkin terjadi akibat tamponade jantung antara lain:\n- Syok\n- Perdarahan\n- Edema paru\n- Gagal jantung\n- Kematian\n', 'Topik: Tamponade Jantung, Subtopik: Pengertian Tamponade Jantung \n Tamponade jantung sering terjadi akibat tekanan yang berasal dari penumpukan cairan di dalam rongga perikardium, yaitu ruang antara otot dan selaput pelindung jantung. Cairan tersebut bisa darah atau nanah, yang jika menumpuk terlalu banyak dapat menghambat jantung untuk mengembang secara normal.\n\nTamponade jantung dapat menimbulkan gejala seperti kulit pucat, badan lemas, nyeri dada, dan jantung berdebar. Jika orang di sekitar Anda mengalami gejala tersebut, segera cari pertolongan medis agar tamponade jantung tidak menimbulkan komplikasi serius, seperti kerusakan organ, syok, atau kematian.\n', 'Topik: Tamponade Jantung, Subtopik: Pengertian Tamponade Jantung \n Tamponade jantung adalah kondisi terganggunya fungsi jantung dalam memompa darah akibat adanya tekanan yang kuat di jantung. Tamponade jantung merupakan kondisi gawat darurat yang membutuhkan penanganan medis secepatnya.\nTamponade jantung sering terjadi akibat tekanan yang berasal dari penumpukan cairan di dalam rongga perikardium, yaitu ruang antara otot dan selaput pelindung jantung. Cairan tersebut bisa darah atau nanah, yang jika menumpuk terlalu banyak dapat menghambat jantung untuk mengembang secara normal.\n\nTamponade jantung dapat menimbulkan gejala seperti kulit pucat, badan lemas, nyeri dada, dan jantung berdebar. Jika orang di sekitar Anda mengalami gejala tersebut, segera cari pertolongan medis agar tamponade jantung tidak menimbulkan komplikasi serius, seperti kerusakan organ, syok, atau kematian.\n']",Komplikasi yang mungkin terjadi akibat tamponade jantung antara lain:\n- Syok\n- Perdarahan\n- Edema paru\n- Gagal jantung\n- Kematian,1.0,0.7217025238036049,0.9999999999666667,1.0
Bagaimana pencegahan diseksi aorta?,"Diseksi aorta tidak dapat dicegah sepenuhnya, tetapi Anda dapat menurunkan risiko terserang penyakit ini dengan cara:\n\nMengontrol tekanan darah secara rutin\nMempertahankan berat badan ideal\nTidak merokok\nMenjaga pola makan dan menghindari makanan tinggi kolesterol\nMemakai sabuk pengaman ketika mengendarai mobil, untuk menghindari benturan ke dada\nBerkonsultasi dengan dokter mengenai kondisi kesehatan Anda dan keluarga, terutama bila ada riwayat penyakit atau kelainan pembuluh darah aorta","['Topik: Diseksi Aorta, Subtopik: Pencegahan Diseksi Aorta \n Diseksi aorta tidak dapat dicegah sepenuhnya, tetapi Anda dapat menurunkan risiko terserang penyakit ini dengan cara:\n- Mengontrol tekanan darah secara rutin\n- Mempertahankan berat badan ideal\n\n- Tidak merokok\n- Menjaga pola makan dan menghindari makanan tinggi kolesterol\n\n- Memakai sabuk pengaman ketika mengendarai mobil, untuk menghindari benturan ke dada\n- Berkonsultasi dengan dokter mengenai kondisi kesehatan Anda dan keluarga, terutama bila ada riwayat penyakit atau kelainan pembuluh darah aorta\n', 'Topik: Diseksi Aorta, Subtopik: Pengertian Diseksi Aorta \n Diseksi aorta adalah kondisi ketika lapisan dalam pembuluh darah aorta robek dan terpisah dari lapisan tengah dinding aorta. Terkadang, gejala diseksi aorta mirip dengan gejala penyakit lain, seperti penyakit jantung dan stroke. Jika tidak segera ditangani, kondisi ini dapat berakibat fatal.\nPembuluh aorta adalah pembuluh darah arteri terbesar di dalam tubuh yang berfungsi menerima darah kaya oksigen dari jantung. Darah kaya oksigen ini akan dialirkan ke seluruh tubuh melalui cabang-cabang arteri.\n\nJika aorta robek, darah akan bocor dan mengalir melalui sela-sela robekan tersebut sehingga membentuk saluran darah palsu di dinding aorta yang membuat lapisan dalam dan tengah aorta terpisah.\nDiseksi aorta terbagi menjadi tipe A dan tipe B. Pada tipe A, robekan terjadi di aorta bagian atas (ascending aorta). Sedangkan pada tipe B, robekan terjadi di aorta bagian bawah (descending aorta). Dua jenis diseksi aorta ini dapat meluas hingga ke perut, tetapi diseksi aorta tipe A umumnya lebih berbahaya daripada diseksi aorta tipe B.\n', 'Topik: Diseksi Aorta, Subtopik: Pengobatan Diseksi Aorta: Operasi \n Operasi dilakukan untuk mengangkat bagian aorta yang rusak dan menggantinya dengan bahan sintetis. Jika terjadi kebocoran di katup jantung, dokter juga akan melakukan operasi penggantian katup jantung.\nSetelah kondisi kembali normal, semua penderita diseksi aorta harus mengonsumsi obat-obatan seumur hidupnya untuk menurunkan tekanan di aorta dan menjaga kestabilan tekanan darah.\nObat-obatan yang dimaksud antara lain obat anthipertensi seperti obat penghambat beta atau antagonis kalsium, obat angiotensin-converting enzyme (ACE) inhibitor, dan obat penurun kolesterol.\n']","Pencegahan diseksi aorta tidak dapat dijamin sepenuhnya, karena faktor-faktor resiko dan penyebabnya bervariasi. Namun, terdapat beberapa cara umum yang dapat dilakukan untuk mengurangi risiko terkena diseksi aorta:\n\n1. Mengontrol tekanan darah secara rutin: Kondisi hipertensi atau tekanan darah tinggi merupakan faktor utama risiko terkena diseksi aorta, sehingga mengendalikan tekanan darah menjadi penting untuk diimbangi.\n2. Mempertahankan berat badan ideal: Obesitas dapat mempercepat pertumbuhan dan timbulnya diseksi aorta karena lebih banyak tekanan yang bekerja pada dinding aorta. Mencapai bobot badan ideal bisa menjadi cara untuk mengurangi risiko terkena penyakit ini.\n3. Tidak merokok: Konsumsi rokok secara konsisten telah terbukti sebagai faktor risiko dalam timbulnya diseksi aorta, sehingga tidak mengkonsumsi minuman atau obat rokok adalah cara yang baik untuk menurunkan risiko.\n4. Menjaga pola makan dan menghindari makanan tinggi kolesterol: Mengkonsumsi makanan bergizi, rendah lemak, dan rendah kolesterol dapat membantu mencegah penyakit jantung serta mengurangi risiko terkena diseksi aorta.\n5. Memakai sabuk pengaman ketika mengendarai mobil: Benturan yang berat bisa meningkatkan resiko timbulnya diseksi aorta, oleh karena itu memakai sabuk pengaman saat mengendarai mobil adalah cara untuk menjaga keamanan diri.\n6. Berkonsultasi dengan dokter: Melakukan sering berkonsultasi dengan dokter dan tetapkan pola perawatan kesehatan yang baik akan membantu mendeteksi penyakit atau gejala awal sebelum menjadi lebih parah.\n\nTetapi, meskipun ada cara-cara tersebut, risiko timbulnya diseksi aorta tidak dapat dijamin secara sempurna karena faktor resiko dan penyebabnya bervariasi. Oleh karena itu, penting untuk tetap hati-hati dan sering berikan monitoring kepada dokter untuk menjaga agar tidak terjadi penyakit atau gejala yang lebih parah.",0.5789473684210527,0.0,0.99999999995,1.0
Apa itu penyakit diseksi aorta?,"Diseksi aorta adalah kondisi ketika lapisan dalam pembuluh darah aorta robek dan terpisah dari lapisan tengah dinding aorta. Terkadang, gejala diseksi aorta mirip dengan gejala penyakit lain, seperti penyakit jantung dan stroke. Jika tidak segera ditangani, kondisi ini dapat berakibat fatal.","['Topik: Diseksi Aorta, Subtopik: Pengertian Diseksi Aorta \n Diseksi aorta adalah kondisi ketika lapisan dalam pembuluh darah aorta robek dan terpisah dari lapisan tengah dinding aorta. Terkadang, gejala diseksi aorta mirip dengan gejala penyakit lain, seperti penyakit jantung dan stroke. Jika tidak segera ditangani, kondisi ini dapat berakibat fatal.\nPembuluh aorta adalah pembuluh darah arteri terbesar di dalam tubuh yang berfungsi menerima darah kaya oksigen dari jantung. Darah kaya oksigen ini akan dialirkan ke seluruh tubuh melalui cabang-cabang arteri.\n\nJika aorta robek, darah akan bocor dan mengalir melalui sela-sela robekan tersebut sehingga membentuk saluran darah palsu di dinding aorta yang membuat lapisan dalam dan tengah aorta terpisah.\nDiseksi aorta terbagi menjadi tipe A dan tipe B. Pada tipe A, robekan terjadi di aorta bagian atas (ascending aorta). Sedangkan pada tipe B, robekan terjadi di aorta bagian bawah (descending aorta). Dua jenis diseksi aorta ini dapat meluas hingga ke perut, tetapi diseksi aorta tipe A umumnya lebih berbahaya daripada diseksi aorta tipe B.\n', 'Topik: Diseksi Aorta, Subtopik: Diagnosis Diseksi Aorta \n Diseksi aorta tidak mudah terdeteksi, karena penyakit ini menunjukkan gejala yang mirip dengan sejumlah kondisi medis lainnya.\nUntuk mendiagnosis diseksi aorta, dokter akan menanyakan gejala yang dialami pasien, serta riwayat pasien dan keluarga, Selanjutnya, dokter akan memeriksa detak jantung pasien menggunakan stetoskop dan mengukur tekanan darah di kedua lengan pasien.\nDokter dapat mencurigai pasien terkena diseksi aorta bila terdapat tekanan darah di kedua lengan pasien berbeda. Namun, untuk lebih memastikan diagnosis, dokter akan melakukan pemeriksaan penunjang, seperti:\n- Foto Rontgen dada, untuk melihat apakah terdapat pelebaran aorta\n- Ekokardiografi transesofageal (transesophageal echocardiogram), untuk melihat gambaran jantung\n- CT scan, untuk melihat kondisi jantung, aorta, dan pembuluh darah lain secara lebih jelas dengan menggunakan zat kontras\n- Magnetic resonance angiogram (MRA), untuk melihat aliran darah di aorta\n', 'Topik: Diseksi Aorta, Subtopik: Pengertian Diseksi Aorta \n Pembuluh aorta adalah pembuluh darah arteri terbesar di dalam tubuh yang berfungsi menerima darah kaya oksigen dari jantung. Darah kaya oksigen ini akan dialirkan ke seluruh tubuh melalui cabang-cabang arteri.\n\nJika aorta robek, darah akan bocor dan mengalir melalui sela-sela robekan tersebut sehingga membentuk saluran darah palsu di dinding aorta yang membuat lapisan dalam dan tengah aorta terpisah.\nDiseksi aorta terbagi menjadi tipe A dan tipe B. Pada tipe A, robekan terjadi di aorta bagian atas (ascending aorta). Sedangkan pada tipe B, robekan terjadi di aorta bagian bawah (descending aorta). Dua jenis diseksi aorta ini dapat meluas hingga ke perut, tetapi diseksi aorta tipe A umumnya lebih berbahaya daripada diseksi aorta tipe B.\n']","Penyakit diseksi aorta adalah kondisi dimana lapisan dalam pembuluh darah aorta robek dan terpisah dari lapisan tengah dinding aorta. Hal ini menyebabkan darah bocor dan mengalir melalui sela-sela robekan yang terjadi, membentuk saluran darah palsu di dinding aorta sehingga lapisan dalam dan tengah aorta terpisah. Penyakit ini umumnya menunjukkan gejala yang mirip dengan penyakit jantung dan stroke, seringkali memerlukan perawatan medis cepat untuk mencegahnya berkembang fatal.",1.0,0.5506042061741593,0.9999999999666667,1.0
Apa saja penyebab efusi perikardium?,"Penyebab efusi perikardium sangat bervariasi, antara lain:\n\nPeradangan pada perikardium (perikarditis), baik akibat penyakit maupun cedera\nKanker perikardium, kanker jantung, atau kanker yang menyebar dari paru-paru, kelenjar getah bening, atau payudara\nInfeksi yang disebabkan oleh bakteri, virus, jamur, atau parasit\nPenyakit autoimun, seperti rheumatoid arthritis, lupus, atau sindrom Sjögren\nHipotiroidisme\nGagal ginjal\nSerangan jantung\nEfek samping prosedur medis, seperti radioterapi, kemoterapi, atau operasi jantung\nEfek samping obat-obatan tertentu, seperti obat tekanan darah tinggi, obat tuberkulosis, dan obat antikejang","['Topik: Efusi Perikardium, Subtopik: Penyebab Efusi Perikardium \n Penyebab efusi perikardium sangat bervariasi, antara lain:\n- Peradangan pada perikardium (perikarditis), baik akibat penyakit maupun cedera\n\n- Kanker perikardium, kanker jantung, atau kanker yang menyebar dari paru-paru, kelenjar getah bening, atau payudara\n\n- Infeksi yang disebabkan oleh bakteri, virus, jamur, atau parasit\n- Penyakit autoimun, seperti rheumatoid arthritis, lupus, atau sindrom Sj gren\n\n- Hipotiroidisme\n- Gagal ginjal\n- Serangan jantung\n- Efek samping prosedur medis, seperti radioterapi, kemoterapi, atau operasi jantung\n\n- Efek samping obat-obatan tertentu, seperti obat tekanan darah tinggi, obat tuberkulosis, dan obat antikejang\n\nMeski ada banyak kondisi atau penyakit yang dapat menyebabkan efusi perikardium, tidak sedikit pula kejadian efusi perikardium yang tidak diketahui penyebabnya. Hal ini disebut dengan idiopathic pericardial effusion. \n', 'Topik: Efusi Perikardium, Subtopik: Pengertian Efusi Perikardium \n Efusi perikardium adalah penumpukan cairan di antara selaput jantung (perikardium) dan jantung. Penumpukan cairan tersebut dapat menyebabkan tekanan berlebih pada jantung. Akibatnya, fungsi jantung bisa terganggu.\nPerikardium terdiri dari dua lapisan tipis yang menyelubungi jantung. Satu lapis menempel pada jantung dan satu lapis yang lain membatasi jantung dari organ sekitarnya. Di antara kedua lapisan ini terdapat celah kecil berisi cairan yang berfungsi untuk melumasi jantung agar dapat berdenyut atau memompa darah dengan mudah.\n\nEfusi perikardium terjadi ketika kadar cairan di antara ruang perikardium melebihi jumlah normalnya. Pada efusi perikardium, kadar cairan bisa sebanyak 100 mililiter hingga lebih dari 2 liter, padahal normalnya, cairan tersebut hanya sebanyak 2  3 sendok makan.\n', 'Topik: Efusi Perikardium, Subtopik: Pencegahan Efusi Perikardium \n Pada sebagian besar kasus, efusi perikardium tidak dapat dicegah. Namun, Anda bisa mengurangi risiko terkena penyakit yang dapat menyebabkan efusi perikardium, seperti infeksi, gagal ginjal, dan serangan jantung. Caranya adalah sebagai berikut:\n- Menjalani pola hidup sehat, seperti mengonsumsi makanan bergizi seimbang, menjaga berat badan ideal, dan berolahraga secara rutin\n- Mengonsumsi obat sesuai aturan pakai atau terlebih dahulu berkonsultasi online dengan dokter\n\n- Melakukan pemeriksaan kesehatan ke dokter secara berkala jika menderita penyakit kronis, seperti penyakit autoimun, diabetes, atau hipertensi\n']","Penyebab efusi perikardium mencakup berbagai macam faktor, di antaranya:\n\n1. Peradangan pada perikardium (perikarditis), baik akibat penyakit maupun cedera.\n2. Kanker perikardium, kanker jantung, atau kanker yang menyebar dari paru-paru, kelenjar getah bening, atau payudara.\n3. Infeksi yang disebabkan oleh bakteri, virus, jamur, atau parasit.\n4. Penyakit autoimun, seperti rheumatoid arthritis, lupus, atau sindrom Sjögren.\n5. Hipotiroidisme.\n6. Gagal ginjal.\n7. Serangan jantung.\n8. Efek samping prosedur medis, seperti radioterapi, kemoterapi, atau operasi jantung.\n9. Efek samping obat-obatan tertentu, seperti obat tekanan darah tinggi, obat tuberkulosis, dan obat antikejang.",1.0,0.6671386964913188,0.8333333332916666,1.0
Apa saja obat untuk menyembuhkan efusi perikardium?,"Obat-obatan yang diberikan dapat berupa:\n\nAspirin\nObat antiinflamasi nonsteroid (OAINS), misalnya ibuprofen\nKortikosteroid, seperti prednisone\nColchicine","['Topik: Efusi Perikardium, Subtopik: Pengobatan Efusi Perikardium: Pemberian obat-obatan \n Dokter akan meresepkan obat untuk mengurangi peradangan pada perikardium jika pasien tidak berisiko mengalami tamponade jantung. Obat-obatan yang diberikan dapat berupa:\n- Aspirin\n- Obat antiinflamasi nonsteroid (OAINS), misalnya ibuprofen\n- Kortikosteroid, seperti prednisone\n\n- Colchicine\n', 'Topik: Efusi Perikardium, Subtopik: Pengobatan Efusi Perikardium: Tindakan medis \n Dokter akan melakukan prosedur medis jika obat-obatan tidak efektif dan bila pasien menderita atau berisiko terserang tamponade jantung. Beberapa prosedur tersebut adalah:\n- Perikardiosentesis, dengan memasang kateter selama beberapa hari, untuk mengeluarkan cairan yang menumpuk di perikardium\n- Operasi jantung terbuka (open-heart surgery), untuk mengeluarkan darah atau cairan dari perikardium, memperbaiki kerusakan di perikardium, dan terkadang memasang selang dari rongga perikardium ke rongga perut supaya cairan bisa mengalir ke area tersebut kemudian terserap\n\n- Perikardiotomi balon perkutan, untuk membuat lubang drainase pada perikardium yang kemudian dibesarkan dengan balon, menggunakan metode kateterisasi\n\n- Perikardiektomi, untuk mengangkat sebagian atau keseluruhan perikardium, bagi pasien yang sudah mengalami efusi perikardium berkali-kali meski sudah ditangani dengan metode lain\n', 'Topik: Efusi Perikardium, Subtopik: Pencegahan Efusi Perikardium \n Pada sebagian besar kasus, efusi perikardium tidak dapat dicegah. Namun, Anda bisa mengurangi risiko terkena penyakit yang dapat menyebabkan efusi perikardium, seperti infeksi, gagal ginjal, dan serangan jantung. Caranya adalah sebagai berikut:\n- Menjalani pola hidup sehat, seperti mengonsumsi makanan bergizi seimbang, menjaga berat badan ideal, dan berolahraga secara rutin\n- Mengonsumsi obat sesuai aturan pakai atau terlebih dahulu berkonsultasi online dengan dokter\n\n- Melakukan pemeriksaan kesehatan ke dokter secara berkala jika menderita penyakit kronis, seperti penyakit autoimun, diabetes, atau hipertensi\n']","1. Aspirin\n2. Obat antiinflamasi nonsteroid (OAINS), seperti ibuprofen\n3. Kortikosteroid, misalnya prednisone\n4. Colchicine",1.0,0.2784115373010427,0.9999999999,1.0
Apa saja komplikasi yang dapat ditimbulkan penyakit jantung koroner?,"Penyakit jantung koroner jika tidak ditangani dengan baik dapat berujung ke serangan jantung hingga kematian. Selain itu, berkurangnya suplai darah menuju jantung dapat menyebabkan komplikasi lain, seperti:\n\nHipertensi pulmonal, yaitu kondisi ketika tekanan darah di paru-paru meningkat dan menyebabkan pertukaran oksigen tidak optimal\nKardiomiopati, yaitu kondisi ketika otot jantung mengalami kerusakan sehingga terlalu lemah untuk memompa darah\nGagal jantung, akibat kondisi jantung yang tidak cukup kuat untuk memompa darah sehingga suplai oksigen ke tubuh tidak optimal\nGangguan irama jantung (aritmia), ketika suplai darah ke jantung berkurang atau ada kerusakan di jaringan jantung yang memengaruhi impuls listrik jantung","['Topik: Penyakit Jantung Koroner, Subtopik: Pengertian Penyakit Jantung Koroner \n Penyakit jantung koroner adalah kondisi ketika pembuluh darah jantung (arteri koroner) tersumbat oleh timbunan lemak. Pada awalnya, kondisi ini mungkin tidak menyebabkan gejala. Namun, sumbatan total pada arteri koroner dapat menyebabkan serangan jantung.\nArteri koroner adalah pembuluh darah yang mengalirkan darah kaya oksigen ke otot jantung. Penumpukan lemak di arteri koroner membuat pembuluh darah ini menyempit dan mengeras. Akibatnya, aliran darah dan asupan oksigen ke otot jantung berkurang.\n\nKetika asupan oksigen berkurang, otot jantung bisa rusak sehingga kemampuannya untuk bekerja juga menjadi terbatas. Hal inilah yang menyebabkan gejala serangan jantung, seperti nyeri dada kiri dan sesak napas.\nBerdasarkan data WHO pada tahun 2019, ada 17,9 juta penduduk di dunia yang meninggal karena penyakit jantung dan pembuluh darah (kardiovaskular), di antaranya akibat penyakit jantung koroner (PJK). Sementara di Indonesia, tercatat lebih dari 2 juta orang menderita penyakit kardiovaskular pada tahun 2018.\n', 'Topik: Penyakit Jantung Koroner, Subtopik: Penyebab Penyakit Jantung Koroner: Stres \n Penelitian menunjukkan bahwa stres yang tidak dikelola dengan baik meningkatkan jumlah plak lemak di dalam arteri koroner. Kondisi ini juga meningkatkan risiko terbentuknya gumpalan darah yang dapat menyumbat arteri koroner sehingga terjadilah penyakit jantung koroner.\n', 'Topik: Penyakit Jantung Koroner, Subtopik: Penyebab Penyakit Jantung Koroner: Rokok \n Rokok adalah faktor risiko utama penyakit jantung koroner. Kandungan nikotin dan karbon monoksida yang terdapat di dalam rokok bisa meningkatkan risiko terjadinya penggumpalan darah.\nDi samping itu, bahan kimia lain yang berasal dari pembakaran rokok juga dapat merusak dinding pembuluh darah jantung dan menyempitkan arteri koroner.\n']","Berdasarkan informasi yang ada, komplikasi dari penyakit jantung koroner meliputi:\n\n1. Serangan Jantung (Angina Pectoris): Gejala utama serangan jantung disebabkan oleh pembatasan aliran darah ke otot jantung akibat sumbatan arteri koroner. Gejala umumnya meliputi nyeri dada yang menjulang, terutama saat beban fisik lebih atau dewasa matahari, serta sesak napas dan bermacam-macam gangguan lain seperti mual, muntah, dan ketegangan.\n2. Penyakit Imajiner: Jika arteri koroner terlalu sumbek untuk memberikan darah ke imajin yang rusak secara tetap, menyebabkan fungsi jantung menurun sehingga dapat membahayakan nyawa pasien.\n3. Penyumbatan Arteri Koroner (Acute Coronary Syndrome - ACS): Jika gumpalan darah pada arteri koroner yang tertekan berkembang pesat, akan mengakibatkan penyumbatan total atau parah dalam aliran darah ke jantung. Hal ini dapat menyebabkan serangan jantung dan bahkan meningkatkan resiko infark jantung.\n4. Hipertensi: Penyakit jantung koroner umumnya diselingi oleh gangguan tekanan darah tinggi (hipertensi), yang dapat memperburuk fungsi jantung dan meningkatkan resiko serangan jantung, infark jantung, dan penyumbatan arteri koroner.\n5. Kerusakan Imajiner: Jika aliran darah terhambur pada otot jantung akibat sumbatan arteri koroner, maka imajin akan menjadi lebih sulit untuk bekerja secara efisien dan dapat menyebabkan penyakit imajiner seperti insufisiensi jantung.\n6. Ginjal: Penyakitan jantung koroner juga bisa mempengaruhi ginjal, terutama ketika pasien mengalami infark jantung atau gangguan tekanan darah tinggi.\n7. Pemulihan Darah (Shock): Jika fungsi jantung menjadi lebih buruk akibat penyakit jantung koroner, pasien bisa mengalami pemulihan darah yang berarti tidak adanya aliran darah dan oksigen yang cukup untuk memenuhi kebutuhan tubuh.\n8. Penyakit Vaskular Umum: Beberapa penyebab lain seperti stroke, diabetes mellitus, dan obesitas juga bisa meningkatkan resiko terjadinya komplikasi jantung koroner.",0.23529411764705882,0.6036473945087023,0.9999999999,0.5
Makanan apa yang tepat untuk mencegah penyakit jantung koroner?,"Makanan tinggi serat, seperti sayur dan buah. Selain itu, tingkatkan kadar kolesterol baik atau HDL dengan memperbanyak konsumsi makanan tinggi lemak tak jenuh. Jenis makanan ini antara lain minyak ikan, minyak zaitun, minyak biji bunga matahari, minyak sayur, serta alpukat dan kacang-kacangan.","['Topik: Penyakit Jantung Koroner, Subtopik: Pencegahan Penyakit Jantung Koroner: Berolahraga rutin \n Pola makan sehat yang dikombinasikan dengan olahraga rutin dapat menjaga berat badan ideal. Di samping itu, olahraga rutin dapat menurunkan kadar kolesterol dan menjaga tekanan darah tetap normal.\nLuangkan waktu untuk berolahraga setidaknya 150 menit dalam seminggu, misalnya dengan jogging, senam, atau renang. Namun, bagi orang yang berisiko terserang penyakit jantung koroner, diskusikan terlebih dahulu dengan dokter mengenai jenis dan durasi olahraga yang tepat.\n', 'Topik: Penyakit Jantung Koroner, Subtopik: Pencegahan Penyakit Jantung Koroner \n Cara untuk mencegah penyakit jantung koroner adalah dengan menjalani pola hidup sehat, seperti:\n', 'Topik: Penyakit Jantung Koroner, Subtopik: Penyebab Penyakit Jantung Koroner: Rokok \n Rokok adalah faktor risiko utama penyakit jantung koroner. Kandungan nikotin dan karbon monoksida yang terdapat di dalam rokok bisa meningkatkan risiko terjadinya penggumpalan darah.\nDi samping itu, bahan kimia lain yang berasal dari pembakaran rokok juga dapat merusak dinding pembuluh darah jantung dan menyempitkan arteri koroner.\n']","Untuk mencegah penyakit jantung koroner, sehat dan menguntungkan pola makanan yang direkomendasikan termasuk berbagai jenis sayuran dan buah-buahan, protein nabati atau olahan rendah lemak, serta mematuhi asupan gula dalam batas normal. Diet sehat biasanya juga menghindari penggunaan bawang daun dan bumbu beralkohol yang tinggi lemak untuk mencegah risiko penyakit jantung koroner.",0.2857142857142857,0.7860433880372909,0.9999999999,0.0
Bagaimana cara pencegahan penyakit takikardia supraventrikular?,"Takikardia supraventrikular dapat dicegah dengan menerapkan pola hidup sehat, seperti:\n\nMenghindari konsumsi minuman beralkohol dan berkafein secara berlebihan\nBerhenti merokok\nMenghindari penggunaan NAPZA, terutama kokain dan amphetamine\nBeristirahat dan tidur yang cukup\nMengelola stres dengan baik\nSelalu mematuhi dosis dan aturan pakai saat mengonsumsi obat apa pun\nMengonsumsi makanan sehat bergizi lengkap dan seimbang\nMembatasi asupan garam dan lemak jenuh\nBerolahraga rutin, minimal 30 menit setiap hari","['Topik: Takikardia Supraventrikular, Subtopik: Pencegahan Takikardia Supraventrikular \n Takikardia supraventrikular dapat dicegah dengan menerapkan pola hidup sehat, seperti:\n- Menghindari konsumsi minuman beralkohol dan berkafein secara berlebihan\n- Berhenti merokok\n- Menghindari penggunaan NAPZA, terutama kokain dan amphetamine \n- Beristirahat dan tidur yang cukup\n- Mengelola stres dengan baik\n- Selalu mematuhi dosis dan aturan pakai saat mengonsumsi obat apa pun\n- Mengonsumsi makanan sehat bergizi lengkap dan seimbang\n- Membatasi asupan garam dan lemak jenuh\n- Berolahraga rutin, minimal 30 menit setiap hari\n', 'Topik: Takikardia Supraventrikular, Subtopik: Pengobatan Takikardia Supraventrikular \n Pengobatan takikardia supraventrikular bertujuan untuk memperlambat denyut jantung dan mencegah kondisi yang lebih serius.\nPenderita takikardia supraventrikular umumnya tidak memerlukan pengobatan apa pun. Namun, dokter akan menyarankan beberapa tindakan berikut jika kondisi ini terjadi secara terus-menerus dalam jangka panjang:\n', 'Topik: Takikardia Supraventrikular, Subtopik: Pengertian Takikardia Supraventrikular \n Takikardia supraventrikular adalah kondisi ketika jantung berdetak lebih cepat dari biasanya. Pada kasus yang parah, takikardia supraventrikular dapat menyebabkan henti jantung mendadak. Oleh karena itu, kondisi ini penting untuk diobati secara rutin.\nNormalnya, jantung berdetak sekitar 60 100 detak/menit. Namun, pada penderita takikardia supraventrikular, detak jantung bisa mencapai 150 220 detak/menit secara tiba-tiba. Kondisi ini dapat terjadi ketika penderitanya sedang berolahraga atau bahkan saat tidak melakukan aktivitas apa pun.\n\n']","Untuk mencegah takikardia supraventrikular, seseorang bisa mengikuti pola hidup sehat dan melakukan beberapa langkah berikut:\n\n1. Hindari konsumsi alkohol dan teh atau kopi berlebihan yang mengandung kafein, karena hal itu dapat meningkatkan detak jantung.\n2. Berhenti merokok, terutama rokok pembunuh yang mengandung elemen stimulan seperti nikotin dan kafein yang mempercepat denyut jantung.\n3. Hindari penggunaan NAPZA, termasuk obat-obatan seperti kokain dan amphetamine, yang dapat meningkatkan risiko terkena takikardia supraventrikular.\n4. Pastikan untuk tidur dan istirahat cukup, meminimalisir stress, dan mengelola stres dengan baik. Stress dan ketegangan dapat meningkatkan resiko timbulnya takikardia supraventrikular.\n5. Periksa dosis dan aturan penggunaan obat secara teliti sebelum menggunakannya, terlepas dari jenisnya.\n6. Konsumsi makanan bergizi lengkap dan seimbang serta membatasi asupan garam dan lemak jenuh dalam diet.\n7. Berolahraga rutin minimal 30 menit setiap hari untuk menjaga kondisi fisik tetap baik dan mengurangi risiko takikardia supraventrikular.",0.6666666666666666,0.6295227048259466,0.99999999995,1.0
Apa gejala penyakit takikardia supraventrikular pada bayi?,Bayi dengan takikardia supraventrikular dapat menunjukkan tanda-tanda berikut:\n\nTidak bisa atau sulit menyusu\nNapas cepat\nKulit pucat\nRewel\nMudah berkeringat,"['Topik: Takikardia Supraventrikular, Subtopik: Gejala Takikardia Supraventrikular \n Gejala utama takikardia supraventrikular adalah detak jantung yang cepat. Kondisi ini dapat terjadi secara mendadak dan berlangsung dalam hitungan menit atau bahkan hari.\nSelain detak jantung yang sangat cepat, penderita takikardia supraventrikular juga mengalami gejala berupa:\n- Pusing \n- Nyeri dada\n- Sesak napas\n- Sakit kepala ringan\n- Keringat dingin\n- Mudah lelah\n- Pingsan\n- Gelisah \nSementara itu, gejala takikardia supraventrikular pada bayi umumnya sulit dikenali. Namun, bayi dengan takikardia supraventrikular dapat menunjukkan tanda-tanda berikut:\n- Tidak bisa atau sulit menyusu\n- Napas cepat\n- Kulit pucat\n- Rewel\n- Mudah berkeringat \n', 'Topik: Takikardia Supraventrikular, Subtopik: Gejala Takikardia Supraventrikular: Kapan harus ke dokter \n Segera lakukan pemeriksaan ke dokter jika Anda atau anak Anda merasakan jantung yang berdebar cepat dan disertai dengan gejala di atas, atau jika detak jantung cepat ini berlangsung lebih dari beberapa menit.\n', 'Topik: Takikardia Supraventrikular, Subtopik: Pengertian Takikardia Supraventrikular \n Takikardia supraventrikular adalah kondisi ketika jantung berdetak lebih cepat dari biasanya. Pada kasus yang parah, takikardia supraventrikular dapat menyebabkan henti jantung mendadak. Oleh karena itu, kondisi ini penting untuk diobati secara rutin.\nNormalnya, jantung berdetak sekitar 60 100 detak/menit. Namun, pada penderita takikardia supraventrikular, detak jantung bisa mencapai 150 220 detak/menit secara tiba-tiba. Kondisi ini dapat terjadi ketika penderitanya sedang berolahraga atau bahkan saat tidak melakukan aktivitas apa pun.\n\n']","Gejala takikardia supraventrikular pada bayi umumnya sulit dikenali, tetapi sebagai gantinya korban bisa menunjukkan tanda-tanda berikut:\n1. Tidak bisa atau sulit menyusu\n2. Napas cepat\n3. Kulit pucat\n4. Rewel\n5. Mudah berkeringat",1.0,0.5940774808449641,0.9999999999666667,1.0
Bagaimana cara mencegah penyakit jantung rematik?,"Beberapa upaya yang dapat dilakukan untuk mencegah penyakit jantung rematik adalah:\n\nMencuci tangan dengan sabun dan air mengalir, terutama sebelum mengolah makanan atau sebelum makan\nMenghindari penyebaran bakteri dengan tidak berbagi peralatan makan, handuk, dan sarung bantal\nMenutup mulut dan hidung saat bersin atau batuk\nMengonsumsi makanan bergizi lengkap seimbang\nMencukupi waktu tidur malam dan istirahat\nMenjalani pemeriksaan jantung dan mengonsumsi antibiotik bila memiliki riwayat demam rematik","['Topik: Penyakit Jantung Rematik, Subtopik: Pencegahan Penyakit Jantung Rematik \n Penyakit jantung reumatik dapat dicegah dengan menghindari berbagai faktor yang menyebabkan infeksi bakteri Streptococcus. Beberapa upaya yang dapat dilakukan untuk mencegah penyakit jantung rematik adalah:\n- Mencuci tangan dengan sabun dan air mengalir, terutama sebelum mengolah makanan atau sebelum makan\n- Menghindari penyebaran bakteri dengan tidak berbagi peralatan makan, handuk, dan sarung bantal\n- Menutup mulut dan hidung saat bersin atau batuk\n- Mengonsumsi makanan bergizi lengkap seimbang\n- Mencukupi waktu tidur malam dan istirahat\n- Menjalani pemeriksaan jantung dan mengonsumsi antibiotik bila memiliki riwayat demam rematik\n', 'Topik: Penyakit Jantung Rematik, Subtopik: Pengobatan Penyakit Jantung Rematik: Obat-obatan \n Dokter dapat meresepkan beberapa obat-obatan untuk menangani gejala penyakit jantung rematik dan mencegah perburukan kondisi pasien. Jenis obat-obatan yang dapat diberikan oleh dokter antara lain:\n- Antibiotik\nPemberian antibiotik harian dalam jangka panjang dilakukan untuk mengobati demam rematik pada anak-anak dan dewasa muda. Hal ini untuk mencegah kekambuhan atau komplikasi demam rematik.\n- Steroid\nSteroid diresepkan oleh dokter untuk meredakan peradangan pada jantung dan bagian tubuh lainnya.\n', 'Topik: Penyakit Jantung Rematik, Subtopik: Pengertian Penyakit Jantung Rematik \n Penyakit jantung rematik adalah kerusakan katup jantung akibat komplikasi dari demam rematik. Jika tidak segera mendapatkan penanganan, penyakit jantung rematik berisiko menyebabkan gagal jantung.\nDemam rematik adalah peradangan yang terjadi di berbagai organ tubuh, termasuk jantung. Jika tidak segera ditangani, demam rematik dapat menyebabkan penyempitan atau kebocoran pada katup jantung. Akibatnya, penderita bisa terkena penyakit jantung rematik.\n\nPenyakit jantung rematik bisa dialami oleh siapa saja. Namun, penyakit ini lebih sering menyerang anak-anak usia 5  15 tahun.\n']","Untuk mencegah penyakit jantung rematik, upaya yang bisa dilakukan antara lain:\n\n1. Mencuci tangan dengan sabun dan air mengalir, terutama sebelum mengolah makanan atau sebelum makan, untuk mencegah penularan infeksi melalui kontak fisik.\n2. Menghindari penyebaran bakteri dengan tidak berbagi peralatan makan, handuk, dan sarung bantal setelah mengalami demam rematik atau batuk.\n3. Menutup mulut dan hidung saat bersin atau batuk untuk mencegah penularan infeksi.\n4. Mengonsumsi makanan bergizi lengkap seimbang untuk menjaga imunitas tubuh dan mengurangi risiko terkena penyakit.\n5. Mencukupi waktu tidur malam dan istirahat yang cukup untuk membersihkan diri tubuh dari stres dan mempertahankan fungsi jantung dalam keadaan sehat.\n6. Menjalani pemeriksaan jantung dan mengonsumsi antibiotik bila memiliki riwayat demam rematik, untuk mencegah terjadinya infeksi yang dapat menyebabkan penyakit jantung rematik.\n7. Mengadopsi pola hidup sehat lainnya, seperti tidak merokok dan menghindari paparan asap rokok atau debu busuk.",0.3076923076923077,0.5666503257212844,0.8333333332916666,1.0
Apa saja faktor yang dapat meningkatkan risiko seseorang menderita penyakit jantung rematik?,"Ada beberapa faktor yang diduga dapat meningkatkan risiko seseorang menderita penyakit jantung rematik, yaitu:\n\nTidak mendapatkan pengobatan infeksi Streptococcus secara tuntas, atau mengalami infeksi berulang\nTinggal di lingkungan yang padat dan kumuh\nSulit mendapatkan antibiotik\nJarang mencuci tangan, terutama setelah bersin, batuk, atau sebelum makan","['Topik: Penyakit Jantung Rematik, Subtopik: Penyebab Penyakit Jantung Rematik \n Penyakit jantung rematik disebabkan oleh demam rematik yang tidak tertangani. Demam rematik sendiri dapat disebabkan oleh infeksi bakteri Streptococcus grup A, atau Streptococcus pyogenes (demam scarlet). Infeksi tersebut menyebabkan tubuh menghasilkan respons sistem kekebalan yang menyerang jantung.\nAda beberapa faktor yang diduga dapat meningkatkan risiko seseorang menderita penyakit jantung rematik, yaitu:\n- Tidak mendapatkan pengobatan infeksi Streptococcus secara tuntas, atau mengalami infeksi berulang\n- Tinggal di lingkungan yang padat dan kumuh\n- Sulit mendapatkan antibiotik\n- Jarang mencuci tangan, terutama setelah bersin, batuk, atau sebelum makan\n', 'Topik: Penyakit Jantung Rematik, Subtopik: Pencegahan Penyakit Jantung Rematik \n Penyakit jantung reumatik dapat dicegah dengan menghindari berbagai faktor yang menyebabkan infeksi bakteri Streptococcus. Beberapa upaya yang dapat dilakukan untuk mencegah penyakit jantung rematik adalah:\n- Mencuci tangan dengan sabun dan air mengalir, terutama sebelum mengolah makanan atau sebelum makan\n- Menghindari penyebaran bakteri dengan tidak berbagi peralatan makan, handuk, dan sarung bantal\n- Menutup mulut dan hidung saat bersin atau batuk\n- Mengonsumsi makanan bergizi lengkap seimbang\n- Mencukupi waktu tidur malam dan istirahat\n- Menjalani pemeriksaan jantung dan mengonsumsi antibiotik bila memiliki riwayat demam rematik\n', 'Topik: Penyakit Jantung Rematik, Subtopik: Pengertian Penyakit Jantung Rematik \n Penyakit jantung rematik adalah kerusakan katup jantung akibat komplikasi dari demam rematik. Jika tidak segera mendapatkan penanganan, penyakit jantung rematik berisiko menyebabkan gagal jantung.\nDemam rematik adalah peradangan yang terjadi di berbagai organ tubuh, termasuk jantung. Jika tidak segera ditangani, demam rematik dapat menyebabkan penyempitan atau kebocoran pada katup jantung. Akibatnya, penderita bisa terkena penyakit jantung rematik.\n\nPenyakit jantung rematik bisa dialami oleh siapa saja. Namun, penyakit ini lebih sering menyerang anak-anak usia 5  15 tahun.\n']","Faktor-faktor yang dapat meningkatkan risiko seseorang menderita penyakit jantung rematik, seperti dijelaskan dalam konteks tersebut, adalah:\n\n1. Tidak mendapatkan pengobatan infeksi Streptococcus secara tuntas, atau mengalami infeksi berulang.\n2. Tinggal di lingkungan yang padat dan kumuh.\n3. Sulit mendapatkan antibiotik.\n4. Jarang mencuci tangan, terutama setelah bersin, batuk, atau sebelum makan.",1.0,0.9837904019207163,0.9999999999666667,1.0
Apa kelainan jantung yang diderita seseorang dengan torsade de pointes?,"Pada torsade de pointes, bilik jantung berdetak lebih cepat dan tidak selaras dengan denyut pada atrium. Perlu diketahui, denyut jantung manusia pada kondisi normal adalah 60−100 per menit. Sementara pada torsade de pointes, bilik jantung dapat berdenyut hingga 150–300 per menit.","['Topik: Torsade de Pointes, Subtopik: Pengertian Torsade de Pointes \n Torsade de pointes adalah kelainan jantung berupa kecepatan denyut pada bilik jantung (ventrikel) yang melebihi batas normal. Kondisi ini dapat disebabkan oleh kelainan bawaan atau efek samping obat-obatan. Jika tidak segera ditangani, torsade de pointes dapat menyebabkan henti jantung mendadak.\nJantung memiliki empat ruang utama yang dibagi menjadi dua, yaitu dua ruang bagian bawah (bilik jantung) dan dua ruang bagian atas (atrium). Kedua ruangan ini berfungsi untuk menerima dan memompa darah di jantung.\n\nPada torsade de pointes, bilik jantung berdetak lebih cepat dan tidak selaras dengan denyut pada atrium. Perlu diketahui, denyut jantung manusia pada kondisi normal adalah 60  100 per menit. Sementara pada torsade de pointes, bilik jantung dapat berdenyut hingga 150  300 per menit.\n', 'Topik: Torsade de Pointes, Subtopik: Pencegahan Torsade de Pointes \n Cara mencegah torsade de pointes adalah dengan menurunkan risiko terjadinya kondisi tersebut. Beberapa upaya yang dapat dilakukan adalah:\n- Hindari minum obat tanpa saran dari dokter.\n- Terapkan pola hidup yang sehat untuk menghindari serangan jantung.\n- Jaga kesehatan ginjal dengan minum air putih yang cukup, serta selalu jaga kadar gula darah.\n- Hentikan kebiasaan merokok.\n- Terapkan perilaku hidup bersih dan sehat (PHBS) untuk menghindari diare parah yang bisa mengakibatkan hipokalemia.\nSelain itu, ada beberapa langkah untuk menurunkan risiko terjadinya torsade de pointes yang disebabkan oleh kelainan jantung bawaan, yaitu:\n- Lakukan pemeriksaan jantung secara berkala jika menderita long QT syndrome atau memiliki keluarga dengan kondisi tersebut.\n- Konsultasikan dengan dokter sebelum melakukan aktivitas berat, seperti lari maraton.\n', 'Topik: Torsade de Pointes, Subtopik: Penyebab Torsade de Pointes: Congenital long QT syndrome \n Congenital long QT syndrome adalah kelainan bawaan yang menyebabkan gangguan aktivitas listrik pada bilik jantung. Sindrom ini dinamai demikian karena terjadi pemanjangan interval gelombang QRS ke T pada pemeriksaan rekam jantung (EKG).\nMakin sering seseorang mengalami pemanjangan interval QT, maka risiko terkena torsade de pointes makin tinggi.\n']","Kelainan jantung yang umumnya dikaitkan dengan torsade de pointes adalah sindrom long QT (Congenital Long QT syndrome). Ini merupakan kelainan bawaan yang menyebabkan gangguan aktivitas listrik pada bilik jantung, yang menghasilkan perubahan dalam denyut jantung dan risiko terkena torsade de pointes. Kelainan ini dikenal dengan ritme jantung tidak normal dan dapat memicu hentri jantung mendadak, sehingga penting untuk segera ditangani oleh dokter.",1.0,0.8451284550951751,0.9999999999666667,1.0
Apa saja komplikasi yang dapat ditimbulkan oleh penyakit torsade de pointes?,"Torsade de pointes merupakan kondisi gawat darurat. Jika tidak segera ditangani, torsade de pointes dapat menimbulkan beberapa komplikasi yang serius, yaitu:\n\nTakikardia ventrikel\nFibrilasi ventrikel\nHenti jantung mendadak\nKematian","['Topik: Torsade de Pointes, Subtopik: Komplikasi Torsade de Pointes \n Torsade de pointes merupakan kondisi gawat darurat. Jika tidak segera ditangani, torsade de pointes dapat menimbulkan beberapa komplikasi yang serius, yaitu:\n- Takikardia ventrikel\n- Fibrilasi ventrikel\n- Henti jantung mendadak\n- Kematian\n', 'Topik: Torsade de Pointes, Subtopik: Gejala Torsade de Pointes \n Pada sebagian kasus, torsade de pointes tidak menimbulkan gejala apa pun. Kondisi ini bisa timbul secara mendadak.\nGejala yang dapat timbul pada penderita meliputi:\n- Jantung berdebar (palpitasi) secara tiba-tiba\n- Pusing\n- Mual\n- Keringat dingin\n- Nyeri dada\n- Sesak napas\n- Rasa seperti akan pingsan\n- Penurunan kesadaran\nPada penderita long QT syndrome, gejala-gejala di atas dapat muncul karena dipicu oleh stres, rasa takut, atau aktivitas fisik yang berat.\n', 'Topik: Torsade de Pointes, Subtopik: Pengertian Torsade de Pointes \n Torsade de pointes adalah kelainan jantung berupa kecepatan denyut pada bilik jantung (ventrikel) yang melebihi batas normal. Kondisi ini dapat disebabkan oleh kelainan bawaan atau efek samping obat-obatan. Jika tidak segera ditangani, torsade de pointes dapat menyebabkan henti jantung mendadak.\nJantung memiliki empat ruang utama yang dibagi menjadi dua, yaitu dua ruang bagian bawah (bilik jantung) dan dua ruang bagian atas (atrium). Kedua ruangan ini berfungsi untuk menerima dan memompa darah di jantung.\n\nPada torsade de pointes, bilik jantung berdetak lebih cepat dan tidak selaras dengan denyut pada atrium. Perlu diketahui, denyut jantung manusia pada kondisi normal adalah 60  100 per menit. Sementara pada torsade de pointes, bilik jantung dapat berdenyut hingga 150  300 per menit.\n']","Berdasarkan konteks yang diberikan, komplikasi yang dapat timbul akibat torsade de pointes antara lain:\n\n1. Takikardia ventrikel: Kecepatan denyut jantung (ventrikel) melebihi batas normal, menyebabkan ritme jantung menjadi tidak teratur dan kurang efektif dalam mengalirkan darah ke seluruh tubuh.\n2. Fibrilasi ventrikel: Keadaan di mana jantung berdenyut secara tak teratur dan tidak terkoordinasi, yang dapat membahayakan sistem penggantian oksigen udara dan menyebabkan henti jantung mendadak.\n3. Henti jantung mendadak: Kesulitan dalam mengatasi torsade de pointes secara efektif bisa meningkatkan resiko terjadinya henti jantung, yang dapat berujung pada kematian.\n4. Kematian: Torsade de pointes yang tidak segera ditangani dan diatasi sehingga dapat menyebabkan komplikasi serius termasuk henti jantung mendadak, yang secara fatal bisa mengganggu fungsi jantung.\n\nKomplikasi lainnya yang mungkin terjadi akibat torsade de pointes antara lain ketidaknyamanan fisik seperti pusing, mual, dan sesak napas; gejala nyeri dada atau rasa gatal di area tengkorak; serta penurunan kesadaran hingga terkena kerusakan otak jika hentian jantung tidak segera ditangani.",0.2,0.802103957064407,0.8333333332916666,1.0
Apa saja faktor risiko penyakit atrial flutter?,Atrial flutter lebih sering terjadi pada orang dengan faktor-faktor berikut:\n\nTekanan darah tinggi\nBerusia 50 tahun atau lebih\nMemiliki berat badan berlebih atau obesitas\nMerokok\nMenderita stres berat atau gangguan cemas dalam jangka panjang,"['Topik: Atrial Flutter, Subtopik: Faktor risiko atrial flutter \n Atrial flutter lebih sering terjadi pada orang dengan faktor-faktor berikut:\n- Tekanan darah tinggi\n- Berusia 50 tahun atau lebih\n- Memiliki berat badan berlebih atau obesitas\n- Merokok\n- Menderita stres berat atau gangguan cemas dalam jangka panjang\n', 'Topik: Atrial Flutter, Subtopik: Pengertian Atrial Flutter \n Atrial flutter adalah gangguan irama jantung yang terjadi di serambi jantung (atrium), yaitu ruang jantung bagian atas. Kondisi ini ditandai dengan denyut jantung yang sangat cepat. Jika tidak tertangani, atrial flutter berisiko menimbulkan stroke.\nNormalnya, jantung berdenyut sebanyak 60  100 kali per menit saat tubuh dalam kondisi diam. Akan tetapi, pada atrial flutter, denyut jantung menjadi sangat cepat, yaitu sampai 150 kali per menit bahkan lebih.\n\nAtrial flutter adalah salah satu jenis gangguan irama jantung (aritmia). Atrial flutter memiliki gejala serupa dengan atrial fibrilasi, yang juga merupakan salah satu jenis aritmia, tetapi kedua kondisi tersebut sebenarnya berbeda.\nPada atrial fibrilasi, jantung berdenyut cepat dan iramanya sangat tidak beraturan. Sementara pada atrial flutter, irama jantung masih teratur meskipun denyutnya juga sangat cepat.\n', 'Topik: Atrial Flutter, Subtopik: Pencegahan Atrial Flutter \n Ada penyebab atrial flutter yang tidak dapat dicegah sepenuhnya, misalnya kelainan jantung bawaan dan pheochromocytoma.\nMeskipun demikian, ada penyebab atrial flutter yang bisa dicegah dengan cara menjaga kesehatan jantung, yaitu:\n- Menjaga berat badan agar tetap ideal\n\n- Mengonsumsi makanan sehat, bergizi lengkap, dan seimbang\n\n- Melakukan olahraga secara rutin\n- Tidak merokok\n- Membatasi konsumsi minuman beralkohol dan berkafein\n- Tidak menggunakan narkoba\nJika Anda menderita diabetes, hipertensi, atau penyakit tiroid, pastikan untuk berobat dan kontrol rutin ke dokter, serta menerapkan pola hidup sehat.\n']","Berikut adalah beberapa faktor risiko penyakat atrial flutter, sesuai dengan konteks yang diberikan:\n\n1. Tekanan Darah Tinggi: Atrial flutter sering terjadi pada orang-orang dengan tekanan darah tinggi, karena faktor ini memicu kerusakan pembuluh darah dan mengganggu aliran darah yang normal ke jantung.\n2. Usia 50 Tahun atau Lebih: Pemakaian usia sebagai faktor risiko tidak didukung oleh teks konteks yang diberikan, karena tidak ada referensi tentang umur dalam teks tersebut.\n3. Berat Badan Berlebih atau Obesitas: Penyebab ini dijelaskan dalam subtopik pencegahan, yaitu ""menjaga berat badan agar tetap ideal.""\n4. Merokok: Tekst ini menggambarkan bahwa merokok sebagai faktor risiko atrial flutter dan disertakan dalam keselamatan subtopik pencegahan.\n5. Menderita Stres Berat atau Gangguan Cemas Dalam Jangka Panjang: Seperti yang dijelaskan dalam subtopik pencegahan, ""mengonsumsi makanan sehat, bergizi lengkap, dan seimbang,"" serta melakukan olahraga secara rutin"" merupakan cara untuk menurunkan risiko penyakit jantung termasuk atrial flutter.\n6. Tidak Menggunakan Narkoba: Tekst ini tidak mempertimbangkan narkoba sebagai faktor risiko atrial flutter, karena tidak ada informasi tentang hubungannya dalam konteks yang diberikan.\n7. Diabetes, Hipertensi, Penyakit Tiroid: Dalam subtopik pencegahan, disarankan untuk ""memastikan Anda berobat dan kontrol rutin ke dokter,"" serta menerapkan pola hidup sehat dalam menjaga kesehatan jantung.\n\nDari uraian di atas, faktor risiko penyakit atrial flutter yang sesuai dengan konteks adalah:\n1. Tekanan Darah Tinggi\n2. Berat Badan Berlebih atau Obesitas\n3. Meroket\n4. Mengonsumsi makanan sehat, bergizi lengkap, dan seimbang\n5. Melakukan olahraga secara rutin",0.6842105263157895,0.7520563043308045,0.8333333332916666,1.0
Apa saja gejala penyakit atrial flutter?,Gejala atrial flutter dapat bervariasi dan berlangsung dalam hitungan jam hingga hari. Beberapa gejalanya adalah:\n\nJantung berdebar\nPusing atau terasa akan pingsan\nSesak napas\nNyeri dada\nLemas\nLinglung,"['Topik: Atrial Flutter, Subtopik: Gejala Atrial Flutter \n Gejala atrial flutter dapat bervariasi dan berlangsung dalam hitungan jam hingga hari. Beberapa gejalanya adalah:\n- Jantung berdebar\n- Pusing atau terasa akan pingsan\n- Sesak napas\n- Nyeri dada\n- Lemas\n- Linglung\nSeperti yang telah dijelaskan, atrial flutter dan atrial fibrilasi memiliki gejala yang mirip. Terkadang, kedua kondisi tersebut bahkan bisa terjadi secara bersamaan.\n', 'Topik: Atrial Flutter, Subtopik: Pengertian Atrial Flutter \n Atrial flutter adalah gangguan irama jantung yang terjadi di serambi jantung (atrium), yaitu ruang jantung bagian atas. Kondisi ini ditandai dengan denyut jantung yang sangat cepat. Jika tidak tertangani, atrial flutter berisiko menimbulkan stroke.\nNormalnya, jantung berdenyut sebanyak 60  100 kali per menit saat tubuh dalam kondisi diam. Akan tetapi, pada atrial flutter, denyut jantung menjadi sangat cepat, yaitu sampai 150 kali per menit bahkan lebih.\n\nAtrial flutter adalah salah satu jenis gangguan irama jantung (aritmia). Atrial flutter memiliki gejala serupa dengan atrial fibrilasi, yang juga merupakan salah satu jenis aritmia, tetapi kedua kondisi tersebut sebenarnya berbeda.\nPada atrial fibrilasi, jantung berdenyut cepat dan iramanya sangat tidak beraturan. Sementara pada atrial flutter, irama jantung masih teratur meskipun denyutnya juga sangat cepat.\n', 'Topik: Atrial Flutter, Subtopik: Gejala Atrial Flutter: Kapan harus ke dokter \n Periksakan diri ke dokter jika mengalami jantung berdebar yang tidak membaik dengan beristirahat, sering terjadi, atau disertai gejala-gejala yang telah disebutkan di atas. Segera ke dokter jika jantung berdebar timbul pada Anda yang mengalami atau dalam pengobatan penyakit tiroid.\nJantung berdebar merupakan gejala dari berbagai penyakit jantung. Oleh karena itu, dokter akan memeriksa Anda untuk menentukan apakah gejala tersebut disebabkan oleh atrial flutter.\nSegera ke IGD rumah sakit terdekat jika jantung berdebar sampai menimbulkan nyeri dada, sesak napas, atau rasa seperti akan pingsan. Hal ini karena beberapa kondisi tersebut bisa menjadi tanda serangan jantung.\n']","Gejala atrial flutter yang paling umum termasuk:\n- Jantung berdebar, yaitu denyut jantung yang terlalu cepat dan tidak sebanding dengan ritme normal tubuh saat diam.\n- Pusing atau merasa akan pingsan, karena jalur elektrofisiologis di dalam jantung yang dipengaruhi oleh gangguan irama ini menjadi kompleks dan tidak stabil.\n- Sesak napas, yang dapat disebabkan oleh penyempitan arteri atau pembuluh darah yang menyusun serambi jantung akibat cepatnya denyut jantung.\n- Nyeri dada, termasuk rasa lemas dan gemetar, karena kompleksitas ritme jantung ini dapat mempengaruhi kerja jantung secara menyeluruh.\n- Linglung atau ketidaknyamanan di belakang tenggorokan, yang bisa disebabkan oleh pembuluh darah yang menumpuk akibat denyut jantung cepat ini.",0.36363636363636365,0.7432265329914401,0.8333333332916666,1.0
Apa saja gejala pada penyakit atrioventricular block derajat dua?,"Penderita AV block derajat ini dapat mengalami beberapa gejala berikut:\n\nDenyut jantung lambat atau terasa seperti tidak berdetak sesaat\nMudah lelah\nKepala terasa ringan seperti akan pingsan, atau kadang sampai pingsan\nNyeri dada\nMual\nNapas cepat dan pendek","['Topik: Atrioventricular Block, Subtopik: Gejala Atrioventricular Block: AV block derajat dua \n Pada AV block derajat dua, sinyal listrik jantung tidak mengalir konsisten sehingga aliran listrik kadang tidak mencapai ventrikel jantung seperti seharusnya. Hal ini menyebabkan jantung tidak berdenyut pada beberapa waktu.\nPenderita AV block derajat ini dapat mengalami beberapa gejala berikut:\n- Denyut jantung lambat atau terasa seperti tidak berdetak sesaat\n- Mudah lelah\n- Kepala terasa ringan seperti akan pingsan, atau kadang sampai pingsan\n- Nyeri dada\n- Mual\n- Napas cepat dan pendek\n', 'Topik: Atrioventricular Block, Subtopik: Gejala Atrioventricular Block: AV block derajat tiga \n AV block derajat tiga atau complete heart block menyebabkan sinyal listrik dari nodus AV tidak terkirim sama sekali ke ventrikel. AV block derajat tiga merupakan jenis yang paling parah dan dapat berakibat fatal. Pada jenis ini, penderitanya dapat mengalami gejala berikut:\n- Detak jantung sangat lambat\n- Nyeri dada\n- Pusing berputar, seperti melayang\n- Pingsan\n- Sesak napas\n', 'Topik: Atrioventricular Block, Subtopik: Gejala Atrioventricular Block: Kapan harus ke dokter \n Periksakan ke dokter jika denyut jantung Anda lebih lambat dari normal, terasa tidak teratur, atau jika mengalami gejala-gejala yang disebutkan di atas.\nAtrioventricular block merupakan kondisi yang bisa berakibat fatal. Segera ke IGD jika muncul keluhan berikut:\n- Kepala terasa sangat ringan seperti akan pingsan\n- Sesak napas\n- Nyeri dada\n- Detak jantung sangat cepat atau tidak beraturan\n- Linglung\n- Pingsan\n']","Gejala pada penyakit Atrioventricular Block (AVB) derajat dua, selain menyebabkan denyut jantung menjadi lebih lambat atau tidak mengalir secara konsisten, juga dapat melibatkan beberapa gejala berikut:\n\n1. Denyut jantung yang terasa lebih lambat atau seperti tidak ada denyut jantung untuk sesaat.\n2. Mudah lelah dan kelelahan, karena jantung kurang efisien dalam mengeluarkan darah.\n3. Kepala terasa ringan atau seolah-olah akan pingsan, yang dapat disertai perubahan mental atau emosi akibat penyebab denyut jantung kurang normal.\n4. Nyeri dada atau rasa sakit di belakang leher dan ginjal (sepanjang vertebrae).\n5. Mual, terutama saat mengalami gejala denyut jantung yang tidak normal.\n6. Napas yang cepat dan pendek, karena tubuh kurang mampu memenuhi oksigen mereka dengan cara yang sehat.\n7. Kehilangan konsentrasi atau keadaan mental yang tidak stabil saat gejala denyur jantung yang tidak normal terjadi.",0.47368421052631576,0.655717920252749,0.8333333332916666,1.0
Bagaimana pencegahan penyakit atrioventricular block?,"Atrioventricular block dapat dicegah dengan menjaga kesehatan jantung. Ada berbagai upaya yang dapat dilakukan untuk menjaga kesehatan jantung, seperti:\n\nTidak merokok dan menghindari paparan asap rokok\nMengonsumsi makanan bergizi dan bervariasi setiap harinya\nMenjaga berat badan agar tetap ideal\nBerolahraga secara rutin, setidaknya 5 hari dalam seminggu selama 30 menit\nMengelola stres dengan baik\nTidur setidaknya 7–9 jam per hari\nBerobat atau berkonsultasi dengan dokter secara rutin jika menderita penyakit lain atau memiliki faktor risiko atrioventrikular blok","['Topik: Atrioventricular Block, Subtopik: Pencegahan Atrioventricular Block \n Atrioventricular block dapat dicegah dengan menjaga kesehatan jantung. Ada berbagai upaya yang dapat dilakukan untuk menjaga kesehatan jantung, seperti:\n- Tidak merokok dan menghindari paparan asap rokok\n- Mengonsumsi makanan bergizi dan bervariasi setiap harinya\n- Menjaga berat badan agar tetap ideal\n- Berolahraga secara rutin, setidaknya 5 hari dalam seminggu selama 30 menit\n- Mengelola stres dengan baik\n- Tidur setidaknya 7  9 jam per hari\n- Berobat atau berkonsultasi dengan dokter secara rutin jika menderita penyakit lain atau memiliki faktor risiko atrioventrikular blok\n', 'Topik: Atrioventricular Block, Subtopik: Pengobatan Atrioventricular Block \n Metode pengobatan atrioventricular block tergantung pada penyebab dan derajat keparahan gejalanya. Umumnya, pengobatan hanya dilakukan apabila AV block menyebabkan gejala.\nPada pasien yang tidak mengalami gejala atau hanya mengalami gejala yang ringan, dokter akan meminta pasien untuk:\n- Menjalani kontrol rutin\n- Memeriksa denyut jantung secara berkala\n- Mewaspadai gejala AV block yang mungkin terjadi dan mengetahui langkah-langkah yang perlu dilakukan ketika gejala terjadi\nJika AV block sudah menimbulkan gejala yang mengganggu, dokter mungkin akan menyarankan Anda untuk memakai alat pacu jantung, yaitu alat kecil yang ditanamkan di bawah kulit area dada dan tersambung ke otot jantung. Alat ini akan mengirimkan sinyal listrik yang dapat membantu jantung berdetak dengan frekuensi dan ritme yang normal.\nSementara  jika AV block menimbulkan kondisi yang darurat, seperti henti jantung mendadak, dokter akan menstabilkan kondisi pasien terlebih dahulu dan memasang alat pacu jantung sementara jika diperlukan. Setelah itu, alat pacu jantung sementara pasien dapat diganti dengan yang permanen.\n', 'Topik: Atrioventricular Block, Subtopik: Penyebab dan Faktor Risiko Atrioventricular Block \n Atrioventricular block umumnya terjadi akibat kerusakan di jantung yang memengaruhi aliran listrik pada jantung. Namun, kondisi ini juga bisa terjadi dari lahir pada beberapa orang atau disebut juga dengan atrioventricular block congenital.\nAda beberapa kondisi yang dapat meningkatkan risiko terjadinya atrioventricular block, antara lain:\n- Usia lanjut, terutama 70 tahun ke atas\n- Serangan jantung\n- Kelainan pada struktur jantung, seperti kardiomiopati hipertrofi\n- Penyakit katup jantung\n- Kadar kalium tinggi (hiperkalemia)\n- Demam rematik\n- Kanker, termasuk limfoma\n- Hipertiroidisme\n- Tumor jantung\n- Tekanan darah tinggi (hipertensi)\n- Kadar gula darah tinggi (hiperglikemia)\n- Penggunaan obat-obatan tertentu, seperti penghambat beta, amiodarone, digoxin, verapamil, dan diltiazem\n- Operasi terbuka pada jantung\nSementara itu, AV block yang terjadi sejak lahir lebih berisiko dialami bayi dengan kondisi berikut:\n- Menderita kelainan jantung\n- Terlahir dari ibu yang menderita penyakit autoimun, seperti lupus atau sindrom Sj gren\n\n']","Pencegahan atrioventricular block (AVB) meliputi berbagai upaya kesehatan untuk mencegah terjadinya penyakit jantung dan gangguan aliran listrik di dalam jantung. Berikut beberapa cara praktis yang dapat dilakukan untuk menghindari AVB:\n\n1. Jaga kesehatan jantung: Konsultasikan rutin dengan dokter dan perawat mengenai gejala-gejala atau bahaya penyakit jantung, termasuk AVB. Mereka akan memberikan nasihat tentang bagaimana cara menjaga kesehatan jantung Anda agar lebih sehat dan aman dari berbagai masalah yang berkaitan dengan jantung.\n\n2. Hindarkan paparan asap rokok: Pernikahan rokok secara signifikan meningkatkan risiko terjadinya AVB karena asap rokok dapat merusak sel-sel hati dan menyebabkan gangguan aliran listrik di dalam jantung. Hindarkan paparan asin rokok baik dirumah maupun di tempat umum lainnya.\n\n3. Konsumsi makanan bergizi: Mengonsumsikan makanan yang sehat dan bergizi akan membantu mengurangi risiko penyakit jantung, termasuk AVB. Beragam jenis sayuran dan buah-buahan serta protein hewani dapat meningkatkan kualitas hidup Anda.\n\n4. Obesitas: Penurunan berat badan yang sehat juga bisa membantu mencegah terjadinya AVB, terutama bagi mereka yang mengalami obesitas atau kegemukan. Cara menurunkan berat badan secara sehat meliputi diet dan olahraga rutin.\n\n5. Olahraga setiap hari: Berolahraga secara teratur, minimal 30 menit per hari, akan membantu mengurangi risiko penyakit jantung termasuk AVB. Pilih olahraga yang disukai dan dapat dijalani setiap hari untuk menjaga kesehatan Anda.\n\n6. Manajemen stres: Stres yang berlebihan bisa mempengaruhi kondisi jantung, termasuk risiko terjadinya AVB. Jadikan praktik-praktikeren untuk mengelola stres dengan cara yang sehat dan efektif, seperti meditasi atau berolahraga.\n\n7. Tidur sesuai durasi: Setidaknya 7 hingga 9 jam tidur setiap malam juga penting untuk menjaga kondisi jantung Anda tetap baik, terutama dalam mengurangi risiko AVB.\n\n8. Penggunaan obat-obatan dengan bijak: Jika Anda memiliki penyakit jantung atau faktor risiko lainnya seperti hiperkalemia, demam rematik, kanker, dan gangguan ritme jantung lainnya, pastikan untuk mengikuti nasihat dokter dalam penggunaan obat-obatan.\n\nDengan menjalani cara praktis ini, Anda bisa meminimalkan risiko terjadinya atrioventricular block dan menjaga kesehatan jantung Anda tetap baik serta aman.",0.8846153846153846,0.7330673942550598,0.9999999999666667,1.0
Apa hal yang dapat menyebabkan penyakit jantung ringan?,"Penyebab serangan jantung ringan adalah berbagai penyakit atau kondisi yang menghambat aliran darah dari pembuluh darah arteri koroner menuju otot-otot jantung. Kondisi atau penyakit tersebut meliputi:\n\nAterosklerosis, yaitu penumpukan plak atau kolesterol pada dinding arteri koroner \nEmboli koroner, yakni penyumbatan pada pembuluh darah arteri jantung akibat gumpalan darah\nVasospasme, yaitu kontraksi pada pembuluh darah arteri koroner\nMiokarditis, yakni peradangan yang terjadi pada otot jantung\nCedera pada otot jantung, misalnya akibat kecelakaan\nKeracunan karbon monoksida","['Topik: Serangan Jantung Ringan, Subtopik: Pengertian Serangan Jantung Ringan \n Serangan jantung pada umumnya disebabkan oleh penyumbatan total pada pembuluh darah arteri koroner utama. Hal ini membuat pasokan darah ke otot-otot jantung terhenti dan menyebabkan kematian jaringan otot jantung yang luas.\n\nSerangan jantung ringan, atau disebut juga dengan NSTEMI, terjadi ketika pembuluh darah arteri koroner tersumbat sebagian sehingga mengurangi pasokan darah ke otot-otot jantung. Kondisi ini sama-sama menyebabkan kematian jaringan otot, tetapi tidak seluas serangan jantung pada umumnya.\nMeski demikian, semua jenis serangan jantung, termasuk serangan jantung ringan, perlu segera mendapatkan pertolongan medis. Hal ini penting untuk mencegah terjadinya komplikasi berupa kerusakan permanen pada jantung atau bahkan kematian. \n', 'Topik: Serangan Jantung Ringan, Subtopik: Pengertian Serangan Jantung Ringan \n Serangan jantung ringan adalah kondisi ketika pembuluh darah arteri koroner menyempit sehingga aliran darah ke otot jantung berkurang. Kondisi ini tidak menyebabkan kerusakan otot jantung yang separah serangan jantung umumnya. Namun, penanganan sedini mungkin tetap harus segera diberikan.\nSerangan jantung pada umumnya disebabkan oleh penyumbatan total pada pembuluh darah arteri koroner utama. Hal ini membuat pasokan darah ke otot-otot jantung terhenti dan menyebabkan kematian jaringan otot jantung yang luas.\n\nSerangan jantung ringan, atau disebut juga dengan NSTEMI, terjadi ketika pembuluh darah arteri koroner tersumbat sebagian sehingga mengurangi pasokan darah ke otot-otot jantung. Kondisi ini sama-sama menyebabkan kematian jaringan otot, tetapi tidak seluas serangan jantung pada umumnya.\nMeski demikian, semua jenis serangan jantung, termasuk serangan jantung ringan, perlu segera mendapatkan pertolongan medis. Hal ini penting untuk mencegah terjadinya komplikasi berupa kerusakan permanen pada jantung atau bahkan kematian. \n', 'Topik: Serangan Jantung Ringan, Subtopik: Faktor risiko serangan jantung ringan \n Serangan jantung ringan lebih banyak terjadi pada orang yang memiliki faktor-faktor di bawah ini:\n- Berusia lanjut (  45 tahun pada pria dan  50 tahun pada wanita)\n- Memiliki keluarga yang menderita penyakit jantung atau pernah mengalami serangan jantung ringan\n- Memiliki tekanan darah tinggi (hipertensi)\n- Mengalami obesitas\n- Memiliki kolesterol tinggi\n- Menderita diabetes\n- Merokok \n- Jarang berolahraga\n- Pernah mengalami preeklamsia, hipertensi saat hamil, atau diabetes gestasional\n\n- Menggunakan obat-obatan terlarang atau NAPZA\n']","Hal yang dapat menyebabkan penyakit jantung ringan, atau NSTEMI (Non-ST Elevation Myocardial Infarction), termasuk serangan jantung ringan secara umum, adalah pembuluh darah arteri koroner yang bermacet menyumbat sebagian. Hal ini mengurangi aliran darah ke otot jantung, menyebabkan kurangnya oksigen dan nutrisi untuk jaringan otot jantung.\n\nPenyebab utama serangan jantung ringan termasuk faktor risiko seperti usia yang lebih tua (> 45 tahun untuk laki-laki, > 50 tahun untuk wanita), kejadian penyakit jantung atau serangan jantung ringan di keluarga, tekanan darah tinggi, obesitas, kolesterol tinggi, diabetes, merokok, kurang bergairah, pengalaman hipertensi selama kehamilan, dan penggunaan obat-obatan terlarang atau NAPZA (Nonprescription and Abuse drugs).\n\nMeskipun serangan jantung ringan tidak menyebabkan kerusakan yang sebanding dengan serangan jantung umumnya, penanganan segera tetap diperlukan untuk mencegah komplikasi dan mengurangi risiko kematian.",0.8333333333333334,0.43644249700763943,0.99999999995,0.2857142857142857
Bagaimana prosedur operasi yang dilakukan pada penderita serangan jantung ringan?,Operasi bypass jantung merupakan prosedur untuk membuat pembuluh darah baru yang diambil dari pembuluh darah lain di tungkai atau dada sebagai jalur alternatif bagi aliran darah yang tersumbat. Tindakan bedah ini dapat dilakukan jika ada banyak pembuluh darah arteri jantung yang mengalami penyempitan. ,"['Topik: Serangan Jantung Ringan, Subtopik: Pengobatan Serangan Jantung Ringan: Operasi bypass jantung \n Operasi bypass jantung merupakan prosedur untuk membuat pembuluh darah baru yang diambil dari pembuluh darah lain di tungkai atau dada sebagai jalur alternatif bagi aliran darah yang tersumbat. Tindakan bedah ini dapat dilakukan jika ada banyak pembuluh darah arteri jantung yang mengalami penyempitan. \nPerlu diketahui bahwa pasien yang pernah mengalami serangan jantung ringan bisa mengalami lagi kondisi ini pada masa yang akan datang. Untuk mencegahnya, dokter biasanya akan meminta pasien untuk menjalani pemeriksaan lanjutan atau rehabilitasi jantung setelah pengobatan utama di atas. \n', 'Topik: Serangan Jantung Ringan, Subtopik: Pengobatan Serangan Jantung Ringan: Percutaneous coronary intervention  \n Percutaneous coronary intervention (PCI) adalah prosedur kateterisasi jantung yang dilakukan untuk memasang ring pada pembuluh darah arteri jantung yang tersumbat. Dengan demikian, aliran darah ke otot jantung kembali lancar dan pembuluh darah akan tetap terbuka.\n', 'Topik: Serangan Jantung Ringan, Subtopik: Pengertian Serangan Jantung Ringan \n Serangan jantung ringan adalah kondisi ketika pembuluh darah arteri koroner menyempit sehingga aliran darah ke otot jantung berkurang. Kondisi ini tidak menyebabkan kerusakan otot jantung yang separah serangan jantung umumnya. Namun, penanganan sedini mungkin tetap harus segera diberikan.\nSerangan jantung pada umumnya disebabkan oleh penyumbatan total pada pembuluh darah arteri koroner utama. Hal ini membuat pasokan darah ke otot-otot jantung terhenti dan menyebabkan kematian jaringan otot jantung yang luas.\n\nSerangan jantung ringan, atau disebut juga dengan NSTEMI, terjadi ketika pembuluh darah arteri koroner tersumbat sebagian sehingga mengurangi pasokan darah ke otot-otot jantung. Kondisi ini sama-sama menyebabkan kematian jaringan otot, tetapi tidak seluas serangan jantung pada umumnya.\nMeski demikian, semua jenis serangan jantung, termasuk serangan jantung ringan, perlu segera mendapatkan pertolongan medis. Hal ini penting untuk mencegah terjadinya komplikasi berupa kerusakan permanen pada jantung atau bahkan kematian. \n']","Penderita serangan jantung ringan (NSTEMI) umumnya mengalami prosedur operasi percutaneous coronary intervention (PCI), yaitu metode kateterisasi jantung melalui pergelangan dan/atau leher jantung. Prosedur ini dilakukan dengan cara menembus bagian dada atau leher untuk menggantungkan cincin pengelir (stent) di dalam pembuluh darah arteri jantung yang tersumbat, sehingga aliran darah ke otot jantung kembali normal dan menjaga terbuka jalur pernapasan.\n\nProsedur ini dimulai dengan melakukan pembedahan di bagian dada atau leher untuk mendapatkan akses ke arteri jantung, lalu memasang kateter ke dalam arteri jantung. Kemudian, dokter menembus dan melewati arteri jantung sambil menggunakan tomografi kontras (angiogram) untuk melihat secara visual apakah ada bagian dari pembuluh darah yang tersumbat.\n\nSetelah itu, dokter akan menempatkan cincin pengelir atau stent di dalam arteri jantung yang tersumbat untuk memperkuat dan membuka jalur pernapasan aliran darah ke otot jantung. Prosedur ini biasanya dilakukan dengan operasi sternotomi (pembedahan tradisional) atau sternotomi melalui sisik (minimally invasive cardiac surgery).\n\nProses pasca-operasi, pasien akan dijaga untuk memastikan bahwa aliran darah dan fungsi jantung tetap normal. Pasien mungkin diserang sanksi berat seperti pilek atau sindrom pernapasan obat yang bisa menyebabkan adanya masalah pada proses penggantungan otot jantung, dan ini memerlukan penanganan medis lanjutan.\n\nDokter akan menyarankan pasien untuk mengikuti program rehabilitasi jantung setelah operasi, yang meliputi latihan fisik teratur, diet hedonik, dan pengendalian tekanan darah dan berat badan agar tetap sehat.",0.3888888888888889,0.4524118459069785,0.9999999999,1.0
Bagaimana contoh stres emosional yang dialami oleh penderita broken heart syndrome?,"Berduka akibat kehilangan orang terdekat\nMengalami perceraian\nTerjerat hutang, misalnya karena kecanduan judi online\nDidiagnosis terkena penyakit serius\nMenjadi korban tindakan kriminal\nMengalami bullying  ","['Topik: Broken Heart Syndrome, Subtopik: Penyebab Broken Heart Syndrome: Stres pada mental \n Umumnya, broken heart syndrome dipicu oleh stres emosional yang berat, misalnya akibat kondisi berikut:\n- Berduka akibat kehilangan orang terdekat\n- Mengalami perceraian\n- Terjerat hutang, misalnya karena kecanduan judi online\n\n- Didiagnosis terkena penyakit serius\n- Menjadi korban tindakan kriminal\n- Mengalami bullying  \n\n', 'Topik: Broken Heart Syndrome, Subtopik: Penyebab Broken Heart Syndrome \n Broken heart syndrome diketahui dapat muncul ketika seseorang mengalami stres yang ekstrem, baik pada mental maupun fisiknya. \nStres akan membuat tubuh memproduksi hormon adrenalin atau kortisol. Bila kadarnya terlalu tinggi, kedua hormon stres tersebut dapat membuat jantung bekerja sangat keras hingga akhirnya otot-otot jantung melemah.\nBerikut ini adalah contoh-contoh stres pada mental dan fisik yang dapat menyebabkan broken heart syndrome:\n', 'Topik: Broken Heart Syndrome, Subtopik: Pengertian Broken Heart Syndrome \n Broken heart syndrome adalah masalah jantung yang terjadi akibat stres atau sakit fisik. Kondisi ini membuat jantung kurang mampu memompa darah dengan maksimal sehingga memunculkan gejala mirip serangan jantung. Meski begitu, broken heart syndrome umumnya hanya bersifat sementara.\nBilik kiri adalah bagian jantung yang berperan untuk memompa darah. Pada broken heart syndrome, bagian atas bilik kiri jantung menyempit dan bagian bawahnya melebar sehingga menyerupai perangkap gurita, yang di Jepang disebut dengan takotsubo. Oleh karena itu, kondisi ini  juga dikenal dengan istilah Takotsubo syndrome.\n\nGangguan pada fungsi bilik kiri jantung ini membuat otot jantung melemah sehingga tidak bisa memompa darah secara maksimal. Akibatnya, suplai darah dan oksigen untuk tubuh berkurang, termasuk ke jantung itu sendiri. Hal ini memunculkan keluhan nyeri dada dan sesak yang mirip dengan serangan jantung.\nBroken heart syndrome umumnya dipicu oleh stres emosional yang berat, tetapi juga bisa muncul saat sakit berat atau operasi besar. Broken heart syndrome umumnya akan membaik dalam 1  4 minggu, tetapi bisa kambuh bahkan memicu masalah jantung yang serius bila tidak ditangani dengan baik. \n']","Contoh stres emosional yang dialami oleh penderita broken heart syndrome meliputi:\n\n1. Berduka akibat kehilangan orang terdekat, seperti mati suci atau meninggal dunia dewasa.\n2. Mengalami perceraian dan merasa korban ketidaksejahteraan dalam hubungan yang telah berakhir.\n3. Terjerat hutang akibat kecanduan judi online, menyebabkan ketidakmampuan untuk memenuhi kewajiban keuangan dan merasakan stres ekstrim.\n4. Mengalami gangguan psikososial sebagai korban tindakan kriminal atau bullying, yang dapat meninggalkan penderita merasa tertekan dan gugup.\n5. Menjadi korban sakit berat atau operasi besar, menyebabkan stres emosional tinggi akibat pemeliharaan medis dan ketidaknyamanan fisik yang ditimbulkan.",0.7,0.7797365502420351,0.9999999999666667,1.0
Pada situasi apa penderita broken heart syndrome perlu dibawa ke IGD?,"Segera cari pertolongan ke IGD bila nyeri dada tidak membaik setelah 5 menit atau setelah beristirahat dan minum obat. Melalui pemeriksaan, dokter akan memastikan apakah kondisi pasien disebabkan oleh broken heart syndrome atau serangan jantung sehingga penanganan yang diberikan pun tepat.","['Topik: Broken Heart Syndrome, Subtopik: Gejala Broken Heart Syndrome : Kapan harus ke dokter  \n Broken heart syndrome umumnya dapat mereda setelah kondisi emosional pasien stabil. Namun, jangan menunda untuk berkonsultasi ke dokter bila Anda sering mengalami nyeri dada atau sesak napas setiap kali merasa stres.\nGuna memastikan penyebabnya, Anda bisa berkonsultasi secara online. Selain bisa dilakukan dari rumah, konsultasi online akan menyediakan jawaban yang lebih cepat. \nSegera cari pertolongan ke IGD bila nyeri dada tidak membaik setelah 5 menit atau setelah beristirahat dan minum obat. Melalui pemeriksaan, dokter akan memastikan apakah kondisi pasien disebabkan oleh broken heart syndrome atau serangan jantung sehingga penanganan yang diberikan pun tepat.\n', 'Topik: Broken Heart Syndrome, Subtopik: Pengertian Broken Heart Syndrome \n Broken heart syndrome adalah masalah jantung yang terjadi akibat stres atau sakit fisik. Kondisi ini membuat jantung kurang mampu memompa darah dengan maksimal sehingga memunculkan gejala mirip serangan jantung. Meski begitu, broken heart syndrome umumnya hanya bersifat sementara.\nBilik kiri adalah bagian jantung yang berperan untuk memompa darah. Pada broken heart syndrome, bagian atas bilik kiri jantung menyempit dan bagian bawahnya melebar sehingga menyerupai perangkap gurita, yang di Jepang disebut dengan takotsubo. Oleh karena itu, kondisi ini  juga dikenal dengan istilah Takotsubo syndrome.\n\nGangguan pada fungsi bilik kiri jantung ini membuat otot jantung melemah sehingga tidak bisa memompa darah secara maksimal. Akibatnya, suplai darah dan oksigen untuk tubuh berkurang, termasuk ke jantung itu sendiri. Hal ini memunculkan keluhan nyeri dada dan sesak yang mirip dengan serangan jantung.\nBroken heart syndrome umumnya dipicu oleh stres emosional yang berat, tetapi juga bisa muncul saat sakit berat atau operasi besar. Broken heart syndrome umumnya akan membaik dalam 1  4 minggu, tetapi bisa kambuh bahkan memicu masalah jantung yang serius bila tidak ditangani dengan baik. \n', 'Topik: Broken Heart Syndrome, Subtopik: Pengertian Broken Heart Syndrome \n Bilik kiri adalah bagian jantung yang berperan untuk memompa darah. Pada broken heart syndrome, bagian atas bilik kiri jantung menyempit dan bagian bawahnya melebar sehingga menyerupai perangkap gurita, yang di Jepang disebut dengan takotsubo. Oleh karena itu, kondisi ini  juga dikenal dengan istilah Takotsubo syndrome.\n\nGangguan pada fungsi bilik kiri jantung ini membuat otot jantung melemah sehingga tidak bisa memompa darah secara maksimal. Akibatnya, suplai darah dan oksigen untuk tubuh berkurang, termasuk ke jantung itu sendiri. Hal ini memunculkan keluhan nyeri dada dan sesak yang mirip dengan serangan jantung.\nBroken heart syndrome umumnya dipicu oleh stres emosional yang berat, tetapi juga bisa muncul saat sakit berat atau operasi besar. Broken heart syndrome umumnya akan membaik dalam 1  4 minggu, tetapi bisa kambuh bahkan memicu masalah jantung yang serius bila tidak ditangani dengan baik. \n']","Penderita Broken Heart Syndrome harus segera berkonsultasi dengan dokter atau mengunjungi IGD (Institut Gigi dan Darah) ketika mengalami nyeri dada atau sesak napas setelah beristirahat selama 5 menit, terlepas dari apakah kondisi ini disebabkan oleh Broken Heart Syndrome atau tidak. Hal ini penting untuk memastikan penyebab nyeri dan mencegahnya bisa merugikan jangka panjang tubuh.",0.6666666666666666,0.46304459954591914,0.9999999999666667,1.0
