question,ground_truth,retrieved_contexts,answer,faithfulness,answer_relevancy,context_precision,context_recall
Apa hal-hal yang dapat menyebabkan penyakit hipertensi?,"Hipertensi sekunder bisa disebabkan oleh sejumlah kondisi, yaitu:\n\nPenyakit ginjal\nPenyakit kelenjar tiroid\nTumor kelenjar adrenal\nKelainan bawaan pada pembuluh darah\nKecanduan alkohol\nPenyalahgunaan NAPZA\nGangguan pernapasan yang terjadi saat tidur (sleep apnea)\nKonsumsi obat-obatan tertentu, seperti obat antiinflamasi nonsteroid (NSAID), obat batuk pilek, atau pil KB","['Topik: Hipertensi, Subtopik: Penyebab Hipertensi: Faktor Risiko Hipertensi \n Ada beberapa faktor yang bisa meningkatkan risiko seseorang terserang hipertensi, yaitu:\n- Berusia di atas 65 tahun\n- Sedang hamil\n- Jarang berolahraga dan jarang melakukan aktivitas fisik\n- Kurang mengonsumsi makanan yang mengandung kalium\n- Memiliki keluarga dengan riwayat tekanan darah tinggi\n- Menderita obesitas, sleep apnea, diabetes, atau penyakit ginjal\n- Mengonsumsi terlalu banyak makanan tinggi garam\n- Mengonsumsi terlalu banyak kafein\n- Memiliki kebiasaan merokok dan mengonsumsi minuman beralkohol\n', 'Topik: Hipertensi, Subtopik: Pengertian Hipertensi \n Hipertensi atau darah tinggi adalah kondisi ketika tekanan darah berada pada angka 130/80 mmHg atau lebih. Jika tidak segera ditangani, hipertensi bisa menyebabkan komplikasi serius, seperti gagal jantung, penyakit ginjal, hingga stroke.\nTekanan darah dinyatakan dalam dua nilai angka yang dipisahkan dengan garis miring atau yang biasanya disebut  per  . Angka di awal, yaitu di sebelah kiri garis miring menandakan tekanan sistolik. Ini adalah tekanan di dalam pembuluh darah ketika jantung berkontraksi untuk memompa darah keluar dari jantung.\n\nAngka di akhir yang berada setelah garis miring menandakan tekanan diastolik, yaitu tekanan darah saat jantung berelaksasi dan menyedot atau menerima darah masuk kembali ke dalam jantung.\nPada kondisi normal, tekanan darah orang dewasa adalah 120/80 mmHg. Artinya, tekanan sistoliknya adalah 120 mmHg dan diastoliknya 80 mmHG.\nTekanan darah tinggi yang terjadi terus-menerus dapat membuat jantung bekerja lebih keras untuk memompa darah ke seluruh tubuh. Kondisi ini lama-kelamaan bisa membuat jantung membesar, merusak pembuluh darah, dan membuat ginjal tidak bisa bekerja dengan baik.\nOleh karena itu, hipertensi perlu segera ditangani. Setelah tekanan darah kembali normal pun, perlu terus dilakukan pemantauan dan bahkan penggunaan obat rutin agar tekanan darah selalu terkontrol.\n', 'Topik: Hipertensi, Subtopik: Komplikasi Hipertensi \n Tekanan darah tinggi bisa merusak pembuluh darah dan organ-organ lain di dalam tubuh. Jika tidak segera diobati, tekanan darah tinggi bisa menimbulkan penyakit serius, seperti:\n- Gangguan penglihatan hingga kebutaan akibat retinopati hipertensi\n\n- Sindrom metabolik\n- Penyakit ginjal\n- Penyakit arteri perifer\n- Penyakit jantung (hypertensive heart disease)\n- Serangan jantung\n- Gagal jantung atau jantung lemah\n\n- Demensia vaskular\n- Aneurisma otak\n- Stroke\nHipertensi yang tidak terkontrol dengan baik berisiko menjadi krisis hipertensi. Kondisi ini berbahaya dan memerlukan penanganan segera di IGD.\n']","Hal-hal yang dapat menyebabkan penyakit hipertensi meliputi faktor risiko seperti usia di atas 65 tahun, berusia siaga hamil, jarang berolahraga dan melakukan aktivitas fisik, kurang mengonsumsi makanan yang mengandung kalium, memiliki keluarga dengan riwayat tekanan darah tinggi, menderita obesitas, sleep apnea, diabetes, atau penyakit ginjal, mengonsumsi terlalu banyak makanan tinggi garam, mengonsumsi terlalu banyak kafein, memiliki kebiasaan meroket dan mengonsumsi minuman beralkohol.",0.9230769230769231,0.569798010251494,0.0,0.0
Apa saja gejala hipertensi?,Gejala yang dapat muncul pada kondisi tersebut adalah:\n\nMual dan muntah\nSakit kepala\nMimisan\nSesak napas\nNyeri dada\nGangguan penglihatan\nTelinga berdenging\nGangguan irama jantung\nDarah dalam urine,"['Topik: Hipertensi, Subtopik: Gejala Hipertensi \n Hipertensi merupakan penyakit yang berbahaya, karena bisa terjadi tanpa gejala. Bahkan, pada beberapa kasus, gejalanya baru muncul setelah hipertensi makin parah dan sampai mengancam nyawa. Gejala yang dapat muncul pada kondisi tersebut adalah:\n- Mual dan muntah\n- Sakit kepala\n- Mimisan\n- Sesak napas\n- Nyeri dada\n- Gangguan penglihatan\n- Telinga berdenging\n- Gangguan irama jantung\n- Darah dalam urine\n', 'Topik: Hipertensi, Subtopik: Gejala Hipertensi: Kapan Harus ke Dokter \n Pada beberapa kasus, hipertensi dapat menjadi kondisi gawat darurat yang membutuhkan penanganan dengan segera. Hal ini terjadi ketika tekanan darah naik dengan cepat dan terlalu tinggi.\nSegera ke dokter jika tekanan darah Anda telah mencapai angka 180/120 atau lebih. Anda juga perlu segera ke dokter jika mengalami gejala yang dapat menjadi pertanda kerusakan organ, yaitu:\n- Sesak napas\n- Nyeri dada\n- Sulit berbicara\n- Sakit kepala yang parah\n- Mati rasa\n- Lemas\n- Gangguan penglihatan\n', 'Topik: Hipertensi, Subtopik: Pengertian Hipertensi \n Hipertensi atau darah tinggi adalah kondisi ketika tekanan darah berada pada angka 130/80 mmHg atau lebih. Jika tidak segera ditangani, hipertensi bisa menyebabkan komplikasi serius, seperti gagal jantung, penyakit ginjal, hingga stroke.\nTekanan darah dinyatakan dalam dua nilai angka yang dipisahkan dengan garis miring atau yang biasanya disebut  per  . Angka di awal, yaitu di sebelah kiri garis miring menandakan tekanan sistolik. Ini adalah tekanan di dalam pembuluh darah ketika jantung berkontraksi untuk memompa darah keluar dari jantung.\n\nAngka di akhir yang berada setelah garis miring menandakan tekanan diastolik, yaitu tekanan darah saat jantung berelaksasi dan menyedot atau menerima darah masuk kembali ke dalam jantung.\nPada kondisi normal, tekanan darah orang dewasa adalah 120/80 mmHg. Artinya, tekanan sistoliknya adalah 120 mmHg dan diastoliknya 80 mmHG.\nTekanan darah tinggi yang terjadi terus-menerus dapat membuat jantung bekerja lebih keras untuk memompa darah ke seluruh tubuh. Kondisi ini lama-kelamaan bisa membuat jantung membesar, merusak pembuluh darah, dan membuat ginjal tidak bisa bekerja dengan baik.\nOleh karena itu, hipertensi perlu segera ditangani. Setelah tekanan darah kembali normal pun, perlu terus dilakukan pemantauan dan bahkan penggunaan obat rutin agar tekanan darah selalu terkontrol.\n']","Gejala hipertensi, berdasarkan konteks yang diberikan, meliputi:\n\n1. Mual dan muntah (pada beberapa kasus)\n2. Sakit kepala\n3. Mimisan\n4. Sesak napas (sebagai gejala paling signifikan yang memerlukan perawatan medis)\n5. Nyeri dada\n6. Gangguan penglihatan, seperti gangguan visus atau berkurangnya daya tahan mata terhadap gelap dan cahaya (mungkin menandai tekanan darah yang tinggi)\n7. Telinga berdenging\n8. Gangguan irama jantung\n9. Darah dalam urine\n10. Gejala lain, seperti penurunan daya tahan dan keguguran (pada beberapa kasus).",0.8,0.4761412069767008,0.9999999999,1.0
Bagaimana cara mencegah hipertensi?,"Beberapa cara efektif yang dapat dilakukan adalah:\n\nPertahankan berat badan ideal.\nLakukan olahraga secara rutin minimal 30 menit setiap hari.\nCukupi waktu tidur dan istirahat.\nKelola stres dengan baik.\nKonsumsi makanan rendah lemak dan kaya serat, seperti buah dan sayuran.\nBatasi konsumsi garam atau micin dalam makanan, tidak lebih dari satu sendok teh per hari.\nHindari konsumsi minuman beralkohol.\nBatasi konsumsi minuman berkafein.\nHentikan kebiasaan merokok.\nLakukan pemeriksaan kesehatan dan skrining hipertensi secara rutin.","['Topik: Hipertensi, Subtopik: Pencegahan Hipertensi \n Cara mencegah hipertensi adalah dengan menghindari faktor yang dapat meningkatkan risiko terserang penyakit ini. Beberapa cara efektif yang dapat dilakukan adalah:\n- Pertahankan berat badan ideal.\n- Lakukan olahraga secara rutin minimal 30 menit setiap hari.\n- Cukupi waktu tidur dan istirahat.\n- Kelola stres dengan baik.\n- Konsumsi makanan rendah lemak dan kaya serat, seperti buah dan sayuran.\n- Batasi konsumsi garam atau micin dalam makanan, tidak lebih dari satu sendok teh per hari.\n- Hindari konsumsi minuman beralkohol.\n- Batasi konsumsi minuman berkafein.\n- Hentikan kebiasaan merokok.\n- Lakukan pemeriksaan kesehatan dan skrining hipertensi secara rutin.\nDeteksi dini hipertensi dapat dilakukan dengan melakukan pemeriksaan tekanan darah secara mandiri dengan menggunakan tensimeter yang tepat. Selain itu, konsultasikan dengan dokter mengenai pemilihan tensimeter yang tepat untuk di rumah.\n', 'Topik: Hipertensi, Subtopik: Pengertian Hipertensi \n Hipertensi atau darah tinggi adalah kondisi ketika tekanan darah berada pada angka 130/80 mmHg atau lebih. Jika tidak segera ditangani, hipertensi bisa menyebabkan komplikasi serius, seperti gagal jantung, penyakit ginjal, hingga stroke.\nTekanan darah dinyatakan dalam dua nilai angka yang dipisahkan dengan garis miring atau yang biasanya disebut  per  . Angka di awal, yaitu di sebelah kiri garis miring menandakan tekanan sistolik. Ini adalah tekanan di dalam pembuluh darah ketika jantung berkontraksi untuk memompa darah keluar dari jantung.\n\nAngka di akhir yang berada setelah garis miring menandakan tekanan diastolik, yaitu tekanan darah saat jantung berelaksasi dan menyedot atau menerima darah masuk kembali ke dalam jantung.\nPada kondisi normal, tekanan darah orang dewasa adalah 120/80 mmHg. Artinya, tekanan sistoliknya adalah 120 mmHg dan diastoliknya 80 mmHG.\nTekanan darah tinggi yang terjadi terus-menerus dapat membuat jantung bekerja lebih keras untuk memompa darah ke seluruh tubuh. Kondisi ini lama-kelamaan bisa membuat jantung membesar, merusak pembuluh darah, dan membuat ginjal tidak bisa bekerja dengan baik.\nOleh karena itu, hipertensi perlu segera ditangani. Setelah tekanan darah kembali normal pun, perlu terus dilakukan pemantauan dan bahkan penggunaan obat rutin agar tekanan darah selalu terkontrol.\n', 'Topik: Hipertensi, Subtopik: Pengobatan Hipertensi: Perubahan gaya hidup \n Mengubah gaya hidup menjadi lebih sehat bisa menurunkan tekanan darah dalam beberapa minggu. Biasanya, dokter akan menyarankan perubahan gaya hidup tanpa perlu konsumsi obat jika risiko pasien terserang komplikasi rendah.\nGaya hidup sehat yang dijalani adalah:\n- Mengonsumsi lebih banyak buah-buahan dan sayur-sayuran\n- Mengurangi konsumsi garam, yaitu maksimal sebanyak satu sendok teh per hari\n- Memperbanyak aktivitas fisik dan rutin berolahraga\n- Menurunkan berat badan berlebih dan menjaga berat badan ideal\n- Menghentikan kebiasaan merokok\n- Menghindari atau mengurangi konsumsi minuman beralkohol\n- Mengurangi konsumsi minuman berkafein, seperti kopi, teh, atau soda\n- Melakukan terapi relaksasi untuk mengelola stres, seperti yoga atau meditasi\n']","Untuk mencegah hipertensi, ada beberapa cara efektif yang bisa dilakukan, termasuk:\n\n1. Menjaga berat badan ideal: Pastikan berat badar anda tidak terlalu tinggi atau rendah agar tekanan darah tetap stabil.\n2. Melakukan olahraga secara rutin minimal 30 menit setiap hari: Berolahraga seperti jogging, bersepeda, atau berenang bisa membantu mengurangi risiko terkena hipertensi.\n3. Mengatur waktu tidur dan istirahat: Menjaga pola tidur yang baik dan selalu memberikan diri sendiri waktu istirahat untuk menghindari stres.\n4. Mengelola stres dengan baik: Cara mengelolanya bisa berbeda-beda, tergantung pada individu, tetapi solusinya adalah menyelesaikan masalah yang membuat anda tertekan secara nyata dan tidak hanya merasa cemas saja.\n5. Mengkonsumsi makanan sehat: Berikan diri sendiri lebih banyak buah-buahan, sayuran, protein hewani, serta olahan makanan rendah lemak untuk tetap sehat.\n6. Batasi konsumsi garam atau micin: Jangan lupa bahwa tidak lebih dari satu sendok teh per hari saja agar cemas tekanan darah naik turun bisa terkendali.\n7. Hindari paparan debu beracun dan polusi udara yang kotor: Mengelilingi diri anda dengan lingkungan yang sehat untuk menjaga alangkah baik badan anda mungkin.",0.5,0.6056091952861017,0.8333333332916666,1.0
Apa penyebab umum seseorang terkena penyakit jantung?,"Secara umum, penyakit jantung dapat diakibatkan oleh kondisi berikut:\n\nPenumpukan lemak di dalam pembuluh darah koroner (aterosklerosis)\nTekanan darah tinggi (hipertensi)\nDiabetes tidak terkontrol\nInfeksi","['Topik: Penyakit Jantung, Subtopik: Penyebab Penyakit Jantung: Penyakit Jantung Koroner \n Penyakit jantung koroner merupakan jenis penyakit jantung yang paling sering terjadi. Kondisi ini muncul ketika pembuluh darah jantung menyempit atau tersumbat. Akibatnya, jantung kekurangan darah yang kaya oksigen dan nutrisi.\nPenyakit jantung koroner umumnya disebabkan oleh aterosklerosis, yaitu penyempitan pembuluh darah akibat penumpukan lemak (kolesterol) dan kalsium. Kondisi ini juga bisa menyebabkan pembuluh darah menjadi lebih kaku, sehingga membuat aliran darah jantung tidak lancar.\nAda beberapa kondisi atau faktor yang bisa meningkatkan risiko seseorang untuk terkena penyakit jantung koroner, di antaranya:\n- Hipertensi\n- Tingginya kadar kolesterol dalam darah (hiperkolesterolemia)\n- Kebiasaan merokok\n- Diabetes\n- Obesitas\n- Jarang olahraga\n- Kebiasaan sering mengonsumsi minuman beralkohol berlebihan\n', 'Topik: Penyakit Jantung, Subtopik: Penyebab Penyakit Jantung: Faktor Risiko Penyakit Jantung \n Penyakit jantung lebih berisiko terjadi pada orang dengan faktor-faktor berikut:\n- Rokok\nKandungan nikotin dan karbonmonoksida di dalam asap rokok dapat merusak lapisan dalam jantung dan menyempitkan pembuluh darah. Oleh sebab itu, serangan jantung lebih sering terjadi pada perokok.\n- Riwayat keluarga\nRisiko terserang penyakit jantung cukup tinggi jika memiliki memiliki ayah atau saudara laki-laki yang terkena penyakit jantung sebelum usia 55 tahun. Risiko yang sama juga bisa dialami jika memiliki ibu atau saudara perempuan yang menderita penyakit jantung sebelum usia 65 tahun\n- Pola makan buruk\nKonsumsi makanan tinggi lemak, gula, garam, dan kolesterol, bisa meningkatkan risiko penyakit jantung.\n- Hipertensi\nTekanan darah tinggi yang tidak terkendali dapat membuat pembuluh darah menebal sehingga mempersempit aliran darah.\n- Kadar kolesterol tinggi\nKolesterol tinggi dan trigliserida yang berlebihan dapat membentuk timbunan plak di pembuluh darah. Hal ini kemudian dapat meningkatkan risiko terjadinya aterosklerosis.\n- Diabetes\nDiabetes yang tidak terkontrol dapat menimbulkan komplikasi pada pembuluh darah sehingga mengakibatkan penyakit jantung koroner.\n- Kurang menjaga kebersihan diri\nTidak rutin mencuci tangan atau menyikat gigi dapat membuat bakteri dan virus masuk ke dalam tubuh dan memicu infeksi jantung.\n- Usia\nBertambahnya usia dapat meningkatkan risiko otot jantung melemah dan menebal. Pertambahan usia juga menyebabkan pembuluh darah menjadi lebih kaku sehingga tekanan darah lebih tinggi.\n- Jenis kelamin\nPria lebih berisiko terserang penyakit jantung daripada wanita. Namun, risiko penyakit jantung akan meningkat pada wanita setelah masa menopause.\nSelain sejumlah faktor di atas, kurang berolahraga, stres berat, dan mengalami obesitas juga bisa meningkatkan risiko penyakit jantung.\n', 'Topik: Penyakit Jantung, Subtopik: Penyebab Penyakit Jantung \n Penyebab penyakit jantung sangat bervariasi, mulai dari masalah pada pembuluh darah jantung, irama jantung, hingga kelainan lahir. Berikut adalah penyebab penyakit jantung berdasarkan jenisnya:\n']","Penyebab umum seseorang terkena penyakit jantung meliputi faktor genetik, perilaku, dan komplikasi medis lainnya. Faktor ini mencakup:\n\n1. Aterosklerosis: Pembuluh darah yang menjadi lebih keras dan berderet (plaque) akibat penumpukan lemak, kolesterol, dan kalcium dalam pembuluh darah jantung dapat menyebabkan penyempitan atau sumbatan.\n2. Hipertensi: Tekanan darah tinggi yang tidak terkendali selama bertahun-tahun dapat merusak pembuluh darah jantung dan meningkatkan risiko terjadinya penyakit jantung koroner.\n3. Diabetes: Penyakit jangka panjang yang tidak terkendali, termasuk diabetes, dapat menyebabkan kerusakan pada pembuluh darah dan meningkatkan risiko penyakit jantung.\n4. Kolesterol tinggi: Kadar kolesterol dalam darah yang berlebih dapat membentuk lemak akumulasi di pembuluh darah, menyebabkan mereka menjadi keras dan mengurangi aliran darah.\n5. Obesitas: Keadaan obesitas, terutama dalam bentuk yang tidak sehat dengan tingkat lipid tubuh yang tinggi, juga bisa mempengaruhi risiko penyakit jantung.\n6. Merokok: Asap rokok mengandung berbagai zat toksik dan nikotin yang dapat merusak jaringan dalam hati, pembuluh darah jantung, dan meningkatkan tekanan darah.\n7. Keracunan timbal: Paparan timbal tinggi secara teratur bisa menyebabkan kerusakan hati, yang kemudian dapat mempengaruhi fungsi jantung.\n8. Stres berat: Tidak hanya merugikan pikiran dan penampilan, stres juga dapat meningkatkan tekanan darah dan mengurangi sistem imun tubuh yang normal.\n9. Kadar gula darah tak terkendali: Diabetes melitus atau kebiasaan makan berlebih dapat menyebabkan peningkatan kadar gula darah, sehingga meningkat risiko penyakit jantung.\n10. Obat-obatan dan substansi psikotropik: Pemberian obat atau penggunaan bahan kimia lainnya yang mengandung racun dapat mempengaruhi fungsi jantung, terutama pada mereka yang menderita penyakit jantung.\n11. Usia: Sebagai orang lebih tua, risiko terkena penyakit jantung meningkat karena kurangnya otot jantung dan pembuluh darah yang lebih keras.\n12. Jenis kelamin: Wanita lebih cenderung mengalami masalah jantung setelah menopause, saat produksi hormon suramen berhenti secara drastis.\nSelain faktor-faktor ini, risiko penyakit jantung juga dapat dipengaruhi oleh pola hidup sehat dan pemenuhan kebutuhan asuransi kesehatan yang lengkap.",0.5135135135135135,0.5797994960437439,0.9999999999666667,0.8
Bagaimana pola hidup yang benar untuk menyembuhkan penyakit jantung?,Menjalani pola hidup sehat dapat mencegah perburukan penyakit jantung. Beberapa cara yang dapat dilakukan adalah:\n\nBerhenti merokok\nBerolahraga ringan 30 menit sehari\nMengonsumsi makanan rendah lemak dan rendah garam\nMembatasi konsumsi minuman beralkohol,"['Topik: Penyakit Jantung, Subtopik: Pengobatan Penyakit Jantung: Perbaikan Gaya Hidup \n Menjalani pola hidup sehat dapat mencegah perburukan penyakit jantung. Beberapa cara yang dapat dilakukan adalah:\n- Berhenti merokok\n- Berolahraga ringan 30 menit sehari\n- Mengonsumsi makanan rendah lemak dan rendah garam\n- Membatasi konsumsi minuman beralkohol\n', 'Topik: Penyakit Jantung, Subtopik: Pengobatan Penyakit Jantung \n Pengobatan penyakit jantung tergantung pada jenis penyakitnya. Sebagai contoh, dokter akan meresepkan antibiotik guna mengatasi penyakit jantung akibat infeksi. Sementara untuk mengatasi penyakit jantung koroner, dokter akan meresepkan obat-obatan dan menyarankan pasien mengubah gaya hidup menjadi lebih sehat.\nPada umumnya, metode pengobatan penyakit jantung meliputi:\n', 'Topik: Penyakit Jantung, Subtopik: Pengertian Penyakit Jantung \n Penyakit jantung adalah kondisi ketika bagian jantung yang meliputi pembuluh darah jantung, selaput jantung, katup jantung, dan otot jantung mengalami gangguan. Penyakit jantung bisa disebabkan oleh berbagai hal, seperti sumbatan pada pembuluh darah jantung, peradangan, infeksi, atau kelainan bawaan.\nJantung adalah organ vital yang terdiri dari otot dan terbagi menjadi empat ruang. Ruang jantung dibatasi oleh katup jantung yang berfungsi mengatur aliran darah agar bergerak ke satu arah.\n\nPada dinding jantung, terdapat pembuluh darah jantung atau arteri koroner yang mengalirkan darah kaya oksigen ke seluruh bagian jantung. Pembuluh ini memiliki dua cabang, yaitu pembuluh darah koroner kanan dan kiri.\nJantung juga memiliki dua selaput yang disebut perikardium. Fungsinya adalah untuk melindungi jantung, menjaga posisi jantung tetap pada tempatnya, dan mencegah terjadinya luka akibat gesekan ketika berdenyut.\n']","Untuk mengobati penyakat jantung, sangatlah penting bagi seseorang untuk memperhatikan pola hidup sehat. Berikut adalah beberapa cara dalam menjaga gaya hidup yang baik untuk mencegah atau mengurangi gejala penyakit jantung:\n\n1. Tidak merokok: Merokok dapat menyebabkan penyumbatan pembuluh darah, sehingga jantung seringkali bekerja lebih keras untuk mengalirkan darah. Mencegah rokok dan menghindari lingkungan yang membosankan juga penting dalam mencegah penyakit jantung.\n2. Olahraga ringan: Berolahraga seperti berjalan, berenang, atau jogging 30 menit perhari dapat meningkatkan kapasitas jantung dan mengurangi risiko penyakit jantung. Jangan lupa untuk selalu merubah aktivitas rutinnya agar tidak kehabisan-habisnya, tetapi pastikan untuk melakukannya dengan tenang dan santai.\n3. Makanan sehat: Mengonsumsi makanan yang kaya akan protein dan rendah lemak serta rendah garam dapat menurunkan tekanan darah dan mengurangi resiko penyakit jantung. Berikan perhatian pada asupan gizi, tetapi juga jangan lupa untuk menghindari makanan jahat seperti donat, kue, atau minuman beralkohol yang dapat membahayakan kesehatan.\n4. Minuman cairan: Meminimalisir penggunaan minuman beralkohol dan mengurangi penghamburan teh atau kopi pekat juga penting untuk mencegah risiko terkena penyakit jantung. Berikan perhatian pada asupan air yang cukup, sebab dehidrasi dapat meningkatkan beban jantung.\n5. Konsistensi mental dan emosi: Menjaga kondisi jiwa tetap tenang serta mengedarkan rasa percaya diri dalam mengatasi masalah yang dihadapi adalah aspek lain yang harus diperhatikan untuk menjaga pola hidup sehat.\n6. Konsultasi dokter: Jika memiliki penyakit jantung, pastikan selalu berkonsultasi dengan dokter dan mengikuti nasehat mereka. Dokter akan mengajarkan cara terbaik untuk menjaga pola hidup yang sehat serta memberi obat-obatan sesuai kebutuhan medis.\n7. Berlatih religius: Mencari dukungan dan harapan dari dewi Tahu dan berdoa secara sadar juga membantu menjaga jiwa tetap dalam kondisi yang sehat, menyembuhkan penyakit jantung, dan mengurangi stres.\n\nDengan menerapkan pola hidup yang sehat tersebut, seseorang dapat mempercepat proses sembuhannya atau bahkan menghindari pengobatan medis apabila penyebabnya berasal dari gaya hidup yang buruk.",0.4642857142857143,0.556714525137109,0.99999999995,1.0
Bagaimana gejala penyakit gagal jantung?,"Gejala utama yang timbul akibat gagal jantung antara lain:\n\nSesak napas\nMudah lelah\nPembengkakan di kaki dan pergelangan kaki\n\nSelain beberapa gejala utama di atas, ada beberapa keluhan lain yang dapat muncul, yaitu:\n\nBatuk terus-menerus yang memburuk di malam hari\nBerat badan naik atau turun secara drastis\nRasa cemas dan gelisah\nHilang nafsu makan\nPerut kembung\nMual\nLinglung atau penurunan kesadaran","['Topik: Gagal Jantung, Subtopik: Gejala Gagal Jantung \n Gejala gagal jantung dapat bervariasi pada setiap penderitanya. Gejalanya juga bisa muncul secara tiba-tiba atau berkembang secara perlahan selama beberapa minggu atau beberapa bulan.\nGejala utama yang timbul akibat gagal jantung antara lain:\n- Sesak napas\n- Mudah lelah\n- Pembengkakan di kaki dan pergelangan kaki\nSelain beberapa gejala utama di atas, ada beberapa keluhan lain yang dapat muncul, yaitu:\n- Batuk terus-menerus yang memburuk di malam hari\n- Berat badan naik atau turun secara drastis\n- Rasa cemas dan gelisah\n- Hilang nafsu makan\n- Perut kembung\n- Mual\n- Linglung atau penurunan kesadaran\nPada gagal jantung ringan, gejala mungkin tidak muncul meski penderita sedang beraktivitas. Akan tetapi, pada gagal jantung yang parah, gejala bisa muncul saat penderita beraktivitas atau ketika sedang beristirahat.\n', 'Topik: Gagal Jantung, Subtopik: Gejala Gagal Jantung: Kapan Harus ke Dokter \n Lakukan pemeriksaan jika Anda mengalami keluhan seperti yang telah disebutkan di atas, terutama jika terjadi secara terus-menerus dan makin memburuk.\nSegera ke dokter atau rumah sakit terdekat jika gejala disertai dengan kondisi berikut:\n- Nyeri dada\n- Sangat lemas, seperti ingin pingsan\n- Jantung berdebar\n- Batuk yang disertai lendir berwarna kemerahan\n- Sesak napas yang tidak mereda meski telah beristirahat\n- Pembengkakan di lengan atau kaki\n', 'Topik: Gagal Jantung, Subtopik: Penyebab Gagal Jantung \n Gagal jantung disebabkan oleh kondisi atau penyakit yang menyebabkan jantung menjadi lemah, kaku, dan bekerja secara berlebihan dalam jangka panjang. Gagal jantung juga dapat disebabkan oleh kerusakan atau kelainan pada jantung, seperti pada otot atau katup jantung.\nBerikut ini adalah sejumlah kondisi atau penyakit yang menyebabkan gagal jantung:\n']","Gejala penyakat gagal jantung bervariasi, terutama karena faktor-faktor internal dan eksternal penderita. Namun, gejala umum yang sering dikaitkan dengan penyebab ini termasuk:\n\n1. Sesak napas: Penderita sering merasa sulit untuk menyerap udara sebelah sisi jantung dan bisa terkesan bosan atau gemetaran saat beraktivitas.\n2. Mudah lelah: Kecelakaan ini disebabkan oleh hati yang bekerja lebih keras untuk mengeluarkan darah, menyebabkan penderita cepat merasa lemas dan kehabisan tenaga.\n3. Pembengkakan di kaki dan pergelangan kaki: Gejala ini disebabkan oleh tekanan darah yang tinggi atau penyumbatan arteri, menyebabkan penderita merasa gemetar dan gatal saat beraktivitas.\n4. Batuk terus-menerus di malam hari: Gejala ini dapat menandakan masalah jantung, karena seringkali disertai dengan sesak napas atau penyumbatan saluran napas.\n5. Berat badan naik atau turun secara drastis: Gagal jantung bisa menyebabkan tubuh mengeksesorisasi air, sehingga berat badan berkurang secara tidak saksama.\n6. Rasa cemas dan gelisah: Penderita mungkin merasakan ketidaksempurnaan jantung yang membuat mereka takut akan kematian.\n7. Hilang nafsu makan: Gagal jantung bisa menyebabkan tubuh kehilangan nafsu makan, terutama jika penderita harus menahan asupan makanan atau air.\n8. Perut kembung dan mual: Gejakala ini dapat disertai gagal jantung, terutama ketika penyebabnya adalah kerusakan katup jantung atau otot jantung.\n9. Linglung atau penurunan kesadaran: Penderita bisa merasa pusing, seperti ingin akan puncak hati, akibat tekanan darah yang tinggi atau ketidaksempurnaan katup jantung.\n\nSemua gejala ini harus dianalisis dan diidentifikasi oleh dokter untuk menentukan penyebabnya, terutama jika ada keluhan yang membahayakan atau tidak normal bagi seseorang.",0.48148148148148145,0.4993849160757437,0.99999999995,1.0
Apa saja obat yang direkomendasikan untuk penderita penyakit gagal jantung?,"Beberapa jenis obat yang dapat diresepkan adalah:\n\nDiuretik, seperti spironolactone, furosemide, indapamide, dan acetazolamide untuk mencegah pengumpulan cairan di dalam tubuh\nPenghambat beta, seperti carvedilol dan bisoprolol, untuk memperlambat jantung dan menurunkan tekanan darah\nACE inhibitor, seperti lisinopril, ramipril, dan perindopril, untuk mengurangi ketegangan pada pembuluh darah, menurunkan tekanan darah, dan melancarkan aliran darah\nAngiotensin II receptor blockers (ARB), seperti candesartan, valsartan, dan telmisartan, untuk mengurangi ketegangan pada pembuluh darah pada pasien yang tidak cocok dengan ACE inhibitor\nDigoxin, untuk meningkatkan kekuatan otot jantung\nIvabradine, untuk memperlambat laju denyut jantung\nTolvaptan, untuk mengembalikan kadar natrium darah yang dapat menurun pada pasien gagal jantung\nEmpagliflozin, untuk menurunkan tekanan darah dan beban kerja jantung pada pasien yang juga memiliki diabetes tipe 2.","['Topik: Gagal Jantung, Subtopik: Pengobatan Gagal Jantung \n Gagal jantung merupakan kondisi yang terjadi dalam jangka panjang. Oleh sebab itu, pengobatan yang dilakukan bertujuan untuk:\n- Meringankan gejala gagal jantung\n- Meningkatkan kekuatan jantung\n- Mencegah terjadinya komplikasi\nMetode pengobatan gagal jantung akan disesuaikan dengan usia pasien, penyebab dan tingkat keparahannya, serta penyakit lain yang menyertai. Metode pengobatan gagal jantung dapat berupa:\n', 'Topik: Gagal Jantung, Subtopik: Penyebab Gagal Jantung: 3. Diabetes \n Penderita diabetes berisiko lebih tinggi untuk terkena penyakit jantung koroner, yaitu penyebab utama gagal jantung. Diabetes juga dapat menyebabkan kerusakan pada pembuluh darah dan saraf di jantung.\n', 'Topik: Gagal Jantung, Subtopik: Gejala Gagal Jantung \n Gejala gagal jantung dapat bervariasi pada setiap penderitanya. Gejalanya juga bisa muncul secara tiba-tiba atau berkembang secara perlahan selama beberapa minggu atau beberapa bulan.\nGejala utama yang timbul akibat gagal jantung antara lain:\n- Sesak napas\n- Mudah lelah\n- Pembengkakan di kaki dan pergelangan kaki\nSelain beberapa gejala utama di atas, ada beberapa keluhan lain yang dapat muncul, yaitu:\n- Batuk terus-menerus yang memburuk di malam hari\n- Berat badan naik atau turun secara drastis\n- Rasa cemas dan gelisah\n- Hilang nafsu makan\n- Perut kembung\n- Mual\n- Linglung atau penurunan kesadaran\nPada gagal jantung ringan, gejala mungkin tidak muncul meski penderita sedang beraktivitas. Akan tetapi, pada gagal jantung yang parah, gejala bisa muncul saat penderita beraktivitas atau ketika sedang beristirahat.\n']","Pada umumnya, obat-obatan terapi gagal jantung bisa berupa beberapa jenis zat atau preparat yang membantu mengurangi gejala penyakit dan mencegah komplikasi. Berikut ini beberapa obat umum direkomendasikan untuk penderita gagal jantung:\n\n1. Angiotensin II receptor antagonists (ARBs) - seperti losartan, valsartan, atau irbesartan. Obat ini membantu mengurangi tekanan darah dan bisa meningkatkan kesadaran penderita yang tertekan oleh gagal jantung ringan.\n2. Beta-bloker - contohnya metoprolol, bisoprolol atau carvedilol. Obat ini memperlambat sistem saraf yang aktif dan bisa menurunkan tekanan darah serta mengurangi beban jantung.\n3. Diuretik - seperti furosemide atau torasemide. Obat ini digunakan untuk membersihkan air berlebih dalam tubuh, yang bisa meningkatkan tekanan darah dan memperparah gejala gagal jantung.\n4. Angiotensin konverting enzyme (ACE) inhibitor - contohnya enalapril atau lisinopril. Obat ini juga membantu mengurangi tekanan darah, serta bisa mencegah penyumbatan pembuluh darah jantung dan menghambat produksi enzim yang menyebabkan konstriksi otot jantung.\n5. Aldosteron antagonist - contohnya spironolactone atau eplerenona. Obat ini membantu mengurangi jumlah air dalam tubuh dan meningkatkan kapasitas jantung untuk mengeluarkan cairan.\n6. Kardiotonik - seperti digoxin. Obat ini bisa meningkatkan daya kontraksi jantung, serta memperlambat ritme nadi dan menurunkan risiko stroke atau gagal jantung yang parah.\n7. Antiplatelet - contohnya aspirin. Obat ini digunakan untuk mencegah pengkopian darah (atau trombus) dalam tubuh, terutama dalam sirkulasi jantung dan otak.\n\nNamun, perlu diingat bahwa obat-obatan yang direkomendasikan akan selalu mempertimbangkan kondisi medis individual pasien, seperti penyakit ekstern lainnya, umur, jenis kelamin, dan kebiasaan merokok atau minum alkohol. Oleh karena itu, penggunaan obat-obatan ini harus selalu diawasi oleh dokter spesialis gagal jantung untuk memastikan efek samping yang minimum dan manfaat maksimal.",0.2692307692307692,0.5516624019380335,0.9999999999,0.0
Apa saja hal yang membuat seseorang memiliki risiko tinggi mengidap penyakit gagal jantung?,"Ada beberapa faktor yang dapat meningkatkan risiko terjadinya gagal jantung pada seseorang, yaitu:\n\nBerusia di atas 65 tahun\nMemiliki keluarga dengan riwayat gagal jantung\nMemiliki berat badan berlebih atau obesitas\nMerokok\nSering mengonsumsi makanan tinggi lemak dan kolesterol\nJarang berolahraga\nMengonsumsi minuman beralkohol secara berlebihan\nMengonsumsi obat-obatan tertentu, seperti obat pereda nyeri dan obat antihipertensi","['Topik: Gagal Jantung, Subtopik: Penyebab Gagal Jantung: Faktor Risiko Gagal Jantung \n Meski dapat terjadi pada siapa saja, ada beberapa faktor yang dapat meningkatkan risiko terjadinya gagal jantung pada seseorang, yaitu:\n- Berusia di atas 65 tahun\n- Memiliki keluarga dengan riwayat gagal jantung\n- Memiliki berat badan berlebih atau obesitas\n\n- Merokok\n- Sering mengonsumsi makanan tinggi lemak dan kolesterol\n\n- Jarang berolahraga\n- Mengonsumsi minuman beralkohol secara berlebihan\n- Mengonsumsi obat-obatan tertentu, seperti obat pereda nyeri dan obat antihipertensi\n', 'Topik: Gagal Jantung, Subtopik: Penyebab Gagal Jantung: 3. Diabetes \n Penderita diabetes berisiko lebih tinggi untuk terkena penyakit jantung koroner, yaitu penyebab utama gagal jantung. Diabetes juga dapat menyebabkan kerusakan pada pembuluh darah dan saraf di jantung.\n', 'Topik: Gagal Jantung, Subtopik: Penyebab Gagal Jantung \n Gagal jantung disebabkan oleh kondisi atau penyakit yang menyebabkan jantung menjadi lemah, kaku, dan bekerja secara berlebihan dalam jangka panjang. Gagal jantung juga dapat disebabkan oleh kerusakan atau kelainan pada jantung, seperti pada otot atau katup jantung.\nBerikut ini adalah sejumlah kondisi atau penyakit yang menyebabkan gagal jantung:\n']","Hal-hal yang membuat seseorang memiliki risiko tinggi mengidap penyakab gagal jantung termasuk:\n\n1. Usia di atas 65 tahun, karena risiko meningkat dengan bertambahnya usia.\n2. Keluarga dengan riwayat penyakit gagal jantung, yang mengindikasikan bahwa genetika dan famili adalah faktor risiko penting.\n3. Berat badan berlebih atau obesitas, karena itu juga bisa meningkatkan resiko penyakit jantung serta memicu riwayat gagal jantung dalam keluarga.",0.8333333333333334,0.6513138415251686,0.8333333332916666,1.0
Apa saja faktor risiko seseorang terkena serangan jantung?,"Penyakit jantung koroner merupakan penyebab utama terjadinya serangan jantung. Oleh sebab itu, orang dengan faktor risiko penyakit jantung koroner juga berisiko terkena serangan jantung, antara lain;\n\nBerusia lanjut (≥45 tahun pada pria atau ≥55 tahun pada wanita)\nMenderita tekanan darah tinggi atau hipertensi\nMenderita kolesterol tinggi atau trigliserida tinggi\nMengalami diabetes\nMengalami obesitas\nMengalami stres\nMemiliki keluarga yang pernah mengalami serangan jantung\nJarang berolahraga\nMerokok","['Topik: Serangan Jantung, Subtopik: Penyebab Serangan Jantung: Faktor Risiko Serangan Jantung \n Seperti yang telah disebutkan sebelumnya, penyakit jantung koroner merupakan penyebab utama terjadinya serangan jantung. Oleh sebab itu, orang dengan faktor risiko penyakit jantung koroner juga berisiko terkena serangan jantung, antara lain;\n- Berusia lanjut (  45 tahun pada pria atau  55 tahun pada wanita)\n- Menderita tekanan darah tinggi atau hipertensi\n- Menderita kolesterol tinggi atau trigliserida tinggi\n\n- Mengalami diabetes\n- Mengalami obesitas\n- Mengalami stres\n\n- Memiliki keluarga yang pernah mengalami serangan jantung\n- Jarang berolahraga\n- Merokok\nRisiko terjadinya serangan jantung juga lebih tinggi pada penderita penyakit autoimun, seperti lupus, dan wanita yang mengalami preeklamsia saat hamil.\n', 'Topik: Serangan Jantung, Subtopik: Pencegahan Serangan Jantung: Berhenti merokok \n Merokok merupakan faktor risiko utama serangan jantung. Hal ini karena rokok bisa menyebabkan aterosklerosis di pembuluh darah, serta dapat meningkatkan tekanan darah.\n', 'Topik: Serangan Jantung, Subtopik: Pengobatan Serangan Jantung: Hubungan intim \n Hubungan intim bisa dilakukan setelah pasien merasa sehat, umumnya 4  6 minggu setelah pengobatan. Perlu diketahui bahwa hubungan seksual tidak meningkatkan risiko pasien terkena serangan jantung berulang.\nMeski begitu, pria berisiko mengalami impotensi setelah serangan jantung akibat stres dan kecemasan, serta efek samping obat-obatan yang dikonsumsi.\n']","Faktor risiko umum terjadinya serangan jantung antara lain:\n\n1. Usia lanjut (lebih dari 45 tahun untuk pria atau lebih dari 55 tahun untuk wanita)\n2. Penyakit jantung koroner, seperti penyakit arteri yang menyusun luka akibat asam arakidonat dan lain-lain.\n3. Tingginya tekanan darah (hipertensi), tingginya kolesterol atau tingginya trigliserida dalam darah.\n4. Mengalami diabetes, obesitas, stres, atau memiliki gangguan metabolisme lainnya.\n5. Keluarga yang pernah mengalami serangan jantung.\n6. Jarang berolahraga dan aktivitas fisik rendah.\n7. Merokok secara sepanjang hari atau merokok dengan dosis tinggi.\n8. Penderita penyakit autoimun, contohnya lupus atau gagal ginjal akut.",0.6666666666666666,0.5518433430270132,0.9999999999,1.0
Apa saja hal yang menunjukkan gejala penyakit jantung?,"Serangan jantung bisa muncul secara mendadak dengan beberapa gejala berikut:\n\nNyeri dada sebelah kiri seperti tertekan atau tertindih, yang dapat menjalar ke daerah leher, rahang, lengan, atau punggung\nGangguan pencernaan, seperti mual, muntah, atau sakit perut\nBatuk atau mengi\nSesak napas\nPusing\nKeringat dingin\nGelisah dan cemas\nPenurunan kesadaran","['Topik: Serangan Jantung, Subtopik: Pencegahan Serangan Jantung: Menjalani pemeriksaan kesehatan secara rutin \n Rutin menjalani pemeriksaan kesehatan setidaknya 1 tahun sekali dapat membantu mendeteksi penyakit jantung lebih dini. Meski cara deteksi penyakit jantung lewat jari bisa dilakukan secara mandiri, namun untuk memastikan kondisi kesehatan sebenarnya, Anda sebaiknya melakukan pemeriksaan kesehatan rutin ke fasilitas kesehatan. Selain penyakit jantung, pemeriksaan ini juga dapat mendeteksi gangguan pada tekanan darah, kadar gula darah dan kolesterol, serta berbagai penyakit lainnya.\n', 'Topik: Serangan Jantung, Subtopik: Penyebab Serangan Jantung: Penyakit jantung koroner \n Penyakit jantung koroner merupakan penyebab utama serangan jantung. Kondisi ini terjadi ketika satu atau lebih pembuluh yang memberi pasokan darah ke jantung (pembuluh darah koroner) tersumbat. Penyumbatan tersebut dapat disebabkan oleh penumpukan plak kolesterol (aterosklerosis) atau gumpalan darah.\n', 'Topik: Serangan Jantung, Subtopik: Pengobatan Serangan Jantung: Gangguan mental \n Setelah pulang dari rumah sakit, pasien dapat merasa cemas, takut, atau mengalami trauma akibat serangan jantung. Hal tersebut bisa memengaruhi proses pemulihan. Oleh karena itu, penderita perlu berkonsultasi dengan psikiater untuk mendapatkan penanganan terhadap gangguan mental tersebut.\n']","Hal-hal yang menunjukkan gejala penyakat jantung termasuk perubahan dalam pencernaan, rasa lelah atau ketegangan, nyeri di belakang payudara, mual atau sesak makanan, gatalan atau imej kotor pada kaki, sering demam dan luka yang sulit untuk b愈合. Selain itu, ada juga beberapa gejala lainnya seperti bising di telinga, tidur berlebihan, kehilangan daya tahan, sesak nafas, dan tekanan darah yang tinggi atau rendah.",0.0,0.6930863192815037,0.49999999995,0.5555555555555556
Bagaimana pertolongan pertama untuk penderita penyakit jantung?,"Lakukan pertolongan pertama berupa cardiopulmonary resuscitation (CPR) atau resusitasi jantung paru (RJP). Namun, jika memungkinkan, bawalah penderita langsung ke instalasi gawat darurat (IGD) rumah sakit terdekat.","['Topik: Serangan Jantung, Subtopik: Pencegahan Serangan Jantung: Menjalani pemeriksaan kesehatan secara rutin \n Rutin menjalani pemeriksaan kesehatan setidaknya 1 tahun sekali dapat membantu mendeteksi penyakit jantung lebih dini. Meski cara deteksi penyakit jantung lewat jari bisa dilakukan secara mandiri, namun untuk memastikan kondisi kesehatan sebenarnya, Anda sebaiknya melakukan pemeriksaan kesehatan rutin ke fasilitas kesehatan. Selain penyakit jantung, pemeriksaan ini juga dapat mendeteksi gangguan pada tekanan darah, kadar gula darah dan kolesterol, serta berbagai penyakit lainnya.\n', 'Topik: Serangan Jantung, Subtopik: Gejala Serangan Jantung \n Serangan jantung bisa muncul secara mendadak dengan beberapa gejala berikut:\n- Nyeri dada sebelah kiri seperti tertekan atau tertindih, yang dapat menjalar ke daerah leher, rahang, lengan, atau punggung\n- Gangguan pencernaan, seperti mual, muntah, atau sakit perut\n\n- Batuk atau mengi\n\n- Sesak napas\n- Pusing\n- Keringat dingin\n- Gelisah dan cemas\n- Penurunan kesadaran\nSerangan jantung tidak selalu muncul mendadak. Terkadang, beberapa hari atau minggu sebelumnya, penderita sudah merasakan nyeri dada (angina) yang muncul saat beraktivitas dan mereda saat beristirahat.\nBahkan, pada beberapa kasus, serangan jantung tidak menimbulkan gejala sama sekali, terutama pada penderita diabetes, wanita, dan lansia.\n', 'Topik: Serangan Jantung, Subtopik: Pengertian Serangan Jantung \n Serangan jantung adalah gangguan jantung serius ketika otot jantung tidak mendapat aliran darah. Kondisi ini akan mengganggu fungsi jantung dalam mengalirkan darah ke seluruh tubuh. Serangan jantung dapat menyebabkan kematian bila tidak segera tertangani.\nSerangan jantung, atau disebut juga infark miokard, terjadi akibat terhambatnya aliran darah ke otot jantung. Penyebab utama kondisi ini adalah penyakit jantung koroner.\n\nPenyakit jantung koroner terjadi ketika pembuluh darah koroner yang memasok darah ke jantung tersumbat. Penyumbatan ini terjadi karena timbunan kolesterol yang membentuk plak di dinding pembuluh darah.\n']","Pertolongan pertama untuk penderita jantung termasuk tahap-tahap dasar seperti memastikan keamanan situasi, menghentikan aktivitas yang sedang berjalan dan memberikan obat asisten atau asupan garam dalam hal ini. Selain itu, segera menghubungi 911 (atau ambulance di negara lain) untuk mendapatkan bantuan medis lebih lanjut dan mengarahkan mereka ke fasilitas keselamatan jantung yang siaga.",0.0,0.6107888263157957,0.3333333333,0.0
Apa saja gejala pada seseorang yang mengalami hipotensi?,"Hipotensi tidak selalu menimbulkan gejala. Jika muncul gejala, penderita hipotensi dapat merasakan keluhan berikut:\n\nPusing\nMual dan muntah\nLemas\nPandangan kabur\nLinglung\nSulit berkonsentrasi\nTubuh terasa tidak stabil\nSesak napas\nPingsan","['Topik: Hipotensi, Subtopik: Gejala Hipotensi \n Hipotensi tidak selalu menimbulkan gejala. Jika muncul gejala, penderita hipotensi dapat merasakan keluhan berikut:\n- Pusing\n- Mual dan muntah\n- Lemas\n- Pandangan kabur\n- Linglung\n- Sulit berkonsentrasi\n- Tubuh terasa tidak stabil\n- Sesak napas\n- Pingsan\n', 'Topik: Hipotensi, Subtopik: Gejala Hipotensi \n Lakukan pemeriksaan ke dokter jika Anda mengalami gejala yang telah disebutkan di atas. Bila setelah diperiksa tekanan darah Anda di bawah normal, dokter akan melakukan pemeriksaan lanjutan untuk mencari tahu penyebab hipotensi tersebut.\nSegera ke dokter atau rumah sakit terdekat jika mengalami hipotensi dengan penurunan kesadaran dan gejala syok, seperti jantung berdebar, keringat dingin, atau sesak napas. Tekanan darah yang sangat rendah hingga menimbulkan syok perlu segera ditangani, karena dapat membahayakan nyawa.\n', 'Topik: Hipotensi, Subtopik: Pengertian Hipotensi \n Darah rendah atau hipotensi adalah kondisi ketika tekanan darah kurang dari 90/60 mmHg. Hipotensi umumnya tidak bergejala dan dapat dialami oleh siapa saja. Namun, pada beberapa orang, hipotensi dapat menyebabkan pusing, lemas, hingga pingsan.\nTekanan darah normal berkisar antara 90/60 mmHg dan 120/80 mmHg. Seseorang dapat dikatakan menderita hipotensi jika tekanan darahnya berada di bawah rentang tersebut.\n\nHipotensi dapat menjadi tanda dari suatu penyakit atau kondisi yang sedang diderita. Pada beberapa kasus yang parah, hipotensi dapat mengancam nyawa sehingga butuh ditangani segera.\n']","Gejala penderita hipotensi, seperti yang disebut dalam konteks tersebut, termasuk:\n\n1. Pusing\n2. Mual dan muntah\n3. Lemas\n4. Pandangan kabur\n5. Linglung\n6. Sulit berkonsentrasi\n7. Tubuh terasa tidak stabil\n8. Sesak napas\n9. Pingsan",1.0,0.5271727751951351,0.9999999999666667,1.0
Berapa tekanan darah yang menandakan seseorang mengalami hipotensi?,Tekanan darah normal berkisar antara 90/60 mmHg dan 120/80 mmHg. Seseorang dapat dikatakan menderita hipotensi jika tekanan darahnya berada di bawah rentang tersebut.,"['Topik: Hipotensi, Subtopik: Pengertian Hipotensi \n Darah rendah atau hipotensi adalah kondisi ketika tekanan darah kurang dari 90/60 mmHg. Hipotensi umumnya tidak bergejala dan dapat dialami oleh siapa saja. Namun, pada beberapa orang, hipotensi dapat menyebabkan pusing, lemas, hingga pingsan.\nTekanan darah normal berkisar antara 90/60 mmHg dan 120/80 mmHg. Seseorang dapat dikatakan menderita hipotensi jika tekanan darahnya berada di bawah rentang tersebut.\n\nHipotensi dapat menjadi tanda dari suatu penyakit atau kondisi yang sedang diderita. Pada beberapa kasus yang parah, hipotensi dapat mengancam nyawa sehingga butuh ditangani segera.\n', 'Topik: Hipotensi, Subtopik: Pengertian Hipotensi \n Tekanan darah normal berkisar antara 90/60 mmHg dan 120/80 mmHg. Seseorang dapat dikatakan menderita hipotensi jika tekanan darahnya berada di bawah rentang tersebut.\n\nHipotensi dapat menjadi tanda dari suatu penyakit atau kondisi yang sedang diderita. Pada beberapa kasus yang parah, hipotensi dapat mengancam nyawa sehingga butuh ditangani segera.\n', 'Topik: Hipotensi, Subtopik: Gejala Hipotensi \n Lakukan pemeriksaan ke dokter jika Anda mengalami gejala yang telah disebutkan di atas. Bila setelah diperiksa tekanan darah Anda di bawah normal, dokter akan melakukan pemeriksaan lanjutan untuk mencari tahu penyebab hipotensi tersebut.\nSegera ke dokter atau rumah sakit terdekat jika mengalami hipotensi dengan penurunan kesadaran dan gejala syok, seperti jantung berdebar, keringat dingin, atau sesak napas. Tekanan darah yang sangat rendah hingga menimbulkan syok perlu segera ditangani, karena dapat membahayakan nyawa.\n']","Tekanan darah normal berkisar antara 90/60 mmHg dan 120/80 mmHg. Seseorang dapat dikatakan menderita hipotensi jika tekanan darahnya berada di bawah rentang tersebut, yaitu kurang dari 90/60 mmHg.",1.0,0.5647540821696938,0.9999999999666667,1.0
Bagaimana metode utama dalam pengobatan penyakit hipotensi?,"Metode utama untuk menangani hipotensi adalah perubahan pola makan dan gaya hidup, seperti:\n\nMemperbanyak konsumsi cairan, karena cairan dapat meningkatkan volume darah dan membantu mencegah dehidrasi\nBerolahraga secara teratur untuk meningkatkan tekanan darah\nMengonsumsi suplemen atau obat darah rendah yang bisa didapatkan di apotek\nMenggunakan stoking khusus (stoking kompresi) pada tungkai untuk memperlancar aliran darah","['Topik: Hipotensi, Subtopik: Pengobatan Hipotensi \n Pengobatan hipotensi tergantung pada penyebab yang mendasarinya. Tujuan pengobatan adalah untuk meningkatkan tekanan darah, meredakan gejala yang muncul, dan mengobati kondisi yang menyebabkan hipotensi.\nJika hipotensi menimbulkan gejala, maka tindakan pertama yang perlu dilakukan adalah duduk atau berbaring. Setelah itu, posisikan kaki lebih tinggi dari jantung dan pertahankan posisi tersebut selama beberapa saat. Bila gejala tidak juga mereda, penanganan oleh dokter perlu dilakukan.\nMetode utama untuk menangani hipotensi adalah perubahan pola makan dan gaya hidup, seperti:\n- Memperbanyak konsumsi cairan, karena cairan dapat meningkatkan volume darah dan membantu mencegah dehidrasi\n- Berolahraga secara teratur untuk meningkatkan tekanan darah\n- Mengonsumsi suplemen atau obat darah rendah yang bisa didapatkan di apotek\n- Menggunakan stoking khusus (stoking kompresi) pada tungkai untuk memperlancar aliran darah\nJika hipotensi disebabkan oleh konsumsi obat-obatan, dokter akan mengurangi dosis atau mengganti jenis obatnya bila perlu. Selain itu, dokter juga dapat memberikan obat-obatan untuk menurunkan tekanan darah, yang disesuaikan dengan penyebab dan kondisi pasien.\nHipotensi yang disertai gejala syok membutuhkan penanganan darurat. Dokter akan memberikan cairan infus dan obat peningkat tekanan darah, seperti epinephrine atau norepinephrine untuk mencegah kerusakan fungsi organ. Transfusi darah juga dapat diberikan jika hipotensi disebabkan oleh kehilangan darah yang banyak.\nSetelah tekanan darah, detak jantung, suhu tubuh, dan pernapasan pasien stabil, dokter akan memberikan pengobatan untuk mengatasi penyebabnya. Misalnya, memberikan obat antibiotik untuk mengatasi infeksi yang sudah masuk ke dalam darah.\n', 'Topik: Hipotensi, Subtopik: Diagnosis Hipotensi \n Untuk mendiagnosis hipotensi, dokter akan melakukan tanya jawab mengenai gejala dan riwayat kesehatan pasien. Setelah itu, dokter akan melakukan pemeriksaan fisik, termasuk memeriksa tekanan darah dengan menggunakan sfigmomanometer.\nJika hasil pemeriksaan menunjukkan angka yang cukup rendah dan disertai gejala tertentu, dokter akan melakukan pemeriksaan lanjutan untuk mendeteksi kondisi atau penyakit yang menyebabkan hipotensi.\nPemeriksaan yang akan dilakukan dokter meliputi:\n- Tes darah, untuk memeriksa kadar gula dan kadar hormon dalam darah\n- Elektrokardiografi (EKG), untuk mendeteksi struktur jantung yang tidak normal dan detak jantung yang tidak beraturan\n- Ekokardiogram, untuk memeriksa fungsi jantung dan mendeteksi kelainan pada jantung\n- Uji latih jantung (stress test), untuk menilai fungsi jantung saat melakukan aktivitas, seperti berjalan atau berlari\n- Tilt table test, untuk melihat perbedaan tekanan darah saat berbaring dan berdiri pada pasien hipotensi ortostatik\n\n', 'Topik: Hipotensi, Subtopik: Pencegahan Hipotensi \n Cara terbaik untuk mencegah terjadinya hipotensi adalah dengan menghindari faktor pemicunya. Beberapa hal yang dapat dilakukan adalah:\n- Membatasi konsumsi minuman berkafein dan beralkohol\n- Mengonsumsi makanan dalam porsi kecil tetapi sering, dan tidak langsung berdiri setelah makan\n- Memosisikan kepala lebih tinggi ketika tidur\n- Berdiri secara perlahan dari posisi duduk atau berbaring\n- Tidak berdiri atau duduk terlalu lama\n- Tidak membungkuk atau mengubah posisi tubuh secara tiba-tiba\n- Tidak mengangkat beban yang terlalu berat\n- Mencukupi kebutuhan minum, minimal 8 gelas per hari\n- Berolahraga secara teratur, untuk meningkatkan otot tubuh dan melancarkan aliran darah\n- Menghindari diet rendah garam yang terlalu ketat\n']","Metode utama dalam pengobatan penyakit hipotensi meliputi beberapa langkah, seperti berikut:\n\n1. Perubahan pola makan dan gaya hidup:\n   - Memperbanyak konsumsi cairan untuk meningkatkan volume darah dan mengatasi dehidrasi.\n   - Berolahraga secara teratur, yang dapat memperbaiki sistem peredaran darah dan meningkatkan tekanan darah.\n   - Menggunakan suplemen atau obat darah rendah untuk menjaga stabilitas tekanan darah.\n\n2. Penggunaan stoking khusus (stoking kompresi) pada tungkai:\n   - Metode ini digunakan untuk memperlancar aliran darah, yang dapat membantu meningkatkan tekanan darah dan mengatasi hipotensi yang disebabkan oleh penyakit jantung atau pembuluh darah retikuler.\n\n3. Penggunaan obat-obatan:\n   - Jika hipotensi disebabkan oleh penggunaan obat, dokter akan mengurangi dosis obat atau menukar jenis obat untuk stabilkan tekanan darah pasien.\n\n4. Terapi medik:\n   - Dokter akan memberikan obat antibiotik atau zat lain yang diperlukan untuk mendiagnosis dan mengobati penyebab hipotensi, seperti infeksi.\n\n5. Pencegahan:\n   - Mengontrol faktor-faktor pemicu hipotensi, seperti konsumsi obat atau pengeluaran cairan tubuh yang berlebih.\n   - Mematuhi pola makan dan gaya hidup yang sehat untuk mencegah timbulnya hipotensi.",0.9333333333333333,0.5733934135339264,0.9999999999,1.0
Apa gejala yang menunjukkan seseorang mengalami angin duduk?,Beberapa gejala lain yang dapat menyertai nyeri dada pada angin duduk atau angina adalah:\n\nKeringat dingin\nMual\nPusing\nLemas\nSesak napas,"['Topik: Angin Duduk, Subtopik: Gejala Angin Duduk \n Gejala utama angin duduk adalah nyeri dada yang terasa seperti ditindih atau ditekan benda berat. Nyeri yang timbul akibat angin duduk dapat menyebar ke bagian tubuh lain, seperti leher, lengan, bahu, punggung, rahang, dan gigi. Pada wanita, terkadang nyeri dada dapat terasa seperti ditusuk benda tajam.\nBeberapa gejala lain yang dapat menyertai nyeri dada pada angin duduk atau angina adalah:\n- Keringat dingin\n- Mual\n- Pusing\n- Lemas\n- Sesak napas\nGejala angin duduk lebih sering timbul saat beraktivitas dan mereda atau hilang jika beristirahat atau meminum obat. Angin duduk jenis ini disebut angin duduk stabil.\nPada kasus tertentu, angin duduk tidak hilang meski sudah beristirahat dan minum obat, atau timbul saat sedang beristirahat. Angin duduk jenis ini disebut dengan angin duduk tidak stabil.\n', 'Topik: Angin Duduk, Subtopik: Gejala Angin Duduk: Kapan harus ke dokter \n Segera ke IGD jika mengalami gejala angin duduk untuk pertama kalinya. Bila Anda sudah memiliki obat angin duduk, cepatlah minum obat dan beristirahat jika gejala muncul. \nNamun, jangan menunda untuk mencari pertolongan medis jika gejala angin duduk tidak membaik atau makin berat, terlebih bila gejala tersebut disertai dengan sesak napas, berkeringat berlebihan, atau nyeri yang menjalar ke lengan, rahang, maupun punggung. \nBila ada orang lain, mintalah pertolongannya untuk membawa Anda ke rumah sakit terdekat. Penting diingat bahwa Anda tidak boleh mengemudi seorang diri ke rumah sakit, kecuali bila tidak ada pilihan lain.\n', 'Topik: Angin Duduk, Subtopik: Komplikasi Angin Duduk \n Angin duduk dapat berkembang menjadi serangan jantung, yang ditandai dengan nyeri dada berat yang menjalar ke lengan, leher, atau punggung, disertai gejala seperti keringat berlebihan, mual, dan pusing. Jika Anda atau orang di sekitar mengalami gejala ini, segera ke IGD terdekat.\n']","Gejala utama angin duduk, yaitu nyeri dada yang terasa seperti ditindih atau ditekan benda berat. Nyeri ini dapat menyebar ke bagian tubuh lain, termasuk leher, lengan, bahu, punggung, rahang, dan gigi. Pada wanita, nyeri dada yang dirasakan seperti ditusuk benda tajam juga merupakan gejala umum dari angin duduk.\n\nGejala lain yang sering disertai oleh nyeri dada pada angin duduk atau angina adalah:\n- Keringat dingin\n- Mual\n- Pusing\n- Lemas\n- Sesak napas\n\nAngin duduk lebih sering terjadi saat beraktivitas dan bisa hilang jika beristirahat atau minum obat. Ada dua jenis angin duduk, yaitu angin duduk stabil (yang biasanya muncul saat aktif) dan tidak stabil (yang timbul meskipun sedang istirahat).\n\nPenting untuk segera datang ke dokter atau IGD jika mengalami gejala angin duduk, terutama bila ada perubahan pada gejala atau munculnya komplikasi seperti serangan jantung.",1.0,0.367447738710442,0.9999999999666667,1.0
Bagaimana pertolongan terhadap seseorang yang mengalami angin duduk?,"Segera ke IGD jika mengalami gejala angin duduk untuk pertama kalinya. Bila Anda sudah memiliki obat angin duduk, cepatlah minum obat dan beristirahat jika gejala muncul. \n\nNamun, jangan menunda untuk mencari pertolongan medis jika gejala angin duduk tidak membaik atau makin berat, terlebih bila gejala tersebut disertai dengan sesak napas, berkeringat berlebihan, atau nyeri yang menjalar ke lengan, rahang, maupun punggung. \n\nBila ada orang lain, mintalah pertolongannya untuk membawa Anda ke rumah sakit terdekat. Penting diingat bahwa Anda tidak boleh mengemudi seorang diri ke rumah sakit, kecuali bila tidak ada pilihan lain.","['Topik: Angin Duduk, Subtopik: Gejala Angin Duduk: Kapan harus ke dokter \n Segera ke IGD jika mengalami gejala angin duduk untuk pertama kalinya. Bila Anda sudah memiliki obat angin duduk, cepatlah minum obat dan beristirahat jika gejala muncul. \nNamun, jangan menunda untuk mencari pertolongan medis jika gejala angin duduk tidak membaik atau makin berat, terlebih bila gejala tersebut disertai dengan sesak napas, berkeringat berlebihan, atau nyeri yang menjalar ke lengan, rahang, maupun punggung. \nBila ada orang lain, mintalah pertolongannya untuk membawa Anda ke rumah sakit terdekat. Penting diingat bahwa Anda tidak boleh mengemudi seorang diri ke rumah sakit, kecuali bila tidak ada pilihan lain.\n', 'Topik: Angin Duduk, Subtopik: Pengertian Angin Duduk \n Angin duduk adalah nyeri dada yang disebabkan oleh berkurangnya aliran darah ke otot jantung. Kondisi ini sering kali disalahartikan dan diremehkan karena gejalanya mirip dengan masalah yang ringan. Padahal, angin duduk berkaitan erat dengan gangguan jantung yang perlu segera ditangani.\nAngina pectoris atau angin duduk ditandai dengan nyeri dada yang seperti tertindih, terbakar, atau tertusuk. Keluhan ini lebih sering muncul saat penderitanya sedang beraktivitas, yaitu ketika jantung memompa darah lebih cepat. \n\nAngin duduk dapat ditangani dengan pengobatan dari dokter dan dengan menjalani gaya hidup sehat. Jika ditangani dengan baik, penderita angin duduk dapat terhindar dari komplikasi yang serius.\n', 'Topik: Angin Duduk, Subtopik: Pengobatan Angin Duduk  \n Pengobatan angina duduk bertujuan untuk mengurangi keluhan dan mencegah terjadinya serangan jantung. Pengobatan ini umumnya melibatkan perubahan gaya hidup yang diimbangi dengan pengobatan dan prosedur medis tertentu. Perubahan gaya hidup untuk menangani angin duduk mencakup:\n- Tidak merokok\n- Memilih makanan rendah garam dan tinggi serat, seperti sayuran dan buah-buahan\n- Menghindari konsumsi makanan tinggi lemak jenuh dan minuman beralkohol\n- Menjaga berat badan ideal atau menurunkan berat badan jika overweight  atau obesitas\n\n- Berolahraga secara teratur\n- Mengelola stres dengan baik\n']","Pertolongan terhadap seseorang yang mengalami angin duduk harus segera dilakukan, khususnya jika gejala angin duduk adalah hal baru atau dirasakan lebih parah. Berikut langkah-langkah pertolongan terhadap seseorang yang mengalami angin duduk:\n\n1. Segera hubungi dokter atau tenaga medis untuk mendapatkan nasihat dan solusi pasien. Dokter akan memeriksa pasien dan mungkin menyarankan perubahan gaya hidup, pengobatan medis, serta mengurangi risiko ancaman komplikasi angin duduk.\n\n2. Pastikan pasien tidak mengalami penyakit jantung koroner atau gangguan lainnya yang dapat meningkatkan resiko terjadinya angin duduk. Jika demikian, pasien perlu secara cepat diarahkan ke rumah sakit untuk mendapat pengobatan yang sesuai.\n\n3. Berikan obat angin duduk pasien sesegera mungkin setelah memastikan bahwa dosis dan jenis obat tersebut benar. Jika tidak ada orang lain, segera bantu pasien untuk pergi ke rumah sakit atau menghubungi dokter secara langsung.\n\n4. Hindari membuangkan seluruh dosis obat angin duduk yang diberikan oleh dokter dalam waktu satu bulan sebelumnya, karena ini akan membahayakan pasien dan mengancam kehidupan pasien.\n\n5. Perhatikan gejala-gejasa lainnya selain angin duduk yang mungkin terjadi pada pasien, seperti sesak napas atau nyeri menjanjang. Segera bantu pasien untuk mengobati dan mencari pertolongan medis yang dibutuhkan.\n\n6. Jika gejala angin duduk tidak membaik atau makin berat, segera berkunjung ke dokter atau IGD (Instalasi Gigi Dentar) untuk mendapat pertolongan medis yang lebih lanjut.\n\n7. Ikuti nasihat dan petunjuk dari dokter tentang bagaimana cara mengurangi risiko terjadinya angin duduk, termasuk perubahan gaya hidup seperti menghindari merokok, memilih makanan sehat, serta berolahraga secara teratur.\n\nDengan segera melakukan pertolongan ini dan mengikuti nasihat dokter, kesadaran tentang angin duduk yang timbul pada pasien dapat diminimalisir, meningkatkan kualitas hidup pasien secara signifikan.",0.7272727272727273,0.6832733153836061,0.9999999999666667,1.0
Bagaimana cara mencegah penyakit angin duduk?,"Angin duduk dapat dicegah melalui beberapa cara berikut:\n\nBerolahraga secara rutin, misalnya bersepeda santai, berjalan kaki, atau berenang\nMengonsumsi makanan yang sehat untuk jantung, terutama makanan yang mengandung serat dan lemak tak jenuh, seperti sayuran, buah-buahan, ikan tuna, dan minyak zaitun\nMenghindari konsumsi makanan yang tinggi garam dan lemak jenuh, seperti santan, gorengan, keju, dan mentega\nMengonsumsi obat secara rutin sesuai anjuran dokter \nMenjaga berat badan ideal\nMenghindari konsumsi minuman beralkohol\nTidak merokok","['Topik: Angin Duduk, Subtopik: Pencegahan Angin Duduk \n Angin duduk dapat dicegah melalui beberapa cara berikut:\n- Berolahraga secara rutin, misalnya bersepeda santai, berjalan kaki, atau berenang\n- Mengonsumsi makanan yang sehat untuk jantung, terutama makanan yang mengandung serat dan lemak tak jenuh, seperti sayuran, buah-buahan, ikan tuna, dan minyak zaitun\n- Menghindari konsumsi makanan yang tinggi garam dan lemak jenuh, seperti santan, gorengan, keju, dan mentega\n- Mengonsumsi obat secara rutin sesuai anjuran dokter \n- Menjaga berat badan ideal\n\n- Menghindari konsumsi minuman beralkohol\n- Tidak merokok\nUntuk mencegah angin duduk, pastikan untuk menjalani pemeriksaan kesehatan rutin, terutama bagi yang menderita diabetes, hipertensi, atau faktor risiko lain. Pemeriksaan secara berkala dapat mengendalikan faktor risiko yang ada dengan lebih baik dan mendeteksi masalah lebih dini.\n', 'Topik: Angin Duduk, Subtopik: Pengobatan Angin Duduk  \n Pengobatan angina duduk bertujuan untuk mengurangi keluhan dan mencegah terjadinya serangan jantung. Pengobatan ini umumnya melibatkan perubahan gaya hidup yang diimbangi dengan pengobatan dan prosedur medis tertentu. Perubahan gaya hidup untuk menangani angin duduk mencakup:\n- Tidak merokok\n- Memilih makanan rendah garam dan tinggi serat, seperti sayuran dan buah-buahan\n- Menghindari konsumsi makanan tinggi lemak jenuh dan minuman beralkohol\n- Menjaga berat badan ideal atau menurunkan berat badan jika overweight  atau obesitas\n\n- Berolahraga secara teratur\n- Mengelola stres dengan baik\n', 'Topik: Angin Duduk, Subtopik: Pengertian Angin Duduk \n Angin duduk adalah nyeri dada yang disebabkan oleh berkurangnya aliran darah ke otot jantung. Kondisi ini sering kali disalahartikan dan diremehkan karena gejalanya mirip dengan masalah yang ringan. Padahal, angin duduk berkaitan erat dengan gangguan jantung yang perlu segera ditangani.\nAngina pectoris atau angin duduk ditandai dengan nyeri dada yang seperti tertindih, terbakar, atau tertusuk. Keluhan ini lebih sering muncul saat penderitanya sedang beraktivitas, yaitu ketika jantung memompa darah lebih cepat. \n\nAngin duduk dapat ditangani dengan pengobatan dari dokter dan dengan menjalani gaya hidup sehat. Jika ditangani dengan baik, penderita angin duduk dapat terhindar dari komplikasi yang serius.\n']","Untuk mencegah angin duduk, berikut beberapa cara yang dapat diikuti:\n\n1. Berolahraga secara rutin, termasuk aktivitas seperti bersepeda santai, berjalan kaki, atau berenang. Kondisi fisik yang baik membantu mengoptimalkan aliran darah dan menghindari angin duduk.\n2. Mengonsumsi makanan yang sehat untuk jantung, terutama yang tinggi serat dan mengandung lemak tak jenuh. Menu diet sehat ini bisa mencakup sayuran, buah-buahan, ikan tuna, dan minyak zaitun.\n3. Menghindari konsumsi makanan yang tinggi garam dan lemak jenuh, seperti santan, gorengan, keju, dan mentega. Mengurangi asupan makanan dengan rasa pedas juga bisa membantu mencegah angin duduk.\n4. Mengonsumsi obat secara rutin sesuai anjuran dokter, seperti kardiotonik atau antiangina. Obat-obatan ini bisa menurunkan nyeri dan mengoptimalkan aliran darah ke jantung.\n5. Menjaga berat badan ideal agar tidak overweight atau obesitas. Penurunan berat badan yang sehat juga dapat membantu mencegah angin duduk.\n6. Menghindari konsumsi minuman beralkohol dan menjaga stres yang baik, agar tidak merusak jantung atau mengganggu aliran darah.\n7. Tidak merokok secara rutin. Minyak liur dan zat kimiawi dalam rokok dapat memperburuk kondisi jantung dan meningkatkan risiko angin duduk.\n8. Menjaga pemeriksaan kesehatan rutin, terutama bagi yang menderita diabetes, hipertensi, atau faktor risiko lainnya. Pemeriksaan berkala dapat mengendalikan faktor risiko angin duduk dan mendeteksi masalah lebih dini.\n\nDengan menjalani gaya hidup sehat dan sering melakukan pemeriksaan kesehatan, Anda bisa mencegah angin duduk dan mengantisipasi ancaman yang timbul dari penyakit jantung.",0.7083333333333334,0.7461317869023829,0.9999999999666667,1.0
Apa saja faktor risiko penyakit emboli?,"Angin duduk dapat dicegah melalui beberapa cara berikut:\n\nBerolahraga secara rutin, misalnya bersepeda santai, berjalan kaki, atau berenang\nMengonsumsi makanan yang sehat untuk jantung, terutama makanan yang mengandung serat dan lemak tak jenuh, seperti sayuran, buah-buahan, ikan tuna, dan minyak zaitun\nMenghindari konsumsi makanan yang tinggi garam dan lemak jenuh, seperti santan, gorengan, keju, dan mentega\nMengonsumsi obat secara rutin sesuai anjuran dokter \nMenjaga berat badan ideal\nMenghindari konsumsi minuman beralkohol\nTidak merokok","['Topik: Emboli, Subtopik: Faktor risiko emboli \n Ada beberapa faktor yang dapat meningkatkan risiko seseorang mengalami emboli, yaitu:\n- Merokok\n- Berusia 60 tahun atau lebih\n- Sedang hamil\n- Mengalami berat badan berlebih atau obesitas\n- Tidak aktif bergerak untuk waktu yang lama, misalnya karena kelumpuhan atau menjalani rawat inap intensif di rumah sakit\n- Menderita penyakit jantung, kelainan katup jantung, fibrilasi atrium\n\n- Memiliki kelainan pada pembuluh darah vena\n- Menderita infeksi atau peradangan yang parah, kanker, kolesterol tinggi, atau diabetes\n- Sedang menjalani terapi hormon\n', 'Topik: Emboli, Subtopik: Pencegahan Emboli \n Emboli tidak selalu dapat dicegah. Meski demikian, ada upaya yang dapat dilakukan untuk mengurangi risiko terjadinya emboli, antara lain:\n- Rutin berolahraga, setidaknya 30 menit sehari\n- Minum air putih yang cukup\n- Menerapkan pola makan sehat dan bergizi seimbang\n- Membatasi asupan garam dengan diet rendah garam\n\n- Mempertahankan berat badan ideal\n- Berhenti merokok dan hindari konsumsi minuman beralkohol\n- Tidak duduk terlalu lama atau kurang aktif bergerak\n- Menjalani pemeriksaan kesehatan secara berkala\n', 'Topik: Emboli, Subtopik: Pengertian Emboli \n Emboli adalah kondisi ketika pembuluh darah tersumbat oleh zat asing, seperti gumpalan darah, gelembung udara, atau gumpalan kolesterol. Kondisi ini berbahaya dan harus segera diatasi, terutama bila terjadi di paru-paru, otak, atau jantung.\nEmboli menyebabkan pembuluh darah tersumbat. Penyumbatan ini dapat terjadi di pembuluh darah mana saja, mulai dari yang terkecil hingga terbesar, arteri maupun vena. Meski begitu, emboli biasanya lebih sering terjadi di arteri.\n\nEmboli yang terjadi pada arteri akan menyebabkan kurangnya asupan oksigen ke jaringan sehingga hal ini akan mengganggu fungsi jaringan atau organ. Jika tidak ditangani dengan tepat, penyumbatan ini dapat menyebabkan kerusakan permanen\nSementara itu, emboli yang terjadi pada vena akan mengganggu aliran darah yang akan kembali ke jantung. Akibatnya, darah akan membendung dan menyebabkan jaringan membengkak. Jika tidak segera ditangani, kondisi ini juga dapat merusak jaringan dan organ.\n']","Berdasarkan konteks yang diberikan, ada beberapa faktor risiko penyakit emboli yang diidentifikasi, termasuk:\n\n1. Merokok: Pernikahan merupakan salah satu faktor risiko utama untuk mengembangnya dada dan meningkatkan resiko serangan jantung.\n2. Berusia 60 tahun atau lebih: Kadar kebasahan tubuh dan fungsi organ-organ penting berkurang dengan bertambahnya usia.\n3. Sedang hamil: Hal ini disebabkan oleh faktor pembesaran janin yang memicu terjadinya penggumpalan darah.\n4. Mengalami berat badan berlebih atau obesitas: Obesitas dapat meningkatkan resiko timbulnya penyumbatan pembuluh darah, termasuk di dada dan otak.\n5. Tidak aktif bergerak untuk waktu yang lama: Kecurigaan fisik memungkinkan terjadinya penggumpalan darah dan meningkatkan risiko penyumbatan pembuluh darah.\n6. Menderita penyakit jantung, kelainan katup jantung, fibrilasi atrium: Masalah dalam sistem jantung dapat mempercepat terjadinya penumpukan zat asing di pembuluh darah.\n7. Memiliki kelainan pada pembuluh darah vena: Kelainan struktur atau fungsi pembuluh darah venus dapat menyebabkan aliran darah yang tidak normal dan meningkatkan risiko terjadinya emboli.\n8. Menderita infeksi atau peradangan yang parah, kanker, kolesterol tinggi, atau diabetes: Keadaan medis lainnya dapat mempengaruhi pertumbuhan dan fungsi pembuluh darah serta meningkatkan risiko terjadinya emboli.\n9. Sedang menjalani terapi hormon: Pemberian obat-obatan hormonal, termasuk pada masa kehamilan atau menstruasi, dapat mempengaruhi konsentrasi zat dalam darah dan risiko terjadinya emboli.\n\nDemikianlah faktor risiko penyebab emboli yang diidentifikasikan berdasarkan konteks yang diberikan.",0.4,0.9614549519297692,0.49999999995,0.875
Apa saja gejala penyakit emboli yang terjadi di daerah tangan?,"Berikut adalah contoh gejala emboli yang terjadi di pembuluh darah arteri tangan atau kaki:\n\nTangan dan kaki terasa dingin dan pucat\nOtot terasa lemah, sulit bergerak\nOtot kram atau kedutan\nNyeri saat berjalan\nMati rasa atau kesemutan","['Topik: Emboli, Subtopik: Gejala Emboli \n Gejala emboli tergantung pada jenis dan lokasi pembuluh darah yang tersumbat, serta pengaruhnya pada aliran darah. Makin besar ukuran pembuluh darah yang tersumbat, makin parah pula gejala yang ditimbulkan.\nBerikut adalah contoh gejala emboli yang terjadi di pembuluh darah arteri tangan atau kaki:\n- Tangan dan kaki terasa dingin dan pucat\n- Otot terasa lemah, sulit bergerak\n- Otot kram atau kedutan\n- Nyeri saat berjalan\n- Mati rasa atau kesemutan\nEmboli juga dapat terjadi pada vena, atau disebut juga dengan DVT (deep vein thrombosis). Gejalanya meliputi:\n- Bengkak dan nyeri pada salah satu kaki\n- Sakit di area yang tersumbat\n- Rasa hangat di area yang mengalami penyumbatan\n- Kemerahan pada kulit kaki yang terkena emboli\nSeperti yang telah disebutkan sebelumnya, emboli juga bisa menimbulkan kondisi berbahaya. Berikut ini adalah contoh gejala emboli yang termasuk gawat darurat:\n1. Emboli paru, yang beberapa gejalanya adalah:\n- Nyeri dada\n- Sesak napas\n- Batuk berdarah\n- Pusing\n- Keringat dingin\n- Kulit kebiruan (sianosis)\n- Detak jantung cepat atau tidak beraturan (takikardia)\n- Penurunan kesadaran atau pingsan\n2. Stroke (emboli otak), yang ditandai dengan:\n- Wajah tidak simetris atau pelo\n- Kelumpuhan anggota tubuh\n- Bicara cadel atau melantur\n3. Serangan jantung (emboli pada pembuluh koroner jantung), dengan gejala berupa:\n- Nyeri dada\n- Sesak napas\n- Mual\n- Keringat dingin\n', 'Topik: Emboli, Subtopik: Pengertian Emboli \n Emboli adalah kondisi ketika pembuluh darah tersumbat oleh zat asing, seperti gumpalan darah, gelembung udara, atau gumpalan kolesterol. Kondisi ini berbahaya dan harus segera diatasi, terutama bila terjadi di paru-paru, otak, atau jantung.\nEmboli menyebabkan pembuluh darah tersumbat. Penyumbatan ini dapat terjadi di pembuluh darah mana saja, mulai dari yang terkecil hingga terbesar, arteri maupun vena. Meski begitu, emboli biasanya lebih sering terjadi di arteri.\n\nEmboli yang terjadi pada arteri akan menyebabkan kurangnya asupan oksigen ke jaringan sehingga hal ini akan mengganggu fungsi jaringan atau organ. Jika tidak ditangani dengan tepat, penyumbatan ini dapat menyebabkan kerusakan permanen\nSementara itu, emboli yang terjadi pada vena akan mengganggu aliran darah yang akan kembali ke jantung. Akibatnya, darah akan membendung dan menyebabkan jaringan membengkak. Jika tidak segera ditangani, kondisi ini juga dapat merusak jaringan dan organ.\n', 'Topik: Emboli, Subtopik: Komplikasi Emboli \n Emboli yang tidak ditangani dapat menyebabkan komplikasi berbahaya yang bisa mengancam nyawa. Komplikasi yang dapat terjadi tergantung jenis dan lokasi pembuluh darah yang tersumbat, serta kondisi pasien. Beberapa komplikasinya adalah:\n- Kerusakan organ akibat kekurangan oksigen\n- Infeksi akibat kematian organ (gangrene)\n- Amputasi tangan atau kaki\n- Cacat permanen\n- Kerusakan otak, jantung, atau paru-paru\n- Syok\n- Kematian mendadak\n']","Gejala penyakat emboli yang bisa terjadi pada bagian tangan dan kaki antara lain:\n1. Tangan dan kaki terasa dingin dan pucat.\n2. Otot menjadi lemah dan sulit bergerak.\n3. Ada nyeri atau kesakitan saat berjalan.\n4. Ada otot kram (gabungan darah yang menyebabkan ketegangan) ataupun kedutan di bagian dada atau pinggang.\n5. Penyumbatan pembuluh darah dapat menimbulkan nyeri saat bergerak, seperti terdeteksi oleh pasien dalam keadaan statis (diam).",0.7142857142857143,0.59873849225146,0.99999999995,1.0
Bagaimana cara mencegah penyakit emboli?,"Emboli tidak selalu dapat dicegah. Meski demikian, ada upaya yang dapat dilakukan untuk mengurangi risiko terjadinya emboli, antara lain:\n\nRutin berolahraga, setidaknya 30 menit sehari\nMinum air putih yang cukup\nMenerapkan pola makan sehat dan bergizi seimbang\nMembatasi asupan garam dengan diet rendah garam\nMempertahankan berat badan ideal\nBerhenti merokok dan hindari konsumsi minuman beralkohol\nTidak duduk terlalu lama atau kurang aktif bergerak\nMenjalani pemeriksaan kesehatan secara berkala","['Topik: Emboli, Subtopik: Pencegahan Emboli \n Emboli tidak selalu dapat dicegah. Meski demikian, ada upaya yang dapat dilakukan untuk mengurangi risiko terjadinya emboli, antara lain:\n- Rutin berolahraga, setidaknya 30 menit sehari\n- Minum air putih yang cukup\n- Menerapkan pola makan sehat dan bergizi seimbang\n- Membatasi asupan garam dengan diet rendah garam\n\n- Mempertahankan berat badan ideal\n- Berhenti merokok dan hindari konsumsi minuman beralkohol\n- Tidak duduk terlalu lama atau kurang aktif bergerak\n- Menjalani pemeriksaan kesehatan secara berkala\n', 'Topik: Emboli, Subtopik: Pengertian Emboli \n Emboli adalah kondisi ketika pembuluh darah tersumbat oleh zat asing, seperti gumpalan darah, gelembung udara, atau gumpalan kolesterol. Kondisi ini berbahaya dan harus segera diatasi, terutama bila terjadi di paru-paru, otak, atau jantung.\nEmboli menyebabkan pembuluh darah tersumbat. Penyumbatan ini dapat terjadi di pembuluh darah mana saja, mulai dari yang terkecil hingga terbesar, arteri maupun vena. Meski begitu, emboli biasanya lebih sering terjadi di arteri.\n\nEmboli yang terjadi pada arteri akan menyebabkan kurangnya asupan oksigen ke jaringan sehingga hal ini akan mengganggu fungsi jaringan atau organ. Jika tidak ditangani dengan tepat, penyumbatan ini dapat menyebabkan kerusakan permanen\nSementara itu, emboli yang terjadi pada vena akan mengganggu aliran darah yang akan kembali ke jantung. Akibatnya, darah akan membendung dan menyebabkan jaringan membengkak. Jika tidak segera ditangani, kondisi ini juga dapat merusak jaringan dan organ.\n', 'Topik: Emboli, Subtopik: Pengobatan Emboli \n Pengobatan emboli tergantung pada ukuran emboli, serta lokasi dan penyebab penyumbatan. Metode penanganannya bisa dengan pemberian obat-obatan atau prosedur operasi. Berikut ini adalah penjelasannya:\n']","Mencegah penyakit emboli melalui beberapa upaya sosial dan budaya, seperti membiasakan diri berolahraga setidaknya 30 menit sehari, minum air putih yang cukup, menerapkan pola makan sehat dan bergizi seimbang, membatasi asupan garam dengan diet rendah garam, mempertahankan berat badan ideal, berhenti merokok dan hindari konsumsi minuman beralkohol, tidak duduk terlalu lama atau kurang aktif bergerak, serta menjalani pemeriksaan kesehatan secara berkala. Upaya ini dapat membantu mengurangi risiko terjadinya emboli dan mencegah penyakit yang disebabkan oleh emboli.",0.8333333333333334,0.698555836607837,0.99999999995,1.0
Apa itu penyakit aritmia?,"Aritmia adalah gangguan yang terjadi pada irama jantung. Penderita aritmia bisa merasakan irama jantungnya terlalu cepat, terlalu lambat, atau tidak teratur.","['Topik: Aritmia, Subtopik: Penyebab Aritmia \n Aritmia terjadi ketika impuls listrik yang berfungsi mengatur detak jantung tidak bekerja dengan baik. Kondisi tersebut dapat disebabkan oleh sejumlah kondisi di bawah ini:\n- Konsumsi obat pilek atau obat alergi\n- Sleep apnea\n- Hipertensi\n- Diabetes\n- Gangguan elektrolit, seperti kelebihan atau kekurangan kalium, hiperkalemia, dan hipomagnesemia\n\n- Gangguan tiroid, misalnya hipertiroidisme\n\n- Kelainan katup jantung\n- Penyakit jantung bawaan, seperti tetralogy of Fallot\n\n- Penyakit jantung koroner\n- Serangan jantung\n- Kardiomiopati\n- Torsade de pointes\nSelain kondisi medis, aritmia juga dapat dipicu oleh gaya hidup yang tidak sehat, seperti:\n- Tidak dapat mengelola stres dengan baik\n- Kurang tidur\n- Merokok\n- Mengonsumsi minuman beralkohol atau berkafein secara berlebihan\n- Menyalahgunakan NAPZA\n', 'Topik: Aritmia, Subtopik: Diagnosis Aritmia \n Untuk menentukan apakah pasien menderita aritmia, dokter akan menanyakan gejala yang muncul dan mendengarkan detak jantung pasien. Setelah itu, dokter akan melakukan beberapa pemeriksaan berikut:\n- Elektrokardiogram (EKG), untuk merekam aktivitas listrik jantung dalam kondisi berbaring\n- Holter monitoring, untuk merekam aktivitas listrik jantung ketika pasien beraktivitas selama seharian\n- Uji latih jantung, untuk mengukur aktivitas jantung saat pasien melakukan latihan fisik, seperti mengayuh sepeda statis atau berjalan di atas treadmill\n\n- Echo jantung, untuk melihat struktur dan fungsi jantung dengan bantuan gelombang suara\nDokter juga dapat menjalankan pemeriksaan lain guna melihat kemungkinan adanya penyakit yang mendasari aritmia, yaitu:\n- Pengukuran kadar elektrolit\n- Pengukuran kadar gula darah\n- Pemindaian\n- Katerisasi jantung\n- Biopsi\n', 'Topik: Aritmia, Subtopik: Gejala Aritmia \n Aritmia bisa terjadi tanpa menimbulkan gejala, sehingga kadang tidak disadari oleh penderitanya. Gejala aritmia yang dapat muncul antara lain:\n- Jantung berdetak lebih cepat dari normal (takikardia)\n- Jantung berdetak lebih lambat dari normal (bradikardia)\n- Pusing\n- Pingsan\n- Cepat lelah\n- Sesak napas\n- Nyeri dada\nPerlu diketahui, seseorang yang mengalami gejala di atas belum tentu mengalami aritmia. Oleh karena itu, pemeriksaan oleh dokter diperlukan agar dapat diketahui apa yang memicu gejala tersebut.\n']","Penyebutan 'berdasarkan konteks yang diberikan': Arthritis adalah sebuah penyakit medis dimana pasien mengalami perubahan anatomi dan fungsional pada tulang belakang, kulit atau serabut nerver lainnya. Penyebab arthritis bermacam-macam termasuk keguguran, disfungsi organ internal, genetik, penyakit imun, trauma fisik dan sebagainya.\n\nArthritis bukan merupakan topik medis yang sesuai dengan konteks yang diberikan yaitu mengenai aritmia (gangguan ritme jantung). Jadi tidak ada hubungannya langsung antara kedua penyebab tersebut.",0.42857142857142855,0.0,0.99999999995,1.0
Apa saja penyebab penyakit aritmia?,"Aritmia terjadi ketika impuls listrik yang berfungsi mengatur detak jantung tidak bekerja dengan baik. Kondisi tersebut dapat disebabkan oleh sejumlah kondisi di bawah ini:\nKonsumsi obat pilek atau obat alergi\nSleep apnea\nHipertensi\nDiabetes\nGangguan elektrolit, seperti kelebihan atau kekurangan kalium, hiperkalemia, dan hipomagnesemia\nGangguan tiroid, misalnya hipertiroidisme\nKelainan katup jantung\nPenyakit jantung bawaan, seperti tetralogy of Fallot\nPenyakit jantung koroner\nSerangan jantung\nKardiomiopati\nTorsade de pointes\n\nSelain kondisi medis, aritmia juga dapat dipicu oleh gaya hidup yang tidak sehat, seperti:\nTidak dapat mengelola stres dengan baik\nKurang tidur\nMerokok\nMengonsumsi minuman beralkohol atau berkafein secara berlebihan\nMenyalahgunakan NAPZA","['Topik: Aritmia, Subtopik: Penyebab Aritmia \n Aritmia terjadi ketika impuls listrik yang berfungsi mengatur detak jantung tidak bekerja dengan baik. Kondisi tersebut dapat disebabkan oleh sejumlah kondisi di bawah ini:\n- Konsumsi obat pilek atau obat alergi\n- Sleep apnea\n- Hipertensi\n- Diabetes\n- Gangguan elektrolit, seperti kelebihan atau kekurangan kalium, hiperkalemia, dan hipomagnesemia\n\n- Gangguan tiroid, misalnya hipertiroidisme\n\n- Kelainan katup jantung\n- Penyakit jantung bawaan, seperti tetralogy of Fallot\n\n- Penyakit jantung koroner\n- Serangan jantung\n- Kardiomiopati\n- Torsade de pointes\nSelain kondisi medis, aritmia juga dapat dipicu oleh gaya hidup yang tidak sehat, seperti:\n- Tidak dapat mengelola stres dengan baik\n- Kurang tidur\n- Merokok\n- Mengonsumsi minuman beralkohol atau berkafein secara berlebihan\n- Menyalahgunakan NAPZA\n', 'Topik: Aritmia, Subtopik: Pencegahan Aritmia \n Seperti telah dijelaskan di atas, banyak faktor yang bisa menyebabkan aritmia. Oleh karena itu, pencegahannya tergantung pada penyebab aritmia tersebut.\n', 'Topik: Aritmia, Subtopik: Diagnosis Aritmia \n Untuk menentukan apakah pasien menderita aritmia, dokter akan menanyakan gejala yang muncul dan mendengarkan detak jantung pasien. Setelah itu, dokter akan melakukan beberapa pemeriksaan berikut:\n- Elektrokardiogram (EKG), untuk merekam aktivitas listrik jantung dalam kondisi berbaring\n- Holter monitoring, untuk merekam aktivitas listrik jantung ketika pasien beraktivitas selama seharian\n- Uji latih jantung, untuk mengukur aktivitas jantung saat pasien melakukan latihan fisik, seperti mengayuh sepeda statis atau berjalan di atas treadmill\n\n- Echo jantung, untuk melihat struktur dan fungsi jantung dengan bantuan gelombang suara\nDokter juga dapat menjalankan pemeriksaan lain guna melihat kemungkinan adanya penyakit yang mendasari aritmia, yaitu:\n- Pengukuran kadar elektrolit\n- Pengukuran kadar gula darah\n- Pemindaian\n- Katerisasi jantung\n- Biopsi\n']","Seperti yang telah dijelaskan dalam konteks tersebut, beberapa penyebab aritmia termasuk obat pilek atau obat alergi, sleep apnea, hipertensi, diabetes, gangguan elektrolit, penyakit tiroid, kelainan katup jantung, penyakit jantung bawaan, penyakit jantung koroner, serangan jantung, kardiomiopati, torsade de pointes, tidak dapat mengelola stres, kurang tidur, meroket, pengonsumsi minuman beralkohol atau berkafein secara berlebihan, dan menyalahgunakan NAPZA.",1.0,0.622228828545636,0.99999999995,1.0
Apa alat bantu untuk menangani pasien yang mengalami syok kardiogenik?,"Beberapa alat bantu yang dapat dipasang adalah:\n\nExtracorporeal membrane oxygenation (ECMO), untuk meningkatkan aliran darah dan suplai oksigen ke seluruh tubuh\nPemasangan alat pacu jantung, untuk mengembalikan irama jantung ke dalam kondisi normal","['Topik: Syok Kardiogenik, Subtopik: Diagnosis Syok Kardiogenik \n Syok kardiogenik tergolong kondisi gawat darurat. Sambil memberikan tindakan untuk menstabilkan kondisi pasien, dokter akan menanyakan gejala yang dialami pasien kepada pendamping atau keluarganya, kemudian melakukan pemeriksaan fisik menyeluruh.\nRangkaian pemeriksaan yang akan dilakukan oleh dokter adalah:\n- Pemeriksaan kesadaran dan tanda-tanda vital, termasuk tekanan darah, denyut nadi, frekuensi pernapasan, dan suhu tubuh\n- Tes darah, untuk mendeteksi kerusakan jantung melalui pemeriksaan enzim jantung (troponin dan CKMB), serta memeriksa kadar oksigen dalam darah dengan analisis gas darah\n- Elektrokardiogram(EKG), untuk mengetahui aktivitas kelistrikan jantung dan mendeteksi tanda kerusakan jaringan atau otot jantung\n- Ekokardiografi, untuk melihat struktur, ukuran, dan kondisi jantung\n- Pemindaian dengan Rontgen dada, untuk memeriksa kondisi dan ukuran jantung, sekaligus mendeteksi penumpukan cairan di dalam paru-paru\n- Angiografi koroner, untuk mendeteksi penyumbatan di dalam pembuluh darah, serta untuk mengukur tekanan di dalam bilik jantung\n- PET scan jantung (nuclear heart scan), untuk mendeteksi gangguan pada aliran darah jantung\n', 'Topik: Syok Kardiogenik, Subtopik: Pengertian Syok Kardiogenik \n Syok kardiogenik adalah syok yang disebabkan oleh ketidakmampuan jantung untuk memompa darah ke seluruh tubuh. Syok kardiogenik merupakan kondisi yang berbahaya dan perlu mendapatkan penanganan secepatnya.\nBeberapa gejala yang terjadi saat seseorang mengalami syok kardiogenik adalah penurunan tekanan darah, denyut nadi cepat tetapi lemah, sesak napas, ujung kaki dan tangan terasa dingin, hingga penurunan kesadaran.\n\n', 'Topik: Syok Kardiogenik, Subtopik: Gejala Syok Kardiogenik: Kapan harus ke dokter \n Segera bawa ke IGD rumah sakit terdekat jika ada seseorang di sekitar Anda yang mengalami gejala seperti di atas, terlebih bila disertai dengan penurunan kesadaran. Syok kardiogenik bisa memburuk dalam waktu yang cepat dan mengancam nyawa sehingga pasien perlu mendapatkan penanganan secepatnya.\nJika Anda memiliki penyakit atau kondisi medis yang dapat meningkatkan risiko terjadinya syok kardiogenik, lakukan pemeriksaan berkala sesuai anjuran dokter.\n']","Alat bantu utama yang biasanya digunakan untuk menangani pasien yang mengalami syok kardiogenik adalah defibrillator. Defibrillator adalah alat medis yang digunakan untuk mereset elektrolisis jantung setelah terjadi fibrilasi atrioventrikuler (FAP), yaitu keadaan di mana jantung tidak dapat membersihkan darah secara efektif, menyebabkan tekanan darah menurun dan membutuhkan alat bantu untuk mengembalikan fungsi jantung yang normal.\n\nSelain defibrillator, pasien syok kardiogenik juga mungkin mendapatkan infus obat-obatan seperti epinephrine atau salbutamol untuk meningkatkan tekanan darah dan mempercepat respon sirkulasi. Pemberian oksigen juga diberikan untuk menggantikan asupan oksigen yang hilang akibat sesak napas, dan vena-vena pengisap (venous suction) dapat digunakan dalam beberapa situasi untuk mencegah penumpukan darah di paru-paru.\n\nDokter atau dokter yang menangani pasien seringkali menggunakan sejumlah alat bantu medis lainnya, seperti kateter infus, obat temporer untuk mempercepat pembuangan air tetap (fluid status), dan monitor jiwa untuk mengamati frekuensi denyut nadi, tekanan darah, dan oksigenasi darah secara cepat dan akurat.\n\nSetiap tindakan yang dilakukan terhadap pasien syok kardiogenik harus diarahkan oleh penanganan resminya atau dokter spesialisasi dalam bidang ini, sehingga risiko terjadinya gangguan fungsi jantung dapat dikurangi dan kekuatan nyawa pasien tidak mengalami kerugian.",0.4,0.5835001060495859,0.9999999999,0.0
Apa saja hal yang dapat meningkatkan risiko seseorang mengalami syok kardiogenik?,"Selain penyakit dan kondisi yang disebutkan di atas, sejumlah faktor berikut juga bisa meningkatkan risiko seseorang mengalami syok kardiogenik:\n\nBerusia lebih dari 75 tahun\nMenderita gagal jantung\nMenderita diabetes, sepsis, atau pneumothorax\nMenderita berat badan berlebih atau obesitas\nPernah terkena serangan jantung\nPernah menjalani operasi bypass jantung","['Topik: Syok Kardiogenik, Subtopik: Faktor risiko syok kardiogenik \n Selain penyakit dan kondisi yang disebutkan di atas, sejumlah faktor berikut juga bisa meningkatkan risiko seseorang mengalami syok kardiogenik:\nBerusia lebih dari 75 tahun\n- Menderita gagal jantung\n\n- Menderita diabetes, sepsis, atau pneumothorax\n\n- Menderita berat badan berlebih atau obesitas\n\n- Pernah terkena serangan jantung\n- Pernah menjalani operasi bypass jantung\n\n', 'Topik: Syok Kardiogenik, Subtopik: Gejala Syok Kardiogenik: Kapan harus ke dokter \n Segera bawa ke IGD rumah sakit terdekat jika ada seseorang di sekitar Anda yang mengalami gejala seperti di atas, terlebih bila disertai dengan penurunan kesadaran. Syok kardiogenik bisa memburuk dalam waktu yang cepat dan mengancam nyawa sehingga pasien perlu mendapatkan penanganan secepatnya.\nJika Anda memiliki penyakit atau kondisi medis yang dapat meningkatkan risiko terjadinya syok kardiogenik, lakukan pemeriksaan berkala sesuai anjuran dokter.\n', 'Topik: Syok Kardiogenik, Subtopik: Pengertian Syok Kardiogenik \n Syok kardiogenik adalah syok yang disebabkan oleh ketidakmampuan jantung untuk memompa darah ke seluruh tubuh. Syok kardiogenik merupakan kondisi yang berbahaya dan perlu mendapatkan penanganan secepatnya.\nBeberapa gejala yang terjadi saat seseorang mengalami syok kardiogenik adalah penurunan tekanan darah, denyut nadi cepat tetapi lemah, sesak napas, ujung kaki dan tangan terasa dingin, hingga penurunan kesadaran.\n\n']","Hal-hal yang dapat meningkatkan risiko seseorang mengalami syok kardiogenik meliputi:\n\n1. Berusia lebih dari 75 tahun, yang berarti umur yang tinggi dan riwayat penyakit jantung atau gangguan kejiwaannya mungkin meningkatkan risiko terjadinya syok kardiogenik.\n2. Penyakit gagal jantung, yaitu kondisi dimana jantung tidak dapat bekerja secara efektif untuk membersihkan darah dan memindahkannya ke seluruh tubuh.\n3. Diabetes, sepsis (infeksi sistemik), atau pneumothorax (lubang di paru-paru) merupakan penyakit lain yang bisa meningkatkan risiko terjadinya syok kardiogenik.\n4. Berat badan berlebih atau obesitas, yang juga dapat mempengaruhi fungsi jantung dan meningkatkan resiko timbulnya syok kardiogenik.\n5. Pernikahan terkena serangan jantung, yang menunjukan bahwa risiko penyakit jantung atau gangguan kejiwaannya sudah ada sebelumnya dan mempengaruhi resiko timbulnya syok kardiogenik.\n6. Pernama menjalani operasi bypass jantung, yang berarti seseorang telah mengalami pembedahan untuk mencegah aritmia atau gangguan denyut jantung lainnya, dan ini juga bisa mempengaruhi resiko terjadinya syok kardiogenik.",0.5,0.5810561463352611,0.99999999995,1.0
Apa gejala dari penyakit kardiomiopati?,"Kardiomiopati atau lemah jantung pada awalnya jarang menimbulkan gejala. Gejalanya akan muncul dan berkembang seiring dengan menurunnya kerja jantung dalam memompa darah.\n\nBeberapa gejala yang bisa muncul adalah:\n\nNapas pendek, terutama setelah melakukan aktivitas fisik yang berat\nTungkai membengkak (edema tungkai)\nBatuk terutama saat tidur telentang\nTubuh mudah lelah\nPerut kembung\nNyeri dada\nPenglihatan berkunang-kunang\nJantung berdebar-debar (palpitasi)\nDenyut jantung tidak teratur (aritmia)\nPusing dan pingsan","['Topik: Kardiomiopati, Subtopik: Gejala Kardiomiopati \n Kardiomiopati atau lemah jantung pada awalnya jarang menimbulkan gejala. Gejalanya akan muncul dan berkembang seiring dengan menurunnya kerja jantung dalam memompa darah.\nBeberapa gejala yang bisa muncul adalah:\n- Napas pendek, terutama setelah melakukan aktivitas fisik yang berat\n- Tungkai membengkak (edema tungkai)\n- Batuk terutama saat tidur telentang\n- Tubuh mudah lelah\n- Perut kembung\n- Nyeri dada\n- Penglihatan berkunang-kunang\n- Jantung berdebar-debar (palpitasi)\n- Denyut jantung tidak teratur (aritmia)\n- Pusing dan pingsan\n\n', 'Topik: Kardiomiopati, Subtopik: Pengertian Kardiomiopati \n Kardiomiopati adalah penyakit akibat kelainan di otot jantung. Penyakit ini ditandai dengan melemahnya kemampuan jantung untuk memompa darah. Gejala kardiomiopati bisa bervariasi, mulai dari tubuh mudah lelah, napas pendek, pusing, hingga nyeri dada.\nPenyebab kardiomiopati sering kali tidak diketahui dengan pasti. Namun, kondisi ini bisa terkait dengan kelainan genetik atau penyakit tertentu. Penyakit yang sering memicu terjadinya kardiomiopati pada orang dewasa adalah hipertensi kronis, yaitu tekanan darah tinggi yang sudah berlangsung lama.\n\n', 'Topik: Kardiomiopati, Subtopik: Gejala Kardiomiopati: Kapan harus ke dokter \n Lakukan pemeriksaan ke dokter jika Anda mengalami gejala seperti yang telah disebutkan di atas. Jika Anda merasakan keluhan sulit bernapas, nyeri dada, sakit kepala, atau seperti akan pingsan, segera pergi ke IGD rumah sakit terdekat untuk mendapatkan pertolongan gawat darurat.\nJika Anda memiliki faktor yang bisa meningkatkan risiko terkena kardiomiopati, seperti hipertensi, lakukan pemeriksaan berkala ke dokter untuk mencegah terjadinya kardiomiopati.\n']","Gejala kardiomiopati bisa bervariasi dan seringkali mirip dengan gejala biasa saat rekam medis. Namun, ada beberapa gejala khusus yang mungkin terkait dengan penyakit ini, seperti:\n\n1. Napas pendek, terutama setelah melakukan aktivitas fisik yang berat.\n2. Tungkai membengkak (edema tungkai), kadang-kadang disertai gatalan pada bagian tungkai atau leher.\n3. Batuk terutama saat tidur telentang, seringkali dengan nyeri dada yang ringan.\n4. Tubuh mudah lelah, bahkan dalam aktivitas ringan.\n5. Perut kembung dan makin besar.\n6. Nyeri dada, terutama saat beraktivitas fisik atau bila meminum makan.\n7. Penglihatan berkunang-kunang, seperti menjatuhkan pandangan atau melihat gatal pada waktu bereda.\n8. Jantung berdebar-debar (palpitasi) atau detak jantung yang tidak teratur (aritmia).\n9. Pusing dan pingsan, bahkan dalam keadaan istirahat.\n\nGejala ini bisa menandai penyakit kardiomiopati, tetapi seringkali gejala-gejala ini sulit untuk dideteksi oleh orang lain selain pasien sendiri dan dokter. Jika Anda atau seseorang yang kamu cintai mengalami salah satu dari gejala tersebut, segera pergi ke dokter untuk mendapatkan pemeriksaan medis dan rencana pasien kesehatan.",0.6,0.0,0.9999999999666667,1.0
Apa saja komplikasi yang dapat ditimbulkan dari penyakit kardiomiopati?,Kardiomiopati dapat menyebabkan komplikasi serius jika tidak segera terdiagnosis dan ditangani dengan baik. Beberapa komplikasi yang dapat timbul adalah:\n\nGagal jantung\nPenggumpalan darah\nGangguan katup jantung\nHenti jantung dan kematian mendadak,"['Topik: Kardiomiopati, Subtopik: Komplikasi Kardiomiopati \n Kardiomiopati dapat menyebabkan komplikasi serius jika tidak segera terdiagnosis dan ditangani dengan baik. Beberapa komplikasi yang dapat timbul adalah:\n- Gagal jantung\n- Penggumpalan darah\n- Gangguan katup jantung\n- Henti jantung dan kematian mendadak\n', 'Topik: Kardiomiopati, Subtopik: Pengobatan Kardiomiopati \n Pengobatan kardiomiopati tergantung pada gejala serta keparahan kondisi pasien.  Tujuan dari pengobatan adalah untuk meredakan dan mencegah perburukan gejala, serta mengurangi kemungkinan terjadinya komplikasi.\nPenderita kardiomiopati ringan yang belum mengalami gejala apa pun dianjurkan untuk menerapkan pola hidup sehat, seperti:\n- Menjaga berat badan tetap ideal\n- Mengonsumsi makanan yang bergizi seimbang\n\n- Mengelola waktu tidur dan istirahat\n- Mengelola stres dengan baik\n- Berolahraga rutin\n- Berhenti merokok\n- Mengurangi minum kopi atau minuman berkafein\n- Membatasi konsumsi minuman beralkohol\nJika kardiomiopati sudah menimbulkan gejala, dokter dapat memberikan pasien beberapa jenis obat di bawah ini:\n- Obat antiaritmia, untuk mengatur agar detak jantung tetap teratur dan mencegah aritmia\n- Obat antihipertensi, untuk menjaga dan mengelola tekanan darah\n- Obat antikoagulan atau pengencer darah, untuk mencegah terbentuknya gumpalan darah yang dapat memperparah kardiomiopati\n- Obat penghambat aldosterone, untuk menyeimbangkan kadar mineral dalam tubuh sehingga jaringan otot dan saraf jantung dapat bekerja dengan baik\n- Obat diuretik, untuk mengurangi penumpukan cairan dari dalam tubuh\nJika obat-obatan tidak mampu meredakan gejala kardiomiopati yang sudah terlalu parah, pasien dapat menjalani operasi jantung. Jenis operasi yang dilakukan antara lain:\n', 'Topik: Kardiomiopati, Subtopik: Pengertian Kardiomiopati \n Kardiomiopati adalah penyakit akibat kelainan di otot jantung. Penyakit ini ditandai dengan melemahnya kemampuan jantung untuk memompa darah. Gejala kardiomiopati bisa bervariasi, mulai dari tubuh mudah lelah, napas pendek, pusing, hingga nyeri dada.\nPenyebab kardiomiopati sering kali tidak diketahui dengan pasti. Namun, kondisi ini bisa terkait dengan kelainan genetik atau penyakit tertentu. Penyakit yang sering memicu terjadinya kardiomiopati pada orang dewasa adalah hipertensi kronis, yaitu tekanan darah tinggi yang sudah berlangsung lama.\n\n']","Komplikasi yang dapat timbul dari penyaket kardiomiopati meliputi:\n1. Gagal jantung, yaitu kapasitas jantung untuk mengeluarkan cairan dan memfasilitasi aliran darah menurun sehingga organ tubuh tidak mendapatkan oksigen yang dibutuhkan.\n2. Penggumpalan darah, yang bisa berpotensi menjadi stroke atau peningkatan risiko serangan jantung dan penyumbatan arteri.\n3. Gangguan katup jantung, seperti stenosis atau insufisiensi katup, yang dapat menyebabkan aliran darah kurang ideal dan meningkatkan beban pada jantung.\n4. Henti jantung dan kematian mendadak, yaitu risiko parah dari kardiomiopati apabila penyakit tidak segera diketahui dan ditangani.\n\nDalam konteks yang diberikan, komplikasi lain yang harus diperhatikan adalah:\n- Penyebab kardiomiopati seringkali bervariasi, termasuk penyakit genetik atau gangguan fisik seperti hipertensi.",0.46153846153846156,0.7070043451600444,0.99999999995,1.0
Apa saja gejala umum yang dialami oleh seseorang dengan penyakit katup jantung?,"Umumnya, penyakit katup jantung memunculkan gejala-gejala di bawah ini:\n\nNyeri dada saat beraktivitas\nJantung berdebar atau berdetak tidak beraturan (aritmia)\nSesak napas\nTubuh lebih mudah lelah\nPusing\nPingsan\nPembengkakan (edema) di bagian kaki, pergelangan kaki,  perut, atau pembuluh darah di leher\nBatuk darah\nGejala penyakit katup jantung bisa berbeda-beda pada setiap penderita, tergantung pada jenis gangguan katup jantung yang dialami dan tingkat keparahannya. Gejala bisa muncul secara perlahan atau bisa juga secara tiba-tiba dan berkembang sangat cepat.","['Topik: Penyakit Katup Jantung, Subtopik: Gejala Penyakit Katup Jantung \n Katup jantung berperan untuk menjaga kelancaran aliran darah yang ada di dalam jantung dan keluar dari jantung. Katup jantung bekerja tiap kali jantung berdetak. Bunyi  lup-dup  jantung berasal dari suara katup yang sedang menutup setelah menyalurkan darah.\nKetika terjadi gangguan pada katup jantung, biasanya dokter akan menemukan tanda khas berikut: \n- Murmur jantung atau bunyi bising pada jantung  \n\n- Tekanan darah rendah atau tekanan darah tinggi\nPenderita penyakit katup jantung umumnya tidak merasakan gejala khas. Akan tetapi, ia dapat mengalami beberapa gejala akibat aliran darah terhambat sehingga jantung perlu bekerja lebih keras.\nUmumnya, penyakit katup jantung memunculkan gejala-gejala di bawah ini:\n- Nyeri dada saat beraktivitas\n- Jantung berdebar atau berdetak tidak beraturan (aritmia)\n- Sesak napas\n- Tubuh lebih mudah lelah\n- Pusing\n- Pingsan\n- Pembengkakan (edema) di bagian kaki, pergelangan kaki,  perut, atau pembuluh darah di leher\n- Batuk darah\nGejala penyakit katup jantung bisa berbeda-beda pada setiap penderita, tergantung pada jenis gangguan katup jantung yang dialami dan tingkat keparahannya. Gejala bisa muncul secara perlahan atau bisa juga secara tiba-tiba dan berkembang sangat cepat.\n', 'Topik: Penyakit Katup Jantung, Subtopik: Diagnosis Penyakit Katup Jantung \n Untuk mendiagnosis penyakit katup jantung, dokter akan menanyakan gejala, riwayat kesehatan, dan gaya hidup pasien, kemudian dilanjutkan dengan pemeriksaan fisik. \nPemeriksaan fisik dilakukan menggunakan stetoskop untuk mendeteksi suara detak jantung yang tidak normal (bising atau murmur jantung) atau irama jantung yang tidak beraturan.\nSetelah melakukan pemeriksaan fisik, dokter dapat menentukan diagnosis melalui beberapa pemeriksaan penunjang, yaitu:\n- Ekokardiografi, untuk melihat pergerakan jantung, ukuran katup dan ruangan jantung, serta aliran darah yang melewati katup jantung\n\n- Elektrokardiografi (EKG), untuk mengetahui aktivitas listrik jantung, mendeteksi pembesaran ruang jantung dan gangguan irama jantung\n- Foto Rontgen dada, untuk melihat apakah gangguan pada katup jantung telah berdampak pada paru-paru atau menyebabkan pembesaran jantung\n- EKG Treadmill, untuk melihat apakah gejala penyakit katup jantung memburuk saat pasien melakukan aktivitas fisik (misalnya berjalan di treadmill)\n- Kateterisasi jantung, untuk melihat melihat ruang jantung, katup jantung, dan pembuluh darah jantung secara rinci, serta mengukur tekanan di rongga jantung\n\n- MRI jantung, untuk melihat gambaran jantung dan katupnya secara rinci, serta untuk mengetahui tingkat keparahan dari penyakit katup jantung\n', 'Topik: Penyakit Katup Jantung, Subtopik: Pencegahan Penyakit Katup Jantung \n Penyakit katup jantung dapat dicegah dengan menangani penyakit atau infeksi yang berisiko menyebabkan masalah pada katup jantung, di antaranya:\n- Mengobati infeksi streptokokus sedini mungkin agar tidak berkembang menjadi demam reumatik, yang dapat meningkatkan risiko terjadinya penyakit katup jantung\n\n- Mengobati endokarditis sedini mungkin\n\n- Menerapkan kebersihan gigi dan mulut, untuk mencegah infeksi pemicu penyakit katup jantung \n- Mengonsumsi obat dan kontrol secara rutin jika memiliki penyakit kronis yang dapat meningkatkan risiko terjadinya kerusakan katup jantung, seperti hipertensi, penyakit jantung koroner, penyakit autoimun, atau diabetes\nBagi orang yang pernah mengalami penyakit katup jantung, terapkan gaya hidup sehat berikut untuk mencegah kondisi ini memburuk:\n- Mengonsumsi makanan bergizi yang rendah akan kolesterol dan lemak tak jenuh, misalnya sayur, buah, ikan, gandum utuh, dan minyak zaitun\n- Berolahraga rutin, setidaknya 30 menit setiap hari\n- Berhenti merokok\n- Tidur cukup setiap hari atau melakukan konsultasi online dengan dokter jika sulit tidur\n\n- Melakukan pemeriksaan tekanan darah, fungsi jantung, kadar kolesterol darah, serta kadar gula darah secara rutin dengan dokter\n']","Gejala umum yang dialami oleh seseorang dengan penyakit katup jantung meliputi:\n\n1. Nyeri dada saat beraktivitas atau istirahat\n2. Jantung berdebar atau berdetak tidak beraturan (aritmia)\n3. Sesak napas, terutama dalam aktivitas ringan hingga menengah\n4. Tubuh lebih mudah lelah dibandingkan sebelum penyakit\n5. Pusing dan pingsan\n6. Batuk darah atau batuk yang kadaluarsa, terutama saat berjalan-jalan\n7. Pembengkakan (edema) di bagian kaki, pergelangan kaki, perut, atau pembulus darah di leher\n8. Tekanan darah tinggi atau rendah, tergantung jenis dan keadaan penyakit katup jantung yang dialami pasien",0.5,0.45813505934380516,0.9999999999,1.0
Bagaimana cara mencegah penyakit katup jantung?,"Penyakit katup jantung dapat dicegah dengan menangani penyakit atau infeksi yang berisiko menyebabkan masalah pada katup jantung, di antaranya:\n\nMengobati infeksi streptokokus sedini mungkin agar tidak berkembang menjadi demam reumatik, yang dapat meningkatkan risiko terjadinya penyakit katup jantung\nMengobati endokarditis sedini mungkin\nMenerapkan kebersihan gigi dan mulut, untuk mencegah infeksi pemicu penyakit katup jantung \nMengonsumsi obat dan kontrol secara rutin jika memiliki penyakit kronis yang dapat meningkatkan risiko terjadinya kerusakan katup jantung, seperti hipertensi, penyakit jantung koroner, penyakit autoimun, atau diabetes\nBagi orang yang pernah mengalami penyakit katup jantung, terapkan gaya hidup sehat berikut untuk mencegah kondisi ini memburuk:\n\nMengonsumsi makanan bergizi yang rendah akan kolesterol dan lemak tak jenuh, misalnya sayur, buah, ikan, gandum utuh, dan minyak zaitun\nBerolahraga rutin, setidaknya 30 menit setiap hari\nBerhenti merokok\nTidur cukup setiap hari atau melakukan konsultasi online dengan dokter jika sulit tidur\nMelakukan pemeriksaan tekanan darah, fungsi jantung, kadar kolesterol darah, serta kadar gula darah secara rutin dengan dokter","['Topik: Penyakit Katup Jantung, Subtopik: Pengobatan Penyakit Katup Jantung \n Penanganan penyakit katup jantung disesuaikan dengan tingkat keparahannya. Umumnya, dokter akan menyarankan pasien untuk menerapkan gaya hidup sehat, seperti tidak merokok, mengonsumsi makanan yang baik untuk jantung, mengelola stres dengan baik, dan beristirahat yang cukup.\nSetelah itu, dokter juga dapat memberikan tindakan medis, seperti:\n', 'Topik: Penyakit Katup Jantung, Subtopik: Pengertian Penyakit Katup Jantung \n Penyakit katup jantung adalah kondisi ketika katup jantung tidak dapat membuka dan menutup dengan sempurna. Kondisi ini menyebabkan aliran darah di dalam jantung dan yang keluar dari jantung tidak lancar. Penyakit katup jantung dapat ditandai dengan suara jantung yang tidak normal, nyeri dada, pusing, dan sesak napas.\nKatup jantung atau klep jantung merupakan bagian jantung yang berfungsi seperti pintu satu arah. Tugasnya adalah sebagai pintu yang mengalirkan darah dari satu ruang jantung ke ruang lain. Katup jantung juga mengalirkan darah dari jantung ke pembuluh darah yang akan menuju seluruh tubuh.\n\nGangguan pada satu atau beberapa katup jantung dapat berpengaruh dalam fungsi jantung dalam mengalirkan darah dan oksigen ke seluruh tubuh. Berkurangnya distribusi oksigen ke jaringan tubuh (hipoksemia) dapat menyebabkan kerusakan pada berbagai organ tubuh dan mengakibatkan komplikasi yang fatal.\n', 'Topik: Penyakit Katup Jantung, Subtopik: Gejala Penyakit Katup Jantung \n Katup jantung berperan untuk menjaga kelancaran aliran darah yang ada di dalam jantung dan keluar dari jantung. Katup jantung bekerja tiap kali jantung berdetak. Bunyi  lup-dup  jantung berasal dari suara katup yang sedang menutup setelah menyalurkan darah.\nKetika terjadi gangguan pada katup jantung, biasanya dokter akan menemukan tanda khas berikut: \n- Murmur jantung atau bunyi bising pada jantung  \n\n- Tekanan darah rendah atau tekanan darah tinggi\nPenderita penyakit katup jantung umumnya tidak merasakan gejala khas. Akan tetapi, ia dapat mengalami beberapa gejala akibat aliran darah terhambat sehingga jantung perlu bekerja lebih keras.\nUmumnya, penyakit katup jantung memunculkan gejala-gejala di bawah ini:\n- Nyeri dada saat beraktivitas\n- Jantung berdebar atau berdetak tidak beraturan (aritmia)\n- Sesak napas\n- Tubuh lebih mudah lelah\n- Pusing\n- Pingsan\n- Pembengkakan (edema) di bagian kaki, pergelangan kaki,  perut, atau pembuluh darah di leher\n- Batuk darah\nGejala penyakit katup jantung bisa berbeda-beda pada setiap penderita, tergantung pada jenis gangguan katup jantung yang dialami dan tingkat keparahannya. Gejala bisa muncul secara perlahan atau bisa juga secara tiba-tiba dan berkembang sangat cepat.\n']","Untuk mencegah penyakat katup jantung, penting untuk mengikuti beberapa langkah sosial dan kesehatan yang strategis. Berikut adalah cara-cara praktis yang bisa diambil:\n\n1. Menyusui ibu setelah melahirkan: Mengadopsi prinsip ini dapat membantu mencegah infeksi pada bayi dan juga mengurangi risiko terjadinya penyakit katup jantung karena sperma yang biasanya ada dalam ASI bisa menutup lubang katup.\n2. Menggunakan obat-obatan dengan bijak: Jika Anda menderita penyakit jantung atau mengalami risiko tinggi untuk terkena penyakit ini, topik ini perlu dinilai lebih lanjut oleh dokter dan pastikan tidak menggunakan obat-obatan yang dapat menyebabkan gangguan pada jantung.\n3. Mengonsumsi makanan sehat: Menyusui ibu, menurunkan berat badan atau meningkatnya berat badan dan mengkonsumsi asupan gizi yang buruk bisa mempercepat terjadinya penyakit katup jantung. Oleh karena itu, makanan sehat dan vitamin dianjurkan untuk dikonsumsi secara rutin.\n4. Mengontrol tekanan darah dan menurunkan asid urat: Menurunnya tekanan darah dan mengendalikan asid urat dalam tubuh bisa membantu mencegah terjadinya penyakit katup jantung, khususnya pada pasien yang rentan.\n5. Beristirahat cukup: Mengurangi stres dan menghindari aktivitas fisik berlebihan bisa membantu mencegah terjadinya penyakit katup jantung, khususnya pada pasien dengan riwayat penyakit jantung atau tingkat risiko tinggi.\n6. Mengkonsumsi alkohol dan merokok dalam jumlah yang minimal: Konsumsi alkohol dan merokok secara berlebihan bisa meningkatkan risiko terjadinya penyakit katup jantung, sehingga dikhawatinkan untuk dihindari.\n7. Mengadopsi gaya hidup yang sehat: Prinsip ini meliputi aktivitas fisik dan penggunaan obat-obatan secara bijaksana serta menjaga pola makanannya agar tetap sehat.\n8. Melakukan tes gizi dan mengadopsi gaya hidup yang sehat: Penyusunan program kesehatan rutin, termasuk pemantauan berat badan, asupan gizi, tekanan darah, serta penilaian terhadap gangguan fungsi jantung dan risiko penyakit katup jantung.\n9. Mengadopsi prinsip-prinsip kebijakan kesehatan umum: Prinsip ini meliputi pemenuhan asuransi medis, mengikuti pelatihan resmi tentang penyakit jantung dan hubungannya dengan penyebab lain seperti merokok dan obat-obatan.\n10. Menyusui ibu setelah melahirkan: Mengadopsi prinsip ini bisa membantu mencegah infeksi pada bayi dan juga mengurangi risiko terjadinya penyakit katup jantung karena sperma yang biasanya ada dalam ASI.\n\nDengan menjalani langkah-langkah ini, Anda dapat membantu mencegah terjadinya penyakat katup jantung dan mengoptimalkan performa fungsi jantung Anda secara konsesif.",0.6551724137931034,0.49618438383342345,0.9999999999666667,0.8181818181818182
Apa saja hal yang dapat menyebabkan jantung berdebar?,"Jantung berdebar tidak selalu akibat penyakit pada jantung. Berikut adalah beberapa kondisi dan penyakit yang dapat menimbulkan keluhan jantung berdebar kencang:\n\n1. Gaya hidup, seperti:\nKebiasaan merokok\nTidur yang tidak cukup\nLatihan fisik yang berat\nEfek konsumsi minuman beralkohol\nKonsumsi minuman berkafein seperti kopi, teh, dan minuman berenergi\nPenyalahgunaan NAPZA, seperti amfetamin, ekstasi, kokain, atau ganja\nPola makan tinggi gula dan lemak\n\n2. Faktor psikologis, misalnya:\nStres atau gelisah\nSerangan panik\nCemas atau takut luar biasa\n\n3. Obat-obatan, antara lain:\nObat asma\nObat tekanan darah tinggi (antihipertensi)\nAntihistamin\nAntidepresan\nObat flu, contohnya obat yang mengandung phenylephrine\n\n4. Perubahan hormon, misalnya pada masa:\nMenstruasi\nKehamilan\nMenopause\n\n5. Gangguan irama jantung atau aritmia, meliputi:\nFibrilasi atrium\nAtrial flutter\nTakikardia ventrikular\nTakikardia supraventrikular\n\n6. Penyakit jantung, antara lain:\nGagal jantung\nPenyakit jantung bawaan\nKardiomiopati\nPenyakit katup jantung\n\n7. Penyakit atau kondisi tertentu, seperti:\nDehidrasi\nDemam di atas 38 derajat Celcius\nHipertiroidisme\nAnemia\nPheochromocytoma\nHipotensi ortostatik\nKadar gula darah rendah (hipoglikemia)","['Topik: Jantung Berdebar, Subtopik: Penyebab Jantung Berdebar \n Jantung berdebar tidak selalu akibat penyakit pada jantung. Berikut adalah beberapa kondisi dan penyakit yang dapat menimbulkan keluhan jantung berdebar kencang:\n1. Gaya hidup, seperti:\n- Kebiasaan merokok\n\n- Tidur yang tidak cukup\n- Latihan fisik yang berat\n- Efek konsumsi minuman beralkohol\n- Konsumsi minuman berkafein seperti kopi, teh, dan minuman berenergi\n- Penyalahgunaan NAPZA, seperti amfetamin, ekstasi, kokain, atau ganja\n- Pola makan tinggi gula dan lemak\n2. Faktor psikologis, misalnya:\n- Stres atau gelisah\n- Serangan panik\n- Cemas atau takut luar biasa\n3. Obat-obatan, antara lain:\n- Obat asma\n- Obat tekanan darah tinggi (antihipertensi)\n- Antihistamin\n- Antidepresan\n- Obat flu, contohnya obat yang mengandung phenylephrine\n\n4. Perubahan hormon, misalnya pada masa:\n- Menstruasi\n- Kehamilan\n- Menopause\n5. Gangguan irama jantung atau aritmia, meliputi:\n- Fibrilasi atrium\n- Atrial flutter \n- Takikardia ventrikular\n- Takikardia supraventrikular\n6. Penyakit jantung, antara lain:\n- Gagal jantung\n- Penyakit jantung bawaan\n- Kardiomiopati\n- Penyakit katup jantung\n7. Penyakit atau kondisi tertentu, seperti:\n- Dehidrasi\n- Demam di atas 38 derajat Celcius\n- Hipertiroidisme\n- Anemia\n- Pheochromocytoma\n- Hipotensi ortostatik\n- Kadar gula darah rendah (hipoglikemia)\n', 'Topik: Jantung Berdebar, Subtopik: Diagnosis Jantung Berdebar \n Untuk memulai diagnosis, dokter akan melakukan tanya jawab terkait gejala pada pasien yang dapat menandakan gangguan pada jantung. Meski tidak semua kasus jantung berdebar disebabkan oleh gangguan jantung, pemeriksaan perlu dilakukan untuk mencegah komplikasi yang mungkin terjadi akibat gangguan jantung.\nDokter juga akan menanyakan gejala lain yang mungkin menyertai jantung berdebar. Tujuannya adalah untuk mendeteksi kondisi lain yang dapat menyebabkan jantung berdebar, seperti gangguan kelenjar tiroid. Dokter juga akan bertanya tentang aktivitas fisik, tingkat stres, obat yang sedang digunakan, dan riwayat kesehatan pasien.\nSetelah itu, dokter akan melakukan pemeriksaan fisik menyeluruh, termasuk mengukur tekanan darah, suhu tubuh, dan nadi pasien. Dokter juga akan melakukan pemeriksaan yang spesifik, seperti mendengarkan suara jantung pasien menggunakan stetoskop, dan merasakan bagian depan leher untuk memeriksa kelenjar tiroid.\nSelanjutnya, dokter akan melakukan pemeriksaan penunjang untuk memastikan diagnosis. Umumnya, pemeriksaan awal yang dilakukan adalah elektrokardiografi (EKG). Namun, karena jantung berdebar umumnya hilang timbul, EKG mungkin tidak selalu dapat menangkap kelainan pada jantung.\nJika palpitasi dicurigai berasal dari gangguan jantung, pasien akan dirujuk ke dokter jantung untuk menjalani pemeriksaan berikut:\n- Monitor aktivitas listrik jantung selama 24  48 jam dengan alat khusus (Holter monitor)\n- USG jantung atau ekokardiografi\n- Elektrofisiologi jantung\n- MRI jantung\n- Angiografi koroner\nJika hasil pemeriksaan jantung tidak menunjukkan adanya kelainan, pemeriksaan lain dapat dilakukan untuk mendeteksi penyebab jantung berdebar. Beberapa pemeriksaan tersebut adalah:\n- Pemeriksaan darah lengkap, untuk mendeteksi anemia\n- Pemeriksaan hormon, untuk mendeteksi hipertiroidisme atau pheochromocytoma\n\n- Tes urine, untuk mendeteksi penggunaan obat terlarang\n- Tes kehamilan\n', 'Topik: Jantung Berdebar, Subtopik: Pengobatan Jantung Berdebar \n Pengobatan jantung berdebar tergantung pada penyebabnya. Bagi pasien yang menderita penyakit tertentu, misalnya aritmia, gagal jantung, atau hipertiroidisme, dokter akan merujuk pasien ke dokter spesialis terkait untuk menjalani terapi yang spesifik.\nJika diperlukan, dokter akan meresepkan obat jantung berdebar berupa penghambat beta (beta blocker) atau antagonis kalsium (calcium channel blocker) untuk meredakan jantung berdebar. Pada jantung berdebar yang disebabkan oleh gangguan induksi listrik jantung, dokter akan mempertimbangkan operasi ablasi jantung untuk meredakan jantung berdebar.\nSedangkan pada jantung berdebar yang disebabkan oleh gaya hidup tidak sehat, seperti merokok atau mengonsumsi terlalu banyak minuman berkafein, pasien akan disarankan untuk memperbaiki gaya hidupnya menjadi lebih sehat, misalnya dengan berolahraga.\nPada pasien yang mengalami jantung berdebar akibat penggunaan obat-obatan, dianjurkan untuk berkonsultasi dengan dokter yang memberikan obat tersebut. Tidak disarankan berhenti mengonsumsi obat tanpa persetujuan dokter.\nSementara itu, untuk jantung berdebar yang dipicu oleh faktor psikologis dan disertai gejala gelisah dan jantung berdebar, dokter bisa menyarankan pasien mencoba teknik relaksasi sederhana untuk meredakan serangan panik dan rasa cemas. Bila perlu, pasien akan dirujuk ke psikolog atau psikiater agar kondisi mental yang dialami pasien dapat ditangani.\n']","Hal-hal yang dapat menyebabkan jantung berdebar mencakup beberapa kondisi, penyebab, dan faktor lain. Berikut ini daftar lengkap hal tersebut:\n\n1. Kondisi atau penyakit pada jantung, seperti gagal jantung, penyakit katup jantung, kardiomiopati, dll.\n2. Gangguan irama jantung atau aritmia, seperti fibrilasi atrium, atrial flutter, takikardia ventrikular, dan takikardia supraventrikular.\n3. Faktor yang berkait",1.0,0.9962672596752028,0.9999999999666667,1.0
Kapan seseorang harus dibawa ke dokter ketika mengalami jantung berdebar?,"Sensasi jantung berdebar umumnya tidak disebabkan oleh kondisi yang berbahaya dan dapat hilang dengan beristirahat dan tanpa pengobatan khusus. Meski demikian, pemeriksaan oleh dokter perlu segera dilakukan jika jantung berdebar sering kambuh, memburuk, atau terjadi lama hingga hitungan jam.\n\nPemeriksaan juga diperlukan bila orang yang mengalami jantung berdebar memiliki riwayat penyakit maupun operasi jantung, atau terdapat riwayat penyakit jantung pada keluarga.\n\nSegera ke IGD rumah sakit jika jantung berdebar tidak membaik dengan beristirahat, atau disertai dengan keluhan berikut:\n\nNyeri dada seperti tertekan, yang bisa menjalar ke bahu, dagu, punggung, atau lengan\nTubuh terasa lemah\nSesak napas\nKeringat dingin\nPusing hebat\nLinglung\nPingsan","['Topik: Jantung Berdebar, Subtopik: Gejala Jantung Berdebar: Kapan harus ke dokter \n Sensasi jantung berdebar umumnya tidak disebabkan oleh kondisi yang berbahaya dan dapat hilang dengan beristirahat dan tanpa pengobatan khusus. Meski demikian, pemeriksaan oleh dokter perlu segera dilakukan jika jantung berdebar sering kambuh, memburuk, atau terjadi lama hingga hitungan jam.\nPemeriksaan juga diperlukan bila orang yang mengalami jantung berdebar memiliki riwayat penyakit maupun operasi jantung, atau terdapat riwayat penyakit jantung pada keluarga.\nSegera ke IGD rumah sakit jika jantung berdebar tidak membaik dengan beristirahat, atau disertai dengan keluhan berikut:\n- Nyeri dada seperti tertekan, yang bisa menjalar ke bahu, dagu, punggung, atau lengan\n- Tubuh terasa lemah\n- Sesak napas\n- Keringat dingin\n- Pusing hebat\n- Linglung\n- Pingsan\n', 'Topik: Jantung Berdebar, Subtopik: Pengobatan Jantung Berdebar \n Pengobatan jantung berdebar tergantung pada penyebabnya. Bagi pasien yang menderita penyakit tertentu, misalnya aritmia, gagal jantung, atau hipertiroidisme, dokter akan merujuk pasien ke dokter spesialis terkait untuk menjalani terapi yang spesifik.\nJika diperlukan, dokter akan meresepkan obat jantung berdebar berupa penghambat beta (beta blocker) atau antagonis kalsium (calcium channel blocker) untuk meredakan jantung berdebar. Pada jantung berdebar yang disebabkan oleh gangguan induksi listrik jantung, dokter akan mempertimbangkan operasi ablasi jantung untuk meredakan jantung berdebar.\nSedangkan pada jantung berdebar yang disebabkan oleh gaya hidup tidak sehat, seperti merokok atau mengonsumsi terlalu banyak minuman berkafein, pasien akan disarankan untuk memperbaiki gaya hidupnya menjadi lebih sehat, misalnya dengan berolahraga.\nPada pasien yang mengalami jantung berdebar akibat penggunaan obat-obatan, dianjurkan untuk berkonsultasi dengan dokter yang memberikan obat tersebut. Tidak disarankan berhenti mengonsumsi obat tanpa persetujuan dokter.\nSementara itu, untuk jantung berdebar yang dipicu oleh faktor psikologis dan disertai gejala gelisah dan jantung berdebar, dokter bisa menyarankan pasien mencoba teknik relaksasi sederhana untuk meredakan serangan panik dan rasa cemas. Bila perlu, pasien akan dirujuk ke psikolog atau psikiater agar kondisi mental yang dialami pasien dapat ditangani.\n', 'Topik: Jantung Berdebar, Subtopik: Diagnosis Jantung Berdebar \n Untuk memulai diagnosis, dokter akan melakukan tanya jawab terkait gejala pada pasien yang dapat menandakan gangguan pada jantung. Meski tidak semua kasus jantung berdebar disebabkan oleh gangguan jantung, pemeriksaan perlu dilakukan untuk mencegah komplikasi yang mungkin terjadi akibat gangguan jantung.\nDokter juga akan menanyakan gejala lain yang mungkin menyertai jantung berdebar. Tujuannya adalah untuk mendeteksi kondisi lain yang dapat menyebabkan jantung berdebar, seperti gangguan kelenjar tiroid. Dokter juga akan bertanya tentang aktivitas fisik, tingkat stres, obat yang sedang digunakan, dan riwayat kesehatan pasien.\nSetelah itu, dokter akan melakukan pemeriksaan fisik menyeluruh, termasuk mengukur tekanan darah, suhu tubuh, dan nadi pasien. Dokter juga akan melakukan pemeriksaan yang spesifik, seperti mendengarkan suara jantung pasien menggunakan stetoskop, dan merasakan bagian depan leher untuk memeriksa kelenjar tiroid.\nSelanjutnya, dokter akan melakukan pemeriksaan penunjang untuk memastikan diagnosis. Umumnya, pemeriksaan awal yang dilakukan adalah elektrokardiografi (EKG). Namun, karena jantung berdebar umumnya hilang timbul, EKG mungkin tidak selalu dapat menangkap kelainan pada jantung.\nJika palpitasi dicurigai berasal dari gangguan jantung, pasien akan dirujuk ke dokter jantung untuk menjalani pemeriksaan berikut:\n- Monitor aktivitas listrik jantung selama 24  48 jam dengan alat khusus (Holter monitor)\n- USG jantung atau ekokardiografi\n- Elektrofisiologi jantung\n- MRI jantung\n- Angiografi koroner\nJika hasil pemeriksaan jantung tidak menunjukkan adanya kelainan, pemeriksaan lain dapat dilakukan untuk mendeteksi penyebab jantung berdebar. Beberapa pemeriksaan tersebut adalah:\n- Pemeriksaan darah lengkap, untuk mendeteksi anemia\n- Pemeriksaan hormon, untuk mendeteksi hipertiroidisme atau pheochromocytoma\n\n- Tes urine, untuk mendeteksi penggunaan obat terlarang\n- Tes kehamilan\n']","Seseorang harus segera dibawa ke dokter ketika mengalami jantung berdebar, terutama dalam hal-hal berikut:\n1. Jantung berdebar sering kambuh atau memburuk.\n2. Gejala jantung berdebar tidak hilang dengan beristirahat dan tanpa pengobatan.\n3. Adanya riwayat penyakit maupun operasi jantung, atau riwayat penyakit jantung pada keluarga.\n4. Disertai gejala seperti nyeri dada yang menjalar, sesak napas, kedinginan tubuh, pusing, linglung, dan pingsan.\n5. Jantung berdebar tidak membaik dengan beristirahat atau terjadi bersama-sama dengan gejala lain yang disertai.",0.9230769230769231,0.9772374676384796,0.9999999999666667,1.0
Apa saja komplikasi akibat jantung berdebar?,"Jantung berdebar jarang menyebabkan komplikasi. Namun, pada jantung berdebar yang disebabkan oleh penyakit jantung, beberapa komplikasi yang dapat terjadi meliputi:\n\nStroke\nHenti jantung\nGagal jantung","['Topik: Jantung Berdebar, Subtopik: Komplikasi Jantung Berdebar \n Jantung berdebar jarang menyebabkan komplikasi. Namun, pada jantung berdebar yang disebabkan oleh penyakit jantung, beberapa komplikasi yang dapat terjadi meliputi:\n- Stroke\n- Henti jantung\n- Gagal jantung\n', 'Topik: Jantung Berdebar, Subtopik: Diagnosis Jantung Berdebar \n Untuk memulai diagnosis, dokter akan melakukan tanya jawab terkait gejala pada pasien yang dapat menandakan gangguan pada jantung. Meski tidak semua kasus jantung berdebar disebabkan oleh gangguan jantung, pemeriksaan perlu dilakukan untuk mencegah komplikasi yang mungkin terjadi akibat gangguan jantung.\nDokter juga akan menanyakan gejala lain yang mungkin menyertai jantung berdebar. Tujuannya adalah untuk mendeteksi kondisi lain yang dapat menyebabkan jantung berdebar, seperti gangguan kelenjar tiroid. Dokter juga akan bertanya tentang aktivitas fisik, tingkat stres, obat yang sedang digunakan, dan riwayat kesehatan pasien.\nSetelah itu, dokter akan melakukan pemeriksaan fisik menyeluruh, termasuk mengukur tekanan darah, suhu tubuh, dan nadi pasien. Dokter juga akan melakukan pemeriksaan yang spesifik, seperti mendengarkan suara jantung pasien menggunakan stetoskop, dan merasakan bagian depan leher untuk memeriksa kelenjar tiroid.\nSelanjutnya, dokter akan melakukan pemeriksaan penunjang untuk memastikan diagnosis. Umumnya, pemeriksaan awal yang dilakukan adalah elektrokardiografi (EKG). Namun, karena jantung berdebar umumnya hilang timbul, EKG mungkin tidak selalu dapat menangkap kelainan pada jantung.\nJika palpitasi dicurigai berasal dari gangguan jantung, pasien akan dirujuk ke dokter jantung untuk menjalani pemeriksaan berikut:\n- Monitor aktivitas listrik jantung selama 24  48 jam dengan alat khusus (Holter monitor)\n- USG jantung atau ekokardiografi\n- Elektrofisiologi jantung\n- MRI jantung\n- Angiografi koroner\nJika hasil pemeriksaan jantung tidak menunjukkan adanya kelainan, pemeriksaan lain dapat dilakukan untuk mendeteksi penyebab jantung berdebar. Beberapa pemeriksaan tersebut adalah:\n- Pemeriksaan darah lengkap, untuk mendeteksi anemia\n- Pemeriksaan hormon, untuk mendeteksi hipertiroidisme atau pheochromocytoma\n\n- Tes urine, untuk mendeteksi penggunaan obat terlarang\n- Tes kehamilan\n', 'Topik: Jantung Berdebar, Subtopik: Penyebab Jantung Berdebar \n Jantung berdebar tidak selalu akibat penyakit pada jantung. Berikut adalah beberapa kondisi dan penyakit yang dapat menimbulkan keluhan jantung berdebar kencang:\n1. Gaya hidup, seperti:\n- Kebiasaan merokok\n\n- Tidur yang tidak cukup\n- Latihan fisik yang berat\n- Efek konsumsi minuman beralkohol\n- Konsumsi minuman berkafein seperti kopi, teh, dan minuman berenergi\n- Penyalahgunaan NAPZA, seperti amfetamin, ekstasi, kokain, atau ganja\n- Pola makan tinggi gula dan lemak\n2. Faktor psikologis, misalnya:\n- Stres atau gelisah\n- Serangan panik\n- Cemas atau takut luar biasa\n3. Obat-obatan, antara lain:\n- Obat asma\n- Obat tekanan darah tinggi (antihipertensi)\n- Antihistamin\n- Antidepresan\n- Obat flu, contohnya obat yang mengandung phenylephrine\n\n4. Perubahan hormon, misalnya pada masa:\n- Menstruasi\n- Kehamilan\n- Menopause\n5. Gangguan irama jantung atau aritmia, meliputi:\n- Fibrilasi atrium\n- Atrial flutter \n- Takikardia ventrikular\n- Takikardia supraventrikular\n6. Penyakit jantung, antara lain:\n- Gagal jantung\n- Penyakit jantung bawaan\n- Kardiomiopati\n- Penyakit katup jantung\n7. Penyakit atau kondisi tertentu, seperti:\n- Dehidrasi\n- Demam di atas 38 derajat Celcius\n- Hipertiroidisme\n- Anemia\n- Pheochromocytoma\n- Hipotensi ortostatik\n- Kadar gula darah rendah (hipoglikemia)\n']","Komplikasi jantung berdebar, terutama yang disebabkan oleh penyakit jantung, meliputi:\n\n1. Stroke (kembuli) – Kehilangan fungsi pada bagian tubuh karena aliran darah terganggu atau luka di dalam tengkorak.\n2. Henti jantung – Kematian akibat penyebab lain selain stroke, seperti infeksi, gangguan aritmik, atau gagal jantung yang tidak terkait langsung dengan stroke.\n3. Gagal jantung – Kemampuan jantung untuk membersihkan darah dan memompa itu sendiri menurun sehingga menyebabkan pasien merasa pusing, lelah atau takut merasa gatal di dada.\n4. Penyakit jantung lainnya yang dapat disertai oleh komplikasi seperti aritmia (gangguan ritme jantung), penyakit katup jantung, kardiomiopati dan lain-lain.\n\nKomplikasi ini bisa timbul akibat faktor internal atau eksternal, yang dapat mempengaruhi fungsi jantung seperti pemakaian obat, pola makan, stres, latihan fisik dan penyakit lainnya.",0.5714285714285714,0.46586732562854677,0.9999999999666667,1.0
Apa itu penyakit kardiomegali?,"Kardiomegali adalah membesarnya ukuran jantung akibat penyakit tertentu, seperti tekanan darah tinggi atau penyakit jantung koroner. Tergantung pada penyebabnya, kondisi ini bisa terjadi secara permanen atau hanya sementara.\n\nKardiomegali biasanya terjadi karena penyakit atau kondisi yang menyebabkan jantung harus bekerja lebih keras untuk memompa darah. Akibatnya, otot jantung menebal sehingga ukuran jantung membesar.\n\nKardiomegali dapat terlihat melalui pemindaian, seperti foto Rontgen. Kondisi ini umumnya bukan merupakan suatu keadaan darurat. Namun, penting untuk mencari tahu penyebab kardiomegali sehingga penanganan yang tepat bisa diberikan dan komplikasinya dapat dicegah.","['Topik: Kardiomegali, Subtopik: Pengertian Kardiomegali \n Kardiomegali adalah membesarnya ukuran jantung akibat penyakit tertentu, seperti tekanan darah tinggi atau penyakit jantung koroner. Tergantung pada penyebabnya, kondisi ini bisa terjadi secara permanen atau hanya sementara.\nKardiomegali biasanya terjadi karena penyakit atau kondisi yang menyebabkan jantung harus bekerja lebih keras untuk memompa darah. Akibatnya, otot jantung menebal sehingga ukuran jantung membesar.\n\nKardiomegali dapat terlihat melalui pemindaian, seperti foto Rontgen. Kondisi ini umumnya bukan merupakan suatu keadaan darurat. Namun, penting untuk mencari tahu penyebab kardiomegali sehingga penanganan yang tepat bisa diberikan dan komplikasinya dapat dicegah.\n', 'Topik: Kardiomegali, Subtopik: Pengertian Kardiomegali \n Kardiomegali biasanya terjadi karena penyakit atau kondisi yang menyebabkan jantung harus bekerja lebih keras untuk memompa darah. Akibatnya, otot jantung menebal sehingga ukuran jantung membesar.\n\nKardiomegali dapat terlihat melalui pemindaian, seperti foto Rontgen. Kondisi ini umumnya bukan merupakan suatu keadaan darurat. Namun, penting untuk mencari tahu penyebab kardiomegali sehingga penanganan yang tepat bisa diberikan dan komplikasinya dapat dicegah.\n', 'Topik: Kardiomegali, Subtopik: Penyebab dan Faktor Risiko Kardiomegali \n Kardiomegali terjadi ketika otot jantung memompa darah lebih keras daripada yang seharusnya. Beban kerja yang berlebihan ini lama-lama menyebabkan otot jantung menebal sehingga ukuran jantung menjadi lebih besar.\nBeberapa kondisi yang dapat menyebabkan jantung bengkak atau kardiomegali adalah:\n- Hipertensi\n- Penyakit jantung koroner\n- Penyakit katup jantung\n- Kardiomiopati\n- Gangguan irama jantung (aritmia)\n- Penumpukan cairan di selaput pelindung jantung (efusi perikardium)\n- Gangguan hormon tiroid\n- Anemia\n- Kelebihan zat besi dalam tubuh (hemokromatosis)\n- Infeksi virus pada jantung\n- Infeksi HIV\n- Gagal ginjal\n- Penyakit paru, seperti penyakit paru obstruktif kronik (PPOK)\n- Penyakit amiloidosis\n\n- Penyakit jantung bawaan, seperti kelainan katup jantung atau koarktasio aorta\n\n- Kehamilan\nSelain kondisi-kondisi di atas, risiko kardiomegali juga lebih tinggi pada seseorang dengan beberapa faktor di bawah ini:\n- Memiliki berat badan berlebih atau obesitas\n- Kurang beraktivitas fisik dan berolahraga\n- Menderita kecanduan alkohol\n- Menyalahgunakan NAPZA\n- Pernah terkena serangan jantung\n\n- Memiliki keluarga dengan riwayat pembengkakan jantung\n']","Penyakit kardiomegali adalah suatu keadaan dimana ukuran jantung (misalnya ventrikel di bagian bawah jantung) mengecil dan mengembun akibat otot jantung yang bekerja lebih keras untuk memompa darah. Hal ini biasanya disebabkan oleh penyakit atau kondisi lain yang menyebabkan jantung harus bekerja lebih keras untuk mengalirkan darah. Kardiomegali dapat terjadi secara permanen (setidaknya dalam jangka panjang) atau hanya sementara, tergantung pada penyebab dan dampaknya.",0.625,0.7662043283731362,0.9999999999666667,1.0
Apa saja obat yang dapat mengatasi penyakit kardiomegali?,"Untuk mengatasi kardiomegali yang disebabkan oleh tekanan darah tinggi atau gagal jantung, dokter dapat memberikan beberapa obat-obatan berikut:\n\nObat penurun tekanan darah golongan ACE inhibitors, seperti captopril; atau obat ARB, seperti candesartan\nObat penghambat beta (beta blockers), seperti bisoprolol, untuk mengontrol tekanan darah dan meningkatkan fungsi pompa jantung\nObat diuretik, untuk mengurangi penumpukan cairan di dalam tubuh agar tekanan darah menurun dan pembengkakan berkurang\n\nUntuk mengatasi penyebab kardiomegali yang terkait dengan irama jantung, dokter dapat meresepkan obat pengontrol denyut jantung, seperti digoxin. Apabila pasien berisiko menderita stroke atau serangan jantung, dokter juga dapat memberikan obat pengencer darah.","['Topik: Kardiomegali, Subtopik: Pengobatan Kardiomegali \n Pengobatan kardiomegali berfokus untuk mengatasi penyebab pembesaran jantung. Metode pengobatannya mencakup pemberian obat atau operasi, tergantung pada penyebab dan tingkat keparahannya.\nUntuk mengatasi kardiomegali yang disebabkan oleh tekanan darah tinggi atau gagal jantung, dokter dapat memberikan beberapa obat-obatan berikut:\n- Obat penurun tekanan darah golongan ACE inhibitors, seperti captopril; atau obat ARB, seperti candesartan\n- Obat penghambat beta (beta blockers), seperti bisoprolol, untuk mengontrol tekanan darah dan meningkatkan fungsi pompa jantung\n- Obat diuretik, untuk mengurangi penumpukan cairan di dalam tubuh agar tekanan darah menurun dan pembengkakan berkurang\nUntuk mengatasi penyebab kardiomegali yang terkait dengan irama jantung, dokter dapat meresepkan obat pengontrol denyut jantung, seperti digoxin. Apabila pasien berisiko menderita stroke atau serangan jantung, dokter juga dapat memberikan obat pengencer darah.\nJika obat-obatan tidak cukup ampuh dalam mengatasi penyebab kardiomegali, dokter dapat melakukan operasi. Beberapa jenis operasi yang bisa dilakukan untuk menangani kardiomegali adalah:\n- Pemasangan alat pacu jantung atau implantable cardioverter-defibrillator (ICD), untuk memantau dan mengendalikan irama jantung\n- Operasi bypass jantung, untuk mengatasi penyumbatan pembuluh darah jantung pada kardiomegali yang disebabkan oleh penyakit jantung koroner\n\n- Operasi katup jantung, untuk mengganti katup yang bermasalah\n- Transplantasi atau pencangkokan jantung, sebagai pilihan terakhir jika berbagai prosedur medis lain tidak dapat menangani kardiomegali\nPeluang keberhasilan pengobatan kardiomegali akan lebih besar jika didukung dengan perubahan gaya hidup menjadi lebih sehat, seperti:\n- Berolahraga secara rutin\n- Mengelola stres dengan baik\n- Menjaga berat badan ideal\n\n- Membatasi asupan garam dalam makanan\n- Tidur yang cukup, sekitar 7  9 jam sehari\n- Berhenti merokok\n- Membatasi konsumsi minuman beralkohol atau berkafein\n\n- Menjaga kadar gula darah dan tekanan darah\nKardiomegali yang terjadi sementara, misalnya akibat kehamilan atau infeksi, biasanya dapat sembuh total dan jantung akan kembali ke ukuran normal. Sementara itu, kardiomegali yang disebabkan oleh penyakit lain biasanya bersifat permanen sehingga perlu terus diobati.\n', 'Topik: Kardiomegali, Subtopik: Pencegahan Kardiomegali \n Kardiomegali dapat dihindari dengan mencegah terjadinya penyakit penyebab dan faktor risikonya. Upaya yang dapat dilakukan adalah dengan menjalani gaya hidup sehat guna menjaga kesehatan jantung, seperti:\n- Mengonsumsi makanan yang baik untuk penderita jantung bengkak, seperti buah, sayur, ikan, susu rendah lemak, dan biji-bijian\n- Membatasi asupan garam dan lemak jenuh dalam makanan\n- Menghindari konsumsi minuman beralkohol\n- Berhenti merokok\n- Berolahraga rutin\n- Menjaga kadar kolesterol dan tekanan darah\n- Mencuci tangan dengan sabun dan air mengalir secara rutin\n', 'Topik: Kardiomegali, Subtopik: Penyebab dan Faktor Risiko Kardiomegali \n Kardiomegali terjadi ketika otot jantung memompa darah lebih keras daripada yang seharusnya. Beban kerja yang berlebihan ini lama-lama menyebabkan otot jantung menebal sehingga ukuran jantung menjadi lebih besar.\nBeberapa kondisi yang dapat menyebabkan jantung bengkak atau kardiomegali adalah:\n- Hipertensi\n- Penyakit jantung koroner\n- Penyakit katup jantung\n- Kardiomiopati\n- Gangguan irama jantung (aritmia)\n- Penumpukan cairan di selaput pelindung jantung (efusi perikardium)\n- Gangguan hormon tiroid\n- Anemia\n- Kelebihan zat besi dalam tubuh (hemokromatosis)\n- Infeksi virus pada jantung\n- Infeksi HIV\n- Gagal ginjal\n- Penyakit paru, seperti penyakit paru obstruktif kronik (PPOK)\n- Penyakit amiloidosis\n\n- Penyakit jantung bawaan, seperti kelainan katup jantung atau koarktasio aorta\n\n- Kehamilan\nSelain kondisi-kondisi di atas, risiko kardiomegali juga lebih tinggi pada seseorang dengan beberapa faktor di bawah ini:\n- Memiliki berat badan berlebih atau obesitas\n- Kurang beraktivitas fisik dan berolahraga\n- Menderita kecanduan alkohol\n- Menyalahgunakan NAPZA\n- Pernah terkena serangan jantung\n\n- Memiliki keluarga dengan riwayat pembengkakan jantung\n']","Obat-obatan yang dapat digunakan untuk mengatasi penyebab kardiomegali meliputi beberapa jenis obat, seperti ACE inhibitor atau angiotensin converting enzyme inhibitors (ACEI), angiotensin receptor blockers (ARB), beta blokker, dan diuretik. Berikut adalah spesifikasi masing-masing jenis obat:\n\n1. Obat penurun tekanan darah golongan ACE inhibitor, contohnya captopril atau angiotensin converting enzyme inhibitors (ACEI), seperti lisinopolis dan perindopril. Ini berguna untuk mengatasi kardiomegali yang disebabkan oleh tekanan darah tinggi atau gagal jantung.\n2. Obat ARB, contohnya candesartan atau angiotensin receptor blockers (ARB), digunakan untuk mengatasi penyebab kardiomegali yang sama sekali berbeda dengan obat di atas.\n3. Obat penghambat beta, contohnya bisoprolol dan carvedilol, digunakan untuk mengontrol tekanan darah dan meningkatkan fungsi pompa jantung pada kardiomegali yang disebabkan oleh gagal jantung.\n4. Obat diuretik, contohnya furosemid atau torasemid, digunakan untuk mengurangi penumpukan cairan di dalam tubuh agar tekanan darah menurun dan pembengkakan berkurang pada kardiomegali yang disebabkan oleh gagal jantung.\n5. Obat pengontrol denyut jantung, contohnya digoxin, digunakan untuk mengendalikan irama jantung dalam kardiomegali yang terkait dengan tekanan darah tinggi atau gagal jantung.\n6. Obat pengencer darah, seperti warfarin atau heparin, digunakan untuk mengurangi resiko stroke atau serangan jantung dalam kardiomegali yang disebabkan oleh penyakit trombosis.\n7. Beberapa obat lainnya juga dapat digunakan secara eksperimen untuk mengatasi penyebab kardiomegali, seperti angiotensin II receptor antagonist (ARNI) atau mavacamten.",1.0,0.6190568820852423,0.8333333332916666,1.0
Bagaimana kelainan jantung yang dialami oleh seseorang dengan penyakit tetralogy of fallot?,"Berikut ini adalah empat kelainan jantung yang terjadi pada ToF:\n\nVentricular septal defect (VSD), yaitu lubang di dinding yang memisahkan ventrikel kanan dan kiri\nPulmonary valve stenosis, yaitu penyempitan pada katup pembuluh darah yang ke paru-paru (katup pulmonal) sehingga darah dari jantung yang ke paru-paru berkurang\nPosisi aorta tidak normal, yakni bergeser ke kanan mengikuti VSD yang terbentuk\nRight ventricular hypertrophy atau penebalan pada otot ventrikel kanan jantung akibat jantung bekerja terlalu keras untuk memompa darah","['Topik: Tetralogy of Fallot, Subtopik: Pengertian Tetralogy of Fallot \n Tetralogy of Fallot adalah salah satu penyakit jantung bawaan pada bayi baru lahir. Penyakit jantung ini terdiri dari empat jenis kelainan struktur pada jantung bayi. Tetralogy of Fallot menyebabkan darah yang dialirkan ke seluruh tubuh bayi tidak mengandung cukup oksigen.\nTetralogy of Fallot (ToF) terjadi ketika bayi masih di dalam kandungan, tepatnya ketika jantungnya sedang berkembang. Di antara penyakit jantung bawaan yang ada, tetralogy of Fallot merupakan salah satu jenis yang umum ditemui. Namun, kondisi ini diperkirakan hanya terjadi pada 5 dari 10.000 kelahiran.\n\nKelainan struktur jantung pada ToF menyebabkan darah yang kaya oksigen bercampur dengan darah yang kekurangan oksigen. Akibatnya, darah yang mengalir ke seluruh tubuh tidak mengandung oksigen yang cukup dan bayi pun kekurangan oksigen.\nBerikut ini adalah empat kelainan jantung yang terjadi pada ToF:\n- Ventricular septal defect (VSD), yaitu lubang di dinding yang memisahkan ventrikel kanan dan kiri\n- Pulmonary valve stenosis, yaitu penyempitan pada katup pembuluh darah yang ke paru-paru (katup pulmonal) sehingga darah dari jantung yang ke paru-paru berkurang\n- Posisi aorta tidak normal, yakni bergeser ke kanan mengikuti VSD yang terbentuk\n- Right ventricular hypertrophy atau penebalan pada otot ventrikel kanan jantung akibat jantung bekerja terlalu keras untuk memompa darah\n', 'Topik: Tetralogy of Fallot, Subtopik: Pengertian Tetralogy of Fallot \n Tetralogy of Fallot (ToF) terjadi ketika bayi masih di dalam kandungan, tepatnya ketika jantungnya sedang berkembang. Di antara penyakit jantung bawaan yang ada, tetralogy of Fallot merupakan salah satu jenis yang umum ditemui. Namun, kondisi ini diperkirakan hanya terjadi pada 5 dari 10.000 kelahiran.\n\nKelainan struktur jantung pada ToF menyebabkan darah yang kaya oksigen bercampur dengan darah yang kekurangan oksigen. Akibatnya, darah yang mengalir ke seluruh tubuh tidak mengandung oksigen yang cukup dan bayi pun kekurangan oksigen.\nBerikut ini adalah empat kelainan jantung yang terjadi pada ToF:\n- Ventricular septal defect (VSD), yaitu lubang di dinding yang memisahkan ventrikel kanan dan kiri\n- Pulmonary valve stenosis, yaitu penyempitan pada katup pembuluh darah yang ke paru-paru (katup pulmonal) sehingga darah dari jantung yang ke paru-paru berkurang\n- Posisi aorta tidak normal, yakni bergeser ke kanan mengikuti VSD yang terbentuk\n- Right ventricular hypertrophy atau penebalan pada otot ventrikel kanan jantung akibat jantung bekerja terlalu keras untuk memompa darah\n', 'Topik: Tetralogy of Fallot, Subtopik: Komplikasi Tetralogy of Fallot \n Tetralogy of Fallot yang tidak tertangani atau tidak terkontrol dengan baik dapat menimbulkan komplikasi serius, seperti:\n- Gangguan tumbuh kembang anak\n- Gangguan irama jantung\n- Kejang\n- Peradangan di lapisan dalam jantung (endokarditis)\n- Kematian\nPenting untuk diingat, risiko terkena komplikasi ToF dapat berlanjut sampai masa remaja atau dewasa. Jika ToF tidak tertangani dengan baik, jantung penderita bisa saja mengalami masalah lagi walau sudah pernah menjalani operasi. Oleh sebab itu, penderita tetap harus kontrol secara rutin semasa hidupnya.\n']","Kelainan jantung pada orang yang menderita Tetralogy of Fallot (ToF) terdiri dari empat penyakit jantung yang saling berhubungan, yaitu:\n\n1. Ventricular septal defect (VSD): Lubang di dinding yang memisahkan ventrikel kanan dan kiri pada jantung. VSD menyebabkan darah oksigen tinggi bercampur dengan darah kekurangan oksigen, sehingga jumlah oksigen dalam darah yang mengalir ke seluruh tubuh menjadi rendah.\n2. Pulmonary valve stenosis: Penyempitan pada katup pembuluh darah menuju paru-paru (katup pulmonal), menyebabkan aliran darah ke paru-paru berkurang. Hal ini berakibat rendahnya jumlah oksigen dalam darah yang mengalir ke sirkulasi sistemik.\n3. Posisi aorta tidak normal: Aorta bergeser ke kanan, seiring dengan terbentuknya VSD. Ini menyebabkan aliran darah masuk dan keluar jantung menjadi biasa.\n4. Right ventricular hypertrophy atau penebalan otot ventrikel kanan: Hal ini disebabkan oleh beban kerja yang berlebihan jantung untuk memompa darah, terutama akibat aliran tidak normal dan penyempitan katup pulmonal.\n\nKeseluruhan komplikasi ini menyebabkan bayi dengan ToF kekurangan oksigen yang cukup, yang pada akhirnya bisa berdampak buruk pada pertumbuhan dan perkembangan fisik serta fungsional.",0.5714285714285714,0.5790310090728132,0.9999999999666667,1.0
Bagaimana cara mencegah bayi agar terhindar dari penyakit tetralogy of fallot?,"Penyakit jantung bawaan umumnya tidak dapat dicegah, termasuk tetralogy of Fallot. Namun, ada beberapa upaya yang dapat dilakukan oleh ibu hamil untuk mengurangi risiko bayi terlahir dengan kondisi ini, yaitu:\n\nKonsultasikan terlebih dahulu dengan dokter sebelum mengonsumsi obat-obatan, termasuk obat herbal atau obat yang bisa dibeli di apotik.\nKonsumsi suplemen asam folat 400 mcg setiap hari pada trimester pertama kehamilan.\nPastikan telah mendapatkan imunisasi rubella dan flu sebelum hamil.\nJalani pengobatan sesuai yang dianjurkan dokter jika menderita diabetes.\nHindari kebiasaan merokok dan paparan asap rokok, terutama selama hamil.\nJangan mengonsumsi minuman beralkohol dan menggunakan NAPZA.\nHindari kontak dengan orang yang sedang sakit atau terinfeksi.","['Topik: Tetralogy of Fallot, Subtopik: Pencegahan Tetralogy of Fallot \n Penyakit jantung bawaan umumnya tidak dapat dicegah, termasuk tetralogy of Fallot. Namun, ada beberapa upaya yang dapat dilakukan oleh ibu hamil untuk mengurangi risiko bayi terlahir dengan kondisi ini, yaitu:\n- Konsultasikan terlebih dahulu dengan dokter sebelum mengonsumsi obat-obatan, termasuk obat herbal atau obat yang bisa dibeli di apotik.\n- Konsumsi suplemen asam folat 400 mcg setiap hari pada trimester pertama kehamilan.\n- Pastikan telah mendapatkan imunisasi rubella dan flu sebelum hamil.\n- Jalani pengobatan sesuai yang dianjurkan dokter jika menderita diabetes.\n- Hindari kebiasaan merokok dan paparan asap rokok, terutama selama hamil.\n- Jangan mengonsumsi minuman beralkohol dan menggunakan NAPZA.\n- Hindari kontak dengan orang yang sedang sakit atau terinfeksi.\n', 'Topik: Tetralogy of Fallot, Subtopik: Pengertian Tetralogy of Fallot \n Tetralogy of Fallot adalah salah satu penyakit jantung bawaan pada bayi baru lahir. Penyakit jantung ini terdiri dari empat jenis kelainan struktur pada jantung bayi. Tetralogy of Fallot menyebabkan darah yang dialirkan ke seluruh tubuh bayi tidak mengandung cukup oksigen.\nTetralogy of Fallot (ToF) terjadi ketika bayi masih di dalam kandungan, tepatnya ketika jantungnya sedang berkembang. Di antara penyakit jantung bawaan yang ada, tetralogy of Fallot merupakan salah satu jenis yang umum ditemui. Namun, kondisi ini diperkirakan hanya terjadi pada 5 dari 10.000 kelahiran.\n\nKelainan struktur jantung pada ToF menyebabkan darah yang kaya oksigen bercampur dengan darah yang kekurangan oksigen. Akibatnya, darah yang mengalir ke seluruh tubuh tidak mengandung oksigen yang cukup dan bayi pun kekurangan oksigen.\nBerikut ini adalah empat kelainan jantung yang terjadi pada ToF:\n- Ventricular septal defect (VSD), yaitu lubang di dinding yang memisahkan ventrikel kanan dan kiri\n- Pulmonary valve stenosis, yaitu penyempitan pada katup pembuluh darah yang ke paru-paru (katup pulmonal) sehingga darah dari jantung yang ke paru-paru berkurang\n- Posisi aorta tidak normal, yakni bergeser ke kanan mengikuti VSD yang terbentuk\n- Right ventricular hypertrophy atau penebalan pada otot ventrikel kanan jantung akibat jantung bekerja terlalu keras untuk memompa darah\n', 'Topik: Tetralogy of Fallot, Subtopik: Gejala Tetralogy of Fallot: Kapan harus ke dokter \n Lakukan pemeriksaan ke dokter jika muncul gejala atau tanda di atas pada anak. Jika anak terlihat sesak dan bibirnya membiru (sianosis), posisikan anak berbaring menyamping dengan lutut menekuk ke dada dan jangan tunda untuk membawanya ke IGD rumah sakit terdekat.\nPenderita tetralogy of Fallot perlu rutin menjalani pemeriksaan ke dokter seumur hidupnya. Tujuannya adalah agar kondisinya selalu terpantau dan dapat menjalani aktivitas dengan baik.\n']","Untuk mencegah Bayi agar terhindar dari Penyakit Tetralogy of Fallot, ibu hamil harus mengikuti beberapa langkah yaitu : \n1. Konsultasikan dulu dengan dokter sebelum mengonsumsi obat-obatan, termasuk obat herbal atau yang bisa dibeli di apotik.\n2. Konsumsi suplemen asam folat 400 mcg setiap hari pada trimester pertama kehamilan.\n3. Pastikan mendapatkan imunisasi rubella dan flu sebelum hamil.\n4. Jalani pengobatan sesuai yang dianjurkan dokter jika mengalami diabetes.\n5. Hindari merokok, minuman beralkohol, dan paparan asap rokok serta menghindari kontak dengan orang sakit atau terinfeksi.",1.0,0.7044004396249636,0.99999999995,1.0
Apa kelainan kondisi pada jantung seseorang yang mengalami takikardia?,"Takikardia adalah kondisi jantung yang berdetak melebihi 100 kali per menit. Normalnya, jantung berdetak 60–100 kali per menit. Jika detak jantung lebih dari 100 kali per menit, kondisi ini disebut takikardia.\n\nDetak jantung yang terlalu cepat dapat menyebabkan aliran darah yang masuk ke jantung berkurang. Kondisi ini membuat jantung tidak memiliki cukup darah untuk dialirkan ke seluruh tubuh. Akibatnya, organ dan jaringan yang tidak dialiri darah menjadi kekurangan oksigen.","['Topik: Takikardia, Subtopik: Pengertian Takikardia \n Takikardia adalah kondisi jantung yang berdetak melebihi 100 kali per menit. Takikardia dapat terjadi sebagai respons dari kondisi normal, penyakit, atau gangguan irama jantung (aritmia).\nNormalnya, jantung berdetak 60  100 kali per menit. Jika detak jantung lebih dari 100 kali per menit, kondisi ini disebut takikardia.\n\nTakikardia terbagi dua, yaitu takikardia sinus dan aritmia. Takikardia sinus bisa terjadi ketika seseorang sedang berolahraga. Kondisi ini juga dapat terjadi sebagai respons tubuh terhadap stres, trauma, atau penyakit. Sementara aritmia terjadi akibat gangguan pada serambi atau bilik jantung sehingga detak jantung menjadi lebih cepat.\nTakikardia umumnya tidak menimbulkan gejala atau komplikasi. Namun, kondisi ini dapat mengganggu fungsi jantung jika dibiarkan tidak tertangani. Akibatnya, penderita bisa mengalami gagal jantung, stroke, serangan jantung mendadak, bahkan kematian.\n', 'Topik: Takikardia, Subtopik: Pengertian Takikardia \n Normalnya, jantung berdetak 60  100 kali per menit. Jika detak jantung lebih dari 100 kali per menit, kondisi ini disebut takikardia.\n\nTakikardia terbagi dua, yaitu takikardia sinus dan aritmia. Takikardia sinus bisa terjadi ketika seseorang sedang berolahraga. Kondisi ini juga dapat terjadi sebagai respons tubuh terhadap stres, trauma, atau penyakit. Sementara aritmia terjadi akibat gangguan pada serambi atau bilik jantung sehingga detak jantung menjadi lebih cepat.\nTakikardia umumnya tidak menimbulkan gejala atau komplikasi. Namun, kondisi ini dapat mengganggu fungsi jantung jika dibiarkan tidak tertangani. Akibatnya, penderita bisa mengalami gagal jantung, stroke, serangan jantung mendadak, bahkan kematian.\n', 'Topik: Takikardia, Subtopik: Pengobatan Takikardia \n Pengobatan takikardia bertujuan untuk menurunkan detak jantung yang cepat, mencegah kekambuhan dan komplikasi, serta mengatasi penyebab takikardia.\nBagi penderita yang mengalami takikardia sinus, dokter akan menangani penyebabnya. Jika penyebabnya adalah stres, dokter akan meminta pasien untuk memperbaiki gaya hidup sehingga stres bisa mereda. Sementara jika penyebabnya adalah kondisi medis, dokter akan memberikan pengobatan sesuai kondisi pasien.\nPada pasien takikardia supaventrikuler, dokter akan menganjurkan untuk beristirahat yang cukup, mengurangi konsumsi minuman beralkohol atau berkafein, dan berhenti merokok.\nSementara itu, bagi penderita takikardia yang disertai dengan gangguan irama jantung (aritmia), ada beberapa penanganan yang dapat dilakukan, yaitu:\n']","Kelainan kondisi pada jantung seseorang yang mengalami takikardia tidak terdapat secara eksplisit dalam konteks yang diberikan. Namun, kesimpulannya adalah bahwa takikardia merupakan suatu kondisi di mana detak jantung melebihi 100 kali per menit, sebaliknya normalnya berada pada rentang 60 hingga 100 kali per menit.\n\nDalam konteks ini, takikardia terbagi dua yaitu takikardia sinus dan aritmia. Takikardia sinus bisa terjadi ketika seseorang sedang berolahraga atau saat mengalami stres, trauma, penyakit lainnya. Aritmia adalah gangguan pada serambi atau bilik jantung sehingga detak jantung menjadi lebih cepat.\n\nTakikardia umumnya tidak menimbulkan gejala atau komplikasi, tetapi bisa mengganggu fungsi jantung apabila tidak terobati. Akibatnya, penderita mungkin mengalami gagal jantung, stroke, serangan jantung mendadak, bahkan kematian.\n\nUntuk penyebab takikardia sinus dan aritmia yang disertai dengan komplikasi seperti itu, dokter akan menangani penyebabnya masing-masing sesuai dengan gejala atau kondisi pasien. Pengobatan takikardia bertujuan untuk menurunkan detak jantung cepat, mengatasi kekambuhan dan komplikasinya serta memperbaiki penyebabnya.",1.0,0.0,0.9999999999666667,0.5
Siapa saja orang yang berisiko mengalami takikardia?,"Takikardia atau aritmia lebih sering terjadi pada orang dengan faktor berikut:\n\nBerusia lanjut\nMemiliki penyakit endokrin, seperti diabetes atau penyakit tiroid, yang tidak terkontrol\nMemiliki hipertensi yang tidak terkontrol\nMengalami infeksi bakteri atau virus yang berat\nMenderita atau pernah mengalami hipertensi pulmonal\nMengonsumsi minuman beralkohol secara berlebihan\nMenggunakan NAPZA\nTidak cukup mengonsumsi kalsium, magnesium, atau kalium\n\nTakikardia supraventrikuler lebih sering dialami oleh wanita dan anak-anak, orang yang memiliki kebiasaan merokok, serta orang yang mengonsumsi minuman beralkohol atau berkafein secara berlebihan.","['Topik: Takikardia, Subtopik: Pengertian Takikardia \n Takikardia adalah kondisi jantung yang berdetak melebihi 100 kali per menit. Takikardia dapat terjadi sebagai respons dari kondisi normal, penyakit, atau gangguan irama jantung (aritmia).\nNormalnya, jantung berdetak 60  100 kali per menit. Jika detak jantung lebih dari 100 kali per menit, kondisi ini disebut takikardia.\n\nTakikardia terbagi dua, yaitu takikardia sinus dan aritmia. Takikardia sinus bisa terjadi ketika seseorang sedang berolahraga. Kondisi ini juga dapat terjadi sebagai respons tubuh terhadap stres, trauma, atau penyakit. Sementara aritmia terjadi akibat gangguan pada serambi atau bilik jantung sehingga detak jantung menjadi lebih cepat.\nTakikardia umumnya tidak menimbulkan gejala atau komplikasi. Namun, kondisi ini dapat mengganggu fungsi jantung jika dibiarkan tidak tertangani. Akibatnya, penderita bisa mengalami gagal jantung, stroke, serangan jantung mendadak, bahkan kematian.\n', 'Topik: Takikardia, Subtopik: Pengertian Takikardia \n Normalnya, jantung berdetak 60  100 kali per menit. Jika detak jantung lebih dari 100 kali per menit, kondisi ini disebut takikardia.\n\nTakikardia terbagi dua, yaitu takikardia sinus dan aritmia. Takikardia sinus bisa terjadi ketika seseorang sedang berolahraga. Kondisi ini juga dapat terjadi sebagai respons tubuh terhadap stres, trauma, atau penyakit. Sementara aritmia terjadi akibat gangguan pada serambi atau bilik jantung sehingga detak jantung menjadi lebih cepat.\nTakikardia umumnya tidak menimbulkan gejala atau komplikasi. Namun, kondisi ini dapat mengganggu fungsi jantung jika dibiarkan tidak tertangani. Akibatnya, penderita bisa mengalami gagal jantung, stroke, serangan jantung mendadak, bahkan kematian.\n', 'Topik: Takikardia, Subtopik: Komplikasi Takikardia \n Takikardia dapat menyebabkan sejumlah komplikasi, tergantung pada jenis, kecepatan detak jantung, irama jantung dan waktu berlangsungnya takikardia. Komplikasi juga dapat terjadi tergantung pada ada atau tidaknya gangguan jantung yang dialami pasien.\nBerikut ini adalah beberapa komplikasi yang umum terjadi akibat takikardia:\n- Penggumpalan darah, yang dapat menyebabkan stroke atau serangan jantung\n- Gagal jantung, yang ditandai dengan ketidakmampuan jantung untuk memompa cukup darah\n- Sering pingsan atau tidak sadarkan diri\n- Kematian mendadak, yang biasanya terjadi akibat takikardia ventrikel atau fibrilasi ventrikel\n']","Orang-orang yang cenderung memiliki risiko tinggi untuk mengalami takikardia termasuk mereka:\n1. Penderita penyakit jantung, seperti hipertensi atau valvular heart disease.\n2. Pasien diabetes mellitus dan pasien lainnya dengan riwayat penyakit obesitas.\n3. Pemain olahraga yang intensif, khususnya yang sering berolahraga secara anaerob atau shock-prone.\n4. Mereka yang mengalami stres emotional dan trauma akut.\n5. Pasien dengan gangguan fungsi saraf perifer atau metabolik lainnya.\n6. Penderita asidosis metabolis, seperti yang umumnya terdapat pada pasien pneumonia atau anemia hipoksemia.",0.0,0.9467881818514597,0.99999999995,0.0
Apa penyebab seseorang mengalami iskemia?,"Iskemia umumnya disebabkan oleh aterosklerosis, yaitu penumpukan plak lemak di pembuluh darah. Akibatnya, aliran darah pun menjadi terhambat. Penumpukan ini terjadi secara perlahan sehingga jarang disadari.\n\nSelain itu, plak di pembuluh darah bisa pecah dan membentuk gumpalan darah, yang dapat menyumbat pembuluh darah dan menghentikan aliran darah secara tiba-tiba. Gumpalan darah tersebut juga dapat terlepas dan menyumbat pembuluh darah di area lain. Kondisi ini disebut sebagai emboli.","['Topik: Iskemia, Subtopik: Penyebab Iskemia \n Iskemia umumnya disebabkan oleh aterosklerosis, yaitu penumpukan plak lemak di pembuluh darah. Akibatnya, aliran darah pun menjadi terhambat. Penumpukan ini terjadi secara perlahan sehingga jarang disadari.\nSelain itu, plak di pembuluh darah bisa pecah dan membentuk gumpalan darah, yang dapat menyumbat pembuluh darah dan menghentikan aliran darah secara tiba-tiba. Gumpalan darah tersebut juga dapat terlepas dan menyumbat pembuluh darah di area lain. Kondisi ini disebut sebagai emboli.\n', 'Topik: Iskemia, Subtopik: Pengertian Iskemia \n Iskemia adalah terganggunya aliran darah ke jaringan atau organ tubuh akibat adanya gangguan di pembuluh darah. Kondisi ini dapat terjadi di seluruh tubuh, mulai dari jaringan pada tungkai, saluran pencernaan, jantung, hingga otak. \nKetika terjadi iskemia, jaringan atau organ tidak mendapat cukup oksigen. Jika terjadi cukup lama, jaringan atau organ tersebut tidak dapat berfungsi dengan baik, bahkan bisa mengalami kerusakan. Oleh karena itu, iskemia bisa menyebabkan kondisi yang fatal jika terjadi pada organ yang vital, seperti jantung atau otak.\n\n', 'Topik: Iskemia, Subtopik: Pengertian Iskemia \n Ketika terjadi iskemia, jaringan atau organ tidak mendapat cukup oksigen. Jika terjadi cukup lama, jaringan atau organ tersebut tidak dapat berfungsi dengan baik, bahkan bisa mengalami kerusakan. Oleh karena itu, iskemia bisa menyebabkan kondisi yang fatal jika terjadi pada organ yang vital, seperti jantung atau otak.\n\n']","Penyebab umum yang menyebabkan seseorang mengalami iskemia adalah arterioklerosis, yaitu penumpukan plak lemak di dalam pembuluh darah. Akibatnya, aliran darah menjadi terhambat atau tidak maksimal, yang dapat menyebabkan jaringan atau organ tubuh kekurangan oksigen (iskemia).",1.0,0.558073014154456,0.9999999999666667,1.0
Apa gejala iskemia yang terjadi di bagian jantung?,"Iskemia di jantung terjadi pada pembuluh darah koroner yang tersumbat sebagian atau seluruhnya. Kondisi ini bisa menyebabakn serangan jantung. \n\nGejala yang dapat muncul akibat iskema jantung antara lain:\n\nNyeri dada seperti tertekan\nNyeri di leher, rahang, bahu, atau lengan\nDetak jantung menjadi lebih cepat\nSesak napas, terutama saat melakukan aktivitas fisik\nMual dan muntah\nBerkeringat dingin\nLemas\nPusing atau sakit kepala ","['Topik: Iskemia, Subtopik: Gejala Iskemia: Iskemia di jantung  \n Iskemia di jantung terjadi pada pembuluh darah koroner yang tersumbat sebagian atau seluruhnya. Kondisi ini bisa menyebabakn serangan jantung. \nGejala yang dapat muncul akibat iskema jantung antara lain:\n- Nyeri dada seperti tertekan\n- Nyeri di leher, rahang, bahu, atau lengan\n- Detak jantung menjadi lebih cepat\n- Sesak napas, terutama saat melakukan aktivitas fisik\n- Mual dan muntah\n- Berkeringat dingin\n- Lemas\n- Pusing atau sakit kepala \n', 'Topik: Iskemia, Subtopik: Gejala Iskemia: Kapan harus ke dokter  \n Iskemia di otak, jantung, perut, atau tungkai bisa berakibat fatal. Namun, iskemia di bagian tubuh lainnya juga dapat menyebabkan kondisi yang serius. Segera cari pertolongan medis jika Anda mengalami gejala berikut: \n- Nyeri berat di dada \n- Nyeri dada yang tidak kunjung reda \n- Kesulitan bernapas \n- Gejala stroke, seperti lemah di tungkai, mati rasa, pusing, sulit bicara, atau hilang penglihatan \n- Nyeri perut yang parah\n- Tungkai, lengan, atau jari terasa dingin, berwarna kebiruan, dan mati rasa\n', 'Topik: Iskemia, Subtopik: Pengertian Iskemia \n Iskemia adalah terganggunya aliran darah ke jaringan atau organ tubuh akibat adanya gangguan di pembuluh darah. Kondisi ini dapat terjadi di seluruh tubuh, mulai dari jaringan pada tungkai, saluran pencernaan, jantung, hingga otak. \nKetika terjadi iskemia, jaringan atau organ tidak mendapat cukup oksigen. Jika terjadi cukup lama, jaringan atau organ tersebut tidak dapat berfungsi dengan baik, bahkan bisa mengalami kerusakan. Oleh karena itu, iskemia bisa menyebabkan kondisi yang fatal jika terjadi pada organ yang vital, seperti jantung atau otak.\n\n']","Gejala iskemia yang bisa terjadi di bagian jantung termasuk nyeri dada seperti tertekur, detak jantung menjadi lebih cepat, sesak napas, mual dan muntah, berkeringat dingin, lemas, serta pusing atau sakit kepala.",1.0,0.5896657820108974,0.9999999999666667,1.0
Bagaimana cara mengobati penyakit bradikardia?,"Pengobatan bradikardia akan disesuaikan dengan tingkat keparahannya dan penyebabnya. Sebagai contoh, jika penyebabnya adalah hipotiroidisme, dokter akan memberikan terapi yang sesuai untuk mengobati kondisi tersebut.\n\nSementara pada bradikardia yang disebabkan oleh penggunaan obat-obatan, dokter akan menurunkan dosis obat, mengganti jenis obat, atau menghentikan pengobatan.\n\nJika metode di atas tidak menunjukkan perbaikan atau kondisi pasien memburuk, dokter mungkin akan menyarankan penggunaan alat pacu jantung. Alat ini ditanam di dalam dada sebagai pengirim sinyal listrik ke jantung. Dengan begitu, detak jantung dapat kembali normal.","['Topik: Bradikardia, Subtopik: Pengobatan Bradikardia \n Pengobatan bradikardia akan disesuaikan dengan tingkat keparahannya dan penyebabnya. Sebagai contoh, jika penyebabnya adalah hipotiroidisme, dokter akan memberikan terapi yang sesuai untuk mengobati kondisi tersebut.\nSementara pada bradikardia yang disebabkan oleh penggunaan obat-obatan, dokter akan menurunkan dosis obat, mengganti jenis obat, atau menghentikan pengobatan.\nJika metode di atas tidak menunjukkan perbaikan atau kondisi pasien memburuk, dokter mungkin akan menyarankan penggunaan alat pacu jantung. Alat ini ditanam di dalam dada sebagai pengirim sinyal listrik ke jantung. Dengan begitu, detak jantung dapat kembali normal.\n', 'Topik: Bradikardia, Subtopik: Pencegahan Bradikardia \n Bradikardia tidak selalu bisa dicegah. Namun, ada beberapa upaya yang dapat dilakukan untuk menurunkan risiko terkena bradikardia, yaitu:\n- Mengonsumsi makanan bergizi seimbang, serta rendah garam dan gula\n- Tidak merokok atau menghentikan kebiasaan merokok\n- Menghindari penggunaan NAPZA\n- Tidak mengonsumsi minuman beralkohol\n- Menjaga berat badan ideal\n\n- Berolahraga secara rutin\n- Mengelola stres dengan baik\nSelain cara-cara di atas, lakukan pemeriksaan tekanan darah, kolesterol, dan kadar gula darah secara berkala ke dokter.\n', 'Topik: Bradikardia, Subtopik: Diagnosis Bradikardia \n Untuk mendiagnosis bradikardia, dokter akan bertanya seputar gejala yang muncul, riwayat penyakit dan obat-obatan yang dikonsumsi pasien. Setelah itu, dokter akan melakukan pemeriksaan fisik, termasuk mengukur tekanan darah dan denyut nadi serta mendengarkan detak jantung pasien menggunakan stetoskop.\nUntuk memastikan diagnosis, dokter akan melakukan pemeriksaan penunjang berikut:\n- Elektrokardiografi (EKG), untuk mengetahui aliran listrik pada jantung. Namun, EKG bisa menunjukkan hasil yang normal jika pada saat pemeriksaan pasien tidak mengalami bradikardia.\n- Holter monitoring, untuk mendeteksi bradikardia yang mungkin terjadi di lain waktu. Alat ini dapat merekam aktivitas listrik pada jantung secara terus-menerus selama 1  2 hari.\n- Event recorder, untuk melihat aliran listrik pada jantung melalui monitor di alat tersebut. Event recorder akan merekam aktivitas listrik jantung ketika muncul gejala. Alat ini umumnya digunakan selama beberapa minggu hingga 1 bulan.\n']","Mengobati bradikardia melalui beberapa metode tergantung pada penyebab dan tingkat keparahan kondisi tersebut. Berikut adalah cara mengobati bradikardia, sesuai dengan konteks yang diberikan:\n\n1. Obat-obatan atau terapi medis:\n   - Jika penyebabnya hipotiroidisme, obat yang dikonsumsi adalah zat perangsang tiroid (levothyroxine) untuk menggantikan hormon tiroid yang kurang.\n   - Untuk bradikardia akibat penggunaan obat-obatan, dokter akan menurunkan dosis atau mengganti jenis obat tersebut.\n\n2. Pemeriksaan penunjang:\n   - Elektrokardiografi (EKG) untuk memastikan aliran listrik jantung normal.\n   - Holter monitoring, yang dapat merekam aktivitas listrik pada jantung secara terus-menerus selama beberapa hari untuk mendeteksi gangguan ritme jantung lain waktu.\n   - Event recorder, alat yang digunakan oleh pasien untuk merekam gejala bradikardia dan kemudian dikembalikan ke dokter untuk analisis.\n\n3. Penggunaan alat pacu jantung:\n   - Metode ini dilakukan dengan cara menanam sebuah alat listrik ke dalam dada pasien, yang akan mengirim sinyal listrik ke jantung untuk memastikan ritme jantung kembali normal.\n\n4. Pencegahan bradikardia:\n   - Mengonsumsi makanan bergizi dan rendah garam, gula.\n   - Tidak merokok atau menghentikan kebiasaan merokok.\n   - Menghindari penggunaan NAPZA (Non-preskrip anti inflamasi).\n   - Mengelola stres dengan baik dan menjaga berat badar ideal.\n   - Berolahraga secara rutin, serta melakukan pemeriksaan tekanan darah, kolesterol, dan kadar gula darah secara berkala ke dokter.",0.8235294117647058,0.6108138676872578,0.9999999999,1.0
Bagaimana metode pemberian diagnosis pada pasien yang mengalami bradikardia?,"Untuk mendiagnosis bradikardia, dokter akan bertanya seputar gejala yang muncul, riwayat penyakit dan obat-obatan yang dikonsumsi pasien. Setelah itu, dokter akan melakukan pemeriksaan fisik, termasuk mengukur tekanan darah dan denyut nadi serta mendengarkan detak jantung pasien menggunakan stetoskop.\n\nUntuk memastikan diagnosis, dokter akan melakukan pemeriksaan penunjang berikut:\n\nElektrokardiografi (EKG), untuk mengetahui aliran listrik pada jantung. Namun, EKG bisa menunjukkan hasil yang normal jika pada saat pemeriksaan pasien tidak mengalami bradikardia.\nHolter monitoring, untuk mendeteksi bradikardia yang mungkin terjadi di lain waktu. Alat ini dapat merekam aktivitas listrik pada jantung secara terus-menerus selama 1–2 hari.\nEvent recorder, untuk melihat aliran listrik pada jantung melalui monitor di alat tersebut. Event recorder akan merekam aktivitas listrik jantung ketika muncul gejala. Alat ini umumnya digunakan selama beberapa minggu hingga 1 bulan.","['Topik: Bradikardia, Subtopik: Diagnosis Bradikardia \n Untuk mendiagnosis bradikardia, dokter akan bertanya seputar gejala yang muncul, riwayat penyakit dan obat-obatan yang dikonsumsi pasien. Setelah itu, dokter akan melakukan pemeriksaan fisik, termasuk mengukur tekanan darah dan denyut nadi serta mendengarkan detak jantung pasien menggunakan stetoskop.\nUntuk memastikan diagnosis, dokter akan melakukan pemeriksaan penunjang berikut:\n- Elektrokardiografi (EKG), untuk mengetahui aliran listrik pada jantung. Namun, EKG bisa menunjukkan hasil yang normal jika pada saat pemeriksaan pasien tidak mengalami bradikardia.\n- Holter monitoring, untuk mendeteksi bradikardia yang mungkin terjadi di lain waktu. Alat ini dapat merekam aktivitas listrik pada jantung secara terus-menerus selama 1  2 hari.\n- Event recorder, untuk melihat aliran listrik pada jantung melalui monitor di alat tersebut. Event recorder akan merekam aktivitas listrik jantung ketika muncul gejala. Alat ini umumnya digunakan selama beberapa minggu hingga 1 bulan.\n', 'Topik: Bradikardia, Subtopik: Pengobatan Bradikardia \n Pengobatan bradikardia akan disesuaikan dengan tingkat keparahannya dan penyebabnya. Sebagai contoh, jika penyebabnya adalah hipotiroidisme, dokter akan memberikan terapi yang sesuai untuk mengobati kondisi tersebut.\nSementara pada bradikardia yang disebabkan oleh penggunaan obat-obatan, dokter akan menurunkan dosis obat, mengganti jenis obat, atau menghentikan pengobatan.\nJika metode di atas tidak menunjukkan perbaikan atau kondisi pasien memburuk, dokter mungkin akan menyarankan penggunaan alat pacu jantung. Alat ini ditanam di dalam dada sebagai pengirim sinyal listrik ke jantung. Dengan begitu, detak jantung dapat kembali normal.\n', 'Topik: Bradikardia, Subtopik: Pengertian Bradikardia \n Bradikardia adalah kondisi jantung yang berdetak lebih lambat dari normal. Bradikardia yang parah merupakan kondisi serius yang dapat menyebabkan gejala berupa pusing berat, lemas, sesak napas, hingga pingsan.\nNormalnya, jantung berdetak sekitar 60  100 detak per menit. Namun, pada penderita bradikardia, detak jantungnya kurang dari 60 detak per menit. Kondisi ini normal terjadi pada atlet, lansia, atau saat sedang tidur.\n\nNamun, jika disertai keluhan lain, seperti nyeri dada atau sesak napas, bradikardia bisa menjadi salah satu gejala adanya gangguan aktivitas listrik pada jantung. Kondisi ini membuat jantung tidak dapat memompa cukup darah sesuai yang dibutuhkan tubuh. Akibatnya, akan terjadi gangguan pada organ, seperti otak dan jantung.\n']","Metode pemberian diagnosis pada pasien yang mengalami bradikardia melibatkan beberapa tahap, di antaranya adalah:\n\n1. Pengumpulan riwayat gejala dan penyakit: Dokter akan bertanya tentang apa saja gejala yang dialami pasien, termasuk waktu terjadinya, serta mempelajari riwayat medis pasien.\n2. Penggunaan alat pemeriksaan fisik: Dokter akan melakukan pengukuran tekanan darah dan denyut nadi secara kontinu untuk menentukan apakah detak jantung pasien berada di bawah tingkat normal.\n3. Pemeriksaan penunjang: Selain menggunakan alat pengukuran tekanan darah dan denyut nadi, dokter juga akan melakukan pemeriksaan lebih lanjut dengan metode elektrokardiografi (EKG), holter monitoring, atau event recorder untuk memastikan diagnosis.\n4. Penggunaan alat ukur aktivitas listrik jantung: Alat ini akan digunakan untuk mengetahui apakah ada gangguan dalam arus listrik pada jantung, yang kemungkinan besar disebabkan oleh bradikardia.\n5. Pemberian obat dan terapi: Setelah diagnosis dilakukan, dokter akan memutuskan metode apa yang paling tepat untuk mengobati penyebab bradikardia pasien, seperti menurunkan dosis obat atau mengganti jenis obat.\n\nDengan demikian, proses diagnosis pada pasien yang mengalami bradikardia melibatkan berbagai metode dan alat ukur untuk memastikan kondisi tersebut sebenarnya benar-benar mengalami bradikardia.",0.7619047619047619,0.7400700935258278,0.8333333332916666,1.0
Apa gejala yang muncul pada anak yang mengalami miokarditis?,Tanda dan gejala yang umumnya muncul pada anak-anak dan bayi dengan miokarditis adalah: \n\nLemas\nHilang nafsu makan\nBatuk\nSulit bernapas\nDemam\nKulit pucat\nLebih rewel daripada biasanya\nNyeri dada\nTangan atau kaki yang dingin,"['Topik: Miokarditis, Subtopik: Gejala Miokarditis \n Kebanyakan miokarditis tidak disadari oleh penderitanya karena kondisi ini bisa tidak bergejala atau hanya menimbulkan keluhan ringan. Jika terjadi keluhan, penderita mungkin mengalami gejala-gejala berikut:\n- Nyeri dada\n- Sesak napas, baik saat beraktivitas maupun ketika beristirahat\n- Jantung berdebar atau berdetak tidak beraturan\n\n- Pembengkakan di tungkai atau kaki\n- Lemas\n- Mudah lelah\n- Sakit kepala ringan atau malah berat seperti akan pingsan\nAda kemungkinan juga muncul gejala lain, yang jenisnya tergantung pada penyebab miokarditis itu sendiri. Sebagai contoh, jika miokarditis disebabkan oleh infeksi virus, penderita dapat mengalami demam, nyeri sendi, badan pegal-pegal, atau sakit tenggorokan.\nSementara itu, miokarditis pada anak dan bayi tidak memiliki gejala yang spesifik sehingga diperlukan pemeriksaan langsung oleh dokter. Tanda dan gejala yang umumnya muncul pada anak-anak dan bayi dengan miokarditis adalah: \n- Lemas\n- Hilang nafsu makan\n- Batuk\n- Sulit bernapas\n- Demam\n- Kulit pucat\n- Lebih rewel daripada biasanya\n- Nyeri dada\n- Tangan atau kaki yang dingin \n', 'Topik: Miokarditis, Subtopik: Gejala Miokarditis: Kapan harus ke dokter \n Lakukan pemeriksaan ke dokter jika Anda atau anak Anda mengalami gejala di atas, terutama jika ada keluhan nyeri dada dan sesak napas. Jika gejala memburuk atau tidak membaik dalam beberapa menit, jangan tunda untuk ke IGD rumah sakit terdekat, agar segera mendapat penanganan medis.\n', 'Topik: Miokarditis, Subtopik: Diagnosis Miokarditis \n Diagnosis miokarditis dimulai dengan tanya jawab mengenai kondisi pasien. Dokter akan menanyakan kepada pasien tentang:\n- Gejala yang dirasakan dan lama berlangsungnya\n- Penyakit yang pernah atau sedang diderita\nSelanjutnya, dokter akan melakukan pemeriksaan fisik. Pada pemeriksaan ini, dokter akan mendengarkan bunyi jantung dan pernapasan dengan menggunakan stetoskop, serta melihat apakah ada pembengkakan di tungkai dan kaki pasien.\nDokter juga mungkin akan melakukan beberapa pemeriksaan penunjang berikut untuk memastikan diagnosis dan menentukan penyebab miokarditis:\n- Tes darah, untuk mendeteksi  tanda-tanda infeksi atau penyakit autoimun\n- Elektrokardiogram (EKG), untuk memeriksa aktivitas listrik jantung\n\n- Foto Rontgen dada, untuk melihat ukuran dan bentuk jantung, serta untuk memeriksa kemungkinan adanya gagal jantung\n- Ekokardiografi atau USG jantung, untuk memeriksa fungsi pompa jantung, serta mendeteksi gumpalan darah di dalam jantung, penumpukan cairan di selaput jantung (efusi perikardium), gangguan pada katup jantung, dan pembesaran jantung\n\n- MRI jantung, untuk melihat ada tidaknya peradangan pada otot jantung\n- Kateterisasi jantung yang disertai biopsi otot jantung (pemeriksaan dari sampel otot jantung), untuk melihat kondisi jantung\n']",Gejala yang umumnya muncul pada anak-anak dan bayi dengan miokarditis adalah:\n- Lemas\n- Hilang nafsu makan\n- Batuk\n- Sulit bernapas\n- Demam\n- Kulit pucat\n- Lebih rewel daripada biasanya\n- Nyeri dada\n- Tangan atau kaki yang dingin,1.0,0.6305128280543865,0.9999999999,1.0
Bagaimana upaya pencegahan penyakit miokarditis?,"Sampai saat ini, belum diketahui secara pasti bagaimana cara untuk mencegah miokarditis. Namun, risiko terkena kondisi ini bisa dikurangi dengan melakukan upaya-upaya berikut:\n\nSelalu menjaga kebersihan diri, makanan, dan tempat tinggal \nMelakukan vaksinasi sesuai anjuran dokter\nMenghindari kontak dengan orang yang sedang sakit\nBerhubungan seks secara sehat, yaitu dengan memakai kondom dan tidak bergonta-ganti pasangan\nMengonsumsi obat sesuai aturan pakai dan dosis yang tertera, atau sesuai anjuran dokter\nMenghindari penggunaan obat-obatan terlarang","['Topik: Miokarditis, Subtopik: Pencegahan Miokarditis \n Sampai saat ini, belum diketahui secara pasti bagaimana cara untuk mencegah miokarditis. Namun, risiko terkena kondisi ini bisa dikurangi dengan melakukan upaya-upaya berikut:\n- Selalu menjaga kebersihan diri, makanan, dan tempat tinggal \n- Melakukan vaksinasi sesuai anjuran dokter\n- Menghindari kontak dengan orang yang sedang sakit\n- Berhubungan seks secara sehat, yaitu dengan memakai kondom dan tidak bergonta-ganti pasangan\n- Mengonsumsi obat sesuai aturan pakai dan dosis yang tertera, atau sesuai anjuran dokter\n- Menghindari penggunaan obat-obatan terlarang\n', 'Topik: Miokarditis, Subtopik: Pengertian Miokarditis \n Miokarditis adalah peradangan yang terjadi pada miokardium atau otot jantung. Peradangan ini umumnya disebabkan oleh infeksi bakteri atau virus. Namun, pada beberapa kasus, miokarditis juga dapat terjadi akibat paparan zat berbahaya atau penggunaan obat-obatan tertentu.\nMiokardium adalah otot jantung yang berperan memompa darah dari jantung ke seluruh tubuh. Peradangan pada otot jantung dapat menyebabkan gangguan irama jantung dan menurunkan kemampuan jantung dalam memompa darah. \n\nMiokarditis ditandai dengan nyeri dada, sesak napas, dan jantung berdebar. Pada kasus yang ringan, miokarditis bisa sembuh dengan perawatan sederhana, serta tidak menyebabkan komplikasi. Namun, jika tidak tertangani dengan benar, miokarditis bisa menyebabkan komplikasi serius, seperti gangguan irama jantung, gagal jantung, dan serangan jantung.\n', 'Topik: Miokarditis, Subtopik: Pengertian Miokarditis \n Miokardium adalah otot jantung yang berperan memompa darah dari jantung ke seluruh tubuh. Peradangan pada otot jantung dapat menyebabkan gangguan irama jantung dan menurunkan kemampuan jantung dalam memompa darah. \n\nMiokarditis ditandai dengan nyeri dada, sesak napas, dan jantung berdebar. Pada kasus yang ringan, miokarditis bisa sembuh dengan perawatan sederhana, serta tidak menyebabkan komplikasi. Namun, jika tidak tertangani dengan benar, miokarditis bisa menyebabkan komplikasi serius, seperti gangguan irama jantung, gagal jantung, dan serangan jantung.\n']","Upaya pencegahan miokarditis yang diuraikan dalam konteks tersebut mencakup beberapa langkah sederhana yang bisa dilakukan untuk mengurangi risiko munculnya penyakit ini. Berikut adalah upaya-upaya pencegahan miokarditis:\n\n1. **Menjaga kebersihan diri, makanan, dan tempat tinggal**: Penting untuk selalu membersihkan barang-barang yang sering kita gunakan, seperti telepon genggam atau peralatan rumah tangga, agar bebas dari bakteri dan virus.\n\n2. **Melakukan vaksinasi sesuai anjuran dokter**: Mengikuti program vaksinasi yang disyaratkan oleh profesional kesehatan untuk mencegah penyakit infeksi seperti influenza dan difteri, yang bisa memicu miokarditis.\n\n3. **Menghindari kontak dengan orang yang sedang sakit**: Mengurangi paparan terhadap infeksi lainnya yang bisa merusak jaringan otot jantung.\n\n4. **Berhubungan seks secara sehat, yaitu dengan memakai kondom dan tidak bergonta-ganti pasangan**: Mencegah penularan infeksi melalui sistem reproduksi dan mengurangi risiko munculnya masalah kehamilan tanpa henti.\n\n5. **Mengonsumsi obat sesuai aturan pakai dan dosis yang tertera, atau sesuai anjuran dokter**: Mengikuti petunjuk dari tenaga dokter dalam pemakaian obat untuk mencegah efek samping berdampak buruk.\n\n6. **Menghindari penggunaan obat-obatan terlarang**: Mengingat risiko penyakit jantung, penting untuk menjauhi zalim menyusu dan mengkonsumsi obat yang tidak dipercaya, khususnya yang dilarang.\n\nDengan menerapkan langkah-langkah ini, individu bisa meminimalkan risiko munculnya miokarditis dan melindungi kesehatan jantung mereka sendiri.",0.631578947368421,0.6047090278428997,0.99999999995,1.0
Apa gejala yang muncul pada penderita hipertensi pulmonal?,Beberapa gejala awal hipertensi pulmonal yang mungkin muncul adalah:\n\nNapas yang pendek atau terputus-putus\nNyeri atau rasa tertekan di dada\nNyeri di perut bagian kanan atas\nJantung berdebar\nLemas\nSuara serak\nHilang nafsu makan\n\nSedangkan gejala yang muncul saat kondisi telah bertambah parah meliputi:\n\nPembengkakan di area tungkai dan perut\nPusing saat sedang berolahraga\nWarna bibir atau kulit yang kebiruan\nBatuk kering atau batuk berdarah\nPingsan,"['Topik: Hipertensi Pulmonal, Subtopik: Gejala Hipertensi Pulmonal \n Pada tahap awal, penderita mungkin tidak menyadari gejala hipertensi pulmonal. Gejala penyakit ini biasanya mulai terlihat dan bertambah buruk seiring dengan perkembangan penyakit.\nBeberapa gejala awal hipertensi pulmonal yang mungkin muncul adalah:\n- Napas yang pendek atau terputus-putus\n- Nyeri atau rasa tertekan di dada\n- Nyeri di perut bagian kanan atas\n- Jantung berdebar\n- Lemas\n- Suara serak\n- Hilang nafsu makan\nSedangkan gejala yang muncul saat kondisi telah bertambah parah meliputi:\n- Pembengkakan di area tungkai dan perut\n- Pusing saat sedang berolahraga\n- Warna bibir atau kulit yang kebiruan\n- Batuk kering atau batuk berdarah\n- Pingsan\nKeluhan tersebut dapat memburuk saat sedang beraktivitas sehingga penderita akan mengalami keterbatasan dalam melakukan aktivitas fisik.\nTingkat keparahan hipertensi pulmonal dapat digolongkan berdasarkan gejala yang dimiliki. Berikut ini adalah penjelasannya:\n- Tingkat 1: penderita tidak mengalami gejala dan masih dapat beraktivitas secara normal\n- Tingkat 2: penderita tidak mengalami gejala saat beristirahat, tetapi mengalami kelelahan, napas yang tersengal-sengal, atau nyeri dada saat beraktivitas\n- Tingkat 3: penderita mengalami gejala ringan yang tidak begitu mengganggu saat beristirahat, tetapi gejala akan bertambah parah saat melakukan aktivitas fisik\n- Tingkat 4: penderita mengalami gejala, baik saat melakukan aktivitas fisik maupun saat beristirahat\n', 'Topik: Hipertensi Pulmonal, Subtopik: Pengertian Hipertensi Pulmonal \n Hipertensi pulmonal adalah tekanan darah tinggi yang secara spesifik terjadi pada pembuluh darah arteri di paru-paru dan sisi kanan jantung. Kondisi ini awalnya bisa tidak disadari, kemudian lama-kelamaan makin serius dan dapat berakibat fatal.\nHipertensi pulmonal dapat terjadi pada semua orang, tetapi penyakit ini sering kali menyerang orang yang menderita gangguan di jantung atau paru-paru. Kondisi ini dapat terjadi dengan sendirinya atau disebabkan oleh penyakit lain.\n\nHipertensi pulmonal berkembang dengan perlahan sehingga gejalanya pun timbul secara bertahap. Penderita dapat tidak mengalami gejala apa pun pada tahap awal, tetapi gejala kemudian akan muncul dan bertambah parah seiring dengan berkembangnya kondisi.\nHipertensi pulmonal umumnya dapat ditandai oleh gejala berikut ini:\n- Napas pendek selama beraktivitas\n- Kelelahan\n- Nyeri dada\n- Jantung berdebar\n- Nyeri pada bagian kanan atas perut\n- Hilang nafsu makan\nHipertensi pulmonal terjadi ketika arteri kecil di paru-paru dan pembuluh kapilernya menyempit, tersumbat, atau rusak. Kondisi ini mengakibatkan darah dari sisi kanan jantung sulit mengalir ke paru-paru. Akibatnya, tekanan pada arteri paru-paru juga meningkat.\nSeiring peningkatan tekanan tersebut, bilik kanan jantung harus bekerja lebih keras untuk memompa darah menuju paru-paru. Kondisi ini seiring waktu membuat otot jantung melemah dan dapat memicu beragam komplikasi, yang meliputi:\n- Gagal jantung\n- Pembesaran jantung\n- Aritmia\n- Penggumpalan darah\n- Perdarahan pada paru-paru\n- Komplikasi kehamilan\nHipertensi pulmonal jarang terdiagnosis pada tahap awal dan biasanya baru disadari setelah penyakit tersebut berkembang selama beberapa waktu atau setelah mencapai tahap lanjut. Diagnosa biasanya ditetapkan melalui pemindaian jantung dan paru-paru, serta elektrokardiogram.\nHipertensi pulmonal merupakan penyakit yang belum dapat disembuhkan, sehingga pengobatan akan lebih difokuskan untuk meredakan gejala atau memperlambat perkembangan penyakit.\nPenanganan sedini mungkin penting untuk dilakukan agar tidak terjadi komplikasi. Selain itu, penderita juga disarankan untuk mengubah gaya hidup untuk memperbaiki kondisinya.\n', 'Topik: Hipertensi Pulmonal, Subtopik: Gejala Hipertensi Pulmonal: Kapan harus ke dokter \n Periksakan diri Anda ke dokter jika mengalami gejala seperti yang telah disebutkan di atas. Gejala hipertensi pulmonal dapat menyerupai gejala dari kondisi lain. Oleh sebab itu, diperlukan pemeriksaan untuk memastikan kondisi yang dialami.\nDiagnosis hipertensi pulmonal sebaiknya diketahui sedini mungkin, bahkan sebelum gejala muncul. Dengan begitu, potensi kesembuhan meningkat dan risiko terjadinya komplikasi dapat dicegah. Oleh karena itu, jika Anda memiliki faktor risiko hipertensi pulmonal, disarankan untuk melakukan pemeriksaan ke dokter secara rutin.\nSegera cari pertolongan medis jika Anda mengalami gejala yang serius, seperti:\n- Nyeri atau rasa tidak nyaman di dada yang disertai dengan sesak napas, berkeringat, mual, dan kelelahan\n- Denyut jantung yang sangat cepat hingga lebih dari 120  150 per menit, terutama jika disertai dengan sesak napas\n- Sesak napas yang tidak dapat diredakan dengan beristirahat\n- Lemah atau lumpuh di lengan dan tungkai yang terjadi tanpa sebab yang jelas\n- Sakit kepala berat yang muncul secara tiba-tiba\n']","Gejala hipertensi pulmonal (GHP) yang mungkin muncul pada penderita termasuk:\n\n1. Napas yang pendek atau terputus-putus, menyebabkan perasaan gugup dan sulit bernapas, terutama selama beraktivitas.\n2. Nyeri atau rasa tertekan di dada, seringkali mengikuti napas yang pendek.\n3. Nyeri di perut bagian kanan atas, merupakan gejala umum pada GHP karena arteri yang berkelanjutan dengan paru-paru berada disekitar bagian atas hati dan dada.\n4. Jantung berdebar, menyebabkan perasaan lelah atau gugup serta gejala seperti nyeri dada.\n5. Lemas, yang bisa merujuk pada kesadaran rendah atau sakit dalam menghirup.\n6. Suara serak, terutama saat bernapas lebih lanjut mempertegas gejala GHP.\n7. Hilang nafsu makan dan gangguan berat makan, sebelum-belom mengalami gejalan lain.\n\nSedangkan gejala yang muncul saat kondisi telah bertambah parah meliputi:\n\n1. Pembengkakan di area tungkai dan perut, menyebabkan perubahan pada tubuh seperti mengecil atau membengkok.\n2. Pusing saat sedang berolahraga, yang dapat menandakan bahwa otot jantung sudah tidak lagi bekerja dengan optimal.\n3. Warna bibir atau kulit yang kebiruan, menyebabkan perasaan gatal dan sulit untuk mengeluarkan darah ke organ lain dalam tubuh seperti otak.\n4. Batuk kering atau batuk berdarah, yang dapat menunjukkan adanya penyumbatan pada arteri paru-paru.\n5. Pingsan, suatu gejala seseorang dalam keadaan gugup dan depresi akibat penyakit hipertensi pulmonal lanjut.\n\nKeluhan ini dapat memburuk saat sedang beraktivitas sehingga penderita akan mengalami keterbatasan dalam melakukan aktivitas fisik, menurunkan kualitas hidup dan bisa merugikan hubungan.\n\nHipertensi Pulmonal (GHP) adalah penyakit yang memerlukan pemeriksaan medis dengan cepat untuk mencegah komplikasi, termasuk gagal jantung, penggumpalan darah dan perdarahan di paru-paru.",0.4090909090909091,0.6069233497662728,0.9999999999666667,0.9285714285714286
Apa obat yang dapat diberikan pada penderita hipertensi pulmonal?,"Jenis obat yang bisa diberikan antara lain:\n\nSildenafil atau tadalafil\nSildenafil dan tadalafil berfungsi membuka pembuluh darah paru-paru agar darah dapat mengalir dengan lebih mudah.\n\nAntagonis kalsium\nObat ini berfungsi melemaskan otot pembuluh darah, tetapi hanya ampuh pada sebagian penderita hipertensi pulmonal. Beberapa obat yang termasuk ke dalam golongan ini adalah nifedipine, diltiazem, dan amlodipine.\n\nAntikoagulan\nAntikoagulan, seperti warfarin, merupakan obat pengencer darah yang berfungsi menghambat terbentuknya gumpalan darah di arteri paru-paru. Meski obat ini sering digunakan, penggunaannya perlu dievaluasi secara rutin karena dapat meningkatkan risiko terjadinya perdarahan.\n\nDiuretik\nDiuretik adalah obat yang berfungsi mengurangi cairan di dalam tubuh sehingga kerja jantung menjadi lebih ringan. Obat ini juga dapat mengurangi penumpukan cairan di paru-paru, tungkai, dan perut pada pasien yang sudah mengalami komplikasi gagal jantung.\n\nDigoxin\nDigoxin adalah obat yang berfungsi membantu jantung berdenyut lebih kuat agar dapat memompa lebih banyak darah. Obat ini juga dapat mengendalikan denyut jantung menjadi lebih teratur.\n\nVasodilator\nVasodilator digunakan untuk melemaskan dan membuka pembuluh darah yang menyempit di paru-paru. Dengan begitu, darah dapat mengalir lebih baik. Contoh obat dari golongan ini antara lain epoprostenol, beraprost, dan iloprost.","['Topik: Hipertensi Pulmonal, Subtopik: Pengobatan Hipertensi Pulmonal: Obat-obatan \n Salah satu pilihan pengobatan yang dapat dilakukan pada pasien hipertensi pulmonal adalah pemberian obat. Jenis obat yang bisa diberikan antara lain:\n- Sildenafil atau tadalafil\nSildenafil dan tadalafil berfungsi membuka pembuluh darah paru-paru agar darah dapat mengalir dengan lebih mudah.\n- Antagonis kalsium\nObat ini berfungsi melemaskan otot pembuluh darah, tetapi hanya ampuh pada sebagian penderita hipertensi pulmonal. Beberapa obat yang termasuk ke dalam golongan ini adalah nifedipine, diltiazem, dan amlodipine.\n- Antikoagulan\nAntikoagulan, seperti warfarin, merupakan obat pengencer darah yang berfungsi menghambat terbentuknya gumpalan darah di arteri paru-paru. Meski obat ini sering digunakan, penggunaannya perlu dievaluasi secara rutin karena dapat meningkatkan risiko terjadinya perdarahan.\n- Diuretik\nDiuretik adalah obat yang berfungsi mengurangi cairan di dalam tubuh sehingga kerja jantung menjadi lebih ringan. Obat ini juga dapat mengurangi penumpukan cairan di paru-paru, tungkai, dan perut pada pasien yang sudah mengalami komplikasi gagal jantung.\n- Digoxin\nDigoxin adalah obat yang berfungsi membantu jantung berdenyut lebih kuat agar dapat memompa lebih banyak darah. Obat ini juga dapat mengendalikan denyut jantung menjadi lebih teratur.\n- Vasodilator\nVasodilator digunakan untuk melemaskan dan membuka pembuluh darah yang menyempit di paru-paru. Dengan begitu, darah dapat mengalir lebih baik. Contoh obat dari golongan ini antara lain epoprostenol, beraprost, dan iloprost.\n', 'Topik: Hipertensi Pulmonal, Subtopik: Pengobatan Hipertensi Pulmonal \n Hipertensi pulmonal merupakan penyakit yang belum dapat disembuhkan. Pengobatan hanya bertujuan untuk meredakan gejala dan menghambat perkembangan penyakit. Jika didiagnosis dan ditangani sejak dini, kerusakan arteri pulmonal secara permanen dapat dicegah.\nPengobatan hipertensi pulmonal dapat dilakukan dengan menangani kondisi itu sendiri, atau mengatasi penyebab yang mendasarinya. Beberapa metode pengobatan yang dapat dilakukan meliputi:\n', 'Topik: Hipertensi Pulmonal, Subtopik: Pengertian Hipertensi Pulmonal \n Hipertensi pulmonal adalah tekanan darah tinggi yang secara spesifik terjadi pada pembuluh darah arteri di paru-paru dan sisi kanan jantung. Kondisi ini awalnya bisa tidak disadari, kemudian lama-kelamaan makin serius dan dapat berakibat fatal.\nHipertensi pulmonal dapat terjadi pada semua orang, tetapi penyakit ini sering kali menyerang orang yang menderita gangguan di jantung atau paru-paru. Kondisi ini dapat terjadi dengan sendirinya atau disebabkan oleh penyakit lain.\n\nHipertensi pulmonal berkembang dengan perlahan sehingga gejalanya pun timbul secara bertahap. Penderita dapat tidak mengalami gejala apa pun pada tahap awal, tetapi gejala kemudian akan muncul dan bertambah parah seiring dengan berkembangnya kondisi.\nHipertensi pulmonal umumnya dapat ditandai oleh gejala berikut ini:\n- Napas pendek selama beraktivitas\n- Kelelahan\n- Nyeri dada\n- Jantung berdebar\n- Nyeri pada bagian kanan atas perut\n- Hilang nafsu makan\nHipertensi pulmonal terjadi ketika arteri kecil di paru-paru dan pembuluh kapilernya menyempit, tersumbat, atau rusak. Kondisi ini mengakibatkan darah dari sisi kanan jantung sulit mengalir ke paru-paru. Akibatnya, tekanan pada arteri paru-paru juga meningkat.\nSeiring peningkatan tekanan tersebut, bilik kanan jantung harus bekerja lebih keras untuk memompa darah menuju paru-paru. Kondisi ini seiring waktu membuat otot jantung melemah dan dapat memicu beragam komplikasi, yang meliputi:\n- Gagal jantung\n- Pembesaran jantung\n- Aritmia\n- Penggumpalan darah\n- Perdarahan pada paru-paru\n- Komplikasi kehamilan\nHipertensi pulmonal jarang terdiagnosis pada tahap awal dan biasanya baru disadari setelah penyakit tersebut berkembang selama beberapa waktu atau setelah mencapai tahap lanjut. Diagnosa biasanya ditetapkan melalui pemindaian jantung dan paru-paru, serta elektrokardiogram.\nHipertensi pulmonal merupakan penyakit yang belum dapat disembuhkan, sehingga pengobatan akan lebih difokuskan untuk meredakan gejala atau memperlambat perkembangan penyakit.\nPenanganan sedini mungkin penting untuk dilakukan agar tidak terjadi komplikasi. Selain itu, penderita juga disarankan untuk mengubah gaya hidup untuk memperbaiki kondisinya.\n']","Obat-obatan yang bisa diberikan pada pasien hipertensi pulmonal antara lain:\n\n1. Sildenafil atau tadalafil: Jenis obat ini berfungsi membuka pembuluh darah paru-paru agar darah dapat mengalir lebih mudah, yang berguna untuk meredakan gejala napas pendek dan kesulitan bernapas selama aktivitas.\n2. Antagonis kalsium: Jenis obat ini berfungsi melemaskan otot pembuluh darah, contoh yang umum di antaranya nifedipine, diltiazem, dan amlodipine. Obat ini digunakan untuk memperkecil tekanan darah paru-paru dan mengurangi beban jantung kanan.\n3. Antikoagulan: Jenis obat ini berfungsi menghambat terbentuknya gumpalan darah di arteri paru-paru, contoh yang umum antara lain warfarin. Obat ini digunakan untuk mencegah pengkuran dan komplikasi lainnya dari hipertensi pulmonal.\n4. Diuretik: Jenis obat ini berfungsi mengurangi penumpukan cairan di paru-paru, yang berguna untuk menekan gejala penyumbatan aliran darah dan menyembuhkan edema (penumpukan air). Contohnya fludrocortisone.\n5. Digoxin: Jenis obat ini berfungsi membantu jantung berdenyut lebih kuat agar dapat memompa lebih banyak darah, yang berguna untuk mengontrol denyutan jantung dan menghindari aritmia.\n6. Vasodilator: Jenis obat ini berfungsi melemaskan pembuluh darah paru-paru yang menyempit, sehingga memperluas aliran darah dan mengurangi tekanan di dalam sistem peredaran darah. Contohnya epoprostenol, beraprost, dan iloprost.\n\nPenggunaan obat ini harus diawetkan oleh dokter khususnya untuk setiap pasien hipertensi pulmonal, sehingga dosis dan cara pemberian obat yang tepat dapat diperoleh sesuai dengan kebutuhan masing-masing.",0.625,0.6248531256708936,0.9999999999666667,1.0
Apa saja hal yang dapat meningkatkan risiko terkena penyakit hipertensi pulmonal?,"Risiko terkena hipertensi pulmonal lebih dapat meningkat pada orang dengan kondisi berikut:\n\nBerjenis kelamin wanita\nBerusia 30 tahun ke atas\nMenderita berat badan berlebih\nMemiliki keluarga dengan riwayat hipertensi pulmonal\nMenderita kelainan lahir, seperti penyakit jantung bawaan atau sindrom Down\nMemiliki kondisi medis lain, seperti penyakit hati, penyakit penggumpalan darah, penyakit ginjal kronis, atau penyakit tiroid\nMengonsumsi obat-obatan penurun berat badan\nMengonsumsi obat selective serotonin reuptake inhibitors (SSRIs) untuk mengatasi depresi dan gangguan kecemasan\nMemiliki kebiasaan merokok\nMenyalahgunakan NAPZA, seperti kokain\nTerpapar asbes","['Topik: Hipertensi Pulmonal, Subtopik: Penyebab Hipertensi Pulmonal: Faktor Risiko Hipertensi Pulmonal \n Risiko terkena hipertensi pulmonal lebih dapat meningkat pada orang dengan kondisi berikut:\n- Berjenis kelamin wanita\n- Berusia 30 tahun ke atas\n- Menderita berat badan berlebih\n- Memiliki keluarga dengan riwayat hipertensi pulmonal\n- Menderita kelainan lahir, seperti penyakit jantung bawaan atau sindrom Down\n\n- Memiliki kondisi medis lain, seperti penyakit hati, penyakit penggumpalan darah, penyakit ginjal kronis, atau penyakit tiroid\n- Mengonsumsi obat-obatan penurun berat badan\n- Mengonsumsi obat selective serotonin reuptake inhibitors (SSRIs) untuk mengatasi depresi dan gangguan kecemasan\n- Memiliki kebiasaan merokok\n- Menyalahgunakan NAPZA, seperti kokain\n- Terpapar asbes\n', 'Topik: Hipertensi Pulmonal, Subtopik: Pencegahan Hipertensi Pulmonal \n Meski tidak semua jenis hipertensi pulmonal dapat dicegah, risiko terjadinya kondisi ini dapat dihindari dengan mengubah gaya hidup, misalnya dengan menurunkan berat badan yang berlebih, menerapkan pola makan yang sehat, dan menghindari kebiasaan merokok.\nPencegahan juga dapat dilakukan dengan menangani kondisi lain yang dapat memicu terjadinya hipertensi pulmonal, seperti hipertensi, penyakit jantung koroner, penyakit hati kronis, penyakit paru-paru konis, dan sleep apnea.\n', 'Topik: Hipertensi Pulmonal, Subtopik: Pengertian Hipertensi Pulmonal \n Hipertensi pulmonal adalah tekanan darah tinggi yang secara spesifik terjadi pada pembuluh darah arteri di paru-paru dan sisi kanan jantung. Kondisi ini awalnya bisa tidak disadari, kemudian lama-kelamaan makin serius dan dapat berakibat fatal.\nHipertensi pulmonal dapat terjadi pada semua orang, tetapi penyakit ini sering kali menyerang orang yang menderita gangguan di jantung atau paru-paru. Kondisi ini dapat terjadi dengan sendirinya atau disebabkan oleh penyakit lain.\n\nHipertensi pulmonal berkembang dengan perlahan sehingga gejalanya pun timbul secara bertahap. Penderita dapat tidak mengalami gejala apa pun pada tahap awal, tetapi gejala kemudian akan muncul dan bertambah parah seiring dengan berkembangnya kondisi.\nHipertensi pulmonal umumnya dapat ditandai oleh gejala berikut ini:\n- Napas pendek selama beraktivitas\n- Kelelahan\n- Nyeri dada\n- Jantung berdebar\n- Nyeri pada bagian kanan atas perut\n- Hilang nafsu makan\nHipertensi pulmonal terjadi ketika arteri kecil di paru-paru dan pembuluh kapilernya menyempit, tersumbat, atau rusak. Kondisi ini mengakibatkan darah dari sisi kanan jantung sulit mengalir ke paru-paru. Akibatnya, tekanan pada arteri paru-paru juga meningkat.\nSeiring peningkatan tekanan tersebut, bilik kanan jantung harus bekerja lebih keras untuk memompa darah menuju paru-paru. Kondisi ini seiring waktu membuat otot jantung melemah dan dapat memicu beragam komplikasi, yang meliputi:\n- Gagal jantung\n- Pembesaran jantung\n- Aritmia\n- Penggumpalan darah\n- Perdarahan pada paru-paru\n- Komplikasi kehamilan\nHipertensi pulmonal jarang terdiagnosis pada tahap awal dan biasanya baru disadari setelah penyakit tersebut berkembang selama beberapa waktu atau setelah mencapai tahap lanjut. Diagnosa biasanya ditetapkan melalui pemindaian jantung dan paru-paru, serta elektrokardiogram.\nHipertensi pulmonal merupakan penyakit yang belum dapat disembuhkan, sehingga pengobatan akan lebih difokuskan untuk meredakan gejala atau memperlambat perkembangan penyakit.\nPenanganan sedini mungkin penting untuk dilakukan agar tidak terjadi komplikasi. Selain itu, penderita juga disarankan untuk mengubah gaya hidup untuk memperbaiki kondisinya.\n']","Hal-hal yang dapat meningkatkan risiko terkena penyakit hipertensi pulmonal (HPP) antara lain:\n\n1. Berjenis kelamin wanita, khususnya pada usia 30 tahun ke atas.\n2. Menderita berat badan berlebih, yang dapat meningkatkan tekanan darah dan beban jantung.\n3. Memiliki keluarga dengan riwayat hipertensi pulmonal, sehingga risiko terkena penyakit ini meningkat secara genetik.\n4. Menderita kelainan lahir, seperti penyakit jantung bawaan atau sindrom Down, yang dapat mempengaruhi struktur dan fungsi jantung serta paru-paru.\n5. Mengonsumsi obat-obatan penurun berat badan (seperti asetisklaimin), yang dapat meningkatkan risiko terkena hipertensi pulmonal.\n6. Mengonsumsi obat selective serotonin reuptake inhibitors (SSRI) untuk mengatasi depresi dan gangguan kecepatan nalar, karena beberapa studi telah menunjukkan korelasi antara penggunaan SSRI dengan risiko terkena hipertensi pulmonal.\n7. Memiliki kebiasaan meroket atau menyedapkan bahan aktif narkotika, seperti kokain, yang dapat meningkatkan tekanan darah dan resiko penyakit jantung.\n8. Terpapar asbes, terutama bagi mereka yang memiliki riwayat kerja atau lingkungan yang sering terkena asbes, sebab asbes dapat menyebabkan tekanan darah meningkat dan mengancam kesehatan jantung.\n9. Mengonsumsi obat-obatan lain, seperti hipertensi atau penyakit hati/jantung, yang dapat mempengaruhi sistem pencernaan dan menyebabkan tekanan darah meningkat.\n10. Merokok, karena minuman alkohol, meroket, dan merayap asbes serta mengkonsumsi obat-obatan penurun berat badan (seperti bupropion) yang dapat mempercepat perkembangan hipertensi pulmonal.\n11. Menggunakan napza lain secara tidak sah atau merokok, seperti kokain, karena penggunaan obat-obatan ini juga dapat meningkatkan risiko terkena penyakit jantung dan tekanan darah tinggi.",0.5384615384615384,0.5958968057095015,0.99999999995,1.0
Apa penyebab penyakit endokarditis?,"Endokarditis terjadi ketika kuman masuk ke aliran darah dan bergerak menuju jantung. Kuman tersebut lalu menempel di katup jantung yang mengalami gangguan atau di jaringan jantung yang rusak. Selanjutnya, kuman tersebut akan berkembang biak di lapisan dalam jantung (endokardium).\n\nKuman penyebab endokarditis dapat masuk ke aliran darah melalui:\n\nGigi yang berlubang atau infeksi pada rongga mulut, sehingga kuman dapat masuk dengan mudah ke aliran darah\nBagian tubuh lain yang terinfeksi, misalnya infeksi di kulit, infeksi menular seksual, atau infeksi di saluran pencernaan\nKateter urine atau jarum infus, terutama yang telah dipasang dalam jangka waktu lama, misalnya pada pasien stroke atau cuci darah\nJarum suntik yang terkontaminasi kuman, baik pada penggunaan NAPZA suntik, pembuatan tato, maupun pemasangan tindik","['Topik: Endokarditis, Subtopik: Penyebab Endokarditis \n Endokarditis terjadi ketika kuman masuk ke aliran darah dan bergerak menuju jantung. Kuman tersebut lalu menempel di katup jantung yang mengalami gangguan atau di jaringan jantung yang rusak. Selanjutnya, kuman tersebut akan berkembang biak di lapisan dalam jantung (endokardium).\nKuman penyebab endokarditis dapat masuk ke aliran darah melalui:\n- Gigi yang berlubang atau infeksi pada rongga mulut, sehingga kuman dapat masuk dengan mudah ke aliran darah\n- Bagian tubuh lain yang terinfeksi, misalnya infeksi di kulit, infeksi menular seksual, atau infeksi di saluran pencernaan\n\n- Kateter urine atau jarum infus, terutama yang telah dipasang dalam jangka waktu lama, misalnya pada pasien stroke atau cuci darah\n\n- Jarum suntik yang terkontaminasi kuman, baik pada penggunaan NAPZA suntik, pembuatan tato, maupun pemasangan tindik\n', 'Topik: Endokarditis, Subtopik: Pengertian Endokarditis \n Endokarditis adalah peradangan di endokardium, yaitu lapisan bagian dalam jantung. Peradangan ini umumnya disebabkan oleh bakteri, tetapi bisa juga disebabkan oleh virus atau jamur.\nEndokarditis merupakan penyakit peradangan yang jarang terjadi. Penyakit ini hanya dialami oleh 3  10 orang dari setiap 100.000 orang, dan jarang menyerang orang yang jantungnya sehat.\n\n \nEndokarditis paling berisiko terjadi pada pasien yang menderita kerusakan katup jantung, telah menjalani operasi cangkok katup jantung, atau menderita kelainan jantung. \nMeski banyak penderitanya yang sembuh, endokarditis dapat memicu komplikasi serius jika tidak segera ditangani. Oleh karenanya, pemeriksaan dan pengobatan sedini mungkin perlu dilakukan.\n', 'Topik: Endokarditis, Subtopik: Pengertian Endokarditis \n Endokarditis merupakan penyakit peradangan yang jarang terjadi. Penyakit ini hanya dialami oleh 3  10 orang dari setiap 100.000 orang, dan jarang menyerang orang yang jantungnya sehat.\n\n \nEndokarditis paling berisiko terjadi pada pasien yang menderita kerusakan katup jantung, telah menjalani operasi cangkok katup jantung, atau menderita kelainan jantung. \nMeski banyak penderitanya yang sembuh, endokarditis dapat memicu komplikasi serius jika tidak segera ditangani. Oleh karenanya, pemeriksaan dan pengobatan sedini mungkin perlu dilakukan.\n']","Penyebab endokarditis, seperti yang telah dijelaskan dalam konteks tersebut, adalah kuman yang masuk ke aliran darah dan bergerak menuju jantung. Kuman ini lalu menempel pada katup jantung yang rusak atau di jaringan jantung yang rusak. Selanjutnya, kuman tersebut akan berkembang biak di lapisan dalam jantung (endokardium).\n\nPenyebab utama endokarditis melibatkan:\n1. Infeksi di rongga mulut atau bagian tubuh lain, seperti infeksi kulit, penyakit menular seksual, dan infeksi saluran pencernaan.\n2. Penyalahgunaan gigi yang berlubang atau infeksi di rongga mulut, yang memungkinkan kuman masuk ke aliran darah dengan mudah.\n3. Kateter urine atau jarum infus, terutama yang telah dipasang dalam jangka waktu lama pada pasien-pasien tertentu seperti pasien stroke atau pasien cuci darah.\n4. Jarum suntik yang terkontaminasi kuman, baik dari penggunaan NAPZA suntik, pembuatan tato, maupun pemasangan tindik.",1.0,0.6834348778336814,0.9999999999666667,1.0
Apa saja faktor yang meningkatkan risiko penyakit endokarditis?,"Endokarditis dapat dialami oleh siapa saja. Namun, ada beberapa faktor yang dapat meningkatkan risiko seseorang menderita kondisi ini, yaitu:\n\nBerusia lebih dari 60 tahun\nMenggunakan katup jantung buatan\nMenderita kerusakan di katup jantung\nMemiliki penyakit jantung bawaan\nMenggunakan alat bantu di jantung, seperti alat pacu jantung\nPernah menderita endokarditis sebelumnya\nPernah menggunakan NAPZA bentuk suntik\nMemiliki daya tahan tubuh lemah\nMemakai kateter dalam jangka panjang\nMemiliki kesehatan gigi dan mulut yang buruk","['Topik: Endokarditis, Subtopik: Faktor risiko endokarditis \n Endokarditis dapat dialami oleh siapa saja. Namun, ada beberapa faktor yang dapat meningkatkan risiko seseorang menderita kondisi ini, yaitu:\n- Berusia lebih dari 60 tahun\n- Menggunakan katup jantung buatan\n- Menderita kerusakan di katup jantung\n- Memiliki penyakit jantung bawaan\n\n- Menggunakan alat bantu di jantung, seperti alat pacu jantung\n- Pernah menderita endokarditis sebelumnya\n- Pernah menggunakan NAPZA bentuk suntik\n- Memiliki daya tahan tubuh lemah\n- Memakai kateter dalam jangka panjang\n- Memiliki kesehatan gigi dan mulut yang buruk\n', 'Topik: Endokarditis, Subtopik: Pengertian Endokarditis \n Endokarditis adalah peradangan di endokardium, yaitu lapisan bagian dalam jantung. Peradangan ini umumnya disebabkan oleh bakteri, tetapi bisa juga disebabkan oleh virus atau jamur.\nEndokarditis merupakan penyakit peradangan yang jarang terjadi. Penyakit ini hanya dialami oleh 3  10 orang dari setiap 100.000 orang, dan jarang menyerang orang yang jantungnya sehat.\n\n \nEndokarditis paling berisiko terjadi pada pasien yang menderita kerusakan katup jantung, telah menjalani operasi cangkok katup jantung, atau menderita kelainan jantung. \nMeski banyak penderitanya yang sembuh, endokarditis dapat memicu komplikasi serius jika tidak segera ditangani. Oleh karenanya, pemeriksaan dan pengobatan sedini mungkin perlu dilakukan.\n', 'Topik: Endokarditis, Subtopik: Pengertian Endokarditis \n Endokarditis merupakan penyakit peradangan yang jarang terjadi. Penyakit ini hanya dialami oleh 3  10 orang dari setiap 100.000 orang, dan jarang menyerang orang yang jantungnya sehat.\n\n \nEndokarditis paling berisiko terjadi pada pasien yang menderita kerusakan katup jantung, telah menjalani operasi cangkok katup jantung, atau menderita kelainan jantung. \nMeski banyak penderitanya yang sembuh, endokarditis dapat memicu komplikasi serius jika tidak segera ditangani. Oleh karenanya, pemeriksaan dan pengobatan sedini mungkin perlu dilakukan.\n']","Faktor-faktor yang meningkatkan risiko penyakit endokarditis antara lain:\n\n1. Usia lebih dari 60 tahun, karena resiko semakin meningkat seiring berjalannya usia.\n2. Menggunakan katup jantung buatan, yang bisa memicu infeksi dan risiko endokarditis.\n3. Menderita kerusakan di katup jantung atau kelainan jantung, yang dapat meningkatkan resiko infeksi pada area ini.\n4. Memiliki penyakit jantung bawaan, seperti hipertrofi kardiomyopati atau difteris sinusitis, yang juga bisa memperkuat risiko endokarditis.",0.5714285714285714,0.7475260476760024,0.9999999999666667,1.0
Apa kelainan yang dialami oleh seseorang dengan penyakit Patent Foramen Ovale?,Patent foramen ovale adalah penyakit jantung bawaan ketika lubang yang terletak di antara serambi kanan dan serambi kiri jantung tidak menutup secara sempurna setelah bayi lahir. Pada patent foramen ovale (PFO) darah kaya oksigen bercampur dengan darah minim oksigen.,"['Topik: Patent Foramen Ovale, Subtopik: Komplikasi Patent Foramen Ovale \n Patent foramen ovale umumnya tidak menimbulkan komplikasi, kecuali jika disertai dengan kondisi lain atau kelainan lain pada struktur jantung. Komplikasi yang dapat terjadi pada penderita PFO adalah:\n- Kekurangan oksigen dalam darah (hipoksemia)\n- Stroke iskemik\n- Serangan jantung\n- Gangguan ginjal\n- Migrain\n- Emboli lemak\n- Emboli udara (pada penyelam)\n- Gangguan katup jantung\n', 'Topik: Patent Foramen Ovale, Subtopik: Pengertian Patent Foramen Ovale \n Patent foramen ovale adalah penyakit jantung bawaan ketika lubang yang terletak di antara serambi kanan dan serambi kiri jantung tidak menutup secara sempurna setelah bayi lahir. Meski jarang bergejala, kondisi ini dapat menyebabkan migrain dan stroke ketika penderita dewasa.\nForamen ovale adalah lubang yang dibutuhkan oleh janin ketika masih di dalam kandungan. Normalnya, lubang ini akan menutup secara alami setelah bayi lahir, karena sudah tidak diperlukan. Patent foramen ovale (PFO) adalah istilah untuk foramen ovale yang tidak menutup setelah bayi lahir.\n\n', 'Topik: Patent Foramen Ovale, Subtopik: Gejala Patent Foramen Ovale \n Patent foramen ovale cukup sering terjadi, yaitu pada 1 dari 4 bayi. Kondisi ini sering kali tidak menimbulkan gejala sehingga tidak disadari oleh penderitanya. Sebagian besar pasien baru menyadari dirinya menderita PFO ketika melakukan pemeriksaan untuk penyakit lain.\nKeluhan yang dapat timbul pada penderita PFO antara lain:\n- Lemah atau mati rasa di lengan atau kaki\n- Migrain atau sakit kepala\n- Nyeri dada\n- Penggumpalan darah\n- Linglung\n- Hilang keseimbangan\n']","Kelainan yang umumnya terjadi pada seseorang dengan Patent Foramen Ovale (PFO) termasuk:\n\n1. Hipoksemia, yaitu ketidakmaksimalan oksigen dalam darah karena adanya PFO yang menghalangi aliran darah normal antara serambi kanan dan kiri jantung.\n2. Stroke iskemik, yang dapat terjadi akibat pembuluh darah ke大脑 membuka mundur melalui PFO ketika pasien berada di posisi horizontal, menyebabkan oksigen dalam darah menjadi lebih sedikit untuk brain.\n3. Serangan jantung, yang dapat disebabkan oleh gangguan aliran darah pada PFO sehingga oksigen tidak maksimal tercapai oleh tissue jantung.\n4. Gangguan ginjal dan migrain, keduanya juga merupakan gejala lain yang berkaitan dengan penyakit ini.\n5. Emboli lemak atau udara, yang terdapat pada PFO, dapat mengganggu aliran darah ke organ-organ tubuh lainnya.",0.375,0.6813089882135969,0.5833333333041666,0.5
Apa gejala pada seseorang yang menderita penyakit Patent Foramen Ovale?,"Patent foramen ovale cukup sering terjadi, yaitu pada 1 dari 4 bayi. Kondisi ini sering kali tidak menimbulkan gejala sehingga tidak disadari oleh penderitanya. Sebagian besar pasien baru menyadari dirinya menderita PFO ketika melakukan pemeriksaan untuk penyakit lain.\n\nKeluhan yang dapat timbul pada penderita PFO antara lain:\n\nLemah atau mati rasa di lengan atau kaki\nMigrain atau sakit kepala\nNyeri dada\nPenggumpalan darah\nLinglung\nHilang keseimbangan","['Topik: Patent Foramen Ovale, Subtopik: Gejala Patent Foramen Ovale \n Patent foramen ovale cukup sering terjadi, yaitu pada 1 dari 4 bayi. Kondisi ini sering kali tidak menimbulkan gejala sehingga tidak disadari oleh penderitanya. Sebagian besar pasien baru menyadari dirinya menderita PFO ketika melakukan pemeriksaan untuk penyakit lain.\nKeluhan yang dapat timbul pada penderita PFO antara lain:\n- Lemah atau mati rasa di lengan atau kaki\n- Migrain atau sakit kepala\n- Nyeri dada\n- Penggumpalan darah\n- Linglung\n- Hilang keseimbangan\n', 'Topik: Patent Foramen Ovale, Subtopik: Gejala Patent Foramen Ovale: Kapan harus ke dokter \n Seperti yang telah disebutkan sebelumnya, penderita sering kali tidak menyadari bila ia menderita PFO. Oleh karena itu, segera periksakan ke dokter apabila mengalami gejala berikut ini:\n- Sakit kepala atau migrain yang sering terjadi\n- Lemah pada salah satu sisi wajah, lengan, atau kaki\n- Gangguan penglihatan\n- Tidak dapat berbicara atau bicara pelo secara tiba-tiba\n- Gangguan keseimbangan dan berjalan\n- Nyeri dada berulang\n- Pingsan\n', 'Topik: Patent Foramen Ovale, Subtopik: Pengertian Patent Foramen Ovale \n Patent foramen ovale adalah penyakit jantung bawaan ketika lubang yang terletak di antara serambi kanan dan serambi kiri jantung tidak menutup secara sempurna setelah bayi lahir. Meski jarang bergejala, kondisi ini dapat menyebabkan migrain dan stroke ketika penderita dewasa.\nForamen ovale adalah lubang yang dibutuhkan oleh janin ketika masih di dalam kandungan. Normalnya, lubang ini akan menutup secara alami setelah bayi lahir, karena sudah tidak diperlukan. Patent foramen ovale (PFO) adalah istilah untuk foramen ovale yang tidak menutup setelah bayi lahir.\n\n']","Penyakit Patent Foramen Ovale (PFO) biasanya tidak menyebabkan gejala saat bayi masih kecil, karena lubang tersebut umumnya secara alami menutup setelah bayi lahir. Namun, sebagai dewasa, seseorang yang menderita PFO dapat mengalami beberapa gejala berikut:\n\n1. Sakit kepala atau migrain sering terjadi, yang bisa disebabkan oleh aliran darah tidak lancar akibat adanya PFO.\n2. Lemah pada salah satu sisi wajah, lengan, atau kaki, yang juga dapat menunjukkan gangguan syaraf atau penyakit pernapasan lainnya.\n3. Gangguan penglihatan, seperti kehilangan visu di salah satu mata, yang bisa disebabkan oleh aliran darah tidak lancar hingga jaringan otak.\n4. Tidak dapat berbicara atau bicara pelompat-lompong secara tiba-tiba, yang juga merupakan gejala lain yang mungkin disebabkan oleh penyakit neurologis atau gangguan syaraf.\n5. Gangguan keseimbangan dan berjalan, yang bisa menunjukkan masalah dengan aliran darah ke jaringan otak atau gejala lainnya.\n6. Nyeri dada berulang, yang juga bisa disebabkan oleh penyakit jantung atau gangguan syaraf perlu diperiksa lebih lanjut untuk menentukan hubungannya dengan PFO.\n7. Pingsan, yang merupakan gejala lain yang bisa disebabkan oleh penyakit neurologis atau gangguan syaraf lainnya.\n\nKetika seseorang mengalami gejala-gejala ini dan memiliki penyakit PFO, mereka harus segera periksa ke dokter untuk mendapatkan diagnosis yang tepat dan pengobatan sesuai dengan masalahnya.",0.5,0.8362021269027737,0.9999999999666667,1.0
Apa penyebab dari penyakit sindrom eisenmenger?,"Pada penderita sindrom Eisenmenger, terdapat lubang di jantung, tepatnya di antara ruang jantung. Kondisi ini menyebabkan darah dari ruang kiri jantung mengalir ke ruang kanan jantung dan tekanan darah paru-paru meningkat (hipertensi pulmonal).\n\nSindrom Eisenmenger atau Eisenmenger syndrome terjadi akibat kelainan jantung bawaan, seperti:\n\nAtrioventricular canal defect, yaitu lubang besar di tengah yang menyebabkan semua ruang jantung menyatu\nVentricular septal defect, yaitu lubang di septum ventrikel\nAtrial septal defect, yaitu lubang pada septum atrium\nPatent ductus arteriosus","['Topik: Sindrom Eisenmenger, Subtopik: Penyebab Sindrom Eisenmenger \n Jantung manusia terdiri dari empat ruang, yaitu dua serambi (atrium) dan dua bilik (ventrikel) yang dipisahkan oleh sekat jantung, serta empat katup jantung.\nRuang kiri jantung berisi darah yang kaya oksigen (darah bersih) untuk dipompa ke seluruh tubuh. Sementara ruang kanan jantung berisi darah yang minim oksigen (darah kotor), untuk dibawa ke paru-paru dan diperkaya dengan oksigen.\nPada penderita sindrom Eisenmenger, terdapat lubang di jantung, tepatnya di antara ruang jantung. Kondisi ini menyebabkan darah dari ruang kiri jantung mengalir ke ruang kanan jantung dan tekanan darah paru-paru meningkat (hipertensi pulmonal).\nSindrom Eisenmenger atau Eisenmenger syndrome terjadi akibat kelainan jantung bawaan, seperti:\n- Atrioventricular canal defect, yaitu lubang besar di tengah yang menyebabkan semua ruang jantung menyatu\n- Ventricular septal defect, yaitu lubang di septum ventrikel\n- Atrial septal defect, yaitu lubang pada septum atrium\n- Patent ductus arteriosus\n', 'Topik: Sindrom Eisenmenger, Subtopik: Pengertian Sindrom Eisenmenger \n Sindrom Eisenmenger adalah kelainan jantung bawaan yang mengakibatkan bercampurnya darah kaya oksigen dengan darah minim oksigen. Kondisi ini menyebabkan penderitanya mudah lelah dan kulitnya membiru.\nBercampurnya darah kaya oksigen dengan darah minim oksigen paling sering terjadi akibat adanya lubang di sekat jantung. Akibatnya, darah yang seharusnya dipompa ke seluruh tubuh malah kembali ke paru-paru.\n\nKondisi tersebut menyebabkan tekanan di pembuluh darah paru-paru meningkat dan meningkatkan risiko terjadinya gagal jantung.\n', 'Topik: Sindrom Eisenmenger, Subtopik: Gejala Sindrom Eisenmenger \n Gejala sindrom Eisenmenger tergantung pada penyebab dan usia penderitanya. Pada bayi baru lahir, tanda yang dapat terlihat adalah napas yang cepat, mudah lelah saat menyusu, kulit membiru ketika menangis, dan berat badan sulit naik.\nSementara pada anak-anak, gejala yang muncul adalah berat badan sulit naik dan sering sesak napas saat beraktivitas. Sedangkan pada penderita usia remaja atau dewasa, sindrom Eisenmenger dapat menimbulkan gejala, seperti:\n- Kulit, bibir, jari-jari tangan dan kaki berwarna kebiruan (sianosis)\n- Jari-jari tangan atau kaki menjadi lebar dan gempal (clubbing finger)\n- Kesemutan atau mati rasa pada jari kaki atau tangan\n- Pusing atau sakit kepala\n- Batuk berdarah\n- Kaki bengkak\n- Mudah lelah\n- Jantung berdebar\n- Nyeri dada\n- Sesak napas makin parah\n- Sering pingsan\n']","Penurunan tekanan darah pada ruang jantung kiri dan kanan disebabkan oleh adanya lubang di sekat jantung, menyebabkan aliran darah tidak teratur. Dalam hal ini, darah yang mengalir dari ruang kiri ke ruang kanan meninggalkan sistem sirkulasi pulmonal dan mengganggu fungsi paru-paru lainnya. Hal ini menyebabkan tekanan di pembuluh darah paru-paru meningkat (hipertensi pulmonal) dan risiko terjadinya gagal jantung juga bertambah besar.\n\nPenyebab sindrom Eisenmenger, seperti yang dijelaskan dalam konteks yang diberikan, adalah kelainan jantung bawaan seperti atrioventricular canal defect, ventricular septal defect, atrial septal defect, dan patent ductus arteriosus. Kelainan ini membuka rute aliran darah yang tidak semestinya, menyebabkan aliran darah dari ruang kiri ke kanan dan mengganggu fungsi jantung serta sistem sirkulasi lainnya.",0.6363636363636364,0.3044111536012332,0.99999999995,1.0
Apa gejala yang muncul pada bayi yang mengalami sindrom eisenmenger?,"Pada bayi baru lahir, tanda yang dapat terlihat adalah napas yang cepat, mudah lelah saat menyusu, kulit membiru ketika menangis, dan berat badan sulit naik.","['Topik: Sindrom Eisenmenger, Subtopik: Gejala Sindrom Eisenmenger \n Gejala sindrom Eisenmenger tergantung pada penyebab dan usia penderitanya. Pada bayi baru lahir, tanda yang dapat terlihat adalah napas yang cepat, mudah lelah saat menyusu, kulit membiru ketika menangis, dan berat badan sulit naik.\nSementara pada anak-anak, gejala yang muncul adalah berat badan sulit naik dan sering sesak napas saat beraktivitas. Sedangkan pada penderita usia remaja atau dewasa, sindrom Eisenmenger dapat menimbulkan gejala, seperti:\n- Kulit, bibir, jari-jari tangan dan kaki berwarna kebiruan (sianosis)\n- Jari-jari tangan atau kaki menjadi lebar dan gempal (clubbing finger)\n- Kesemutan atau mati rasa pada jari kaki atau tangan\n- Pusing atau sakit kepala\n- Batuk berdarah\n- Kaki bengkak\n- Mudah lelah\n- Jantung berdebar\n- Nyeri dada\n- Sesak napas makin parah\n- Sering pingsan\n', 'Topik: Sindrom Eisenmenger, Subtopik: Pencegahan Sindrom Eisenmenger \n Sindrom Eisenmenger pada bayi dapat dicegah melalui operasi perbaikan kelainan jantung sedini mungkin. Sedangkan pada anak yang menderita penyakit jantung bawaan, pemeriksaan rutin bisa mencegah terjadinya komplikasi.\nOrang tua juga perlu waspada ketika berat badan anak tidak naik dengan optimal. Sementara itu, wanita yang menderita sindrom Eisenmenger dan aktif secara seksual disarankan untuk tidak hamil, karena dapat membahayakan kondisi ibu dan janin.\n', 'Topik: Sindrom Eisenmenger, Subtopik: Gejala Sindrom Eisenmenger: Kapan harus ke dokter \n Segera periksakan diri atau anak Anda ke dokter jika mengalami keluhan di atas. Jika Anda atau anak Anda telah didiagnosis menderita sindrom Eisenmenger, pemeriksaan rutin ke dokter perlu dilakukan untuk mencegah terjadinya komplikasi yang fatal.\n']","Gejala yang mungkin muncul pada bayi yang mengalami sindrom Eisenmenger, termasuk dalam kategori pasien pediatrik, meliputi:\n- Napas yang cepat dan mudah lelah saat menyusu.\n- Berat badan sulit naik.\n- Sesak napas seringkali disertai aktivitas berat seperti berenang atau bermain.\n- Kulit, bibir, jari-jari tangan dan kaki membiru ketika menangis.\n- Faktor risiko yang lebih lanjut untuk sindrom Eisenmenger pada bayi termasuk dalam kategori pasien pediatrik adalah berat badan sulit naik, sering sesak napas saat aktivitas ringan hingga berat, dan kulit, bibir, jari-jari tangan, atau kaki yang membiru.\n\nPada anak-anak dapat muncul gejala seperti:\n- Berat badan sulit naik.\n- Sesak napas seringkali disertai aktivitas ringan hingga berat.\n- Faktor risiko yang lebih lanjut untuk sindrom Eisenmenger pada anak termasuk berat badan sulit naik dan sesak napas saat aktivitas ringan hingga berat, serta kaki bengkak atau jantung berdebar.\n\nPenderita usia remaja atau dewasa dengan sindrom Eisenmenger mungkin mengalami:\n- Kulit, bibir, jari-jari tangan dan kaki kebiruan (sianosis).\n- Jari-jari tangan atau kaki menjadi lebar dan gempal (clubbing finger).\n- Kesemutan atau mati rasa pada jari kaki atau tangan.\n- Pusing atau sakit kepala.\n- Batuk berdarah.\n- Kaki bengkrak.\n- Mudah lelah.\n- Jantung berdebar.\n- Nyeri dada.\n- Sesak napas makin parah.\n- Sering pingsan.",0.7083333333333334,0.6156594145849211,0.8333333332916666,1.0
Apa yang membedakan henti jantung mendadak dengan serangan jantung?,"Henti jantung mendadak berbeda dengan serangan jantung. Serangan jantung terjadi karena penyumbatan pembuluh darah. Sementara henti jantung mendadak disebabkan oleh ventrikel fibrilasi. Namun, ventrikel fibrilasi juga dapat disebabkan oleh serangan jantung.\n\nVentrikel fibrilasi merupakan salah satu jenis gangguan irama jantung (aritmia). Kondisi ini ditandai dengan ventrikel (bilik) jantung yang hanya bergetar, bukan berdenyut untuk memompa darah. Akibatnya, pasokan darah yang membawa oksigen dan nutrisi ke organ-organ tubuh akan terhenti.","['Topik: Henti Jantung Mendadak, Subtopik: Pengertian Henti Jantung Mendadak \n Henti jantung mendadak atau sudden cardiac arrest adalah kondisi ketika jantung berhenti berdetak secara tiba-tiba. Kondisi ini menyebabkan penderitanya hilang kesadaran dan bahkan berhenti bernapas. \nHenti jantung mendadak terjadi akibat gangguan pada listrik jantung sehingga jantung berhenti memompa darah ke seluruh tubuh. Kondisi ini dapat menyebabkan kerusakan otak permanen sampai kematian. Penderita perlu diberikan pertolongan pertama berupa CPR dan kejut jantung, agar tidak terserang komplikasi.\n\n', 'Topik: Henti Jantung Mendadak, Subtopik: Pengertian Henti Jantung Mendadak \n Henti jantung mendadak terjadi akibat gangguan pada listrik jantung sehingga jantung berhenti memompa darah ke seluruh tubuh. Kondisi ini dapat menyebabkan kerusakan otak permanen sampai kematian. Penderita perlu diberikan pertolongan pertama berupa CPR dan kejut jantung, agar tidak terserang komplikasi.\n\n', 'Topik: Henti Jantung Mendadak, Subtopik: Diagnosis Henti Jantung Mendadak \n Pada saat tiba di rumah sakit, dokter akan memeriksa denyut jantung pasien. Dokter juga akan memasang monitor untuk memeriksa irama jantung. Selanjutnya, dokter akan melakukan penanganan sampai kondisi pasien stabil atau jantungnya kembali berdetak.\nJika kondisi pasien sudah stabil, dokter akan melakukan pemeriksaan lanjutan untuk mendiagnosis penyebab atau faktor pemicu terjadinya henti jantung mendadak. Pemeriksaan tersebut dapat meliputi:\n- Tes darah\nTes darah dilakukan untuk memeriksa kadar kalium, magnesium, atau hormon tertentu yang memengaruhi fungsi jantung. Tes darah juga dapat dilakukan untuk mendeteksi cedera atau riwayat serangan jantung pada penderita henti jantung mendadak.\n- Foto Rontgen dada\nFoto Rontgen dada dilakukan untuk memeriksa ukuran dan struktur jantung serta pembuluh darah jantung. Melalui pemeriksaan ini, dokter juga dapat mendeteksi apakah pasien mengalami gagal jantung.\n- Ekokardiografi\nEkokardiografi atau USG jantung bertujuan untuk mengidentifikasi kerusakan pada jantung.\n- Kateterisasi jantung\nDalam kateterisasi jantung, dokter akan menyuntikkan zat pewarna khusus pada pembuluh darah yang menuju jantung. Pemeriksaan ini bertujuan untuk mendeteksi sumbatan pada pembuluh darah. Kateterisasi jantung juga dapat dilakukan untuk studi elektrofisiologi jantung. Prosedur ini dapat mendeteksi gangguan irama jantung yang mungkin menyebabkan henti jantung mendadak.\n']","Henti jantung mendadak (sudden cardiac arrest) dan serangan jantung (heart attack) adalah dua kondisi medis berbeda yang memiliki asosiasi erat dengan fungsi jantung. Berikut ini penjelasan mengenai perbedaan antara henti jantung mendadak dan serangan jantung:\n\n1. Penyebab dan Mekanisme Kerusakan:\n- Henti Jantung Mendadak (Sudden Cardiac Arrest): Penyebab utamanya adalah gangguan sistem listrik di jantung yang mengakibatkan jantung secara mendadak berhenti memompa darah. Hal ini dapat disebabkan oleh aritmia atau terputusan ritme jantung, seringkali tidak berkaitan langsung dengan penyakit arteri yang menutup luka pembuluh darah (stenosis).\n- Serangan Jantung (Heart Attack): Penyebab utama serangan jantung adalah terhambatnya aliran darah ke jantung karena pengotor atau lemak dalam saluran pembuluh darah. Hal ini menipis sel daripada yang dibutuhkan dan mengurangi oksigen yang dapat diserap oleh jantung, serta menyebabkan cedera pada jaringan miokardium (jaringan yang membentuk bibir atas dan bawah jantung).\n\n2. Gejala Wajib:\n- Henti Jantung Mendadak: Penderita biasanya tidak mengalami awitan sebelum henti jantung mendadak terjadi, yang diakibatkan oleh hilangnya sistem pengaturan detak jantung.\n- Serangan Jantung: Penderita seringkali mengalami awitan atau nyeri tenggorokan sebelum serangan jantung, dan biasanya gejala ini berkurang saat bergerak menghindari jantung dari beban yang berlebihan.\n\n3. Pengobatan Pertama:\n- Henti Jantung Mendadak: Pemulihan sangat tergantung pada lamanya waktu antara henti jantung dan penyembuhan pertama dilakukan pada pasien, terutama dalam 4-6 menit setelah kekurangan oksigen otak.\n- Serangan Jantung: Penderita seringkali segera mengadopsi tindakan resuscitasi jantung (CPR) dan pemberian asistol dengan cepat untuk mencegah kerusakan otak yang bisa fatal.\n\n4. Progres Diagnostik dan Pemulihan:\n- Henti Jantung Mendadak: Pengobatan diagnostik umumnya lebih lanjut setelah kondisi pasien stabil, termasuk pemeriksaan laboratorium untuk mengetahui faktor penyebab atau riwayat penyakit jantung lainnya.\n- Serangan Jantung: Pemeriksaan yang umum dilakukan antara lain adalah EKG, kateterisasi jantung untuk memastikan tidak terdapat lemak atau pengotor dalam saluran pembuluh darah, dan juga menjaga agar pasien tetap stabil.\n\n5. Kesiapkannya:\n- Henti Jantung Mendadak: Penderita yang mungkin memerlukan dukungan medis khusus seperti perawatan jantung di ICU atau unit terpadu, dengan pengobatan lanjutan dan penyembuhan yang lebih lama.\n- Serangan Jantung: Pasien seringkali mengalami proses rehabilitasi medis dan kesehatan masa depan untuk menghindari risiko ulang terjadinya serangan jantung atau penyakit jantung lainnya, tetapi umumnya tidak memerlukan dukungan medis yang seksama.\n\nDengan demikian, henti jantung mendadak dan serangan jantung merupakan dua kondisi medis berbeda dalam hubungannya dengan fungsi jantung, yang memiliki gejala, penyebab, komplikasi, pengobatan, dan proses rehabilitasinya yang unik.",0.5517241379310345,0.5176713878736846,0.9999999999666667,0.0
Bagaimana penanganan darurat terhadap seseorang yang mengalami henti jantung mendadak?,"Segera periksa denyut jantungnya dan hubungi ambulans atau rumah sakit terdekat.\n\nSambil menunggu datangnya pertolongan medis, lakukan juga penanganan darurat berupa CPR. Gunakan juga alat automated external defibrillator (AED) bila tersedia.","['Topik: Henti Jantung Mendadak, Subtopik: Pengobatan Henti Jantung Mendadak: Penanganan darurat \n Penanganan darurat bertujuan untuk mengembalikan kesadaran pasien henti jantung mendadak. Hal ini dilakukan oleh petugas medis darurat, yang dimulai dengan memeriksa pernapasan dan denyut nadi pasien.\nJika jantung pasien tidak berdetak, tim medis akan melakukan CPR dan memberikan kejut listrik selama perjalanan ke rumah sakit. Setelah jantung kembali berdetak, pasien akan dirawat di ruang rawat intensif (ICU) dan diberikan alat bantu napas.\n', 'Topik: Henti Jantung Mendadak, Subtopik: Gejala Henti Jantung Mendadak: Kapan harus ke dokter \n Henti jantung mendadak merupakan kondisi darurat yang harus segera ditangani. Jika Anda melihat seseorang yang tidak sadarkan diri dan tidak bernapas dengan normal, segera periksa denyut jantungnya dan hubungi ambulans atau rumah sakit terdekat.\nSambil menunggu datangnya pertolongan medis, lakukan juga penanganan darurat berupa CPR. Gunakan juga alat automated external defibrillator (AED) bila tersedia.\nGejala henti jantung mendadak terjadi secara cepat dan tanpa disadari. Meskipun demikian, gejala-gejala awal biasanya dapat dirasakan penderita beberapa hari sebelumnya. Oleh sebab itu, segera lakukan pemeriksaan ke dokter bila mengalami gejala seperti di atas, terutama bila memiliki riwayat penyakit jantung.\n', 'Topik: Henti Jantung Mendadak, Subtopik: Pengobatan Henti Jantung Mendadak \n Pengobatan henti jantung mendadak terdiri dari penanganan darurat dan pengobatan jangka panjang. Berikut adalah penjelasannya:\n']","Penanganan darurat terhadap seseorang yang mengalami henti jantung mendadak melibatkan beberapa langkah dasar. Pertama, segera periksa denyut jantung pasien untuk mengetahui apakah ada gangguan jantung signifikan. Jika jantung pasien tidak berdetak, petugas medis darurat akan mulai langkah penanganan utama, yang meliputi:\n\n1. Memastikan alis dan napas pasien tetap terjaga dengan memberikan bantuan nafas untuk pasien jika perlu.\n2. Melakukan CPR (Cardiopulmonary Resuscitation) secara cepat dan efektif, yang melibatkan teknik-teknik seperti memuntahkan dada, menggosok tengkorak, dan membersihkan trakea untuk mencegah asidosis.\n3. Menggunakan alat kejut listrik (defibrillator) jika pasien perlu untuk menghadapi fibrilasi tanpa ritme ventrikular (VT/VF), yang merupakan bentuk khusus dari fibrilasi jantung, apabila tidak ada denyut nadi atau aritmia terdeteksi.\n4. Melakukan pengaturan perjalanan medis cepat dan aman ke rumah sakit yang kompeten dalam mengobati henti jantung mendadak, dengan penunjang otoritas medis atau stasiun angkutan khusus.\n5. Menyediakan dukungan paramedis lainnya seperti obat-obatan, alat pengatur denyut nadi, dan peralatan ICU yang diperlukan untuk pasien saat ini dan setelah sampai di rumah sakit.\n6. Melakukan risiko kesakitan lainnya seperti menghentikan perdarahan atau menangani gangguan fungsi ginjal, hati, dan sistem saraf yang mungkin terkait dengan henti jantung mendadak.\n7. Menyusun pengobatan jangka panjang untuk penyebab henti jantung atau faktor-faktor risiko lainnya, seperti riwayat keluarga atau gejala yang dihadapi pasien sebelumnya.\n8. Melakukan evaluasi dan analisis lebih lanjut tentang penyebab henti jantung mendadak untuk pengurangan resiko nanti, termasuk perawatan kesehatan umum dan modifikasi gaya hidup yang berkaitan.\n\nHal ini penting untuk segera menangani henti jantung mendadak agar pasien dapat pulih sempurna dan resiko terkena efek samping atau kematian menjadi serendah mungkin.",0.5555555555555556,0.5593530212211719,0.9999999999666667,1.0
Apa saja komplikasi yang dapat dialami oleh orang yang mengalami henti jantung mendadak?,"Komplikasi henti jantung mendadak adalah kerusakan otak permanen, hipoksia, hingga kematian. Pada beberapa kasus, penderita henti jantung mendadak masih bisa ditangani dan akhirnya sembuh.\n\nMeski demikian, penderita henti jantung mendadak yang sembuh umumnya juga mengalami sejumlah komplikasi berupa:\n\nKerusakan saraf\nGangguan gerakan\nKesulitan berbicara\nSulit konsentrasi\nPost-traumatic stress disorder (PTSD)","['Topik: Henti Jantung Mendadak, Subtopik: Komplikasi Henti Jantung Mendadak \n Komplikasi henti jantung mendadak adalah kerusakan otak permanen, hipoksia, hingga kematian. Pada beberapa kasus, penderita henti jantung mendadak masih bisa ditangani dan akhirnya sembuh.\nMeski demikian, penderita henti jantung mendadak yang sembuh umumnya juga mengalami sejumlah komplikasi berupa:\n- Kerusakan saraf\n- Gangguan gerakan\n- Kesulitan berbicara\n- Sulit konsentrasi\n- Post-traumatic stress disorder (PTSD)\n', 'Topik: Henti Jantung Mendadak, Subtopik: Pengertian Henti Jantung Mendadak \n Henti jantung mendadak atau sudden cardiac arrest adalah kondisi ketika jantung berhenti berdetak secara tiba-tiba. Kondisi ini menyebabkan penderitanya hilang kesadaran dan bahkan berhenti bernapas. \nHenti jantung mendadak terjadi akibat gangguan pada listrik jantung sehingga jantung berhenti memompa darah ke seluruh tubuh. Kondisi ini dapat menyebabkan kerusakan otak permanen sampai kematian. Penderita perlu diberikan pertolongan pertama berupa CPR dan kejut jantung, agar tidak terserang komplikasi.\n\n', 'Topik: Henti Jantung Mendadak, Subtopik: Gejala Henti Jantung Mendadak \n Henti jantung mendadak merupakan kondisi yang terjadi secara tiba-tiba. Pada umumnya, gejala utama henti jantung mendadak adalah pingsan. Namun, sebagian penderita henti jantung mendadak dapat mengalami gejala awal berupa:\n- Pusing\n- Lemas\n- Nyeri dada\n- Sesak napas\n- Jantung berdebar\n']","Komplikasi yang dapat dialami oleh orang yang mengalami henti jantung mendadak, selengkapnya sebagai berikut:\n\n1. Kerusakan ot大脑永久性的（hipoksia）：Kerusakan ini berkaitan dengan penyimpangan aliran darah ke otak, yang dapat menyebabkan kerusakan jaringan otak dan bahkan kematian.\n2. Hipoksia：Penyimpangan aliran darah ke organ lain dalam tubuh, termasuk hati, ginjal, atau limpa.\n3. Gangguan gerakan：Kerusakan pada sistem saraf yang bisa menyebabkan kesulitan berjalan dan mengontrol bagian tubuh lainnya.\n4. Kesulitan berbicara：Kemungkinan disebabkan oleh kerusakan pada area otak yang terlibat dalam proses komunikasi.\n5. Sulit konsentrasi：Gejala ini bisa diakibatkan oleh trauma akibat henti jantung mendadak dan ketidakmaksudan tubuh untuk berfungsi dengan normal setelah pengobatan awal.\n6. Post-traumatic stress disorder (PTSD）：Gejala ini bisa timbul karena trauma akibat henti jantung mendadak dan proses yang mereka alami selama masa hospitalisasi atau pemulihan.\n\nKeadaan ini menunjukkan bahwa komplikasi dari henti jantung mendadak bisa sangat parah, termasuk kerusakan otak permanen dan kematian, tetapi ada juga yang sembuh dan mengalami komplikasi lain seperti gangguan gerakan atau kesulitan berbicara.",0.8666666666666667,0.49550399261508754,0.99999999995,1.0
Apa penyebab seseorang menderita penyakit perikarditis?,"Sebagian besar kasus perikarditis tidak diketahui penyebabnya, tetapi ada beberapa hal yang diduga dapat menjadi penyebab perikarditis, yaitu:\n\nInfeksi bakteri\nInfeksi virus, seperti COVID-19, rubella, dan influenza\nKanker dari organ lain yang menyebar ke perikardium\nSerangan jantung\nCedera pada dada\nKomplikasi akibat operasi jantung\nPenyakit peradangan, seperti lupus dan rheumatoid arthritis\nPaparan radiasi dalam radioterapi, khususnya pada terapi kanker payudara dan kanker paru","['Topik: Perikarditis, Subtopik: Penyebab Perikarditis \n Sebagian besar kasus perikarditis tidak diketahui penyebabnya, tetapi ada beberapa hal yang diduga dapat menjadi penyebab perikarditis, yaitu:\n- Infeksi bakteri\n- Infeksi virus, seperti COVID-19, rubella, dan influenza\n- Kanker dari organ lain yang menyebar ke perikardium\n- Serangan jantung\n- Cedera pada dada\n- Komplikasi akibat operasi jantung\n- Penyakit peradangan, seperti lupus dan rheumatoid arthritis\n\n- Paparan radiasi dalam radioterapi, khususnya pada terapi kanker payudara dan kanker paru\n', 'Topik: Perikarditis, Subtopik: Diagnosis Perikarditis \n Diagnosis perikarditis ditetapkan berdasarkan hasil tanya jawab terkait gejala, serta hasil pemeriksaan fisik dan pemeriksaan penunjang. Beberapa tes penunjang yang dilakukan untuk memastikan perikarditis dan penyebabnya yaitu:\n- Tes darah\nTes darah dilakukan untuk mengetahui adanya infeksi atau peradangan.\n- Rontgen dada\nFoto Rontgen dada bertujuan untuk melihat kondisi jantung, paru-paru, dan pembuluh Jika terdapat efusi perikardium yang terjadi pada perikarditis, maka jantung akan tampak membesar.\n- Echo jantung\nEcho jantung dilakukan untuk melihat gambaran jantung dan mendeteksi cairan yang terkumpul dalam ruang\n- EKG (elektrokardiogram) \nEKG bertujuan untuk mendeteksi dan merekam aktivitas listrik jantung yang dapat berubah saat terjadi perikarditits.\n- CT scan\nPemindaian dengan sinar-X ini dilakukan untuk mendapatkan gambaran jantung lebih detail.\n- MRI\nProsedur menggunakan gelombang magnet ini dilakukan untuk mendapatkan gambaran jantung secara detail. Dari hasil pemeriksaan, dapat terlihat apabila ada penebalan, peradangan, atau perubahan lain pada perikardium.\n', 'Topik: Perikarditis, Subtopik: Pengertian Perikarditis \n Perikarditis adalah peradangan pada lapisan tipis berbentuk kantong yang melapisi jantung (perikardium). Perikardium berfungsi untuk menjaga agar jantung tidak berpindah posisi, serta melindungi jantung dari gesekan atau penyebaran infeksi dari jaringan lain.\nPenyakit yang menimbulkan gejala nyeri dada ini dapat terjadi di segala usia. Meski begitu, perikarditis paling banyak terjadi di usia 20 sampai 50 tahun, terutama pada pria.\n']","Penyebab seseorang menderita penyakit perikarditis, sebagaimana yang dijelaskan dalam konteks tersebut, meliputi:\n\n1. Infeksi bakteri\n2. Infeksi virus, termasuk COVID-19, rubella, dan influenza\n3. Kanker dari organ lain yang menyebar ke perikardium\n4. Serangan jantung\n5. Cedera pada dada\n6. Komplikasi akibat operasi jantung\n7. Penyakit peradangan, seperti lupus dan rheumatoid arthritis\n8. Paparan radiasi dalam radioterapi, khususnya pada terapi kanker payudara dan kanker paru",1.0,0.6701740458972624,0.9999999999,1.0
Bagaimana pengobatan terhadap seseorang yang mengalami perikarditis yang tergolong parah?,"Penderita perikarditis yang tergolong parah dan mengalami komplikasi perlu dirawat di rumah sakit. Beberapa tindakan yang dapat dilakukan dokter untuk mengatasi kondisi ini adalah:\n\nPericardiocentesis\nPericardiocentesis dilakukan untuk mengeluarkan timbunan cairan dari ruang perikardium. Pada prosedur ini, dokter akan menyedot cairan menggunakan jarum dan selang kecil.\nPericardiectomy\nOperasi ini perlu dilakukan bila perikardium mengalami Pericardiectomy bertujuan untuk mengambil bagian yang kaku tersebut sehingga pompa jantung dapat kembali normal.","['Topik: Perikarditis, Subtopik: Pengobatan Perikarditis \n Penderita perikarditis ringan bisa sembuh dengan beristirahat dan mengonsumsi obat-obat pereda nyeri. Namun, selama masa penyembuhan, penderita perlu menghindari aktivitas fisik yang berlebihan karena dapat memicu kekambuhan.\nDi samping obat pereda nyeri, dokter juga mungkin akan memberikan:\n- Obat antiinflamasi nonsteroid (OAINS) \nObat antiinflamasi nonsteroid berfungsi untuk mengurangi peradangan di perikardium dan meredakan nyeri dada. Obat yang dapat diberikan adalah ibuprofen dan aspirin.\n- Colchicine\nColchicine berfungsi untuk mengurangi peradangan dengan cara membunuh sel radang Obat ini dapat dikombinasikan dengan OAINS atau diberikan sebagai alternatif dari OAINS.\n- Kortikosteroid\nObat kortikosteroid hanya diberikan apabila perikarditis tidak membaik dengan OAINS dan colchicine. Salah satu contohnya adalah prednisone.\n- Antibiotik\nObat antibiotik hanya diberikan jika perikarditis disebabkan oleh infeksi bakteri.\nPenderita perikarditis yang tergolong parah dan mengalami komplikasi perlu dirawat di rumah sakit. Beberapa tindakan yang dapat dilakukan dokter untuk mengatasi kondisi ini adalah:\n- Pericardiocentesis\nPericardiocentesis dilakukan untuk mengeluarkan timbunan cairan dari ruang perikardium. Pada prosedur ini, dokter akan menyedot cairan menggunakan jarum dan selang kecil.\n- Pericardiectomy\nOperasi ini perlu dilakukan bila perikardium mengalami Pericardiectomy bertujuan untuk mengambil bagian yang kaku tersebut sehingga pompa jantung dapat kembali normal.\n', 'Topik: Perikarditis, Subtopik: Gejala Perikarditis: Kapan harus ke dokter \n Gejala perikarditis mirip dengan penyakit paru-paru dan penyakit jantung lain. Oleh karena itu, jika Anda mengalami gejala-gejala di atas, segera pergi ke dokter agar diperiksa dan ditangani dengan tepat.\nSegera ke dokter jika dada terasa nyeri seperti ditusuk-tusuk dan gejalanya makin parah ketika menarik napas atau berbaring, terutama bila gejala muncul setelah terserang infeksi virus, seperti flu atau sakit tenggorokan.\n', 'Topik: Perikarditis, Subtopik: Pencegahan Perikarditis \n Sebenarnya, tidak ada cara pasti untuk mencegah perikarditis. Akan tetapi, cara-cara berikut dapat mengurangi risiko penyakit tersebut, yaitu:\n- Rutin mencuci tangan dengan air mengalir dan sabun\n- Selalu menjaga kebersihan diri, rumah, dan lingkungan sekitar\n- Menghindari kontak dengan orang-orang yang sedang sakit\n- Menjalani vaksinasi COVID-19, rubella, dan influenza, sesuai saran dokter\n']","Pengobatan terhadap seseorang yang mengalami perikarditis yang tergolong parah meliputi beberapa langkah khusus, antara lain:\n\n1. Obat pereda nyeri dan antiinflamasi nonsteroid (OAINS): Seperti ibuprofen dan aspirin, digunakan untuk meredakan rasa nyeri dada yang disertai peradangan di perikardium.\n2. Colchicine: Obat ini berfungsi mengurangi peradangan dengan cara membunuh sel radang. Diberikan secara khusus bila diperlukan untuk menurunkan inflamasi yang lebih lanjut.\n3. Kortikosteroid: Pemberian obat ini hanya dilakukan apabila perikarditis tidak membaik dengan OAINS dan colchicine, misalnya prednisone. Obat ini berfungsi mengurangi respon inflamasi pada jaringan tubuh.\n4. Antibiotik: Pemberian antibiotik hanya diperlukan bila infeksi bakteri yang menjalar ke perikardium telah teridentifikasi, misalnya dalam kasus infeksi akut atau pasca-operasi.\n5. Terapi medis lain: Seperti prosedur farmakologi dan imunologi tertentu yang membantu mengendalikan gejala dan komplikasi, seperti perikarditis parah.\n6. Pengobatan intensif di rumah sakit: Bila terdapat kesulitan dalam menangani penyakit ini secara medis tradisional atau ada kekhawatiran akan komplikasi serius, dokter mungkin merencanakan pengobatan intensif dan rawat inap untuk mengontrol gejala dan menyelamatkan pasien.\n7. Pencegahan infeksi ulang: Bila disebabkan oleh infeksi sebelumnya, dokter mungkin akan merencanakan vaksinasi khusus atau menekankan cara-cara pencegahan infeksi ulang untuk mengurangi resiko penyakit perikarditis yang parah.\n\nDalam hal ini, segera ke dokter dan terapi dianjurkan sesuai dengan kondisi pasien agar diperbaiki secepat mungkin dan menghindari gejala parah akibat perikarditis.",0.5238095238095238,0.6473729829512975,0.9999999999,1.0
Apa gejala penyakit ventrikel takikardi?,"Ada beberapa gejala yang menandakan ventrikel takikardi, antara lain:\n\nJantung berdebar yang membuat penderitanya merasa tidak nyaman\nSesak napas\nNyeri atau rasa tertekan di dada\nPening atau terasa melayang\nPenurunan kesadaran\n\nVentrikel takikardi perlu diwaspadai karena dapat berkembang menjadi ventrikel fibrilasi, yaitu suatu kondisi yang berbahaya dan bisa menyebabkan kematian.","['Topik: Ventrikel Takikardi, Subtopik: Gejala Ventrikel Takikardi \n Ada beberapa gejala yang menandakan ventrikel takikardi, antara lain:\n- Jantung berdebar yang membuat penderitanya merasa tidak nyaman\n- Sesak napas\n- Nyeri atau rasa tertekan di dada\n- Pening atau terasa melayang\n- Penurunan kesadaran\nVentrikel takikardi perlu diwaspadai karena dapat berkembang menjadi ventrikel fibrilasi, yaitu suatu kondisi yang berbahaya dan bisa menyebabkan kematian.\n', 'Topik: Ventrikel Takikardi, Subtopik: Gejala Ventrikel Takikardi: Kapan harus ke dokter \n Ventrikel takikardi harus segera ditangani. Oleh sebab itu, jika Anda merasakan gejala-gejala di atas, hubungi dokter secepatnya.\nJika Anda melihat orang yang kehilangan kesadaran, tidak memililiki denyut nadi dan tidak bernapas, segera cari pertolongan medis atau minta bantuan orang sekitar, serta lakukan CPR kepada orang tersebut jika Anda mampu.\nBila tersedia alat kejut jantung otomatis atau Automatic External Defibrillator (AED), gunakan alat tersebut untuk mengetahui irama jantung penderita. Setelah itu, ikuti petunjuk dari alat AED. Lakukan hal tersebut hingga bantuan medis datang.\n', 'Topik: Ventrikel Takikardi, Subtopik: Pengertian Ventrikel Takikardi \n Ventricular tachycardia atau ventrikel takikardi adalah kondisi ketika ventrikel (bilik) jantung berdetak terlalu cepat. Hal ini terjadi akibat gangguan pada aliran listrik jantung yang penyebabnya bervariasi.\nVentrikel takikardi terjadi saat bilik atau ruangan bawah jantung berdetak terlalu cepat dan tidak sinkron dengan gerakan serambi (atrium) jantung. Akibatnya, jantung tidak dapat memompa darah secara efektif. Kondisi ini menyebabkan tubuh kekurangan oksigen.\n\n']","Gejala Ventrikel Takikardi (VT) termasuk berbagai gejala fisik dan perasaan tubuh yang memperlihatkan bahwa detak jantung di bawah jantung terlalu cepat atau tidak sinkron. Beberapa gejala VT antara lain:\n\n1. Jantung berdebar, yang dapat menyebabkan perasaan ketidaknyamanan dan merasa gugup.\n2. Sesak napas, seperti menghembur-hembur menangis.\n3. Nyeri atau rasa tertekat di dada (angina takikardi).\n4. Pening atau terasa melayang, yang bisa menyebabkan penderita merasa lemah dan kehilangan perasaan stabilitas tubuhnya.\n5. Penurunan kesadaran, bahkan sampai pingsan.\n\nDalam konteks ini, penyakit ventrikel takikardi dijelaskan sebagai suatu kondisi yang membuat jantung berdetak terlalu cepat akibat gangguan aliran listrik jantung. Kondisi ini bisa meningkatkan risiko cedera jantung dan menyebabkan ketidaknyamanan serta gejala lain seperti sesak napas atau penurunan kesadaran yang lebih parah, termasuk kematian.\n\nJika Anda mengidentifikasi gejala ini pada diri sendiri atau orang lain, sangat penting untuk segera menghubungi dokter atau mencari bantuan medis terlebih dahulu sebelum bahkan membahayakan diri atau orang lain.",0.8181818181818182,0.5274553251532422,0.8333333332916666,1.0
Bagaimana penanganan terhadap seseorang yang mengalami penyakit ventrikel takikardi?,"Segera cari pertolongan medis atau minta bantuan orang sekitar, serta lakukan CPR kepada orang tersebut jika Anda mampu.\n\nBila tersedia alat kejut jantung otomatis atau Automatic External Defibrillator (AED), gunakan alat tersebut untuk mengetahui irama jantung penderita. Setelah itu, ikuti petunjuk dari alat AED. Lakukan hal tersebut hingga bantuan medis datang.","['Topik: Ventrikel Takikardi, Subtopik: Pengobatan Ventrikel Takikardi \n Penanganan ventrikel tarkikadi tergantung pada kondisi dan tingkat keparahan pasien. Tindakan yang dapat dilakukan oleh dokter jantung untuk menangani ventrikel takikardi antara lain:\n- Pemberian obat antiaritmia\nObat antiaritmia, seperti verapamil atau amiodarone, diberikan agar gangguan serupa tidak terjadi lagi.\n- Ablasi jantung\nProsedur ini dilakukan jika terdapat jalur listrik yang menyebabkan detak jantung pasien\n- Pemasangan alat implantable cardioverter defibrillator (ICD)\nAlat ini dimasukkan ke dalam dada atau area perut pasien, untuk membantu mengembalikan irama jantung ke kondisi normal.\n', 'Topik: Ventrikel Takikardi, Subtopik: Diagnosis Ventrikel Takikardi \n Pada tahap awal penanganan, dokter akan menstabilkan kondisi pasien terlebih dulu. Setelah kondisi pasien stabil, dokter akan melakukan pemeriksaan untuk mencari tahu penyebab dari keluhan pasien. Pemeriksaan itu meliputi:\n- Elektrokardiografi (EKG)\nEKG jantung bertujuan untuk mengukur aktivitas listrik\n- EKG treadmill\nTindakan ini bertujuan untuk melihat rekaman listrik jantung selama pasien beraktivitas di atas alat treadmill.\n- Holter monitor\nProsedur ini dilakukan dengan memasang EKG portabel selama 24 jam untuk merekam aliran listrik jantung.\n- Echo jantung\nMetode ini menggunakan gelombang suara berfrekuensi tinggi, untuk melihat gambaran struktur dan katup jantung secara lebih detail.\n- MRI jantung\nPemindaian ini dilakukan untuk mendapatkan gambaran detail jantung, dengan menggunakan gelombang magnet.\n- Kateterisasi jantung\nKateterisasi jantung berfungsi untuk mengetahui aliran darah ke otot jantung.\n', 'Topik: Ventrikel Takikardi, Subtopik: Gejala Ventrikel Takikardi: Kapan harus ke dokter \n Ventrikel takikardi harus segera ditangani. Oleh sebab itu, jika Anda merasakan gejala-gejala di atas, hubungi dokter secepatnya.\nJika Anda melihat orang yang kehilangan kesadaran, tidak memililiki denyut nadi dan tidak bernapas, segera cari pertolongan medis atau minta bantuan orang sekitar, serta lakukan CPR kepada orang tersebut jika Anda mampu.\nBila tersedia alat kejut jantung otomatis atau Automatic External Defibrillator (AED), gunakan alat tersebut untuk mengetahui irama jantung penderita. Setelah itu, ikuti petunjuk dari alat AED. Lakukan hal tersebut hingga bantuan medis datang.\n']","Penanganan terhadap seseorang yang mengalami penyakit ventrikel takikardi melibatkan beberapa tahap, di antaranya:\n\n1. Stabilisasi kondisi awal: Pada tahap ini, dokter akan menstabilkan kondisi pasien terlebih dulu sebelum melanjutkan diagnosa dan penyelesaian masalah.\n\n2. Pemeriksaan diagnosis: Setelah kondisi pasien stabil, dokter akan melakukan pemeriksaan untuk mencari tahu penyebab dari keluhan pasien. Metode yang dilakukan antara lain adalah elektrokardiografi (EKG), EKG treadmill, Holter monitor, echo jantung, MRI jantung, dan kateterisasi jantung.\n\n3. Pengobatan sesuai dengan diagnosis: Berdasarkan hasil pemeriksaan, dokter akan menentukan jenis pengobatan yang paling tepat untuk mengatasi penyakit ventrikel takikardi pasien tersebut. Jenis pengobatan yang dapat dilakukan antara lain adalah pemberian obat antiaritmia, prosedur ablasi jantung atau pemasangan alat implantable cardioverter defibrillator (ICD).\n\n4. Perawatan dan pemantauan: Setelah pengobatan dimulai, pasien perlu diikuti oleh dokter secara berkala untuk memonitor kondisi jantung mereka dan memberikan pertolongan apabila terdapat kekhawatiran akan gejala-gejala yang tak normal.\n\nJika pasien mengalami ventrikel takikardi, segera hubungi dokter untuk mendapatkan bantuan medis dan penanganan yang sesuai dengan kondisi mereka.",1.0,0.5558160459031353,0.5833333333041666,1.0
Apa faktor yang dapat meningkatkan risiko terkena penyakit Ventricular Septal Defect?,"Ada beberapa faktor yang dapat meningkatkan risiko seseorang terkena VSD, antara lain:\n\nMemiliki keluarga dengan riwayat penyakit jantung bawaan\nMenderita kelainan genetik, seperti Down Syndrome","['Topik: Ventricular Septal Defect, Subtopik: Penyebab Ventricular Septal Defect (VSD) \n Defek septum ventrikel (VSD) disebabkan oleh gangguan dalam proses pembentukan jantung di dalam kandungan. Gangguan ini menyebabkan dinding pemisah antara bilik kanan dan bilik kiri jantung tidak menutup dengan sempurna.\nBelum diketahui secara pasti pemicu terjadinya gangguan tersebut. Namun, faktor kelainan genetik dan lingkungan diduga menjadi faktor utama yang menyebabkan seseorang menderita kondisi ini.\nMeski jarang, defek septum ventrikel juga berisiko dialami oleh orang dewasa. Kondisi ini dapat terjadi pada penderita serangan jantung atau orang yang mengalami cedera hebat di bagian dada, misalnya akibat kecelakaan.\nAda beberapa faktor yang dapat meningkatkan risiko seseorang terkena VSD, antara lain:\n- Memiliki keluarga dengan riwayat penyakit jantung bawaan \n- Menderita kelainan genetik, seperti Down Syndrome \n', 'Topik: Ventricular Septal Defect, Subtopik: Pencegahan Ventricular Septal Defect (VSD) \n Defek septum ventrikel (VSD) sulit dicegah, karena umumnya terjadi karena faktor bawaan lahir. Namun, risiko VSD dapat diturunkan dengan menjalani gaya hidup sehat selama hamil, agar kesehatan dan perkembangan janin tetap terjaga.\nUpaya yang dapat dilakukan antara lain:\n- Melakukan pemeriksaan kehamilan secara rutin\n- Menjalani diet seimbang dengan mengonsumsi makanan bergizi dan bernutrisi\n- Berolahraga secara teratur\n- Tidak merokok\n- Membatasi konsumsi minuman beralkohol\n- Tidak menggunakan narkoba\n- Mencegah infeksi dengan melakukan vaksinasi sebelum merencanakan kehamilan\n', 'Topik: Ventricular Septal Defect, Subtopik: Pengertian Ventricular Septal Defect \n Ventricular septal defect atau defek septum ventrikel merupakan salah satu jenis penyakit jantung bawaan. Kondisi ini dapat terjadi sejak usia kehamilan 8 minggu, yaitu pada saat proses pembentukan jantung janin berlangsung.\n\nPada awal pembentukan jantung, bilik kiri dan kanan jantung masih menyatu, tetapi seiring pertumbuhan janin, dinding pemisah (septum) antara kedua bilik tersebut akan terbentuk. Namun, pada beberapa kondisi, septum tidak terbentuk sempurna sehingga meninggalkan sebuah lubang.\nDefek septum ventrikel menyebabkan bilik kiri jantung bekerja lebih keras sehingga menimbulkan gangguan katup dan gagal jantung.\n']","Faktor yang dapat meningkatkan risiko terkena defek septum ventrikel (VSD) antara lain:\n\n1. Keluarga dengan riwayat penyakit jantung bawaan, yang mengindikasikan bahwa adanya faktor genetik遗传 yang mungkin mempengaruhi risiko timbulnya VSD.\n2. Menderita kelainan genetik seperti Down Syndrome, yang juga dapat meningkatkan risiko munculnya penyakit ini dalam suatu keluarga atau individu.\n3. Mengalami infeksi pada masa kehamilan, misalnya infeksi saluran nafas atau limfeksemplastik, yang dapat berpengaruh terhadap proses pertumbuhan janin dan risiko timbulnya VSD.\n4. Mengkonsumsi obat-obatan tua sambil menjalani kehamilan, termasuk obat untuk meringankan nyeri pada saat melakukan pembedahan atau operasi lain yang memerlukan penggunaan obat.\n5. Mengalami rangsangan medis dan stres berlebihan selama masa kehamilan, yang dapat meningkatkan risiko timbulnya penyakit ini.",0.5,0.7346451165821892,0.99999999995,1.0
Apa gejala yang umum terjadi pada anak atau bayi penderita Ventricular Septal Defect?,"Secara umum, gejala VSD pada bayi dan anak-anak meliputi:\n\nMudah lelah ketika sedang makan atau bermain\nBanyak mengeluarkan keringat, terutama ketika makan\nTidak nafsu makan\nBerat badan sulit naik\nNapas cepat dan terdengat berat\nKulit terlihat pucat","['Topik: Ventricular Septal Defect, Subtopik: Gejala Ventricular Septal Defect (VSD) \n Gejala VSD bervariasi, tergantung ukuran dan lokasi celah pada jantung, serta ada tidaknya kondisi cacat jantung lain yang mendasarinya. Gejala ini sering kali sulit terdeteksi saat bayi lahir, terutama jika lubangnya berukuran kecil.\nPada beberapa kasus, kelainan ini terkadang tidak menunjukkan gejala sama sekali dan baru muncul setelah bayi mulai memasuki usia anak-anak.\nSecara umum, gejala VSD pada bayi dan anak-anak meliputi:\n- Mudah lelah ketika sedang makan atau bermain\n- Banyak mengeluarkan keringat, terutama ketika makan\n- Tidak nafsu makan\n- Berat badan sulit naik\n- Napas cepat dan terdengat berat\n- Kulit terlihat pucat\n', 'Topik: Ventricular Septal Defect, Subtopik: Gejala Ventricular Septal Defect (VSD): Kapan harus ke dokter \n Segera periksakan anak Anda ke dokter anak jika muncul gejala VSD seperti di atas, terutama bila sampai menimbulkan gejala yang berbahaya sebagai berikut:\n- Sering mengalami infeksi saluran pernapasan \n- Sesak napas\n- Kulit terlihat membiru di sekitar bibir dan kuku\nJika Anda merasakan gejala seperti napas pendek dan berat saat beraktivitas atau berbaring, detak jantung cepat dan tidak beraturan, serta sering merasa kelelahan dan tubuh terasa lemas, segara periksakan diri ke dokter.\n', 'Topik: Ventricular Septal Defect, Subtopik: Pengobatan Ventricular Septal Defect (VSD) \n Pada sebagian besar kasus, bayi yang terlahir dengan VSD berukuran kecil tidak memerlukan operasi untuk menutup lubang. Dokter hanya akan memantau kondisi bayi dan kemungkinan munculnya gejala melalui pemeriksaan secara rutin, serta menunggu apakah lubang dapat menutup dengan sendirinya.\nJika defek septum ventrikel berukuran sedang hingga besar dan menimbulkan gejala, maka operasi menjadi jalan terbaik untuk menangani kondisi ini. Operasi dilakukan beberapa minggu atau beberapa bulan pertama setelah bayi lahir.\nBerikut ini adalah beberapa metode operasi yang dapat dilakukan untuk mengatasi VSD:\n']","Gejala umum yang mungkin timbul pada anak atau bayi penderita Ventricular Septal Defect (VSD) antara lain:\n\n1. Mudah lelah saat makan atau bermain, serta keseringan secara ringan dan teratur.\n2. Mengeluarkan banyak keringat, terutama ketika aktif seperti saat makan.\n3. Tidak memiliki nafsu makan yang baik.\n4. Berat badan sulit naik atau merosot secara tidak normal.\n5. Napas cepat dan sering terdengar berat, sehingga dapat menimbulkan perasaan cabut pada bayi.\n6. Kulit tampak pucat dan kurang mengkilap, yang bisa disebabkan oleh ketergantungan tubuh atas sumber nutrisi yang efektif.\n7. Mungkin merasakan sesak napas saat beraktivitas ringan hingga sedang, serta kesulitan dalam mendapatkan posisi tidur yang nyaman dan dekat dengan sumber udara.",0.5833333333333334,0.7537080389908448,0.99999999995,1.0
Apa penyebab penyakit sindrom brugada?,"Sindrom Brugada terjadi akibat perubahan atau mutasi pada satu atau beberapa gen yang berperan menjaga irama jantung agar tetap normal. Gen yang bermutasi tersebut diturunkan dari salah satu orang tua.\n\nSindrom Brugada lebih sering dialami oleh laki-laki dibandingkan perempuan. Sementara kemunculan gejalanya diduga dapat dipicu dan diperburuk oleh kondisi berikut:\n\nGangguan elektrolit\nEfek samping obat, seperti obat antiaritmia, obat hipertensi, dan obat antidepresan\nPenyalahgunaan kokain\nDemam","['Topik: Sindrom Brugada, Subtopik: Penyebab dan Faktor Risiko Sindrom Brugada \n Sindrom Brugada terjadi akibat perubahan atau mutasi pada satu atau beberapa gen yang berperan menjaga irama jantung agar tetap normal. Gen yang bermutasi tersebut diturunkan dari salah satu orang tua.\nSindrom Brugada lebih sering dialami oleh laki-laki dibandingkan perempuan. Sementara kemunculan gejalanya diduga dapat dipicu dan diperburuk oleh kondisi berikut:\n- Gangguan elektrolit\n- Efek samping obat, seperti obat antiaritmia, obat hipertensi, dan obat antidepresan\n\n- Penyalahgunaan kokain\n\n- Demam\n', 'Topik: Sindrom Brugada, Subtopik: Pengertian Sindrom Brugada \n Sindrom Brugada adalah gangguan irama jantung akibat kelainan genetik. Sindrom Brugada sering kali tidak memunculkan gejala, tetapi dapat membuat penderitanya mengalami henti jantung mendadak.\nIrama jantung yang tidak teratur akan membuat jantung tidak bisa memompa darah ke seluruh tubuh secara optimal. Walaupun sering kali tidak menimbulkan keluhan, sebagian penderita sindrom Brugada dapat merasakan keluhan jantung berdebar dan sesak napas.\n\nSindrom Brugada jarang terjadi, namun merupakan salah satu penyebab utama kematian mendadak pada bayi hingga orang dewasa.\n', 'Topik: Sindrom Brugada, Subtopik: Pengertian Sindrom Brugada \n Irama jantung yang tidak teratur akan membuat jantung tidak bisa memompa darah ke seluruh tubuh secara optimal. Walaupun sering kali tidak menimbulkan keluhan, sebagian penderita sindrom Brugada dapat merasakan keluhan jantung berdebar dan sesak napas.\n\nSindrom Brugada jarang terjadi, namun merupakan salah satu penyebab utama kematian mendadak pada bayi hingga orang dewasa.\n']","Penidak pernyataan ini berdasarkan pengertian dan informasi tentang sindrom Brugada yang telah dijelaskan dalam konteks yang diberikan, yaitu akibat perubahan atau mutasi pada satu atau beberapa gen yang berperan menjaga irama jantung agar tetap normal. Gen tersebut diturunkan dari salah satu orang tua.\n\nDalam kata lain, penyebab sindrom Brugada adalah perubahan atau mutasi pada gen yang memengaruhi fungsi jantung. Hal ini disebabkan oleh penurunan gen-gen tersebut dari salah satu induknya, sehingga mengakibatkan gangguan irama jantung dan risiko kematian mendadak yang tinggi.",1.0,0.7859240954516115,0.99999999995,1.0
Bagaimana metode utama dalam pengobatan sindrom brugada,"Metode utama pengobatan sindrom Brugada adalah implan alat kejut jantung otomatis (ICD) di bawah tulang selangka. Perangkat ini dihubungkan ke jantung melalui pembuluh darah untuk memonitor detak jantung. Jika detak jantung tidak normal, ICD akan mengirim sinyal kejut agar detak jantung kembali normal.","['Topik: Sindrom Brugada, Subtopik: Pengobatan Sindrom Brugada \n Metode utama pengobatan sindrom Brugada adalah implan alat kejut jantung otomatis (ICD) di bawah tulang selangka. Perangkat ini dihubungkan ke jantung melalui pembuluh darah untuk memonitor detak jantung. Jika detak jantung tidak normal, ICD akan mengirim sinyal kejut agar detak jantung kembali normal.\nPerlu diketahui, ICD dapat mengirimkan sinyal kejut meski detak jantung pasien sedang dalam kondisi normal. Untuk mengurangi risiko kondisi tersebut terjadi, pasien yang menggunakan ICD perlu rutin memeriksakan diri ke dokter. Jika ICD tidak efektif dalam mengatasi sindrom Brugada, dokter akan menyarankan terapi ablasi jantung.\nSelain prosedur di atas, dokter juga dapat meresepkan obat antiaritmia untuk menjaga detak jantung pasien tetap normal.\n', 'Topik: Sindrom Brugada, Subtopik: Pencegahan Sindrom Brugada \n Sindrom Brugada tidak dapat dicegah, karena kelainan genetik yang menyebabkan kondisi ini sudah terjadi sejak lahir. Meski begitu, komplikasi sindrom Brugada bisa dicegah dengan pemeriksaan dini ketika ada gejala gangguan irama jantung.\nBila Anda tidak mengalami gejala sindrom Brugada tetapi memiliki anggota keluarga yang menderita sindrom Brugada atau meninggal karena henti jantung mendadak, sebaiknya periksakan diri ke dokter jantung. Tujuannya adalah agar penyakit ini dapat dideteksi dan ditangani sedini mungkin bila ada.\nSelain itu, penderita sindrom Brugada juga disarankan untuk:\n- Segera mengonsumsi obat penurun demam jika mulai merasa demam dan tidak membiarkan demam naik\n- Menghindari konsumsi minuman beralkohol\n- Berkonsultasi dengan dokter sebelum mengonsumsi obat apapun\n- Menghindari olahraga yang berat atau kompetitif, seperti sepak bola\n', 'Topik: Sindrom Brugada, Subtopik: Pengertian Sindrom Brugada \n Sindrom Brugada adalah gangguan irama jantung akibat kelainan genetik. Sindrom Brugada sering kali tidak memunculkan gejala, tetapi dapat membuat penderitanya mengalami henti jantung mendadak.\nIrama jantung yang tidak teratur akan membuat jantung tidak bisa memompa darah ke seluruh tubuh secara optimal. Walaupun sering kali tidak menimbulkan keluhan, sebagian penderita sindrom Brugada dapat merasakan keluhan jantung berdebar dan sesak napas.\n\nSindrom Brugada jarang terjadi, namun merupakan salah satu penyebab utama kematian mendadak pada bayi hingga orang dewasa.\n']","Metode utama pengobatan Sindrom Brugada adalah implantasi alat kejut jantung otomatis (ICD). Perangkat ini dihubungkan ke jantung melalui pembuluh darah untuk memonitor dan mengidentifikasi detak jantung yang tidak normal. Ketika detak jantung menunjukan pola abnormal, ICD akan mengirim sinyal kejut agar detak jantung kembali normal. Selain prosedur ini, dokter juga dapat meresepkan obat antiaritmia untuk menjaga detak jantung pasien tetap normal dan mengurangi risiko komplikasi sindrom Brugada.",0.875,0.7283419678629203,0.9999999999,1.0
Apa komplikasi yang dapat ditimbulkan dari Hipertrofi Ventrikel Kiri?,"Hipertrofi ventrikel kiri dapat mengubah struktur dan kerja jantung. Kondisi ini juga dapat menyebabkan jantung melemah, mengeras, dan menurunkan fungsi jantung dalam memompa darah. Kondisi ini dinamakan gagal jantung.\n\nDi samping menyebabkan gagal jantung, hipertrofi ventrikel kiri dapat menyebabkan beberapa komplikasi lain di bawah ini:\n\nPenyakit jantung koroner\nGangguan irama jantung (aritmia), misalnya atrial fibrilasi\nStroke\nHenti jantung mendadak","['Topik: Hipertrofi Ventrikel Kiri, Subtopik: Komplikasi Hipertrofi Ventrikel Kiri \n Hipertrofi ventrikel kiri dapat mengubah struktur dan kerja jantung. Kondisi ini juga dapat menyebabkan jantung melemah, mengeras, dan menurunkan fungsi jantung dalam memompa darah. Kondisi ini dinamakan gagal jantung.\nDi samping menyebabkan gagal jantung, hipertrofi ventrikel kiri dapat menyebabkan beberapa komplikasi lain di bawah ini:\n- Penyakit jantung koroner\n- Gangguan irama jantung (aritmia), misalnya atrial fibrilasi \n- Stroke\n- Henti jantung mendadak\n', 'Topik: Hipertrofi Ventrikel Kiri, Subtopik: Gejala Hipertrofi Ventrikel Kiri: Kapan harus ke dokter \n Hipertrofi ventrikel kiri merupakan komplikasi yang sering terjadi akibat hipertensi. Baik hipertensi maupun hipertrofi ventrikel kiri pada awalnya tidak menimbulkan gejala sehingga sering kali baru terdeteksi ketika ukuran ventrikel kiri sudah sangat besar.\nOleh karena itu, penting untuk melakukan pemeriksaan tekanan darah secara rutin, terutama pada orang-orang yang merokok atau obesitas. Penderita hipertensi juga perlu melakukan pemeriksaan berkala ke dokter agar tekanan darah tetap terkontrol dengan baik.\nKondisi ini dapat berkembang menjadi penyakit jantung. Gejala penyakit jantung yang perlu segera ditangani di IGD (instalasi gawat darurat) adalah:\n- Nyeri dada selama lebih dari beberapa menit\n- Sesak napas yang tidak membaik dengan istirahat\n- Sangat pusing hingga hilang kesadaran \n', 'Topik: Hipertrofi Ventrikel Kiri, Subtopik: Penyebab Hipertrofi Ventrikel Kiri \n Hipertrofi ventrikel kiri terjadi ketika jantung bekerja lebih keras dalam memompa darah ke seluruh tubuh. Beberapa kondisi yang dapat menyebabkan hal tersebut meliputi:\n- Hipertensi Hipertrofi ventrikel kiri sering kali disebabkan oleh hipertensi. Lebih dari sepertiga orang yang didiagnosis menderita hipertrofi ventrikel kiri juga menderita tekanan darah tinggi.\n- Hipertrofi kardiomiopati Hipertrofi kardiomiopati adalah kelainan genetik yang terjadi saat otot jantung menebal secara abnormal tetapi tekanan darah tetap normal. Akibatnya, jantung kesulitan memompa darah.\n- Stenosis katup aorta Penyakit ini menyebabkan penyempitan pada katup aorta, yaitu katup jantung yang terletak setelah ventrikel kiri. Katup aorta yang menyempit membuat ventrikel atau bilik kiri jantung perlu bekerja lebih keras untuk memompa darah.\n- Latihan fisik Latihan fisik yang dilakukan secara intensif dan berkelanjutan dapat membuat jantung bekerja lebih keras sehingga menyebabkan hipertrofi ventrikel kiri. Kondisi ini sering terjadi pada atlet atau tentara.\nSelain itu, ada sejumlah faktor yang membuat seseorang makin berisiko terkena hipertrofi ventrikel kiri, yaitu:\n- Berusia 50 tahun ke atas\n- Memiliki berat badan berlebih\n- Menderita diabetes \n- Berjenis kelamin wanita\n']","Komplikasi yang dapat timbul akibat hipertrofi ventrikel kiri meliputi:\n\n1. Gagal Jantung: Perubahan struktur dan kerja jantung yang disebabkan oleh hipertrofi ventrikel kiri dapat menyebabkan jantung menjadi lebih lemah, mengerus, dan mengalami penurunan fungsi dalam memompa darah.\n2. Penyakit Jantung Koroner: Kondisi ini terkait erat dengan hipertrofi ventrikel kiri, sehingga penderita cenderung memiliki risiko lebih tinggi untuk mengalami penyakit jantung koroner.\n3. Gangguan Rhythm Jantung: Seperti aritmia atau seringkali atrial fibrilasi, yang dapat meningkatkan resiko terjadinya stroke atau pingsan jantung mendadak (heti jantung).\n4. Stroke: Kondisi ini berkait",0.8,0.6346867964599422,0.9999999999666667,1.0
Bagaimana pencegahan penyakit hipertrofi ventrikel kiri?,"Salah satu cara yang bisa dilakukan untuk mencegah hipertrofi ventrikel kiri adalah menjaga agar tekanan darah selalu berada pada batas normal. Berikut ini adalah beberapa upaya yang dapat dilakukan untuk mengontrol tekanan darah, sekaligus mencegah terjadinya hipertensi:\n\nMelakukan pemeriksaan berkala terhadap tekanan darah\nSelalu menjaga berat badan ideal\nBerolahraga secara rutin, idealnya 30 menit setiap hari\nMenerapkan pola makan sehat, seperti banyak makan buah dan sayur, serta menghindari makanan tinggi lemak dan garam\nMenghindari konsumsi minuman beralkohol secara berlebihan, karena dapat meningkatkan tekanan darah dan asupan kalori\nBerhenti merokok, karena merokok dapat menaikkan tekanan darah dan meningkatkan risiko hipertensi\nMengelola stres dengan baik","['Topik: Hipertrofi Ventrikel Kiri, Subtopik: Pencegahan Hipertrofi Ventrikel Kiri \n Salah satu cara yang bisa dilakukan untuk mencegah hipertrofi ventrikel kiri adalah menjaga agar tekanan darah selalu berada pada batas normal. Berikut ini adalah beberapa upaya yang dapat dilakukan untuk mengontrol tekanan darah, sekaligus mencegah terjadinya hipertensi:\n- Melakukan pemeriksaan berkala terhadap tekanan darah\n- Selalu menjaga berat badan ideal \n- Berolahraga secara rutin, idealnya 30 menit setiap hari\n- Menerapkan pola makan sehat, seperti banyak makan buah dan sayur, serta menghindari makanan tinggi lemak dan garam\n- Menghindari konsumsi minuman beralkohol secara berlebihan, karena dapat meningkatkan tekanan darah dan asupan kalori\n- Berhenti merokok, karena merokok dapat menaikkan tekanan darah dan meningkatkan risiko hipertensi\n- Mengelola stres dengan baik\n', 'Topik: Hipertrofi Ventrikel Kiri, Subtopik: Pengobatan Hipertrofi Ventrikel Kiri \n Pengobatan hipertrofi ventrikel kiri adalah dengan mengatasi penyebabnya, agar otot ventrikel kiri jantung tidak makin membesar sehingga mengakibatkan gagal jantung.\nHipertrofi ventrikel kiri yang disebabkan oleh hipertensi bisa diatasi dengan mengubah gaya hidup, seperti menjalani diet rendah lemak dan garam, memperbanyak konsumsi buah dan sayur, berolahraga secara teratur, dan berhenti merokok.\nSelain perubahan gaya hidup, hipertensi perlu diobati dengan obat-obatan untuk mengatasi tekanan darah tinggi, contohnya:\n- Obat ACE inhibitor, seperti captopril dan ramipril\n- Obat ARB, seperti losartan \n- Obat antagonis kalsium, seperti amlodipine \n- Obat diuretik, seperti hydrochlorothiazide \n- Obat penghambat beta, seperti atenolol\nSelain hipertensi, berikut ini adalah metode pengobatan hipertrofi ventrikel kiri sesuai dengan penyebab yang mendasarinya:\n- Penanganan hipertrofi ventrikel kiri akibat stenosis katup aorta Pada pasien dengan kondisi ini, dokter akan menjalankan operasi untuk memperbaiki katup aorta atau menggantinya dengan katup buatan.\n- Penanganan hipertrofi ventrikel kiri akibat aktivitas fisik berlebihan Pada kondisi ini, dokter akan menyarankan pasien untuk menghentikan latihan fisik selama 3 hingga 6 bulan. Setelah itu, dokter akan melakukan pemeriksaan echo jantung untuk memantau pembesaran ventrikel kiri.\n- Penanganan hipertrofi kardiomiopati Kondisi ini dapat ditangani dengan obat-obatan, perubahan gaya hidup, prosedur bedah, dan penanaman alat khusus di dalam jantung.\n', 'Topik: Hipertrofi Ventrikel Kiri, Subtopik: Penyebab Hipertrofi Ventrikel Kiri \n Hipertrofi ventrikel kiri terjadi ketika jantung bekerja lebih keras dalam memompa darah ke seluruh tubuh. Beberapa kondisi yang dapat menyebabkan hal tersebut meliputi:\n- Hipertensi Hipertrofi ventrikel kiri sering kali disebabkan oleh hipertensi. Lebih dari sepertiga orang yang didiagnosis menderita hipertrofi ventrikel kiri juga menderita tekanan darah tinggi.\n- Hipertrofi kardiomiopati Hipertrofi kardiomiopati adalah kelainan genetik yang terjadi saat otot jantung menebal secara abnormal tetapi tekanan darah tetap normal. Akibatnya, jantung kesulitan memompa darah.\n- Stenosis katup aorta Penyakit ini menyebabkan penyempitan pada katup aorta, yaitu katup jantung yang terletak setelah ventrikel kiri. Katup aorta yang menyempit membuat ventrikel atau bilik kiri jantung perlu bekerja lebih keras untuk memompa darah.\n- Latihan fisik Latihan fisik yang dilakukan secara intensif dan berkelanjutan dapat membuat jantung bekerja lebih keras sehingga menyebabkan hipertrofi ventrikel kiri. Kondisi ini sering terjadi pada atlet atau tentara.\nSelain itu, ada sejumlah faktor yang membuat seseorang makin berisiko terkena hipertrofi ventrikel kiri, yaitu:\n- Berusia 50 tahun ke atas\n- Memiliki berat badan berlebih\n- Menderita diabetes \n- Berjenis kelamin wanita\n']","Pencegahan hipertrofi ventrikel kiri melalui cara mengontrol tekanan darah, mempertahankan berat badan ideal, dan menjaga pola hidup sehat. Berikut ini beberapa upaya yang dapat dilakukan untuk mencegah hipertrofi ventrikel kiri:\n\n1. Mengontrol Tekanan Darah:\n   - Melakukan pemeriksaan berkala terhadap tekanan darah dan menjaga tekanan berada pada batas normal, yaitu 120/80 mmHg atau kurang.\n   - Menggunakan obat-obatan yang dianjurkan dokter untuk mengendalikan hipertensi.\n   - Menjaga pola hidup sehat dan menghindari asupan makanan tinggi lemak, garam, serta minuman beralkohol secara berlebihan.\n\n2. Mempertahankan Berat Badan Ideal:\n   - Melakukan diet yang sehat dan mengontrol kalori untuk menjaga berat badan tetap ideal.\n   - Mengurangi asupan makanan jahat, seperti pangan berkuah tinggi lemak dan gorengan ringan.\n   - Melakukan olahraga secara rutin, yang dianggap ideal adalah berolahraga 30 menit setiap hari.\n\n3. Menjaga Pola Hidup Sehat:\n   - Mengkonsumsi makanan sehat dan mengurangi asupan protein tinggi pada makanan utamanya, serta memakai diet yang sesuai dengan kebutuhan khusus tubuh Anda.\n   - Menghindari merokok dan menjaga stres minimalis dalam hidup.\n   - Menggunakan obat-obatan sehat untuk mengendalikan tekanan darah dan meminimalisir risiko terkena penyakit jantung.\n\nDengan melakukan hal-hal yang disebutkan di atas, Anda dapat mencegah hipertrofi ventrikel kiri dan menjaga kesehatan tubuh Anda tetap dalam keadaan baik.",0.6190476190476191,0.5139008466592863,0.9999999999666667,1.0
Apa kelainan yang dialami penderita atrial fibrilasi?,"Fibrilasi atrium atau atrial fibrilasi (AF) adalah gangguan irama jantung yang ditandai dengan denyut jantung tidak beraturan dan cepat. Penderita atrial fibrilasi dapat merasakan gejala lemas, jantung berdebar, dan sesak napas.\n\nDenyut jantung yang normal berkisar antara 60–100 kali per menit dengan irama yang teratur. Pada penderita atrial fibrilasi, irama jantung menjadi tidak teratur dan bisa lebih dari 100 kali per menit.","['Topik: Atrial Fibrilasi, Subtopik: Pengertian Atrial Fibrilasi \n Fibrilasi atrium atau atrial fibrilasi (AF) adalah gangguan irama jantung yang ditandai dengan denyut jantung tidak beraturan dan cepat. Penderita atrial fibrilasi dapat merasakan gejala lemas, jantung berdebar, dan sesak napas.\nDenyut jantung yang normal berkisar antara 60  100 kali per menit dengan irama yang teratur. Pada penderita atrial fibrilasi, irama jantung menjadi tidak teratur dan bisa lebih dari 100 kali per menit.\n\nAtrial fibrilasi adalah salah satu jenis aritmia atau gangguan irama jantung. Gejalanya bisa hilang timbul, berlangsung lama, atau bahkan permanen. Apabila dibiarkan, atrial fibrilasi bisa mengakibatkan gagal jantung dan stroke.\n', 'Topik: Atrial Fibrilasi, Subtopik: Penyebab Atrial Fibrilasi (AF) \n Fibrilasi atrium (AF) terjadi akibat adanya gangguan hantaran sinyal listrik di otot jantung. Akibatnya, denyut jantung menjadi tidak normal sehingga tidak memompa darah dengan optimal ke seluruh tubuh.\nGangguan hantran listrik ini diduga disebabkan oleh beberapa faktor berikut:\n- Konsumsi minuman berkafein atau beralkohol\n- Konsumsi obat-obatan batuk pilek\n\n- Kebiasaan merokok\n- Tekanan darah tinggi\n- Penyakit jantung koroner\n- Penyakit jantung bawaan\n- Kelainan katup jantung\n- Serangan jantung\n- Hipertiroidisme\n- Infeksi virus\n- Sleep apnea\n- Gangguan metabolik\n- Penyakit paru-paru\nSelain beberapa faktor di atas, terdapat kondisi lain yang dapat meningkatkan risiko seseorang terserang AF, yaitu:\n- Berusia lanjut\n- Menderita obesitas atau berat badan berlebih\n- Memiliki keluarga yang juga mengalami atrial fibrilasi\n', 'Topik: Atrial Fibrilasi, Subtopik: Gejala Atrial Fibrilasi (AF) \n Atrial fibrilasi dapat menimbulkan gejala cepat lelah atau bahkan tidak menimbulkan gejala apa pun. Akibatnya, kondisi ini sering tidak disadari oleh penderitanya. Namun, bila denyut jantung terlalu cepat, penderita AF dapat mengalami gejala berikut ini:\n- Lemas\n- Pusing\n- Jantung berdebar\n- Nyeri dada\n- Sesak napas\nAF dapat berlangsung sesekali dalam hitungan menit sampai jam, atau terjadi berulang-ulang selama seminggu. Gejala AF yang seperti ini masih bisa hilang, baik menghilang dengan sendirinya atau dengan obat-obatan.\nAkan tetapi, atrial fibrilasi juga bisa terjadi terus-menerus sampai lebih dari 1 tahun atau bahkan permanen. Kondisi ini memerlukan pengobatan jangka panjang untuk mencegah stroke dan gagal jantung.\nGejala atrial fibrilasi mirip dengan atrial flutter. Akan tetapi, irama jantung pada atrial fibrilasi tidak beraturan. Kedua kondisi ini bisa terjadi bersamaan.\n']","Atrial fibrilasi (AF) merupakan gangguan irama jantung yang disertai denyut jantung tidak teratur dan cepat. Penderita AF mengalami peningkatan risiko untuk mengalami berbagai kelainan, termasuk:\n\n1. Gagal Jantung (Heart Failure): AF dapat menyebabkan penyumbatan aliran darah di dalam jantung, yang bisa memperparah kondisi gagal jantung.\n2. Stroke: Karena irama jantung menjadi tidak teratur dan cepat pada AF, darah dapat menghentikan untuk menyembur ke tengkorak dalam tabir-tabir yang tipis atau stroke.\n3. Penyakit Jantung Koroner: AF bisa merusak sel-sel jantung dan memperparah penyakit jantung koroner.\n4. Sesak Napas (Sleep Apnea): AF dapat menyebabkan aliran darah yang tidak teratur, yang bisa meningkatkan risiko sesak napas.\n5. Hipertiroidisme: Pada beberapa kasus, AF disertai hipertiroidisme atau peningkatan jumlah iodium dalam tubuh.\n6. Kemerosotan fungsi jantung (Cardiac Dysfunction): AF bisa menyebabkan penurunan fungsi jantung yang dapat berdampak buruk terhadap kesehatan umum penderita.\n7. Penyakit Jantung Bawaan: Risiko meningkat untuk mengalami AF dalam beberapa kasus penyakit jantung bawaan.\n8. Gangguan Metabolik (Metabolic Disturbance): Beberapa penderita AF mengalami gangguan metabolisme, seperti penurunan berat badan dan ketosis spontan.\n9. Infeksi: AF dapat memperparah gejala jika penderita terinfeksi virus atau meningkatkan risiko infeksi di tempat lain dalam tubuh.\n10. Kecelakaan jantung (Cardiac Accident): Risiko meningkat untuk mengalami serangan jantung selama AF berlangsung.",0.48,0.5621639444332637,0.9999999999666667,1.0
Apa penyebab seseorang menderita atrial fibrilasi?,"Fibrilasi atrium (AF) terjadi akibat adanya gangguan hantaran sinyal listrik di otot jantung. Akibatnya, denyut jantung menjadi tidak normal sehingga tidak memompa darah dengan optimal ke seluruh tubuh.\n\nGangguan hantran listrik ini diduga disebabkan oleh beberapa faktor berikut:\n\nKonsumsi minuman berkafein atau beralkohol\nKonsumsi obat-obatan batuk pilek\nKebiasaan merokok\nTekanan darah tinggi\nPenyakit jantung koroner\nPenyakit jantung bawaan\nKelainan katup jantung\nSerangan jantung\nHipertiroidisme\nInfeksi virus\nSleep apnea\nGangguan metabolik\nPenyakit paru-paru\n\nSelain beberapa faktor di atas, terdapat kondisi lain yang dapat meningkatkan risiko seseorang terserang AF, yaitu:\n\nBerusia lanjut\nMenderita obesitas atau berat badan berlebih\nMemiliki keluarga yang juga mengalami atrial fibrilasi","['Topik: Atrial Fibrilasi, Subtopik: Penyebab Atrial Fibrilasi (AF) \n Fibrilasi atrium (AF) terjadi akibat adanya gangguan hantaran sinyal listrik di otot jantung. Akibatnya, denyut jantung menjadi tidak normal sehingga tidak memompa darah dengan optimal ke seluruh tubuh.\nGangguan hantran listrik ini diduga disebabkan oleh beberapa faktor berikut:\n- Konsumsi minuman berkafein atau beralkohol\n- Konsumsi obat-obatan batuk pilek\n\n- Kebiasaan merokok\n- Tekanan darah tinggi\n- Penyakit jantung koroner\n- Penyakit jantung bawaan\n- Kelainan katup jantung\n- Serangan jantung\n- Hipertiroidisme\n- Infeksi virus\n- Sleep apnea\n- Gangguan metabolik\n- Penyakit paru-paru\nSelain beberapa faktor di atas, terdapat kondisi lain yang dapat meningkatkan risiko seseorang terserang AF, yaitu:\n- Berusia lanjut\n- Menderita obesitas atau berat badan berlebih\n- Memiliki keluarga yang juga mengalami atrial fibrilasi\n', 'Topik: Atrial Fibrilasi, Subtopik: Pengertian Atrial Fibrilasi \n Fibrilasi atrium atau atrial fibrilasi (AF) adalah gangguan irama jantung yang ditandai dengan denyut jantung tidak beraturan dan cepat. Penderita atrial fibrilasi dapat merasakan gejala lemas, jantung berdebar, dan sesak napas.\nDenyut jantung yang normal berkisar antara 60  100 kali per menit dengan irama yang teratur. Pada penderita atrial fibrilasi, irama jantung menjadi tidak teratur dan bisa lebih dari 100 kali per menit.\n\nAtrial fibrilasi adalah salah satu jenis aritmia atau gangguan irama jantung. Gejalanya bisa hilang timbul, berlangsung lama, atau bahkan permanen. Apabila dibiarkan, atrial fibrilasi bisa mengakibatkan gagal jantung dan stroke.\n', 'Topik: Atrial Fibrilasi, Subtopik: Pengertian Atrial Fibrilasi \n Denyut jantung yang normal berkisar antara 60  100 kali per menit dengan irama yang teratur. Pada penderita atrial fibrilasi, irama jantung menjadi tidak teratur dan bisa lebih dari 100 kali per menit.\n\nAtrial fibrilasi adalah salah satu jenis aritmia atau gangguan irama jantung. Gejalanya bisa hilang timbul, berlangsung lama, atau bahkan permanen. Apabila dibiarkan, atrial fibrilasi bisa mengakibatkan gagal jantung dan stroke.\n']","Atrial fibrillation (AF), seperti yang dijelaskan dalam konteks tersebut, disebabkan oleh gangguan hantaran sinyal listrik di otot jantung. Akibatnya, impuls listrik normal tidak dapat ditransmisikan secara efektif ke seluruh bagian jantung, menyebabkan denyut jantung menjadi lebih cepat dan tidak teratur.\n\nDalam konteks yang disediakan, faktor-faktor yang memicu atrial fibrilasi termasuk:\n1. Gangguan hantaran listrik di otot jantung, seperti yang disebabkan oleh konsumsi minuman beralkohol atau kafein, kebiasaan merokok, dan tekanan darah tinggi.\n2. Kondisi medis lainnya, seperti penyakit jantung koroner, jantung bawaan, hipertiroidisme, infeksi virus, sleep apnea, gangguan metabolik, penyakit paru-paru, dan kebiasaan merokok.\n3. Faktor umur dan faktor genetik juga dapat mempengaruhi risiko terkena AF.\n\nDari beberapa faktor di atas, gangguan hantaran listrik di otot jantung adalah penyebab kunci yang menyebabkan seseorang menderita atrial fibrilasi.",0.9473684210526315,0.7013377054737231,0.99999999995,1.0
Apa gejala yang dialami penderita angina pectoris?,"Angina pectoris ditandai dengan nyeri dada sebelah kiri yang terasa seperti tertindih, terbakar, tertusuk atau terasa sesak. Rasa sakit ini dapat menjalar ke lengan, bahu, punggung, leher, dan rahang.\n\nGejala lain yang dapat menyertai nyeri dada tersebut antara lain:\n\nKeringat berlebihan meski cuaca tidak panas\nMual\nLelah\nPusing\nSesak napas","['Topik: Angina Pectoris, Subtopik: Gejala Angina Pectoris \n Angina pectoris ditandai dengan nyeri dada sebelah kiri yang terasa seperti tertindih, terbakar, tertusuk atau terasa sesak. Rasa sakit ini dapat menjalar ke lengan, bahu, punggung, leher, dan rahang.\nGejala lain yang dapat menyertai nyeri dada tersebut antara lain:\n- Keringat berlebihan meski cuaca tidak panas\n- Mual\n- Lelah\n- Pusing\n- Sesak napas\nBerdasarkan karakteristik gejalanya, angina pectoris dapat dibedakan menjadi:\n', 'Topik: Angina Pectoris, Subtopik: Gejala Angina Pectoris: Kapan harus ke dokter \n Jika Anda baru pertama kali mengalami nyeri dan rasa tidak nyaman di dada, segera konsultasikan dengan dokter. Keluhan nyeri dada tersebut bisa mengarah ke kondisi angina pectoris yang disebabkan oleh penyakit jantung.\nAnda juga perlu memeriksakan diri ke dokter jika angina pektoris yang dialami berlangsung cukup lama dan tidak membaik setelah beristirahat.\nKarena angina pectoris sering disebabkan oleh penyakit jantung koroner, disarankan untuk melakukan pemeriksaan ke dokter jika memiliki riwayat hipertensi, kolesterol tinggi, dan menjalani pola hidup yang tidak sehat, seperti:\n- Sering mengonsumsi makanan berlemak\n- Mengonsumsi minuman beralkohol secara berlebihan\n- Merokok\nMakin cepat Anda diperiksa dan ditangani oleh dokter, risiko komplikasi yang lebih parah bisa dicegah.\n', 'Topik: Angina Pectoris, Subtopik: Pengertian Angina Pectoris \n Angina pectoris adalah nyeri dada akibat penyakit jantung koroner. Angin duduk atau angina pectoris terjadi ketika otot jantung tidak mendapatkan suplai darah yang cukup, akibat penyempitan atau penyumbatan pada pembuluh darah arteri di jantung.\nAngina pectoris bisa terjadi kapan saja dan pada siapa saja. Nyeri akibat angina pectoris ini sering disalahartikan sebagai gejala dari kondisi lain, seperti naiknya asam lambung dan peradangan pada paru-paru.\n']","Gejala yang biasanya dirasakan oleh penderita angina pectoris meliputi nyeri dada sebelah kiri, yang seringkali terasa seperti tertindih, terbakar, tersusuk atau sesak. Rasa sakit ini bisa menjalar ke lengan, bahu, punggung, leher, dan rahang. Selain itu, penderita juga mungkin mengalami keringat berlebihan meski cuaca tidak panas, mual, lelah, pusing, atau sesak napas.",1.0,0.7565227166234739,0.9999999999666667,0.875
Jenis obat apa yang digunakan untuk meredakan gejala angina pectoris?,"Beberapa jenis obat yang dapat diberikan oleh dokter untuk meredakan gejala angina adalah:\n\nObat pengencer darah, seperti aspirin, clopidogrel, atau ticagrelor\nObat pelebar pembuluh darah golongan nitrat, seperti nitrogliserin dan isosorbide dinitrate, untuk melebarkan dan merelaksasi pembuluh darah, sehingga aliran darah ke jantung lebih baik\nObat penghambat beta, seperti atenolol,bisoprolol, atau carvedilol, untuk memperlambat denyut jantung dan membuat pembuluh darah lebih rileks sehingga mengurangi beban kerja jantung\nObat untuk mengontrol penyakit diabetes, kolesterol, dan hipertensi yang merupakan faktor risiko dari penyakit jantung koroner\nObat antiangina, seperti trimetazidine atau ranolazine, untuk mengurangi dan mencegah kejadian nyeri dada","['Topik: Angina Pectoris, Subtopik: Pengobatan Angina Pectoris: Obat-obatan \n Beberapa jenis obat yang dapat diberikan oleh dokter untuk meredakan gejala angina adalah:\n- Obat pengencer darah, seperti aspirin, clopidogrel, atau ticagrelor\n\n- Obat pelebar pembuluh darah golongan nitrat, seperti nitrogliserin dan isosorbide dinitrate, untuk melebarkan dan merelaksasi pembuluh darah, sehingga aliran darah ke jantung lebih baik\n- Obat penghambat beta, seperti atenolol,bisoprolol, atau carvedilol, untuk memperlambat denyut jantung dan membuat pembuluh darah lebih rileks sehingga mengurangi beban kerja jantung\n- Obat untuk mengontrol penyakit diabetes, kolesterol, dan hipertensi yang merupakan faktor risiko dari penyakit jantung koroner\n- Obat antiangina, seperti trimetazidine atau ranolazine, untuk mengurangi dan mencegah kejadian nyeri dada\n', 'Topik: Angina Pectoris, Subtopik: Pengobatan Angina Pectoris: Prosedur medis \n Apabila angina pectoris tidak mereda setelah pemberian obat-obatan, dokter akan menganjurkan tindakan medis, seperti:\n- Pemberian suntikan antikoagulan, seperti fondaparinux\n\n- Pemasangan ring jantung, untuk melebarkan arteri yang menyempit dengan meletakkan kawat khusus (ring) yang berbentuk seperti tabung di pembuluh darah arteri jantung\n- Operasi bypass jantung, dengan mengambil pembuluh darah dari bagian tubuh lain, untuk membuat saluran aliran darah baru sebagai pengganti saluran aliran darah yang menyempit\nSelain menjalani pengobatan, pasien perlu menjalani pengobatan untuk berbagai faktor risiko penyakit jantung koroner penyebab angina, seperti hipertensi dan diabetes.\nPasien juga perlu melakukan perubahan gaya hidup untuk mencegah keluhan ini muncul kembali dan meningkatkan harapan hidup. Perubahan gaya hidup yang perlu dilakukan meliputi olahraga secara teratur, menerapkan pola makan yang sehat, berhenti merokok, dan beristirahat yang cukup.\n', 'Topik: Angina Pectoris, Subtopik: Gejala Angina Pectoris: Unstable angina \n Berbeda dengan dua jenis angina yang dijelaskan sebelumnya, Prinzmetal  s angina disebabkan oleh kekakuan di arteri jantung. Kondisi ini menyebabkan jumlah aliran darah menurun untuk sementara waktu.\nPrinzmetal  s angina merupakan jenis angina yang cukup jarang terjadi. Angina jenis ini biasanya muncul saat istirahat, di malam hari atau di pagi hari. Intensitas nyerinya cukup berat, tetapi biasanya mereda dengan pemberian obat-obatan.\n']","Untuk mengurangi gejala angina pectoris, dokter sering memberikan beberapa jenis obat, di antaranya:\n\n1. Obat pengencer darah, seperti aspirin, clopidogrel, atau ticagrelor, yang diberikan untuk melebarkan dan merelaksasi pembuluh darah agar aliran darah ke jantung menjadi lebih baik.\n2. Obat pelebar pembuluh darah golongan nitrat, seperti nitrogliserin dan isosorbide dinitrate, yang berfungsi untuk melebarkan pembuluh darah dan mencegah angina pectoris.\n3. Obat penghambat beta, seperti atenolol, bisoprolol, atau carvedilol, yang digunakan untuk memperlambat denyut jantung dan mengurangi beban kerja jantung serta mencegah angina pectoris.\n4. Obat antiangina, seperti trimetazidine atau ranolazine, yang berfungsi untuk mengurangi dan mencegah kejadian nyeri dada akibat angina pectoris.",0.7,0.741169403347694,0.9999999999,1.0
Apa penyebab penyakit aterosklerosis?,"Penyebab pasti aterosklerosis belum diketahui, tetapi penyakit ini dimulai ketika terjadi kerusakan atau cedera di lapisan dalam arteri. Kerusakan tersebut dapat disebabkan oleh:\n\nKolesterol tinggi\nTekanan darah tinggi\nDiabetes\nPeradangan akibat penyakit tertentu, seperti lupus\nObesitas\nKebiasaan merokok","['Topik: Aterosklerosis, Subtopik: Penyebab Aterosklerosis \n Penyebab pasti aterosklerosis belum diketahui, tetapi penyakit ini dimulai ketika terjadi kerusakan atau cedera di lapisan dalam arteri. Kerusakan tersebut dapat disebabkan oleh:\n- Kolesterol tinggi\n- Tekanan darah tinggi\n- Diabetes\n- Peradangan akibat penyakit tertentu, seperti lupus\n\n- Obesitas\n- Kebiasaan merokok\nSaat lapisan dalam arteri rusak, lemak serta zat lain menjadi mudah menempel dan menggumpal di sana. Seiring berjalannya waktu, gumpalan atau plak ini terus menumpuk dan mengeras sehingga pembuluh darah arteri menyempit dan kaku.\nPenyempitan pembuluh darah akan menghambat suplai oksigen serta nutrisi ke organ-organ tubuh. Hal ini membuat fungsi organ tersebut menurun, bahkan terhenti, tergantung seberapa parah penyempitan yang terjadi.\nPerkembangan aterosklerosis hingga menimbulkan gejala sangat lambat, bahkan bisa sampai puluhan tahun. Namun, kondisi di bawah ini dapat membuat seseorang lebih berisiko atau lebih cepat mengalami aterosklerosis:\n- Usia di atas 40 atau 50 tahun\n- Pola hidup yang tidak sehat, seperti malas bergerak atau jarang berolahraga\n- Pola makan tidak sehat dan sering mengonsumsi minuman beralkohol\n- Stres berkepanjangan\n- Riwayat aterosklerosis pada keluarga\n', 'Topik: Aterosklerosis, Subtopik: Pengertian Aterosklerosis \n Atherosclerosis atau aterosklerosis adalah penyempitan dan pengerasan pembuluh darah arteri akibat penumpukan plak di dinding pembuluh darah. Kondisi ini merupakan penyebab umum penyakit jantung koroner (atherosclerosis heart disease).\nArteri adalah pembuluh darah pembawa oksigen serta nutrisi dari dan ke jantung, juga ke seluruh organ lain. Tersumbatnya arteri akibat penumpukan plak kolesterol akan menghambat aliran darah ke organ-organ tubuh.\n\nPada awalnya, aterosklerosis tidak menimbulkan gejala apa pun. Gejala baru muncul ketika aliran darah ke organ atau jaringan tubuh terhambat. Proses penumpukan plak sampai gejala aterosklerosis timbul bisa memakan waktu hingga bertahun-tahun.\n', 'Topik: Aterosklerosis, Subtopik: Gejala dan Komplikasi Aterosklerosis \n terosklerosis awalnya tidak menimbulkan gejala, sampai pembuluh darah arteri sudah sangat menyempit bahkan tertutup Akibatnya, pembuluh arteri tidak lagi dapat menyalurkan darah dalam jumlah cukup ke organ-organ tubuh.\nKarena gejalanya baru muncul setelah bertahun-tahun, banyak orang yang tidak menyadari bahwa dirinya menderita aterosklerosis sampai muncul komplikasi. Komplikasi yang muncul bisa beragam, tergantung lokasi terjadinya aterosklerosis, antara lain:\nAterosklerosis di jantung bisa menyebabkan penyakit jantung koroner dan serangan jantung. Kedua gangguan tersebut memiliki sejumlah gejala yang serupa, yaitu:\n- Nyeri dada seperti ditekan atau diremas (angina)\n- Nyeri atau tekanan pada pundak, lengan, rahang, atau punggung\n- Gangguan irama jantung (aritmia)\n- Sesak napas, berkeringat, dan gelisah\nAterosklerosis di kaki atau lengan bisa menyebabkan penyakit arteri perifer. Gangguan ini ditandai dengan gejala berikut:\n- Nyeri, kram, hingga mati rasa di area lengan atau tungkai\n- Nyeri saat berjalan dan mereda setelah beristirahat (klaudikasio intermiten)\n- Tungkai bagian bawah terasa dingin\n- Luka di jempol, telapak, atau kaki yang tidak kunjung sembuh\nBila terjadi pada pembuluh darah di otak, aterosklerosis bisa menyebabkan stroke, yang ditandai dengan gejala berupa:\n- Mati rasa hingga lumpuh pada salah satu sisi wajah, lengan, atau tungkai\n- Kebingungan dan sulit untuk dapat berbicara dengan jelas\n- Kehilangan penglihatan pada salah satu mata atau kedua mata\n- Kehilangan koordinasi dan keseimbangan\n- Pusing dan sakit kepala berat\n- Sulit bernapas dan kehilangan kesadaran\n\nPenumpukan plak pada pembuluh arteri di ginjal dapat menyebabkan gagal ginjal. Gangguan ini bisa dikenali dari sejumlah gejala, seperti:\n- Jarang buang air kecil\n- Mual yang terasa terus menerus\n- Tubuh terasa sangat lelah dan sering mengantuk\n- Tungkai membengkak\n- Bingung dan sulit berkonsentrasi\n- Sesak napas dan dada terasa nyeri\nSegera periksakan diri ke dokter jika mengalami gejala yang telah disebutkan di atas. Anda juga perlu segera ke IGD bila mengalami gejala serangan jantung atau stroke. Kedua kondisi tersebut harus segera ditangani, karena bisa berakibat fatal bila menunggu lama.\nJika Anda menderita diabetes atau hipertensi, lakukan kontrol rutin ke dokter untuk memantau kondisi penyakitnya dan mencegah kemungkinan komplikasi aterosklerosis.\nBila Anda perokok, berusahalah untuk menghentikan kebiasaan tersebut. Merokok tidak hanya bisa menyebabkan aterosklerosis, tetapi juga penyakit lain. Jika berhenti merokok dirasa sangat sulit, pergilah ke dokter untuk mengikuti program berhenti merokok.\n']","Penyebab aterosklerosis belum pasti, tetapi penyakit ini dimulai ketika terjadi kerusakan atau cedera di lapisan dalam arteri. Kerusakan tersebut bisa disebabkan oleh beberapa faktor, antara lain:\n\n1. Kolesterol tinggi: Zat ini dapat menempel dan menggumpal di bagian dalam arteri, menyebabkan penyempitan pembuluh darah dan kurusnya lapisan dinding arteri.\n2. Tekanan darah tinggi: Mengakibatkan jantung bekerja lebih keras untuk mengalirkan darah ke seluruh tubuh, yang bisa meningkatkan resiko terjadinya aterosklerosis.\n3. Diabetes: Mengakibatkan ketidakseimbangan gula dalam darah dan kerusakan pembuluh darah karena panen oksigen lebih sedikit ke organ-organ tubuh.\n4. Penyakit rematik akibat penyebab lain, seperti obesitas, merokok, atau stres berkepanjangan.\n5. Obesitas: Mengakibatkan terjadinya pengerasan arteri dan menyebabkan risiko terjadinya aterosklerosis lebih tinggi.\n6. Kebiasaan merokok: Merokok dapat menyebabkan penyempitan arteri, kurusnya lapisan dinding arteri, serta menurunkan kapasitas oksigen yang masuk ke tubuh.\n7. Stres berkepanjangan dan riwayat atau famili terkena aterosklerosis: Kedua faktor ini bisa memperparah kondisi jantung dan mengganggu fungsi sistem peredaran darah.\n\nDari konteks yang diberikan, penumpukan plak di dalam arteri diawali dengan kerusakan atau cedera pada lapisan dalam arteri. Hal ini bisa disebabkan oleh faktor-faktor seperti kolesterol tinggi, tekanan darah tinggi, diabetes, penyakit rematik lainnya, obesitas, merokok, stres berkepanjangan, dan riwayat atau famili terkena aterosklerosis.",0.5714285714285714,0.6472249945819278,0.9999999999,1.0
Bagaimana pencegahan penyakit aterosklerosis?,"Aterosklerosis dapat dicegah dengan menerapkan pola hidup sehat. Cara yang bisa dilakukan antara lain:\n\nMelakukan pola makan sehat dengan gizi seimbang yang kaya serat dan karbohidrat kompleks, serta rendah kolesterol\nMenghindari atau membatasi konsumsi minuman beralkohol\nBerolahraga selama 30 menit per hari, setidaknya 5 hari dalam seminggu\nBerhenti merokok\nMenjaga berat badan dalam rentang ideal\nMengelola stress dengan baik, misalnya dengan relaksasi (mengendurkan otot-otot yang tegang) atau meditasi\nBeristirahat dan tidur yang cukup","['Topik: Aterosklerosis, Subtopik: Pencegahan Aterosklerosis \n Aterosklerosis dapat dicegah dengan menerapkan pola hidup sehat. Cara yang bisa dilakukan antara lain:\n- Melakukan pola makan sehat dengan gizi seimbang yang kaya serat dan karbohidrat kompleks, serta rendah kolesterol\n- Menghindari atau membatasi konsumsi minuman beralkohol\n- Berolahraga selama 30 menit per hari, setidaknya 5 hari dalam seminggu\n- Berhenti merokok\n- Menjaga berat badan dalam rentang ideal\n\n- Mengelola stress dengan baik, misalnya dengan relaksasi (mengendurkan otot-otot yang tegang) atau meditasi\n- Beristirahat dan tidur yang cukup\n', 'Topik: Aterosklerosis, Subtopik: Pengobatan Aterosklerosis \n Penangan aterosklerosis dapat dilakukan dengan tiga metode, yaitu perubahan gaya hidup, obat-obatan, serta prosedur medis.\nPerubahan gaya hidup sehari-hari merupakan hal utama yang perlu dilakukan. Pasien dianjurkan untuk lebih sering berolahraga guna meningkatkan kesehatan jantung dan pembuluh darah, serta mengurangi konsumsi makanan yang banyak mengandung kolesterol.\nSelain menyarankan perubahan gaya hidup, dokter juga dapat memberi obat-obatan untuk mencegah arterosklerosis bertambah buruk. Obat-obatan ini dapat berupa:\n- Obat untuk mencegah penggumpalan darah, seperti aspirin\n\n- Obat untuk menurunkan tekanan darah, seperti penghambat beta (beta blockers), antagonis kalsium (calcium channel blockers), serta diuretik\n- Obat penurun kadar kolesterol, seperti statin dan fibrat\n- Obat untuk mencegah penyempitan arteri, seperti ACE inhibitor\n\n- Obat untuk mengendalikan penyakit yang bisa menyebabkan aterosklerosis, seperti obat diabetes untuk menjaga kadar gula darah.\nPada kasus aterosklerosis yang parah, dokter mungkin akan menyarankan penanganan dengan:\n- Pemasangan ring (stent) dan angioplasty\nProsedur ini digunakan untuk membuka penyumbatan atau penyempitan arteri, kemudian memasang tabung kecil di sana agar aliran darah kembali lancar.\n- Terapi fibrinolitik\nTerapi ini dilakukan untuk mengatasi penyumbatan arteri akibat pembekuan darah, dengan memberikan obat pelarut atau pemecah gumpalan darah (fibrinolitik).\n- Operasi bypass\nProsedur ini dilakukan dengan cara memintas pembuluh darah yang tersumbat menggunakan pembuluh darah dari bagian tubuh lain atau selang berbahan sintetis.\n- Endarterektomi\nProsedur ini dilakukan untuk membuang tumpukan lemak pada dinding arteri yang menyempit. Biasanya, prosedur ini dilakukan pada arteri di leher.\n- Arterektomi\nProsedur ini dilakukan untuk membuang plak di arteri dengan menggunakan kateter berpisau tajam di salah satu ujungnya.\n', 'Topik: Aterosklerosis, Subtopik: Gejala dan Komplikasi Aterosklerosis \n terosklerosis awalnya tidak menimbulkan gejala, sampai pembuluh darah arteri sudah sangat menyempit bahkan tertutup Akibatnya, pembuluh arteri tidak lagi dapat menyalurkan darah dalam jumlah cukup ke organ-organ tubuh.\nKarena gejalanya baru muncul setelah bertahun-tahun, banyak orang yang tidak menyadari bahwa dirinya menderita aterosklerosis sampai muncul komplikasi. Komplikasi yang muncul bisa beragam, tergantung lokasi terjadinya aterosklerosis, antara lain:\nAterosklerosis di jantung bisa menyebabkan penyakit jantung koroner dan serangan jantung. Kedua gangguan tersebut memiliki sejumlah gejala yang serupa, yaitu:\n- Nyeri dada seperti ditekan atau diremas (angina)\n- Nyeri atau tekanan pada pundak, lengan, rahang, atau punggung\n- Gangguan irama jantung (aritmia)\n- Sesak napas, berkeringat, dan gelisah\nAterosklerosis di kaki atau lengan bisa menyebabkan penyakit arteri perifer. Gangguan ini ditandai dengan gejala berikut:\n- Nyeri, kram, hingga mati rasa di area lengan atau tungkai\n- Nyeri saat berjalan dan mereda setelah beristirahat (klaudikasio intermiten)\n- Tungkai bagian bawah terasa dingin\n- Luka di jempol, telapak, atau kaki yang tidak kunjung sembuh\nBila terjadi pada pembuluh darah di otak, aterosklerosis bisa menyebabkan stroke, yang ditandai dengan gejala berupa:\n- Mati rasa hingga lumpuh pada salah satu sisi wajah, lengan, atau tungkai\n- Kebingungan dan sulit untuk dapat berbicara dengan jelas\n- Kehilangan penglihatan pada salah satu mata atau kedua mata\n- Kehilangan koordinasi dan keseimbangan\n- Pusing dan sakit kepala berat\n- Sulit bernapas dan kehilangan kesadaran\n\nPenumpukan plak pada pembuluh arteri di ginjal dapat menyebabkan gagal ginjal. Gangguan ini bisa dikenali dari sejumlah gejala, seperti:\n- Jarang buang air kecil\n- Mual yang terasa terus menerus\n- Tubuh terasa sangat lelah dan sering mengantuk\n- Tungkai membengkak\n- Bingung dan sulit berkonsentrasi\n- Sesak napas dan dada terasa nyeri\nSegera periksakan diri ke dokter jika mengalami gejala yang telah disebutkan di atas. Anda juga perlu segera ke IGD bila mengalami gejala serangan jantung atau stroke. Kedua kondisi tersebut harus segera ditangani, karena bisa berakibat fatal bila menunggu lama.\nJika Anda menderita diabetes atau hipertensi, lakukan kontrol rutin ke dokter untuk memantau kondisi penyakitnya dan mencegah kemungkinan komplikasi aterosklerosis.\nBila Anda perokok, berusahalah untuk menghentikan kebiasaan tersebut. Merokok tidak hanya bisa menyebabkan aterosklerosis, tetapi juga penyakit lain. Jika berhenti merokok dirasa sangat sulit, pergilah ke dokter untuk mengikuti program berhenti merokok.\n']","Pencegahan atau preventif aterosklerosis bisa dilakukan melalui beberapa cara, diantaranya adalah sebagai berikut:\n\n1. Mengadopsi pola makan sehat dan gizi seimbang yang kaya akan serat dan karbohidrat kompleks dengan rendahnya kolesterol. Ini membantu mencegah penyumbatan pembuluh darah akibat terakumulasi lemak dalam tubuh.\n2. Mengurangi atau menghindari paparan asap rokok, yang telah terbukti dapat menyebabkan penyempitan atau proses pengenceran pembuluh darah akibat adanya efek racun dan radikal bebas dalam rokok.\n3. Berolahraga seimbang minimal 30 menit per hari, setidaknya 5 kali seminggu. Hal ini bisa mempercepat aliran darah dan mencegah terjadinya penyumbatan pembuluh darah akibat lemak dalam tubuh.\n4. Mengontrol berat badan agar tidak kelebihan bobot ideal. Obesitas atau kegemukan juga dapat meningkatkan risiko terjadinya aterosklerosis.\n5. Menjaga tekanan darah dan kadar gula darah dalam batas normal, serta mengendalikan asupan makanan tinggi lemak kaya asam lemak omega-3 seperti ikan setara dengan 2 gelas minum pada diet rutin.\n6. Mengurangi pola hidup stres dan cara menghadapi tekanan atau trauma mental, baik secara langsung maupun tidak langsung melalui metode yang sesuai untuk setiap individu, seperti olahraga fisik, relaksasi, meditasi, oulu, atau berdiskusi dengan teman dan keluarga.\n7. Menghentikan merokok secara permanen jika masih menontonnya, terutama asap rokok yang membahayakan kesehatan tubuh baik untuk si penyek dan orang disekitar.\n8. Menjaga asupan makanan sehat dan mengurangi paparan lemak dalam jumlah besar atau jenis tertentu, terutama yang berasal dari hewan gizinya mempunyai efek buruk bagi tubuh manusia.\n9. Beristirahat dan tidur cukup untuk mengurangi stress pada jaringan saraf dan sistem kekebalan tubuh, sekaligus menjaga kinerja fisik dan fungsional organ-organ dalam tubuh.",0.4444444444444444,0.6396495271971768,0.9999999999666667,1.0
Apa saja hal yang dapat meningkatkan risiko penyakit Arteriosklerosis?,"Selain itu, ada beberapa kondisi yang dapat meningkatkan risiko terjadinya kerusakan pembuluh darah arteri, yaitu:\n\nKolesterol tinggi\nTrigliserida tinggi\nTekanan darah tinggi\nBerat badan berlebih\nDiabetes\nPeradangan akibat arthritis, lupus, atau infeksi\nKebiasaan merokok\nKurang olahraga\nPola makan yang tidak sehat\nRiwayat penyakit jantung di keluarga","['Topik: Arteriosklerosis, Subtopik: Penyebab Arteriosklerosis \n Arteriosklerosis terjadi ketika dinding bagian dalam pembuluh darah arteri mengalami kerusakan. Akibatnya, sel darah dan plak yang terbentuk dari kolesterol, lemak, atau kalsium menumpuk di dinding arteri dan menyumbat pembuluh darah.\nPenyumbatan pembuluh darah membuat aliran darah ke organ-organ tubuh menjadi tidak lancar. Hal ini mengakibatkan organ tersebut tidak berfungsi dengan baik.\nBelum diketahui secara pasti penyebab kerusakan pada pembuluh darah arteri. Akan tetapi, kondisi ini diyakini bisa terjadi sejak usia muda dan dapat berkembang seiring pertambahan usia.\nSelain itu, ada beberapa kondisi yang dapat meningkatkan risiko terjadinya kerusakan pembuluh darah arteri, yaitu:\n- Kolesterol tinggi\n- Trigliserida tinggi\n- Tekanan darah tinggi\n- Berat badan berlebih\n- Diabetes\n- Peradangan akibat arthritis, lupus, atau infeksi\n- Kebiasaan merokok\n- Kurang olahraga\n- Pola makan yang tidak sehat\n- Riwayat penyakit jantung di keluarga\n', 'Topik: Arteriosklerosis, Subtopik: Pengertian Arteriosklerosis \n Arteriosklerosis adalah pengerasan pembuluh darah arteri akibat penumpukan plak di dinding arteri. Arteri yang mengeras dapat membuat aliran darah ke organ tubuh menjadi tidak lancar sehingga mengganggu fungsi organ tersebut. Kondisi ini dapat terjadi akibat berbagai hal, seperti penumpukan lemak atau penuaan.\nArteri adalah pembuluh darah yang berfungsi mengalirkan darah kaya oksigen dari jantung ke seluruh tubuh. Seiring berjalannya waktu, arteri dapat mengeras sehingga kehilangan elastisitasnya.\n\nArteriosklerosis dapat terjadi di arteri yang mengalirkan darah ke jantung, otak, kaki, dan ginjal. Bila berlangsung dalam waktu lama, aliran darah ke organ-organ tersebut akan terganggu, bahkan tersumbat. Akibatnya, penderita arteriosklerosis berisiko terserang penyakit serius, seperti stroke dan penyakit jantung koroner.\nMeski sering kali dianggap sama, arteriosklerosis berbeda dengan aterosklerosis. Arteriosklerosis mencakup semua kondisi pengerasan arteri. Sedangkan aterosklerosis merupakan pengerasan arteri yang secara spesifik terjadi akibat penumpukan lemak di dinding arteri. Dengan kata lain, aterosklerosis termasuk ke dalam jenis arteriosklerosis.\n', 'Topik: Arteriosklerosis, Subtopik: Pencegahan Arteriosklerosis \n Arteriosklerosis bisa dicegah dengan meminimalkan faktor risiko yang telah disebutkan di atas. Caranya adalah dengan menjalani pola hidup sehat, seperti:\n- Tidak merokok\n- Berolahraga secara rutin\n- Mengonsumsi makanan sehat dan bergizi seimbang, serta memperbanyak asupan sayur-sayuran dan buah-buahan\n- Mempertahankan berat badan ideal\n\n- Beristirahat dan tidur yang cukup\n- Mengelola stres dengan baik\nSelain itu, penderita penyakit diabetes, lupus, dan arthritis dianjurkan untuk melakukan kontrol ke dokter secara rutin, guna memantau kondisi kesehatan dan efektivitas pengobatan yang telah dilakukan.\n']","Hal-hal yang dapat meningkatkan risiko terjadinya arteriosklerosis antara lain:\n\n1. Kolesterol tinggi: Peningkatan kadar LDL (low-density lipoprotein) atau lebih dikenal sebagai kolesterol salju, yaitu jenis protein yang dapat menyumbangkan pada pengerasan arteri dan pertumbuhan plak.\n2. Trigliserida tinggi: Peningkatan kadar trigliserida dalam darah juga memiliki kontribusi terhadap risiko terjadinya arteriosklerosis, terutama jika jumlah LDL yang tinggi dan tidak ada pengurang LDL.\n3. Tekanan Darah Tinggi: Peningkatan tekanan darah akibat penyakit hipertensi juga dapat meningkatkan risiko terjadinya arteriosklerosis, karena tekanan darah tinggi menyebabkan pembuluh darah mengalami stress mekanis yang berpotensi merusak.\n4. Berat Badan Berlebih: Keadaan obesitas dapat meningkatkan risiko terjadinya arteriosklerosis, baik secara langsung maupun tidak langsung melalui peningkatan faktor-faktor lain seperti kolesterol tinggi dan tekanan darah tinggi.\n5. Diabetes: Penyakit diabetes merupakan suatu penyebab utama terjadinya arteriosklerosis, terutama jika tidak diatasi dengan baik.\n6. Pola Makan yang Tidak Sehat: Mengonsumsi makanan berlemak tinggi dan rendah dalam jumlah banyak seringkali meningkatkan risiko terjadinya arteriosklerosis.\n7. Riwayat Penyakit Jantung Dalam Keluarga: Kebiasaan merokok, kurang olahraga, riwayat penyakit jantung di keluarga juga dapat mempengaruhi risiko terjadinya arteriosklerosis.\n8. Penyakit Arthritis, Lupus, atau Infeksi: Kondisi ini sepertinya tidak langsung mempengaruhi kerusakan pembuluh darah tetapi dapat meningkatkan risiko terjadinya penyakit jantung koroner karena faktor-faktor lainnya, seperti riwayat penyakitan jantung di keluarga.",0.45454545454545453,0.6843329450904766,0.99999999995,1.0
Apa saja gejala penyakit arteriosklerosis?,"Sebagian besar kasus arteriosklerosis tidak menimbulkan gejala sampai terjadi penyumbatan di pembuluh darah arteri. Gejala yang muncul tergantung pada lokasi pembuluh arteri yang tersumbat.\n\nBerdasarkan lokasi pembuluh darah arteri yang mengalami penyumbatan, gejala-gejala yang dapat muncul adalah:\n\nPenyumbatan di arteri yang menuju otak, yang dapat menimbulkan gejala berupa mati rasa di tungkai dan lengan, sulit berbicara, gangguan penglihatan, dan wajah terkulai\nPenyumbatan di arteri yang menuju jantung, yang bisa menimbulkan keluhan berupa nyeri dada, sesak napas, dan gangguan irama jantung\nPenyumbatan di arteri yang menuju tungkai, yang dapat menimbulkan gejala berupa nyeri di kaki ketika berjalan dan penurunan tekanan darah di lengan yang terkena\nPenyumbatan di arteri yang menuju ginjal, yang dapat menimbulkan keluhan berupa tekanan darah tinggi hingga gagal ginjal","['Topik: Arteriosklerosis, Subtopik: Gejala Arteriosklerosis \n Sebagian besar kasus arteriosklerosis tidak menimbulkan gejala sampai terjadi penyumbatan di pembuluh darah arteri. Gejala yang muncul tergantung pada lokasi pembuluh arteri yang tersumbat.\nBerdasarkan lokasi pembuluh darah arteri yang mengalami penyumbatan, gejala-gejala yang dapat muncul adalah:\n- Penyumbatan di arteri yang menuju otak, yang dapat menimbulkan gejala berupa mati rasa di tungkai dan lengan, sulit berbicara, gangguan penglihatan, dan wajah terkulai\n- Penyumbatan di arteri yang menuju jantung, yang bisa menimbulkan keluhan berupa nyeri dada, sesak napas, dan gangguan irama jantung\n- Penyumbatan di arteri yang menuju tungkai, yang dapat menimbulkan gejala berupa nyeri di kaki ketika berjalan dan penurunan tekanan darah di lengan yang terkena\n- Penyumbatan di arteri yang menuju ginjal, yang dapat menimbulkan keluhan berupa tekanan darah tinggi hingga gagal ginjal\n\n', 'Topik: Arteriosklerosis, Subtopik: Gejala Arteriosklerosis: Kapan harus ke dokter \n Segera ke dokter bila mengalami gejala arteriosklerosis seperti yang disebutkan di atas, terutama nyeri dada dan mati rasa atau nyeri di kaki. Pemeriksaan dan pengobatan yang dilakukan lebih awal dapat mencegah arteriosklerosis memburuk dan berkembang menjadi penyakit jantung dan stroke.\n', 'Topik: Arteriosklerosis, Subtopik: Diagnosis Arteriosklerosis \n Dokter akan menanyakan gejala yang dialami pasien, serta riwayat kesehatan pasien dan keluarga. Setelah itu, dokter akan melakukan pemeriksaan fisik menyeluruh, termasuk mengukur perbedaan tekanan darah di lengan dan kaki (ankle-brachial index), serta memeriksa denyut nadi di dekat arteri yang menyempit.\nSelanjutnya, dokter akan melakukan pemeriksaan penunjang yang jenisnya tergantung pada hasil pemeriksaan fisik. Pemeriksaan penunjang tersebut antara lain:\n- Tes darah, untuk mengukur kadar kolesterol dan gula darah\n- USG Doppler, untuk mengukur tekanan darah di kaki atau lengan\n- Tes stres, untuk mengukur seberapa baik kerja jantung saat beraktivitas fisik\n- Elektrokardiografi (EKG), untuk mengukur aktivitas listrik jantung\n- Katerisasi jantung, untuk melihat apakah terjadi penyumbatan di pembuluh darah jantung\n- Pemindaian dengan CT scan atau MRA (magnetic resonance angiography), untuk melihat penyempitan dan pengerasan di dinding arteri\n']","Gejala penyakat arteriosklerosis terdiri atas beberapa gejala umum dan lokasinya bergantung pada letak penyumbatan di dalam arteri. Berikut ini daftar gejala yang dapat muncul akibat arteriosklerosis:\n\n1. Penyumbatan di arteri yang menuju otak, yang bisa menimbulkan gejala berupa mati rasa atau nyeri pada bagian tungkai dan lengan. Gejala lainnya termasuk sulit berbicara, gangguan penglihatan, dan wajah terkulai.\n2. Penyumbatan di arteri yang menuju jantung, menyebabkan keluhan nyeri dada, sesak napas, dan gejala-gejala lain seperti gangguan irama jantung.\n3. Penyumbat pada arteri yang menuju tungkai, dapat menimbulkan gejala berupa nyeri di kaki saat berjalan atau penurunan tekanan darah di lengan yang terkena.\n4. Penyumbatan di arteri yang menuju ginjal, menyebabkan gejala-gejala seperti tekanan darah tinggi hingga perihal gagal ginjal karena pembuluh darah ginjal yang tersumbat.\n\nGejala ini biasanya muncul setelah terjadi penyumbatan di dalam arteri, meskipun sebagian besar kasus tidak menimbulkan gejala hingga terjadi pembuluh darah yang tersumbat. Karena itu, segera ke dokter bila mengalami gejala seperti nyeri dada dan mati rasa atau nyeri di kaki adalah hal yang penting untuk dilakukan. Pemeriksaan dan pengobatan lebih awal dapat mencegah arteriosklerosis memburuk dan berkembang menjadi penyakat jantung dan stroke.",1.0,0.6612322527489631,0.9999999999666667,1.0
Apa gejala umum penyakit jantung bawaan pada bayi?,"Sedangkan pada bayi, gejala penyakit jantung bawaan yang umum terjadi adalah:\n\nWarna kebiruan atau kehitaman di bibir, kulit, atau jari-jari kuku (sianosis)\nKelelahan dan kesulitan bernapas, terutama ketika disusui\nBerat badan rendah\nPertumbuhan terhambat\nPembengkakan di tungkai, perut, atau area sekitar mata\nInfeksi paru-paru yang berulang\nSering mengeluarkan keringat dingin","['Topik: Penyakit Jantung Bawaan, Subtopik: Gejala Penyakit Jantung Bawaan \n Penyakit jantung bawaan bisa terdeteksi saat USG kehamilan rutin atau sesaat setelah bayi dilahirkan. Salah satu gejala penyakit jantung bawaan pada janin adalah bunyi detak jantung yang tidak beraturan (aritmia).\nSedangkan pada bayi, gejala penyakit jantung bawaan yang umum terjadi adalah:\n- Warna kebiruan atau kehitaman di bibir, kulit, atau jari-jari kuku (sianosis)\n- Kelelahan dan kesulitan bernapas, terutama ketika disusui\n- Berat badan rendah\n- Pertumbuhan terhambat\n- Pembengkakan di tungkai, perut, atau area sekitar mata\n- Infeksi paru-paru yang berulang\n- Sering mengeluarkan keringat dingin\n\nPada kasus tertentu, gejala penyakit jantung bawaan baru muncul beberapa tahun setelah bayi dilahirkan, bisa ketika masa kanak-kanak atau remaja. Gejalanya bisa berupa:\n- Detak jantung tidak beraturan (aritmia)\n- Pusing dan mudah lelah, terutama saat berolahraga\n- Sulit bernapas atau napas terengah-engah\n- Pembengkakan (edema) di kaki, pergelangan kaki, atau tangan\n- Kulit berwarna kebiruan (sianosis)\n- Mudah pingsan\nPada beberapa kasus, penyakit jantung bawaan tidak menyebabkan nyeri dada atau keluhan lain, bahkan dapat terjadi tanpa gejala tertentu.\nSegera periksakan diri ke dokter jika Anda atau anak Anda mengalami gejala-gejala penyakit jantung bawaan seperti yang telah disebutkan sebelumnya. Penanganan sejak dini perlu segera dilakukan untuk mencegah kondisi yang lebih serius.\nJika pernah divonis mengalami penyakit jantung bawaan, lakukan kontrol secara berkala ke dokter untuk memantau perkembangan penyakit.\nRisiko bayi menderita penyakit jantung bawaan akan lebih tinggi pada ibu hamil yang menderita diabetes atau memiliki riwayat penyakit genetik dalam keluarga. Jika Anda sedang atau pernah menderita kondisi tersebut, konsultasikan dengan dokter terkait kemungkinan menurunkan penyakit jantung bawaan kepada bayi Anda.\nSegera ke IGD rumah sakit terdekat bila Anda atau anak Anda sulit bernapas, kulit dan bibir tampak kebiruan, atau mengalami pembengkakan di tungkai atau bagian tubuh lainnya.\n', 'Topik: Penyakit Jantung Bawaan, Subtopik: Penyebab Penyakit Jantung Bawaan \n Penyakit jantung bawaan (PJB) terjadi akibat gangguan pada proses pembentukan dan perkembangan jantung janin.\nJantung manusia terbagi menjadi empat ruang, yaitu dua serambi (atrium) dan dua bilik (ventrikel), masing-masing di sisi kanan dan kiri. Atrium kanan berfungsi untuk menerima darah kotor dari seluruh tubuh.\nDarah yang masuk ke atrium kanan akan dipompa ke ventrikel kanan, lalu dipompa menuju paru-paru untuk diisi oksigen. Darah yang kaya oksigen ini lalu kemudian kembali ke jantung melalui atrium kiri. Selanjutnya, darah tersebut akan masuk ke ventrikel kiri, untuk kemudian dipompa ke seluruh tubuh melalui aorta.\nPada penderita PJB, siklus dan aliran darah tersebut bisa terganggu. Kondisi ini dapat terjadi akibat gangguan di katup, ruang jantung, dinding penyekat di antara ruang jantung (septum), atau pembuluh darah dari dan menuju jantung.\nPenyebab terjadinya kelainan struktur jantung selama proses pembentukan organ jantung pada janin belum diketahui secara pasti. Namun, sejumlah kondisi pada ibu hamil bisa meningkatkan risiko terjadinya penyakit jantung bawaan pada bayi, yaitu:\n- Memiliki keluarga dengan riwayat penyakit jantung bawaan atau kelainan genetik, seperti sindrom Down atau sindrom Edward\n\n- Menderita diabetes tipe 1 atau 2 yang tidak terkontrol\n- Menderita penyakit autoimun, seperti sindrom Sj gren\n\n- Mengonsumsi alkohol secara berlebihan atau merokok saat hamil\n- Menderita infeksi virus, seperti rubella, pada trimester pertama kehamilan\n- Mengonsumsi obat-obatan tertentu selama hamil, seperti obat antikejang, obat antijerawat golongan retinoid, dan obat golongan statin, tanpa resep dokter\n- Terpapar pelarut organik yang umumnya ditemukan dalam produk cat tembok, cat kuku, atau lem\n- Menderita penyakit tertentu yang dapat diturunkan dari orang tua ke anaknya, misalnya fenilketonuria\n\n', 'Topik: Penyakit Jantung Bawaan, Subtopik: Jenis Penyakit Jantung Bawaan \n Penyakit jantung bawaan dapat dibagi berdasarkan bagian organ jantung yang mengalami gangguan. Berikut adalah penjelasannya:\nPenyakit jantung bawaan jenis ini terjadi akibat katup jantung yang melemah atau tertutup sejak bayi dilahirkan. Beberapa jenis penyakit jantung bawaan dengan kelainan di katup jantung adalah:\n- Tricuspid atresia, terjadi ketika katup di antara serambi kanan dan bilik kanan tidak terbentuk dengan sempurna\n- Pulmonary atresia, terjadi ketika ada gangguan di katup antara bilik kanan dan paru-paru sehingga darah tidak dapat mengalir ke paru-paru\n- Stenosis katup aorta, terjadi ketika katup antara bilik kiri dan aorta tidak terbentuk sempurna dan menyempit sehingga jantung sulit memompa darah\nKelainan di dinding pembatas atrium dan ventrikel bisa mengganggu fungsi jantung dalam memompa darah dan darah berkumpul di bagian yang tidak seharusnya.\nPenyakit jantung bawaan jenis ini, di antaranya:\n- Defek septum ventrikel dan defek septum atrium, yang terjadi ketika ada celah atau lubang di antara kedua bilik atau atrium jantung\n- Tetralogy of Fallot, yang terjadi ketika ada kombinasi empat penyakit jantung bawaan saat lahir, seperti defek septum dan penyempitan (stenosis) katup pembuluh darah dari jantung ke paru-paru (arteri pulmonalis)\nPenyakit jantung bawaan ini terjadi di arteri dan vena dari dan ke jantung. Kondisi ini menyebabkan aliran darah dari dan menuju jantung terhambat.\nBeberapa penyakit jantung bawaan jenis ini adalah:\n- Patent ductus arteriosus (PDA), yang terjadi ketika ada celah atau lubang di pembuluh darah aorta yang membawa darah dari jantung ke seluruh tubuh\n- Transposisi arteri besar (TAB), yang terjadi ketika posisi arteri pulmonalis dan aorta terbalik\n- Truncus arteriosus, yang terjadi ketika proses pemisahan aorta dan arteri paru-paru tidak terjadi secara sempurna\n- Koarktasio aorta, yang terjadi ketika aorta menyempit\nSelain tiga jenis di atas, penyakit jantung bawaan juga dapat dibagi menjadi dua kategori, yaitu sianotik dan asianotik. Sianotik menyebabkan rendahnya kadar oksigen dalam darah, yang ditandai dengan semburat biru di kulit dan kesulitan bernapas. Sementara asianotik umumnya tidak menimbulkan gejala tersebut.\n']","Gejala umum penyakit jantung bawaan pada bayi termasuk:\n- Warna kebiruan atau kehitaman di bibir, kulit, atau jari-jari kuku (sianosis)\n- Kelelahan dan kesulitan bernapis, terutama ketika disusui\n- Berat badan rendah\n- Pertumbuhan terhambat\n- Pembengkakan di tungkai, perut, atau area sekitar mata\n- Infeksi paru-paru yang berulang\n- Sering mengeluarkan keringat dingin",1.0,0.5640324439399917,0.9999999999666667,1.0
Apa saja kondisi yang dapat meningkatkan faktor risiko penyakit jantung bawaan pada bayi?,"Sejumlah kondisi pada ibu hamil bisa meningkatkan risiko terjadinya penyakit jantung bawaan pada bayi, yaitu:\n\nMemiliki keluarga dengan riwayat penyakit jantung bawaan atau kelainan genetik, seperti sindrom Down atau sindrom Edward\nMenderita diabetes tipe 1 atau 2 yang tidak terkontrol\nMenderita penyakit autoimun, seperti sindrom Sjögren\nMengonsumsi alkohol secara berlebihan atau merokok saat hamil\nMenderita infeksi virus, seperti rubella, pada trimester pertama kehamilan\nMengonsumsi obat-obatan tertentu selama hamil, seperti obat antikejang, obat antijerawat golongan retinoid, dan obat golongan statin, tanpa resep dokter\nTerpapar pelarut organik yang umumnya ditemukan dalam produk cat tembok, cat kuku, atau lem\nMenderita penyakit tertentu yang dapat diturunkan dari orang tua ke anaknya, misalnya fenilketonuria","['Topik: Penyakit Jantung Bawaan, Subtopik: Penyebab Penyakit Jantung Bawaan \n Penyakit jantung bawaan (PJB) terjadi akibat gangguan pada proses pembentukan dan perkembangan jantung janin.\nJantung manusia terbagi menjadi empat ruang, yaitu dua serambi (atrium) dan dua bilik (ventrikel), masing-masing di sisi kanan dan kiri. Atrium kanan berfungsi untuk menerima darah kotor dari seluruh tubuh.\nDarah yang masuk ke atrium kanan akan dipompa ke ventrikel kanan, lalu dipompa menuju paru-paru untuk diisi oksigen. Darah yang kaya oksigen ini lalu kemudian kembali ke jantung melalui atrium kiri. Selanjutnya, darah tersebut akan masuk ke ventrikel kiri, untuk kemudian dipompa ke seluruh tubuh melalui aorta.\nPada penderita PJB, siklus dan aliran darah tersebut bisa terganggu. Kondisi ini dapat terjadi akibat gangguan di katup, ruang jantung, dinding penyekat di antara ruang jantung (septum), atau pembuluh darah dari dan menuju jantung.\nPenyebab terjadinya kelainan struktur jantung selama proses pembentukan organ jantung pada janin belum diketahui secara pasti. Namun, sejumlah kondisi pada ibu hamil bisa meningkatkan risiko terjadinya penyakit jantung bawaan pada bayi, yaitu:\n- Memiliki keluarga dengan riwayat penyakit jantung bawaan atau kelainan genetik, seperti sindrom Down atau sindrom Edward\n\n- Menderita diabetes tipe 1 atau 2 yang tidak terkontrol\n- Menderita penyakit autoimun, seperti sindrom Sj gren\n\n- Mengonsumsi alkohol secara berlebihan atau merokok saat hamil\n- Menderita infeksi virus, seperti rubella, pada trimester pertama kehamilan\n- Mengonsumsi obat-obatan tertentu selama hamil, seperti obat antikejang, obat antijerawat golongan retinoid, dan obat golongan statin, tanpa resep dokter\n- Terpapar pelarut organik yang umumnya ditemukan dalam produk cat tembok, cat kuku, atau lem\n- Menderita penyakit tertentu yang dapat diturunkan dari orang tua ke anaknya, misalnya fenilketonuria\n\n', 'Topik: Penyakit Jantung Bawaan, Subtopik: Gejala Penyakit Jantung Bawaan \n Penyakit jantung bawaan bisa terdeteksi saat USG kehamilan rutin atau sesaat setelah bayi dilahirkan. Salah satu gejala penyakit jantung bawaan pada janin adalah bunyi detak jantung yang tidak beraturan (aritmia).\nSedangkan pada bayi, gejala penyakit jantung bawaan yang umum terjadi adalah:\n- Warna kebiruan atau kehitaman di bibir, kulit, atau jari-jari kuku (sianosis)\n- Kelelahan dan kesulitan bernapas, terutama ketika disusui\n- Berat badan rendah\n- Pertumbuhan terhambat\n- Pembengkakan di tungkai, perut, atau area sekitar mata\n- Infeksi paru-paru yang berulang\n- Sering mengeluarkan keringat dingin\n\nPada kasus tertentu, gejala penyakit jantung bawaan baru muncul beberapa tahun setelah bayi dilahirkan, bisa ketika masa kanak-kanak atau remaja. Gejalanya bisa berupa:\n- Detak jantung tidak beraturan (aritmia)\n- Pusing dan mudah lelah, terutama saat berolahraga\n- Sulit bernapas atau napas terengah-engah\n- Pembengkakan (edema) di kaki, pergelangan kaki, atau tangan\n- Kulit berwarna kebiruan (sianosis)\n- Mudah pingsan\nPada beberapa kasus, penyakit jantung bawaan tidak menyebabkan nyeri dada atau keluhan lain, bahkan dapat terjadi tanpa gejala tertentu.\nSegera periksakan diri ke dokter jika Anda atau anak Anda mengalami gejala-gejala penyakit jantung bawaan seperti yang telah disebutkan sebelumnya. Penanganan sejak dini perlu segera dilakukan untuk mencegah kondisi yang lebih serius.\nJika pernah divonis mengalami penyakit jantung bawaan, lakukan kontrol secara berkala ke dokter untuk memantau perkembangan penyakit.\nRisiko bayi menderita penyakit jantung bawaan akan lebih tinggi pada ibu hamil yang menderita diabetes atau memiliki riwayat penyakit genetik dalam keluarga. Jika Anda sedang atau pernah menderita kondisi tersebut, konsultasikan dengan dokter terkait kemungkinan menurunkan penyakit jantung bawaan kepada bayi Anda.\nSegera ke IGD rumah sakit terdekat bila Anda atau anak Anda sulit bernapas, kulit dan bibir tampak kebiruan, atau mengalami pembengkakan di tungkai atau bagian tubuh lainnya.\n', 'Topik: Penyakit Jantung Bawaan, Subtopik: Jenis Penyakit Jantung Bawaan \n Penyakit jantung bawaan dapat dibagi berdasarkan bagian organ jantung yang mengalami gangguan. Berikut adalah penjelasannya:\nPenyakit jantung bawaan jenis ini terjadi akibat katup jantung yang melemah atau tertutup sejak bayi dilahirkan. Beberapa jenis penyakit jantung bawaan dengan kelainan di katup jantung adalah:\n- Tricuspid atresia, terjadi ketika katup di antara serambi kanan dan bilik kanan tidak terbentuk dengan sempurna\n- Pulmonary atresia, terjadi ketika ada gangguan di katup antara bilik kanan dan paru-paru sehingga darah tidak dapat mengalir ke paru-paru\n- Stenosis katup aorta, terjadi ketika katup antara bilik kiri dan aorta tidak terbentuk sempurna dan menyempit sehingga jantung sulit memompa darah\nKelainan di dinding pembatas atrium dan ventrikel bisa mengganggu fungsi jantung dalam memompa darah dan darah berkumpul di bagian yang tidak seharusnya.\nPenyakit jantung bawaan jenis ini, di antaranya:\n- Defek septum ventrikel dan defek septum atrium, yang terjadi ketika ada celah atau lubang di antara kedua bilik atau atrium jantung\n- Tetralogy of Fallot, yang terjadi ketika ada kombinasi empat penyakit jantung bawaan saat lahir, seperti defek septum dan penyempitan (stenosis) katup pembuluh darah dari jantung ke paru-paru (arteri pulmonalis)\nPenyakit jantung bawaan ini terjadi di arteri dan vena dari dan ke jantung. Kondisi ini menyebabkan aliran darah dari dan menuju jantung terhambat.\nBeberapa penyakit jantung bawaan jenis ini adalah:\n- Patent ductus arteriosus (PDA), yang terjadi ketika ada celah atau lubang di pembuluh darah aorta yang membawa darah dari jantung ke seluruh tubuh\n- Transposisi arteri besar (TAB), yang terjadi ketika posisi arteri pulmonalis dan aorta terbalik\n- Truncus arteriosus, yang terjadi ketika proses pemisahan aorta dan arteri paru-paru tidak terjadi secara sempurna\n- Koarktasio aorta, yang terjadi ketika aorta menyempit\nSelain tiga jenis di atas, penyakit jantung bawaan juga dapat dibagi menjadi dua kategori, yaitu sianotik dan asianotik. Sianotik menyebabkan rendahnya kadar oksigen dalam darah, yang ditandai dengan semburat biru di kulit dan kesulitan bernapas. Sementara asianotik umumnya tidak menimbulkan gejala tersebut.\n']","Beberapa kondisi atau faktor risiko yang dapat meningkatkan faktor risiko penyakit jantung bawaan (PJB) pada bayi termasuk:\n\n1. Riwayat keluarga dengan riwayat PJB atau kelainan genetik, seperti sindrom Down atau sindrom Edward.\n2. Mengalami diabetes tipe 1 atau 2 yang tidak terkontrol pada ibu hamil.\n3. Menderita penyakit autoimun, seperti sindrom Sjögren.\n4. Mengonsumsi alkohol secara berlebihan atau merokok saat hamil.\n5. Mengalami infeksi virus, seperti rubella, pada trimester pertama kehamilan.\n6. Mengonsaputi obat-obatan tertentu selama masa kehamilan tanpa resep dokter, contohnya obat antikejang, antijerawat golongan retinoid, dan statin.\n7. Terpapar pelarut organik yang umumnya ditemukan dalam produk cat tembok, cat kuku, atau lem.\n8. Mengalami penyakit tertentu yang dapat diturunkan dari orang tua ke anaknya, misalnya fenilketonuria.",1.0,0.5868801943999573,0.99999999995,1.0
Apa saja komplikasi yang diakibatkan oleh penyakit jantung bawaan?,"Penyakit jantung bawaan dapat menyebabkan sejumlah komplikasi, seperti:\n\nEndokarditis\nGangguan irama jantung atau aritmia\nGagal jantung\nHipertensi pulmonal\nInfeksi saluran pernapasan, seperti pneumonia\nPenggumpalan darah dan stroke\nGangguan pertumbuhan (stunting)\nGangguan belajar","['Topik: Penyakit Jantung Bawaan, Subtopik: Komplikasi Penyakit Jantung Bawaan \n Penyakit jantung bawaan dapat menyebabkan sejumlah komplikasi, seperti:\n- Endokarditis\n- Gangguan irama jantung atau aritmia\n- Gagal jantung\n- Hipertensi pulmonal\n- Infeksi saluran pernapasan, seperti pneumonia\n- Penggumpalan darah dan stroke\n\n- Gangguan pertumbuhan (stunting)\n- Gangguan belajar\n', 'Topik: Penyakit Jantung Bawaan, Subtopik: Penyebab Penyakit Jantung Bawaan \n Penyakit jantung bawaan (PJB) terjadi akibat gangguan pada proses pembentukan dan perkembangan jantung janin.\nJantung manusia terbagi menjadi empat ruang, yaitu dua serambi (atrium) dan dua bilik (ventrikel), masing-masing di sisi kanan dan kiri. Atrium kanan berfungsi untuk menerima darah kotor dari seluruh tubuh.\nDarah yang masuk ke atrium kanan akan dipompa ke ventrikel kanan, lalu dipompa menuju paru-paru untuk diisi oksigen. Darah yang kaya oksigen ini lalu kemudian kembali ke jantung melalui atrium kiri. Selanjutnya, darah tersebut akan masuk ke ventrikel kiri, untuk kemudian dipompa ke seluruh tubuh melalui aorta.\nPada penderita PJB, siklus dan aliran darah tersebut bisa terganggu. Kondisi ini dapat terjadi akibat gangguan di katup, ruang jantung, dinding penyekat di antara ruang jantung (septum), atau pembuluh darah dari dan menuju jantung.\nPenyebab terjadinya kelainan struktur jantung selama proses pembentukan organ jantung pada janin belum diketahui secara pasti. Namun, sejumlah kondisi pada ibu hamil bisa meningkatkan risiko terjadinya penyakit jantung bawaan pada bayi, yaitu:\n- Memiliki keluarga dengan riwayat penyakit jantung bawaan atau kelainan genetik, seperti sindrom Down atau sindrom Edward\n\n- Menderita diabetes tipe 1 atau 2 yang tidak terkontrol\n- Menderita penyakit autoimun, seperti sindrom Sj gren\n\n- Mengonsumsi alkohol secara berlebihan atau merokok saat hamil\n- Menderita infeksi virus, seperti rubella, pada trimester pertama kehamilan\n- Mengonsumsi obat-obatan tertentu selama hamil, seperti obat antikejang, obat antijerawat golongan retinoid, dan obat golongan statin, tanpa resep dokter\n- Terpapar pelarut organik yang umumnya ditemukan dalam produk cat tembok, cat kuku, atau lem\n- Menderita penyakit tertentu yang dapat diturunkan dari orang tua ke anaknya, misalnya fenilketonuria\n\n', 'Topik: Penyakit Jantung Bawaan, Subtopik: Pengobatan Penyakit Jantung Bawaan: Implan alat pacu jantung dan kejut jantung (ICD) \n Pemasangan alat pacu jantung dan ICD (implantable cardioverter-defibrillator) dapat dilakukan untuk membantu jantung berdetak lebih teratur. Metode ini bisa mencegah komplikasi akibat kelainan jantung bawaan.\nKateterisasi dilakukan untuk memperbaiki kelainan jantung tanpa perlu melakukan operasi. Pada prosedur ini, selang tipis dan lentur (kateter) akan dimasukkan melalui pembuluh darah di tungkai pasien menuju jantung dengan bantuan pemindaian gambar, yaitu foto Rontgen dan CT scan.\nSetelah kateter berada di posisi yang tepat, sebuah alat kecil akan dimasukkan melalui kateter untuk mengatasi kelainan atau cacat jantung. Kateterisasi jantung bisa dilakukan dengan prosedur angioplasti dan perbaikan katup jantung (valvuloplasti).\nJenis-jenis penyakit jantung bawaan yang dapat ditangani dengan kateterisasi jantung adalah stenosis katup aorta, defek septum, dan transposisi arteri besar.\nOperasi jantung bisa dilakukan bila kateterisasi jantung tidak efektif mengatasi penyakit jantung bawaan. Operasi bertujuan untuk menambal atau menjahit lubang di jantung, memperbaiki atau mengganti katup jantung, dan melebarkan pembuluh darah.\nCABG (coronary artery bypass grafting) adalah salah satu contoh prosedur bedah jantung. Beberapa jenis penyakit jantung bawaan yang dapat ditangani dengan operasi jantung adalah koarktasio aorta dan Tetralogy of Fallot.\nJika kelainan jantung tidak bisa diperbaiki dengan obat-obatan atau metode pengobatan lain, transplantasi jantung dapat menjadi pilihan penanganan terakhir.\nTransplantasi jantung merupakan prosedur pengangkatan jantung yang sudah tidak bekerja secara optimal, untuk kemudian digantikan dengan jantung yang sehat dari pendonor.\nSetelah pasien penyakit jantung bawaan menjalani pengobatan, pemeriksaan rutin ke dokter tetap perlu dilakukan. Hal ini karena penyakit ini berpotensi terjadi kembali di kemudian hari. Selain itu, fungsi jantung juga dapat menurun seiring pertambahan usia.\nUntuk menjaga kondisi jantung agar tetap sehat, pasien disarankan untuk rutin berolahraga. Jenis olahraga yang disarankan adalah yang berintensitas ringan, seperti berjalan atau berenang.\n']","Berdasarkan konteks yang diberikan, komplikasi yang diakibatkan oleh penyakit jantung bawaan meliputi:\n\n1. Endokarditis - Infeksi pada endokard (lapisan di dalam jantung) yang dapat menyebabkan cedera pada jantung dan mengancam nyawa pasien.\n2. Gangguan irama jantung atau aritmia - Ketidaknormalan ritme jantung yang bisa meningkatkan resiko stroke, hipertensi pulmonal, gagal jantung, infeksi saluran pernapasan, dan gangguan pertumbuhan (stunting).\n3. Gagal jantung - Kondisi dimana jantung tidak dapat membersihkan darah dari penyakit atau kekurangan oksigen yang memerlukan pasien untuk mendapat bantuan medis seperti pengganti jantung, transplantasi hati, atau hemodialisis.\n4. Hipertensi pulmonal - Tekanan darah tinggi di paru-paru yang mengurangi kapasitas paru dan dapat menyebabkan cedera jantung besar.\n5. Infeksi saluran pernapasan, seperti pneumonia - Pneumonia adalah infeksi paru yang bisa meningkatkan resiko gagal jantung karena mengganggu fungsi paru pasien.\n6. Penggumpalan darah dan stroke - Gejala ini dapat terjadi akibat penyebab lain seperti alis, diabetes tipe 2 atau infeksi virus yang tidak diobati.\n7. Gangguan pertumbuhan (stunting) - Kondisi dimana bayi tumbuh kurang dari umur usia normal karena gangguan jantung bawaan.\n8. Gangguan belajar - Kemampuan belajar pasien yang terpengaruh oleh penyakitan ini bisa menjadi rendah sehingga mereka butuh dukungan pendidikan tambahan untuk mengatasi masalah ini.",0.20833333333333334,0.5992452113056279,0.9999999999666667,1.0
Apa saja faktor yang dapat meningkatkan risiko terkena penyakit koarktasio aorta?,"Beberapa faktor yang dapat meningkatkan risiko bayi menderita koarktasio aorta adalah:\n\nMemilliki penyakit jantung bawaan lain, seperti patent ductus arteriosus, arterial septal defect, defek septum ventrikel, atau penyakit katup jantung\nMenderita kelainan genetik, seperti sindrom Turner \nSelain itu, risiko bayi mengalami penyakit jantung bawaan juga meningkat jika ibu hamil merokok, mengonsumsi obat, seperti obat antikejang, menderita lupus, atau menderita diabetes yang tidak terkontrol.","['Topik: Koarktasio Aorta, Subtopik: Faktor risiko koarktasio aorta \n Beberapa faktor yang dapat meningkatkan risiko bayi menderita koarktasio aorta adalah:\n- Memilliki penyakit jantung bawaan lain, seperti patent ductus arteriosus, arterial septal defect, defek septum ventrikel, atau penyakit katup jantung\n\n- Menderita kelainan genetik, seperti sindrom Turner \n\nSelain itu, risiko bayi mengalami penyakit jantung bawaan juga meningkat jika ibu hamil merokok, mengonsumsi obat, seperti obat antikejang, menderita lupus, atau menderita diabetes yang tidak terkontrol.\n', 'Topik: Koarktasio Aorta, Subtopik: Penyebab Koarktasio Aorta \n Koartasio aorta adalah salah satu jenis penyakit jantung bawaan. Pada sebagian besar kasus, penyebab terjadinya koarktasio aorta belum dapat dipastikan. Kondisi ini diduga berkaitan dengan kombinasi faktor genetik dan lingkungan,  termasuk paparan bahan kimia atau obat-obatan selama kehamilan. Koarktasio aorta bisa terjadi bersamaan dengan penyakit jantung bawaan lainnya.\nKondisi ini paling sering ditemukan pada bayi. Namun, koarktasio aorta juga dapat terjadi pada usia dewasa. Koartasio aorta pada orang dewasa biasanya disebabkan arteritis Takayasu dan aterosklerosis.\nKoarktasio aorta sering terjadi pada cabang aorta yang akan mengalirkan darah ke kepala, leher, atau bagian atas tubuh, dan dekat ductus arteriosus (bagian pembuluh darah janin yang menghubungkan aorta dengan arteri pulmonal).\nPenyempitan aorta di bagian ini akan menyebabkan tekanan darah di lengan cenderung lebih tinggi dibandingkan tekanan darah di tungkai dan pergelangan kaki.\n', 'Topik: Koarktasio Aorta, Subtopik: Komplikasi Koarktasio Aorta \n Komplikasi yang dapat terjadi pada penderita koarktasio aorta adalah:\n- Hipertensi\n- Hipertrofi ventrikel kiri\n- Stroke \n- Aneurisma aorta\n- Diseksi atau robeknya aorta \n- Aneurisma otak\n- Gagal jantung \n- Penyakit jantung koroner pada usia muda\n\n- Penyakit ginjal\n- Endokartitis\n']","Berikut adalah beberapa faktor yang dapat meningkatkan risiko terjadinya koarktasio aorta, selain yang sudah disebut dalam konteks yang diberikan:\n\n1. Keadaan genetika atau penyebab umum lainnya seperti sindrom Turner.\n2. Ibu hamil merokok, mengonsumsi obat, terutama antikejutan dan obat-obatan yang dapat berbahaya untuk janin.\n3. Menderita penyakit jantung bawaan lainnya seperti patent ductus arteriosus, arterial septal defect, defek septum ventrikel, atau penyakit katup jantung.\n4. Mengkonsumsi obat antikejang saat hamil, yang dapat meningkatkan risiko timbulnya koarktasio aorta pada janin.\n5. Menderita penyakit lupus atau diabetes yang tidak terkontrol selama kehamilan.\n6. Paparan lingkungan khususnya bahan kimia atau obat-obatan yang dapat menyebabkan mutasi pada janin dan meningkatkan risiko timbulnya penyakit jantung.",1.0,0.6303339937143163,0.99999999995,1.0
Apa saja gejala yang menandakan penyakit koarktasio aorta?,"Gejala koarktasio aorta bervariasi, sesuai dengan tingkat keparahan penyempitan aorta yang terjadi. Pada koarktasio aorta yang ringan, gejala bisa baru muncul setelah anak menjadi remaja atau dewasa. Beberapa gejala yang bisa muncul adalah: \n\nHipertensi \nSakit kepala\nOtot lemah\nNyeri dada\nSesak napas\nKram tungkai\nKaki terasa dingin\n\nSedangkan pada kasus koarktasio aorta yang parah, gejala dapat muncul sesaat setelah bayi lahir atau beberapa bulan setelah kelahiran. Gejala koarktasio aorta pada bayi berupa: \n\nKesulitan bernapas\nKesulitan untuk menyusu\nKulit terlihat pucat \nSangat berkeringat\nBayi tampak gelisah","['Topik: Koarktasio Aorta, Subtopik: Gejala Koarktasio Aorta \n Gejala koarktasio aorta bervariasi, sesuai dengan tingkat keparahan penyempitan aorta yang terjadi. Pada koarktasio aorta yang ringan, gejala bisa baru muncul setelah anak menjadi remaja atau dewasa. Beberapa gejala yang bisa muncul adalah: \n- Hipertensi \n\n- Sakit kepala\n- Otot lemah\n- Nyeri dada\n- Sesak napas\n- Kram tungkai\n- Kaki terasa dingin\nSedangkan pada kasus koarktasio aorta yang parah, gejala dapat muncul sesaat setelah bayi lahir atau beberapa bulan setelah kelahiran. Gejala koarktasio aorta pada bayi berupa: \n- Kesulitan bernapas\n- Kesulitan untuk menyusu\n- Kulit terlihat pucat \n- Sangat berkeringat\n- Bayi tampak gelisah\n', 'Topik: Koarktasio Aorta, Subtopik: Gejala Koarktasio Aorta: Kapan harus ke dokter \n Segera pergi ke dokter atau IGD (instalasi gawat darurat) rumah sakit jika Anda atau anak Anda mengalami gejala berikut:\n- Nyeri dada berat\n- Lemas dan pingsan\n\n- Sesak napas dan sulit bernapas\n- Pucat \nWanita yang menderita koarktasio aorta dan berencana untuk hamil juga perlu mendiskusikan rencana kehamilannya dengan dokter untuk mencegah terjadinya komplikasi.\n', 'Topik: Koarktasio Aorta, Subtopik: Diagnosis Koarktasio Aorta \n Dokter akan melakukan tanya jawab seputar keluhan dan riwayat kesehatan pasien, baik kepada keluarga maupun langsung kepada pasien. Setelah itu, dokter akan melakukan pemeriksaan dada dan jantung. \nSaat pemeriksaan, dokter mungkin akan menemukan adanya suara bising jantung dan perbedaan tekanan darah pada lengan dengan tungkai. Hal-hal tersebut bisa menjadi penanda terjadinya koarktasio aorta. \nUntuk memastikan diagnosis, dokter akan melakukan pemeriksaan penunjang di bawah ini: \n- Elektrokardiogram (EKG), untuk melihat aktivitas kelistrikan jantung sekaligus mendeteksi adanya hipertrofi ventrikel kiri\n\n- Ekokardiogram atau USG jantung, untuk mengetahui lokasi dan keparahan dari koarktasio aorta, sekaligus untuk melihat adanya gangguan jantung lain\n\n- Pemindaian dengan Rontgen dada, CT scan, dan MRI, untuk melihat lokasi, tingkat keparahan, dan efek dari koarktasio aorta terhadap jantung \n\n- Katerisasi jantung, untuk mengetahui penyempitan aorta yang terjadi \n\n']","Gejala-gejala yang bisa menunjukkan adanya penyakit koarktasio aorta termasuk pada kondisi anak, remaja, dewasa atau bahkan bayi dalam konteks ini adalah sebagai berikut:\n- Hipertensi (tinggi darah) yang bisa meningkat dengan tingkat keparahan penyempitan aorta.\n- Sakit dada dan lemas, terutama saat bergerak atau beresiko trauma fisik.\n- Otot lemah karena efek sosial pada jantung dalam memperlambat aliran darah yang bisa menyebabkan penyembuhan tidak sempurna dari infeksi bakteri di sumsum tulang atau luka lainnya.\n- Nyeri dada, sesak napas dan kram tungkai seperti gejala yang mungkin menandai tingkat keparahan penyempitan aorta.\n\nGejala ini bisa muncul pada koarktasio aorta ringan atau parah, bergantung pada tingkat keparahan penyempitan aorta tersebut. Gejala yang mungkin hanya dapat dideteksi setelah dilakukannya diagnosis khusus oleh dokter spesialis jantung dan kardiologis atau instalasi gawat darurat (IGD) di rumah sakit untuk menanggulangi komplikasi.",0.5555555555555556,0.6077946459266912,0.9999999999666667,1.0
Bagaimana prosedur yang dilakukan oleh dokter untuk pengobatan tamponade jantung?,"Untuk mengurangi tekanan di jantung, ada beberapa prosedur yang dapat dilakukan dokter, yaitu:\n\nPericardiocentesis (punksi perikardium)\nPericardiocentesis adalah prosedur yang dilakukan untuk mengeluarkan cairan dari ruang perikardium dengan menggunakan jarum.\nPericardiectomy\nPericardiectomy dilakukan dengan memotong dan menghilangkan sebagian perikardium yang melapisi jantung. Dengan begitu, tekanan di jantung akan berkurang.\nPericardiodesis\nPericardiodesis adalah pemberian obat-obatan langsung ke dalam rongga perikardium untuk menempelkan perikardium dengan otot jantung. Prosedur ini biasa dilakukan bila penumpukan cairan di ruang perikardium terjadi secara berulang.\nTorakotomi\nTorakotomi adalah prosedur bedah terbuka yang dilakukan dokter untuk mengeluarkan gumpalan darah pada tamponade jantung yang terjadi akibat cedera.","['Topik: Tamponade Jantung, Subtopik: Pengobatan Tamponade Jantung \n Tamponade jantung penting untuk segera didiagnosis dan ditangani agar risiko kematian akibat penyakit ini dapat berkurang. Pada dasarnya, tujuan pengobatan tamponade jantung adalah untuk meredakan tekanan di jantung dan menangani penyebab yang mendasarinya.\nSebagai langkah awal, dokter akan memberikan oksigen dan obat-obatan untuk meringankan beban kerja jantung dan meningkatkan tekanan darah. Pasien juga akan diminta untuk berbaring di ranjang dengan kaki disangga ke atas guna meningkatkan aliran balik darah ke jantung.\nUntuk mengurangi tekanan di jantung, ada beberapa prosedur yang dapat dilakukan dokter, yaitu:\n- Pericardiocentesis (punksi perikardium)\nPericardiocentesis adalah prosedur yang dilakukan untuk mengeluarkan cairan dari ruang perikardium dengan menggunakan jarum.\n- Pericardiectomy\nPericardiectomy dilakukan dengan memotong dan menghilangkan sebagian perikardium yang melapisi jantung. Dengan begitu, tekanan di jantung akan berkurang.\n- Pericardiodesis\nPericardiodesis adalah pemberian obat-obatan langsung ke dalam rongga perikardium untuk menempelkan perikardium dengan otot jantung. Prosedur ini biasa dilakukan bila penumpukan cairan di ruang perikardium terjadi secara berulang.\n- Torakotomi\nTorakotomi adalah prosedur bedah terbuka yang dilakukan dokter untuk mengeluarkan gumpalan darah pada tamponade jantung yang terjadi akibat cedera.\nSetelah tekanan di jantung dikurangi, dokter akan mencari tahu penyebab timbulnya tamponade jantung dan memberikan pengobatan terhadap penyebab tersebut.\n', 'Topik: Tamponade Jantung, Subtopik: Diagnosis Tamponade Jantung \n Dokter akan mengawali diagnosis tamponade jantung dengan menanyakan gejala yang dialami pasien dan riwayat kesehatannya. Setelah itu, dokter akan melakukan pemeriksaan fisik secara menyeluruh.\nTamponade jantung biasanya memiliki tiga tanda yang dapat dikenali oleh dokter. Tanda-tanda ini dikenal dengan istilah Beck  s triad. Tanda tersebut meliputi:\n- Tekanan darah rendah dan denyut nadi lemah karena volume darah yang dipompa jantung berkurang\n- Detak jantung cepat disertai suara jantung yang melemah akibat adanya timbunan cairan di dalam ruang perikardium\n- Pembuluh darah vena di leher menonjol karena kesulitan mengembalikan darah ke jantung\nDokter juga akan melakukan pemeriksaan lanjutan berikut ini untuk menunjang diagnosis:\n- Tes darah, untuk mendeteksi infeksi yang bisa menyebabkan perikarditis\n- Rontgen dada, untuk mendeteksi pembesaran di jantung\n- Elektrokardiografi, untuk memeriksa irama jantung pasien\n- Ekokardiografi, untuk mencari tahu apakah pembesaran perikardium dan pengempisan jantung diakibatkan oleh volume darah yang rendah\n- CT scan jantung, untuk memeriksa penimbunan cairan di ruang perikardium dan perubahan lain yang terjadi di jantung\n', 'Topik: Tamponade Jantung, Subtopik: Pencegahan Tamponade Jantung \n Tamponade jantung bisa disebabkan oleh beragam kondisi dan dapat kambuh. Oleh sebab itu, jika Anda memiliki riwayat tamponade jantung atau menderita penyakit yang dapat menyebabkan kondisi ini, lakukanlah pemeriksaan kesehatan ke dokter secara rutin.\nSelain itu, terdapat beberapa upaya yang dapat dilakukan untuk mengurangi risiko terkena penyakit yang dapat menyebabkan tamponade jantung, yaitu:\n- Mengonsumsi makanan yang menyehatkan jantung\n\n- Berolahraga secara rutin\n- Menjaga berat badan ideal\n- Menghindari konsumsi minuman beralkohol\n- Berhati-hati dalam berkendara untuk menghindari cedera dada\n- Berhenti merokok\n']","Prosedur pengobatan tamponade jantung melibatkan beberapa langkah utama, di antaranya:\n\n1. Mengurangi tekanan jantung: Langkah pertama adalah untuk mengurangi tekanan di dalam rongga perikardium yang dapat menyebabkan penumpukan cairan dan pengerutan jantung. Metode ini bisa dilakukan melalui prosedur seperti pericardiocentesis, pericardiectomy, pericardiodesis, atau torakotomi untuk menghapus cairan atau mengeluarkan gumpalan darah yang menyebabkan penumpukan.\n\n2. Menggunakan obat-obatan: Sebagai langkah awal, pasien diberikan oksigen dan obat-obatan untuk menurunkan beban kerja jantung dan menaikkan tekanan darah. Obat ini bisa berupa antihipertensi atau bronkodilator yang membantu mengembangkan pembuluh darah perifer, sehingga menyebabkan aliran balik darah ke jantung meningkat.\n\n3. Mengeksplorasi penyebab: Setelah tekanan di jantung terkurangi dan pasien dalam kondisi stabil, dokter akan mencari tahu penyebab timbulnya tamponade jantung. Pemeriksaan lanjutan yang termasuk ke dalam prosedur ini antara lain tes darah untuk mendeteksi infeksi, pemeriksaan radiologis seperti tomografi sumsum tulang untuk mengeksplorasi penyakit jantung atau cedera, dan ekokardiografi untuk menggambarkan struktur jantung.\n\n4. Mengobati penyebab: Setelah menyelidiki penyebab tamponade jantung, dokter akan memberikan pengobatan terhadap penyebab yang ditemukan, seperti obat untuk mengurangi inflamasi atau infeksi, serta menjaga kondisi fisiologis pasien agar stabil.\n\nDengan demikian, prosedur pengobatan tamponade jantung melibatkan langkah-langkah utama seperti memperkecil tekanan di dalam rongga perikardium, menggunakan obat untuk menstabilkan pasien, mencari tahu penyebab terjadinya tamponade, dan memberikan pengobatan terhadap penyebab yang ditemukan.",0.7368421052631579,0.6677804944740687,0.99999999995,1.0
Apa saja komplikasi yang mungkin terjadi pada penyakit tamponade jantung?,Komplikasi yang mungkin terjadi akibat tamponade jantung antara lain:\n\nSyok\nPerdarahan\nEdema paru\nGagal jantung\nKematian,"['Topik: Tamponade Jantung, Subtopik: Komplikasi Tamponade Jantung \n Komplikasi yang mungkin terjadi akibat tamponade jantung antara lain:\n- Syok\n- Perdarahan\n- Edema paru\n- Gagal jantung\n- Kematian\n', 'Topik: Tamponade Jantung, Subtopik: Pengertian Tamponade Jantung \n Tamponade jantung sering terjadi akibat tekanan yang berasal dari penumpukan cairan di dalam rongga perikardium, yaitu ruang antara otot dan selaput pelindung jantung. Cairan tersebut bisa darah atau nanah, yang jika menumpuk terlalu banyak dapat menghambat jantung untuk mengembang secara normal.\n\nTamponade jantung dapat menimbulkan gejala seperti kulit pucat, badan lemas, nyeri dada, dan jantung berdebar. Jika orang di sekitar Anda mengalami gejala tersebut, segera cari pertolongan medis agar tamponade jantung tidak menimbulkan komplikasi serius, seperti kerusakan organ, syok, atau kematian.\n', 'Topik: Tamponade Jantung, Subtopik: Pengertian Tamponade Jantung \n Tamponade jantung adalah kondisi terganggunya fungsi jantung dalam memompa darah akibat adanya tekanan yang kuat di jantung. Tamponade jantung merupakan kondisi gawat darurat yang membutuhkan penanganan medis secepatnya.\nTamponade jantung sering terjadi akibat tekanan yang berasal dari penumpukan cairan di dalam rongga perikardium, yaitu ruang antara otot dan selaput pelindung jantung. Cairan tersebut bisa darah atau nanah, yang jika menumpuk terlalu banyak dapat menghambat jantung untuk mengembang secara normal.\n\nTamponade jantung dapat menimbulkan gejala seperti kulit pucat, badan lemas, nyeri dada, dan jantung berdebar. Jika orang di sekitar Anda mengalami gejala tersebut, segera cari pertolongan medis agar tamponade jantung tidak menimbulkan komplikasi serius, seperti kerusakan organ, syok, atau kematian.\n']",Komplikasi yang mungkin terjadi akibat tamponade jantung antara lain:\n- Syok\n- Perdarahan\n- Edema paru\n- Gagal jantung\n- Kematian,1.0,0.7217025238036049,0.9999999999666667,1.0
Bagaimana pencegahan diseksi aorta?,"Diseksi aorta tidak dapat dicegah sepenuhnya, tetapi Anda dapat menurunkan risiko terserang penyakit ini dengan cara:\n\nMengontrol tekanan darah secara rutin\nMempertahankan berat badan ideal\nTidak merokok\nMenjaga pola makan dan menghindari makanan tinggi kolesterol\nMemakai sabuk pengaman ketika mengendarai mobil, untuk menghindari benturan ke dada\nBerkonsultasi dengan dokter mengenai kondisi kesehatan Anda dan keluarga, terutama bila ada riwayat penyakit atau kelainan pembuluh darah aorta","['Topik: Diseksi Aorta, Subtopik: Pencegahan Diseksi Aorta \n Diseksi aorta tidak dapat dicegah sepenuhnya, tetapi Anda dapat menurunkan risiko terserang penyakit ini dengan cara:\n- Mengontrol tekanan darah secara rutin\n- Mempertahankan berat badan ideal\n\n- Tidak merokok\n- Menjaga pola makan dan menghindari makanan tinggi kolesterol\n\n- Memakai sabuk pengaman ketika mengendarai mobil, untuk menghindari benturan ke dada\n- Berkonsultasi dengan dokter mengenai kondisi kesehatan Anda dan keluarga, terutama bila ada riwayat penyakit atau kelainan pembuluh darah aorta\n', 'Topik: Diseksi Aorta, Subtopik: Pengertian Diseksi Aorta \n Diseksi aorta adalah kondisi ketika lapisan dalam pembuluh darah aorta robek dan terpisah dari lapisan tengah dinding aorta. Terkadang, gejala diseksi aorta mirip dengan gejala penyakit lain, seperti penyakit jantung dan stroke. Jika tidak segera ditangani, kondisi ini dapat berakibat fatal.\nPembuluh aorta adalah pembuluh darah arteri terbesar di dalam tubuh yang berfungsi menerima darah kaya oksigen dari jantung. Darah kaya oksigen ini akan dialirkan ke seluruh tubuh melalui cabang-cabang arteri.\n\nJika aorta robek, darah akan bocor dan mengalir melalui sela-sela robekan tersebut sehingga membentuk saluran darah palsu di dinding aorta yang membuat lapisan dalam dan tengah aorta terpisah.\nDiseksi aorta terbagi menjadi tipe A dan tipe B. Pada tipe A, robekan terjadi di aorta bagian atas (ascending aorta). Sedangkan pada tipe B, robekan terjadi di aorta bagian bawah (descending aorta). Dua jenis diseksi aorta ini dapat meluas hingga ke perut, tetapi diseksi aorta tipe A umumnya lebih berbahaya daripada diseksi aorta tipe B.\n', 'Topik: Diseksi Aorta, Subtopik: Pengobatan Diseksi Aorta: Operasi \n Operasi dilakukan untuk mengangkat bagian aorta yang rusak dan menggantinya dengan bahan sintetis. Jika terjadi kebocoran di katup jantung, dokter juga akan melakukan operasi penggantian katup jantung.\nSetelah kondisi kembali normal, semua penderita diseksi aorta harus mengonsumsi obat-obatan seumur hidupnya untuk menurunkan tekanan di aorta dan menjaga kestabilan tekanan darah.\nObat-obatan yang dimaksud antara lain obat anthipertensi seperti obat penghambat beta atau antagonis kalsium, obat angiotensin-converting enzyme (ACE) inhibitor, dan obat penurun kolesterol.\n']","Pencegahan diseksi aorta tidak dapat dijamin sepenuhnya, namun Anda dapat mengurangi risiko terkena penyakit ini melalui beberapa cara, antara lain:\n\n1. Mengontrol tekanan darah secara rutin: Kebanyakan kasus diseksi aorta dikarenakan faktor genetik dan gangguan pada arteri yang berkaitan dengan tekanan darah tinggi atau penyakit jantung. Oleh karena itu, mengontrol tekanan darah secara teratur dapat membantu mencegah pertumbuhan robekan aorta dan menghindari kecelaran diseksi.\n2. Mempertahankan berat badan ideal: Obesitas adalah faktor risiko utama dalam mengembangnya penyakit diseksi aorta, sehingga menjaga tubuh dalam pola makan yang sehat dan mempertahankan berat badan ideal dapat mencegah timbulnya diseksi aorta.\n3. Tidak merokok: Merokok secara signifikan mengurangi kesadaran darah, menyebabkan penyumbatan pembuluh darah dan meningkatkan risiko terkena penyakit jantung serta diseksi aorta. Mengingat dampak buruk rokok dalam hal ini, maka tidak merokok adalah salah satu cara untuk mencegah diseksi aorta.\n4. Menjaga pola makan dan menghindari makanan tinggi kolesterol: Mengkonsumsi makanan sehat dan mengurangi asupan lemak dalam diet dapat membantu mengurangi risiko timbulnya diseksi aorta, terutama jika Anda memiliki riwayat penyakit atau gangguan pada keluarga.\n5. Memakai sabuk pengaman ketika mengendarai mobil: Benturan yang berat dapat merugikan tubuh dan meningkatkan risiko terkena diseksi aorta, sehingga memakai sabuk pengaman saat mengendarai mobil atau naik-turun kendaraan adalah cara untuk mencegah cedera jantung yang parah.\n6. Berkonsultasi dengan dokter: Mengadakan pertemuan dengan dokter secara berkala dan memperhatikan riwayat penyakit atau gangguan pada keluarga adalah cara lain untuk mencegah diseksi aorta, terutama jika Anda mengalami gejala yang menunjukkan bahaya.\n\nDengan mematuhi cara-cara tersebut dan tetap hati-hati dalam mengelola kesehatan tubuh, risiko timbulnya diseksi aorta dapat diminimalisir sebagaian besar.",0.7142857142857143,0.6070938077625377,0.9999999999,1.0
Apa itu penyakit diseksi aorta?,"Diseksi aorta adalah kondisi ketika lapisan dalam pembuluh darah aorta robek dan terpisah dari lapisan tengah dinding aorta. Terkadang, gejala diseksi aorta mirip dengan gejala penyakit lain, seperti penyakit jantung dan stroke. Jika tidak segera ditangani, kondisi ini dapat berakibat fatal.","['Topik: Diseksi Aorta, Subtopik: Pengertian Diseksi Aorta \n Diseksi aorta adalah kondisi ketika lapisan dalam pembuluh darah aorta robek dan terpisah dari lapisan tengah dinding aorta. Terkadang, gejala diseksi aorta mirip dengan gejala penyakit lain, seperti penyakit jantung dan stroke. Jika tidak segera ditangani, kondisi ini dapat berakibat fatal.\nPembuluh aorta adalah pembuluh darah arteri terbesar di dalam tubuh yang berfungsi menerima darah kaya oksigen dari jantung. Darah kaya oksigen ini akan dialirkan ke seluruh tubuh melalui cabang-cabang arteri.\n\nJika aorta robek, darah akan bocor dan mengalir melalui sela-sela robekan tersebut sehingga membentuk saluran darah palsu di dinding aorta yang membuat lapisan dalam dan tengah aorta terpisah.\nDiseksi aorta terbagi menjadi tipe A dan tipe B. Pada tipe A, robekan terjadi di aorta bagian atas (ascending aorta). Sedangkan pada tipe B, robekan terjadi di aorta bagian bawah (descending aorta). Dua jenis diseksi aorta ini dapat meluas hingga ke perut, tetapi diseksi aorta tipe A umumnya lebih berbahaya daripada diseksi aorta tipe B.\n', 'Topik: Diseksi Aorta, Subtopik: Diagnosis Diseksi Aorta \n Diseksi aorta tidak mudah terdeteksi, karena penyakit ini menunjukkan gejala yang mirip dengan sejumlah kondisi medis lainnya.\nUntuk mendiagnosis diseksi aorta, dokter akan menanyakan gejala yang dialami pasien, serta riwayat pasien dan keluarga, Selanjutnya, dokter akan memeriksa detak jantung pasien menggunakan stetoskop dan mengukur tekanan darah di kedua lengan pasien.\nDokter dapat mencurigai pasien terkena diseksi aorta bila terdapat tekanan darah di kedua lengan pasien berbeda. Namun, untuk lebih memastikan diagnosis, dokter akan melakukan pemeriksaan penunjang, seperti:\n- Foto Rontgen dada, untuk melihat apakah terdapat pelebaran aorta\n- Ekokardiografi transesofageal (transesophageal echocardiogram), untuk melihat gambaran jantung\n- CT scan, untuk melihat kondisi jantung, aorta, dan pembuluh darah lain secara lebih jelas dengan menggunakan zat kontras\n- Magnetic resonance angiogram (MRA), untuk melihat aliran darah di aorta\n', 'Topik: Diseksi Aorta, Subtopik: Pengertian Diseksi Aorta \n Pembuluh aorta adalah pembuluh darah arteri terbesar di dalam tubuh yang berfungsi menerima darah kaya oksigen dari jantung. Darah kaya oksigen ini akan dialirkan ke seluruh tubuh melalui cabang-cabang arteri.\n\nJika aorta robek, darah akan bocor dan mengalir melalui sela-sela robekan tersebut sehingga membentuk saluran darah palsu di dinding aorta yang membuat lapisan dalam dan tengah aorta terpisah.\nDiseksi aorta terbagi menjadi tipe A dan tipe B. Pada tipe A, robekan terjadi di aorta bagian atas (ascending aorta). Sedangkan pada tipe B, robekan terjadi di aorta bagian bawah (descending aorta). Dua jenis diseksi aorta ini dapat meluas hingga ke perut, tetapi diseksi aorta tipe A umumnya lebih berbahaya daripada diseksi aorta tipe B.\n']","Penyakit diseksi aorta adalah kondisi medis di mana lapisan dalam pembuluh darah aorta robek dan terpisah dari lapisan tengah dinding aorta. Hal ini mengakibatkan darah bocor melalui sela-sela robekan, yang membentuk saluran darah palsu di dinding aorta. Disesuaikan dengan konteks yang diberikan, diseksi aorta terbagi menjadi tipe A dan tipe B; pada tipe A robekan terjadi di aorta bagian atas (ascending aorta), sementara pada tipe B robekan terjadi di aorta bagian bawah (descending aorta). Kedua jenis diseksi ini dapat meluas hingga ke perut, dan diseksi aorta tipe A umumnya lebih berbahaya daripada diseksi aorta tipe B.",1.0,0.5228383452982176,0.9999999999666667,1.0
Apa saja penyebab efusi perikardium?,"Penyebab efusi perikardium sangat bervariasi, antara lain:\n\nPeradangan pada perikardium (perikarditis), baik akibat penyakit maupun cedera\nKanker perikardium, kanker jantung, atau kanker yang menyebar dari paru-paru, kelenjar getah bening, atau payudara\nInfeksi yang disebabkan oleh bakteri, virus, jamur, atau parasit\nPenyakit autoimun, seperti rheumatoid arthritis, lupus, atau sindrom Sjögren\nHipotiroidisme\nGagal ginjal\nSerangan jantung\nEfek samping prosedur medis, seperti radioterapi, kemoterapi, atau operasi jantung\nEfek samping obat-obatan tertentu, seperti obat tekanan darah tinggi, obat tuberkulosis, dan obat antikejang","['Topik: Efusi Perikardium, Subtopik: Penyebab Efusi Perikardium \n Penyebab efusi perikardium sangat bervariasi, antara lain:\n- Peradangan pada perikardium (perikarditis), baik akibat penyakit maupun cedera\n\n- Kanker perikardium, kanker jantung, atau kanker yang menyebar dari paru-paru, kelenjar getah bening, atau payudara\n\n- Infeksi yang disebabkan oleh bakteri, virus, jamur, atau parasit\n- Penyakit autoimun, seperti rheumatoid arthritis, lupus, atau sindrom Sj gren\n\n- Hipotiroidisme\n- Gagal ginjal\n- Serangan jantung\n- Efek samping prosedur medis, seperti radioterapi, kemoterapi, atau operasi jantung\n\n- Efek samping obat-obatan tertentu, seperti obat tekanan darah tinggi, obat tuberkulosis, dan obat antikejang\n\nMeski ada banyak kondisi atau penyakit yang dapat menyebabkan efusi perikardium, tidak sedikit pula kejadian efusi perikardium yang tidak diketahui penyebabnya. Hal ini disebut dengan idiopathic pericardial effusion. \n', 'Topik: Efusi Perikardium, Subtopik: Pencegahan Efusi Perikardium \n Pada sebagian besar kasus, efusi perikardium tidak dapat dicegah. Namun, Anda bisa mengurangi risiko terkena penyakit yang dapat menyebabkan efusi perikardium, seperti infeksi, gagal ginjal, dan serangan jantung. Caranya adalah sebagai berikut:\n- Menjalani pola hidup sehat, seperti mengonsumsi makanan bergizi seimbang, menjaga berat badan ideal, dan berolahraga secara rutin\n- Mengonsumsi obat sesuai aturan pakai atau terlebih dahulu berkonsultasi online dengan dokter\n\n- Melakukan pemeriksaan kesehatan ke dokter secara berkala jika menderita penyakit kronis, seperti penyakit autoimun, diabetes, atau hipertensi\n', 'Topik: Efusi Perikardium, Subtopik: Pengertian Efusi Perikardium \n Perikardium terdiri dari dua lapisan tipis yang menyelubungi jantung. Satu lapis menempel pada jantung dan satu lapis yang lain membatasi jantung dari organ sekitarnya. Di antara kedua lapisan ini terdapat celah kecil berisi cairan yang berfungsi untuk melumasi jantung agar dapat berdenyut atau memompa darah dengan mudah.\n\nEfusi perikardium terjadi ketika kadar cairan di antara ruang perikardium melebihi jumlah normalnya. Pada efusi perikardium, kadar cairan bisa sebanyak 100 mililiter hingga lebih dari 2 liter, padahal normalnya, cairan tersebut hanya sebanyak 2  3 sendok makan.\n']","Penyebab efusi perikardium sangat bervariasi, antara lain:\n- Peradangan pada perikardium (perikarditis), baik akibat penyakit maupun cedera\n- Kanker perikardium, kanker jantung, atau kanker yang menyebar dari paru-paru, kelenjar getah bening, atau payudara\n- Infeksi yang disebabkan oleh bakteri, virus, jamur, atau parasit\n- Penyakit autoimun, seperti rheumatoid arthritis, lupus, atau sindrom Sjögren\n- Hipotiroidisme\n- Gagal ginjal\n- Serangan jantung\n- Efek samping prosedur medis, seperti radioterapi, kemoterapi, atau operasi jantung\n- Efek samping obat-obatan tertentu, seperti obat tekanan darah tinggi, obat tuberkulosis, dan obat antikejang",1.0,0.6671297339884634,0.99999999995,1.0
Apa saja obat untuk menyembuhkan efusi perikardium?,"Obat-obatan yang diberikan dapat berupa:\n\nAspirin\nObat antiinflamasi nonsteroid (OAINS), misalnya ibuprofen\nKortikosteroid, seperti prednisone\nColchicine","['Topik: Efusi Perikardium, Subtopik: Pengobatan Efusi Perikardium: Pemberian obat-obatan \n Dokter akan meresepkan obat untuk mengurangi peradangan pada perikardium jika pasien tidak berisiko mengalami tamponade jantung. Obat-obatan yang diberikan dapat berupa:\n- Aspirin\n- Obat antiinflamasi nonsteroid (OAINS), misalnya ibuprofen\n- Kortikosteroid, seperti prednisone\n\n- Colchicine\n', 'Topik: Efusi Perikardium, Subtopik: Pengobatan Efusi Perikardium: Tindakan medis \n Dokter akan melakukan prosedur medis jika obat-obatan tidak efektif dan bila pasien menderita atau berisiko terserang tamponade jantung. Beberapa prosedur tersebut adalah:\n- Perikardiosentesis, dengan memasang kateter selama beberapa hari, untuk mengeluarkan cairan yang menumpuk di perikardium\n- Operasi jantung terbuka (open-heart surgery), untuk mengeluarkan darah atau cairan dari perikardium, memperbaiki kerusakan di perikardium, dan terkadang memasang selang dari rongga perikardium ke rongga perut supaya cairan bisa mengalir ke area tersebut kemudian terserap\n\n- Perikardiotomi balon perkutan, untuk membuat lubang drainase pada perikardium yang kemudian dibesarkan dengan balon, menggunakan metode kateterisasi\n\n- Perikardiektomi, untuk mengangkat sebagian atau keseluruhan perikardium, bagi pasien yang sudah mengalami efusi perikardium berkali-kali meski sudah ditangani dengan metode lain\n', 'Topik: Efusi Perikardium, Subtopik: Pencegahan Efusi Perikardium \n Pada sebagian besar kasus, efusi perikardium tidak dapat dicegah. Namun, Anda bisa mengurangi risiko terkena penyakit yang dapat menyebabkan efusi perikardium, seperti infeksi, gagal ginjal, dan serangan jantung. Caranya adalah sebagai berikut:\n- Menjalani pola hidup sehat, seperti mengonsumsi makanan bergizi seimbang, menjaga berat badan ideal, dan berolahraga secara rutin\n- Mengonsumsi obat sesuai aturan pakai atau terlebih dahulu berkonsultasi online dengan dokter\n\n- Melakukan pemeriksaan kesehatan ke dokter secara berkala jika menderita penyakit kronis, seperti penyakit autoimun, diabetes, atau hipertensi\n']","Obat-obatan yang umum digunakan untuk mengurangi efusi perikardium termasuk aspirin, obat antiinflamasi nonsteroid (OAINS) seperti ibuprofen, dan kortikosteroid seperti prednisone. Selain itu, colchicine juga sering diberikan sebagai pilihan medis untuk mengurangi peradangan pada perikardium.\n\nNamun, apabila obat-obatan tersebut tidak efektif atau pasien berisiko mengalami tamponade jantung, dokter mungkin akan melakukan prosedur medis seperti:\n1. Perikardiosentesis, yaitu dengan memasang kateter selama beberapa hari untuk mengeluarkan cairan yang menumpuk di perikardium.\n2. Operasi jantung terbuka (open-heart surgery), digunakan untuk mengeluarkan darah atau cairan dari perikardium, memperbaiki kerusakan di perikardium, dan terkadang menambahkan selang dari rongga perikardium ke rongga perut supaya cairan bisa mengalir.\n3. Perikardiotomi balon perkutan, digunakan untuk membuat lubang drainase pada perikardium yang kemudian dibesarkan dengan balon, menggunakan metode kateterisasi.\n4. Perikardiektomi, yaitu prosedur untuk mengangkat sebagian atau seluruh perikardium bagi pasien yang sudah sering mengalami efusi perikardium meski sudah ditangani dengan metode lain.",1.0,0.6163513146633012,0.9999999999,1.0
Apa saja komplikasi yang dapat ditimbulkan penyakit jantung koroner?,"Penyakit jantung koroner jika tidak ditangani dengan baik dapat berujung ke serangan jantung hingga kematian. Selain itu, berkurangnya suplai darah menuju jantung dapat menyebabkan komplikasi lain, seperti:\n\nHipertensi pulmonal, yaitu kondisi ketika tekanan darah di paru-paru meningkat dan menyebabkan pertukaran oksigen tidak optimal\nKardiomiopati, yaitu kondisi ketika otot jantung mengalami kerusakan sehingga terlalu lemah untuk memompa darah\nGagal jantung, akibat kondisi jantung yang tidak cukup kuat untuk memompa darah sehingga suplai oksigen ke tubuh tidak optimal\nGangguan irama jantung (aritmia), ketika suplai darah ke jantung berkurang atau ada kerusakan di jaringan jantung yang memengaruhi impuls listrik jantung","['Topik: Penyakit Jantung Koroner, Subtopik: Komplikasi Penyakit Jantung Koroner \n Penyakit jantung koroner jika tidak ditangani dengan baik dapat berujung ke serangan jantung hingga kematian. Selain itu, berkurangnya suplai darah menuju jantung dapat menyebabkan komplikasi lain, seperti:\n- Hipertensi pulmonal, yaitu kondisi ketika tekanan darah di paru-paru meningkat dan menyebabkan pertukaran oksigen tidak optimal\n- Kardiomiopati, yaitu kondisi ketika otot jantung mengalami kerusakan sehingga terlalu lemah untuk memompa darah\n- Gagal jantung, akibat kondisi jantung yang tidak cukup kuat untuk memompa darah sehingga suplai oksigen ke tubuh tidak optimal\n- Gangguan irama jantung (aritmia), ketika suplai darah ke jantung berkurang atau ada kerusakan di jaringan jantung yang memengaruhi impuls listrik jantung\n', 'Topik: Penyakit Jantung Koroner, Subtopik: Penyebab Penyakit Jantung Koroner \n Penyakit jantung koroner paling sering disebabkan oleh penumpukan plak lemak (aterosklerosis) di dalam arteri koroner. Jika plak makin tebal, arteri koroner akan menyempit dan menjadi kaku. Akibatnya, pasokan darah ke jantung tidak optimal sehingga seseorang mengalami gejala penyakit jantung koroner.\nPada beberapa kasus, penyakit jantung koroner bisa terjadi karena gumpalan darah yang terbentuk untuk memperbaiki dinding pembuluh darah yang rusak. Kerusakan dinding pembuluh darah ini umumnya juga berkaitan dengan aterosklerosis.\nAda kondisi atau penyakit yang dapat meningkatkan risiko terjadinya aterosklerosis atau penggumpalan darah, antara lain:\n', 'Topik: Penyakit Jantung Koroner, Subtopik: Penyebab Penyakit Jantung Koroner: Pola makan tidak sehat \n Risiko penyakit jantung koroner bisa meningkat akibat pola makan yang tidak sehat, seperti mengonsumsi makanan tinggi gula dan tinggi garam, maupun mengandung lemak jenuh atau lemak trans.\nMengonsumsi makanan tinggi gula dapat meningkatkan risiko atau memperburuk diabetes pada penderitanya. Selain itu, konsumsi makanan tinggi garam bisa mengakibatkan hipertensi. Makanan dengan kandungan lemak jenuh dan lemak trans juga meningkatkan penumpukan plak lemak di dalam arteri koroner.\n']","Komplikasi yang berkaitan dengan penyakit jantung koroner, seperti yang dijelaskan dalem konteks tersebut, meliputi:\n\n1. Serangan Jantung (Angina Pectoris): Akibat kurangnya suplai darah ke jantung, seseorang dapat mengalami geme dan perasaan sesak di belakang leher, lengkungan dada, atau perut.\n2. Hipertensi Pulmonal: Ketika tekanan darah di paru-paru meningkat, ini bisa menyebabkan jantung bekerja lebih keras untuk memompa darah dan menggangu pertukaran oksigen dalam tubuh.\n3. Kardiomiopati: Otot jantung yang terlalu lemas atau kelelahan oleh kerusakan dapat menyebabkan fungsi jantung menjadi tidak normal, sehingga darah tidak bisa benar-benar dipompa keluar.\n4. Gagal Jantung: Ketika jantung tidak cukup kuat untuk memompa darah, suplai oksigen ke tubuh menjadi kurang optimal dan menyebabkan rasa gugatan atau lelah yang seringkali berlebihan.\n5. Gangguan Irara Jantung (Aritmia): Ketika suplai darah ke jantung berkurang atau ada kerusakan di jaringan jantung, impuls listrik jantung dapat terpengaruh sehingga frekuensi nadi menjadi tidak normal.\n6. Penyumbatan Pembuluh Darah (Thrombosis): Ketika terdapat gumpalan darah yang besar dan mengganggu aliran darah, ini bisa menyebabkan serangan jantung atau gangguan lain di jantung karena kurangnya suplai oksigen.\n7. Penyempitan Pembuluh Darah Lain (Peripheral Arterial Disease): Kerusakan pada arteri-arteri lain selain yang terkait dengan penumpukan plak lemak, seperti arteri perifer, juga bisa meningkatkan risiko terjadinya serangan jantung koroner.\n8. Penyumbatan Gastrointestinal (GI): Ketika darah mengalami penyempitan di bagian gastrointestinal, ini bisa menyebabkan fluktuasi gizi dan mual yang tidak nyaman atau bahkan gangguan pencernaan lainnya.",0.5652173913043478,0.5157204635535718,0.99999999995,1.0
Makanan apa yang tepat untuk mencegah penyakit jantung koroner?,"Makanan tinggi serat, seperti sayur dan buah. Selain itu, tingkatkan kadar kolesterol baik atau HDL dengan memperbanyak konsumsi makanan tinggi lemak tak jenuh. Jenis makanan ini antara lain minyak ikan, minyak zaitun, minyak biji bunga matahari, minyak sayur, serta alpukat dan kacang-kacangan.","['Topik: Penyakit Jantung Koroner, Subtopik: Pencegahan Penyakit Jantung Koroner: Mengonsumsi makanan sehat dan bergizi seimbang \n Perbanyaklah mengonsumsi makanan tinggi serat, seperti sayur dan buah. Selain itu, pastikan kadar garam pada makanan tidak lebih dari satu sendok teh sehari.\nHindari jenis makanan tinggi kolesterol. Makanan berkadar gula tinggi juga harus dihindari karena dapat meningkatkan risiko diabetes, yang merupakan salah satu faktor risiko penyakit jantung koroner.\nSebaliknya, tingkatkan kadar kolesterol baik atau HDL dengan memperbanyak konsumsi makanan tinggi lemak tak jenuh. Jenis makanan ini antara lain minyak ikan, minyak zaitun, minyak biji bunga matahari, minyak sayur, serta alpukat dan kacang-kacangan.\n', 'Topik: Penyakit Jantung Koroner, Subtopik: Pencegahan Penyakit Jantung Koroner: Berolahraga rutin \n Pola makan sehat yang dikombinasikan dengan olahraga rutin dapat menjaga berat badan ideal. Di samping itu, olahraga rutin dapat menurunkan kadar kolesterol dan menjaga tekanan darah tetap normal.\nLuangkan waktu untuk berolahraga setidaknya 150 menit dalam seminggu, misalnya dengan jogging, senam, atau renang. Namun, bagi orang yang berisiko terserang penyakit jantung koroner, diskusikan terlebih dahulu dengan dokter mengenai jenis dan durasi olahraga yang tepat.\n', 'Topik: Penyakit Jantung Koroner, Subtopik: Penyebab Penyakit Jantung Koroner: Pola makan tidak sehat \n Risiko penyakit jantung koroner bisa meningkat akibat pola makan yang tidak sehat, seperti mengonsumsi makanan tinggi gula dan tinggi garam, maupun mengandung lemak jenuh atau lemak trans.\nMengonsumsi makanan tinggi gula dapat meningkatkan risiko atau memperburuk diabetes pada penderitanya. Selain itu, konsumsi makanan tinggi garam bisa mengakibatkan hipertensi. Makanan dengan kandungan lemak jenuh dan lemak trans juga meningkatkan penumpukan plak lemak di dalam arteri koroner.\n']","Untuk mencegah penyakit jantung koroner, sehat dan bergizi seimbang adalah makanan berikut:\n\n1. Makanan tinggi serat, seperti sayur dan buah.\n2. Kadar garam pada makanan tidak lebih dari satu sendok teh sehari.\n3. Mengonsumsi jenis makanan tinggi kolesterol dan gula harus dihindari.\n4. Tingkatkan kadar kolesterol baik atau HDL, misalnya dengan memperbanyak konsumsi makanan tinggi lemak tak jenuh seperti minyak ikan, minyak zaitun, dan minyak biji bunga matahari.\n5. Mengonsumsi alpukat dan kacang-kacangan yang kaya akan omega-3, yang dapat menurunkan risiko penyakit jantung koroner.",0.8571428571428571,0.5230832223147939,0.9999999999,1.0
Bagaimana cara pencegahan penyakit takikardia supraventrikular?,"Takikardia supraventrikular dapat dicegah dengan menerapkan pola hidup sehat, seperti:\n\nMenghindari konsumsi minuman beralkohol dan berkafein secara berlebihan\nBerhenti merokok\nMenghindari penggunaan NAPZA, terutama kokain dan amphetamine\nBeristirahat dan tidur yang cukup\nMengelola stres dengan baik\nSelalu mematuhi dosis dan aturan pakai saat mengonsumsi obat apa pun\nMengonsumsi makanan sehat bergizi lengkap dan seimbang\nMembatasi asupan garam dan lemak jenuh\nBerolahraga rutin, minimal 30 menit setiap hari","['Topik: Takikardia Supraventrikular, Subtopik: Pengobatan Takikardia Supraventrikular \n Pengobatan takikardia supraventrikular bertujuan untuk memperlambat denyut jantung dan mencegah kondisi yang lebih serius.\nPenderita takikardia supraventrikular umumnya tidak memerlukan pengobatan apa pun. Namun, dokter akan menyarankan beberapa tindakan berikut jika kondisi ini terjadi secara terus-menerus dalam jangka panjang:\n', 'Topik: Takikardia Supraventrikular, Subtopik: Penyebab Takikardia Supraventrikular \n Takikardia supraventrikular terjadi karena adanya gangguan pada sistem pacu listrik jantung. Hal ini membuat jantung berdetak dengan sangat cepat. Akibatnya, waktu yang dibutuhkan oleh jantung agar terisi darah sangat berkurang. Jika jantung tidak cukup terisi darah, aliran darah ke seluruh tubuh pun menjadi berkurang\nTakikardia supraventrikular dapat disebabkan oleh:\n- Penyakit paru-paru\n- Penyakit tiroid, terutama hipertiroidisme \n- Penyakit jantung\n- Penyakit jantung bawaan\n- Sindrom Wolf-Parkinson-White \nSelain itu, ada beberapa kondisi yang diduga dapat meningkatkan risiko seseorang mengalami takikardia supraventrikular, yaitu:\n- Usia 25 40 tahun\n- Kehamilan\n- Penyalahgunaan NAPZA, seperti kokain atau amphetamine \n- Penggunaan obat-obatan, seperti obat asma, alergi, atau flu\n- Konsumsi minuman berkafein dan beralkohol secara berlebihan\n- Kebiasaan merokok\n- Diabetes\n- Sleep apnea \n- Stres\n- Pernah menjalani operasi jantung\n', 'Topik: Takikardia Supraventrikular, Subtopik: Pengertian Takikardia Supraventrikular \n Takikardia supraventrikular adalah kondisi ketika jantung berdetak lebih cepat dari biasanya. Pada kasus yang parah, takikardia supraventrikular dapat menyebabkan henti jantung mendadak. Oleh karena itu, kondisi ini penting untuk diobati secara rutin.\nNormalnya, jantung berdetak sekitar 60 100 detak/menit. Namun, pada penderita takikardia supraventrikular, detak jantung bisa mencapai 150 220 detak/menit secara tiba-tiba. Kondisi ini dapat terjadi ketika penderitanya sedang berolahraga atau bahkan saat tidak melakukan aktivitas apa pun.\n\n']","Pencegahan takikardia supraventrikular melibatkan beberapa langkah sederhana tetapi penting. Hal-hal berikut diklaim oleh banyak sumber, termasuk The Mayo Clinic dan WebMD, sebagai cara alternatif untuk mencegah takikardia supraventrikular:\n\n1. Mengontrol Tekanan Darah: Menyusupi hipertiroidisme atau mengendalikan tekanan darah yang tinggi dapat membantu mengurangi risiko terkena takikardia supraventrikular, karena gangguan pada sistem pacu listrik jantung seringkali disebabkan oleh penyakit tiroid atau hipertiroidisme.\n\n2. Mengontrol Penyakit Jantung: Menjaga agar seluruh penyakit jantung seperti infark miokardium, arritmi, dan penyumbatan pembuluh darah dikendalikan dapat mencegah timbulnya takikardia supraventrikular.\n\n3. Menjaga Berat Badan: Menyusupi obesitas atau menurunkan berat badan yang tinggi juga bisa membantu mengurangi risiko terkena takikardia supraventrikular, karena obesitas seringkali diikuti oleh tekanan darah tinggi dan penyakit jantung.\n\n4. Mengontrol Stres: Menyusupi stres atau menurunkan beban stres dapat membantu mengurangi risiko terjadinya takikardia supraventrikular, karena stres seringkali berhubungan erat dengan arritmi jantung.\n\n5. Makan Sayuran Segar: Mengonsumsi diet rendah lemak dan tinggi serta mengandung banyak serat, seperti sayuran segar dan buah-buahan, bisa membantu mencegah takikardia supraventrikular karena dapat menurunkan risiko penyakit jantung.\n\n6. Minum Air: Mengonsumsi banyak air secara normal juga bisa membantu mengurangi risiko terkena takikardia supraventrikular, sebab penggunaan obat-obatan dan konsumsi cairan berlebihan seringkali diikuti oleh arritmi jantung.\n\n7. Tidur Dahak: Mengontrol penyakit sleep apnea juga penting untuk mencegah takikardia supraventrikular, karena obesitas yang disertai sleep apnea seringkali diikuti oleh arritmi jantung.\n\nSebaiknya, tidak hanya melihat konteks teks yang diberikan tetapi juga mengacu pada sumber-sumber ilmiah lain untuk menemukan cara terbaik dan alternatif untuk mencegah takikardia supraventrikular.",0.10526315789473684,0.6304812054195543,0.99999999995,0.4
Apa gejala penyakit takikardia supraventrikular pada bayi?,Bayi dengan takikardia supraventrikular dapat menunjukkan tanda-tanda berikut:\n\nTidak bisa atau sulit menyusu\nNapas cepat\nKulit pucat\nRewel\nMudah berkeringat,"['Topik: Takikardia Supraventrikular, Subtopik: Gejala Takikardia Supraventrikular \n Gejala utama takikardia supraventrikular adalah detak jantung yang cepat. Kondisi ini dapat terjadi secara mendadak dan berlangsung dalam hitungan menit atau bahkan hari.\nSelain detak jantung yang sangat cepat, penderita takikardia supraventrikular juga mengalami gejala berupa:\n- Pusing \n- Nyeri dada\n- Sesak napas\n- Sakit kepala ringan\n- Keringat dingin\n- Mudah lelah\n- Pingsan\n- Gelisah \nSementara itu, gejala takikardia supraventrikular pada bayi umumnya sulit dikenali. Namun, bayi dengan takikardia supraventrikular dapat menunjukkan tanda-tanda berikut:\n- Tidak bisa atau sulit menyusu\n- Napas cepat\n- Kulit pucat\n- Rewel\n- Mudah berkeringat \n', 'Topik: Takikardia Supraventrikular, Subtopik: Gejala Takikardia Supraventrikular: Kapan harus ke dokter \n Segera lakukan pemeriksaan ke dokter jika Anda atau anak Anda merasakan jantung yang berdebar cepat dan disertai dengan gejala di atas, atau jika detak jantung cepat ini berlangsung lebih dari beberapa menit.\n', 'Topik: Takikardia Supraventrikular, Subtopik: Penyebab Takikardia Supraventrikular \n Takikardia supraventrikular terjadi karena adanya gangguan pada sistem pacu listrik jantung. Hal ini membuat jantung berdetak dengan sangat cepat. Akibatnya, waktu yang dibutuhkan oleh jantung agar terisi darah sangat berkurang. Jika jantung tidak cukup terisi darah, aliran darah ke seluruh tubuh pun menjadi berkurang\nTakikardia supraventrikular dapat disebabkan oleh:\n- Penyakit paru-paru\n- Penyakit tiroid, terutama hipertiroidisme \n- Penyakit jantung\n- Penyakit jantung bawaan\n- Sindrom Wolf-Parkinson-White \nSelain itu, ada beberapa kondisi yang diduga dapat meningkatkan risiko seseorang mengalami takikardia supraventrikular, yaitu:\n- Usia 25 40 tahun\n- Kehamilan\n- Penyalahgunaan NAPZA, seperti kokain atau amphetamine \n- Penggunaan obat-obatan, seperti obat asma, alergi, atau flu\n- Konsumsi minuman berkafein dan beralkohol secara berlebihan\n- Kebiasaan merokok\n- Diabetes\n- Sleep apnea \n- Stres\n- Pernah menjalani operasi jantung\n']","Gejala takikardia supraventrikular pada bayi umumnya sulit dikenali dan bervariasi, tetapi dapat termasuk dalam tanda-tanda berikut:\n\n1. Tidak bisa atau sulit menyusu, yang dapat menunjukkan gangguan fungsi trakea atau lidah.\n2. Napas cepat dan dehidrasi karena aliran darah ke tubuh menurun sehingga membutuhkan pasokan oksigen lebih banyak untuk mengimbangi penyakit yang disebabkannya.\n3. Kulit pucat atau mudah berkeringat, yang dapat berhubungan dengan gangguan kardiovaskuler dan resiko dehidrasan.\n4. Rewel atau kehilangan berat badan secara mendadak tanpa alasan tertentu, yang juga terkait erat dengan gejala takikardia supraventrikular.\n5. Mudah lelah atau kurang aktif, karena jantung tidak mampu memenuhi kebutuhan oksigen tubuh secara efisien.",0.18181818181818182,0.6142884153701853,0.99999999995,1.0
Bagaimana cara mencegah penyakit jantung rematik?,"Beberapa upaya yang dapat dilakukan untuk mencegah penyakit jantung rematik adalah:\n\nMencuci tangan dengan sabun dan air mengalir, terutama sebelum mengolah makanan atau sebelum makan\nMenghindari penyebaran bakteri dengan tidak berbagi peralatan makan, handuk, dan sarung bantal\nMenutup mulut dan hidung saat bersin atau batuk\nMengonsumsi makanan bergizi lengkap seimbang\nMencukupi waktu tidur malam dan istirahat\nMenjalani pemeriksaan jantung dan mengonsumsi antibiotik bila memiliki riwayat demam rematik","['Topik: Penyakit Jantung Rematik, Subtopik: Pencegahan Penyakit Jantung Rematik \n Penyakit jantung reumatik dapat dicegah dengan menghindari berbagai faktor yang menyebabkan infeksi bakteri Streptococcus. Beberapa upaya yang dapat dilakukan untuk mencegah penyakit jantung rematik adalah:\n- Mencuci tangan dengan sabun dan air mengalir, terutama sebelum mengolah makanan atau sebelum makan\n- Menghindari penyebaran bakteri dengan tidak berbagi peralatan makan, handuk, dan sarung bantal\n- Menutup mulut dan hidung saat bersin atau batuk\n- Mengonsumsi makanan bergizi lengkap seimbang\n- Mencukupi waktu tidur malam dan istirahat\n- Menjalani pemeriksaan jantung dan mengonsumsi antibiotik bila memiliki riwayat demam rematik\n', 'Topik: Penyakit Jantung Rematik, Subtopik: Pengobatan Penyakit Jantung Rematik: Obat-obatan \n Dokter dapat meresepkan beberapa obat-obatan untuk menangani gejala penyakit jantung rematik dan mencegah perburukan kondisi pasien. Jenis obat-obatan yang dapat diberikan oleh dokter antara lain:\n- Antibiotik\nPemberian antibiotik harian dalam jangka panjang dilakukan untuk mengobati demam rematik pada anak-anak dan dewasa muda. Hal ini untuk mencegah kekambuhan atau komplikasi demam rematik.\n- Steroid\nSteroid diresepkan oleh dokter untuk meredakan peradangan pada jantung dan bagian tubuh lainnya.\n', 'Topik: Penyakit Jantung Rematik, Subtopik: Penyebab Penyakit Jantung Rematik \n Penyakit jantung rematik disebabkan oleh demam rematik yang tidak tertangani. Demam rematik sendiri dapat disebabkan oleh infeksi bakteri Streptococcus grup A, atau Streptococcus pyogenes (demam scarlet). Infeksi tersebut menyebabkan tubuh menghasilkan respons sistem kekebalan yang menyerang jantung.\nAda beberapa faktor yang diduga dapat meningkatkan risiko seseorang menderita penyakit jantung rematik, yaitu:\n- Tidak mendapatkan pengobatan infeksi Streptococcus secara tuntas, atau mengalami infeksi berulang\n- Tinggal di lingkungan yang padat dan kumuh\n- Sulit mendapatkan antibiotik\n- Jarang mencuci tangan, terutama setelah bersin, batuk, atau sebelum makan\n']","Untuk mencegah penyakit jantung rematik, berbagai upaya dapat dilakukan. Salah satu faktor utama yang menyebabkan infeksi bakteri Streptococcus adalah menghindari berbagai jenis kontak dengan makhluk hidup ini. Berikut cara-cara mencegah penyakit jantung rematik:\n\n1. Pencuci Tangan dan Kebersihan Makanan: Pastikan tangan bersih sebelum mengolah makanan, terlebih sebelum makan atau setelah bekerja di dapur. Gunakan sabun dan air mengalir untuk membersihkan tangan.\n2. Pencegahan Penyebaran Bakteri: Hindari penggunaan handuk yang telah digunakan oleh orang lain, serta tidak berbagi alat makan atau minuman secara langsung. Pastikan semua peralatan makan dan wadah bersih dan dibersihkan setiap kali digunakan.\n3. Penggunaan Masker: Ketika sakit, gunakan masker untuk menutup mulut dan hidung saat bersin atau batuk, sehingga bakteri tidak mudah masuk ke dalam tubuh.\n4. Makanan Bergizi Lengkap: Mengonsumsi makanan yang kaya akan protein, serta mengandung vitamin dan mineral untuk menjaga daya tahan tubuh tetap tinggi.\n5. Tidur dan Istirahat: Pastikan waktu tidur malam cukup dan selalu istirahat agar tubuh dapat memulihkan tenaganya.\n6. Pemeriksaan Jantung dan Obat-obatan: Bila memiliki riwayat demam rematik, periksa jantung secara berkala dan obati sesuai dokter. Jika terkena infeksi bakteri Streptococcus, konsumsi antibiotik yang diresepkan oleh dokter menjadi sangat penting untuk mencegah penyakit jantung rematik.",0.8076923076923077,0.5686432721823436,0.8333333332916666,1.0
Apa saja faktor yang dapat meningkatkan risiko seseorang menderita penyakit jantung rematik?,"Ada beberapa faktor yang diduga dapat meningkatkan risiko seseorang menderita penyakit jantung rematik, yaitu:\n\nTidak mendapatkan pengobatan infeksi Streptococcus secara tuntas, atau mengalami infeksi berulang\nTinggal di lingkungan yang padat dan kumuh\nSulit mendapatkan antibiotik\nJarang mencuci tangan, terutama setelah bersin, batuk, atau sebelum makan","['Topik: Penyakit Jantung Rematik, Subtopik: Penyebab Penyakit Jantung Rematik \n Penyakit jantung rematik disebabkan oleh demam rematik yang tidak tertangani. Demam rematik sendiri dapat disebabkan oleh infeksi bakteri Streptococcus grup A, atau Streptococcus pyogenes (demam scarlet). Infeksi tersebut menyebabkan tubuh menghasilkan respons sistem kekebalan yang menyerang jantung.\nAda beberapa faktor yang diduga dapat meningkatkan risiko seseorang menderita penyakit jantung rematik, yaitu:\n- Tidak mendapatkan pengobatan infeksi Streptococcus secara tuntas, atau mengalami infeksi berulang\n- Tinggal di lingkungan yang padat dan kumuh\n- Sulit mendapatkan antibiotik\n- Jarang mencuci tangan, terutama setelah bersin, batuk, atau sebelum makan\n', 'Topik: Penyakit Jantung Rematik, Subtopik: Pencegahan Penyakit Jantung Rematik \n Penyakit jantung reumatik dapat dicegah dengan menghindari berbagai faktor yang menyebabkan infeksi bakteri Streptococcus. Beberapa upaya yang dapat dilakukan untuk mencegah penyakit jantung rematik adalah:\n- Mencuci tangan dengan sabun dan air mengalir, terutama sebelum mengolah makanan atau sebelum makan\n- Menghindari penyebaran bakteri dengan tidak berbagi peralatan makan, handuk, dan sarung bantal\n- Menutup mulut dan hidung saat bersin atau batuk\n- Mengonsumsi makanan bergizi lengkap seimbang\n- Mencukupi waktu tidur malam dan istirahat\n- Menjalani pemeriksaan jantung dan mengonsumsi antibiotik bila memiliki riwayat demam rematik\n', 'Topik: Penyakit Jantung Rematik, Subtopik: Pengertian Penyakit Jantung Rematik \n Penyakit jantung rematik adalah kerusakan katup jantung akibat komplikasi dari demam rematik. Jika tidak segera mendapatkan penanganan, penyakit jantung rematik berisiko menyebabkan gagal jantung.\nDemam rematik adalah peradangan yang terjadi di berbagai organ tubuh, termasuk jantung. Jika tidak segera ditangani, demam rematik dapat menyebabkan penyempitan atau kebocoran pada katup jantung. Akibatnya, penderita bisa terkena penyakit jantung rematik.\n\nPenyakit jantung rematik bisa dialami oleh siapa saja. Namun, penyakit ini lebih sering menyerang anak-anak usia 5  15 tahun.\n']","Faktor-faktor yang dapat meningkatkan risiko seseorang menderita penyakit jantung rematik, berdasarkan konteks yang diberikan, adalah:\n\n1. Tidak mendapatkan pengobatan infeksi Streptococcus secara tuntas atau mengalami infeksi berulang: Jika penyembuhan primer tidak sempurna dan menyebabkan reinfeksi, risiko terkena penyakit jantung rematik meningkat.\n\n2. Tinggal di lingkungan yang padat dan kumuh: Lingkungan kotor dan kelembapan tinggi dapat memperburuk kondisi sanitasi tubuh, sehingga risiko terkena infeksi atau penyakit meningkat.\n\n3. Sulit mendapatkan antibiotik: Kemudahan akses obat-obatan dan alat bantu medis dalam suatu daerah dapat mempengaruhi lamanya waktu pemulihan pasien, yang kemungkinan besar akan meningkatkan risiko terkena penyakit jantung rematik.\n\n4. Jarang mencuci tangan, terutama setelah bersin, batuk, atau sebelum makan: Kesehatan publik dan sosial ekonomi juga mempengaruhi tingkat kebersihan individu, yang dapat berdampak pada risiko infeksi.\n\n5. Mengonsumsi makanan bergizi kurang: Makanan sehat adalah aspek penting dalam menjaga kondisi jantung dan sistem kekebalan tubuh. Kurangnya nutrisi dapat memperparah penyakit demam rematik dan kemudian menyebabkan penyakit jantung rematik.\n\n6. Mencukupi waktu tidur malam dan istirahat: Kualitas tidur yang baik adalah aspek penting dalam menjaga sistem kekebalan tubuh, sehingga ketidakmaksimalan tidur dapat memperparah penyakit demam rematik.\n\n7. Menjalani pemeriksaan jantung dan mengonsumsi antibiotik bila memiliki riwayat demam rematik: Pemantauan kondisi jantung seringkali diperlukan untuk mencegah terjadinya penyakit jantung rematik, sehingga tidak menjalani pemeriksaan dan obati secara tepat akan memperparah risiko.",0.5,0.5600027527669212,0.9999999999666667,1.0
Apa kelainan jantung yang diderita seseorang dengan torsade de pointes?,"Pada torsade de pointes, bilik jantung berdetak lebih cepat dan tidak selaras dengan denyut pada atrium. Perlu diketahui, denyut jantung manusia pada kondisi normal adalah 60−100 per menit. Sementara pada torsade de pointes, bilik jantung dapat berdenyut hingga 150–300 per menit.","['Topik: Torsade de Pointes, Subtopik: Pengertian Torsade de Pointes \n Torsade de pointes adalah kelainan jantung berupa kecepatan denyut pada bilik jantung (ventrikel) yang melebihi batas normal. Kondisi ini dapat disebabkan oleh kelainan bawaan atau efek samping obat-obatan. Jika tidak segera ditangani, torsade de pointes dapat menyebabkan henti jantung mendadak.\nJantung memiliki empat ruang utama yang dibagi menjadi dua, yaitu dua ruang bagian bawah (bilik jantung) dan dua ruang bagian atas (atrium). Kedua ruangan ini berfungsi untuk menerima dan memompa darah di jantung.\n\nPada torsade de pointes, bilik jantung berdetak lebih cepat dan tidak selaras dengan denyut pada atrium. Perlu diketahui, denyut jantung manusia pada kondisi normal adalah 60  100 per menit. Sementara pada torsade de pointes, bilik jantung dapat berdenyut hingga 150  300 per menit.\n', 'Topik: Torsade de Pointes, Subtopik: Pencegahan Torsade de Pointes \n Cara mencegah torsade de pointes adalah dengan menurunkan risiko terjadinya kondisi tersebut. Beberapa upaya yang dapat dilakukan adalah:\n- Hindari minum obat tanpa saran dari dokter.\n- Terapkan pola hidup yang sehat untuk menghindari serangan jantung.\n- Jaga kesehatan ginjal dengan minum air putih yang cukup, serta selalu jaga kadar gula darah.\n- Hentikan kebiasaan merokok.\n- Terapkan perilaku hidup bersih dan sehat (PHBS) untuk menghindari diare parah yang bisa mengakibatkan hipokalemia.\nSelain itu, ada beberapa langkah untuk menurunkan risiko terjadinya torsade de pointes yang disebabkan oleh kelainan jantung bawaan, yaitu:\n- Lakukan pemeriksaan jantung secara berkala jika menderita long QT syndrome atau memiliki keluarga dengan kondisi tersebut.\n- Konsultasikan dengan dokter sebelum melakukan aktivitas berat, seperti lari maraton.\n', 'Topik: Torsade de Pointes, Subtopik: Faktor risiko torsade de pointes \n Berikut ini adalah beberapa faktor yang dapat meningkatkan risiko seseorang mengalami torsade de pointes:\n- Berjenis kelamin wanita\n- Berusia di atas 65 tahun\n- Menderita penyakit jantung\n\n- Memiliki riwayat long QT syndrome dalam keluarga\n- Mengonsumsi diuretik\n\n- Mengalami denyut jantung yang melambat (bradikardia)\n- Memiliki kadar kalsium rendah (hipokalsemia), kadar magnesium rendah (hipomagnesemia), atau kadar kalium rendah (hipokalemia)\n- Menderita penyakit hati atau ginjal\n']","Kelainan jantung yang dikaitkan dengan torsade de pointes termasuk long QT syndrome. Long QT syndrome adalah penyakit genetik yang menyebabkan denyut jantung menjadi lebih panjang dan mempercepatnya, sehingga menggangu fungsi jantung serta dapat meningkatkan risiko terkena sesuatu hal yang berbahaya bagi jiwa.",0.16666666666666666,0.7025155824513126,0.9999999999,1.0
Apa saja komplikasi yang dapat ditimbulkan oleh penyakit torsade de pointes?,"Torsade de pointes merupakan kondisi gawat darurat. Jika tidak segera ditangani, torsade de pointes dapat menimbulkan beberapa komplikasi yang serius, yaitu:\n\nTakikardia ventrikel\nFibrilasi ventrikel\nHenti jantung mendadak\nKematian","['Topik: Torsade de Pointes, Subtopik: Komplikasi Torsade de Pointes \n Torsade de pointes merupakan kondisi gawat darurat. Jika tidak segera ditangani, torsade de pointes dapat menimbulkan beberapa komplikasi yang serius, yaitu:\n- Takikardia ventrikel\n- Fibrilasi ventrikel\n- Henti jantung mendadak\n- Kematian\n', 'Topik: Torsade de Pointes, Subtopik: Gejala Torsade de Pointes \n Pada sebagian kasus, torsade de pointes tidak menimbulkan gejala apa pun. Kondisi ini bisa timbul secara mendadak.\nGejala yang dapat timbul pada penderita meliputi:\n- Jantung berdebar (palpitasi) secara tiba-tiba\n- Pusing\n- Mual\n- Keringat dingin\n- Nyeri dada\n- Sesak napas\n- Rasa seperti akan pingsan\n- Penurunan kesadaran\nPada penderita long QT syndrome, gejala-gejala di atas dapat muncul karena dipicu oleh stres, rasa takut, atau aktivitas fisik yang berat.\n', 'Topik: Torsade de Pointes, Subtopik: Pengertian Torsade de Pointes \n Torsade de pointes adalah kelainan jantung berupa kecepatan denyut pada bilik jantung (ventrikel) yang melebihi batas normal. Kondisi ini dapat disebabkan oleh kelainan bawaan atau efek samping obat-obatan. Jika tidak segera ditangani, torsade de pointes dapat menyebabkan henti jantung mendadak.\nJantung memiliki empat ruang utama yang dibagi menjadi dua, yaitu dua ruang bagian bawah (bilik jantung) dan dua ruang bagian atas (atrium). Kedua ruangan ini berfungsi untuk menerima dan memompa darah di jantung.\n\nPada torsade de pointes, bilik jantung berdetak lebih cepat dan tidak selaras dengan denyut pada atrium. Perlu diketahui, denyut jantung manusia pada kondisi normal adalah 60  100 per menit. Sementara pada torsade de pointes, bilik jantung dapat berdenyut hingga 150  300 per menit.\n']","Dari konteks yang diberikan, komplikasi yang dapat ditimbulkan oleh penyakit Torsade de Pointes meliputi:\n\n1. Takikardia ventrikel: Kecepatan denyur jantung (denyut nadi) pada bilik ventrikel menjadi lebih cepat dari yang dianggap normal, menyebabkan aliran darah menjadi tidak merata dan mengganggu fungsi jantung.\n\n2. Fibrilasi ventrikel: Kehilangan kontrol ritme jantung, menyebabkan jantung berdenyut acak dan tak teratur, yang dapat membahayakan penderita secara drastis.\n\n3. Henti jantung mendadak (sudden cardiac arrest): Kemungkinan besar yang paling serius, dimana jantung mengalami gangguan ritme sehingga darah tidak teratur dan dapat menyebabkan kerusakan organ lain dan pembekuan jantung.\n\nDari subtopik gejala Torsade de Pointes, kondisi ini juga dapat diikuti oleh beberapa gejala sosial atau psikologis seperti:\n\n- Jantung berdebar (palpitasi) secara tiba-tiba.\n- Pusing.\n- Mual.\n- Keringat dingin.\n- Nyeri dada.\n- Sesak napas.\n- Rasa seperti akan pingsan.\n- Penurunan kesadaran (faints).\n\nDari subtopik pengertian Torsade de Pointes, komplikasi lain yang dapat terjadi jika penyakit ini tidak segera ditangani adalah:\n\n1. Kematian: Kerugian gawat darurat akut dan gangguan ritme jantung yang bergejolir bisa memicu henti jantung secara mendadak, menyebabkan kerusakan organ lain dan kematian penderita.",0.5185185185185185,0.8018027377517654,0.8333333332916666,1.0
Apa saja faktor risiko penyakit atrial flutter?,Atrial flutter lebih sering terjadi pada orang dengan faktor-faktor berikut:\n\nTekanan darah tinggi\nBerusia 50 tahun atau lebih\nMemiliki berat badan berlebih atau obesitas\nMerokok\nMenderita stres berat atau gangguan cemas dalam jangka panjang,"['Topik: Atrial Flutter, Subtopik: Faktor risiko atrial flutter \n Atrial flutter lebih sering terjadi pada orang dengan faktor-faktor berikut:\n- Tekanan darah tinggi\n- Berusia 50 tahun atau lebih\n- Memiliki berat badan berlebih atau obesitas\n- Merokok\n- Menderita stres berat atau gangguan cemas dalam jangka panjang\n', 'Topik: Atrial Flutter, Subtopik: Pengertian Atrial Flutter \n Atrial flutter adalah gangguan irama jantung yang terjadi di serambi jantung (atrium), yaitu ruang jantung bagian atas. Kondisi ini ditandai dengan denyut jantung yang sangat cepat. Jika tidak tertangani, atrial flutter berisiko menimbulkan stroke.\nNormalnya, jantung berdenyut sebanyak 60  100 kali per menit saat tubuh dalam kondisi diam. Akan tetapi, pada atrial flutter, denyut jantung menjadi sangat cepat, yaitu sampai 150 kali per menit bahkan lebih.\n\nAtrial flutter adalah salah satu jenis gangguan irama jantung (aritmia). Atrial flutter memiliki gejala serupa dengan atrial fibrilasi, yang juga merupakan salah satu jenis aritmia, tetapi kedua kondisi tersebut sebenarnya berbeda.\nPada atrial fibrilasi, jantung berdenyut cepat dan iramanya sangat tidak beraturan. Sementara pada atrial flutter, irama jantung masih teratur meskipun denyutnya juga sangat cepat.\n', 'Topik: Atrial Flutter, Subtopik: Penyebab Atrial Flutter \n Belum diketahui secara pasti penyebab terjadinya atrial flutter. Namun, kondisi ini diduga terjadi akibat adanya gangguan pada sel-sel penghasil sinyal listrik jantung yang berfungsi mengontrol denyut jantung.\nGangguan sinyal listrik jantung tersebut dapat disebabkan oleh kelainan atau penyakit pada jantung, seperti:\n- Penyakit jantung koroner\n- Gagal jantung\n- Penyakit jantung rematik\n- Penyakit jantung bawaan, seperti atrial septal defect\n\n- Peradangan pada lapisan jantung (perikarditis)\n- Kelainan otot jantung (kardiomiopati)\n- Penyakit katup jantung\n- Riwayat operasi jantung terbuka\n- Serangan jantung\nSelain kelainan dan penyakit pada jantung, ada juga beberapa kondisi pada bagian tubuh lain yang dapat mengakibatkan gangguan sinyal listrik jantung, yaitu:\n- Kekurangan oksigen parah (hipoksia)\n- Penyakit paru obstruktif kronis (PPOK)\n- Emfisema\n- Emboli paru\n- Kelebihan hormon tiroid (hipertiroidisme)\n- Pheochromocytoma\n- Gangguan elektrolit\n- Keracunan digitalis\n- Sleep apnea\nGangguan sinyal listrik jantung juga dapat disebabkan oleh kondisi yang berkaitan dengan gaya hidup, seperti:\n- Kecanduan alkohol\n- Penyalahgunaan NAPZA\n- Kebiasaan merokok\n- Konsumsi minuman berkafein secara berlebihan\n- Efek samping obat-obatan tertentu, seperti aminophylline, teofilin, epinephrine, obat pilek yang mengandung phenylpropanolamine, atau dobutamin\n\n']","Berdasarkan pembahasan di atas, faktor risiko penyakat atrial flutter meliputi:\n\n1. Tekanan Darah Tinggi: Atrial flutter seringkali terjadi pada orang yang memiliki tekanan darah tinggi, sehingga menurunnya tekanan darah dapat dijadikan langkah awal dalam mencegah dan mengobati atrial flutter.\n2. Usia: Atrial flutter lebih sering terjadi pada orang yang berusia 50 tahun ke atas, karena risiko penyakit jantung dan gangguan ritme jantung semakin meningkat seiring dengan bertambahnya usia.\n3. Berat Badan Berlebih atau Obesitas: Penyebab utama obesitas yang menyebabkan timbulnya atrial flutter adalah faktor genetik, disfungsi metabolisme dan pola makan tidur yang kurang baik.\n4. Merokok: Karena meroket dapat meningkatkan risiko terjadinya penyakit jantung dan gangguan ritme jantung, maka pengguna rokok seringkali mengalami atrial flutter.\n5. Stres Berat atau Gangguan Cemas: Kondisi stress berat atau gangguan cemas dalam jangka panjang dapat meningkatkan risiko timbulnya atrial flutter, karena memicu terjadinya perubahan ritme jantung.\n6. Kelainan dan Penyakit pada Jantung: Gangguan pada sel-sel penghasil sinyal listrik jantung seperti penyakit jantung koroner, gagal jantung, penyakit katup jantung, atrial septal defect, peradangan pada lapisan jantung, dan kardiomiopati dapat menyebabkan timbulnya atrial flutter.\n7. Kondisi Terkait Gaya Hidup: Pengguna alkohol, penyalahgunaan narkoba, merokok, kebiasaan mengonsumsi minuman berwarna dan obat-obatan tertentu seperti aminophylline, teofilin, epinephrine, obat pilek yang mengandung phenylpropanolamine atau dobutamin dapat memicu terjadinya gangguan ritme jantung, termasuk atrial flutter.\n8. Kondisi Medis Lain: Gangguan oksigen paruh, penyakit paru obstruktif kronis (PPOK), emfisema, serta kelebihan hormon tiroid dan pheochromocytoma juga dapat meningkatkan risiko timbulnya atrial flutter.",0.7419354838709677,0.7924381327945721,0.8333333332916666,1.0
Apa saja gejala penyakit atrial flutter?,Gejala atrial flutter dapat bervariasi dan berlangsung dalam hitungan jam hingga hari. Beberapa gejalanya adalah:\n\nJantung berdebar\nPusing atau terasa akan pingsan\nSesak napas\nNyeri dada\nLemas\nLinglung,"['Topik: Atrial Flutter, Subtopik: Gejala Atrial Flutter \n Gejala atrial flutter dapat bervariasi dan berlangsung dalam hitungan jam hingga hari. Beberapa gejalanya adalah:\n- Jantung berdebar\n- Pusing atau terasa akan pingsan\n- Sesak napas\n- Nyeri dada\n- Lemas\n- Linglung\nSeperti yang telah dijelaskan, atrial flutter dan atrial fibrilasi memiliki gejala yang mirip. Terkadang, kedua kondisi tersebut bahkan bisa terjadi secara bersamaan.\n', 'Topik: Atrial Flutter, Subtopik: Pengertian Atrial Flutter \n Atrial flutter adalah gangguan irama jantung yang terjadi di serambi jantung (atrium), yaitu ruang jantung bagian atas. Kondisi ini ditandai dengan denyut jantung yang sangat cepat. Jika tidak tertangani, atrial flutter berisiko menimbulkan stroke.\nNormalnya, jantung berdenyut sebanyak 60  100 kali per menit saat tubuh dalam kondisi diam. Akan tetapi, pada atrial flutter, denyut jantung menjadi sangat cepat, yaitu sampai 150 kali per menit bahkan lebih.\n\nAtrial flutter adalah salah satu jenis gangguan irama jantung (aritmia). Atrial flutter memiliki gejala serupa dengan atrial fibrilasi, yang juga merupakan salah satu jenis aritmia, tetapi kedua kondisi tersebut sebenarnya berbeda.\nPada atrial fibrilasi, jantung berdenyut cepat dan iramanya sangat tidak beraturan. Sementara pada atrial flutter, irama jantung masih teratur meskipun denyutnya juga sangat cepat.\n', 'Topik: Atrial Flutter, Subtopik: Gejala Atrial Flutter: Kapan harus ke dokter \n Periksakan diri ke dokter jika mengalami jantung berdebar yang tidak membaik dengan beristirahat, sering terjadi, atau disertai gejala-gejala yang telah disebutkan di atas. Segera ke dokter jika jantung berdebar timbul pada Anda yang mengalami atau dalam pengobatan penyakit tiroid.\nJantung berdebar merupakan gejala dari berbagai penyakit jantung. Oleh karena itu, dokter akan memeriksa Anda untuk menentukan apakah gejala tersebut disebabkan oleh atrial flutter.\nSegera ke IGD rumah sakit terdekat jika jantung berdebar sampai menimbulkan nyeri dada, sesak napas, atau rasa seperti akan pingsan. Hal ini karena beberapa kondisi tersebut bisa menjadi tanda serangan jantung.\n']","Atrial flutter adalah gangguan irama jantung yang terjadi di serambi jantung (atrium), yaitu ruang jantung bagian atas. Gejala atrial flutter bervariasi dan berlangsung dalam hitungan jam hingga hari, termasuk:\n\n1. Jantung berdebar\n2. Pusing atau terasa akan pingsan\n3. Sesak napas\n4. Nyeri dada\n5. Lemas\n6. Linglung",1.0,0.747596024144903,0.8333333332916666,1.0
Apa saja gejala pada penyakit atrioventricular block derajat dua?,"Penderita AV block derajat ini dapat mengalami beberapa gejala berikut:\n\nDenyut jantung lambat atau terasa seperti tidak berdetak sesaat\nMudah lelah\nKepala terasa ringan seperti akan pingsan, atau kadang sampai pingsan\nNyeri dada\nMual\nNapas cepat dan pendek","['Topik: Atrioventricular Block, Subtopik: Gejala Atrioventricular Block: AV block derajat dua \n Pada AV block derajat dua, sinyal listrik jantung tidak mengalir konsisten sehingga aliran listrik kadang tidak mencapai ventrikel jantung seperti seharusnya. Hal ini menyebabkan jantung tidak berdenyut pada beberapa waktu.\nPenderita AV block derajat ini dapat mengalami beberapa gejala berikut:\n- Denyut jantung lambat atau terasa seperti tidak berdetak sesaat\n- Mudah lelah\n- Kepala terasa ringan seperti akan pingsan, atau kadang sampai pingsan\n- Nyeri dada\n- Mual\n- Napas cepat dan pendek\n', 'Topik: Atrioventricular Block, Subtopik: Gejala Atrioventricular Block: AV block derajat tiga \n AV block derajat tiga atau complete heart block menyebabkan sinyal listrik dari nodus AV tidak terkirim sama sekali ke ventrikel. AV block derajat tiga merupakan jenis yang paling parah dan dapat berakibat fatal. Pada jenis ini, penderitanya dapat mengalami gejala berikut:\n- Detak jantung sangat lambat\n- Nyeri dada\n- Pusing berputar, seperti melayang\n- Pingsan\n- Sesak napas\n', 'Topik: Atrioventricular Block, Subtopik: Gejala Atrioventricular Block: Kapan harus ke dokter \n Periksakan ke dokter jika denyut jantung Anda lebih lambat dari normal, terasa tidak teratur, atau jika mengalami gejala-gejala yang disebutkan di atas.\nAtrioventricular block merupakan kondisi yang bisa berakibat fatal. Segera ke IGD jika muncul keluhan berikut:\n- Kepala terasa sangat ringan seperti akan pingsan\n- Sesak napas\n- Nyeri dada\n- Detak jantung sangat cepat atau tidak beraturan\n- Linglung\n- Pingsan\n']","Gejala pada penyakit Atrioventricular Block (AVB) derajat dua, selain menyebabkan denyut jantung menjadi lebih lambat atau tidak teratur dan seringkali memakan waktu yang berbeda-beda untuk mencapai ventrikel jantung, juga bisa melibatkan beberapa gejala lain seperti:\n\n1. Denyut jantung lambat atau terasa seperti tidak ada denyut jantung sesaat.\n2. Mudah lelah akibat penglihatan denyut jantung yang tidak stabil dan kurang efisien.\n3. Kepala terasa ringan seperti akan pingsan, atau kadang sampai mengalami pingsan.\n4. Nyeri dada yang bisa merujuk kepada rasa sakit di belakang leher, tengah perut, atau pun bergantung pada titik asuh jantung.\n5. Mual akibat gangguan sirkulasi dan oksigen dalam tubuh yang bisa menyebabkan ketidakmakanan.\n6. Napas cepat dan pendek karena perubahan denyut jantung yang tidak normal dapat membuat penderita merasa kekurangan oksigen.\n7. Sesak napas, terutama saat beraktivitas atau dalam waktu-waktu istirahat.\n8. Pusing berputar, seperti melayang akibat kurangnya pencahaman yang baik tentang posisi tubuh selama denyut jantung tidak normal.",0.3,0.6557515303011452,0.8333333332916666,1.0
Bagaimana pencegahan penyakit atrioventricular block?,"Atrioventricular block dapat dicegah dengan menjaga kesehatan jantung. Ada berbagai upaya yang dapat dilakukan untuk menjaga kesehatan jantung, seperti:\n\nTidak merokok dan menghindari paparan asap rokok\nMengonsumsi makanan bergizi dan bervariasi setiap harinya\nMenjaga berat badan agar tetap ideal\nBerolahraga secara rutin, setidaknya 5 hari dalam seminggu selama 30 menit\nMengelola stres dengan baik\nTidur setidaknya 7–9 jam per hari\nBerobat atau berkonsultasi dengan dokter secara rutin jika menderita penyakit lain atau memiliki faktor risiko atrioventrikular blok","['Topik: Atrioventricular Block, Subtopik: Pencegahan Atrioventricular Block \n Atrioventricular block dapat dicegah dengan menjaga kesehatan jantung. Ada berbagai upaya yang dapat dilakukan untuk menjaga kesehatan jantung, seperti:\n- Tidak merokok dan menghindari paparan asap rokok\n- Mengonsumsi makanan bergizi dan bervariasi setiap harinya\n- Menjaga berat badan agar tetap ideal\n- Berolahraga secara rutin, setidaknya 5 hari dalam seminggu selama 30 menit\n- Mengelola stres dengan baik\n- Tidur setidaknya 7  9 jam per hari\n- Berobat atau berkonsultasi dengan dokter secara rutin jika menderita penyakit lain atau memiliki faktor risiko atrioventrikular blok\n', 'Topik: Atrioventricular Block, Subtopik: Pengobatan Atrioventricular Block \n Metode pengobatan atrioventricular block tergantung pada penyebab dan derajat keparahan gejalanya. Umumnya, pengobatan hanya dilakukan apabila AV block menyebabkan gejala.\nPada pasien yang tidak mengalami gejala atau hanya mengalami gejala yang ringan, dokter akan meminta pasien untuk:\n- Menjalani kontrol rutin\n- Memeriksa denyut jantung secara berkala\n- Mewaspadai gejala AV block yang mungkin terjadi dan mengetahui langkah-langkah yang perlu dilakukan ketika gejala terjadi\nJika AV block sudah menimbulkan gejala yang mengganggu, dokter mungkin akan menyarankan Anda untuk memakai alat pacu jantung, yaitu alat kecil yang ditanamkan di bawah kulit area dada dan tersambung ke otot jantung. Alat ini akan mengirimkan sinyal listrik yang dapat membantu jantung berdetak dengan frekuensi dan ritme yang normal.\nSementara  jika AV block menimbulkan kondisi yang darurat, seperti henti jantung mendadak, dokter akan menstabilkan kondisi pasien terlebih dahulu dan memasang alat pacu jantung sementara jika diperlukan. Setelah itu, alat pacu jantung sementara pasien dapat diganti dengan yang permanen.\n', 'Topik: Atrioventricular Block, Subtopik: Penyebab dan Faktor Risiko Atrioventricular Block \n Atrioventricular block umumnya terjadi akibat kerusakan di jantung yang memengaruhi aliran listrik pada jantung. Namun, kondisi ini juga bisa terjadi dari lahir pada beberapa orang atau disebut juga dengan atrioventricular block congenital.\nAda beberapa kondisi yang dapat meningkatkan risiko terjadinya atrioventricular block, antara lain:\n- Usia lanjut, terutama 70 tahun ke atas\n- Serangan jantung\n- Kelainan pada struktur jantung, seperti kardiomiopati hipertrofi\n- Penyakit katup jantung\n- Kadar kalium tinggi (hiperkalemia)\n- Demam rematik\n- Kanker, termasuk limfoma\n- Hipertiroidisme\n- Tumor jantung\n- Tekanan darah tinggi (hipertensi)\n- Kadar gula darah tinggi (hiperglikemia)\n- Penggunaan obat-obatan tertentu, seperti penghambat beta, amiodarone, digoxin, verapamil, dan diltiazem\n- Operasi terbuka pada jantung\nSementara itu, AV block yang terjadi sejak lahir lebih berisiko dialami bayi dengan kondisi berikut:\n- Menderita kelainan jantung\n- Terlahir dari ibu yang menderita penyakit autoimun, seperti lupus atau sindrom Sj gren\n\n']","Pencegahan Atrioventricular Block (AVB) melalui berbagai upaya kesehatan jantung termasuk cara hidup sehat dan pengelolaan risiko. Berikut adalah beberapa langkah yang dapat dilakukan untuk mencegah AVB:\n\n1. Tidur Setidaknya 7-9 Jam per Hari: Mengkonsumsi waktu tidur yang cukup sangat berguna dalam menjaga kondisi jantung tetap sehat, terutama untuk mengurangi risiko serangan jantung dan mencegah stres mental.\n2. Minum Kulit Buah-buahan: Mengonsumsi buah-buahan yang bergizi tinggi akan membantu mengoptimalkan berat badan, menjaga kadar gula darah rendah, dan melindungi jantung dari penyakit.\n3. Olahraga Secara Reguler: Berolahraga secara rutin setidaknya 5 hari dalam seminggu selama 30 menit per harinya memiliki banyak manfaat, termasuk pengurangan risiko penyakit jantung dan stabilisasi denyut nadi.\n4. Hindari Paparan Asap Rokok: Merokok dapat meningkatkan risiko terjadinya AVB karena merokok mengakibatkan penuaan hati, gangguan aritmia, dan pengerasan arteri yang bisa memengaruhi aliran listrik di jantung.\n5. Mengelola Stres: Menyusun waktu untuk meredakan stres dengan aktivitas rekreasi atau metode meditatif akan membantu mencegah penyakit jantung, termasuk AVB.\n6. Berat Badan Ideal: Mengurangi asupan makanan yang tinggi lemak dan kandungan gula serta menjaga agar berat badan tetap ideal akan membantu mencegah risiko penyakit jantung, termasuk AVB.\n7. Obati Penyakit Lain: Jika mengalami penyakit lain atau memiliki faktor risiko AVB, harus tetap berkonsultasi dengan dokter secara rutin untuk mencegah terjadinya penyakit jantung.\n8. Obati Penyumbatan Arteri: Mengadakan pemeriksaan aritmia atau penyumbatan arteri yang bisa meningkatkan risiko AVB dan membuat gejalanya lebih parah.\n9. Konsultasi Dokter: Memantau kondisi jantung secara rutin, mengikuti petunjuk dokter, dan segera melaporkan perubahan yang aneh atau gejala AVB apa pun akan sangat membantu mencegah penyakit.\n10. Menggunakan Obat dengan Bijak: Penggunaan obat-obatan seperti antara lain beta bloker, amiodarone dan digoxin harus diikuti dokter untuk menjaga kondisi jantung tetap stabil dan mencegah AVB.\n11. Mengontrol Kolesterol: Mematuhi diet yang mengandung kolesterol rendah akan membantu mencegah risiko penyakit jantung, termasuk AVB.\n12. Fokus pada Penyakit Jantung lainnya: Jika Anda memiliki penyakit jantung lain seperti kardiomiopati atau penyumbatan arteri, harap disiplin mengikuti dokter dan obati penyebab tersebut untuk mencegah AVB.\n\nDengan melakukan semua ini, Anda dapat menjaga jantung tetap sehat dan menghindari risiko terjadinya Atrioventricular Block (AVB).",0.3870967741935484,0.7248177272525497,0.9999999999666667,1.0
Apa hal yang dapat menyebabkan penyakit jantung ringan?,"Penyebab serangan jantung ringan adalah berbagai penyakit atau kondisi yang menghambat aliran darah dari pembuluh darah arteri koroner menuju otot-otot jantung. Kondisi atau penyakit tersebut meliputi:\n\nAterosklerosis, yaitu penumpukan plak atau kolesterol pada dinding arteri koroner \nEmboli koroner, yakni penyumbatan pada pembuluh darah arteri jantung akibat gumpalan darah\nVasospasme, yaitu kontraksi pada pembuluh darah arteri koroner\nMiokarditis, yakni peradangan yang terjadi pada otot jantung\nCedera pada otot jantung, misalnya akibat kecelakaan\nKeracunan karbon monoksida","['Topik: Serangan Jantung Ringan, Subtopik: Penyebab Serangan Jantung Ringan \n Penyebab serangan jantung ringan adalah berbagai penyakit atau kondisi yang menghambat aliran darah dari pembuluh darah arteri koroner menuju otot-otot jantung. Kondisi atau penyakit tersebut meliputi:\n- Aterosklerosis, yaitu penumpukan plak atau kolesterol pada dinding arteri koroner \n\n- Emboli koroner, yakni penyumbatan pada pembuluh darah arteri jantung akibat gumpalan darah\n- Vasospasme, yaitu kontraksi pada pembuluh darah arteri koroner\n- Miokarditis, yakni peradangan yang terjadi pada otot jantung\n\n- Cedera pada otot jantung, misalnya akibat kecelakaan\n- Keracunan karbon monoksida\n', 'Topik: Serangan Jantung Ringan, Subtopik: Pengertian Serangan Jantung Ringan \n Serangan jantung pada umumnya disebabkan oleh penyumbatan total pada pembuluh darah arteri koroner utama. Hal ini membuat pasokan darah ke otot-otot jantung terhenti dan menyebabkan kematian jaringan otot jantung yang luas.\n\nSerangan jantung ringan, atau disebut juga dengan NSTEMI, terjadi ketika pembuluh darah arteri koroner tersumbat sebagian sehingga mengurangi pasokan darah ke otot-otot jantung. Kondisi ini sama-sama menyebabkan kematian jaringan otot, tetapi tidak seluas serangan jantung pada umumnya.\nMeski demikian, semua jenis serangan jantung, termasuk serangan jantung ringan, perlu segera mendapatkan pertolongan medis. Hal ini penting untuk mencegah terjadinya komplikasi berupa kerusakan permanen pada jantung atau bahkan kematian. \n', 'Topik: Serangan Jantung Ringan, Subtopik: Pengertian Serangan Jantung Ringan \n Serangan jantung ringan adalah kondisi ketika pembuluh darah arteri koroner menyempit sehingga aliran darah ke otot jantung berkurang. Kondisi ini tidak menyebabkan kerusakan otot jantung yang separah serangan jantung umumnya. Namun, penanganan sedini mungkin tetap harus segera diberikan.\nSerangan jantung pada umumnya disebabkan oleh penyumbatan total pada pembuluh darah arteri koroner utama. Hal ini membuat pasokan darah ke otot-otot jantung terhenti dan menyebabkan kematian jaringan otot jantung yang luas.\n\nSerangan jantung ringan, atau disebut juga dengan NSTEMI, terjadi ketika pembuluh darah arteri koroner tersumbat sebagian sehingga mengurangi pasokan darah ke otot-otot jantung. Kondisi ini sama-sama menyebabkan kematian jaringan otot, tetapi tidak seluas serangan jantung pada umumnya.\nMeski demikian, semua jenis serangan jantung, termasuk serangan jantung ringan, perlu segera mendapatkan pertolongan medis. Hal ini penting untuk mencegah terjadinya komplikasi berupa kerusakan permanen pada jantung atau bahkan kematian. \n']","Penyebab serangan jantung ringan, atau NSTEMI (Non-ST Elevation Myocardial Infarction), termasuk penyakit jantung ringan ini, adalah berbagai penyakit atau kondisi yang dapat menghambat aliran darah ke otot jantung. Berikut beberapa penyebab utama serangan jantung ringan:\n\n1. Aterosklerosis, yaitu proses penumpukan plak atau kolesterol pada dinding arteri koroner yang mengurangi aliran darah menuju jantung.\n2. Emboli koroner, seperti gumpalan darah yang menghalang aliran darah ke otot jantung akibat penyumbatan arteri.\n3. Vasospasme, yaitu penggembalian atau kontraksi pada pembuluh darah arteri koroner sehingga terhambat aliran darah menuju jantung.\n4. Miokarditis, yang merupakan peradangan pada otot jantung yang dapat menyebabkan penyempitan pembuluh darah arteri ke jantung.\n5. Cedera atau luka pada otot jantung akibat kecelakaan atau trauma lainnya, seperti serangan jantung akut.\n6. Keracunan karbon monoksida, yang dapat menurunkan kapasitas jantung untuk mengeluarkan darah dan menyebabkan penyumbatan pembuluh darah arteri ke jantung.",0.7142857142857143,0.27719979759674573,0.9999999999666667,1.0
Bagaimana prosedur operasi yang dilakukan pada penderita serangan jantung ringan?,Operasi bypass jantung merupakan prosedur untuk membuat pembuluh darah baru yang diambil dari pembuluh darah lain di tungkai atau dada sebagai jalur alternatif bagi aliran darah yang tersumbat. Tindakan bedah ini dapat dilakukan jika ada banyak pembuluh darah arteri jantung yang mengalami penyempitan. ,"['Topik: Serangan Jantung Ringan, Subtopik: Pengobatan Serangan Jantung Ringan: Operasi bypass jantung \n Operasi bypass jantung merupakan prosedur untuk membuat pembuluh darah baru yang diambil dari pembuluh darah lain di tungkai atau dada sebagai jalur alternatif bagi aliran darah yang tersumbat. Tindakan bedah ini dapat dilakukan jika ada banyak pembuluh darah arteri jantung yang mengalami penyempitan. \nPerlu diketahui bahwa pasien yang pernah mengalami serangan jantung ringan bisa mengalami lagi kondisi ini pada masa yang akan datang. Untuk mencegahnya, dokter biasanya akan meminta pasien untuk menjalani pemeriksaan lanjutan atau rehabilitasi jantung setelah pengobatan utama di atas. \n', 'Topik: Serangan Jantung Ringan, Subtopik: Pengobatan Serangan Jantung Ringan: Percutaneous coronary intervention  \n Percutaneous coronary intervention (PCI) adalah prosedur kateterisasi jantung yang dilakukan untuk memasang ring pada pembuluh darah arteri jantung yang tersumbat. Dengan demikian, aliran darah ke otot jantung kembali lancar dan pembuluh darah akan tetap terbuka.\n', 'Topik: Serangan Jantung Ringan, Subtopik: Diagnosis Serangan Jantung Ringan \n Dokter akan memulai diagnosis serangan jantung ringan dengan memeriksa tanda-tanda vital pasien, seperti tekanan darah, detak jantung, suhu tubuh, dan kadar saturasi oksigen. Jika kondisi pasien stabil, dokter akan mengajukan pertanyaan mengenai hal-hal berikut:\n- Gejala yang muncul\n- Penyakit lain yang pernah diderita\n- Penyakit di dalam keluarga\n- Gaya hidup pasien\nSelanjutnya, dokter akan menegakkan diagnosis serangan jantung ringan dengan melakukan tes penunjang berikut ini:\n- Elektrokardiografi (EKG) atau rekam jantung, untuk melihat aktivitas listrik dan seberapa luas kerusakan yang terjadi pada jantung\n- Tes darah, untuk mencari keberadaan troponin, yaitu protein penanda terjadinya kerusakan di otot jantung\n- Ekokardiografi atau USG jantung, untuk mencari lokasi kerusakan pada jantung dan pengaruhnya pada kerja jantung\n- CT scan jantung, untuk mengetahui lokasi terbentuknya plak atau penyempitan yang terjadi di pembuluh darah arteri koroner\n']","Prosedur operasi pada pasien yang mengalami serangan jantung ringan, seperti yang dijelaskan dalam konteks tersebut, adalah operasi bypass jantung. Berikut adalah langkah-langkah umum prosedur ini:\n\n1. **Pembersihan Darah Otak**: Sebelum operasi, pasien akan diberikan obat untuk mencegah stroke akibat arus darah yang terganggu selama tindakan bedah.\n\n2. **Penghentian Pernafasan dan Pembidan:** Pasien dikuras udara dalam paru-paru dan dipasang pipa khusus untuk memastikan tidak ada udara dalam paru-paru yang masuk ke dalam jantung selama operasi.\n\n3. **Penyembuhan Kulit:** Di sepanjang laring atau di bagian belakang leher, pasien akan diberikan obat untuk memperlancar detak jantung dan menghentikan denyut nadi sesaat sebelum operasi dimulai.\n\n4. **Penggunaan Catheter:** Pasien dirawat di operating room (OR) dan dokter medis akan menemui arteri dalam lengan atau perut pasien unt accessiblity untuk melakukan pembedahan. Pembuluh darah yang akan digunakan sebagai jalur alternatif dialiri oleh obat sampai kulitnya menjadi licin dan tidak nyeri lagi, biasanya menggunakan bantuan aspirin atau heparin untuk mencegah ginjal.\n\n5. **Pengambilan Pembuluh Darah:** Dokter akan membuka kulit dengan pisau dan menarik alis arteri yang diinginkan, biasanya menggunakan metode selang seling yang tidak merusak jaringan tetapi cukup mudah.\n\n6. **Penyambungan Pembuluh Darah Baru:** Setelah pembuluh darah dipotong dan pasien dihindarkan dari arus darah, dokter akan melekatkan kabel bypass atau rangkaian cincin yang terbuat dari bahan biologis seperti Dacron untuk menutup luka.\n\n7. **Pembuangan Tubuh Lelahi:** Setelah proses penyambungan selesai, pasien akan dikembalikan ke sirkulasi normal dan tubuh leluhara yang memakan waktu operasi diparitik.\n\n8. **Penggunaan Obat Demam dan Antibiotika:** Setelah operasi, pasien akan menerima obat demam dan antibiotika untuk mengurangi risiko infeksi atau penyakit yang dapat merugikan proses pemulihan.\n\n9. **Penggunaan Demam Getah:** Pasien dikondisikan dalam suhu tinggi (hipertermia) untuk meningkatkan aliran darah ke otot jantung dan mempercepat pemulihan pasien.\n\n10. **Pengeluaran Pasien dari OR:** Setelah proses demam getah selesai, pasien akan dikeluarkan dari operating room dan dimicu untuk mengambil posisi yang nyaman.\n\nDengan ini, langkah-langkah operasi bypass jantung ringan telah selesai. Pasien kemudian harus mendapatkan rehabilitasi jantung dan pemeriksaan lanjutan agar risiko serangan jantung ditekan serendah mungkin di masa depan.",0.4230769230769231,0.5694646480355496,0.9999999999,1.0
Bagaimana contoh stres emosional yang dialami oleh penderita broken heart syndrome?,"Berduka akibat kehilangan orang terdekat\nMengalami perceraian\nTerjerat hutang, misalnya karena kecanduan judi online\nDidiagnosis terkena penyakit serius\nMenjadi korban tindakan kriminal\nMengalami bullying  ","['Topik: Broken Heart Syndrome, Subtopik: Penyebab Broken Heart Syndrome: Stres pada mental \n Umumnya, broken heart syndrome dipicu oleh stres emosional yang berat, misalnya akibat kondisi berikut:\n- Berduka akibat kehilangan orang terdekat\n- Mengalami perceraian\n- Terjerat hutang, misalnya karena kecanduan judi online\n\n- Didiagnosis terkena penyakit serius\n- Menjadi korban tindakan kriminal\n- Mengalami bullying  \n\n', 'Topik: Broken Heart Syndrome, Subtopik: Penyebab Broken Heart Syndrome \n Broken heart syndrome diketahui dapat muncul ketika seseorang mengalami stres yang ekstrem, baik pada mental maupun fisiknya. \nStres akan membuat tubuh memproduksi hormon adrenalin atau kortisol. Bila kadarnya terlalu tinggi, kedua hormon stres tersebut dapat membuat jantung bekerja sangat keras hingga akhirnya otot-otot jantung melemah.\nBerikut ini adalah contoh-contoh stres pada mental dan fisik yang dapat menyebabkan broken heart syndrome:\n', 'Topik: Broken Heart Syndrome, Subtopik: Pengertian Broken Heart Syndrome \n Broken heart syndrome adalah masalah jantung yang terjadi akibat stres atau sakit fisik. Kondisi ini membuat jantung kurang mampu memompa darah dengan maksimal sehingga memunculkan gejala mirip serangan jantung. Meski begitu, broken heart syndrome umumnya hanya bersifat sementara.\nBilik kiri adalah bagian jantung yang berperan untuk memompa darah. Pada broken heart syndrome, bagian atas bilik kiri jantung menyempit dan bagian bawahnya melebar sehingga menyerupai perangkap gurita, yang di Jepang disebut dengan takotsubo. Oleh karena itu, kondisi ini  juga dikenal dengan istilah Takotsubo syndrome.\n\nGangguan pada fungsi bilik kiri jantung ini membuat otot jantung melemah sehingga tidak bisa memompa darah secara maksimal. Akibatnya, suplai darah dan oksigen untuk tubuh berkurang, termasuk ke jantung itu sendiri. Hal ini memunculkan keluhan nyeri dada dan sesak yang mirip dengan serangan jantung.\nBroken heart syndrome umumnya dipicu oleh stres emosional yang berat, tetapi juga bisa muncul saat sakit berat atau operasi besar. Broken heart syndrome umumnya akan membaik dalam 1  4 minggu, tetapi bisa kambuh bahkan memicu masalah jantung yang serius bila tidak ditangani dengan baik. \n']","Contoh stres emosional yang diikuti atau dipicu oleh Broken Heart Syndrome meliputi berbagai situasi kehidupan seseorang yang menyebabkan mereka merasa kesedihan dan bahkan menimbulkan gejala medis. Berikut beberapa contoh stres emosional yang dapat memicu broken heart syndrome:\n\n1. **Kehilangan Orang Terdekat**: Penderita mungkin mengalami kehilangan suaminya, istrinya, anak-anak, atau saudara yang sangat dekat mereka. Kehilangan ini dapat menimbulkan stres emosional dan merupakan faktor risiko utama untuk broken heart syndrome.\n\n2. **Perceraian**: Perubahan hubungan secara drastis, seperti perceraian atau pemisahan, juga bisa memicu gejala yang mirip serangan jantung karena stres tersebut.\n\n3. **Hutang dan Kebiasaan Negatif**: Seorang pria pun mungkin mengalami broken heart syndrome akibat hutang atau kecanduan, seperti merokok atau merumah yang membuat mereka tertekuk dalam stres.\n\n4. **Tindakan Kriminal dan Korban Bullying**: Orang yang menjadi korban tindakan kriminal atau dikenai bullying juga bisa mengalami stres ekstrem, yang dapat memicu broken heart syndrome.\n\n5. **Stres Kerja dan Rumah Tangga**: Stres kerja, hubungan rumah tangga tidak sejahtera, maupun isu-isu sosial atau politik yang menyolok juga bisa menjadi faktor penyebab stres emosional.\n\n6. **KegawatDarurat dalam Hubungan**: Stabilitas hubungan yang tidak stabil, seperti kepulangan antara dan pemisahan suami istri juga dapat menimbulkan stress ekstrem dan kemungkinan timbulnya broken heart syndrome.\n\n7. **KegawatDarurat dalam Keluarga**: Keadaan medis di家中, seperti penyakit jantung atau gangguan mental lain yang membuat orang-orang merasa cemas dan takut juga bisa menjadi faktor utama.\n\nKeempat contoh tersebut mencerminkan berbagai macam stres emosional yang dapat menyebabkan broken heart syndrome, dimana setiap kasus memiliki karakteristik unik dan menggambarkan bagaimana stres ekstrem bisa mengeksploitasi jantung.",1.0,0.7267722927552142,0.9999999999666667,1.0
Pada situasi apa penderita broken heart syndrome perlu dibawa ke IGD?,"Segera cari pertolongan ke IGD bila nyeri dada tidak membaik setelah 5 menit atau setelah beristirahat dan minum obat. Melalui pemeriksaan, dokter akan memastikan apakah kondisi pasien disebabkan oleh broken heart syndrome atau serangan jantung sehingga penanganan yang diberikan pun tepat.","['Topik: Broken Heart Syndrome, Subtopik: Gejala Broken Heart Syndrome : Kapan harus ke dokter  \n Broken heart syndrome umumnya dapat mereda setelah kondisi emosional pasien stabil. Namun, jangan menunda untuk berkonsultasi ke dokter bila Anda sering mengalami nyeri dada atau sesak napas setiap kali merasa stres.\nGuna memastikan penyebabnya, Anda bisa berkonsultasi secara online. Selain bisa dilakukan dari rumah, konsultasi online akan menyediakan jawaban yang lebih cepat. \nSegera cari pertolongan ke IGD bila nyeri dada tidak membaik setelah 5 menit atau setelah beristirahat dan minum obat. Melalui pemeriksaan, dokter akan memastikan apakah kondisi pasien disebabkan oleh broken heart syndrome atau serangan jantung sehingga penanganan yang diberikan pun tepat.\n', 'Topik: Broken Heart Syndrome, Subtopik: Pengertian Broken Heart Syndrome \n Broken heart syndrome adalah masalah jantung yang terjadi akibat stres atau sakit fisik. Kondisi ini membuat jantung kurang mampu memompa darah dengan maksimal sehingga memunculkan gejala mirip serangan jantung. Meski begitu, broken heart syndrome umumnya hanya bersifat sementara.\nBilik kiri adalah bagian jantung yang berperan untuk memompa darah. Pada broken heart syndrome, bagian atas bilik kiri jantung menyempit dan bagian bawahnya melebar sehingga menyerupai perangkap gurita, yang di Jepang disebut dengan takotsubo. Oleh karena itu, kondisi ini  juga dikenal dengan istilah Takotsubo syndrome.\n\nGangguan pada fungsi bilik kiri jantung ini membuat otot jantung melemah sehingga tidak bisa memompa darah secara maksimal. Akibatnya, suplai darah dan oksigen untuk tubuh berkurang, termasuk ke jantung itu sendiri. Hal ini memunculkan keluhan nyeri dada dan sesak yang mirip dengan serangan jantung.\nBroken heart syndrome umumnya dipicu oleh stres emosional yang berat, tetapi juga bisa muncul saat sakit berat atau operasi besar. Broken heart syndrome umumnya akan membaik dalam 1  4 minggu, tetapi bisa kambuh bahkan memicu masalah jantung yang serius bila tidak ditangani dengan baik. \n', 'Topik: Broken Heart Syndrome, Subtopik: Pengertian Broken Heart Syndrome \n Bilik kiri adalah bagian jantung yang berperan untuk memompa darah. Pada broken heart syndrome, bagian atas bilik kiri jantung menyempit dan bagian bawahnya melebar sehingga menyerupai perangkap gurita, yang di Jepang disebut dengan takotsubo. Oleh karena itu, kondisi ini  juga dikenal dengan istilah Takotsubo syndrome.\n\nGangguan pada fungsi bilik kiri jantung ini membuat otot jantung melemah sehingga tidak bisa memompa darah secara maksimal. Akibatnya, suplai darah dan oksigen untuk tubuh berkurang, termasuk ke jantung itu sendiri. Hal ini memunculkan keluhan nyeri dada dan sesak yang mirip dengan serangan jantung.\nBroken heart syndrome umumnya dipicu oleh stres emosional yang berat, tetapi juga bisa muncul saat sakit berat atau operasi besar. Broken heart syndrome umumnya akan membaik dalam 1  4 minggu, tetapi bisa kambuh bahkan memicu masalah jantung yang serius bila tidak ditangani dengan baik. \n']","Penderita Broken Heart Syndrome harus segera berkonsultasi dengan dokter atau mengunjungi IGD (Istana Guru Dalam) jika mereka mengalami gejala nyeri dada atau sesak napas yang tidak membaik setelah 5 menit atau setelah beristirahat, kecuali kalau ada penyebab medis lainnya seperti serangan jantung. Hal ini penting untuk mengeliminir masalah yang mungkin lebih serius dan memastikan penderita mendapatkan terapi yang tepat sesuai dengan kondisi mereka.",0.5714285714285714,0.531298827058634,0.9999999999666667,1.0
